username,time,tweet
MichaelBenderJr,Sat Sep 01 05:29:55 IST 2012,there less chanc anyon age understand anyth show girl crackspiritguid
MichaelBenderJr,Sat Sep 01 05:25:18 IST 2012,this show make realiz i appropri wardrob live brooklyn brokelyn girl
MichaelBenderJr,Sat Sep 01 05:23:31 IST 2012,just smoke crack crackspiritguid
MichaelBenderJr,Sat Sep 01 05:22:11 IST 2012,sociopath girl hbodemand epicweekend
MichaelBenderJr,Sat Sep 01 03:04:52 IST 2012,don care it weekend deuc
MichaelBenderJr,Fri Aug 31 03:17:42 IST 2012,hip hop mogul chris lighti belov manag diddi cent mariah dead suicid age damn
MichaelBenderJr,Thu Aug 30 00:21:48 IST 2012,rt fox news hint phantom ronald reagan hologram may show endors mitt romney rnc tomorrow
MichaelBenderJr,Wed Aug 29 23:29:45 IST 2012,rt that awkward moment realiz creat
MichaelBenderJr,Wed Aug 29 18:39:05 IST 2012,jeff daniel play keith olbermann type newscast cri whenev watch rudi it also sucki show
MichaelBenderJr,Wed Aug 29 08:36:00 IST 2012,i think jay z diamond remix just stole song show
MichaelBenderJr,Wed Aug 29 08:30:42 IST 2012,bag put book
MichaelBenderJr,Wed Aug 29 08:29:32 IST 2012,rt i group text black rnc you know i kid
MichaelBenderJr,Wed Aug 29 08:28:23 IST 2012,what eff second american centuri mean someon get will mcavoy clear bs thenewsroom trainwreck
MichaelBenderJr,Wed Aug 29 08:20:46 IST 2012,rt aaron sorkin slam sex citi huge hypocrit
MichaelBenderJr,Wed Aug 29 08:20:17 IST 2012,commenc cheer young republican gif tonight
MichaelBenderJr,Wed Aug 29 08:15:08 IST 2012,is new jersey realli live larg christi make reconsid i live
MichaelBenderJr,Wed Aug 29 08:10:25 IST 2012,christi obama romney kerri make sens
MichaelBenderJr,Wed Aug 29 08:04:50 IST 2012,mcavoy thenewsroom trainwreck
MichaelBenderJr,Wed Aug 29 07:59:18 IST 2012,everytim sorkin say internet i want stab fork eye wtf are you talk about bro trainwreck thenewsroom
MichaelBenderJr,Wed Aug 29 07:50:41 IST 2012,is show suppos tragedi because i feel realli bad actor futur career thenewsroom trainwreck
MichaelBenderJr,Wed Aug 29 07:48:56 IST 2012,didn think could get wors bin laden episod cant put pant debacl thenewsroom trainwreck
MichaelBenderJr,Wed Aug 29 07:15:00 IST 2012,can i take silenc mayb
MichaelBenderJr,Wed Aug 29 04:50:25 IST 2012,i interest intern gawker fall i sent email inquir respons i thought i would tri twitter
MichaelBenderJr,Tue Aug 28 21:56:01 IST 2012,tweetyourweight lb lot read today
MichaelBenderJr,Tue Aug 28 07:06:47 IST 2012,and i hot caus i hell
MichaelBenderJr,Tue Aug 28 07:02:01 IST 2012,i sick but i well
MichaelBenderJr,Tue Aug 28 04:07:41 IST 2012,rt link subscrib hang up listen sport podcast itun pleas rt fan help spread word
MichaelBenderJr,Mon Aug 27 18:45:02 IST 2012,rt my review last night break bad mani comment disagre strong
MichaelBenderJr,Mon Aug 27 04:09:56 IST 2012,i realli afraid storm romney bush rnc
MichaelBenderJr,Mon Aug 27 03:15:41 IST 2012,at least i clean apart negativestoposit
MichaelBenderJr,Sun Aug 26 23:07:14 IST 2012,rt this goe everi contrarian bone bodi i realli think the newsroom might worst tv show al
MichaelBenderJr,Sat Aug 25 03:30:46 IST 2012,rt rickey sure
MichaelBenderJr,Sat Aug 25 01:00:47 IST 2012,so better leadoff hitter ricki henderson inspectah deck thedeaddonotimprov
MichaelBenderJr,Fri Aug 24 18:09:53 IST 2012,rt usada say lanc evid made public right time well posit test let us know
MichaelBenderJr,Thu Aug 23 08:21:21 IST 2012,i loser user i need accus
MichaelBenderJr,Wed Aug 22 20:40:32 IST 2012,rt dear take challeng now pleas buy suit fit
MichaelBenderJr,Wed Aug 22 20:06:18 IST 2012,you peopl i use know plural
MichaelBenderJr,Wed Aug 22 19:59:13 IST 2012,my sequel chain no liessss plural
MichaelBenderJr,Wed Aug 22 18:33:46 IST 2012,rt the consequ rt i caught the rock come trailer call him out
MichaelBenderJr,Tue Aug 21 18:43:09 IST 2012,twitternobodi trend yet
MichaelBenderJr,Mon Aug 20 19:25:27 IST 2012,rt first order busi first day shoot scout set crush say someth embarrass never redeem
MichaelBenderJr,Mon Aug 20 17:15:03 IST 2012,when world collid workout tiestoclublif vs teambringit go through some chang
MichaelBenderJr,Mon Aug 20 10:28:12 IST 2012,rt here wwe summerslam bob backlund shirt mr backlund
MichaelBenderJr,Mon Aug 20 10:18:50 IST 2012,make summerslam like use hitmanbulldog
MichaelBenderJr,Mon Aug 20 03:06:09 IST 2012,i mr brightsid
MichaelBenderJr,Sun Aug 19 22:14:06 IST 2012,rt halftim hennessi summerslam preview wwe hhh brocklesnar
MichaelBenderJr,Wed Aug 15 08:37:43 IST 2012,rt london wonder queen fanci littl am cardio along river thame start
MichaelBenderJr,Tue Aug 14 08:33:25 IST 2012,worst end final raw ppv awhil god i wait pay train wreck
MichaelBenderJr,Tue Aug 14 08:32:11 IST 2012,omg gave indian burn paul heyman realli mean raw
MichaelBenderJr,Tue Aug 14 08:28:31 IST 2012,why drive late model ford taurus he got money right raw
