username,time,tweet
suredallass,Tue Mar 22 05:29:59 IST 2016,i love cam post lot sc bc bye bye camera roll
suredallass,Tue Mar 22 05:29:07 IST 2016,i laugh scream everi time
suredallass,Tue Mar 22 05:20:45 IST 2016,rt reaction cameron rap
suredallass,Tue Mar 22 05:20:16 IST 2016,goal
suredallass,Tue Mar 22 05:19:27 IST 2016,he annoy
suredallass,Tue Mar 22 05:19:13 IST 2016,he look so ador
suredallass,Tue Mar 22 05:18:44 IST 2016,i love cameron
suredallass,Tue Mar 22 05:10:20 IST 2016,rt everybodi want truth one want honest
suredallass,Tue Mar 22 05:09:31 IST 2016,aw gotten big
suredallass,Tue Mar 22 04:51:34 IST 2016,he weird i love omg
suredallass,Tue Mar 22 04:47:44 IST 2016,rt glad i got say goodby babi last night love
suredallass,Tue Mar 22 04:36:53 IST 2016,cam look like happi littl babi
suredallass,Tue Mar 22 04:34:43 IST 2016,okay
suredallass,Tue Mar 22 04:34:07 IST 2016,rt cameron dalla take moment rain danc six flag magcontakeov
suredallass,Tue Mar 22 04:33:55 IST 2016,rt the magconfamili readi feed tiger six flag magcontakeov
suredallass,Tue Mar 22 04:33:50 IST 2016,rt check cameron dalla feed tiger magcontakeov six flag
suredallass,Tue Mar 22 04:33:00 IST 2016,i spi cameron
suredallass,Tue Mar 22 03:58:23 IST 2016,i hate peopl piss
suredallass,Tue Mar 22 03:46:04 IST 2016,aw caaron kid ride eleph famili goal
suredallass,Tue Mar 22 03:45:11 IST 2016,rt the boy ride eleph six flag magcontakeov
suredallass,Tue Mar 22 01:11:31 IST 2016,shoulda took hat
suredallass,Tue Mar 22 01:11:24 IST 2016,aw cuti
suredallass,Tue Mar 22 01:11:06 IST 2016,rt giraff
suredallass,Tue Mar 22 01:02:18 IST 2016,fun i rather ride someth els
suredallass,Tue Mar 22 01:02:06 IST 2016,rt i get to ride an eleph
suredallass,Mon Mar 21 23:55:41 IST 2016,and i still have more hour of school
suredallass,Mon Mar 21 23:54:43 IST 2016,rt i laugh hard
suredallass,Mon Mar 21 23:53:58 IST 2016,he obsess dj khale
suredallass,Mon Mar 21 23:53:05 IST 2016,tf weeni
suredallass,Mon Mar 21 23:51:32 IST 2016,rt it lit
suredallass,Mon Mar 21 23:46:39 IST 2016,rt the magconfamili offici arriv six flag the boy goof around
suredallass,Mon Mar 21 23:46:30 IST 2016,rt the magconfamili readi fun day six flag come join us today magconsanfrancisco
suredallass,Mon Mar 21 23:39:03 IST 2016,i choke on a gummi worm in class
suredallass,Mon Mar 21 23:37:19 IST 2016,he look like car wash girl movi
suredallass,Mon Mar 21 23:36:46 IST 2016,outfit
suredallass,Mon Mar 21 23:36:37 IST 2016,rt who want slide thru dms
suredallass,Mon Mar 21 23:32:04 IST 2016,he stupid
suredallass,Mon Mar 21 22:57:58 IST 2016,cam legit zoom pictur header
suredallass,Mon Mar 21 22:56:52 IST 2016,your layout
suredallass,Mon Mar 21 22:56:45 IST 2016,cam layout
suredallass,Mon Mar 21 22:56:10 IST 2016,stfu
suredallass,Mon Mar 21 22:56:07 IST 2016,rt i want love
suredallass,Mon Mar 21 21:30:50 IST 2016,this girl sit next annoy omg
suredallass,Mon Mar 21 20:38:07 IST 2016,can headach pleas kind go fuck away
suredallass,Mon Mar 21 20:31:41 IST 2016,rt when u pretend sick u stay home school ur mom leav
suredallass,Mon Mar 21 20:31:03 IST 2016,okay
suredallass,Mon Mar 21 20:24:15 IST 2016,where stupid bus hot
