username,time,tweet
SpecialKayDee1,Thu Sep 01 05:29:21 IST 2011,while watchin charli the chocol factori
SpecialKayDee1,Thu Sep 01 05:28:29 IST 2011,fri fish gatorad p yummi
SpecialKayDee1,Thu Sep 01 03:37:28 IST 2011,watchin episod spongebob patrick learn badd word hilari
SpecialKayDee1,Thu Sep 01 01:09:15 IST 2011,maww maww makin fish ihop icann eat p smellsyummi
SpecialKayDee1,Tue Aug 30 22:44:53 IST 2011,call cann igotta gett robbi ass said
SpecialKayDee1,Tue Aug 30 22:36:23 IST 2011,wow ijust got dumbest text messag ex
SpecialKayDee1,Tue Aug 30 08:30:15 IST 2011,a person serious love would never let go no matter situat
SpecialKayDee1,Tue Aug 30 07:25:25 IST 2011,just babi sinc want us
SpecialKayDee1,Tue Aug 30 06:29:37 IST 2011,fuck nigga get money mission progress
SpecialKayDee1,Tue Aug 30 06:14:19 IST 2011,iaint beggin motha fucka but nigga pleas
SpecialKayDee1,Tue Aug 30 02:31:25 IST 2011,singl minut ago
SpecialKayDee1,Mon Aug 29 23:40:05 IST 2011,on grown woman shyt tadayi
SpecialKayDee1,Mon Aug 29 12:25:19 IST 2011,its me mommi babi noww ine
SpecialKayDee1,Mon Aug 29 12:23:49 IST 2011,you regret like rest
SpecialKayDee1,Mon Aug 29 10:56:41 IST 2011,xtra fake goin ta bed
SpecialKayDee1,Mon Aug 29 10:53:58 IST 2011,yea over care someon that wanna call yo mistak was ta over care wrong person
SpecialKayDee1,Mon Aug 29 10:40:37 IST 2011,the person talk cann see full shit realli
SpecialKayDee1,Mon Aug 29 10:06:52 IST 2011,iwond one follow talkin
SpecialKayDee1,Mon Aug 29 10:02:03 IST 2011,oh fuck relationship right smh
SpecialKayDee1,Mon Aug 29 08:48:26 IST 2011,should igiv ijust keep chasin pavement even though lead nowher
SpecialKayDee1,Sun Aug 28 10:16:39 IST 2011,iwish oomf would stop accusin stuff
SpecialKayDee1,Sun Aug 28 10:15:30 IST 2011,oh well umm ima need ta let kno wit idont know tim
SpecialKayDee1,Sun Aug 28 09:45:05 IST 2011,uummm tim
SpecialKayDee1,Sat Aug 27 02:14:39 IST 2011,then stayi gone
SpecialKayDee1,Wed Aug 24 23:39:57 IST 2011,not feelin good goin back ta sleep
SpecialKayDee1,Wed Aug 24 21:47:38 IST 2011,feelin good morn
SpecialKayDee1,Wed Aug 24 08:13:38 IST 2011,when i one gettin fuck
SpecialKayDee1,Wed Aug 24 08:12:49 IST 2011,i alway bad guy
SpecialKayDee1,Wed Aug 24 08:09:30 IST 2011,and wast time
SpecialKayDee1,Wed Aug 24 08:08:50 IST 2011,and right open upp cuz bunch bullshit
SpecialKayDee1,Wed Aug 24 08:07:34 IST 2011,idont anth ta sayi ta
SpecialKayDee1,Wed Aug 24 06:44:45 IST 2011,all worri fuckin oomf piss fuck
SpecialKayDee1,Tue Aug 23 00:32:15 IST 2011,its krazii heartless peopl cann
SpecialKayDee1,Mon Aug 22 23:53:57 IST 2011,iknow perfect wayi ta go ahead solv leav
SpecialKayDee1,Mon Aug 22 23:45:22 IST 2011,well nice idont think lil girlfriend would like much
SpecialKayDee1,Sat Aug 13 08:48:42 IST 2011,time ta get grown woman here go
SpecialKayDee1,Wed Aug 10 13:33:38 IST 2011,ok ialreadi know danc ima iget stage
SpecialKayDee1,Fri Jul 01 07:44:18 IST 2011,ilov vike rt
SpecialKayDee1,Mon Jun 27 05:47:20 IST 2011,bouta play beer pong johnathan myy partner yayi
SpecialKayDee1,Mon Jun 27 05:46:25 IST 2011,readyy ta eat badd ass food noel wippin upp us
SpecialKayDee1,Mon Jun 27 05:44:38 IST 2011,blowin wit johnathan noel funnn funnn
SpecialKayDee1,Wed Jun 22 10:31:06 IST 2011,meatbal
SpecialKayDee1,Fri Jun 17 08:52:00 IST 2011,bein inconsider come ta peopl
SpecialKayDee1,Thu Jun 16 13:20:24 IST 2011,layyin watchin movi robbi
SpecialKayDee1,Wed Jun 15 22:28:08 IST 2011,at sprit store wit
SpecialKayDee1,Tue Jun 14 21:58:02 IST 2011,whyy ihav ta badd luck ugh
SpecialKayDee1,Tue Jun 14 12:15:04 IST 2011,rollin hard ilik
SpecialKayDee1,Tue Jun 14 11:26:49 IST 2011,ihop nott madd
SpecialKayDee1,Tue Jun 14 11:03:08 IST 2011,iswear everytim itak step forward iget push back
SpecialKayDee1,Tue Jun 14 10:37:53 IST 2011,icann realli get use ta
