username,time,tweet
bghockey4,Sun Sep 01 05:29:49 IST 2013,eat rowdi beaver wear bemidji state beaver gear do think i could get discount wear beaver stuff
bghockey4,Sat Aug 31 18:26:30 IST 2013,branson bound letsgo
bghockey4,Sat Aug 31 05:30:32 IST 2013,blue mountain state mynewaddict notleavingthecouch
bghockey4,Fri Aug 30 07:49:33 IST 2013,rt i best billet brother guy could ask
bghockey4,Fri Aug 30 07:19:02 IST 2013,billet brother
bghockey4,Fri Aug 30 04:53:19 IST 2013,rt first ap calc test year tomorrow i could tell absolut noth i learn last week
bghockey4,Fri Aug 30 04:46:30 IST 2013,rt i failur he forgiv i sinner he savior i broken he healer i his child he god
bghockey4,Thu Aug 29 08:25:59 IST 2013,why fall one ignor us yet ignor one fall us
bghockey4,Thu Aug 29 04:06:18 IST 2013,rt you make smile like sun fall bed sing like bird dizzi head
bghockey4,Tue Aug 27 22:58:18 IST 2013,well i good day
bghockey4,Tue Aug 27 09:19:55 IST 2013,rt god perfect time everyth learn wait him this bring him honor bring peac see psalm
bghockey4,Tue Aug 27 09:00:24 IST 2013,when god give heavi cross bear ask lighter cross stronger back
bghockey4,Mon Aug 26 08:55:26 IST 2013,rt youth group tonight love taylor
bghockey4,Mon Aug 26 08:23:35 IST 2013,that nice warm shower water game youth group
bghockey4,Sat Aug 24 02:30:52 IST 2013,rt noth brighten day sun
bghockey4,Fri Aug 23 21:22:31 IST 2013,rt i see brotrip vega man futur tonethechieffrocca bdoubleoti letsgo
bghockey4,Fri Aug 23 08:34:29 IST 2013,noth absolut noth
bghockey4,Fri Aug 23 06:54:51 IST 2013,if learn noth els year bio know never use raw bacon bookmark textbook mr pfeifer
bghockey4,Fri Aug 23 02:12:27 IST 2013,drive school zone watch kid watch speedomet
bghockey4,Thu Aug 22 09:15:56 IST 2013,did happen forget someth oh yeah
bghockey4,Wed Aug 21 07:44:02 IST 2013,last bro date leav colleg creamslush gonnamissthes
bghockey4,Tue Aug 20 08:39:43 IST 2013,spread love wherev go let one ever come without leav happier
bghockey4,Mon Aug 19 18:30:38 IST 2013,it fourth day school my first ap calc assign due today i alreadi go earli get help itsgonnabealongyear
bghockey4,Mon Aug 19 06:17:12 IST 2013,you beat homemad ice cream
bghockey4,Mon Aug 19 02:14:15 IST 2013,never respond text
bghockey4,Sun Aug 18 10:09:14 IST 2013,rollerblad beach orang leaf coolest girl around town
bghockey4,Sat Aug 17 09:46:25 IST 2013,rt in end regret chanc take
bghockey4,Fri Aug 16 08:31:54 IST 2013,go bed
bghockey4,Fri Aug 16 08:23:25 IST 2013,i didnt have get back i could left stand awkward other continu sing your welcom
bghockey4,Fri Aug 16 08:19:16 IST 2013,like i close hymn book church hold
bghockey4,Fri Aug 16 08:13:46 IST 2013,ummm defens fr greg readi get thing start kept sing notmyfault
bghockey4,Fri Aug 16 03:24:20 IST 2013,realli how old
bghockey4,Thu Aug 15 07:41:25 IST 2013,go back school make miss tec communiti even i realli wish entir world like tec stillonmyjesushyp jesusfreak
bghockey4,Thu Aug 15 04:54:48 IST 2013,enough selfi wcw entir year itsbecauseiloveyou
bghockey4,Thu Aug 15 04:25:20 IST 2013,womancrushwednesday sorrynotsorri
bghockey4,Wed Aug 14 03:13:12 IST 2013,probabl were even weekend i think realli competit
bghockey4,Wed Aug 14 03:10:11 IST 2013,there goodby follow christ see ya later
bghockey4,Wed Aug 14 03:08:58 IST 2013,right there minor yell sunday bit monday novoic
bghockey4,Wed Aug 14 03:04:58 IST 2013,i know i lost mine that may due minor yell sunday
bghockey4,Tue Aug 13 10:37:34 IST 2013,rt but serious brat
bghockey4,Tue Aug 13 10:35:16 IST 2013,rt brenden liter favorit
bghockey4,Tue Aug 13 10:23:53 IST 2013,d
bghockey4,Tue Aug 13 10:19:06 IST 2013,room it closet doesntsoundanybett
bghockey4,Tue Aug 13 10:06:33 IST 2013,i kinda miss dessert jk they aw
bghockey4,Tue Aug 13 09:48:57 IST 2013,it funni day make big impact entir life i bless serv other wonder group side
bghockey4,Tue Aug 13 09:20:28 IST 2013,i love tec life it feel amaz renew relationship christ great love around
bghockey4,Tue Aug 13 05:49:05 IST 2013,rt peopl grind in front jesus like i front jesus
bghockey4,Sun Aug 11 21:21:53 IST 2013,rt cauuuuut happi rise day
bghockey4,Sat Aug 10 04:25:35 IST 2013,tec here we go letsgo jesusfreak
