username,time,tweet
ecpolitel,Sat Sep 01 05:29:54 IST 2012,don judg book cover n better late never exampl proverb what proverb what mean proverb
ecpolitel,Sat Sep 01 05:10:27 IST 2012,by way tweep today first day septemb may bless day along septemb aamiin
ecpolitel,Sat Sep 01 05:03:21 IST 2012,hi tweep good morn today weekend day have fabul saturday
ecpolitel,Fri Aug 31 20:28:25 IST 2012,done welcom ex secretari ec
ecpolitel,Fri Aug 31 20:27:19 IST 2012,yes thank input
ecpolitel,Fri Aug 31 19:15:59 IST 2012,okay thank suggest
ecpolitel,Fri Aug 31 19:08:10 IST 2012,thank any suggest
ecpolitel,Fri Aug 31 18:47:11 IST 2012,lihat di eaaaa kakag
ecpolitel,Fri Aug 31 17:44:54 IST 2012,happi virtual journey dear tweep travel see next journey
ecpolitel,Fri Aug 31 17:41:35 IST 2012,dear travel tweep travel countri today may cultur tip help get cultur shock go abroad
ecpolitel,Fri Aug 31 17:41:21 IST 2012,now land japan howev expect japaness person say mayb general mean
ecpolitel,Fri Aug 31 17:41:14 IST 2012,still u s we say pleas ask someon someth us and dont forget say thank everi kind
ecpolitel,Fri Aug 31 17:40:45 IST 2012,destin unit state u s pleas n thank you import u s
ecpolitel,Fri Aug 31 17:40:37 IST 2012,destin britain in britain peopl place valu punctual they make great effort arriv time impolit late
ecpolitel,Fri Aug 31 17:40:22 IST 2012,so go virtual journey get closer peopl around world take seat dear travel go
ecpolitel,Fri Aug 31 17:39:58 IST 2012,cultur tip inform like share habit deed peopl various countri
ecpolitel,Fri Aug 31 17:38:20 IST 2012,hi tweep cultur tip thing would like share tonight promis wanna know stay
ecpolitel,Fri Aug 31 09:48:16 IST 2012,tweep tonight share various cultur tip sever countri don t miss it
ecpolitel,Fri Aug 31 05:42:32 IST 2012,rt feel bore timelin see teach us simpl present tens easi way today
ecpolitel,Fri Aug 31 05:42:11 IST 2012,hi good day tweep have splendid friday
ecpolitel,Thu Aug 30 19:23:06 IST 2012,thank today tweep master grammar alway must know grammar may make dare to speak english
ecpolitel,Thu Aug 30 19:23:05 IST 2012,hard confus no problem learn togeth question mention feel free ask
ecpolitel,Thu Aug 30 19:23:04 IST 2012,that tweep we learn simpl present tens today how tweep
ecpolitel,Thu Aug 30 19:23:03 IST 2012,info the use time signal must it option
ecpolitel,Thu Aug 30 19:23:02 IST 2012,info alway one time signal there mani time signal use simpl present usual sometim etc
ecpolitel,Thu Aug 30 19:23:01 IST 2012,pattern do does subject verb wthout addit es
ecpolitel,Thu Aug 30 19:23:00 IST 2012,kal tanya do alway walk school n does alway walk school
ecpolitel,Thu Aug 30 19:22:58 IST 2012,when use do use subject i you we they does use subject she he it
ecpolitel,Thu Aug 30 19:22:57 IST 2012,do does who they call auxiliari verb kt kerja bantu they use sentenc simpl present
ecpolitel,Thu Aug 30 19:22:57 IST 2012,pattern subject do does not verb without addit es
ecpolitel,Thu Aug 30 19:22:55 IST 2012,kal negat i do not alway walk school she does not alway walk school
ecpolitel,Thu Aug 30 19:22:34 IST 2012,when subject i you we they add es origin verb when subject she he it need
ecpolitel,Thu Aug 30 19:22:19 IST 2012,yes bcoz simpl present add es origin verb walk but addit depend subject sentenc
ecpolitel,Thu Aug 30 19:22:12 IST 2012,walk walk why differ
ecpolitel,Thu Aug 30 19:22:06 IST 2012,kal positif i alway walk school she walk school
ecpolitel,Thu Aug 30 19:21:59 IST 2012,patern simpl present verbal sentenc subject verb simpl yes let proceed exampl tweep
ecpolitel,Thu Aug 30 18:33:33 IST 2012,that use simpl present nomin sentenc easi now time move verbal sentenc keep us tweep
ecpolitel,Thu Aug 30 18:33:32 IST 2012,ex kal tanya am i busi to be n subject replac pattern to be subject adject noun adverb
ecpolitel,Thu Aug 30 18:33:31 IST 2012,ex kal negat i busi add not to be the pattern subject to be not adject noun adverb
ecpolitel,Thu Aug 30 18:33:30 IST 2012,exampl kal positif busi
ecpolitel,Thu Aug 30 18:33:29 IST 2012,for nomin sentenc pattern subject noun pronoun to be adject kt sifat adverb kt ket noun kt benda
ecpolitel,Thu Aug 30 18:33:28 IST 2012,we learn use simpl present nomin sntenc kalmt yg tdk mngndung kt kerja n verbal sntenc klmt yg mngndung kt kerja
ecpolitel,Thu Aug 30 18:33:27 IST 2012,simpl present tens use express habitu n stativ event it also use express general truth like sun rise everi day etc
ecpolitel,Thu Aug 30 18:33:12 IST 2012,as previous tweet promis learn simpl present tens it wont bore sinc make brief n attact stay tune
ecpolitel,Thu Aug 30 08:20:49 IST 2012,so dont miss tonight agenda learn simpl present tens alway stick arround
ecpolitel,Thu Aug 30 08:17:29 IST 2012,learn tens grammar ah bore mayb say like promis wont bore sinc make brief n attract
ecpolitel,Thu Aug 30 08:08:07 IST 2012,learn share care motto tweep and tonight learn simpl present tens wait us stay tune
ecpolitel,Thu Aug 30 08:03:56 IST 2012,hi good morn tweep have gorgeous thursday
ecpolitel,Wed Aug 29 08:53:32 IST 2012,we miss lot rt realli miss togeth us wait moment spend everi crazi
ecpolitel,Wed Aug 29 08:52:22 IST 2012,aamiin thank
