username,time,tweet
Aaron_Gonzo,Sat Mar 26 14:09:38 IST 2016,rt  homeless irishman spitalfields london 1969 by don mccullin its grim down south too 
Aaron_Gonzo,Sat Mar 26 14:09:30 IST 2016,beautiful ladies on the way to work love please dont treat me like a fool
Aaron_Gonzo,Sat Mar 26 14:08:45 IST 2016,rt  in life youll realize that there is a purpose for every person you meet some will teach you and some will bring out the…
Aaron_Gonzo,Sat Mar 26 14:07:57 IST 2016,you were like glue holding each of us together
Aaron_Gonzo,Sat Mar 26 00:32:49 IST 2016,oh my god you have burnt the garlic breadshame on you lady
Aaron_Gonzo,Sat Mar 26 00:30:26 IST 2016,  it doesnt sound scary like well hurricane wilma haha
Aaron_Gonzo,Fri Mar 25 01:52:36 IST 2016,having a wine merchants across from work does me no justice  redredwine
Aaron_Gonzo,Fri Mar 25 01:49:52 IST 2016,rt  i just blocked myself im not putting up with this shit either
Aaron_Gonzo,Fri Mar 25 01:49:14 IST 2016,rt  the world around you has beauty written all over it youd know that if you took your face out of your phone 
Aaron_Gonzo,Fri Mar 25 01:48:57 IST 2016,rt  edible sound a dj experiment featuring food that has been laser-etched into audio records  https…
Aaron_Gonzo,Fri Mar 25 01:48:27 IST 2016,ciabatta bread you are delish
Aaron_Gonzo,Thu Mar 24 22:21:56 IST 2016,people giving me tips in work im actually so gracious you guys  gals
Aaron_Gonzo,Thu Mar 24 22:21:08 IST 2016,rt  i was built in 1873do you know what else happened in 1873me neitheri didnt go to school im a house
Aaron_Gonzo,Thu Mar 24 22:20:49 IST 2016,rt  by letting go it all gets done            — lao tzu tao te ching|taoism quotes
Aaron_Gonzo,Thu Mar 24 22:20:38 IST 2016,rt  email if you have any issues please contact mephone changed it to any anus issues so yeah thatll make my inbox more …
Aaron_Gonzo,Thu Mar 24 22:20:15 IST 2016, copy  paste college101
Aaron_Gonzo,Thu Mar 24 22:18:43 IST 2016,rt tbonezzz you gotta love it when people send u a disingenuous dm by saying hello how are you just to make sure ur not mad at them …
Aaron_Gonzo,Thu Mar 24 22:18:22 IST 2016,rt  paul simonon from the clash smashing his fender precision bass against the stage at the palladium in new york 1979 h…
Aaron_Gonzo,Thu Mar 24 22:17:50 IST 2016,look ma its a unicorn 
Aaron_Gonzo,Thu Mar 24 22:16:42 IST 2016,i can honestly say im a grown up kid and not a grown up
Aaron_Gonzo,Thu Mar 24 22:15:40 IST 2016,rt  be the reason she starts loving small dicks
Aaron_Gonzo,Thu Mar 24 22:15:11 IST 2016,love a good haiku
Aaron_Gonzo,Thu Mar 24 22:14:37 IST 2016,if your are failing in the pursuit of happiness it is yourself you must look to and the failing 9/10 is a defiency in youre own character
Aaron_Gonzo,Wed Mar 23 22:34:30 IST 2016,and as for the clouds all i can do is watch them as they roll away
Aaron_Gonzo,Wed Mar 23 22:28:16 IST 2016,rt  marriage is like when you were a kid on easter and saw this huge chocolate bunny in your basket   but it was hollow…
Aaron_Gonzo,Wed Mar 23 22:27:52 IST 2016,rt  pope saint john paul ii meets with mehmet agca the man who attempted to assassinate him 1983 
Aaron_Gonzo,Wed Mar 23 22:27:30 IST 2016,rt react when you get home from a night out and your dad is smelling your breath to see if youve been smoking 
Aaron_Gonzo,Wed Mar 23 22:26:33 IST 2016,pandora only comes out of the box he cant go back in
Aaron_Gonzo,Wed Mar 23 02:30:41 IST 2016,rt  i can’t physically perform most of the mac keyboard shortcuts because i’m not vishnu
Aaron_Gonzo,Wed Mar 23 02:29:46 IST 2016,rt  judge says here you yelled “this ones on me” while tossing a coke into the polar bear exhibit…did y-me lips right…
Aaron_Gonzo,Wed Mar 23 02:27:58 IST 2016,i found the easiest way to end it wasehhh sorry luv im actually gay i just found out now like dublinhunzos
Aaron_Gonzo,Wed Mar 23 02:22:33 IST 2016,rt  i feel like a failure doc ive got 5 boys and they all work as hotel valetswow this is the worst case of parking sons i…
Aaron_Gonzo,Wed Mar 23 02:22:09 IST 2016,  legalize mma 
Aaron_Gonzo,Wed Mar 23 02:21:11 IST 2016,job hinting they need another skipper for the ships were do i sign
Aaron_Gonzo,Wed Mar 23 02:18:50 IST 2016,game of thrones is an amalgamation of certain parts of history with dragons people are shocked when they find out whats its based on
Aaron_Gonzo,Wed Mar 23 02:14:53 IST 2016,rt  i need a small loan of one million dollars
Aaron_Gonzo,Wed Mar 23 02:14:23 IST 2016,hbos rome kicks game of thrones ass  there i said it
Aaron_Gonzo,Tue Mar 22 23:56:32 IST 2016,rt  you may know your wine but throwing a bottle of cheap tequila in your basket tells me you’re not the sharpest tool in this li…
Aaron_Gonzo,Tue Mar 22 23:56:10 IST 2016,ill lay down this bottle of wine if you just be kind to me hannah
Aaron_Gonzo,Tue Mar 22 23:53:57 IST 2016,okay i made this day my biatch son
Aaron_Gonzo,Tue Mar 22 14:21:27 IST 2016,gonna make this day my bitch
Aaron_Gonzo,Tue Mar 22 14:21:16 IST 2016,i know i know for sure that life is beautiful around the world rhcp
Aaron_Gonzo,Mon Mar 21 04:35:11 IST 2016,sinatra all or nothing at all  is a fantastic insight into one of my heros
Aaron_Gonzo,Mon Mar 21 01:08:22 IST 2016,rt  syria to take in american refugees if donald trump is elected  
Aaron_Gonzo,Mon Mar 21 01:06:28 IST 2016,rt  look for the girl with the broken smile 
Aaron_Gonzo,Mon Mar 21 01:06:07 IST 2016,rt  i will never ever be in a secret relationship fuck i look like lol
Aaron_Gonzo,Mon Mar 21 01:05:23 IST 2016,rt  ‘killing in the name’ by rage against the machine covered on a one-stringed shovel guitar  https…
Aaron_Gonzo,Mon Mar 21 01:04:53 IST 2016,rt  niggas that dont save the game before fighting a legendary pokemon really dont care about their future
Aaron_Gonzo,Mon Mar 21 01:03:49 IST 2016,rt  yall ever wonder what yo future wife doing 
