username,time,tweet
TheWesker,Sun Sep 01 05:29:45 IST 2013,stormi land wait tarmac gate clear
TheWesker,Sun Sep 01 05:27:28 IST 2013,tri new twitter app it blue line
TheWesker,Sun Sep 01 04:27:26 IST 2013,stormi land indianapoli intern airport ind w
TheWesker,Sun Sep 01 03:55:52 IST 2013,appar thunderstorm hit come indi
TheWesker,Sun Sep 01 01:01:16 IST 2013,connect indi dalla fort worth intern airport dfw w
TheWesker,Sat Aug 31 23:00:29 IST 2013,good
TheWesker,Sat Aug 31 22:33:21 IST 2013,come neck wood well former i guess
TheWesker,Sat Aug 31 22:32:14 IST 2013,also i know i wifi right i rent free movi gogo let whatev
TheWesker,Sat Aug 31 22:24:25 IST 2013,feet i mean
TheWesker,Sat Aug 31 22:18:10 IST 2013,noth like surf net feet
TheWesker,Sat Aug 31 17:45:14 IST 2013,earli morn brandi marriot marqui
TheWesker,Sat Aug 31 09:30:32 IST 2013,san fran night sanfrancisco sanfran sf afterdark baybridg
TheWesker,Sat Aug 31 04:30:19 IST 2013,san fran pretti
TheWesker,Fri Aug 30 06:30:05 IST 2013,view room
TheWesker,Fri Aug 30 05:30:04 IST 2013,now find bag
TheWesker,Fri Aug 30 04:54:02 IST 2013,land san francisco intern airport sfo w
TheWesker,Thu Aug 29 22:47:32 IST 2013,wheel chicago o hare intern airport ord w
TheWesker,Thu Aug 29 22:30:03 IST 2013,wheel
TheWesker,Thu Aug 29 20:30:44 IST 2013,frisk
TheWesker,Thu Aug 29 20:30:05 IST 2013,chicago
TheWesker,Thu Aug 29 20:00:42 IST 2013,chicago san fran indianapoli intern airport ind w pic
TheWesker,Thu Aug 29 05:12:34 IST 2013,combo meal combo restaur instagram
TheWesker,Thu Aug 29 03:20:24 IST 2013,head san francisco day tomorrow never should fun
TheWesker,Wed Aug 28 23:30:23 IST 2013,oh boy humbl comedi bundl
TheWesker,Wed Aug 28 21:58:25 IST 2013,video show ganondorf edit wind waker hd
TheWesker,Wed Aug 28 21:47:45 IST 2013,rt adult w kid the look horribl would buy adult w kid tablet size babysitt play
TheWesker,Wed Aug 28 21:38:29 IST 2013,rt nintendo new thing kid grown ass adult not buy
TheWesker,Wed Aug 28 21:37:57 IST 2013,where wii u ambassador game
TheWesker,Wed Aug 28 21:28:41 IST 2013,rare turn
TheWesker,Wed Aug 28 21:20:34 IST 2013,if like take solac it
TheWesker,Wed Aug 28 21:19:19 IST 2013,kid pokemon go sell shit thing
TheWesker,Wed Aug 28 08:39:32 IST 2013,never seen mountain dew freez instagram
TheWesker,Wed Aug 28 02:55:42 IST 2013,rt rottentomato can explain one direct this us approv rate
TheWesker,Wed Aug 28 02:53:22 IST 2013,yeah still i feel worth year that current deal ps sub
TheWesker,Wed Aug 28 02:52:10 IST 2013,lol sub though i get anoth deal like last year
TheWesker,Wed Aug 28 02:50:26 IST 2013,if i agre is app vita
TheWesker,Wed Aug 28 02:49:26 IST 2013,i often forget i soni music unlimit and i rememb i love
TheWesker,Wed Aug 28 01:20:03 IST 2013,well i love enter long ass code microsoft point
TheWesker,Wed Aug 28 01:17:14 IST 2013,yeah come well plan i given code microsoft point instead deposit live reward
TheWesker,Wed Aug 28 01:13:45 IST 2013,i even take indiana beach second trip king island i care
TheWesker,Wed Aug 28 01:13:12 IST 2013,who want go cedar point mayb holiday world i want ride roller coaster
TheWesker,Wed Aug 28 01:12:10 IST 2013,so today ps addit machinarium vita i game mani platform
TheWesker,Wed Aug 28 01:09:29 IST 2013,yeah updat yet best buy consol
TheWesker,Tue Aug 27 21:20:54 IST 2013,thank
TheWesker,Tue Aug 27 20:49:32 IST 2013,so dmc come manual
TheWesker,Tue Aug 27 20:40:00 IST 2013,i tell does dmc come manual
TheWesker,Tue Aug 27 07:23:53 IST 2013,yeah possibl find cheaper get real lucki still god copi cheapest
TheWesker,Tue Aug 27 07:21:30 IST 2013,use cheapest i seen last year
TheWesker,Tue Aug 27 07:20:40 IST 2013,good deal physic edit pricey
TheWesker,Mon Aug 26 23:14:31 IST 2013,though nbc lose money fast forward
