username,time,tweet
UGA4life8foreva,Sat Sep 01 05:29:51 IST 2012,arm fresh gym flexitout
UGA4life8foreva,Sat Sep 01 05:28:38 IST 2012,thank
UGA4life8foreva,Sat Sep 01 05:28:15 IST 2012,this help thru pain prayforjordan
UGA4life8foreva,Sat Sep 01 04:40:18 IST 2012,wow jus saw cousin jordan i speechless she brain dead take machin pass prayforjordan
UGA4life8foreva,Sat Sep 01 04:06:20 IST 2012,codi wanna fight we cool tho
UGA4life8foreva,Sat Sep 01 04:04:25 IST 2012,loo cours i bruh freshman gonna get shit drop
UGA4life8foreva,Sat Sep 01 03:57:04 IST 2012,shit cool prolli
UGA4life8foreva,Sat Sep 01 03:55:02 IST 2012,hell yeah i was mad
UGA4life8foreva,Sat Sep 01 03:49:54 IST 2012,yeah told codi told gf got piss
UGA4life8foreva,Sat Sep 01 03:48:43 IST 2012,bruh even freshman codi
UGA4life8foreva,Wed Aug 29 01:28:04 IST 2012,yu haha
UGA4life8foreva,Wed Aug 29 01:26:50 IST 2012,lol ikr haha go kick lik notch
UGA4life8foreva,Mon Aug 27 05:24:53 IST 2012,omg retweet if yur parent make yu laugh yu need
UGA4life8foreva,Mon Aug 27 05:23:14 IST 2012,new outfit yeeeaaabuddi
UGA4life8foreva,Mon Aug 27 05:16:27 IST 2012,the shirt pink orang dumb camera lol
UGA4life8foreva,Mon Aug 27 04:48:10 IST 2012,rt dawg sport bracket hate we winner er looser well hate
UGA4life8foreva,Mon Aug 27 04:47:45 IST 2012,ate gotta bit runnin lol
UGA4life8foreva,Mon Aug 27 04:03:35 IST 2012,rt my true home re
UGA4life8foreva,Mon Aug 27 04:02:16 IST 2012,rt it hard princ charm rather fool around dwarv
UGA4life8foreva,Mon Aug 27 04:02:00 IST 2012,rt tap scrap
UGA4life8foreva,Mon Aug 27 03:57:44 IST 2012,blond moment hush xd
UGA4life8foreva,Mon Aug 27 03:57:09 IST 2012,indigo person p silli goos haha got purplish tini
UGA4life8foreva,Mon Aug 27 03:55:42 IST 2012,look pic
UGA4life8foreva,Mon Aug 27 03:55:16 IST 2012,
UGA4life8foreva,Mon Aug 27 03:54:27 IST 2012,bad i beat tat ass laser tag tho fistpump
UGA4life8foreva,Mon Aug 27 00:46:04 IST 2012,welp i gotta go cuz i invit uggghhh
UGA4life8foreva,Mon Aug 27 00:31:26 IST 2012,hmmm not feelin tbh it gon b dead mite chill home slumpallday
UGA4life8foreva,Sun Aug 26 01:31:20 IST 2012,mmmm idt sooooo i i still cudnt breath xd
UGA4life8foreva,Sun Aug 26 01:11:58 IST 2012,god i never wear skin us life jus slim straight lol
UGA4life8foreva,Sun Aug 26 01:10:44 IST 2012,rt it super effect
UGA4life8foreva,Sun Aug 26 01:04:51 IST 2012,mite go wayn game retweet yu goin
UGA4life8foreva,Sun Aug 26 01:00:02 IST 2012,those pant goin back
UGA4life8foreva,Sun Aug 26 00:59:53 IST 2012,gma bought freakin super skinni levi notpleas
UGA4life8foreva,Sat Aug 25 05:07:12 IST 2012,it sat
UGA4life8foreva,Sat Aug 25 05:06:24 IST 2012,how trynna go wit got cuzo bday parti b deep
UGA4life8foreva,Sat Aug 25 05:03:14 IST 2012,soooooo unhealthi xd protest less gross food xd hahaha
UGA4life8foreva,Sat Aug 25 04:55:20 IST 2012,honest didnt smell best either it poopish smell xd
UGA4life8foreva,Sat Aug 25 04:54:31 IST 2012,lolol cuz haha i use bob marley shirt i rip sleev sad face haha yu tho d
UGA4life8foreva,Sat Aug 25 04:42:01 IST 2012,i go wit yu let
UGA4life8foreva,Sat Aug 25 01:59:07 IST 2012,refri
UGA4life8foreva,Sat Aug 25 01:54:48 IST 2012,this call retri bean p yuck i wundt dare eat schoolfood
