username,time,tweet
hippycampus,Sat Sep 01 05:29:49 IST 2012,the bluemoon look unrev menac norestforthewick join howler werewolv true beast mother natur howl
hippycampus,Sat Sep 01 05:15:21 IST 2012,how piec fuck mind
hippycampus,Sat Sep 01 05:13:52 IST 2012,don tri find answer question brother let heart wound give merci fear live
hippycampus,Sat Sep 01 05:02:39 IST 2012,oh dear smell like ganja thankjah
hippycampus,Fri Aug 31 21:00:23 IST 2012,i might nutcas i dilut let say day i accid prone i rather stay home
hippycampus,Fri Aug 31 20:54:20 IST 2012,funni movi come distant second watch get hurt constant unbeliev way imagin
hippycampus,Fri Aug 31 20:51:53 IST 2012,your map might helsinki lucki enough might right spot pin sea
hippycampus,Fri Aug 31 20:40:02 IST 2012,besid i hope i made smile even littl imagin kind crazi feat guy would imnut
hippycampus,Fri Aug 31 20:38:37 IST 2012,that said i tri tell peopl save planet well better someon make cri
hippycampus,Fri Aug 31 20:35:39 IST 2012,thank i feel alway welcom stonerfamili warm insid i hope i last finnishston follow
hippycampus,Fri Aug 31 20:21:21 IST 2012,oh noe but worri i know mood cpr stand back folk requir make ass laugh
hippycampus,Fri Aug 31 19:27:59 IST 2012,that would includ some might charact someth angel demon good hand
hippycampus,Fri Aug 31 19:19:15 IST 2012,bad ppl exist cos think good better bad dualism viewpoint
hippycampus,Fri Aug 31 15:33:53 IST 2012,why bad ppl
hippycampus,Fri Aug 31 15:31:39 IST 2012,should tarot view case illiter cardograph
hippycampus,Fri Aug 31 15:28:17 IST 2012,did hear full moon tonight tendenc lunar insomnia
hippycampus,Fri Aug 31 15:24:17 IST 2012,thank shout i tough cooki advertis i need good pr agent
hippycampus,Fri Aug 31 05:04:02 IST 2012,she one special ladi iwouldsmoketothat some flame smoke take toke
hippycampus,Fri Aug 31 04:50:56 IST 2012,onceinabluemoon make even crazier howlingatthemoon lunat watch werewolv folk all kind crazi ppl
hippycampus,Fri Aug 31 04:47:37 IST 2012,thank man ppp yeah back she alway and nice canalmostsmellh
hippycampus,Fri Aug 31 04:43:34 IST 2012,warm rain lukewarm shower
hippycampus,Fri Aug 31 04:39:25 IST 2012,green even i danc mj one song ran like sometim missheralreadi
hippycampus,Fri Aug 31 01:25:38 IST 2012,it full blue moon soon i get batter night
hippycampus,Fri Aug 31 01:22:37 IST 2012,i come worst feel inadequ only conquer ghost and i fall begin climb
hippycampus,Thu Aug 30 05:14:26 IST 2012,recogn old song what trunk sarah watch two drunk drunk
hippycampus,Wed Aug 29 19:56:03 IST 2012,it sweden smoke signal intern nobord
hippycampus,Wed Aug 29 02:14:22 IST 2012,edward scissorhand ah love movi oneofmyfabourit icri
hippycampus,Tue Aug 28 17:51:44 IST 2012,is imag sensor full frame slr translat higher mag w smaller sensor
hippycampus,Thu Aug 23 06:14:56 IST 2012,part i cannot see lowlight
hippycampus,Thu Aug 23 00:51:10 IST 2012,soppi right n loneli aw condit thought lure us believ worthi
hippycampus,Wed Aug 22 23:58:38 IST 2012,i acquir tast silenc dark fill heart calm jamiewoon nightair greatsong
hippycampus,Wed Aug 22 23:52:42 IST 2012,thunderstorm insid stomach sound hope stay ass lightn proof anthropomorphicbodilyfunct
hippycampus,Wed Aug 22 23:46:34 IST 2012,why mani afraid gloom i find dark beauti sooth tranquil utter hopeless keepeverythinginbal
hippycampus,Wed Aug 22 21:19:43 IST 2012,rt rt chanc win hand made notapip necklac chongpotcast
hippycampus,Wed Aug 22 21:19:00 IST 2012,oh there also movi name d coolcoincid therearenocoincid icontradictmyselfoften gonna watch
hippycampus,Wed Aug 22 19:22:36 IST 2012,have heard daze confus soul woman creat ibetyourehotterthanhel ilovefieryfoodandwomen
hippycampus,Wed Aug 22 19:13:24 IST 2012,i venus flytrap wither sinc i cellar spend winter they touchi liter
hippycampus,Wed Aug 22 05:03:20 IST 2012,i tri lure fli near carnivor bottl plant luck they seem rather stay near fruit wonderwhi
hippycampus,Wed Aug 22 04:57:37 IST 2012,does signal get pick satellit ground antenna if ground take account earth rotat
hippycampus,Wed Aug 22 04:50:18 IST 2012,i mean onlin present compani one home i got fruit fli they kinda cute much compani
hippycampus,Wed Aug 22 04:43:26 IST 2012,i realli dare say nobodi around perhap kind hope still thru perspect
hippycampus,Wed Aug 22 04:39:00 IST 2012,well know everi day feel like week love gone missingisweird realli get stuff
hippycampus,Wed Aug 22 04:34:06 IST 2012,how pizza crumb
hippycampus,Wed Aug 22 04:15:30 IST 2012,the pizza oven soon sweet mari lung bittersweet long toke last love gonna miss lot lastcrumbsleft
hippycampus,Tue Aug 21 03:31:53 IST 2012,glad hear the alien landscap mind tad complex put onto anyth less sheet paper
hippycampus,Tue Aug 21 03:18:06 IST 2012,thank soon one i like play stuff word peculiar stuff imposs break em
hippycampus,Tue Aug 21 03:00:42 IST 2012,it great girl love danc luscious wisp green vapour luv not enough pothead pritti
hippycampus,Tue Aug 21 01:39:53 IST 2012,i love watch slowli spin pincushion velvet starri space iheartstar followssatellit hitchingarid
hippycampus,Mon Aug 20 21:03:46 IST 2012,oh blimey dwarffortress can i mind back pleas ok one year addict bloodydwarv nofortressissaf
hippycampus,Sun Aug 19 18:48:46 IST 2012,yeah pm and happen come right two min roll
