username,time,tweet
riley_landry,Sun Sep 01 05:29:50 IST 2013,signal georgia game signal if mind could famili come watch game
riley_landry,Sun Sep 01 04:57:33 IST 2013,who want mayb get togeth watch georgia game
riley_landry,Sun Sep 01 04:54:24 IST 2013,rt clemson jumbotron messag safeti rush field stomp face pleas dawg
riley_landry,Sun Sep 01 04:53:59 IST 2013,rt georgia better disappoint
riley_landry,Sun Sep 01 04:53:47 IST 2013,rt i want watch georgia game lot peopl
riley_landry,Sun Sep 01 04:34:21 IST 2013,one hour till game time godawg dawgnat
riley_landry,Sun Sep 01 03:33:55 IST 2013,rt hurri
riley_landry,Sat Aug 31 03:08:25 IST 2013,go cabin weekend fishin relax justwhatine
riley_landry,Fri Aug 30 07:27:43 IST 2013,rt footbal season favorit
riley_landry,Thu Aug 29 07:41:08 IST 2013,rt i met amaz year old boy name lake bozman he battl leukemia pleas pray lake
riley_landry,Thu Aug 29 06:18:15 IST 2013,rt support superstar way
riley_landry,Thu Aug 29 05:10:31 IST 2013,let go visit
riley_landry,Thu Aug 29 05:07:22 IST 2013,rt make want cri
riley_landry,Wed Aug 28 02:38:13 IST 2013,anyon want text snapchat
riley_landry,Tue Aug 27 03:21:11 IST 2013,rt so excit readi watch dawg play
riley_landry,Tue Aug 27 01:16:54 IST 2013,rt colleg footbal start
riley_landry,Sat Aug 24 23:27:03 IST 2013,got iphon
riley_landry,Sat Aug 24 20:53:53 IST 2013,who want someth today
riley_landry,Fri Aug 23 08:06:41 IST 2013,rt summer gonna last forev bring footbal duck call merica
riley_landry,Fri Aug 23 02:47:31 IST 2013,what everyon tomorrow anyon want anyth
riley_landry,Fri Aug 23 02:07:05 IST 2013,phone offici
riley_landry,Thu Aug 22 04:53:40 IST 2013,rt day clemson get hand uga
riley_landry,Thu Aug 22 04:43:27 IST 2013,rt couldn ask better
riley_landry,Wed Aug 21 01:50:27 IST 2013,can wait go hunt fish day kill bird go ride four wheeler thelif
riley_landry,Wed Aug 21 01:20:39 IST 2013,
riley_landry,Tue Aug 20 05:41:51 IST 2013,rt i need job sooooo bad
riley_landry,Tue Aug 20 05:24:38 IST 2013,rt retweet like tailgat favorit hate etowah
riley_landry,Mon Aug 19 06:43:10 IST 2013,nice way end weekend
riley_landry,Mon Aug 19 06:42:53 IST 2013,rt tonight good godbless
riley_landry,Sun Aug 18 17:32:49 IST 2013,wake go play mud dirti bootcamp
riley_landry,Sun Aug 18 09:29:34 IST 2013,ya im startin feel
riley_landry,Sun Aug 18 09:28:01 IST 2013,thank
riley_landry,Sun Aug 18 09:14:23 IST 2013,the thing i small group hadtodrinkexpiredmilk
riley_landry,Sun Aug 18 09:10:05 IST 2013,see thoe six grader worship tonight best thing i seen
riley_landry,Sat Aug 17 01:22:38 IST 2013,our bus never fail bore alway excit
riley_landry,Sat Aug 17 01:21:46 IST 2013,rt i love bus
riley_landry,Sat Aug 17 01:21:36 IST 2013,rt ride bus
riley_landry,Thu Aug 15 07:07:04 IST 2013,i guess peopl known longer
riley_landry,Thu Aug 15 07:06:17 IST 2013,rt yeah i would hate i mean we codi
riley_landry,Thu Aug 15 07:04:04 IST 2013,would caus us drug drink order fun fit tho
riley_landry,Mon Aug 12 05:17:33 IST 2013,rt
riley_landry,Sat Aug 10 09:00:35 IST 2013,get stich
riley_landry,Fri Aug 09 06:35:04 IST 2013,one wer go talkin bout star war
riley_landry,Fri Aug 09 06:20:40 IST 2013,well dang suck i next weekend
riley_landry,Fri Aug 09 06:13:52 IST 2013,at least i know bring pancak
riley_landry,Thu Aug 08 06:49:18 IST 2013,
riley_landry,Thu Aug 08 06:47:02 IST 2013,oh well i tri i ever mean tell ill
riley_landry,Thu Aug 08 06:43:10 IST 2013,wer serious still make
