username,time,tweet
Greg_YNWA1,Tue Mar 01 05:29:39 IST 2016,absolut ive predict coupl month remain confid predict
Greg_YNWA1,Tue Mar 01 04:53:57 IST 2016,pleas dont even get start im bare begin calm insan yesterday
Greg_YNWA1,Tue Mar 01 04:45:39 IST 2016,yeah captain glad readi shot penalti shootout leadership
Greg_YNWA1,Tue Mar 01 04:15:20 IST 2016,if penalti shootout went round would lfc captain sturridg taken kick kolo mignolet
Greg_YNWA1,Tue Mar 01 04:12:29 IST 2016,in news reveal
Greg_YNWA1,Tue Mar 01 03:52:18 IST 2016,lfc penalti lineup sunday truli one outrag thing i seen year w club indefens
Greg_YNWA1,Tue Mar 01 03:44:18 IST 2016,shi
Greg_YNWA1,Mon Feb 29 23:46:25 IST 2016,at work onlin much did lfc captain step yet lead team want penalti shootout w trophi line
Greg_YNWA1,Mon Feb 29 23:32:06 IST 2016,wow that huge good luck very excit
Greg_YNWA1,Mon Feb 29 17:28:19 IST 2016,i take serious cannot take read compliment hendo monday morn ruin day
Greg_YNWA1,Mon Feb 29 17:27:24 IST 2016,rememb perfect mario ignor took without ask
Greg_YNWA1,Mon Feb 29 16:57:21 IST 2016,guess i dream it realli happen lfc captain leader decent penalti taker want pk shootout realiti
Greg_YNWA1,Mon Feb 29 16:27:20 IST 2016,just woke was i dream lfc captain one team best penalti taker want pk shootout trophi
Greg_YNWA1,Mon Feb 29 05:45:48 IST 2016,thank great event today heartbreak result thrill day great food drink gift food drive
Greg_YNWA1,Mon Feb 29 02:10:07 IST 2016,enjoy blind defens lfc penalti lineup leadership captain part five i ynwa
Greg_YNWA1,Mon Feb 29 02:06:54 IST 2016,it happen far slowli but confid hendo worthi lfc captain fall silent rodger in crowd
Greg_YNWA1,Mon Feb 29 02:04:55 IST 2016,for sure but know im one critiic day one and today hendo
Greg_YNWA1,Mon Feb 29 02:03:42 IST 2016,hendo lover if lfc got penalti match sure milner take who would imagin would option be honest
Greg_YNWA1,Mon Feb 29 01:52:48 IST 2016,crush most want defend milner lfc captain take penalti cool you probabl one say rodger in
Greg_YNWA1,Mon Feb 29 01:45:43 IST 2016,like i said i hope milner make kick would love know lfc captain cool part five
Greg_YNWA1,Mon Feb 29 01:42:49 IST 2016,captain demand part shootout unreal let know milner kick goe
Greg_YNWA1,Mon Feb 29 01:40:57 IST 2016,penalti so hendo milner sturridg watch lallana luca take penalti insan
Greg_YNWA1,Mon Feb 29 01:39:46 IST 2016,man summer rebuild true regardless today result focus today
Greg_YNWA1,Mon Feb 29 01:39:01 IST 2016,hendo lover pleas explain lfc captain ok without even man penalti rotat trophi line
Greg_YNWA1,Mon Feb 29 01:37:11 IST 2016,cool let know made captain even penalti lineup
Greg_YNWA1,Mon Feb 29 01:36:12 IST 2016,trophi line one round pks lfc captain vice captain never take kick bullshit
Greg_YNWA1,Mon Feb 29 01:34:34 IST 2016,explain captain vice captain part luck process
Greg_YNWA1,Mon Feb 29 01:33:07 IST 2016,trophi line milner sturridg lfc captain watch can luca lallana take penalti ok bullshit
Greg_YNWA1,Mon Feb 29 01:30:19 IST 2016,sure lfc captain would demand pk shootout w trophi line how kick go captain
Greg_YNWA1,Mon Feb 29 01:03:59 IST 2016,rt i say what happen lfc captain vice captain penalti capitalonecupfin
Greg_YNWA1,Mon Feb 29 01:03:52 IST 2016,rt i absolut livid henderson milner i seen cowardic long time footbal
Greg_YNWA1,Mon Feb 29 01:03:17 IST 2016,for defend insan lfc penalti lineup say milner go let know made
Greg_YNWA1,Mon Feb 29 00:59:46 IST 2016,cool lemm know make
Greg_YNWA1,Mon Feb 29 00:57:36 IST 2016,don give crap pks luck etc answer damn question luca lallana take penalti milner
Greg_YNWA1,Mon Feb 29 00:55:57 IST 2016,can anyon deni lfc got penalti match milner would take yet shootout luca lallana bullshit
Greg_YNWA1,Mon Feb 29 00:49:17 IST 2016,if lfc award penalti game would taken but shootout milner watch luca lallana take pks
Greg_YNWA1,Mon Feb 29 00:46:48 IST 2016,so milner one strength bring lfc take pk ok b
Greg_YNWA1,Mon Feb 29 00:34:51 IST 2016,minut jubil heartbreak
Greg_YNWA1,Mon Feb 29 00:25:08 IST 2016,absolut unbeliev drama wembley
Greg_YNWA1,Mon Feb 29 00:02:13 IST 2016,rt think enjoy
Greg_YNWA1,Sun Feb 28 23:59:21 IST 2016,absolut mad lfc bar go crazi
Greg_YNWA1,Sun Feb 28 23:40:52 IST 2016,cmon mls team make offer milner
Greg_YNWA1,Sun Feb 28 23:40:06 IST 2016,if origi sub chang minut sub
Greg_YNWA1,Sun Feb 28 23:35:38 IST 2016,i believ origi
Greg_YNWA1,Sun Feb 28 23:28:03 IST 2016,jurgen lfc approach min left need goal get origi in the game
Greg_YNWA1,Sun Feb 28 23:25:42 IST 2016,origi hendo doubt ever happen will continu cater lfc captain
Greg_YNWA1,Sun Feb 28 23:24:28 IST 2016,right
Greg_YNWA1,Sun Feb 28 23:22:15 IST 2016,get origi jurgen
Greg_YNWA1,Sun Feb 28 23:20:22 IST 2016,rememb moment lfc equal sterl miss easi chanc get trophi
Greg_YNWA1,Sun Feb 28 23:19:14 IST 2016,trust i biggest critic brutal watch season
