username,time,tweet
smsailor_,Tue Mar 01 05:29:37 IST 2016,are you following us on snapchat hootsuite get a behind-the-scenes look at what is happening at the nest  
smsailor_,Tue Mar 01 05:28:37 IST 2016,how gopro does contentmarketing thatll make you say wow  
smsailor_,Tue Mar 01 05:14:45 IST 2016,can you solve this emojiriddle hint tv show |👩🏻👩🏼👩🏼👦🏻👦🏻👦🏻🗽☕️
smsailor_,Tue Mar 01 04:59:33 IST 2016,how social media education empowers the next generation of marketers  
smsailor_,Tue Mar 01 04:13:29 IST 2016,goretexna has pioneered performance outdoor gear and now branded adventure magazines  
smsailor_,Tue Mar 01 03:29:25 IST 2016,3 insights about advocate marketing and how you can start  
smsailor_,Tue Mar 01 03:28:29 IST 2016,venture capital firm firstround has 9 magazines heres why  
smsailor_,Tue Mar 01 02:59:40 IST 2016,be that person that shares awesome gifs a guide to everything gifs  
smsailor_,Tue Mar 01 02:29:42 IST 2016,youtube has a new tool for blurring moving objects  via mashable choicecontent 
smsailor_,Tue Mar 01 02:13:38 IST 2016,content sutra ep 7 brennermichael on the future of contentmarketing  
smsailor_,Tue Mar 01 02:13:37 IST 2016,bradtonoff keep your eyes peeled for an invite this week 👀
smsailor_,Tue Mar 01 02:05:12 IST 2016,snapchat featured behind-the-scenes oscars coverage on the web 
smsailor_,Tue Mar 01 01:59:38 IST 2016,create your own images for social media with this 15 reliable resources  
smsailor_,Tue Mar 01 00:59:32 IST 2016,keywords you should be monitoring on social media to protect your brand  
smsailor_,Tue Mar 01 00:49:32 IST 2016,pinterest roulette i tried to use the social network for outfit inspiration  
smsailor_,Tue Mar 01 00:19:55 IST 2016,how exclamation points can help you score a date 
smsailor_,Tue Mar 01 00:13:37 IST 2016,the marketing strategy for each presidential campaign analyzed by swag  
smsailor_,Mon Feb 29 23:59:43 IST 2016,writing resources for a heavy week of content  
smsailor_,Mon Feb 29 23:43:44 IST 2016,rt cerosdotcom join raptmedia contently  cerosdotcom as we talk interactivecontent rsvp … 
smsailor_,Mon Feb 29 23:14:03 IST 2016,for the worlds largest retailer reaching the right audience is harder than expected  
smsailor_,Mon Feb 29 22:59:55 IST 2016,have you ever tweeted a customer service complaint those days might be over  
smsailor_,Mon Feb 29 22:04:49 IST 2016,mark zuckerberg sets record straight on orwellian pic of him and his vr army  
smsailor_,Mon Feb 29 21:59:26 IST 2016,the beginner’s guide to social media metrics  
smsailor_,Mon Feb 29 21:58:37 IST 2016,infographic how the best brands use snapchat  
smsailor_,Mon Feb 29 20:59:39 IST 2016,becoming an entrepreneur might not be as risky as you thought  on entrepreneur 
smsailor_,Mon Feb 29 20:49:52 IST 2016,snapchat apologizes for employee payroll data leak after phishing attack 
smsailor_,Mon Feb 29 20:30:11 IST 2016,social media news you need to know  february 2016 roundup 
smsailor_,Mon Feb 29 20:13:58 IST 2016,video how contentmarketing roi works  
smsailor_,Mon Feb 29 19:59:35 IST 2016,every social team is different but there are certain roles you need to be successful  
smsailor_,Mon Feb 29 18:58:34 IST 2016,print magazines are making a comeback—thanks to ambitious brands  
smsailor_,Mon Feb 29 17:59:26 IST 2016,3 reasons why your ceo can’t afford to not to be on social  via fastcompany choicecontent 
smsailor_,Mon Feb 29 17:58:32 IST 2016,the most interesting influencer in the world  
smsailor_,Mon Feb 29 16:58:36 IST 2016,successful brand editors know that good content isnt glorified marketing copy  
smsailor_,Mon Feb 29 15:59:50 IST 2016,how can facebook make you smarter you say just look at these 16 accounts  
smsailor_,Mon Feb 29 15:43:27 IST 2016,sumomes genius tool could give you tons of free traffic  
smsailor_,Mon Feb 29 14:43:26 IST 2016,the big reason it might be time to quit your job  
smsailor_,Mon Feb 29 14:29:29 IST 2016,why facebook’s latest move is a survival tip for us all  invoker for linkedinpulse 
smsailor_,Mon Feb 29 13:59:33 IST 2016,11 ways to use social data to prove the roi of your social media efforts  
smsailor_,Mon Feb 29 13:43:57 IST 2016,everything you ever wanted to know about contentmarketing  
smsailor_,Mon Feb 29 12:59:26 IST 2016,how to keep up with trends by using twitter for business  
smsailor_,Mon Feb 29 12:43:34 IST 2016,how uber  airbnb  buffer use contentmarketing to drive their crazy growth  
smsailor_,Mon Feb 29 10:59:38 IST 2016,how to keep your branding consistent on social  via inc choicecontent 
smsailor_,Mon Feb 29 10:13:39 IST 2016,youll never think of sticky content the same way again  
smsailor_,Mon Feb 29 09:29:25 IST 2016,social roi toolkit  strategies for measuring and improving your social roi 
smsailor_,Mon Feb 29 08:59:52 IST 2016,9 social media etiquette rules everyone should know  
smsailor_,Mon Feb 29 08:28:42 IST 2016,the real problem with contextualized marketing  
smsailor_,Mon Feb 29 07:29:24 IST 2016,still not convinced of the value of social ads  give it a try with this beginners guide 
smsailor_,Mon Feb 29 07:01:19 IST 2016,what is social media doing to our brains a lot  
smsailor_,Mon Feb 29 06:41:36 IST 2016,what happened to abercrombies risky contentmarketing  
smsailor_,Mon Feb 29 04:57:31 IST 2016,fallen into a facebook like rut heres how to get out of it  
