username,time,tweet
Purplefreak_88,Sun Sep 01 05:29:59 IST 2013,i feel bond develop hope feel correct
Purplefreak_88,Sun Sep 01 05:28:56 IST 2013,sleepi
Purplefreak_88,Sun Sep 01 05:27:58 IST 2013,this weather got feel
Purplefreak_88,Sat Aug 31 03:38:09 IST 2013,gimmi likkl one drop
Purplefreak_88,Sat Aug 31 03:37:55 IST 2013,when yu readi come get nah nah nah nah
Purplefreak_88,Sat Aug 31 01:35:13 IST 2013,i ode hot sas crise
Purplefreak_88,Sat Aug 31 01:34:21 IST 2013,rt relationship end soon peopl stop put effort keep win
Purplefreak_88,Sat Aug 31 01:32:44 IST 2013,happi time happi time
Purplefreak_88,Sat Aug 31 01:21:07 IST 2013,the impress ppl give
Purplefreak_88,Sat Aug 31 01:17:54 IST 2013,i need switch asap
Purplefreak_88,Sat Aug 31 01:17:27 IST 2013,i tire n poor servic
Purplefreak_88,Sat Aug 31 01:16:27 IST 2013,where day go
Purplefreak_88,Sat Aug 31 01:08:05 IST 2013,rt when i younger i use draw sun corner paper alway
Purplefreak_88,Thu Aug 29 20:41:42 IST 2013,rt goodmorn
Purplefreak_88,Thu Aug 29 08:49:10 IST 2013,feel sleepi
Purplefreak_88,Thu Aug 29 01:13:37 IST 2013,cyaa believ i mek dis rain ketch mi pon di road i needa home bed
Purplefreak_88,Wed Aug 28 20:13:18 IST 2013,look
Purplefreak_88,Wed Aug 28 18:18:19 IST 2013,dem kill yu dead
Purplefreak_88,Wed Aug 28 12:55:53 IST 2013,twin babi cover photo
Purplefreak_88,Wed Aug 28 12:54:58 IST 2013,mi ah tell yu
Purplefreak_88,Wed Aug 28 12:54:18 IST 2013,suh earli kool haffi hustl fi weh wi want fi real
Purplefreak_88,Wed Aug 28 12:51:25 IST 2013,mi ah come man mi tell yu fi walk back
Purplefreak_88,Wed Aug 28 12:50:21 IST 2013,mi nuh sleep yet
Purplefreak_88,Wed Aug 28 12:48:51 IST 2013,head back hurt
Purplefreak_88,Wed Aug 28 12:43:18 IST 2013,n kno i tri i might fall asleep i interest
Purplefreak_88,Wed Aug 28 12:40:04 IST 2013,so superman way let see magic work
Purplefreak_88,Wed Aug 28 12:38:55 IST 2013,lml
Purplefreak_88,Wed Aug 28 12:37:47 IST 2013,hurri yu com lol
Purplefreak_88,Wed Aug 28 12:35:19 IST 2013,aww thank close eye sleep later flip open lol mi tri p
Purplefreak_88,Wed Aug 28 12:33:28 IST 2013,now i feel like eat nah tek dem bad habit deh
Purplefreak_88,Wed Aug 28 12:30:14 IST 2013,massa hav yu way mi stress think way
Purplefreak_88,Wed Aug 28 12:28:56 IST 2013,tri chang avi time n nah chang
Purplefreak_88,Wed Aug 28 12:26:44 IST 2013,lol dream mesh thought weh yaa tink bout suh
Purplefreak_88,Wed Aug 28 12:21:27 IST 2013,u sleep
Purplefreak_88,Wed Aug 28 12:18:09 IST 2013,at night i sleep
Purplefreak_88,Wed Aug 28 11:58:43 IST 2013,god i gonna trust
Purplefreak_88,Wed Aug 28 11:54:17 IST 2013,i sure i want turn
Purplefreak_88,Wed Aug 28 11:53:22 IST 2013,rt i okay i smile
Purplefreak_88,Wed Aug 28 08:24:52 IST 2013,that moment kno next move
Purplefreak_88,Wed Aug 28 08:21:02 IST 2013,i straight frustrat wtf happen
Purplefreak_88,Tue Aug 27 20:53:06 IST 2013,this becom unbeliev
Purplefreak_88,Tue Aug 27 07:04:27 IST 2013,kmt miser rn
Purplefreak_88,Tue Aug 27 06:50:27 IST 2013,i confus tire
Purplefreak_88,Tue Aug 27 06:28:03 IST 2013,why i sleep i wanna sometim
Purplefreak_88,Tue Aug 27 06:24:47 IST 2013,been long ass day sooo tire shhessh
Purplefreak_88,Mon Aug 26 19:54:05 IST 2013,don feel like anyth today thing need done
Purplefreak_88,Mon Aug 26 19:53:10 IST 2013,wait pill work
Purplefreak_88,Mon Aug 26 19:52:09 IST 2013,rememb make today count
Purplefreak_88,Mon Aug 26 19:51:35 IST 2013,up grate attitud
Purplefreak_88,Mon Aug 26 19:50:58 IST 2013,morn twitter
