username,time,tweet
FHS_BBALL,Sun Sep 01 05:29:52 IST 2013,win take care everyth time chang cultur believefayettevill
FHS_BBALL,Thu Aug 29 08:19:48 IST 2013,a say said true mean strength measur tough believefayettevill
FHS_BBALL,Tue Aug 27 07:33:58 IST 2013,we play ravenwood hs play day sat novemb team time come soon
FHS_BBALL,Mon Aug 26 03:32:01 IST 2013,play watertown hs cascad hs forrest thanksgiv classic also collinwood summertown fayett academi s town x mas classic
FHS_BBALL,Thu Aug 22 23:58:17 IST 2013,tbt first year varsiti team
FHS_BBALL,Thu Aug 22 07:13:48 IST 2013,success measur talent hard work determin unselfish teamwork
FHS_BBALL,Tue Aug 20 17:58:05 IST 2013,you tell lot team competit natur
FHS_BBALL,Sat Aug 17 05:28:07 IST 2013,rt war come go soldier stay etern brotherhood
FHS_BBALL,Sat Aug 17 05:28:02 IST 2013,be strong fast smart play hard tonight footbal jambore basketbal famili
FHS_BBALL,Sat Aug 10 06:50:35 IST 2013,summer
FHS_BBALL,Fri Aug 09 00:34:03 IST 2013,tough team
FHS_BBALL,Mon Aug 05 07:01:52 IST 2013,tomorrow start new year goal reach teamwork famili like atmospher year tiger cam
FHS_BBALL,Sun Aug 04 03:26:30 IST 2013,fhs dive board dunk
FHS_BBALL,Sat Aug 03 06:58:58 IST 2013,first scrimmag
FHS_BBALL,Fri Aug 02 16:10:01 IST 2013,refus averag
FHS_BBALL,Wed Jul 24 01:10:29 IST 2013,happi birthday team member
FHS_BBALL,Fri Jul 12 21:04:10 IST 2013,wish happi birthday
FHS_BBALL,Fri Jul 12 17:13:36 IST 2013,enter narrow gate for wide gate broad road lead destruct mani enter
FHS_BBALL,Thu Jul 11 17:38:15 IST 2013,no one said go easi
FHS_BBALL,Thu Jul 11 06:36:31 IST 2013,did get jump shot tweet did run sprint tweet separ averag
FHS_BBALL,Sat Jul 06 02:36:25 IST 2013,new floor finish grindhous
FHS_BBALL,Wed Jul 03 20:39:59 IST 2013,new floor almost done just need finish
FHS_BBALL,Mon Jul 01 21:12:16 IST 2013,new floor almost complet
FHS_BBALL,Fri Jun 21 03:17:32 IST 2013,progress new floor
FHS_BBALL,Fri Jun 21 02:50:05 IST 2013,good day mchs we play shelbyvill dickson counti come victori tomorrow got mchs forrest
FHS_BBALL,Fri Jun 21 02:36:56 IST 2013,team meal burger king summer camp basketbal burger king
FHS_BBALL,Tue Jun 18 22:11:01 IST 2013,sand complet
FHS_BBALL,Fri Jun 14 05:48:31 IST 2013,old floor come new floor go grindhous
FHS_BBALL,Thu Jun 13 06:48:37 IST 2013,after camp tiger went went eaglevill place belmont tournament loss hl dl dca ba sparkman lighthous
FHS_BBALL,Wed Jun 12 07:13:53 IST 2013,team bond la fuent watch heat game
FHS_BBALL,Mon Jun 10 08:13:43 IST 2013,tiger went today belmont camp tourney only loss came huntsvill sparkman alabama state runner last year
FHS_BBALL,Sat Jun 08 21:58:13 IST 2013,great video work hard realli
FHS_BBALL,Sat Jun 08 20:29:28 IST 2013,tiger went eaglevill team camp week next belmont team camp marshal counti team camp
FHS_BBALL,Fri May 24 22:40:00 IST 2013,congratul skylar mcdonald win a aa women tssaa tenni state championship
FHS_BBALL,Wed May 22 21:05:23 IST 2013,congratul kendrel hall today receiv honor
FHS_BBALL,Fri Mar 08 22:59:10 IST 2013,michael park c highlight tape
FHS_BBALL,Fri Mar 08 10:18:18 IST 2013,nick hopkin pg class end season highlight
FHS_BBALL,Tue Feb 26 02:51:17 IST 2013,jame keith fayettevill high school tn highlight tape more fhs player highlight come soon
FHS_BBALL,Sat Jan 26 10:52:16 IST 2013,big win tonight fhs tiger mtcs great team effort clutch play made night gritngrind ictough grindhous
FHS_BBALL,Sun Jan 13 09:52:47 IST 2013,brother love
FHS_BBALL,Fri Jan 11 07:54:12 IST 2013,come grindhous watch tiger take eaglevill
FHS_BBALL,Sun Jan 06 02:17:59 IST 2013,aaron park jumper last night
FHS_BBALL,Sat Jan 05 09:24:08 IST 2013,rt goood team win tonight ictough
FHS_BBALL,Sat Jan 05 09:23:14 IST 2013,the tiger pick win tonight vers forrest great atmospher band play larg crowd
FHS_BBALL,Sat Jan 05 00:00:08 IST 2013,just post photo
FHS_BBALL,Wed Jan 02 09:37:59 IST 2013,that i call ankl breaker nichola hopkin
FHS_BBALL,Wed Dec 12 09:16:38 IST 2012,bucket tonight tiger get win
FHS_BBALL,Sat Dec 08 10:10:48 IST 2012,go strong rim tonight
FHS_BBALL,Sat Dec 08 09:52:26 IST 2012,thank everyon came grind hous tonight cheer tiger w
FHS_BBALL,Sat Dec 01 10:48:55 IST 2012,game win shot aaron park
