username,time,tweet
pastorredharper,Sat Sep 01 05:29:50 IST 2012,i am a blessed man the longer i live the my god proves his faithfulness to me
pastorredharper,Thu Aug 30 18:09:06 IST 2012,lukes loving it 
pastorredharper,Sun Aug 05 11:49:36 IST 2012, thankful for the protrction of the lord
pastorredharper,Fri Jul 20 11:55:25 IST 2012,safe in securing grandpas arms   via st
pastorredharper,Fri Jul 20 03:10:40 IST 2012,safe in securing grandpas arms  
pastorredharper,Sun Jul 08 09:07:13 IST 2012, i am a blessed i am a blessed man to have such good family
pastorredharper,Wed Jul 04 02:03:26 IST 2012,check out the premium business cards i created with vistaprint  
pastorredharper,Mon Jun 25 11:34:25 IST 2012,rt  my comfort is not my compose -will harper
pastorredharper,Thu Jun 07 03:06:34 IST 2012,in hospital everything seem to be out of wack bad infection sugar high cant stop shking please pray
pastorredharper,Fri Mar 16 08:32:44 IST 2012,  via 
pastorredharper,Tue Mar 06 02:00:09 IST 2012,check out my travel site at 
pastorredharper,Tue Mar 06 01:55:18 IST 2012,check out this hotel at 
pastorredharper,Tue Mar 06 01:50:48 IST 2012,check out this hotel at 
pastorredharper,Sat Feb 25 12:04:07 IST 2012,about ytb » ytb pulse  via 
pastorredharper,Sat Feb 18 10:41:02 IST 2012,rhema homecomming i will be there
pastorredharper,Wed Feb 15 12:13:54 IST 2012,the coming restoration  via 
pastorredharper,Sat Feb 11 13:36:55 IST 2012,3 reasons students are leaving the church after graduation  via 
pastorredharper,Tue Jan 31 19:03:28 IST 2012,well i went to the enemies camp and took back what he stole from me
pastorredharper,Tue Jan 31 06:33:47 IST 2012,i miss my family
pastorredharper,Tue Jan 31 02:19:08 IST 2012,still in the hospital out mabe tomorrow
pastorredharper,Sun Jan 29 00:10:59 IST 2012,still n hospital thx 4 ur prayers
pastorredharper,Thu Jan 26 03:58:09 IST 2012,i miss my grandkids
pastorredharper,Tue Jan 24 17:48:34 IST 2012,dont let unforgiveness entrap you let the love of ur god flow
pastorredharper,Mon Jan 23 10:20:25 IST 2012,  via  need exta money check this helped me
pastorredharper,Sat Jan 21 11:19:09 IST 2012,disney cruise line- adults  via 
pastorredharper,Sat Jan 21 11:13:33 IST 2012,disney cruise line- family  via 
pastorredharper,Thu Jan 12 08:26:04 IST 2012,snow is way over rated
pastorredharper,Tue Oct 25 01:38:54 IST 2011,  via 
pastorredharper,Fri Oct 21 20:36:16 IST 2011,had great time of fun n fellowship last nite at my sons pumkin fire snores kid n adults fun
pastorredharper,Mon Oct 17 00:28:06 IST 2011,what a good service this morn at church of the harvest stillwater campus
pastorredharper,Sat Oct 08 01:04:32 IST 2011,check out my travel site good deals at ytbtravelcom/redharper
pastorredharper,Fri Oct 07 08:40:06 IST 2011, what a great pic i love this little feller 
pastorredharper,Wed Sep 28 00:56:10 IST 2011,  via 
pastorredharper,Mon Sep 12 02:02:27 IST 2011,broke my knee caps cant drive not good
pastorredharper,Thu Aug 25 05:56:24 IST 2011,god has blessed me with the grdatest daughter n law happy bithday mel
pastorredharper,Wed Aug 24 03:19:17 IST 2011,i love my son god speaks tn me thru him
pastorredharper,Mon Aug 15 02:36:50 IST 2011,what a move of god we had at church of the harvest instilly this morn
pastorredharper,Mon Aug 15 02:35:25 IST 2011,it was such a blessing to here my son and his wife and his sister n law minister this morning way to go pastors will and melissa
pastorredharper,Mon Jul 25 00:10:52 IST 2011,congrats pastors will  mellisa harper you bring honer to our family
pastorredharper,Sun Jul 24 23:57:35 IST 2011,today anouther prayer answered
pastorredharper,Mon Jul 04 23:33:50 IST 2011,happy independance day enjoy your freedoms alot of men and women gave there lifes so you can be free
pastorredharper,Wed Jun 29 01:09:15 IST 2011,you may not always understand gods  leading and it may not make sence to you but you can trust him he does know what hes doing
pastorredharper,Wed Jun 29 01:05:55 IST 2011,god has so blessed me with an amazing family i am amazed with his faithfulness  obediance is better than sacrifice what a good god
pastorredharper,Tue Jun 21 00:27:59 IST 2011,chrislam starts to spread in america 
pastorredharper,Sun Jun 19 20:24:58 IST 2011,id like to thank my son for the honor he brings our family i am so proud of him
pastorredharper,Thu May 26 23:25:09 IST 2011,go miami
pastorredharper,Mon May 16 21:10:11 IST 2011,still in the hospital lungs in a mess
pastorredharper,Sun May 15 18:06:20 IST 2011,still in hospital lungs just wont clear miss my fam
pastorredharper,Sat May 14 19:58:57 IST 2011,still in the hospital shure miss my grandchildren bad miss my fam also getting better though
pastorredharper,Fri May 13 21:09:32 IST 2011,still in hospital thank you lord for your provition thanks also for all your prayer
