username,time,tweet
chrisbell33,Thu Sep 01 05:29:29 IST 2011,welcom back ranger matt treanor
chrisbell33,Tue Aug 30 09:03:44 IST 2011,rt let revis popular phrase world way sent
chrisbell33,Sat Aug 27 08:35:55 IST 2011,great time friend tonight we go miss guy
chrisbell33,Fri Aug 26 06:23:26 IST 2011,ranger here go
chrisbell33,Thu Aug 25 07:08:52 IST 2011,serious come ranger
chrisbell33,Wed Aug 24 08:18:43 IST 2011,good grief put fork ranger done
chrisbell33,Wed Aug 24 06:45:43 IST 2011,look littl better
chrisbell33,Wed Aug 24 06:28:06 IST 2011,not ranger night wow
chrisbell33,Mon Aug 22 01:01:08 IST 2011,not look like day chicago
chrisbell33,Sun Aug 21 18:10:51 IST 2011,rt we sin must quarrel god friend j c ryle
chrisbell33,Fri Aug 19 05:55:49 IST 2011,rt when forgiv mean absorb loss debt you bear all forgiv cost
chrisbell33,Thu Aug 18 10:08:30 IST 2011,rt you never need god suppli j i packer
chrisbell33,Thu Aug 18 07:36:25 IST 2011,happi ride motorcycl home rain tonight prais the lord
chrisbell33,Fri Aug 12 19:57:54 IST 2011,my youngest son social butterfli ask dad use lol i realiz social media lingo age limit
chrisbell33,Sat Aug 06 09:57:25 IST 2011,congrat bro
chrisbell33,Fri Aug 05 19:40:10 IST 2011,the lord safe place away trial the lord he himself safe place midst trial matt
chrisbell33,Wed Aug 03 07:04:27 IST 2011,rt so i rais debt ceil end crisi
chrisbell33,Thu Jul 28 11:13:30 IST 2011,rip john r w stott april juli pastor author the cross christ
chrisbell33,Wed Jul 27 22:15:19 IST 2011,rt real slaveri live life tri gain favor real freedom live life alreadi favor
chrisbell33,Wed Jul 27 22:14:42 IST 2011,rt preach gospel everi day mean work god alreadi work
chrisbell33,Wed Jul 27 22:10:12 IST 2011,studi obamacar cost grossli underestim onenewsnow com i want rude i say realli
chrisbell33,Wed Jul 27 07:13:41 IST 2011,rt accord scriptur everi christian join church
chrisbell33,Tue Jul 26 21:50:30 IST 2011,he use thought men brain prove brain c h spurgeon
chrisbell33,Tue Jul 26 21:08:16 IST 2011,michael lawrenc prayer sermon prepar via
chrisbell33,Tue Jul 26 08:23:48 IST 2011,infin commerci if one ever challeng status quo earth would still flat huh these peopl wash dc
chrisbell33,Tue Jul 26 07:02:50 IST 2011,charl krautham obama address i thought i cynic i heard speech now funni
chrisbell33,Tue Jul 26 06:54:49 IST 2011,well said speaker boehner
chrisbell33,Tue Jul 26 06:35:33 IST 2011,unbeliev the first thing obama blame bush leadership polit now back game
chrisbell33,Mon Jul 25 09:25:09 IST 2011,rt all theolog separ christ vain confus also mad deceit spurious calvin
chrisbell33,Sun Jul 24 08:49:50 IST 2011,way go ranger walk win
chrisbell33,Sat Jul 23 09:33:30 IST 2011,on elect leader unwilling make tough decis career kill us sen tom coburn amen getseriousincongress
chrisbell33,Sat Jul 23 09:22:09 IST 2011,complet mission imag via
chrisbell33,Sat Jul 23 08:54:30 IST 2011,rt book everi preacher should read
chrisbell33,Fri Jul 22 03:41:59 IST 2011,tough loss ranger c j pitch angel ace throw hit complet game lose wash would say that basebal go
chrisbell33,Tue Jul 19 05:07:31 IST 2011,that good
chrisbell33,Tue Jul 19 02:22:21 IST 2011,time
chrisbell33,Sun Jul 17 04:50:44 IST 2011,you know hot side pillow even cool kristin comed wife meltinginok
chrisbell33,Sun Jul 17 03:13:04 IST 2011,build right church depend use wrong peopl david platt radic togeth
chrisbell33,Sat Jul 16 20:24:50 IST 2011,lord let make differ utter disproportion i via
chrisbell33,Wed Jul 13 08:11:28 IST 2011,now wash go pull cj come man
chrisbell33,Wed Jul 13 08:06:19 IST 2011,wow cliff lee got pull all star game mccarver must jinx talk rare mistak go al all star
chrisbell33,Wed Jul 13 03:54:30 IST 2011,believ i place degre rain oklahoma
chrisbell33,Tue Jul 12 23:23:06 IST 2011,luther five action struggl believ
chrisbell33,Mon Jul 11 18:21:06 IST 2011,rt the gospel announc victori accomplish cross mere made possibl amen
chrisbell33,Mon Jul 11 11:34:45 IST 2011,martyn lloyd jone video interview via
chrisbell33,Sun Jul 10 08:34:35 IST 2011,ranger win hamilton walk home run
chrisbell33,Thu Jul 07 08:31:19 IST 2011,strike out game sweep way go ranger
chrisbell33,Thu Jul 07 08:01:56 IST 2011,the ogando work tonight
chrisbell33,Tue Jul 05 22:50:09 IST 2011,jesus christ must everi sermon christian mark driscol
chrisbell33,Tue Jul 05 05:57:40 IST 2011,congrat ranger all star
