username,time,tweet
GStamatas,Sun Sep 01 05:29:44 IST 2013,the secret genius carri spirit child old age mean never lose enthusiasm aldous huxley
GStamatas,Wed Aug 14 00:12:46 IST 2013,he think littl err much leonardo da vinci
GStamatas,Tue Jul 23 08:17:13 IST 2013,america want
GStamatas,Mon Jul 08 04:01:16 IST 2013,how i go forward i know way i face john lennon
GStamatas,Mon May 27 04:00:29 IST 2013,status quo know latin mess ronald reagan
GStamatas,Wed May 22 17:41:39 IST 2013,i drink make peopl interest ernest hemingway
GStamatas,Tue May 21 05:03:34 IST 2013,what know drop know ocean isaac newton
GStamatas,Fri Apr 19 06:19:04 IST 2013,to great right littl wrong william shakespear
GStamatas,Sun Apr 14 19:21:09 IST 2013,tripl
GStamatas,Sun Apr 14 19:21:03 IST 2013,i free prejudic i hate everyon equal w c field
GStamatas,Thu Apr 11 07:51:54 IST 2013,to great champion must believ best if your pretend muhammad ali
GStamatas,Wed Mar 20 17:32:07 IST 2013,never argu idiot they drag level beat experi edward murphi
GStamatas,Wed Mar 20 05:15:33 IST 2013,if i eight hour chop tree i spend six hour sharpen axe abraham lincoln
GStamatas,Fri Mar 15 17:34:37 IST 2013,don critic understand bob dylan
GStamatas,Tue Mar 12 22:43:45 IST 2013,get in that ass larri via
GStamatas,Tue Mar 05 05:01:26 IST 2013,the good old time time old good lord byron
GStamatas,Tue Feb 26 06:33:53 IST 2013,keep face alway toward sunshin shadow fall behind walt whitman
GStamatas,Thu Feb 21 04:24:20 IST 2013,have ever notic anybodi drive slower idiot anyon go faster maniac georg carlin
GStamatas,Fri Feb 15 19:00:02 IST 2013,anticip difficult manag easi lao tzu
GStamatas,Wed Feb 06 23:32:13 IST 2013,muscl shoal offici trailer via
GStamatas,Wed Feb 06 21:14:26 IST 2013,human behavior flow three main sourc desir emot knowledg plato
GStamatas,Wed Jan 30 04:22:44 IST 2013,thing matter must never merci thing matter least goeth
GStamatas,Thu Jan 24 01:23:45 IST 2013,senorita spanish rose wipe eye blow nose uptown harlem throw rose to lucki young matador
GStamatas,Tue Jan 22 23:09:45 IST 2013,georg carlin save planet via
GStamatas,Sun Jan 20 02:48:59 IST 2013,anthoni wayn headquart marker
GStamatas,Sun Jan 06 23:14:26 IST 2013,complet trilog
GStamatas,Sun Jan 06 23:12:39 IST 2013,import wake togeth time
GStamatas,Mon Aug 13 11:20:15 IST 2012,i love dropbox easi use sync devic
GStamatas,Mon Jun 18 07:47:32 IST 2012,in harold katz sank sixer they still recov via
GStamatas,Sat Jun 09 23:38:30 IST 2012,lamb chop balsam reduct
GStamatas,Fri Mar 09 05:07:34 IST 2012,dee oatmeal pancak via
GStamatas,Fri Mar 09 05:04:46 IST 2012,dutch babi via
GStamatas,Fri Mar 09 04:51:11 IST 2012,kale sausag white bean simpli recip
GStamatas,Sat Mar 03 22:43:50 IST 2012,linkedin
GStamatas,Tue Feb 28 10:00:21 IST 2012,alway stuff need account free
GStamatas,Tue Jan 03 23:53:39 IST 2012,logorama
GStamatas,Tue Jan 03 09:31:27 IST 2012,i enter win playstat thank click here
GStamatas,Mon Dec 12 18:47:20 IST 2011,meet sooooooooo bore
GStamatas,Fri Dec 09 09:04:20 IST 2011,big deal
GStamatas,Fri Dec 09 08:41:57 IST 2011,first offic tweet look world
