username,time,tweet
eagleed,Tue Mar 22 05:29:59 IST 2016,cool ur teh seri still month cemcq colleg group studi
eagleed,Mon Mar 21 19:06:14 IST 2016,group want your wild idea new york state pavilion via
eagleed,Sun Mar 20 19:04:18 IST 2016,live periscop servic palm behind scene cemcq queen
eagleed,Sat Mar 19 18:02:59 IST 2016,hi good celebr today i prepar event close psalm
eagleed,Sat Mar 19 14:40:56 IST 2016,hey i went stargaz stop secur glad got right direct went back periscop stargaz
eagleed,Fri Mar 18 23:03:04 IST 2016,live periscop this place exhibit ny
eagleed,Fri Mar 18 22:39:01 IST 2016,live periscop outsid bklyn museum gaze
eagleed,Thu Mar 17 01:37:37 IST 2016,film appl soho yesturday
eagleed,Wed Mar 16 23:42:49 IST 2016,euromaestro periscop kayvon hous euro euroscop fb
eagleed,Wed Mar 16 21:14:28 IST 2016,live periscop quick scope thought queen ny memori flush
eagleed,Wed Mar 16 21:11:59 IST 2016,lol hey clair u upgrad android lol focus need p
eagleed,Sun Mar 13 23:25:13 IST 2016,live periscop queen museum
eagleed,Sun Mar 13 22:29:08 IST 2016,live periscop cemcq
eagleed,Sun Mar 13 20:07:19 IST 2016,nycfirst periscop nyc region the pit
eagleed,Sun Mar 13 19:00:12 IST 2016,order servic
eagleed,Sun Mar 13 18:59:07 IST 2016,deck rememb famili far wide
eagleed,Sun Mar 13 18:57:05 IST 2016,watch periscop sunday servic old home
eagleed,Thu Mar 10 20:18:03 IST 2016,mtv union squar film katch
eagleed,Wed Mar 09 23:08:26 IST 2016,live periscop live prank mtv film shoot
eagleed,Tue Mar 08 20:48:54 IST 2016,live periscop warm day highlin
eagleed,Tue Mar 08 04:26:20 IST 2016,i go tonit crowd
eagleed,Mon Mar 07 21:03:03 IST 2016,bymrmatthew periscop stun aerial view amsterdam godzillascop
eagleed,Mon Mar 07 19:26:35 IST 2016,live periscop spring air ny
eagleed,Sun Mar 06 21:16:52 IST 2016,live periscop go away
eagleed,Sun Mar 06 02:46:56 IST 2016,live periscop innov nyc
eagleed,Sat Mar 05 23:10:32 IST 2016,live periscop fishi love
eagleed,Fri Mar 04 01:37:46 IST 2016,live periscop virtual american museum map
eagleed,Mon Feb 29 20:07:49 IST 2016,gif now
eagleed,Fri Feb 26 02:06:43 IST 2016,live periscop live paint
eagleed,Fri Feb 26 01:39:20 IST 2016,live periscop live photo rooklynmuseum
eagleed,Thu Feb 25 01:54:41 IST 2016,live periscop multi screen short
eagleed,Wed Feb 24 21:23:09 IST 2016,katch samsung new store near highlin street open day
eagleed,Wed Feb 24 21:21:39 IST 2016,katch near highlin
eagleed,Wed Feb 24 04:53:23 IST 2016,live periscop creat augment app
eagleed,Tue Feb 23 21:47:11 IST 2016,live periscop samsung new store product vr
eagleed,Tue Feb 23 21:39:58 IST 2016,live periscop coolest place
eagleed,Tue Feb 23 00:47:44 IST 2016,actual exil kngs cross attend near church hope come day newlif connect water
eagleed,Tue Feb 23 00:44:45 IST 2016,interest nto sure u mean tho
eagleed,Mon Feb 22 23:36:02 IST 2016,live periscop brooklyn lib
eagleed,Mon Feb 22 22:30:58 IST 2016,spoke psalm i tell
eagleed,Mon Feb 22 22:29:15 IST 2016,i listen robert sermon yesturday could use av ad note
eagleed,Mon Feb 22 19:23:06 IST 2016,thank i share friend area mayb mutual aquant
eagleed,Mon Feb 22 18:49:37 IST 2016,memori nps u ur time
eagleed,Mon Feb 22 02:11:27 IST 2016,albert seeker
eagleed,Mon Feb 22 00:44:28 IST 2016,u miss servic interest day weekend tech
eagleed,Sun Feb 21 21:58:43 IST 2016,hey albert wong ame today said hi prob oldschool
eagleed,Sun Feb 21 20:39:29 IST 2016,live periscop ch unesc evangel mission queen hi church
eagleed,Sun Feb 21 04:13:17 IST 2016,live periscop art queen museum worldsfair site
