username,time,tweet
aliciahnaomi,Tue Mar 01 05:29:34 IST 2016,hairdryer blow heat element day leav appar worth repair time go
aliciahnaomi,Tue Mar 01 04:02:13 IST 2016,light shadow mercuri umbra ring glow afternoon sun photo
aliciahnaomi,Mon Feb 29 02:24:33 IST 2016,ruin ring heavi deepli erod signet style ring sterlingsilv captur
aliciahnaomi,Sat Feb 27 05:15:37 IST 2016,alicia hannah naomi collect presen voidshowroom march
aliciahnaomi,Fri Feb 26 13:01:16 IST 2016,from last year tiffani bespok aliciahannahnaomi yellow gold grey
aliciahnaomi,Thu Feb 25 11:08:01 IST 2016,well someon got uber puppi
aliciahnaomi,Thu Feb 25 08:56:08 IST 2016,i sad i come sat night
aliciahnaomi,Thu Feb 25 07:38:05 IST 2016,i keep tri start upset
aliciahnaomi,Thu Feb 25 07:24:58 IST 2016,
aliciahnaomi,Thu Feb 25 07:20:49 IST 2016,has anybodi gotten an uber puppi yet
aliciahnaomi,Thu Feb 25 07:20:30 IST 2016,across road day job offic it use actual conveni store
aliciahnaomi,Thu Feb 25 06:56:45 IST 2016,i got invit inconveni store i stop i tri visit next monday leav
aliciahnaomi,Thu Feb 25 06:54:08 IST 2016,oh what time dentist appoint two thirti ahahahaha great good laugh no find funni
aliciahnaomi,Thu Feb 25 06:51:26 IST 2016,next week
aliciahnaomi,Thu Feb 25 06:51:22 IST 2016,well amaz
aliciahnaomi,Thu Feb 25 06:29:09 IST 2016,mayb secret puppi email chain
aliciahnaomi,Thu Feb 25 06:19:28 IST 2016,you dedic puppi area did read term condit
aliciahnaomi,Thu Feb 25 06:18:49 IST 2016,we peopl offici approv
aliciahnaomi,Thu Feb 25 06:09:34 IST 2016,what actual fuck
aliciahnaomi,Thu Feb 25 06:08:14 IST 2016,tri coordin puppi cuddl offic much difficult think
aliciahnaomi,Thu Feb 25 02:25:52 IST 2016,uh i mean puppi noth see do not order any puppi there are no puppi for only
aliciahnaomi,Thu Feb 25 02:24:59 IST 2016,uber puppiessssssssssss
aliciahnaomi,Wed Feb 24 12:54:07 IST 2016,willi nelson pigtail tho neverforget
aliciahnaomi,Wed Feb 24 06:37:20 IST 2016,obvious i tri add emoji end tweet it one
aliciahnaomi,Wed Feb 24 06:36:45 IST 2016,oh man eric andr show
aliciahnaomi,Wed Feb 24 02:41:33 IST 2016,i imagin right peopl would one buy ticket
aliciahnaomi,Tue Feb 23 10:43:51 IST 2016,i becom peter potamus did get thing that thing i sent
aliciahnaomi,Tue Feb 23 09:00:41 IST 2016,i mean perspect best attende may invest buy ticket show unknown design
aliciahnaomi,Tue Feb 23 06:48:24 IST 2016,anoth one i stop stare hand l r aliciahannahnaomi murmur ring
aliciahnaomi,Tue Feb 23 06:40:24 IST 2016,i imagin right peopl would one buy ticket
aliciahnaomi,Tue Feb 23 01:26:17 IST 2016,omg
aliciahnaomi,Mon Feb 22 16:56:08 IST 2016,pleas
aliciahnaomi,Mon Feb 22 15:59:49 IST 2016,i obvious love one
aliciahnaomi,Mon Feb 22 15:59:35 IST 2016,human disappoint stop goddamn aw
aliciahnaomi,Mon Feb 22 11:37:21 IST 2016,discount code expir i check it any chanc i could get anoth code
aliciahnaomi,Mon Feb 22 11:11:28 IST 2016,biek verstappen they most beauti scarv i ever saw life
aliciahnaomi,Mon Feb 22 08:56:06 IST 2016,amaz
aliciahnaomi,Mon Feb 22 08:35:57 IST 2016,also realli scarf
aliciahnaomi,Mon Feb 22 08:35:40 IST 2016,when i i bought scarf cost everyon serious offend time expens
aliciahnaomi,Mon Feb 22 08:34:33 IST 2016,when okay buy scarf i mean ordinari scarf hand craft work art that also scarf
aliciahnaomi,Mon Feb 22 08:27:42 IST 2016,oh one
aliciahnaomi,Sun Feb 21 15:26:20 IST 2016,i think mean tahini hummus made chickpea
aliciahnaomi,Sun Feb 21 07:25:40 IST 2016,think i
aliciahnaomi,Sun Feb 21 07:25:25 IST 2016,obvious pain embarrass
aliciahnaomi,Sun Feb 21 07:24:52 IST 2016,don copi rant you entitl explan anyth harass peopl one
aliciahnaomi,Sun Feb 21 07:23:35 IST 2016,mr tyson dark state human today indic hit great filter
aliciahnaomi,Sun Feb 21 07:20:13 IST 2016,oh god pleas aliciahannahnaomi gmail
aliciahnaomi,Sun Feb 21 07:19:20 IST 2016,fuccckkkk dude
aliciahnaomi,Sat Feb 20 15:54:45 IST 2016,i help wonder process hit great filter
aliciahnaomi,Sat Feb 20 15:53:40 IST 2016,these dark fuck time friend
