username,time,tweet
oooh_friend_,Tue Mar 01 05:29:33 IST 2016,his messag cute found i got gf make feel awk around bc like meeeeeeeeeeee
oooh_friend_,Tue Mar 01 04:20:19 IST 2016,rt on averag i get strong good day person might messag music event
oooh_friend_,Tue Mar 01 04:19:16 IST 2016,rt selena gomez vaniti fair oscar parti
oooh_friend_,Tue Mar 01 04:12:53 IST 2016,i think today enough calm
oooh_friend_,Tue Mar 01 04:12:39 IST 2016,fuck arfffffff nah stain yeah noth a walk talk cring
oooh_friend_,Tue Mar 01 04:10:39 IST 2016,billi mick goal
oooh_friend_,Tue Mar 01 04:10:17 IST 2016,not gonna lie billi fuck cute heart cope i want
oooh_friend_,Tue Mar 01 04:09:43 IST 2016,love man made even happier
oooh_friend_,Tue Mar 01 04:09:29 IST 2016,rt i happi hawah i happi anyon els ngl ye mashaallah
oooh_friend_,Tue Mar 01 04:09:20 IST 2016,beyonc got noth and whitney omg wooooow heart goalsssss
oooh_friend_,Tue Mar 01 04:07:06 IST 2016,even abl deni she goal man perf
oooh_friend_,Tue Mar 01 04:05:44 IST 2016,proper fanci ronni though wooooow
oooh_friend_,Mon Feb 29 18:47:55 IST 2016,i bought work i sat cri insid can concentr
oooh_friend_,Mon Feb 29 18:47:04 IST 2016,rt eh ehn tell us mrs person whisper
oooh_friend_,Mon Feb 29 18:46:50 IST 2016,ha ha ha ha bout takin advic
oooh_friend_,Mon Feb 29 18:46:35 IST 2016,never seen lmao
oooh_friend_,Mon Feb 29 18:44:53 IST 2016,why i concentr anyth today
oooh_friend_,Mon Feb 29 16:12:10 IST 2016,and i mean
oooh_friend_,Mon Feb 29 16:11:58 IST 2016,when lectur finish earli everyon els happi except friend hang next class
oooh_friend_,Mon Feb 29 15:29:39 IST 2016,rt kate leo watch accept award best thing i love two
oooh_friend_,Mon Feb 29 15:29:31 IST 2016,rt amanec con esta foto es una gran alegría por fin leonardodicaprio ere el mejor
oooh_friend_,Mon Feb 29 15:29:15 IST 2016,rt it dicaprio fam
oooh_friend_,Mon Feb 29 15:28:33 IST 2016,rt date awkward person less stress you laugh fun improv qualiti life overal health
oooh_friend_,Mon Feb 29 15:19:54 IST 2016,hashtag i wish girl would stop squeal
oooh_friend_,Mon Feb 29 13:45:30 IST 2016,rt thank god
oooh_friend_,Mon Feb 29 13:45:28 IST 2016,rt if leo win deactiv oscar
oooh_friend_,Mon Feb 29 13:45:16 IST 2016,rt im cri
oooh_friend_,Mon Feb 29 13:23:18 IST 2016,woke meant get train obv miss
oooh_friend_,Mon Feb 29 13:22:50 IST 2016,i late though
oooh_friend_,Mon Feb 29 13:22:36 IST 2016,my boy leooooooo woke let watch golden
oooh_friend_,Mon Feb 29 13:07:08 IST 2016,rt leo time know oscar
oooh_friend_,Mon Feb 29 13:06:58 IST 2016,rt inconsist night sleep ive ever think hour ago
oooh_friend_,Mon Feb 29 13:06:52 IST 2016,rt what a time
oooh_friend_,Mon Feb 29 13:06:46 IST 2016,rt kate watch leo speech all feel
oooh_friend_,Mon Feb 29 13:06:42 IST 2016,rt leo wake tomorrow like
oooh_friend_,Mon Feb 29 13:06:12 IST 2016,rt
oooh_friend_,Mon Feb 29 13:05:56 IST 2016,
oooh_friend_,Mon Feb 29 06:21:40 IST 2016,uhhhh
oooh_friend_,Mon Feb 29 06:21:16 IST 2016,rt when ur littl bro get stuck tabl
oooh_friend_,Mon Feb 29 06:20:33 IST 2016,rt you bitch
oooh_friend_,Mon Feb 29 06:20:03 IST 2016,justin bieber lesbian mum hair lmao
oooh_friend_,Mon Feb 29 06:18:59 IST 2016,rt fri food guilti pleasur
oooh_friend_,Mon Feb 29 06:17:01 IST 2016,rt perfect hous three car garag
oooh_friend_,Mon Feb 29 06:16:43 IST 2016,rt yeah
oooh_friend_,Mon Feb 29 06:16:20 IST 2016,he cute sometim
oooh_friend_,Mon Feb 29 06:16:10 IST 2016,rt my friend oscar i lay bed lazi get pee
oooh_friend_,Mon Feb 29 06:15:58 IST 2016,rt current miss someon probabl miss
oooh_friend_,Mon Feb 29 06:15:39 IST 2016,rt
oooh_friend_,Mon Feb 29 06:14:59 IST 2016,i realli use phone much prob lmao
oooh_friend_,Mon Feb 29 06:14:42 IST 2016,last aag mine last almost hour day and one time i went wale last even
