username,time,tweet
Erin__Hart,Thu Sep 01 05:29:39 IST 2011,nanni mcphee the lion king the lion king the lion king half day of summer glee season volum role model
Erin__Hart,Thu Sep 01 05:27:46 IST 2011,shrek third hoodwink kung fu panda uptown girl wall e jersey girl go on over the hedg the pink panther
Erin__Hart,Thu Sep 01 05:25:50 IST 2011,ratatouill charlott web happi feet garfield tail two kitti the santa claus surf up car over the hedg the wild
Erin__Hart,Thu Sep 01 04:37:32 IST 2011,wish i scanner
Erin__Hart,Thu Sep 01 04:37:03 IST 2011,rt spote paramount someon somethin nice love one
Erin__Hart,Thu Sep 01 04:31:35 IST 2011,it weird way i go i seem know way around better i liverpool sometim
Erin__Hart,Thu Sep 01 04:30:44 IST 2011,i alway felt like new york big part i even went
Erin__Hart,Thu Sep 01 04:28:41 IST 2011,serious need know tyler creator get t shirt all though probabl get special made
Erin__Hart,Thu Sep 01 04:27:06 IST 2011,rt tell how would surviv without tweet she queen endgam
Erin__Hart,Thu Sep 01 04:17:22 IST 2011,lol
Erin__Hart,Thu Sep 01 04:16:28 IST 2011,mr t hero
Erin__Hart,Thu Sep 01 04:15:24 IST 2011,hahahaha
Erin__Hart,Thu Sep 01 04:14:05 IST 2011,blackpeopleareawesom clear
Erin__Hart,Thu Sep 01 04:13:11 IST 2011,both black peopl
Erin__Hart,Thu Sep 01 04:12:51 IST 2011,my favourit show i littl fresh princ bel air kenan kel i never even thought
Erin__Hart,Thu Sep 01 04:10:18 IST 2011,do harri potter fan call pothead because i probabl actual watch movi
Erin__Hart,Thu Sep 01 04:07:46 IST 2011,call beib i never enough space left
Erin__Hart,Thu Sep 01 04:07:13 IST 2011,oh hahahha he least favourit like well i like jona brother seem sound unlik someon like bieb
Erin__Hart,Thu Sep 01 04:04:27 IST 2011,seen
Erin__Hart,Thu Sep 01 04:03:30 IST 2011,got bounc stuck head jona talk
Erin__Hart,Thu Sep 01 04:02:35 IST 2011,hahhaha i hate singl ladi video
Erin__Hart,Thu Sep 01 03:57:45 IST 2011,lol caus finish taytay phone decid call taytay
Erin__Hart,Thu Sep 01 03:51:20 IST 2011,realli kill littl hint hahaha
Erin__Hart,Thu Sep 01 03:47:02 IST 2011,nawww poor everton
Erin__Hart,Thu Sep 01 03:43:21 IST 2011,hahahahha would funnier listen radio start cum hahaha
Erin__Hart,Thu Sep 01 03:38:06 IST 2011,oh hahaha see tweet said came get hahaha
Erin__Hart,Thu Sep 01 03:37:09 IST 2011,had sky sport news day
Erin__Hart,Thu Sep 01 03:33:36 IST 2011,what
Erin__Hart,Thu Sep 01 03:33:05 IST 2011,oh shit
Erin__Hart,Thu Sep 01 02:01:38 IST 2011,
Erin__Hart,Thu Sep 01 01:28:33 IST 2011,mum tuck bed watch jurass park dark
Erin__Hart,Wed Aug 31 20:59:20 IST 2011,beauti sleep lie i near less hour sleep i still look ugli fuck
Erin__Hart,Wed Aug 31 15:19:14 IST 2011,i think everyth ok caus i heard anyth els i know video manvill like way deep
Erin__Hart,Wed Aug 31 15:16:26 IST 2011,i know everyon realli worri new york citi bad worst place peopl hip
Erin__Hart,Wed Aug 31 15:14:30 IST 2011,
Erin__Hart,Wed Aug 31 15:11:52 IST 2011,nope hahahaha
Erin__Hart,Wed Aug 31 15:08:29 IST 2011,check look like near either also nowher near coast
Erin__Hart,Wed Aug 31 15:04:44 IST 2011,i know i thinkg quit close coast though
Erin__Hart,Wed Aug 31 15:01:20 IST 2011,look like manvill worst hit i know close bellevill like
Erin__Hart,Wed Aug 31 07:10:44 IST 2011,seen flood new jersey hurrican
Erin__Hart,Tue Aug 30 14:55:46 IST 2011,i know told
Erin__Hart,Tue Aug 30 14:34:54 IST 2011,look came ipod i go get dvd today
Erin__Hart,Tue Aug 30 14:31:27 IST 2011,i record i watch i physic sit room brother
Erin__Hart,Tue Aug 30 14:25:50 IST 2011,yeah i think realli funni bb i use hate
Erin__Hart,Tue Aug 30 14:24:04 IST 2011,one actual like jedward
Erin__Hart,Tue Aug 30 14:21:43 IST 2011,why mani tweet spider today
Erin__Hart,Tue Aug 30 14:20:56 IST 2011,twitter let tweet
Erin__Hart,Tue Aug 30 14:19:39 IST 2011,rt anoth british summer day anoth winter coat
Erin__Hart,Tue Aug 30 07:50:27 IST 2011,rt happi birthday babe i may know someon hook sweet glee merch
Erin__Hart,Tue Aug 30 07:49:57 IST 2011,can sleep i crave chicken fri rice but i earli tomorrow
