username,time,tweet
aguspersegani,Sun Sep 01 05:29:59 IST 2013,a love one could deni
aguspersegani,Sun Sep 01 05:02:54 IST 2013,
aguspersegani,Sun Sep 01 03:58:21 IST 2013,todo de novio que depriment
aguspersegani,Sun Sep 01 03:46:31 IST 2013,rt clima prefecto
aguspersegani,Sun Sep 01 03:15:12 IST 2013,pago por verla camila andando en bici
aguspersegani,Sun Sep 01 02:08:20 IST 2013,everyth chang
aguspersegani,Sat Aug 31 20:53:32 IST 2013,rt negra rubia que parecen una pocahonta que metieron la cabeza en agua oxigenada
aguspersegani,Sat Aug 31 20:46:03 IST 2013,estoy punto de matar mi mama se compro la remera que queria yo
aguspersegani,Sat Aug 31 20:36:41 IST 2013,rt duermo en colchon canon
aguspersegani,Sat Aug 31 20:08:47 IST 2013,lindo depertars con est calor
aguspersegani,Sat Aug 31 10:02:05 IST 2013,rt hasta que agustina de bola
aguspersegani,Sat Aug 31 09:23:25 IST 2013,que dia mas aburrido
aguspersegani,Sat Aug 31 03:19:45 IST 2013,nacimo para ser felic para ser perfecto
aguspersegani,Sat Aug 31 03:09:30 IST 2013,que lindo calorcito
aguspersegani,Fri Aug 30 23:51:46 IST 2013,hot day sun relax
aguspersegani,Fri Aug 30 23:26:44 IST 2013,rt sol con mi amiga
aguspersegani,Fri Aug 30 22:48:57 IST 2013,que lindo comer mc en
aguspersegani,Fri Aug 30 07:05:20 IST 2013,rt sin música la vida sería un error
aguspersegani,Fri Aug 30 06:03:00 IST 2013,creo que vi como vece bolt siempr lloro
aguspersegani,Fri Aug 30 05:18:28 IST 2013,espero que mañana vaya bien en matematica
aguspersegani,Thu Aug 29 23:13:14 IST 2013,luna cute dog boxer
aguspersegani,Thu Aug 29 21:40:07 IST 2013,rt floorbusceni valevilar al pedo matematica
aguspersegani,Thu Aug 29 05:43:26 IST 2013,porqu tan lindo los de aliado
aguspersegani,Thu Aug 29 05:27:38 IST 2013,pero recuerda nadi es perfecto tu lo vera mas de mil cosa mejor tendra pero carino sincero jama
aguspersegani,Thu Aug 29 05:10:50 IST 2013,es muy linda la cancion que pasoooo
aguspersegani,Wed Aug 28 21:18:03 IST 2013,ni una bien estoy harta
aguspersegani,Wed Aug 28 18:51:47 IST 2013,porqu son fea
aguspersegani,Wed Aug 28 18:01:44 IST 2013,el buen humor en est colegio dura ni un minuto
aguspersegani,Wed Aug 28 06:39:22 IST 2013,no gusta esperar pero igual te espero
aguspersegani,Wed Aug 28 02:17:48 IST 2013,a vece la clave está en desaparec por un tiempo olvidars de todo bob marley
aguspersegani,Wed Aug 28 01:59:44 IST 2013,que dia de mierda
aguspersegani,Wed Aug 28 00:00:48 IST 2013,esta divino el dia para tomar sol
aguspersegani,Tue Aug 27 08:41:41 IST 2013,no cualquiera suma sin restar
aguspersegani,Tue Aug 27 08:41:20 IST 2013,es tan perfecto que asusta
aguspersegani,Tue Aug 27 07:42:43 IST 2013,te amo se conocen hace dos dia
aguspersegani,Tue Aug 27 07:29:58 IST 2013,ami tambien muy bizarro
aguspersegani,Tue Aug 27 07:27:20 IST 2013,karen alexi una historia de amor cada vez mas brasa la televis
aguspersegani,Tue Aug 27 07:16:58 IST 2013,rt como odio esa gent que está hablando en el cine por su culpa puedo escuchar bien mi película trucha de
aguspersegani,Tue Aug 27 06:25:41 IST 2013,que mierda se fumo el de taller
aguspersegani,Tue Aug 27 06:15:32 IST 2013,que bbm
aguspersegani,Tue Aug 27 06:12:55 IST 2013,don worri happi
aguspersegani,Tue Aug 27 06:02:51 IST 2013,viven pasando foto de comida por el grupo las odio
aguspersegani,Tue Aug 27 06:00:29 IST 2013,diu que horror y sin embargo el gordo sigu comiendo
aguspersegani,Tue Aug 27 05:56:02 IST 2013,jajajajajajaja impos que vos coma que video vieron
aguspersegani,Tue Aug 27 05:31:39 IST 2013,pieri wdw love photo love good moment epcot nice funni guy
aguspersegani,Tue Aug 27 04:30:40 IST 2013,rt porqu tenemo que depend de lo que piensan los dema para ser lo que queremo ser
aguspersegani,Tue Aug 27 00:54:40 IST 2013,como odio que dejen con la intriga
aguspersegani,Tue Aug 27 00:31:40 IST 2013,jajajajajajaja pobreeee mina
aguspersegani,Mon Aug 26 07:05:18 IST 2013,mira te paso otro por wp
