username,time,tweet
devesher,Mon Feb 29 16:56:03 IST 2016,a pictur i took earlier whilst walk canal a reflect sun tree water very surreal
devesher,Mon Feb 29 12:51:36 IST 2016,good morn use day someth dare extraordinari unlik take chanc
devesher,Mon Feb 29 04:04:45 IST 2016,rt so close hour excit show hollywood begin academyaward oscar
devesher,Mon Feb 29 02:03:09 IST 2016,rt free time wast time
devesher,Mon Feb 29 01:49:13 IST 2016,very true we wait weekend goe flash everyday matter what think
devesher,Mon Feb 29 01:41:25 IST 2016,say everyth say yes one thing
devesher,Mon Feb 29 01:35:35 IST 2016,rt tower bridg london bridg hospit light river thame london photographi
devesher,Mon Feb 29 01:34:43 IST 2016,rt just fun found interest colour invers i ago
devesher,Mon Feb 29 01:34:32 IST 2016,rt peac sunday enjoy day
devesher,Mon Feb 29 01:33:50 IST 2016,rt sunset even promenad córdoba sunsetoftheday spain andalucia
devesher,Mon Feb 29 01:33:29 IST 2016,rt garden snowdrop
devesher,Sun Feb 28 23:58:29 IST 2016,a pic walk today we chilli yet sunni day yorkshir
devesher,Sun Feb 28 21:00:05 IST 2016,rt in heart seal etern long enough
devesher,Sun Feb 28 15:33:18 IST 2016,thank danni
devesher,Sun Feb 28 15:32:31 IST 2016,rt you lifelin vein tree reach ether toward sun
devesher,Sun Feb 28 15:32:11 IST 2016,rt shift matter i cannot feel sound creation much real
devesher,Sun Feb 28 14:49:22 IST 2016,rt good morn have wonder day xx
devesher,Sun Feb 28 14:32:01 IST 2016,thank soni you good morn have great day
devesher,Sun Feb 28 14:28:22 IST 2016,good morn everyon have good sunday
devesher,Sun Feb 28 03:28:32 IST 2016,rt sometim absenc someth larger presenc mani thing
devesher,Sun Feb 28 01:04:12 IST 2016,had brilliant day yorkshiresculpturepark kaw thegreatoutdoor besti yorkshir
devesher,Sun Feb 28 00:52:56 IST 2016,rt a relax hour garden first daffodil year
devesher,Sat Feb 27 03:55:11 IST 2016,rt pleas help retweet now thank student face race time find stem cell donor
devesher,Sat Feb 27 03:53:42 IST 2016,rt
devesher,Sat Feb 27 01:26:17 IST 2016,rt love door tall thick arch lass wood inset look like compass wouldn cool could spin https
devesher,Sat Feb 27 01:26:05 IST 2016,rt the cross the abbey san galgano tuscani itali
devesher,Fri Feb 26 21:48:21 IST 2016,rt there need worri everyth happen
devesher,Fri Feb 26 16:10:03 IST 2016,happyfriday myview springawaken daffodil have fabul day
devesher,Fri Feb 26 04:12:40 IST 2016,magic someth invent want someth think
devesher,Fri Feb 26 04:07:07 IST 2016,if measur life thing almost happen get anywher
devesher,Fri Feb 26 04:02:16 IST 2016,rt stickl beck langdal love moodi photographi english lakedistrict
devesher,Fri Feb 26 04:01:53 IST 2016,rt look forward happi day amongst tulip fern garden flower
devesher,Fri Feb 26 02:51:11 IST 2016,well deserv
devesher,Thu Feb 25 23:15:18 IST 2016,don wish could take singl childhood memori blow bubbl live insid forev
devesher,Thu Feb 25 22:50:48 IST 2016,rt noth imposs positivethink
devesher,Thu Feb 25 21:52:11 IST 2016,rt the best art exhibit inc kawsysp via
devesher,Thu Feb 25 19:46:48 IST 2016,rt first snow winter look like window you know snow fall natur https
devesher,Thu Feb 25 19:46:24 IST 2016,rt watch shadow come life right amount light
devesher,Thu Feb 25 15:40:34 IST 2016,good morn beauti morn morn sun shine bright have fabul day myview
devesher,Thu Feb 25 04:06:32 IST 2016,love reckon hour month day year everi littl absenc age john dryden
devesher,Thu Feb 25 02:44:36 IST 2016,smile smile thing pleas someon
devesher,Thu Feb 25 02:31:18 IST 2016,apolog show feel when apolog truth
devesher,Thu Feb 25 02:25:23 IST 2016,it feel sweet healthi heart beat
devesher,Thu Feb 25 01:33:12 IST 2016,sometim care much biggest weak
devesher,Thu Feb 25 00:16:16 IST 2016,rt sunset yorkshir england on way home rushour travel
devesher,Wed Feb 24 21:49:20 IST 2016,rt the even play hide seek with moon set sky horizon ablaz ɽ 𓂀
devesher,Wed Feb 24 21:48:08 IST 2016,in spite complic peopl choos superstit common sens
devesher,Wed Feb 24 21:38:34 IST 2016,rt parish church perthshir scotland
devesher,Wed Feb 24 21:38:21 IST 2016,so cute
devesher,Wed Feb 24 21:38:05 IST 2016,rt the promis spring
