username,time,tweet
breakingcreech,Tue Mar 01 05:29:58 IST 2016,lmao yeah least teen time came total understand interest
breakingcreech,Tue Mar 01 05:24:57 IST 2016,beep beep slow dat ass fat
breakingcreech,Tue Mar 01 05:23:39 IST 2016,pokemon i see inher design continu nostalgia trip first game stay rigid formula
breakingcreech,Tue Mar 01 05:20:15 IST 2016,still good stuff especi thunder cat
breakingcreech,Tue Mar 01 05:19:46 IST 2016,lmao they good leak specul new game would recommend know etc
breakingcreech,Tue Mar 01 05:16:18 IST 2016,hey see kari latest tweet
breakingcreech,Tue Mar 01 05:13:35 IST 2016,vp pokemon one board pretti tame like facebook compar like b
breakingcreech,Tue Mar 01 05:11:09 IST 2016,oh
breakingcreech,Tue Mar 01 03:33:29 IST 2016,otherwis i would suggest code geass general
breakingcreech,Tue Mar 01 03:32:55 IST 2016,like mecha part ttgl i would suggest current gundam seri iron blood orphan it daisuki free
breakingcreech,Tue Mar 01 03:29:32 IST 2016,rt half solar system talk us
breakingcreech,Tue Mar 01 03:23:24 IST 2016,man non vergil thing say
breakingcreech,Tue Mar 01 03:21:42 IST 2016,littl stinker
breakingcreech,Tue Mar 01 03:20:37 IST 2016,perfect equilibrium capit achiev absenc greed
breakingcreech,Tue Mar 01 03:19:05 IST 2016,lmao who hell said imma sue slander you sir you re go down you did
breakingcreech,Tue Mar 01 03:15:50 IST 2016,
breakingcreech,Tue Mar 01 03:15:23 IST 2016,done smash mean imma still follow anyway
breakingcreech,Tue Mar 01 03:12:14 IST 2016,say other politician defend self politician trump defend self self
breakingcreech,Tue Mar 01 03:05:08 IST 2016,oh know you say fuck find new psychiatrist caus bs
breakingcreech,Tue Mar 01 03:03:39 IST 2016,gon die
breakingcreech,Tue Mar 01 02:26:02 IST 2016,rt short skirt looooooooooooooooong resum nanana na na nanana na nah nah
breakingcreech,Tue Mar 01 02:26:02 IST 2016,exact good shit good shit good shit
breakingcreech,Tue Mar 01 02:25:18 IST 2016,tast realli good made tummi hurt
breakingcreech,Tue Mar 01 01:49:08 IST 2016,reason i go get stuff forget instead dad he take fuck forev end wait get back
breakingcreech,Tue Mar 01 01:45:07 IST 2016,i crab alfredo last night
breakingcreech,Tue Mar 01 01:42:04 IST 2016,tfw shit talk master leffen drop still
breakingcreech,Tue Mar 01 01:25:18 IST 2016,new muse singl banger
breakingcreech,Tue Mar 01 01:24:36 IST 2016,rt huge relief this student thought he was being bulli for year but the other kid was just joke around
breakingcreech,Tue Mar 01 01:24:25 IST 2016,rt
breakingcreech,Tue Mar 01 01:23:26 IST 2016,rt oh easter come mean gotta remind public duck bun temporari weekend pet deserv
breakingcreech,Mon Feb 29 23:58:48 IST 2016,despit worri hundr year use earth base calendar planet would problemat
breakingcreech,Mon Feb 29 23:52:38 IST 2016,would still prefer si power approach calendar whatev would
breakingcreech,Mon Feb 29 23:50:31 IST 2016,long resum anoth favorit mine
breakingcreech,Mon Feb 29 23:50:08 IST 2016,oh version lmao
breakingcreech,Mon Feb 29 23:48:53 IST 2016,rt yes
breakingcreech,Mon Feb 29 23:47:19 IST 2016,exact it also problem social sort econom concept creat thus far
breakingcreech,Mon Feb 29 23:44:14 IST 2016,short greed ruin perfect capit could creat
breakingcreech,Mon Feb 29 23:43:28 IST 2016,also chariti option mental among societ concept prevent capit achiev balanc
breakingcreech,Mon Feb 29 23:41:17 IST 2016,artifici econom creation like plan obsolesc price floor ceil fiat natur money problemat
breakingcreech,Mon Feb 29 23:38:07 IST 2016,blame metrolyr
breakingcreech,Mon Feb 29 23:37:33 IST 2016,core concept suppli demand great the exploit natur capit get work favor howev
breakingcreech,Mon Feb 29 23:33:35 IST 2016,mayb it will be
breakingcreech,Mon Feb 29 23:32:45 IST 2016,get work
breakingcreech,Mon Feb 29 23:28:58 IST 2016,ballist hon make ammunit
breakingcreech,Mon Feb 29 23:17:54 IST 2016,sinc i could hold myself up high
breakingcreech,Mon Feb 29 23:14:15 IST 2016,trebuchet that cute here tank
breakingcreech,Mon Feb 29 23:13:08 IST 2016,dude favorit part play low difficulti rush gunpowd take knight musketmen
breakingcreech,Mon Feb 29 23:12:37 IST 2016,man fuck still aliv tho
breakingcreech,Mon Feb 29 23:05:21 IST 2016,oh shit adtr it s complic is on the radio love song make want die
breakingcreech,Mon Feb 29 23:00:38 IST 2016,
