username,time,tweet
SexualGif,Tue Mar 01 04:59:17 IST 2016,nah annoy peopl open snapchat view snapchat stori text back ok l see
SexualGif,Tue Mar 01 04:10:11 IST 2016,
SexualGif,Tue Mar 01 03:59:24 IST 2016,babi
SexualGif,Tue Mar 01 02:55:15 IST 2016,on god
SexualGif,Tue Mar 01 01:51:04 IST 2016,get mood
SexualGif,Tue Mar 01 01:04:04 IST 2016,tri pay colleg tuition like
SexualGif,Tue Mar 01 00:15:13 IST 2016,girlfriend
SexualGif,Tue Mar 01 00:05:15 IST 2016,year later
SexualGif,Mon Feb 29 23:36:10 IST 2016,doggystyl everyth
SexualGif,Mon Feb 29 22:51:06 IST 2016,mad cute
SexualGif,Mon Feb 29 22:07:13 IST 2016,i could spend day like
SexualGif,Mon Feb 29 21:22:21 IST 2016,want right
SexualGif,Mon Feb 29 20:32:30 IST 2016,hurt much i got one reaction
SexualGif,Mon Feb 29 19:54:09 IST 2016,i need a guy like this
SexualGif,Mon Feb 29 18:45:42 IST 2016,nigga gonna still groov
SexualGif,Mon Feb 29 18:45:14 IST 2016,when i get rts
SexualGif,Mon Feb 29 18:41:05 IST 2016,here someth bad day
SexualGif,Mon Feb 29 13:32:10 IST 2016,give night like
SexualGif,Mon Feb 29 12:56:02 IST 2016,there no thing busi
SexualGif,Mon Feb 29 12:16:45 IST 2016,rt let fuck like
SexualGif,Mon Feb 29 12:06:31 IST 2016,a ap rocki can t swim akdkakfsf
SexualGif,Mon Feb 29 12:02:09 IST 2016,i got some question
SexualGif,Mon Feb 29 11:25:03 IST 2016,god bless beauti basebal player
SexualGif,Mon Feb 29 10:54:02 IST 2016,bae tri get freaki public mood
SexualGif,Mon Feb 29 10:52:34 IST 2016,leo s full speech rt to save a life
SexualGif,Mon Feb 29 10:47:11 IST 2016,he is white knuckl that thing it is not go anywher
SexualGif,Mon Feb 29 10:40:23 IST 2016,what a time to be aliv
SexualGif,Mon Feb 29 10:37:59 IST 2016,kate watch leo speech all feel
SexualGif,Mon Feb 29 10:32:03 IST 2016,this would perfect right
SexualGif,Mon Feb 29 10:15:12 IST 2016,mood
SexualGif,Mon Feb 29 10:04:56 IST 2016,
SexualGif,Mon Feb 29 09:50:24 IST 2016,
SexualGif,Mon Feb 29 09:47:15 IST 2016,rt point semest
SexualGif,Mon Feb 29 09:22:01 IST 2016,leo kate friendship freak precious make cri love togeth much
SexualGif,Mon Feb 29 09:01:41 IST 2016,
SexualGif,Mon Feb 29 09:00:28 IST 2016,kate s reaction when she saw leo omg
SexualGif,Mon Feb 29 08:54:02 IST 2016,zendaya real life disney princess
SexualGif,Mon Feb 29 08:29:29 IST 2016,i sob
SexualGif,Mon Feb 29 08:16:00 IST 2016,when ur littl bro get stuck tabl
SexualGif,Mon Feb 29 07:58:06 IST 2016,when gotta clean bae eye caus know fuck talk
SexualGif,Mon Feb 29 07:54:00 IST 2016,when bae live togeth
SexualGif,Mon Feb 29 07:44:54 IST 2016,keep girl interest year love alot brag pull girl everi weekend like immatur littl boy
SexualGif,Mon Feb 29 07:40:10 IST 2016,throwback zac vanessa oscar
SexualGif,Mon Feb 29 07:20:08 IST 2016,wish guy like guy hey
SexualGif,Mon Feb 29 07:18:23 IST 2016,the feel
SexualGif,Mon Feb 29 06:55:06 IST 2016,rt bless someon tl
SexualGif,Mon Feb 29 06:26:02 IST 2016,fact life
SexualGif,Mon Feb 29 06:14:18 IST 2016,when singl nobodi cheat
SexualGif,Mon Feb 29 06:01:09 IST 2016,rt jeezus
