username,time,tweet
Everydayshine_,Thu Sep 01 05:29:55 IST 2011,omg sccto feed go nut alreadi
Everydayshine_,Thu Sep 01 05:27:31 IST 2011,yay sccto soon
Everydayshine_,Thu Sep 01 05:25:24 IST 2011,re tri tweetdeck
Everydayshine_,Thu Sep 01 05:15:05 IST 2011,wow great idea
Everydayshine_,Thu Sep 01 04:56:33 IST 2011,finger cross babi h stay bed
Everydayshine_,Thu Sep 01 00:18:32 IST 2011,lol fun mayb commemor will kate coin sccto
Everydayshine_,Thu Sep 01 00:17:06 IST 2011,seem work
Everydayshine_,Thu Sep 01 00:12:06 IST 2011,wow list impress look forward parti ya glass vino hand sccto
Everydayshine_,Wed Aug 31 20:06:33 IST 2011,wooohoo excit sccto
Everydayshine_,Wed Aug 31 19:24:20 IST 2011,left sale bin children place gapkid
Everydayshine_,Wed Aug 31 19:16:08 IST 2011,rt are go mini foodtruckeat popup today you full detail map twitpic com
Everydayshine_,Wed Aug 31 19:14:26 IST 2011,rt whomev person like opti mom page get free half hour coach session wheee
Everydayshine_,Wed Aug 31 19:13:05 IST 2011,last day enter giveaway
Everydayshine_,Wed Aug 31 19:09:46 IST 2011,thank alway lookout great style site kid babi one top notch
Everydayshine_,Wed Aug 31 18:52:18 IST 2011,great interview babiekinsmag thx ladi
Everydayshine_,Wed Aug 31 18:46:27 IST 2011,awesom interview founder stylishbabi
Everydayshine_,Wed Aug 31 18:44:24 IST 2011,interview babiekinsmag com
Everydayshine_,Wed Aug 31 16:51:51 IST 2011,artfest distilleri art visual art toronto com via com love show
Everydayshine_,Wed Aug 31 06:26:27 IST 2011,yay think hubbi would appreci tabl tweet
Everydayshine_,Wed Aug 31 06:23:47 IST 2011,aw go miss one hubbi i anniversari
Everydayshine_,Wed Aug 31 06:12:39 IST 2011,ughm watch first minut killerinsidem casey affleck stop gratuit even word
Everydayshine_,Tue Aug 30 23:56:43 IST 2011,blackberri random cheerio babi h lipgloss sunni wallet
Everydayshine_,Tue Aug 30 23:56:08 IST 2011,rt food truck eat churro dark chocol dip sauc cava food truck eat
Everydayshine_,Tue Aug 30 23:55:46 IST 2011,rt american interest win stroller guzzi guss usa cymax babi offer chanc win
Everydayshine_,Tue Aug 30 23:54:25 IST 2011,ok fifth yoyo i found lie around random place stroller kid hubbi alik realli enjoy
Everydayshine_,Tue Aug 30 23:50:28 IST 2011,i want win hedgehog purdyshedgehogcontest yum
Everydayshine_,Tue Aug 30 23:49:15 IST 2011,rt check lastest post yummymummyclub ca stop kid shriek
Everydayshine_,Tue Aug 30 23:43:39 IST 2011,ugh got hate medic procedur ever problem get tatt take blood make queasi
Everydayshine_,Tue Aug 30 23:41:58 IST 2011,only one day enter giveaway yummi healthi
Everydayshine_,Tue Aug 30 23:34:32 IST 2011,lol love hope u get spoil mamadeservesit
Everydayshine_,Tue Aug 30 23:27:56 IST 2011,happi birthday what treat mama
Everydayshine_,Tue Aug 30 23:18:49 IST 2011,my sister law stori walk cancer the weekend end women cancer thank
Everydayshine_,Tue Aug 30 23:01:40 IST 2011,feel like mia sinc i twitter day addict much
Everydayshine_,Tue Aug 30 18:51:30 IST 2011,when the cat away
Everydayshine_,Tue Aug 30 04:35:11 IST 2011,only day giveaway www stylnmommi com
Everydayshine_,Sun Aug 28 23:22:04 IST 2011,littl crazi fun
Everydayshine_,Sat Aug 27 20:11:26 IST 2011,mmm look tasti
Everydayshine_,Sat Aug 27 05:00:01 IST 2011,great hear enjoy gorgeous weekend weather
Everydayshine_,Sat Aug 27 01:20:57 IST 2011,lol its i think productivitywhatsthat
Everydayshine_,Sat Aug 27 00:53:40 IST 2011,inexplic crave cheeto thin crunchi kind
Everydayshine_,Sat Aug 27 00:20:20 IST 2011,hey i want gift card
Everydayshine_,Sat Aug 27 00:14:01 IST 2011,rt lose valuabl audienc follow make sure commit the dead twitter sin
Everydayshine_,Sat Aug 27 00:10:09 IST 2011,rais mug good evg
Everydayshine_,Sat Aug 27 00:06:27 IST 2011,moi aussi anoth coffe right
Everydayshine_,Fri Aug 26 19:43:10 IST 2011,back total seiz argh motherhoodpain
Everydayshine_,Fri Aug 26 19:42:19 IST 2011,ff awesom tweep
Everydayshine_,Fri Aug 26 19:31:58 IST 2011,thank ff happi weekend
Everydayshine_,Fri Aug 26 19:31:25 IST 2011,want tri healthi yummi new brand enter giveaway
Everydayshine_,Fri Aug 26 17:35:32 IST 2011,lol i know i love plan ahead
Everydayshine_,Fri Aug 26 07:42:34 IST 2011,sound fantast total crave right
