username,time,tweet
Untramen_Taro,Tue Mar 01 05:29:22 IST 2016,i m gonna ignor you i m not even gonna grace you with my presenc anymor if ya gonna be a salti hoe
Untramen_Taro,Tue Mar 01 05:28:57 IST 2016,i mean i accept valid critic voic like voic type random insult lol bye
Untramen_Taro,Tue Mar 01 05:27:59 IST 2016,peopl insult kiyoteru alway someth regard appear pedophil i go lol w e
Untramen_Taro,Tue Mar 01 05:26:24 IST 2016,my mom want make cake i go help mom make cake
Untramen_Taro,Tue Mar 01 05:26:05 IST 2016,see like i tri call u call campus polic know
Untramen_Taro,Tue Mar 01 05:25:22 IST 2016,this dude is on the hunt and he s tri to find some easi prey or what
Untramen_Taro,Tue Mar 01 05:25:01 IST 2016,get hit random
Untramen_Taro,Tue Mar 01 05:19:48 IST 2016,rt today episod
Untramen_Taro,Tue Mar 01 05:13:16 IST 2016,everyon salti featur remov like thank u
Untramen_Taro,Tue Mar 01 05:02:12 IST 2016,rt favourit news stori day
Untramen_Taro,Tue Mar 01 04:50:48 IST 2016,rt
Untramen_Taro,Tue Mar 01 04:49:33 IST 2016,birth death best charact seri
Untramen_Taro,Tue Mar 01 04:49:24 IST 2016,best matsu
Untramen_Taro,Tue Mar 01 04:33:53 IST 2016,new matsu best matsu
Untramen_Taro,Tue Mar 01 04:27:39 IST 2016,brother i
Untramen_Taro,Tue Mar 01 04:22:43 IST 2016,choromatsu admit failur nice
Untramen_Taro,Tue Mar 01 03:38:57 IST 2016,jyushimatsu also dead i think everi brother die least twice seri
Untramen_Taro,Tue Mar 01 03:38:18 IST 2016,todomatsu dead
Untramen_Taro,Tue Mar 01 03:36:30 IST 2016,choro todo get along realli well
Untramen_Taro,Tue Mar 01 03:35:37 IST 2016,at least stretch proper fight
Untramen_Taro,Tue Mar 01 03:33:46 IST 2016,i can t ae kvn
Untramen_Taro,Tue Mar 01 03:33:37 IST 2016,what is karamatsu wear why does he have a keyhol gakuran
Untramen_Taro,Tue Mar 01 03:31:21 IST 2016,final get around watch osomatsu i alreadi cri happen hatabou
Untramen_Taro,Tue Mar 01 03:05:51 IST 2016,least ticket i cri tho
Untramen_Taro,Tue Mar 01 03:04:15 IST 2016,ticket only went up for sale like minut ago i hate evetyghin
Untramen_Taro,Tue Mar 01 03:01:42 IST 2016,we manag book ticket time day realli want work
Untramen_Taro,Tue Mar 01 03:01:03 IST 2016,i m so mad i get home from groceri shop and friend tell me that real zero escap is sold out what the fuck
Untramen_Taro,Tue Mar 01 01:39:30 IST 2016,i feel like one actual get zelda obtain one day go ok sure happen
Untramen_Taro,Tue Mar 01 01:39:01 IST 2016,first zelda game oot zelda gcn collect thing like decad ago tbh zelda fall lap
Untramen_Taro,Tue Mar 01 01:36:59 IST 2016,first zelda game ever play zelda game never land lap mysteri
Untramen_Taro,Tue Mar 01 01:36:00 IST 2016,rt i want someon look way leo look girl scout cooki congratsbro
Untramen_Taro,Tue Mar 01 01:21:49 IST 2016,i feel asian
Untramen_Taro,Tue Mar 01 01:21:30 IST 2016,my famili differ varieti rice hous differ variant white rice
Untramen_Taro,Tue Mar 01 01:16:31 IST 2016,rt
Untramen_Taro,Tue Mar 01 01:14:50 IST 2016,my stomach drive crazi everyth hurt
Untramen_Taro,Tue Mar 01 00:34:07 IST 2016,rt leonardo dicaprio smile because he won his very first oscar liter save live
Untramen_Taro,Tue Mar 01 00:28:09 IST 2016,sensei die i sad choro die i like ok well whatev
Untramen_Taro,Tue Mar 01 00:27:15 IST 2016,i don t want to f
Untramen_Taro,Tue Mar 01 00:26:37 IST 2016,good riddanc tbh
Untramen_Taro,Tue Mar 01 00:25:17 IST 2016,rt pokemonsun pokemongo https
Untramen_Taro,Tue Mar 01 00:24:06 IST 2016,rt ask friend doesnt understand matsu anim general describ
Untramen_Taro,Mon Feb 29 22:35:04 IST 2016,hd remak look realli good i know chang anyth ww hd chang thing mayb
Untramen_Taro,Mon Feb 29 22:33:49 IST 2016,collect zelda oot mm stuff overal good deal someon want play
Untramen_Taro,Mon Feb 29 22:32:20 IST 2016,gcn zelda collector edit price want experi game better buy gcn
Untramen_Taro,Mon Feb 29 22:18:31 IST 2016,i know juli would probabl leav anyway even without encourag
Untramen_Taro,Mon Feb 29 22:17:26 IST 2016,i way googl i teleport friend
Untramen_Taro,Mon Feb 29 22:14:46 IST 2016,
Untramen_Taro,Mon Feb 29 22:11:24 IST 2016,clock physic stop follow dream leav class
Untramen_Taro,Mon Feb 29 22:10:57 IST 2016,ah unfortun my scienc one run advisor professor mentor help resourc
Untramen_Taro,Mon Feb 29 22:09:43 IST 2016,i attest
