username,time,tweet
sudhanva_,Tue Mar 01 05:29:26 IST 2016,nbc trash network
sudhanva_,Tue Mar 01 03:08:33 IST 2016,rt get closer
sudhanva_,Mon Feb 29 10:40:42 IST 2016,rt chang real let take planet grant thank actonclim oscar https
sudhanva_,Mon Feb 29 10:40:22 IST 2016,rt mr told truth climat chang there great deal let get work
sudhanva_,Mon Feb 29 10:28:47 IST 2016,leonardo dicaprio realest
sudhanva_,Mon Feb 29 09:04:00 IST 2016,wow tom hardi definit deserv best actor support role
sudhanva_,Mon Feb 29 08:53:49 IST 2016,insight observ
sudhanva_,Mon Feb 29 08:35:59 IST 2016,mad max easili one best movi
sudhanva_,Mon Feb 29 07:26:34 IST 2016,rt great messag get money polit oscar of cours big short writer almost mention
sudhanva_,Sun Feb 28 09:55:00 IST 2016,curri
sudhanva_,Fri Feb 26 04:17:05 IST 2016,rt worth repost wait but why piec ai we begin exponenti growth digit intellig https
sudhanva_,Thu Feb 25 04:17:24 IST 2016,rt superior electr car come could wreck oil market within decad
sudhanva_,Wed Feb 24 18:53:47 IST 2016,rt the rise donald trump seen distil fundament flaw signific portion
sudhanva_,Tue Feb 23 19:17:41 IST 2016,rt cloud base expans brain possibl w nanotech ai ray kurzweil say mit
sudhanva_,Mon Feb 22 10:52:32 IST 2016,
sudhanva_,Mon Feb 22 02:39:06 IST 2016,rt thank everyth
sudhanva_,Fri Feb 19 11:40:20 IST 2016,
sudhanva_,Fri Feb 19 04:37:12 IST 2016,rt meet appl exec never heard run like import divis https
sudhanva_,Thu Feb 18 21:12:25 IST 2016,rt import post forc compani enabl hack could compromis privaci
sudhanva_,Thu Feb 18 21:12:10 IST 2016,rt but wholli differ requir compani enabl hack custom devic data could
sudhanva_,Thu Feb 18 10:57:14 IST 2016,continu improv
sudhanva_,Thu Feb 18 10:07:11 IST 2016,rt when frank ocean part come wolv
sudhanva_,Thu Feb 18 01:14:16 IST 2016,rt appl strike back call reach us
sudhanva_,Wed Feb 17 06:59:51 IST 2016,rt countri built dreamer never give dream
sudhanva_,Wed Feb 17 06:58:05 IST 2016,rt shoutout artist grammi work build brighter futur mybrotherskeep https
sudhanva_,Tue Feb 16 05:04:26 IST 2016,rt cancer research claim extraordinari result use t cell therapi
sudhanva_,Mon Feb 15 21:47:15 IST 2016,rt berni sander next presid unit state least week rank
sudhanva_,Mon Feb 15 19:43:31 IST 2016,rt brilliant john oliv look ridicul doubl standard behind voter id law via
sudhanva_,Mon Feb 15 04:14:12 IST 2016,rt time time time stop tri cheat time
sudhanva_,Sun Feb 14 23:28:11 IST 2016,whole album heat except feedback freestyl
sudhanva_,Sun Feb 14 23:27:34 IST 2016,lmfao bruh gonna give album
sudhanva_,Sun Feb 14 13:01:49 IST 2016,kany album golden
sudhanva_,Sun Feb 14 11:33:24 IST 2016,rt in honor marshawn lynch the best interview time
sudhanva_,Sun Feb 14 11:26:31 IST 2016,rt album out now thelifeofpablo
sudhanva_,Sat Feb 13 07:53:18 IST 2016,rt a ap rocki announc mob put new music everi wednesday wavi wednesday
sudhanva_,Sat Feb 13 02:44:11 IST 2016,
sudhanva_,Fri Feb 12 07:13:47 IST 2016,world grab
sudhanva_,Thu Feb 11 10:14:47 IST 2016,get ambit bore
sudhanva_,Wed Feb 10 10:58:37 IST 2016,ty goe
sudhanva_,Wed Feb 10 10:11:21 IST 2016,rt berni credit yuge voter victori ap photo
sudhanva_,Tue Feb 09 10:56:27 IST 2016,rt my convers great power surviv cosmos
sudhanva_,Fri Feb 05 21:17:23 IST 2016,rt stream mixtap
sudhanva_,Wed Feb 03 08:58:36 IST 2016,rt thuggaxkeefxfutur
sudhanva_,Tue Feb 02 10:37:14 IST 2016,rt as p et full result iowacaucus iacaucus
sudhanva_,Tue Feb 02 10:33:17 IST 2016,rt what mensch guy berni feelthebern
sudhanva_,Mon Feb 01 03:41:28 IST 2016,rt elon musk want send human start colon mar
sudhanva_,Sun Jan 31 05:45:11 IST 2016,rt just know april time view
sudhanva_,Sun Jan 31 05:43:20 IST 2016,summer
sudhanva_,Sat Jan 30 23:47:06 IST 2016,rt i stand w thousand solar worker nevada want job back clean energi futur sign
sudhanva_,Sat Jan 30 06:09:05 IST 2016,
