username,time,tweet
dandyul,Tue Mar 01 05:29:54 IST 2016,i feel like worst yuri fan i actual realli want sunni sooyoung solo lawl
dandyul,Tue Mar 01 05:27:23 IST 2016,sm way ambiti year
dandyul,Tue Mar 01 05:25:57 IST 2016,i suppos save f x tour tf i left sica yuri taeyeon tiff bye
dandyul,Tue Mar 01 05:20:51 IST 2016,rt yuri write song sing well i believ well happen
dandyul,Tue Mar 01 05:06:49 IST 2016,how sm promot proper month ridicul
dandyul,Tue Mar 01 04:59:49 IST 2016,will luna sunni ever get solo though lol
dandyul,Tue Mar 01 04:55:43 IST 2016,what
dandyul,Tue Mar 01 03:59:53 IST 2016,rt let forget fan threw underwear catch taeyeon attent
dandyul,Tue Mar 01 03:43:35 IST 2016,rt make way real queen
dandyul,Tue Mar 01 03:34:43 IST 2016,lot non meus stan krystal xs
dandyul,Tue Mar 01 03:33:47 IST 2016,dandyul rather voic which slay
dandyul,Tue Mar 01 03:32:52 IST 2016,sunni line bump it tho
dandyul,Tue Mar 01 03:27:58 IST 2016,rt
dandyul,Tue Mar 01 03:26:21 IST 2016,well took play song i final say i well truli sick xd
dandyul,Tue Mar 01 03:20:50 IST 2016,rt arena 일 년 열두 달 기사 재이 예지 피에스타
dandyul,Tue Mar 01 03:04:51 IST 2016,she stop tag snsd onto name liter never done take measur omg i cannot anymor
dandyul,Tue Mar 01 03:03:27 IST 2016,the ironi of this comment are peopl self awar omg lol
dandyul,Mon Feb 29 19:57:23 IST 2016,rt
dandyul,Mon Feb 29 19:41:36 IST 2016,pleas
dandyul,Mon Feb 29 19:35:03 IST 2016,krystal cutest thing ever
dandyul,Mon Feb 29 19:34:33 IST 2016,rt cr gyochi
dandyul,Mon Feb 29 19:23:47 IST 2016,feb let make rash decis
dandyul,Mon Feb 29 19:23:14 IST 2016,rt so like ever get iu x taeyeon i reckon destroy everi korean chart haha
dandyul,Mon Feb 29 19:20:58 IST 2016,will sm final let amber x aile happen
dandyul,Mon Feb 29 19:19:21 IST 2016,rt smile face beat heart yulsic
dandyul,Mon Feb 29 18:51:01 IST 2016,rt
dandyul,Mon Feb 29 18:50:10 IST 2016,dear f x realli concert pleas sing mr boogi and love hate and chu thx
dandyul,Mon Feb 29 17:08:16 IST 2016,jiyeon want varieti iu luna trio live
dandyul,Mon Feb 29 17:00:02 IST 2016,i love still surpris popular lol serious
dandyul,Mon Feb 29 16:51:11 IST 2016,rt just want guy know still alway keep updat gorgeous jessica jung eventho
dandyul,Mon Feb 29 16:50:56 IST 2016,omg taeng tri buy ticket fail like agit concert xd
dandyul,Mon Feb 29 16:37:37 IST 2016,rt i love sulli and her spam
dandyul,Mon Feb 29 16:37:23 IST 2016,rt
dandyul,Mon Feb 29 16:32:11 IST 2016,awh wendi face taeyeon compliment
dandyul,Mon Feb 29 16:27:24 IST 2016,rt say f x much stronger deepli miss voic echo perform hit
dandyul,Mon Feb 29 15:48:48 IST 2016,talk member cri cri god bless choi sooyoung
dandyul,Mon Feb 29 15:48:11 IST 2016,i watch chaseo ep exchang gift soo alon buy gift i cri
dandyul,Mon Feb 29 15:36:59 IST 2016,this is still hot af
dandyul,Mon Feb 29 15:29:26 IST 2016,i realiz i taeyeon merch i yuri merch haha
dandyul,Mon Feb 29 15:24:23 IST 2016,jinriahh cute
dandyul,Mon Feb 29 15:19:49 IST 2016,rt walk ball sunshin
dandyul,Mon Feb 29 15:19:35 IST 2016,rt oh my god soooo prettyyyyi
dandyul,Mon Feb 29 15:12:37 IST 2016,mv album full promot photobook billboard merch
dandyul,Mon Feb 29 15:12:17 IST 2016,rt luna need mv next solo
dandyul,Mon Feb 29 15:05:06 IST 2016,rt i exercis hibern home noth result
dandyul,Mon Feb 29 14:56:05 IST 2016,
dandyul,Mon Feb 29 14:52:30 IST 2016,fiestar follow back twitter
dandyul,Mon Feb 29 14:41:51 IST 2016,rt 루나가 수건 앞으로도 우리 많이 많이
dandyul,Mon Feb 29 14:24:04 IST 2016,as expect
dandyul,Mon Feb 29 14:23:01 IST 2016,hooooli crap queen varieti
