username,time,tweet
aalokdixit,Tue Mar 01 05:29:48 IST 2016,ea sport suck match player player onlin cant match singl player div what hell
aalokdixit,Tue Mar 01 03:31:54 IST 2016,rt what week mon facup wed reserv thur europa sat sun pl mon
aalokdixit,Tue Mar 01 02:00:10 IST 2016,rt pereira spot
aalokdixit,Tue Mar 01 01:35:08 IST 2016,rt paul merson arsenal must axe arsene wenger leicest tottenham win titl
aalokdixit,Tue Mar 01 00:59:44 IST 2016,rt nani cross van gaaalllll
aalokdixit,Tue Mar 01 00:35:27 IST 2016,fun fact it took rashford min score twice past cec took messi game mufc funfact bpl munar
aalokdixit,Mon Feb 29 23:57:28 IST 2016,rt unit fast track new week contract marcus rashford mail
aalokdixit,Mon Feb 29 22:54:41 IST 2016,the next thing know sign shite mufc
aalokdixit,Mon Feb 29 22:52:07 IST 2016,rt carrick i seen debut none quit like rashford it unbeliev start
aalokdixit,Mon Feb 29 00:23:05 IST 2016,and hez back wengerout mufc
aalokdixit,Sun Feb 28 23:57:25 IST 2016,rt van gaal touchlin dive i bit emot much i think i apologis offici mufc
aalokdixit,Sun Feb 28 23:54:34 IST 2016,rt perfect end week togeth stronger old trafford today
aalokdixit,Sun Feb 28 23:32:11 IST 2016,rt unit arsenal fantast scene final whistl mufc
aalokdixit,Sun Feb 28 23:11:35 IST 2016,rt buena victoria great victori unit rojoisr
aalokdixit,Sun Feb 28 22:59:34 IST 2016,rt wenger friday i quit know rashford bet rememb name today
aalokdixit,Sun Feb 28 22:59:21 IST 2016,rt fantast week manchest unit shrewburi man utd man utd midtjylland man utd arsenal
aalokdixit,Sun Feb 28 22:58:30 IST 2016,rt marcus rashford amaz
aalokdixit,Sun Feb 28 22:57:15 IST 2016,rt congratul marcus rashford mufc man match debut thank vote
aalokdixit,Sun Feb 28 22:56:44 IST 2016,rt this explain lot
aalokdixit,Sun Feb 28 22:56:33 IST 2016,rt lvg promot youth cultur manchest unit that took manag i think
aalokdixit,Sun Feb 28 22:56:22 IST 2016,rt arsene wenger let go overboard manchest unit experienc midfield spent lot money
aalokdixit,Sun Feb 28 22:55:04 IST 2016,rt hi
aalokdixit,Sun Feb 28 21:53:40 IST 2016,rt ft mufc afc absolut breathless what perform so proud lad today that manchest unit
aalokdixit,Sun Feb 28 21:52:25 IST 2016,rt this pictur week
aalokdixit,Sun Feb 28 21:52:04 IST 2016,rt ft mufc afc rashford steal headlin matchdaymac
aalokdixit,Sun Feb 28 21:51:53 IST 2016,rt lol whenev arsenal loos arsenal fan want wenger head lmao afc afcjustgotserv cantwinagainstkid
aalokdixit,Sun Feb 28 21:51:40 IST 2016,rt and start
aalokdixit,Sun Feb 28 21:51:21 IST 2016,rt unit last premier leagu result arsenal old trafford d w w w w w d w
aalokdixit,Sun Feb 28 21:51:10 IST 2016,rt pic celebr prove win goal mufc v arsenal front euphor crowd
aalokdixit,Sun Feb 28 21:50:42 IST 2016,rt
aalokdixit,Sun Feb 28 21:50:28 IST 2016,rt marcus rashford score brace offici man match full premier leagu debut
aalokdixit,Sun Feb 28 21:32:32 IST 2016,rt full time manchest unit arsenal mufc
aalokdixit,Sun Feb 28 21:32:26 IST 2016,rt crack game brilliant result manchest unit leicest tottenham marvel
aalokdixit,Sun Feb 28 21:32:19 IST 2016,rt ft mufc arsenal yes the red claim signific win thank rashford doubl herrera deflect shot
aalokdixit,Sun Feb 28 21:32:09 IST 2016,rt when offer arsenal chanc win leagu
aalokdixit,Fri Feb 26 18:53:09 IST 2016,rt great win last night brilliant first team debut marcus rashford liverpool next round mufc
aalokdixit,Fri Feb 26 17:56:34 IST 2016,rt offici manchest unit face liverpool round uefa europa leagu
aalokdixit,Fri Feb 26 17:56:31 IST 2016,rt this europa leagu got interest ueldraw mufc
aalokdixit,Fri Feb 26 17:56:21 IST 2016,rt manchest unit v liverpool atmospher await leg
aalokdixit,Fri Feb 26 03:55:37 IST 2016,rt this disgust
aalokdixit,Fri Feb 26 03:55:32 IST 2016,rt pure unadulter filth
aalokdixit,Fri Feb 26 03:54:49 IST 2016,rt retweet vote mufc man match midtjylland
aalokdixit,Fri Feb 26 03:41:27 IST 2016,rt fact marcus rashford youngest player score goal european competit manchest unit take bow
aalokdixit,Fri Feb 26 03:38:39 IST 2016,rt rashford qualiti
aalokdixit,Fri Feb 26 03:38:31 IST 2016,rt who f midtjylland as red go march mufc matchdaymac
aalokdixit,Fri Feb 26 03:38:24 IST 2016,rt memphi
aalokdixit,Fri Feb 26 03:37:00 IST 2016,seem like forev mufc
aalokdixit,Fri Feb 26 03:36:13 IST 2016,now record good job marcus mufc marcusrashford
aalokdixit,Fri Feb 26 03:35:12 IST 2016,let sink next vs arsenal mufc
aalokdixit,Fri Feb 26 03:34:24 IST 2016,rt a super debut brace manchest born bred marcus rashford
