username,time,tweet
jessmripp,Thu Sep 01 05:29:38 IST 2011,just got ticket brewer cardin game tonight now i watch card lose road home
jessmripp,Thu Sep 01 00:35:00 IST 2011,and go st loui rt record set game duck duck goos saturday
jessmripp,Thu Sep 01 00:25:03 IST 2011,rt brewer announc singl game playoff ticket purchas plan the milwauke brewer today announc detail h
jessmripp,Thu Sep 01 00:24:35 IST 2011,rt the influenti tech ceo twitter
jessmripp,Wed Aug 31 07:24:17 IST 2011,thank updat it took minut figur channel cnn broadcast
jessmripp,Wed Aug 31 06:47:05 IST 2011,i middl transcend man i awe giant white robot model reallytiestheroomtogeth yespleas
jessmripp,Wed Aug 31 02:55:11 IST 2011,i make sure tri i next area
jessmripp,Wed Aug 31 01:30:40 IST 2011,more power sorg must travel but it would nice also featur establish local favorit
jessmripp,Wed Aug 31 01:23:00 IST 2011,great place i use first fundrais rt late lunch st franci breweri restaur
jessmripp,Wed Aug 31 01:20:49 IST 2011,next bar milw featur travel network rt red rock owner buy mcgillycuddi via
jessmripp,Tue Aug 30 23:04:25 IST 2011,ted turner bloomberg
jessmripp,Tue Aug 30 21:37:12 IST 2011,does alcohol burn cook
jessmripp,Tue Aug 30 06:35:02 IST 2011,approv also walk stevi nick stand back i like place alreadi
jessmripp,Tue Aug 30 00:19:32 IST 2011,vote shepherd best milwauke wi milwauke
jessmripp,Mon Aug 29 20:14:13 IST 2011,the real winner fight rep jeff fitzgerald mt thompson neumann wi rememb resort smear wisen
jessmripp,Mon Aug 29 20:09:55 IST 2011,rt milwauke bound boy girl club scholarship event marquett univers wade sworld
jessmripp,Mon Aug 29 20:06:02 IST 2011,what order would eat
jessmripp,Mon Aug 29 19:07:57 IST 2011,an excel read guy
jessmripp,Mon Aug 29 08:59:16 IST 2011,i sampl stuf sausag pepperoni
jessmripp,Mon Aug 29 05:16:58 IST 2011,sampl pizza dinner
jessmripp,Mon Aug 29 05:11:09 IST 2011,had excel brunch thank
jessmripp,Sun Aug 28 18:39:42 IST 2011,rt in come week lower manhattan resid could face unpreced gourmet cupcak shortag
jessmripp,Sun Aug 28 16:26:22 IST 2011,rt econom view washington should tri littl prudent self restraint
jessmripp,Sun Aug 28 16:20:07 IST 2011,rt without automat deduct union due surpris member pay voluntarili why
jessmripp,Sun Aug 28 15:53:17 IST 2011,i still jealous rt heat warn extend monday las vega valley
jessmripp,Sun Aug 28 15:44:46 IST 2011,rt unbox steve job reward risk take
jessmripp,Sun Aug 28 06:10:36 IST 2011,brewer game
jessmripp,Sat Aug 27 22:25:25 IST 2011,cafe centraal i wish i seen earlier tweet brunch favorit meal week milwauke
jessmripp,Sat Aug 27 22:23:20 IST 2011,brewer ticket acquir today go level
jessmripp,Sat Aug 27 22:16:41 IST 2011,rt want mashabl real life facebook wall here join
jessmripp,Sat Aug 27 01:19:29 IST 2011,had interest work lunch steakout greendal
jessmripp,Sat Aug 27 01:13:33 IST 2011,rt russian central bank to offer gold back loan or why the spam standard is come to an end
jessmripp,Fri Aug 26 09:22:04 IST 2011,i pleas current capac wait list mt lambeau field expans
jessmripp,Fri Aug 26 08:36:05 IST 2011,not dinner hahahahahahaha
jessmripp,Fri Aug 26 08:04:21 IST 2011,sit next georg kottara brewer milwauke
jessmripp,Fri Aug 26 06:33:56 IST 2011,ryan braun walk brewer milwauke
jessmripp,Fri Aug 26 06:19:31 IST 2011,thank much bradley amaz host he extrem inform help
jessmripp,Fri Aug 26 06:01:09 IST 2011,sit bar
jessmripp,Fri Aug 26 05:57:13 IST 2011,out dinner h
jessmripp,Fri Aug 26 00:53:54 IST 2011,i keep head swivel tonight i grab dinner
jessmripp,Thu Aug 25 23:23:13 IST 2011,that time work send text schedul secur
jessmripp,Thu Aug 25 21:25:32 IST 2011,interest read are milwauke we grab beer
jessmripp,Thu Aug 25 20:57:57 IST 2011,omaha news rt thehermancain rag rich backstori inform charit endeavor
jessmripp,Thu Aug 25 03:02:46 IST 2011,the most power women
jessmripp,Thu Aug 25 02:07:42 IST 2011,i read the pixar touch week ago very enjoy mt pixar near gave toy stori anoth name
jessmripp,Thu Aug 25 02:02:22 IST 2011,rt earthquak hit washington next week hurrican frog locust worst plagu congress return
jessmripp,Thu Aug 25 01:54:44 IST 2011,decid rent thx even
jessmripp,Thu Aug 25 01:50:41 IST 2011,rt appar franci ford coppola copi the godfath book hand written note
jessmripp,Wed Aug 24 01:37:47 IST 2011,rt the un legisl
jessmripp,Wed Aug 24 01:16:08 IST 2011,rt nba contract real possibl especi mi
