username,time,tweet
jonjohns07,Tue Mar 01 05:29:23 IST 2016,exact four year ago today i gave embarrass miss solstic day due leap year
jonjohns07,Mon Feb 29 08:18:51 IST 2016,rt fun fact paxton lynch father play hoop texa wesleyan roommat kid name mark calaway
jonjohns07,Mon Feb 29 06:58:36 IST 2016,rt hand life everi live thing breath mankind job
jonjohns07,Sat Feb 27 10:09:02 IST 2016,think complet differ back like compar randi moss edelman differ style game
jonjohns07,Sat Feb 27 10:07:46 IST 2016,lack opportun excel pass blocker game chang runner capabl pass catcher seen today could start day one
jonjohns07,Sat Feb 27 05:12:55 IST 2016,rt let sermon full christ begin end cram full gospel spurgeon
jonjohns07,Sat Feb 27 00:30:48 IST 2016,like henri
jonjohns07,Fri Feb 26 09:50:06 IST 2016,sad best man america got least amount attent also yell got time thesehand
jonjohns07,Fri Feb 26 09:42:12 IST 2016,rt the adult room readi lead america need john kasich gopdeb
jonjohns07,Fri Feb 26 04:37:16 IST 2016,depend intrigu least size like b jacob hill like mcfadden run i say yes
jonjohns07,Fri Feb 26 03:24:25 IST 2016,predict henri forti time
jonjohns07,Thu Feb 25 19:12:54 IST 2016,north north al north chicago
jonjohns07,Thu Feb 25 09:30:15 IST 2016,kellyfil town hall tonight if peopl got know ben one minut clip win doubt
jonjohns07,Wed Feb 24 08:31:57 IST 2016,rt we never understand physic behind shot zero arc still goe
jonjohns07,Fri Feb 19 05:12:57 IST 2016,heard
jonjohns07,Thu Feb 18 10:33:15 IST 2016,rt under radar lsu look like sec coach yr remark job obasahan improv
jonjohns07,Wed Feb 17 09:13:37 IST 2016,rt alway stand creed must bend bibl bibl creed spurgeon
jonjohns07,Wed Feb 17 09:11:31 IST 2016,rt
jonjohns07,Wed Feb 17 03:44:42 IST 2016,small hail athen al unexpect short durat still rough noggin
jonjohns07,Tue Feb 16 07:32:17 IST 2016,prayer lift
jonjohns07,Mon Feb 15 23:05:47 IST 2016,think bama bball split next six game enough get i think need lsu game bad way
jonjohns07,Mon Feb 15 08:59:03 IST 2016,hilari stuff light side polit fact gay british man love call daddi
jonjohns07,Sun Feb 14 09:12:35 IST 2016,rt this deserv retweet spread word rolltid buckleup
jonjohns07,Sun Feb 14 09:10:25 IST 2016,gopdeb like unreal life lol
jonjohns07,Sun Feb 14 06:08:54 IST 2016,rt the last time alabama basketbal game o dome gene stall footbal coach
jonjohns07,Sun Feb 14 06:08:51 IST 2016,rt alabama beat florida win gainesvill year ncaa select committe meet tide tide meet
jonjohns07,Sun Feb 14 03:25:17 IST 2016,dazon stay healthi year think would top team sec
jonjohns07,Sun Feb 14 02:58:55 IST 2016,thank info white smoke i guess sound right
jonjohns07,Sun Feb 14 02:36:58 IST 2016,any idea might burn toward huntsvill area ton smoke sever hour
jonjohns07,Sun Feb 14 01:48:44 IST 2016,project percentag probabl chart make ncaa bracket btw
jonjohns07,Sun Feb 14 01:48:20 IST 2016,look like lsu bama gonna end fight spot a win bama today would huge
jonjohns07,Fri Feb 12 10:15:32 IST 2016,rt young old pray lord pleas plan fulfil take home
jonjohns07,Thu Feb 11 22:23:37 IST 2016,vandi ahead bama rank bama top win conf top sos
jonjohns07,Thu Feb 11 09:43:53 IST 2016,rt how alabama success injuri recoveri prevent
jonjohns07,Tue Feb 09 20:41:03 IST 2016,rt what great combin toni reink michael reev break despair unbelief
jonjohns07,Sun Feb 07 05:51:39 IST 2016,i see get readi indi
jonjohns07,Wed Feb 03 06:41:33 IST 2016,i like hear thank
jonjohns07,Wed Feb 03 06:38:18 IST 2016,storm produc tornado earlier head athen al local coverag insight
jonjohns07,Sat Jan 30 21:07:19 IST 2016,comment inspir explor live life full everyth look like
jonjohns07,Sat Jan 30 21:01:59 IST 2016,this great
jonjohns07,Fri Jan 29 19:49:22 IST 2016,rt the law self righteous humbl pride the gospel lost remov despair spurgeon
jonjohns07,Wed Jan 27 09:34:47 IST 2016,rt realbencarson politician polit expedi time someon right
jonjohns07,Sun Jan 24 10:35:56 IST 2016,rt to trust god light noth trust dark faith spurgeon
jonjohns07,Sun Jan 17 01:22:53 IST 2016,rt all boy come back won long road start
jonjohns07,Sat Jan 16 23:28:03 IST 2016,rt prais god christian pastor saeed abedini free year prison sentenc spread gospel
jonjohns07,Sat Jan 16 23:26:45 IST 2016,rt littl hudson love everi saturday morn
jonjohns07,Fri Jan 15 08:39:55 IST 2016,john kasich get stage rand
jonjohns07,Wed Jan 13 08:00:09 IST 2016,mean new economi
jonjohns07,Wed Jan 13 07:55:39 IST 2016,mean new economi
jonjohns07,Wed Jan 13 00:26:33 IST 2016,persever paid wait make big play came biggest game congrat si cover well cover sweet
