username,time,tweet
JordynNito,Tue Mar 01 05:29:28 IST 2016,well need blunt shift
JordynNito,Sun Feb 28 09:41:00 IST 2016,rt very rare i put peopl music
JordynNito,Wed Feb 10 04:18:44 IST 2016,doing thing fuck
JordynNito,Tue Feb 09 10:11:16 IST 2016,first i got marri money i fell love dirti futur
JordynNito,Sun Feb 07 23:48:26 IST 2016,i fear evol
JordynNito,Wed Feb 03 09:23:07 IST 2016,my life definit differ without u
JordynNito,Mon Feb 01 06:04:47 IST 2016,i alway blow dank a one
JordynNito,Sat Jan 30 13:59:09 IST 2016,you want go get wisest word i ever heard
JordynNito,Fri Jan 29 12:59:05 IST 2016,definit gonna miss merced
JordynNito,Tue Jan 19 06:00:10 IST 2016,r i p a ap yam
JordynNito,Mon Jan 18 00:42:42 IST 2016,god
JordynNito,Mon Jan 11 08:17:46 IST 2016,when go work day
JordynNito,Mon Jan 11 08:16:44 IST 2016,rt tianna gregori fine
JordynNito,Sun Jan 10 11:07:25 IST 2016,there certain nigga i fuck w juici j
JordynNito,Thu Jan 07 14:34:38 IST 2016,get rich die tryin
JordynNito,Thu Jan 07 14:33:57 IST 2016,final got car back today shit alreadi smell loud lmfao
JordynNito,Tue Jan 05 13:09:40 IST 2016,rt coachella lineup announc who excit see
JordynNito,Tue Jan 05 13:09:37 IST 2016,rt see you at
JordynNito,Tue Jan 05 11:52:35 IST 2016,fuck
JordynNito,Mon Jan 04 22:33:44 IST 2016,rt dj quik g
JordynNito,Mon Jan 04 13:15:21 IST 2016,rt jennif aniston
JordynNito,Sun Jan 03 15:10:49 IST 2016,i would mani friend i held back truth gave compliment
JordynNito,Sat Jan 02 11:47:47 IST 2016,fat ass dab
JordynNito,Sat Jan 02 10:12:41 IST 2016,gonna ina coupl month crazi time fli
JordynNito,Sat Jan 02 09:01:41 IST 2016,she believ shoot star believ shoe car
JordynNito,Fri Jan 01 08:03:17 IST 2016,funkadel knee deep
JordynNito,Fri Jan 01 08:01:05 IST 2016,leon haywood want someth freaki
JordynNito,Fri Jan 01 07:52:24 IST 2016,bootsi collin id rather realmus classic
JordynNito,Sun Dec 27 12:36:27 IST 2015,roll thru parti first thing i see kitti pool full beer mytypaparti
JordynNito,Sat Dec 26 11:11:28 IST 2015,chill boxer watch movi manni hmu come outsid
JordynNito,Sat Dec 26 08:27:23 IST 2015,rt la novia la escuela como esta todo
JordynNito,Fri Dec 25 10:16:28 IST 2015,everybodi hand go stay
JordynNito,Fri Dec 25 10:15:00 IST 2015,you whatev like
JordynNito,Thu Dec 24 12:14:39 IST 2015,fulli load whip kno talk full load clip
JordynNito,Wed Dec 23 12:36:38 IST 2015,rt fuck yo bed sleep mine
JordynNito,Wed Dec 23 08:10:11 IST 2015,smoke weed like marley
JordynNito,Wed Dec 23 07:44:53 IST 2015,thank god
JordynNito,Tue Dec 22 13:08:32 IST 2015,now baller pope bottl henni cup
JordynNito,Tue Dec 22 12:34:28 IST 2015,that cabin fever thoe
JordynNito,Mon Dec 21 15:46:48 IST 2015,budda lover
JordynNito,Mon Dec 21 14:37:33 IST 2015,if gonna nigga
JordynNito,Mon Dec 21 05:57:18 IST 2015,small step toe
JordynNito,Mon Dec 21 01:40:01 IST 2015,last night brazi
JordynNito,Sun Dec 20 16:41:42 IST 2015,thank god i work today
JordynNito,Sun Dec 20 08:12:46 IST 2015,i roll quick bleezi homi level shit drop sum crum anoth homi yo shit turn life around
JordynNito,Sat Dec 19 10:47:03 IST 2015,rt lmaooo harri potter
JordynNito,Sat Dec 19 10:46:09 IST 2015,rt tupac concert use lit
JordynNito,Sat Dec 19 10:44:36 IST 2015,rt the pass smoov
JordynNito,Sat Dec 19 06:12:36 IST 2015,they wanna see succeed
JordynNito,Fri Dec 18 10:22:20 IST 2015,fr
