username,time,tweet
finessedbyjai,Wed Mar 23 05:29:58 IST 2016,that friend i like search
finessedbyjai,Wed Mar 23 05:28:28 IST 2016,
finessedbyjai,Wed Mar 23 05:28:00 IST 2016,any time i see work come across christian page i snipe
finessedbyjai,Wed Mar 23 04:14:23 IST 2016,self defens smh
finessedbyjai,Wed Mar 23 02:31:14 IST 2016,she real tho
finessedbyjai,Wed Mar 23 02:30:31 IST 2016,oh nah gentrif real
finessedbyjai,Wed Mar 23 01:54:06 IST 2016,lean thick look like snot
finessedbyjai,Wed Mar 23 01:44:57 IST 2016,i need good ox tail rice get life back track
finessedbyjai,Wed Mar 23 01:27:33 IST 2016,i gotta make fun friend often gay
finessedbyjai,Wed Mar 23 01:16:53 IST 2016,rt only da best chines spot got bullet proof glass linden blvd
finessedbyjai,Wed Mar 23 01:11:56 IST 2016,the nonviol part cri brownsvill eni bed stuy williamsburg
finessedbyjai,Wed Mar 23 01:03:18 IST 2016,why pound muscl work at t
finessedbyjai,Wed Mar 23 00:59:59 IST 2016,peopl get weird get much muscl
finessedbyjai,Tue Mar 22 21:22:10 IST 2016,you know karl kani jean iceberg sweat nah u form opinion
finessedbyjai,Tue Mar 22 21:20:25 IST 2016,your favorit rapper die one bop head even understand refer go sleep
finessedbyjai,Tue Mar 22 21:19:52 IST 2016,keef mani classic album nas uno
finessedbyjai,Tue Mar 22 21:17:53 IST 2016,keep retard hoe hula hoop life
finessedbyjai,Tue Mar 22 11:39:41 IST 2016,if titti instagram boyfriend null void
finessedbyjai,Tue Mar 22 10:17:19 IST 2016,spooki hour
finessedbyjai,Tue Mar 22 10:16:02 IST 2016,shit wick tonight
finessedbyjai,Tue Mar 22 07:03:05 IST 2016,all girl look differ person instagram
finessedbyjai,Tue Mar 22 06:05:11 IST 2016,oodl n noodl til casket drop word
finessedbyjai,Tue Mar 22 06:04:44 IST 2016,ate yesterday keep buck mom cook
finessedbyjai,Tue Mar 22 06:04:24 IST 2016,frank bean til i die u heard
finessedbyjai,Tue Mar 22 02:03:23 IST 2016,majid jordan care famili
finessedbyjai,Tue Mar 22 01:53:09 IST 2016,princ transcend gender
finessedbyjai,Tue Mar 22 01:31:20 IST 2016,no preme
finessedbyjai,Tue Mar 22 00:46:48 IST 2016,they said gucci come home gucci come home
finessedbyjai,Tue Mar 22 00:27:02 IST 2016,girl wear snap back aid
finessedbyjai,Mon Mar 21 22:46:41 IST 2016,mani great song last day mani
finessedbyjai,Mon Mar 21 22:42:30 IST 2016,when i die imma go smile i kept real never clown
finessedbyjai,Mon Mar 21 22:24:16 IST 2016,nowplay black girl lost nas
finessedbyjai,Mon Mar 21 20:12:11 IST 2016,pressur burst pipe
finessedbyjai,Mon Mar 21 08:33:19 IST 2016,need go peppa i get home
finessedbyjai,Mon Mar 21 07:51:55 IST 2016,me abl use photoshop good anybodi
finessedbyjai,Mon Mar 21 07:38:21 IST 2016,that said i best ever mario kart
finessedbyjai,Mon Mar 21 07:36:45 IST 2016,i make everybodi get tweet stop hate sucker
finessedbyjai,Mon Mar 21 04:40:19 IST 2016,that mood everi time i watch purpl rain
finessedbyjai,Mon Mar 21 04:39:54 IST 2016,flyest nigga ever
finessedbyjai,Mon Mar 21 04:17:23 IST 2016,mood
finessedbyjai,Mon Mar 21 03:48:02 IST 2016,somebodi photoshop jordan cri meme face
finessedbyjai,Mon Mar 21 03:39:36 IST 2016,the accuraci
finessedbyjai,Mon Mar 21 03:35:25 IST 2016,i got mitch paid full face right took sonni whip ace
finessedbyjai,Sun Mar 20 23:14:02 IST 2016,knock somebodi i bad mood sunday litti
