username,time,tweet
Keep_It103,Thu Sep 01 05:29:46 IST 2011,bol i look tre push garbag kitchen bedroom doorway this lil boy mine
Keep_It103,Thu Sep 01 05:24:41 IST 2011,bodi sore hell could realli use massag right
Keep_It103,Thu Sep 01 05:21:50 IST 2011,after long day good sleep interrupt i final
Keep_It103,Wed Aug 31 12:59:08 IST 2011,imma fat i keep eat time morn i eat full cours meal
Keep_It103,Wed Aug 31 11:54:55 IST 2011,trey songz flow holla u need
Keep_It103,Wed Aug 31 11:46:55 IST 2011,do see men i work
Keep_It103,Wed Aug 31 11:45:53 IST 2011,wow buddi told fuck gon make pull gun tonight hahaha
Keep_It103,Wed Aug 31 11:44:44 IST 2011,i lol
Keep_It103,Wed Aug 31 11:38:22 IST 2011,i need movi date i wanna see colombiano
Keep_It103,Wed Aug 31 11:30:35 IST 2011,lol i know u make night go fast
Keep_It103,Wed Aug 31 11:17:06 IST 2011,my cowork said big mistak send miami alon he riigghhhttt
Keep_It103,Wed Aug 31 11:15:56 IST 2011,haha lt gave origin day weekend i weekend n i promis i go make worthwhil
Keep_It103,Wed Aug 31 11:13:11 IST 2011,rt f ck kim lol lol i don get boxer bunch
Keep_It103,Wed Aug 31 09:07:42 IST 2011,rt you make femal heart smile take random tell beauti preach
Keep_It103,Wed Aug 31 09:04:40 IST 2011,i swear everi night i get work ambul
Keep_It103,Wed Aug 31 09:04:11 IST 2011,workflow
Keep_It103,Wed Aug 31 01:41:48 IST 2011,i good lol
Keep_It103,Wed Aug 31 01:35:07 IST 2011,fml i left phone ring cuz i expect import call i still slept fuccckkkk
Keep_It103,Tue Aug 30 17:40:40 IST 2011,lol tell shut
Keep_It103,Tue Aug 30 17:23:03 IST 2011,hi ta darius it obvious want attent
Keep_It103,Tue Aug 30 17:14:55 IST 2011,screw i stay til i leav those minut make differ
Keep_It103,Tue Aug 30 16:11:39 IST 2011,find job i wanna come back home
Keep_It103,Tue Aug 30 16:11:12 IST 2011,my co worker told kreg make big mistak let go miami he right lol i way live
Keep_It103,Tue Aug 30 15:15:17 IST 2011,i miss home sooo much this tampa life cuttin
Keep_It103,Tue Aug 30 13:48:59 IST 2011,being beauti mani disadvantag lol
Keep_It103,Tue Aug 30 13:36:55 IST 2011,how could someth dead feel right
Keep_It103,Tue Aug 30 13:12:03 IST 2011,i figur i want hair i think short cut
Keep_It103,Tue Aug 30 12:19:33 IST 2011,watch zoo keeper
Keep_It103,Tue Aug 30 12:18:44 IST 2011,lol i just pop b movi
Keep_It103,Tue Aug 30 10:55:57 IST 2011,hungri
Keep_It103,Tue Aug 30 10:55:07 IST 2011,naw imma fri our week start sunday i gotta work thur next thur
Keep_It103,Tue Aug 30 10:47:14 IST 2011,i got night i work thursday i took weekend
Keep_It103,Tue Aug 30 10:24:53 IST 2011,keyword lame he know approach women and hella opportun
Keep_It103,Tue Aug 30 10:19:06 IST 2011,lmao he gay realli scari he make head hurt lame i made word lol
Keep_It103,Tue Aug 30 10:17:06 IST 2011,i done work tonight i count round now i go noth next hour
Keep_It103,Tue Aug 30 10:14:45 IST 2011,this guy job lame still virgin scare shitless women r u serious
Keep_It103,Tue Aug 30 09:32:39 IST 2011,beyonceflow
Keep_It103,Tue Aug 30 09:32:14 IST 2011,if i ur gf i b u somebodi hurt u even somebodi
Keep_It103,Tue Aug 30 09:23:52 IST 2011,screw peopl say b jay z cute coupl they look happi togeth i want love like
Keep_It103,Tue Aug 30 09:19:22 IST 2011,rt i hate tuesday nobodi right let slideeeeeeeeeeeeeeeeeee i
Keep_It103,Tue Aug 30 09:17:03 IST 2011,it offici i look fw weekend
Keep_It103,Tue Aug 30 09:08:53 IST 2011,how could someth dead feel right
Keep_It103,Tue Aug 30 09:08:23 IST 2011,my afflict i addict i lie poison
Keep_It103,Tue Aug 30 09:02:52 IST 2011,so dang i thought i special
Keep_It103,Tue Aug 30 09:01:14 IST 2011,workflow i believ get earli i get dot i earli i sit park lot til messi
Keep_It103,Tue Aug 30 08:41:34 IST 2011,i miss oomf
Keep_It103,Tue Aug 30 08:35:53 IST 2011,rt wonder kim readi work no babi close beauti eye till like watchin u sleep i readi nite
Keep_It103,Tue Aug 30 02:14:51 IST 2011,i come realize babi big head that ok though he still handsom
Keep_It103,Mon Aug 29 16:42:28 IST 2011,i realli miss
Keep_It103,Mon Aug 29 16:37:38 IST 2011,bang headach it almost time make way home
