username,time,tweet
MyDaily420,Sat Sep 01 05:29:48 IST 2012,you meant camera girl eyecandi too hot
MyDaily420,Sat Sep 01 05:28:56 IST 2012,rt i love contour sever torso
MyDaily420,Sat Sep 01 05:27:33 IST 2012,sound like welcom committe town new meat go n get d girl
MyDaily420,Sat Sep 01 05:24:05 IST 2012,rt pisc stay readi back plan back plan never slippin
MyDaily420,Sat Sep 01 05:22:22 IST 2012,rt pisc way make ppl want want giftandcurs
MyDaily420,Sat Sep 01 05:22:12 IST 2012,who grow boy menac ii societi lmao
MyDaily420,Sat Sep 01 05:18:11 IST 2012,rt smile natur lift muscl face slow rate age
MyDaily420,Sat Sep 01 05:17:31 IST 2012,hmmmm i wanna halloween you dress wife i realli happi
MyDaily420,Sat Sep 01 04:54:09 IST 2012,rt global men focus women breast sexiest featur women think eye sexiest
MyDaily420,Sat Sep 01 04:28:51 IST 2012,you perfect babi girl and let anyon els tell ya otherwis
MyDaily420,Sat Sep 01 00:03:25 IST 2012,rt weed happi marijuana legal
MyDaily420,Fri Aug 31 23:59:39 IST 2012,my mom homophob good thing i lesbian when hookin tho lmao
MyDaily420,Fri Aug 31 23:57:41 IST 2012,i carri bowl pocket pretti much time never sure next time i crave thc
MyDaily420,Fri Aug 31 23:53:19 IST 2012,just one day i got mind weed weed mind wait everi day oh well
MyDaily420,Fri Aug 31 23:51:02 IST 2012,smokinloud champion pleas don bring weak shit way amen
MyDaily420,Fri Aug 31 23:50:36 IST 2012,rt in advertis time display clock
MyDaily420,Fri Aug 31 20:43:43 IST 2012,tgif twitter world now pick lighter smokeon stayhigh
MyDaily420,Fri Aug 31 20:41:03 IST 2012,i start believ god must like stupid peopl make mani on posit note happi friday mofo
MyDaily420,Fri Aug 31 02:56:50 IST 2012,smmmmmmoke
MyDaily420,Thu Aug 30 11:07:55 IST 2012,rt in disney comic call mickey mous medicin man goofi mickey becom drug dealer
MyDaily420,Wed Aug 29 23:37:13 IST 2012,i creepin offic today so
MyDaily420,Wed Aug 29 23:22:35 IST 2012,put em bodi bag johnni oldschool karatekid
MyDaily420,Wed Aug 29 22:19:36 IST 2012,rt the first beer cigarett marijuana everi singl person life bought money
MyDaily420,Wed Aug 29 22:17:53 IST 2012,rt stonerlov
MyDaily420,Wed Aug 29 22:17:48 IST 2012,rt stayhigh
MyDaily420,Wed Aug 29 22:17:43 IST 2012,
MyDaily420,Wed Aug 29 21:36:04 IST 2012,love girl follow
MyDaily420,Wed Aug 29 21:35:38 IST 2012,rt happi high
MyDaily420,Wed Aug 29 20:47:48 IST 2012,rt s nf
MyDaily420,Wed Aug 29 20:47:47 IST 2012,rt stonerlov
MyDaily420,Wed Aug 29 09:59:34 IST 2012,rt in slumber parti barbi came book titl how to lose weight one tip don eat
MyDaily420,Wed Aug 29 09:28:06 IST 2012,i give hour get high possibl i retir bed even i think enough time get stone
MyDaily420,Wed Aug 29 09:27:10 IST 2012,chi do know lighter smokeon
MyDaily420,Wed Aug 29 06:39:10 IST 2012,i total then reason i fall asleep til come smoke
MyDaily420,Wed Aug 29 06:30:23 IST 2012,i start late today cuz i tire morn otherwis i usual get i need smoke buddi
MyDaily420,Wed Aug 29 06:25:38 IST 2012,i still work stuck anoth hour i got hitter car ride home
MyDaily420,Wed Aug 29 06:22:49 IST 2012,well alrighti send resum i see offici posit got open
MyDaily420,Wed Aug 29 06:17:20 IST 2012,you mean normal job lol yes type hour pleasant only problem would commut home i guess
MyDaily420,Wed Aug 29 05:45:41 IST 2012,well would like monday thru friday
MyDaily420,Wed Aug 29 03:19:30 IST 2012,twitter gateway drug insomnia lack assoc peopl person n dissolv grammar charact less weed cure
MyDaily420,Wed Aug 29 03:12:43 IST 2012,yea i think accur either i continu smoke bowl lol
MyDaily420,Wed Aug 29 01:46:50 IST 2012,i check problem job downtown chicago lincoln park actual too far
MyDaily420,Wed Aug 29 00:56:37 IST 2012,what type work wanna my offic grow need peopl numer job
MyDaily420,Tue Aug 28 23:52:23 IST 2012,i addict drug those bad i actual addict lighter weed give reason use stayhigh
MyDaily420,Tue Aug 28 23:29:44 IST 2012,how fun would road trip rv full pothead tho gotta make happen we smoke mt rushmor yellow stone grand canyon
MyDaily420,Tue Aug 28 23:22:13 IST 2012,before good weather come end year i think rent rv n explor road trip pack full stoner who
MyDaily420,Tue Aug 28 23:05:55 IST 2012,lmao babi jesus still sleep bed poop laugh last night but i know got joint later
