username,time,tweet
NokiaN97Sales,Sat Sep 01 05:29:58 IST 2012,told gf tonight blue moon told beer actual moon lmao
NokiaN97Sales,Sat Sep 01 05:21:45 IST 2012,from us celluloco happi blue moon everyon learn tonight u look sky
NokiaN97Sales,Sat Sep 01 03:37:36 IST 2012,put paw pictur best look dog miami help kahlua win contest
NokiaN97Sales,Wed Aug 29 05:19:06 IST 2012,celluloco com launch super afford tablet ainol novo aurora ii android o s unlock white
NokiaN97Sales,Wed Aug 29 04:18:27 IST 2012,only panason eluga unlock gingerbread android w cam dualcor cpu
NokiaN97Sales,Wed Aug 29 03:32:43 IST 2012,introduc two line beast htc desir v dual sim unlock white
NokiaN97Sales,Wed Aug 29 02:47:15 IST 2012,pricedown notifi samsung sgh galaxi siii pebbl blue t mobil unlock
NokiaN97Sales,Wed Aug 29 02:19:42 IST 2012,ultra exlcus samsung sgh galaxi siii garnet red at t unlock lte global nowher els
NokiaN97Sales,Wed Aug 29 01:40:10 IST 2012,celluloco com invit meet world first full hd android tablet
NokiaN97Sales,Wed Aug 29 01:01:05 IST 2012,celluloco com report live ifa berlin start less hrs all mobil fanat stay tune
NokiaN97Sales,Wed Aug 29 00:46:17 IST 2012,samsung gt note ii android tablet bermuda caribbean latin america wifi
NokiaN97Sales,Wed Aug 29 00:13:53 IST 2012,celluloco com offer perman remot unlock servic at t appl iphon version eta hrs
NokiaN97Sales,Tue Aug 28 23:42:09 IST 2012,celluloco warehous blowout samsung gt galaxi note ii black unlock inch android tablet
NokiaN97Sales,Tue Aug 28 23:33:03 IST 2012,sale samsung gt galaxi note ii android tablet bermuda caribbean latin am wifi
NokiaN97Sales,Sat Aug 25 06:28:24 IST 2012,how to get your own googl vaniti url
NokiaN97Sales,Fri Aug 24 22:02:25 IST 2012,iphon pode ser mai fino que galaxi notícia techtudo
NokiaN97Sales,Fri Aug 24 21:31:55 IST 2012,news internet user show massacr empir state build nyc august
NokiaN97Sales,Fri Aug 24 21:15:12 IST 2012,polic kill gunman shoot outsid empir state build this just in blog
NokiaN97Sales,Fri Aug 24 03:31:43 IST 2012,apó ano homen são libertado graça post facebook notícia techtudo
NokiaN97Sales,Wed Aug 22 02:58:21 IST 2012,celluloco com proud introduc asus transform pad infin wifi no keyboard version royal blue
NokiaN97Sales,Tue Aug 21 21:53:28 IST 2012,tip one theeee coolest site web bookmark one folk the cool hunter
NokiaN97Sales,Tue Aug 21 21:51:52 IST 2012,isra donkey get wifi equip histor theme park engadget
NokiaN97Sales,Tue Aug 21 21:49:23 IST 2012,wow how cool panason expand smart home applianc line add android smart app cloud servic engadget
NokiaN97Sales,Tue Aug 21 21:42:19 IST 2012,diamond multimedia out android set top box gingerbread base sell engadget
NokiaN97Sales,Tue Aug 21 21:38:28 IST 2012,vintag mtv promo spot you cherish etern
NokiaN97Sales,Tue Aug 21 21:35:01 IST 2012,appl news leak iphon video reveal radic new design
NokiaN97Sales,Tue Aug 21 21:33:43 IST 2012,anoth daili cool tech tip chang top googl search result for your name free
NokiaN97Sales,Tue Aug 21 21:32:36 IST 2012,remind all skype user that skype add photo share latest io updat
NokiaN97Sales,Tue Aug 21 21:30:46 IST 2012,celluloco tip hacker show world how break almost any hotel room daili travel condé nast travel
NokiaN97Sales,Tue Aug 21 07:37:56 IST 2012,celluloco com blow htc one x unlock white global android os must see
NokiaN97Sales,Tue Aug 21 07:14:55 IST 2012,mega sale asus transform pad infin wifi unlock amethyst gray
NokiaN97Sales,Tue Aug 21 00:55:59 IST 2012,appl supera marca da microsoft e é empresa mai valiosa da história us bilhõ veja aqui
NokiaN97Sales,Sun Aug 19 23:03:22 IST 2012,wow celluloco receiv await afford blackberri curv limit white edit unlock see
NokiaN97Sales,Sun Aug 19 22:27:34 IST 2012,watch entireu uncut assang speech today hd courtesi
NokiaN97Sales,Sun Aug 19 22:26:19 IST 2012,connectifi combin all your internet network into one
NokiaN97Sales,Sun Aug 19 22:22:43 IST 2012,way pay dinner with your phone
NokiaN97Sales,Sun Aug 19 22:21:08 IST 2012,l a restaur give discount stay off your phone
NokiaN97Sales,Sun Aug 19 22:08:27 IST 2012,wow great celluloco deal samsung sgh galaxi note navi blue t mobil unlock w super amol screen
NokiaN97Sales,Sun Aug 19 20:28:17 IST 2012,berryunlock com present wikileak julian assang histor speech ecuador embassi london watch here
NokiaN97Sales,Sun Aug 19 08:39:29 IST 2012,present how connect blackberri playbook lte mobil network
NokiaN97Sales,Sun Aug 19 08:22:35 IST 2012,present lte blackberri playbook hand demo interview watch
NokiaN97Sales,Sun Aug 19 08:13:47 IST 2012,present insert sim card blackberri playbook lte how to demo youtub
NokiaN97Sales,Sun Aug 19 07:54:22 IST 2012,celluloco com alreadi ship unlock blackberri playbook lte cellular wi fi tablet bermuda
NokiaN97Sales,Sun Aug 19 06:29:24 IST 2012,julian assang fiasco six way spring troublesom fugit like assang embassi mail onlin
NokiaN97Sales,Sun Aug 19 06:21:57 IST 2012,deepest swim pool descend contain whop litr water
NokiaN97Sales,Sun Aug 19 06:19:50 IST 2012,you smoke crack judg call appl ridicul final day patent infring trial samsung
NokiaN97Sales,Sun Aug 19 06:19:09 IST 2012,loja poderão dar check facebook atravé de reconhecimento facial
NokiaN97Sales,Sat Aug 18 03:56:55 IST 2012,found thee coolest site offer firefox plugin optim ur gmail signatur
NokiaN97Sales,Sat Aug 18 01:02:02 IST 2012,remind u tablet capabl samsung gt galaxi note ii
NokiaN97Sales,Sat Aug 18 00:59:56 IST 2012,new tablet arriv notifi samsung gt galaxi note ii white unlock
