username,time,tweet
adveis,Sun Sep 01 05:29:48 IST 2013, or a hood ornament to the solar plexusor in some cases a change of pants
adveis,Sun Sep 01 05:11:01 IST 2013,honking your horn at a pedestrian is absolutely nothing like saying helloit just makes them think you are about to hit them
adveis,Fri Aug 30 07:05:09 IST 2013, yees
adveis,Fri Aug 30 05:23:39 IST 2013,someone come practice the organim in bible class
adveis,Fri Aug 30 04:25:39 IST 2013,on the stingle darry
adveis,Fri Aug 30 03:55:06 IST 2013, i volunteer
adveis,Mon Aug 26 03:40:50 IST 2013,todays struggle not responding every time i hear hey
adveis,Sat Aug 24 18:43:37 IST 2013,heres to cramming everything in every last available space otherwise known as how/why did he bring that much stuff
adveis,Sat Aug 24 01:33:42 IST 2013,dont wait for incentive its better to do it without
adveis,Thu Aug 22 10:02:48 IST 2013, it gave me laef
adveis,Wed Aug 21 09:53:35 IST 2013,rt  i really hate having to buy ridiculously expensive textbooks for non major classes 😡😡
adveis,Wed Aug 21 03:47:06 IST 2013,i so missed fresh market
adveis,Wed Aug 21 00:09:18 IST 2013, truth
adveis,Tue Aug 20 23:50:05 IST 2013,that moment when a page turner comes out for caro mio benitstwopages
adveis,Tue Aug 20 20:50:01 IST 2013, i bet you secretly love cargo shorts l but dont want anyone to know
adveis,Mon Aug 19 03:39:05 IST 2013,why do we even have speed limits on highways drivers exceed them 98 of the time police severely exceed them 95 of the timegetridofthem
adveis,Sat Aug 17 02:30:42 IST 2013,try saying social usurpation three times fast
adveis,Fri Aug 16 07:14:52 IST 2013,kabrich uhh23 your success through my failure
adveis,Fri Aug 16 07:10:19 IST 2013,kabrich uhh23 when i finally saw it i thought how obvious it wasand couldnt stop laughing at myself
adveis,Fri Aug 16 06:47:10 IST 2013,kabrich uhh23 it took me like 30 seconds to realise those were cottage fries and not a piece of firewood
adveis,Fri Aug 16 01:16:42 IST 2013,its days like today that make me want to run red lights
adveis,Wed Aug 14 09:14:05 IST 2013,cm when does this reality show premiere
adveis,Sun Aug 11 09:14:05 IST 2013,forget heart disease writers block is the silent killerand also heart disease
adveis,Sun Aug 11 03:44:07 IST 2013, may i direct your attention to  and 
adveis,Sun Aug 11 00:10:59 IST 2013,god made freeze pops and then he created summer to give us an excuse to eat them
adveis,Thu Aug 08 23:13:34 IST 2013,it must be said im going to miss these four hour lunches
adveis,Wed Aug 07 02:15:21 IST 2013, oh sorry i thought that was a clue😉
adveis,Wed Aug 07 02:14:33 IST 2013, who is becca stovall
adveis,Tue Aug 06 03:27:53 IST 2013, you mean the font of american hope the streams of patriotic joy that flow hence from that convivial gemwitness the majesty
adveis,Mon Aug 05 23:56:18 IST 2013, exactlyits not that we think you need us to but that you shouldnt have to
adveis,Mon Aug 05 23:53:16 IST 2013,business ethics should be a more universally practiced thing than it isalas
adveis,Sat Aug 03 13:20:11 IST 2013, at least hes not as bad as schumann
adveis,Fri Aug 02 05:13:21 IST 2013, japan does it and look how much they accomplish
adveis,Thu Aug 01 23:55:33 IST 2013, oops
adveis,Thu Aug 01 04:22:08 IST 2013,rt  i wish i could live in a ralph lauren store
adveis,Wed Jul 31 22:49:36 IST 2013,to the lady on the phone in the restaurant please talk about your butt-fat elsewhereits kind of disgusting
adveis,Wed Jul 31 08:06:04 IST 2013,i just referred to moses as the first comic book hero in historyitworkstho sorrygod
adveis,Tue Jul 30 12:09:00 IST 2013,rt  i dont understand why all moms text with so many exclamation points
adveis,Mon Jul 29 02:39:19 IST 2013,this essay is getting out of hand used the words zenith denouement and catharsis correctly in the same paragraph stopmeplease
adveis,Mon Jul 29 00:16:07 IST 2013,alliteration is always appropriate
adveis,Thu Jul 25 21:58:10 IST 2013, try left-handed scissors
adveis,Sun Jul 21 04:04:57 IST 2013, wish i was there
adveis,Sat Jul 20 04:57:33 IST 2013, answer it to the end of the durufleno hello just [dissonance chaos madness]
adveis,Thu Jul 18 01:37:46 IST 2013, whats not to love
adveis,Tue Jul 16 04:30:34 IST 2013,im feeling blue today sartorially that is not emotionally
adveis,Tue Jul 16 01:04:37 IST 2013,hypothetical what would happen at mc if it was found out that acoustical deadening tiles were going to be put up in provine
adveis,Tue Jul 16 01:02:20 IST 2013,cm 🎶when we all--- get to heaven what a day of rejoicing that will be🎶
adveis,Sun Jul 14 08:20:20 IST 2013,choose your battles wisely
adveis,Sun Jul 14 08:20:01 IST 2013, i would be happy to obligei just need airfare ha
adveis,Sun Jul 14 04:30:48 IST 2013,cm we are all rooting for you tonight best wishes and good luck
