username,time,tweet
JeffreyBridges,Wed Mar 23 05:29:59 IST 2016,you great human
JeffreyBridges,Wed Mar 23 04:05:12 IST 2016,fellow writer we want submiss and truli fantast editor send us stuff
JeffreyBridges,Wed Mar 23 03:30:08 IST 2016,i unequivoc right hand unless i peel orang appar there are no rule all is chao
JeffreyBridges,Tue Mar 22 23:03:02 IST 2016,review super import drop share thought
JeffreyBridges,Tue Mar 22 06:47:19 IST 2016,you
JeffreyBridges,Tue Mar 22 02:16:59 IST 2016,okay kill ned
JeffreyBridges,Tue Mar 22 01:34:39 IST 2016,anoth new show launch next week tweet question host ok to air might get show
JeffreyBridges,Tue Mar 22 00:49:27 IST 2016,we watch all screener screener
JeffreyBridges,Tue Mar 22 00:46:44 IST 2016,fine astley geez
JeffreyBridges,Mon Mar 21 23:17:31 IST 2016,anoth star review episod archer armstrong audio drama get
JeffreyBridges,Mon Mar 21 06:14:26 IST 2016,congrat guy
JeffreyBridges,Mon Mar 21 04:04:54 IST 2016,tell perman sunshin utopia
JeffreyBridges,Mon Mar 21 03:55:35 IST 2016,rt le talk real
JeffreyBridges,Sun Mar 20 08:14:30 IST 2016,rt anyon know anyth mean answer nobodi noth mean anyth bother talk
JeffreyBridges,Sun Mar 20 00:33:07 IST 2016,rt we still all favorit comic exclus collect valiant booth stop https
JeffreyBridges,Sat Mar 19 09:15:14 IST 2016,cryptic
JeffreyBridges,Sat Mar 19 09:13:36 IST 2016,i love place this wall sofa
JeffreyBridges,Sat Mar 19 04:21:19 IST 2016,rt join univers brought life first time archer armstrong the audio drama https
JeffreyBridges,Sat Mar 19 02:39:23 IST 2016,griffith observatori one favorit place earth
JeffreyBridges,Fri Mar 18 20:46:36 IST 2016,more great review episod one archer armstrong audio drama
JeffreyBridges,Fri Mar 18 19:50:06 IST 2016,you thought break law awesom one person allow tini
JeffreyBridges,Fri Mar 18 19:40:02 IST 2016,my thumb hurt favorit i amaz
JeffreyBridges,Fri Mar 18 19:37:09 IST 2016,he alway order warp revers take light year odomet
JeffreyBridges,Fri Mar 18 06:58:34 IST 2016,i n s a n e action favorit kind
JeffreyBridges,Fri Mar 18 06:22:12 IST 2016,so cool
JeffreyBridges,Fri Mar 18 06:21:46 IST 2016,easier answer facebook i
JeffreyBridges,Fri Mar 18 06:20:13 IST 2016,hi can dm rate have small page project i look get letter thank
JeffreyBridges,Fri Mar 18 04:20:10 IST 2016,oh rise graphic also excel cutscen anim like featur cgi anim studio stuff amaz
JeffreyBridges,Fri Mar 18 04:14:58 IST 2016,mass effect push earli i think fallout dlc start arriv next week
JeffreyBridges,Fri Mar 18 04:11:25 IST 2016,rise even better gameplay explor puzzl
JeffreyBridges,Fri Mar 18 04:07:31 IST 2016,almost done rise tomb raider so love and world mani possibl my brain buzz idea
JeffreyBridges,Thu Mar 17 23:16:55 IST 2016,it i even dislik first two movi i dug well enough i fall love
JeffreyBridges,Thu Mar 17 23:15:03 IST 2016,i honest sure x men huge teen year it odd
JeffreyBridges,Thu Mar 17 23:14:42 IST 2016,i heard good thing good thing first class care meter still rise zero
JeffreyBridges,Thu Mar 17 23:13:24 IST 2016,haven seen desir i use love comic i care seen movi sinc
JeffreyBridges,Thu Mar 17 19:43:58 IST 2016,rt time wake archer armstrong audio drama amazon audibl https
JeffreyBridges,Thu Mar 17 06:24:12 IST 2016,what realli lack remark larg number unintent doubl entendr
JeffreyBridges,Thu Mar 17 05:08:13 IST 2016,you mean like
JeffreyBridges,Thu Mar 17 01:06:03 IST 2016,we good start
JeffreyBridges,Wed Mar 16 21:57:49 IST 2016,what caught word speak
JeffreyBridges,Wed Mar 16 21:48:23 IST 2016,i spi
JeffreyBridges,Wed Mar 16 21:09:38 IST 2016,here get ep only amazon audibl itun
JeffreyBridges,Wed Mar 16 21:08:08 IST 2016,we so proud a a show pleas check let us know think on amazon itun audibl
JeffreyBridges,Wed Mar 16 20:56:16 IST 2016,rt you also get archer armstrong audio drama itun
JeffreyBridges,Wed Mar 16 20:56:08 IST 2016,rt perhap prefer archer armstrong audio drama amazon
JeffreyBridges,Wed Mar 16 20:56:00 IST 2016,rt the archer and armstrong audio drama episod get audibl
JeffreyBridges,Wed Mar 16 19:49:30 IST 2016,yeah like fifteen year ago i rememb noth mayb intent
JeffreyBridges,Wed Mar 16 08:43:45 IST 2016,ha i most rif concept i made script it topic interest
JeffreyBridges,Wed Mar 16 08:39:47 IST 2016,i dunno talent there aw lot crazi coincid plot stuff one right mind would well
