username,time,tweet
Becky_Bee,Tue Mar 01 05:29:22 IST 2016,case want need
Becky_Bee,Tue Mar 01 05:29:08 IST 2016,i need
Becky_Bee,Tue Mar 01 05:12:17 IST 2016,rt where see year
Becky_Bee,Tue Mar 01 05:07:47 IST 2016,where do i get a nic cage tshirt
Becky_Bee,Tue Mar 01 01:10:47 IST 2016,rt children author dedic new book home volunt famili support
Becky_Bee,Tue Mar 01 00:24:05 IST 2016,rt so proud i join twitter share now i need https
Becky_Bee,Tue Mar 01 00:23:53 IST 2016,twitter hooray hello egg
Becky_Bee,Fri Feb 26 00:25:53 IST 2016,no one told dog year scotbookconf
Becky_Bee,Fri Feb 26 00:23:31 IST 2016,rt what kid read half term anyth enjoy no thing bad book children
Becky_Bee,Fri Feb 26 00:23:15 IST 2016,rt at last children illustr recognis import art form right andrew franklin
Becky_Bee,Fri Feb 26 00:22:52 IST 2016,brilliant both treasur trove
Becky_Bee,Thu Feb 25 14:42:43 IST 2016,rt thank great review what will danni do today
Becky_Bee,Thu Feb 25 14:41:21 IST 2016,you choos stori wonder new pic book
Becky_Bee,Thu Feb 25 14:36:04 IST 2016,rt discov world minibeast new titl bbc present https
Becky_Bee,Thu Feb 25 14:34:56 IST 2016,watch cheeki gremlin happi public day
Becky_Bee,Thu Feb 25 02:12:35 IST 2016,rt waaaaah wefoundahat cover reveal the last hat trilog
Becky_Bee,Thu Feb 25 01:43:38 IST 2016,there is a dog on the tube a dog on the tube i tell you a corgi no less adventur itsthesimpleth
Becky_Bee,Fri Feb 19 14:18:26 IST 2016,rt congrat kate greenaway medal longliste
Becky_Bee,Tue Feb 16 19:38:01 IST 2016,woooo great news
Becky_Bee,Thu Feb 11 00:06:26 IST 2016,such great scheme
Becky_Bee,Wed Feb 10 23:53:51 IST 2016,rt happi chinesenewyear yearofthemonkey
Becky_Bee,Wed Feb 10 23:53:23 IST 2016,rt happi nationalumbrelladay better way find need
Becky_Bee,Wed Feb 10 23:50:49 IST 2016,good
Becky_Bee,Wed Feb 10 04:13:23 IST 2016,rt a wonder array egmont titl best children book list today https
Becky_Bee,Sun Feb 07 18:22:38 IST 2016,infatu book zadi smith treasur perfect sunday compani
Becky_Bee,Sat Feb 06 03:02:37 IST 2016,rt chat morn amazinganimaljourney
Becky_Bee,Fri Feb 05 05:30:27 IST 2016,rt fanci good read junior book club round best new children book februari https
Becky_Bee,Tue Feb 02 23:19:46 IST 2016,rt wherestheeleph just spot top illustr children book list
Becky_Bee,Tue Feb 02 23:19:15 IST 2016,rt next week see chinesenewyear yearofthemonkey we monkey goodi giveaway
Becky_Bee,Thu Jan 28 23:55:39 IST 2016,rt an excit day histori stori publish first time
Becky_Bee,Thu Jan 28 23:35:24 IST 2016,rt happi public day amazinganimaljourney amaz journey
Becky_Bee,Thu Jan 28 16:58:19 IST 2016,rt happi public day amazinganimaljourney
Becky_Bee,Thu Jan 28 15:57:24 IST 2016,happi pub day such wonder book
Becky_Bee,Thu Jan 28 15:54:44 IST 2016,so mani brilliant book publish today
Becky_Bee,Fri Jan 22 23:29:56 IST 2016,also i like pictur daisi masterpiec
Becky_Bee,Fri Jan 22 23:29:27 IST 2016,hope websit finish
Becky_Bee,Fri Jan 22 23:28:19 IST 2016,aw hello i grand good hear
Becky_Bee,Wed Jan 20 23:57:46 IST 2016,rt a supermarket gremlin decid join lunch today
Becky_Bee,Sat Jan 16 00:28:08 IST 2016,rt take two
Becky_Bee,Thu Jan 14 23:54:17 IST 2016,champ
Becky_Bee,Thu Jan 14 23:53:35 IST 2016,rt no pressur rule book the import protect read resolut
Becky_Bee,Thu Jan 14 23:48:03 IST 2016,rt what will danni do today a delight full brim brillianc bravo
Becky_Bee,Tue Jan 12 04:03:43 IST 2016,aw make sad scotland hope goe grand
Becky_Bee,Tue Jan 12 00:37:27 IST 2016,rt david bowi tilda swinton tilda swinton david bowi
Becky_Bee,Tue Jan 12 00:34:54 IST 2016,rt a truli interact book reader determin danni today by
Becky_Bee,Fri Jan 08 14:34:03 IST 2016,i never invit parti
Becky_Bee,Fri Jan 08 04:59:38 IST 2016,rt read is import iwond storytel
Becky_Bee,Tue Jan 05 02:06:37 IST 2016,rt what happen children book our lit calendar tell us miss
Becky_Bee,Tue Jan 05 02:01:18 IST 2016,rt egmontuk launch list modern classic
Becky_Bee,Fri Jan 01 01:44:18 IST 2016,go london book collect start look pretti jammi
