username,time,tweet
TrickUpMy_sLEVY,Sun Sep 01 05:29:48 IST 2013,i realli hope someon bring life size cutout this us movi
TrickUpMy_sLEVY,Sun Sep 01 05:15:00 IST 2013,i go stand outsid so anyon ask i outstand
TrickUpMy_sLEVY,Sun Sep 01 05:14:06 IST 2013,rt i even fit straw caprisun
TrickUpMy_sLEVY,Sat Aug 31 07:01:47 IST 2013,dat cray
TrickUpMy_sLEVY,Sat Aug 31 05:18:23 IST 2013,pleas look pictur camera roll i show one pictur that exact i want said one ever
TrickUpMy_sLEVY,Sat Aug 31 04:56:02 IST 2013,i googl plus notif i know wish cool swag
TrickUpMy_sLEVY,Fri Aug 30 07:56:46 IST 2013,rt someon obnoxi tell someth complet stupid
TrickUpMy_sLEVY,Fri Aug 30 06:48:35 IST 2013,keepingupwiththes
TrickUpMy_sLEVY,Fri Aug 30 06:45:29 IST 2013,i miss much come back meeee break vanessa hudgen babi come back song
TrickUpMy_sLEVY,Fri Aug 30 06:39:40 IST 2013,i crash hors bridg i care texa
TrickUpMy_sLEVY,Fri Aug 30 06:04:04 IST 2013,kinda mad i endless suppli frozen yogurt room
TrickUpMy_sLEVY,Fri Aug 30 05:04:21 IST 2013,dear left hand you free ride entir life right hand get hurt anyth wow step game
TrickUpMy_sLEVY,Thu Aug 29 21:07:37 IST 2013,rt drop new singl i singl
TrickUpMy_sLEVY,Thu Aug 29 06:48:42 IST 2013,school schoo scho sch sc s so so h so ho so so so ab so abo so abou so so n so
TrickUpMy_sLEVY,Thu Aug 29 06:05:29 IST 2013,rt hakuna matata continu wonder phrase
TrickUpMy_sLEVY,Thu Aug 29 05:21:57 IST 2013,insid insid count gettingcray mindblown
TrickUpMy_sLEVY,Thu Aug 29 05:17:10 IST 2013,peopl like fridg insid count
TrickUpMy_sLEVY,Wed Aug 28 07:10:13 IST 2013,i say top talent includ trip noth get angri autocorrect
TrickUpMy_sLEVY,Tue Aug 27 10:08:39 IST 2013,rt ok im done when time go back cltc
TrickUpMy_sLEVY,Tue Aug 27 08:14:26 IST 2013,to bbg bbg that question
TrickUpMy_sLEVY,Tue Aug 27 05:05:45 IST 2013,i pretti sure i go doctor appoint parti
TrickUpMy_sLEVY,Tue Aug 27 04:25:07 IST 2013,sometim i wish i mermaid i could take nap bathtub scare drown
TrickUpMy_sLEVY,Mon Aug 26 03:31:44 IST 2013,i love play fetch dog like readi come get na na na na
TrickUpMy_sLEVY,Sun Aug 25 22:29:21 IST 2013,when life hand lulu lemon make lulu lemonad
TrickUpMy_sLEVY,Sun Aug 25 08:29:48 IST 2013,rt one opportun use word oodl one use word oodl
TrickUpMy_sLEVY,Sun Aug 25 08:17:22 IST 2013,show drew nail polish i use well color combin way order color choos wise
TrickUpMy_sLEVY,Sun Aug 25 05:32:52 IST 2013,sushi that grammat incorrect i think mean sue
TrickUpMy_sLEVY,Sun Aug 25 05:10:11 IST 2013,oh miley stop stop
TrickUpMy_sLEVY,Sun Aug 25 04:45:32 IST 2013,if want good laugh watch tri use chopstick
TrickUpMy_sLEVY,Sun Aug 25 04:42:22 IST 2013,bbyo board school let go
TrickUpMy_sLEVY,Sat Aug 24 07:17:16 IST 2013,
TrickUpMy_sLEVY,Sat Aug 24 07:06:06 IST 2013,i problem my comput downstair backpack guest downstair i put pant thestruggl
TrickUpMy_sLEVY,Sat Aug 24 06:24:03 IST 2013,i use selfi halloween decor
TrickUpMy_sLEVY,Sat Aug 24 05:07:46 IST 2013,start bottom remind riski game jenga
TrickUpMy_sLEVY,Fri Aug 23 07:15:02 IST 2013,i pledg allegi flag oh bbg
TrickUpMy_sLEVY,Fri Aug 23 06:19:08 IST 2013,rt co worker email everyon need charger iphon jeez need brag get email
TrickUpMy_sLEVY,Fri Aug 23 06:16:09 IST 2013,next local campaign stop make vine drive
TrickUpMy_sLEVY,Fri Aug 23 05:51:14 IST 2013,when i i imagin guy go say hey tennesse and say yup then walk away
TrickUpMy_sLEVY,Thu Aug 22 23:57:17 IST 2013,rt we reach give gather
TrickUpMy_sLEVY,Thu Aug 22 07:14:03 IST 2013,my dog walk room realli must love onceinalifetim
TrickUpMy_sLEVY,Thu Aug 22 05:34:24 IST 2013,school back i guess mean time werkin time twerkin
TrickUpMy_sLEVY,Wed Aug 21 08:46:17 IST 2013,if i talk i watch pretti littl liar feel special i get zone fulli invest watch hour
TrickUpMy_sLEVY,Wed Aug 21 05:53:10 IST 2013,rt swear pll fan patient peopl ever like peopl watch understand go
TrickUpMy_sLEVY,Wed Aug 21 05:24:53 IST 2013,but serious kardashian becom famous
TrickUpMy_sLEVY,Wed Aug 21 05:06:42 IST 2013,i forgot school
TrickUpMy_sLEVY,Tue Aug 20 18:02:37 IST 2013,there better way start school year run wall way hous typic
TrickUpMy_sLEVY,Tue Aug 20 09:40:27 IST 2013,anyth divis two
TrickUpMy_sLEVY,Tue Aug 20 05:17:07 IST 2013,life wait storm pass learn danc rain without get phone wet
TrickUpMy_sLEVY,Tue Aug 20 01:35:54 IST 2013,tweetabond omg coval bond we share much besti
TrickUpMy_sLEVY,Tue Aug 20 01:25:21 IST 2013,ugh jealous
