username,time,tweet
AldoCastro20,Tue Mar 01 05:29:37 IST 2016,how gonna celebr earli close game
AldoCastro20,Tue Mar 01 05:28:57 IST 2016,rt video hs basketbal team celebr state titl prematur lose buzzer beater
AldoCastro20,Tue Mar 01 05:28:47 IST 2016,rt goe hard paint love energi work ethic
AldoCastro20,Tue Mar 01 05:25:26 IST 2016,rt leo s full speech rt to save a life
AldoCastro20,Tue Mar 01 05:25:05 IST 2016,
AldoCastro20,Tue Mar 01 05:24:27 IST 2016,break second yard dash best thing i seen day runrichrun
AldoCastro20,Tue Mar 01 04:58:23 IST 2016,rt realiz rich eisen sudden faster
AldoCastro20,Tue Mar 01 04:58:05 IST 2016,rt bronco elway said trevathan test market team focus von malik brock would still like trevathan back
AldoCastro20,Tue Mar 01 04:39:34 IST 2016,rt russ u favorit superstar stop rawr xd shit
AldoCastro20,Tue Mar 01 04:38:50 IST 2016,rt raider one team hold formal interview mackensi alexand agent confirm
AldoCastro20,Tue Mar 01 04:38:22 IST 2016,rt when curri come gonna help u shoot foot jump shot
AldoCastro20,Tue Mar 01 04:37:36 IST 2016,rt stephen curri left ankl question tomorrow night game vs atlanta festus eze left knee surgeri
AldoCastro20,Tue Mar 01 04:06:19 IST 2016,rt game left
AldoCastro20,Tue Mar 01 04:05:22 IST 2016,rt don forget ya boy actual cover punt condo
AldoCastro20,Tue Mar 01 04:05:15 IST 2016,rt
AldoCastro20,Tue Mar 01 04:05:14 IST 2016,rt chucki chees
AldoCastro20,Tue Mar 01 04:04:26 IST 2016,rt god damn
AldoCastro20,Tue Mar 01 04:03:39 IST 2016,rt with sign pff updat free agenc preview oakland raider
AldoCastro20,Tue Mar 01 03:39:38 IST 2016,rt just wanna tell support raider fan base i realli appreci support feel good call
AldoCastro20,Tue Mar 01 03:27:41 IST 2016,rt congrat bruh
AldoCastro20,Tue Mar 01 03:23:15 IST 2016,rt haha wherev brother lol
AldoCastro20,Tue Mar 01 03:19:53 IST 2016,rt don play lol
AldoCastro20,Tue Mar 01 03:18:41 IST 2016,rt congrat man happi well deserv
AldoCastro20,Tue Mar 01 03:18:38 IST 2016,rt congrat new contract happi ya bro
AldoCastro20,Tue Mar 01 03:18:01 IST 2016,rt instead call girl thirsti call d hydrat
AldoCastro20,Tue Mar 01 03:16:57 IST 2016,rt we sign punter long term contract extens read
AldoCastro20,Tue Mar 01 03:16:54 IST 2016,rt raider announc sign p marquett king contract extens
AldoCastro20,Tue Mar 01 03:16:51 IST 2016,rt last season king set franchis record punt place insid yard line
AldoCastro20,Tue Mar 01 03:16:48 IST 2016,rt a messag raidern king
AldoCastro20,Tue Mar 01 03:16:46 IST 2016,rt turn in contract wear black visor
AldoCastro20,Tue Mar 01 03:16:44 IST 2016,rt congrat bruh best leagu much deserv
AldoCastro20,Tue Mar 01 03:16:43 IST 2016,rt congrat fam
AldoCastro20,Tue Mar 01 03:16:41 IST 2016,rt he board long time check best photo marquett king
AldoCastro20,Tue Mar 01 03:16:38 IST 2016,rt congrat bro you buy camo want
AldoCastro20,Tue Mar 01 03:16:36 IST 2016,rt congrat bro take eat alreadi
AldoCastro20,Tue Mar 01 03:16:35 IST 2016,rt that ray guy type punt marquett king impress season
AldoCastro20,Tue Mar 01 03:16:31 IST 2016,rt where u tri go dude
AldoCastro20,Tue Mar 01 03:16:28 IST 2016,rt with season offici earli look oppon
AldoCastro20,Tue Mar 01 01:03:12 IST 2016,rt break set new runrichrun record stjude
AldoCastro20,Tue Mar 01 01:03:05 IST 2016,rt the raider sign punter marquett king year extens sourc said the team announc sign
AldoCastro20,Tue Mar 01 01:03:03 IST 2016,rt raider sign p marquett king year extens worth sourc say guarante year
AldoCastro20,Tue Mar 01 01:02:49 IST 2016,rt with king done raider hope lock lt donald penn covet bill tag cordi glenn penn
AldoCastro20,Tue Mar 01 00:57:59 IST 2016,miss run i school
AldoCastro20,Mon Feb 29 23:14:33 IST 2016,rt tune today run cours pleas hit donat button
AldoCastro20,Mon Feb 29 20:52:57 IST 2016,rt it rest afc east alreadi need drink
AldoCastro20,Mon Feb 29 20:25:43 IST 2016,rt good morn leapday sfgiant sfgspring
AldoCastro20,Mon Feb 29 20:23:48 IST 2016,rt truuuuuu
AldoCastro20,Mon Feb 29 20:10:32 IST 2016,rt here inscript heel canadi cleat the offic kill first shift ever tragic https
AldoCastro20,Mon Feb 29 12:03:45 IST 2016,rt when first put tip
AldoCastro20,Mon Feb 29 12:02:31 IST 2016,realli want go school tomorrow
