username,time,tweet
GoBostoncom,Sat Sep 01 05:29:46 IST 2012,if you think ideal protein is expensive think about the cost of overweight diabetes hypertension 
GoBostoncom,Sat Sep 01 05:26:17 IST 2012,you make my speakers go boom boom boston  get your goboston card 
GoBostoncom,Sat Sep 01 05:21:22 IST 2012,cant wait to lose weight  start today ideal protein diet  im ready when you are   
GoBostoncom,Sat Sep 01 05:20:10 IST 2012,bbq boston labor day fun  ideal protein works great with bbq  grilled veggies  
GoBostoncom,Sat Sep 01 05:17:54 IST 2012,you be my sunny day ill be your shady tree boston its labor day  have fun   
GoBostoncom,Sat Sep 01 05:16:54 IST 2012,ill be your sweet ice tea boston goboston cards go have fun   
GoBostoncom,Sat Sep 01 05:15:40 IST 2012,nfl fantasy draft vs boston duck boats pick your fun  
GoBostoncom,Sat Sep 01 05:12:56 IST 2012,labor day boston goboston cards save big duck boats tours attractions  
GoBostoncom,Sat Sep 01 05:11:20 IST 2012,go boston cards are hot this weekend  save money boston attractions goboston  
GoBostoncom,Sat Sep 01 05:07:11 IST 2012,nfl fantasy football vs ideal protein diet change your life 
GoBostoncom,Sat Sep 01 05:04:46 IST 2012,if you are ready to start ideal protein diet im ready to show you how nashua pepperell boston  labor day weekend
GoBostoncom,Sat Sep 01 04:47:36 IST 2012,labor day weekend ideal protein nashua pepperell boston  yes were open 
GoBostoncom,Thu Aug 30 07:06:55 IST 2012,would  you like to make an offer on one of my best domains   im considering selling   what will you offer me boston
GoBostoncom,Thu Aug 30 06:48:23 IST 2012,passionate wellcoach coach joyce loves ideal protein idealprotein  best coach best product best diet  it works 
GoBostoncom,Wed Aug 29 14:19:21 IST 2012,where do you turn and what do you do when you get that end-of-the-rope feeling  how do you ask for help  
GoBostoncom,Wed Aug 29 07:57:06 IST 2012,thinking about losing weight  thinking thinking thinking lose any weight yet ideal protein 
GoBostoncom,Wed Aug 29 07:47:07 IST 2012,ideal protein  heard of it  weight loss for smart people  fast  done  your last diet  nashua pepperell boston 
GoBostoncom,Tue Aug 28 07:18:53 IST 2012,rt   you work with a lot of local hockey places/skate shops right can you think of anywhere that would have size 
GoBostoncom,Mon Aug 27 19:24:34 IST 2012,rt  moving day started my morning with a rich and chocolately idealprotein drink - feeling great and ready to go  
GoBostoncom,Mon Aug 27 17:46:14 IST 2012,best way to learn if a wellness coach is right for you to try it  
GoBostoncom,Mon Aug 27 17:10:09 IST 2012,ideal protein workshop tonight 630 pm nashua free 
GoBostoncom,Mon Aug 27 11:13:20 IST 2012,idealprotein support group meets fridays in pepperell    
GoBostoncom,Sun Aug 26 07:44:59 IST 2012,boston tickets   just sayin  
GoBostoncom,Sun Aug 26 07:26:20 IST 2012,rt  workout check ideal protein drink check get on it athletes perform better everyday   
GoBostoncom,Wed Aug 22 17:36:48 IST 2012,take the weight off your shoulders start ideal protein diet today 
GoBostoncom,Mon Aug 20 17:26:36 IST 2012,eat your own food  add a little ideal protein  the miracle of science  boston nashua
GoBostoncom,Mon Aug 20 17:16:39 IST 2012,want more energy try good clean living ideal protein 
GoBostoncom,Mon Aug 20 17:15:07 IST 2012,nashua pepperell ideal protein loved by doctors supported by science lose 25 pounds in two months 
GoBostoncom,Mon Aug 20 17:05:14 IST 2012,you will lose 25 pounds in two months its the diet supported by science ideal protein 
GoBostoncom,Mon Aug 20 17:00:57 IST 2012,i lost 25 pounds in two months with ideal protein and a great coach 
GoBostoncom,Mon Aug 20 16:58:17 IST 2012,boston area ideal protein best coaching lose 12 lbs in one month 
GoBostoncom,Mon Aug 20 16:52:44 IST 2012,rt jpagotto nothing like having monday off and playing golf fooooooore
GoBostoncom,Mon Aug 20 08:36:11 IST 2012,paul revere house - boston  via 
GoBostoncom,Mon Aug 20 08:36:00 IST 2012,fenway park tour  via 
GoBostoncom,Mon Aug 20 08:35:35 IST 2012,freedom trail walk into history tour  via 
GoBostoncom,Mon Aug 20 08:35:17 IST 2012,plimouth plantation  via 
GoBostoncom,Mon Aug 20 08:34:57 IST 2012,hop on/hop off beantown trolley - boston  via 
GoBostoncom,Mon Aug 20 08:25:41 IST 2012,top boston attractions  via 
GoBostoncom,Thu Aug 16 17:03:17 IST 2012,what if all the time we spend being negative is using up our healing energy  
GoBostoncom,Thu Aug 16 06:05:11 IST 2012,   scouting elite eshl juniors for islanders hockey    contact me
GoBostoncom,Mon Aug 13 17:28:08 IST 2012,get a discount on boston duck boat tour and boston museum of science 
GoBostoncom,Mon Aug 13 17:26:47 IST 2012,get a discount on boston duck boat tour and museum of science 
GoBostoncom,Mon Aug 13 17:24:25 IST 2012,go boston card save money on the duck boat tour 
GoBostoncom,Mon Aug 13 17:09:33 IST 2012,crispy cereal peach mango and chocolate drink are my favorite ideal protein treats what are yours
GoBostoncom,Sun Aug 12 07:25:30 IST 2012,rt  usain bolt is to sprinting what a swedish stickhandling ball is to serious dangles thegreatest
GoBostoncom,Sun Aug 12 07:24:25 IST 2012,rt  pretty fun way to spend a friday afternoon fridayfun start the weekend off right 
GoBostoncom,Sun Aug 12 07:24:19 IST 2012,rt  getting all jacked up and ready to head to the kenny chesney concert showtime
GoBostoncom,Sun Aug 12 07:23:51 IST 2012,rt  woot ff time i follow       
GoBostoncom,Sun Aug 12 07:23:45 IST 2012,rt  huzzah for ff we follow        
GoBostoncom,Sun Aug 12 07:23:37 IST 2012,rt   youre the best gia happy weekend ff       
