username,time,tweet
taylorpowell376,Sun Sep 01 05:29:48 IST 2013,my swim suit told go gym hoodi like nah girl good
taylorpowell376,Sat Aug 31 12:33:17 IST 2013,i alway read book kind romanc thing make sad guy perfect i get one
taylorpowell376,Fri Aug 30 00:18:38 IST 2013,got right
taylorpowell376,Fri Aug 30 00:14:55 IST 2013,i soccer memori
taylorpowell376,Thu Aug 29 10:03:41 IST 2013,if one got peter pan i would love forev
taylorpowell376,Tue Aug 27 23:34:34 IST 2013,sometim i lean real close cup tank jowl hand touch nose guy make sad ilh
taylorpowell376,Tue Aug 27 07:23:15 IST 2013,rt if basebal life softbal heaven
taylorpowell376,Tue Aug 27 03:14:21 IST 2013,i want thing softbal seed softbal
taylorpowell376,Mon Aug 26 20:13:22 IST 2013,rt why i date basebal player alreadi
taylorpowell376,Mon Aug 26 10:23:22 IST 2013,i went surf ride lake top came um yeah
taylorpowell376,Mon Aug 26 07:17:02 IST 2013,rt woohoo go two direct newbandalert
taylorpowell376,Fri Aug 23 11:23:17 IST 2013,rt i terribl person
taylorpowell376,Fri Aug 23 02:30:02 IST 2013,rt why go parti play sport
taylorpowell376,Fri Aug 23 01:34:42 IST 2013,i want go masquerad ball
taylorpowell376,Thu Aug 22 09:01:10 IST 2013,rt cinderella fairi godmoth get much damn prais idiot who hell leav parti midnight
taylorpowell376,Thu Aug 22 08:59:14 IST 2013,rt they need to make a softbal emoji softballprob
taylorpowell376,Thu Aug 22 08:43:53 IST 2013,hit dimpl ball fenc put biggest smile face i much fun tonight make wanna play
taylorpowell376,Thu Aug 22 05:24:28 IST 2013,feel nice put softbal pant back
taylorpowell376,Wed Aug 21 20:46:04 IST 2013,yeah i know i want happi
taylorpowell376,Wed Aug 21 20:42:05 IST 2013,now i know i never chanc congratszaynandperri
taylorpowell376,Wed Aug 21 05:08:27 IST 2013,period of thing blood why cant like fairi dust someth
taylorpowell376,Wed Aug 21 05:08:02 IST 2013,rt how girl put pant left leg right leg jump wiggl wiggl twerk red nose jump jump squat
taylorpowell376,Tue Aug 20 12:38:29 IST 2013,i dreamer
taylorpowell376,Tue Aug 20 11:48:26 IST 2013,my step mom tri buy love hubert lemonad
taylorpowell376,Tue Aug 20 01:25:41 IST 2013,rt idk im feel pound overweight
taylorpowell376,Mon Aug 19 21:41:32 IST 2013,rt just spoon boyfriend out contain it ice cream
taylorpowell376,Mon Aug 19 12:42:49 IST 2013,forev loser togeth
taylorpowell376,Mon Aug 19 12:01:52 IST 2013,rt thingsihateaboutpeopl i jus hate peopl
taylorpowell376,Mon Aug 19 10:47:26 IST 2013,my mom cut teen wolf marathon wtf mom notcool
taylorpowell376,Mon Aug 19 09:42:50 IST 2013,rt guy understand
taylorpowell376,Sun Aug 18 23:58:09 IST 2013,when thigh big guy shut zipper cage thing el oh el
taylorpowell376,Sun Aug 18 22:43:52 IST 2013,rt i want reliv last night
taylorpowell376,Sun Aug 18 11:22:10 IST 2013,i feel like i use human punch bag idc i lost concert virgin i love everi sec
taylorpowell376,Sat Aug 17 10:08:13 IST 2013,think martin luther king jr presid that good laugh
taylorpowell376,Fri Aug 16 21:54:37 IST 2013,rt hold wait
taylorpowell376,Fri Aug 16 12:58:13 IST 2013,i go hybrid
taylorpowell376,Fri Aug 16 02:03:04 IST 2013,when uncl jess play michel heart beat chest
taylorpowell376,Thu Aug 15 15:50:00 IST 2013,i need sleep
