username,time,tweet
stupidtalk,Tue Mar 01 05:29:51 IST 2016,media consortium consid polit parti protestor ableg
stupidtalk,Tue Mar 01 03:10:46 IST 2016,rt i hope uber decid compli law shut servic hate see forc legal issu yegcc
stupidtalk,Tue Mar 01 01:01:12 IST 2016,rt crusad particular notion public interest realli bag someth yes
stupidtalk,Tue Mar 01 00:59:27 IST 2016,journalist protest confus
stupidtalk,Tue Mar 01 00:58:29 IST 2016,rt virtual teacher coach servic rise can work
stupidtalk,Tue Mar 01 00:57:14 IST 2016,rt this happi place makedonalddrumpfagain
stupidtalk,Tue Mar 01 00:55:47 IST 2016,rt elect trump nation disast economi constitut secur
stupidtalk,Tue Mar 01 00:40:15 IST 2016,ever seen media outlet run protest
stupidtalk,Tue Mar 01 00:37:49 IST 2016,media protest like protestor polticalparti
stupidtalk,Tue Mar 01 00:36:11 IST 2016,sign prove polit parti not media
stupidtalk,Mon Feb 29 19:34:14 IST 2016,rt bump expect ann hathaway shine vaniti fair oscar parti
stupidtalk,Mon Feb 29 19:33:59 IST 2016,rt see queen elizabeth birthday china karat gold
stupidtalk,Mon Feb 29 19:33:28 IST 2016,rt all great chang america begin dinner tabl ronald reagan
stupidtalk,Mon Feb 29 19:30:57 IST 2016,rt cbc tim horton corpor workforc let go well babi time shoploc
stupidtalk,Mon Feb 29 19:30:23 IST 2016,rt trump fare best area high level racist search
stupidtalk,Mon Feb 29 19:30:08 IST 2016,rt from espresso it look like hillari clinton super tuesday
stupidtalk,Mon Feb 29 11:14:26 IST 2016,rt break rubio went there trump know what they say about men
stupidtalk,Mon Feb 29 11:14:10 IST 2016,rt proud stand friend tonight pure courag inspir challeng us itsonus all us
stupidtalk,Mon Feb 29 11:12:37 IST 2016,rt season peac nonviol day abedchat edchat cdned cdnedchat
stupidtalk,Mon Feb 29 10:56:48 IST 2016,rt hey leo it climat chang freakin chinook search educ make ill
stupidtalk,Mon Feb 29 10:56:29 IST 2016,rt where abe vigoda late actor among star snub oscar in memoriam tribut
stupidtalk,Mon Feb 29 10:55:47 IST 2016,rt climat chang bad wreck environ fli cast crew argentina snow
stupidtalk,Mon Feb 29 10:33:18 IST 2016,oscar date
stupidtalk,Mon Feb 29 10:31:31 IST 2016,rt holi crap spotlight take best pictur what wild somewhat unpredict night oscarssocrazi
stupidtalk,Mon Feb 29 10:31:20 IST 2016,rt at last leo great speech oscar
stupidtalk,Mon Feb 29 10:26:37 IST 2016,rt tire but wait leo win i stop hear leo win oscar
stupidtalk,Mon Feb 29 10:26:09 IST 2016,go bed leowin
stupidtalk,Mon Feb 29 10:06:38 IST 2016,rt glenn close nomin mani time leo also oscar
stupidtalk,Mon Feb 29 10:05:41 IST 2016,rt vice pres biden proud stand friend ladi gaga tonight oscar
stupidtalk,Mon Feb 29 10:05:26 IST 2016,rt minim peopl group struggl inappropri especi joke funni oscar
stupidtalk,Mon Feb 29 10:05:17 IST 2016,rt so two joke expens asian actor throw one minor rais anoth writer oscar
stupidtalk,Mon Feb 29 10:04:34 IST 2016,rt after ladygaga i watch see happen leonardodicaprio oscar
stupidtalk,Mon Feb 29 10:03:47 IST 2016,i beat pick oscar
stupidtalk,Mon Feb 29 10:01:53 IST 2016,rt ladi gaga us cri shitti sam smith song whatev float boat
stupidtalk,Mon Feb 29 09:49:01 IST 2016,rt i cant express emot i feel survivor stood stage you damn strong angel
stupidtalk,Mon Feb 29 09:45:21 IST 2016,rt it s time oscar
stupidtalk,Mon Feb 29 09:45:13 IST 2016,rt joe biden amaz actor damn time recogn true talent oscar
stupidtalk,Mon Feb 29 09:43:57 IST 2016,rt how tell live alberta fb feed fill i hope dicaprio lose ha ha cdnpoli oscar ableg
stupidtalk,Mon Feb 29 09:43:49 IST 2016,rt i least qualifi man tonight vp us joebiden get stand ovat oscar
stupidtalk,Mon Feb 29 09:43:34 IST 2016,rt tell joe biden stop yell us oscar
stupidtalk,Mon Feb 29 09:43:27 IST 2016,rt thank bring import messag present oscar itsonus end sexual assault
stupidtalk,Mon Feb 29 09:42:19 IST 2016,rt real talk joe biden pleas run presid it s not too late oscar
stupidtalk,Mon Feb 29 09:40:51 IST 2016,rt i wish would post film oscar site could watch especi doc short foreign
stupidtalk,Mon Feb 29 09:39:16 IST 2016,rt is yet oscar
stupidtalk,Mon Feb 29 09:38:26 IST 2016,katiecour titan
stupidtalk,Mon Feb 29 09:37:24 IST 2016,rt here in memoriam abe vigoda sinc miss oscar
stupidtalk,Mon Feb 29 09:35:40 IST 2016,rt we still moment oscar
stupidtalk,Mon Feb 29 09:35:21 IST 2016,rt oh god i thought whole time i watch oscar i watch curl
stupidtalk,Mon Feb 29 09:34:37 IST 2016,rt uhhh excus forgot honor one abe vigoda in memoriam segment oscar
stupidtalk,Mon Feb 29 09:32:22 IST 2016,rt leonard nimoy got choke oscar memoriam ihavebeenandalwaysshallbeyourfriend
