username,time,tweet
A10Talk,Tue Mar 01 05:29:54 IST 2016,finish tomorrow morn bracketolog rank how mani a team make ncaa tournament
A10Talk,Tue Mar 01 03:05:12 IST 2016,antwoin anderson feroci hammer davidson saturday
A10Talk,Tue Mar 01 03:04:23 IST 2016,rt crazi thought the atlant may posit earn ncaa bid big east american
A10Talk,Mon Feb 29 20:57:13 IST 2016,rt phil martelli we better choic player year presid
A10Talk,Mon Feb 29 20:45:02 IST 2016,rt congrat deandr bembri player joseph chartouni rooki week honore
A10Talk,Mon Feb 29 19:30:45 IST 2016,brooklyn bust georg washington
A10Talk,Mon Feb 29 18:31:59 IST 2016,week atlant power rank vcu take top spot st joe close second
A10Talk,Mon Feb 29 17:32:09 IST 2016,injur x factor kendal pollard
A10Talk,Mon Feb 29 08:13:07 IST 2016,the bonni quiet last select committe look team come hot tough look past st bonaventur
A10Talk,Mon Feb 29 04:28:21 IST 2016,and
A10Talk,Mon Feb 29 01:50:05 IST 2016,saint joseph v st bonaventur rochest week go battl can wait one
A10Talk,Mon Feb 29 01:47:24 IST 2016,rt review bonni win stay ncaa bubbl set huge game wednesday vs sju
A10Talk,Mon Feb 29 01:33:16 IST 2016,final saint joseph slu
A10Talk,Mon Feb 29 01:31:14 IST 2016,rt how spectacular poster jam
A10Talk,Mon Feb 29 01:30:18 IST 2016,rt bembri threw revers break now chant one year
A10Talk,Mon Feb 29 01:28:59 IST 2016,look like hawk remain tie vcu atop a stand up second play
A10Talk,Mon Feb 29 01:02:01 IST 2016,the foul situat far today slu st joe hawk outscor billiken line
A10Talk,Mon Feb 29 00:54:23 IST 2016,jermain bishop tie hawk battl
A10Talk,Mon Feb 29 00:52:21 IST 2016,billiken fight back hangin have trim hawk lead back play
A10Talk,Mon Feb 29 00:32:18 IST 2016,rt we post interest q a cbs bracket dude tomorrow all bonni fan want read
A10Talk,Mon Feb 29 00:30:27 IST 2016,slu held saint joseph field hawk outscor slu line though lead three
A10Talk,Mon Feb 29 00:27:04 IST 2016,the billiken tough team late mike crawford slu right close game hagan
A10Talk,Mon Feb 29 00:20:55 IST 2016,halftim saint joseph slu
A10Talk,Sun Feb 28 22:12:44 IST 2016,atlant sunday preview the billiken head philli
A10Talk,Sun Feb 28 21:30:00 IST 2016,still good sos rpi definit lock drop probabl seed recent struggl
A10Talk,Sun Feb 28 19:16:13 IST 2016,dayton vcu st joe bona gw bubbl
A10Talk,Sun Feb 28 18:01:47 IST 2016,atlant saturday recap vcu defeat gw thriller
A10Talk,Sun Feb 28 11:38:05 IST 2016,liter
A10Talk,Sun Feb 28 11:36:03 IST 2016,rt vcu coach will wade chest bump justin tillman make free throw seal win gw
A10Talk,Sun Feb 28 11:34:12 IST 2016,rt steph shoot season attempt game level difficulti it surreal it
A10Talk,Sun Feb 28 11:33:05 IST 2016,year top regular season finish pick finish outsid top four preseason vcu st joe bona
A10Talk,Sun Feb 28 11:25:39 IST 2016,fordham went nut davidson point assist rebound kid freshman
A10Talk,Sun Feb 28 06:14:22 IST 2016,csnma
A10Talk,Sun Feb 28 06:05:12 IST 2016,ur incred baselin bound play countri point per play cline miss bunni
A10Talk,Sun Feb 28 06:02:58 IST 2016,spider much duke offens ur get great look cline lock d w min go
A10Talk,Sun Feb 28 04:33:12 IST 2016,rt clark sink game win look like got
A10Talk,Sun Feb 28 02:49:22 IST 2016,rt hit pointer season today he join ram accomplish
A10Talk,Sun Feb 28 02:49:12 IST 2016,rt how job new staff done fordham laid solid foundat may found rock freshman
A10Talk,Sun Feb 28 02:48:29 IST 2016,if i mistaken doubl bye lock bona win umass would vcu st joe dayton bona
A10Talk,Sun Feb 28 02:31:27 IST 2016,fordham hold beat davidson
A10Talk,Sun Feb 28 02:11:54 IST 2016,just clock fordham lead davidson
A10Talk,Sun Feb 28 01:27:59 IST 2016,archi said pollard play way mani minut will remain activ day day say flyer find made
A10Talk,Sun Feb 28 01:25:52 IST 2016,archi said flyer need get confid ident togeth back have get back keep fight
A10Talk,Sun Feb 28 01:24:14 IST 2016,archi the last two home game shell come ident paralyz start mental reason
A10Talk,Sun Feb 28 01:05:18 IST 2016,final vcu gw
A10Talk,Sun Feb 28 01:04:07 IST 2016,gw ball four left
A10Talk,Sun Feb 28 01:03:08 IST 2016,garino two perfect opportun won go vcu shot line two left
A10Talk,Sun Feb 28 00:58:42 IST 2016,gw ball ali cox foul
A10Talk,Sun Feb 28 00:58:01 IST 2016,correct second
A10Talk,Sun Feb 28 00:57:36 IST 2016,vcu ball four second left
