username,time,tweet
AthletaThePoint,Tue Mar 01 05:29:58 IST 2016,recruit brand ambassador l profession fit well w strong social presenc passion athleta tweet us interest
AthletaThePoint,Sun Feb 21 05:17:43 IST 2016,rt here great way wear trekki hike pant athleta design erin hartman
AthletaThePoint,Thu Feb 18 00:14:58 IST 2016,rt the destin wide leg pant take nutritionist yogini entrepreneur work play
AthletaThePoint,Mon Feb 15 04:59:42 IST 2016,here still help creat perfect v day look even acai hand galentin
AthletaThePoint,Mon Feb 15 01:00:35 IST 2016,thank everyon join us morn yogacycl richell mercur valentinesday
AthletaThePoint,Sun Feb 14 23:03:03 IST 2016,good morn valentin get yoga mat join us coupl yoga yogacycl valentin
AthletaThePoint,Sun Feb 14 07:30:17 IST 2016,we start tomorrow bright earli free coupl yoga yogacycl acai bowl valentinesday
AthletaThePoint,Sun Feb 14 06:30:13 IST 2016,take time valentin acai bowl tomorrow valentinesday
AthletaThePoint,Sun Feb 14 05:59:22 IST 2016,rt we excit announc launch athleta girl new girl line
AthletaThePoint,Sun Feb 14 05:32:52 IST 2016,join us tomorrow free coupl yoga tomorrow kickstart valentin event valentinesday
AthletaThePoint,Tue Feb 09 23:16:24 IST 2016,come meet lauren join yoga class book sign thursday store retox
AthletaThePoint,Sun Feb 07 23:24:29 IST 2016,make sure join us yoga today local instructor yogacycl yoga
AthletaThePoint,Sun Feb 07 00:25:53 IST 2016,join us today learn mix print pattern you could even win pair print bottom remixyourroutin
AthletaThePoint,Thu Feb 04 23:59:58 IST 2016,share pic workout twitter remixyourroutin you could win athleta no purch nec detail
AthletaThePoint,Wed Jan 27 03:13:19 IST 2016,extra sale merchandis extend point come grab last minut deal
AthletaThePoint,Mon Jan 18 02:03:39 IST 2016,rt a easi mind practic lead happier calmer home
AthletaThePoint,Wed Jan 13 23:07:50 IST 2016,rt fight season sniffl tasti warm energ lemon ginger tea
AthletaThePoint,Wed Jan 13 04:04:50 IST 2016,rt enter win shop card no purchas necessari detail powerofintent
AthletaThePoint,Mon Jan 11 00:00:09 IST 2016,rt turn new year resolut power intent actual stick
AthletaThePoint,Sun Jan 10 02:15:21 IST 2016,have set intent join us simpl tip healthi age powerofintent
AthletaThePoint,Sat Jan 09 05:07:14 IST 2016,join us tomorrow set intent year
AthletaThePoint,Fri Jan 08 23:43:23 IST 2016,rt share new year intent twitter instagram w powerofintent chanc athleta
AthletaThePoint,Thu Jan 07 23:13:13 IST 2016,rt enter win shop card no purchas neccesari detail powerofintent
AthletaThePoint,Wed Jan 06 12:29:13 IST 2016,rt chanc athleta tweet instagram powerofintent detail
AthletaThePoint,Wed Jan 06 02:30:59 IST 2016,look rain jacket come check new style stay dri
AthletaThePoint,Mon Jan 04 22:58:25 IST 2016,our semi annual sale still go get come see us gone
AthletaThePoint,Mon Jan 04 04:54:46 IST 2016,rt i teach readi awesom workout
AthletaThePoint,Mon Jan 04 01:05:59 IST 2016,last day markdown come see us find perfect outfit perfect price sale
AthletaThePoint,Sun Jan 03 05:43:14 IST 2016,join us free pilat class tomorrow fit pilat southbay
AthletaThePoint,Thu Dec 31 11:38:09 IST 2015,rt have open athleta credit card receiv reward first bill statement
AthletaThePoint,Wed Dec 30 22:59:07 IST 2015,extra sale limit time stop get gift
AthletaThePoint,Thu Dec 24 12:59:11 IST 2015,rt perfect christma eve get recip blog
AthletaThePoint,Sat Dec 19 22:42:51 IST 2015,rt make run last minut gift get store onlin w code wrapup end
AthletaThePoint,Tue Dec 15 07:07:36 IST 2015,rt wahoo cheer runner today
AthletaThePoint,Sun Dec 13 03:33:28 IST 2015,till back tomorrow help find perfect gift
AthletaThePoint,Sat Dec 12 22:56:34 IST 2015,we sale item sure check gone
AthletaThePoint,Sat Dec 12 12:38:32 IST 2015,join us tomorrow treat gift
AthletaThePoint,Sat Dec 12 12:23:26 IST 2015,rt holiday beauti junki gift him her yes pleas yunibeauti gift
AthletaThePoint,Fri Dec 11 00:05:48 IST 2015,join us saturday want miss
AthletaThePoint,Sat Nov 28 23:11:40 IST 2015,rt we continu blackfriday sale entir purchas shop save holiday
AthletaThePoint,Mon Nov 16 03:43:17 IST 2015,team build athleta style powertothesh worklov teamlov
AthletaThePoint,Fri Nov 13 23:59:47 IST 2015,fun demo delici sampl come join fun
AthletaThePoint,Fri Nov 13 23:57:46 IST 2015,rt the new x athleta winter collect get last
AthletaThePoint,Thu Nov 12 23:07:05 IST 2015,arriv store today come check new winter collect bonus also new markdown today markdown
AthletaThePoint,Fri Nov 06 02:28:15 IST 2015,come check new markdown today get gone markdown
AthletaThePoint,Fri Oct 30 02:14:22 IST 2015,the wait new arriv store today come check our stylist wait
AthletaThePoint,Sun Oct 25 22:42:24 IST 2015,hous today amaz instructor brookelin south bay studio
AthletaThePoint,Sat Oct 24 21:53:09 IST 2015,intens workout she put unstink top test
AthletaThePoint,Wed Oct 21 23:27:20 IST 2015,rt backbend intimid share pose sequenc help
AthletaThePoint,Tue Oct 20 10:29:45 IST 2015,rt join the point el segundo sat free hiit workout come get awesom sweat sesh shop
