username,time,tweet
TayIorrMade,Tue Mar 01 05:29:57 IST 2016,alan irvin cancer club ruin big sam tactic
TayIorrMade,Tue Mar 01 05:27:22 IST 2016,half shit squad injur
TayIorrMade,Tue Mar 01 05:26:36 IST 2016,hate life
TayIorrMade,Tue Mar 01 05:26:29 IST 2016,minut
TayIorrMade,Tue Mar 01 05:25:21 IST 2016,made shortlist wonderkid i need could get watford everi cunt bought alreadi januari
TayIorrMade,Tue Mar 01 05:20:00 IST 2016,coquelin limit player job held virtual everi team face what ramsey done
TayIorrMade,Tue Mar 01 04:11:55 IST 2016,come back injuri held next retard he excus
TayIorrMade,Tue Mar 01 04:11:20 IST 2016,what sexual orient a lot
TayIorrMade,Tue Mar 01 03:47:34 IST 2016,any critic ramsey bring fault other ramsey coq control shit like can never mention
TayIorrMade,Mon Feb 29 23:13:57 IST 2016,rt it fanci footwork imo
TayIorrMade,Mon Feb 29 23:13:55 IST 2016,rt hmmm
TayIorrMade,Mon Feb 29 23:13:54 IST 2016,rt hmm
TayIorrMade,Mon Feb 29 23:11:12 IST 2016,alway anoth name along side ramsey critic
TayIorrMade,Mon Feb 29 23:09:45 IST 2016,admir commit
TayIorrMade,Mon Feb 29 22:23:45 IST 2016,hear
TayIorrMade,Mon Feb 29 22:21:33 IST 2016,rt ozil one still shit u know
TayIorrMade,Mon Feb 29 22:14:08 IST 2016,my hero my mate
TayIorrMade,Mon Feb 29 22:13:54 IST 2016,rt we never ball we never smack team still got domin big game struggl goal margin
TayIorrMade,Mon Feb 29 22:13:52 IST 2016,rt i know peopl think ramsey arteta good u know our footbal poverti still knick
TayIorrMade,Mon Feb 29 22:13:51 IST 2016,rt i angri i often prove right afc prove right yday may
TayIorrMade,Mon Feb 29 22:13:27 IST 2016,oppress white man work hard absenc disgust
TayIorrMade,Mon Feb 29 22:06:37 IST 2016,tikatakawilsh capitalis random word ad exclam mark can mean one thing gibb get game time
TayIorrMade,Mon Feb 29 20:38:20 IST 2016,rt no one allow bad year messi ronaldo made sure
TayIorrMade,Mon Feb 29 20:04:49 IST 2016,question charact
TayIorrMade,Mon Feb 29 20:03:16 IST 2016,get voodoo doll dez need help get
TayIorrMade,Mon Feb 29 19:56:14 IST 2016,stanc wenger
TayIorrMade,Mon Feb 29 19:51:11 IST 2016,titl win parti intim
TayIorrMade,Mon Feb 29 19:31:21 IST 2016,hope buy leicest main player loan releg rival
TayIorrMade,Mon Feb 29 19:29:45 IST 2016,wrong
TayIorrMade,Mon Feb 29 19:10:41 IST 2016,rt this guy also said ramsey would walk madrid team
TayIorrMade,Mon Feb 29 19:10:18 IST 2016,rt predict santi found season ramsey lead us titl the guy take serious
TayIorrMade,Mon Feb 29 19:07:14 IST 2016,shut leicest one amaz season fuck championship chang noth wenger built legaci
TayIorrMade,Mon Feb 29 19:01:11 IST 2016,rt cazorla gas never ever outshon ramsey
TayIorrMade,Mon Feb 29 08:01:08 IST 2016,absolut livid noth black take chanc away young white academi player
TayIorrMade,Mon Feb 29 07:52:00 IST 2016,phwoar hunk
TayIorrMade,Mon Feb 29 07:50:33 IST 2016,sam wallac indi
TayIorrMade,Mon Feb 29 07:48:13 IST 2016,depay dad right leav
TayIorrMade,Mon Feb 29 07:47:24 IST 2016,rt chris rock career haha black
TayIorrMade,Mon Feb 29 07:46:35 IST 2016,j depp except actor challeng hardi rang
TayIorrMade,Mon Feb 29 07:46:13 IST 2016,
TayIorrMade,Mon Feb 29 07:45:24 IST 2016,fuck gayboy
TayIorrMade,Mon Feb 29 07:45:02 IST 2016,deserv degre
TayIorrMade,Mon Feb 29 07:41:40 IST 2016,countri exist
TayIorrMade,Mon Feb 29 07:40:01 IST 2016,how inappropri
TayIorrMade,Mon Feb 29 07:38:57 IST 2016,preach
TayIorrMade,Mon Feb 29 07:34:55 IST 2016,excus the wualiti player grrrreat
TayIorrMade,Mon Feb 29 07:30:25 IST 2016,want peak shortlist
TayIorrMade,Mon Feb 29 07:30:08 IST 2016,i said take frank
TayIorrMade,Mon Feb 29 07:29:41 IST 2016,look moon like flash light
