username,time,tweet
RIMBermuda,Sat Sep 01 05:29:57 IST 2012,told gf tonight blue moon told beer actual moon lmao
RIMBermuda,Sat Sep 01 05:21:43 IST 2012,from us celluloco happi blue moon everyon learn tonight u look sky
RIMBermuda,Sat Sep 01 03:37:34 IST 2012,put paw pictur best look dog miami help kahlua win contest
RIMBermuda,Wed Aug 29 05:19:04 IST 2012,celluloco com launch super afford tablet ainol novo aurora ii android o s unlock white
RIMBermuda,Wed Aug 29 04:18:25 IST 2012,only panason eluga unlock gingerbread android w cam dualcor cpu
RIMBermuda,Wed Aug 29 03:32:41 IST 2012,introduc two line beast htc desir v dual sim unlock white
RIMBermuda,Wed Aug 29 02:47:13 IST 2012,pricedown notifi samsung sgh galaxi siii pebbl blue t mobil unlock
RIMBermuda,Wed Aug 29 02:19:40 IST 2012,ultra exlcus samsung sgh galaxi siii garnet red at t unlock lte global nowher els
RIMBermuda,Wed Aug 29 01:40:08 IST 2012,celluloco com invit meet world first full hd android tablet
RIMBermuda,Wed Aug 29 01:01:03 IST 2012,celluloco com report live ifa berlin start less hrs all mobil fanat stay tune
RIMBermuda,Wed Aug 29 00:46:15 IST 2012,samsung gt note ii android tablet bermuda caribbean latin america wifi
RIMBermuda,Wed Aug 29 00:13:51 IST 2012,celluloco com offer perman remot unlock servic at t appl iphon version eta hrs
RIMBermuda,Tue Aug 28 23:42:07 IST 2012,celluloco warehous blowout samsung gt galaxi note ii black unlock inch android tablet
RIMBermuda,Tue Aug 28 23:33:01 IST 2012,sale samsung gt galaxi note ii android tablet bermuda caribbean latin am wifi
RIMBermuda,Sat Aug 25 06:28:22 IST 2012,how to get your own googl vaniti url
RIMBermuda,Fri Aug 24 22:02:23 IST 2012,iphon pode ser mai fino que galaxi notícia techtudo
RIMBermuda,Fri Aug 24 21:31:53 IST 2012,news internet user show massacr empir state build nyc august
RIMBermuda,Fri Aug 24 21:15:10 IST 2012,polic kill gunman shoot outsid empir state build this just in blog
RIMBermuda,Fri Aug 24 03:31:41 IST 2012,apó ano homen são libertado graça post facebook notícia techtudo
RIMBermuda,Wed Aug 22 02:58:19 IST 2012,celluloco com proud introduc asus transform pad infin wifi no keyboard version royal blue
RIMBermuda,Tue Aug 21 21:53:26 IST 2012,tip one theeee coolest site web bookmark one folk the cool hunter
RIMBermuda,Tue Aug 21 21:51:50 IST 2012,isra donkey get wifi equip histor theme park engadget
RIMBermuda,Tue Aug 21 21:49:21 IST 2012,wow how cool panason expand smart home applianc line add android smart app cloud servic engadget
RIMBermuda,Tue Aug 21 21:42:18 IST 2012,diamond multimedia out android set top box gingerbread base sell engadget
RIMBermuda,Tue Aug 21 21:38:25 IST 2012,vintag mtv promo spot you cherish etern
RIMBermuda,Tue Aug 21 21:34:58 IST 2012,appl news leak iphon video reveal radic new design
RIMBermuda,Tue Aug 21 21:33:41 IST 2012,anoth daili cool tech tip chang top googl search result for your name free
RIMBermuda,Tue Aug 21 21:32:34 IST 2012,remind all skype user that skype add photo share latest io updat
RIMBermuda,Tue Aug 21 21:30:45 IST 2012,celluloco tip hacker show world how break almost any hotel room daili travel condé nast travel
RIMBermuda,Tue Aug 21 07:37:54 IST 2012,celluloco com blow htc one x unlock white global android os must see
RIMBermuda,Tue Aug 21 07:14:53 IST 2012,mega sale asus transform pad infin wifi unlock amethyst gray
RIMBermuda,Tue Aug 21 00:55:57 IST 2012,appl supera marca da microsoft e é empresa mai valiosa da história us bilhõ veja aqui
RIMBermuda,Sun Aug 19 23:03:21 IST 2012,wow celluloco receiv await afford blackberri curv limit white edit unlock see
RIMBermuda,Sun Aug 19 22:27:31 IST 2012,watch entireu uncut assang speech today hd courtesi
RIMBermuda,Sun Aug 19 22:26:17 IST 2012,connectifi combin all your internet network into one
RIMBermuda,Sun Aug 19 22:22:41 IST 2012,way pay dinner with your phone
RIMBermuda,Sun Aug 19 22:21:06 IST 2012,l a restaur give discount stay off your phone
RIMBermuda,Sun Aug 19 22:08:25 IST 2012,wow great celluloco deal samsung sgh galaxi note navi blue t mobil unlock w super amol screen
RIMBermuda,Sun Aug 19 20:28:15 IST 2012,berryunlock com present wikileak julian assang histor speech ecuador embassi london watch here
RIMBermuda,Sun Aug 19 08:39:27 IST 2012,present how connect blackberri playbook lte mobil network
RIMBermuda,Sun Aug 19 08:22:32 IST 2012,present lte blackberri playbook hand demo interview watch
RIMBermuda,Sun Aug 19 08:13:45 IST 2012,present insert sim card blackberri playbook lte how to demo youtub
RIMBermuda,Sun Aug 19 07:54:21 IST 2012,celluloco com alreadi ship unlock blackberri playbook lte cellular wi fi tablet bermuda
RIMBermuda,Sun Aug 19 06:29:22 IST 2012,julian assang fiasco six way spring troublesom fugit like assang embassi mail onlin
RIMBermuda,Sun Aug 19 06:21:55 IST 2012,deepest swim pool descend contain whop litr water
RIMBermuda,Sun Aug 19 06:19:49 IST 2012,you smoke crack judg call appl ridicul final day patent infring trial samsung
RIMBermuda,Sun Aug 19 06:19:07 IST 2012,loja poderão dar check facebook atravé de reconhecimento facial
RIMBermuda,Sat Aug 18 03:56:53 IST 2012,found thee coolest site offer firefox plugin optim ur gmail signatur
RIMBermuda,Sat Aug 18 01:02:00 IST 2012,remind u tablet capabl samsung gt galaxi note ii
RIMBermuda,Sat Aug 18 00:59:55 IST 2012,new tablet arriv notifi samsung gt galaxi note ii white unlock
