username,time,tweet
jon_wakefield,Sun Sep 01 05:29:57 IST 2013,why i fall asleep sofa fall asleep bed ffs sleep sleeplessnight
jon_wakefield,Sun Sep 01 03:06:21 IST 2013,i person got total lost listen di canio safc motd
jon_wakefield,Sun Sep 01 02:58:54 IST 2013,didn catch start miss goal motd
jon_wakefield,Sun Sep 01 02:47:46 IST 2013,i like mix
jon_wakefield,Sun Sep 01 02:38:30 IST 2013,rt if first half game championship count sheffield wednesday would instead count the
jon_wakefield,Sun Sep 01 02:37:54 IST 2013,the order cpfc sfc mcfc hcfc montag rest motd epl
jon_wakefield,Sun Sep 01 02:17:49 IST 2013,dose say
jon_wakefield,Sun Sep 01 01:32:59 IST 2013,premiership la la la la premiership la la la footballchairman
jon_wakefield,Sun Sep 01 01:31:09 IST 2013,prem come i guid weston ranger place the champ
jon_wakefield,Sat Aug 31 23:57:39 IST 2013,levi would sold iphon first
jon_wakefield,Sat Aug 31 23:54:44 IST 2013,i play like masterb i go end cri
jon_wakefield,Sat Aug 31 21:32:05 IST 2013,first point season well done lad let tri get game swfc
jon_wakefield,Sat Aug 31 21:04:01 IST 2013,i know funni stori dog want might help fill min motd epl
jon_wakefield,Sat Aug 31 20:56:18 IST 2013,hope work part trick i think go need tonight motd
jon_wakefield,Sat Aug 31 20:47:41 IST 2013,info fake plain fraud real punter footbal fan never promot crap
jon_wakefield,Sat Aug 31 20:46:24 IST 2013,incas ignor you know info real illeg
jon_wakefield,Sat Aug 31 20:44:36 IST 2013,happi promot servic spread stuff like i thought better
jon_wakefield,Sat Aug 31 20:39:49 IST 2013,guy real getthefuckoffoftwitt
jon_wakefield,Sat Aug 31 20:37:30 IST 2013,pleas post shit time line
jon_wakefield,Sat Aug 31 20:25:07 IST 2013,can someon pleas remind player premiership best leagu world epl footbal goal boredraw
jon_wakefield,Sat Aug 31 17:01:16 IST 2013,sign vip it free tight fuck banter gambl
jon_wakefield,Sat Aug 31 16:47:14 IST 2013,first line clear say i win
jon_wakefield,Sat Aug 31 03:12:25 IST 2013,i check i survey email i will win voucher email suggest
jon_wakefield,Thu Aug 29 22:57:12 IST 2013,you suck game
jon_wakefield,Thu Aug 29 18:30:25 IST 2013,champion i guid weston ranger place leagu
jon_wakefield,Thu Aug 29 16:00:26 IST 2013,rt paulinho capou soldado chad chirich lamela eriksen caulker clint hudd bale footbal world
jon_wakefield,Thu Aug 29 03:32:34 IST 2013,back net i guid weston ranger place leagu
jon_wakefield,Wed Aug 28 17:58:44 IST 2013,i one read email i admit
jon_wakefield,Wed Aug 28 17:58:13 IST 2013,dig anyth might worth summeri bet togeth one place
jon_wakefield,Wed Aug 28 17:31:03 IST 2013,i see one either only goal that dead btw
jon_wakefield,Wed Aug 28 12:21:37 IST 2013,champion i guid weston ranger place non leagu a
jon_wakefield,Wed Aug 28 03:39:22 IST 2013,champion i guid weston ranger place non leagu b
jon_wakefield,Wed Aug 28 03:17:05 IST 2013,addict footbal chairman thank nolif
jon_wakefield,Wed Aug 28 03:06:47 IST 2013,champion i guid weston ranger place non leagu c
jon_wakefield,Wed Aug 28 02:09:29 IST 2013,last minut love
jon_wakefield,Wed Aug 28 01:09:10 IST 2013,i play footbal chairman i tri get weston ranger top
jon_wakefield,Wed Aug 28 01:00:46 IST 2013,bad half time
jon_wakefield,Tue Aug 27 04:04:13 IST 2013,just watch purg can decid i like thank thepurg
jon_wakefield,Tue Aug 27 03:12:37 IST 2013,look buy decent sofa any suggest westonsupermar bristol shop sofa
jon_wakefield,Tue Aug 27 03:04:39 IST 2013,anyon sell good sofa read review everyon seem hate dfs peopl moan prais sofa help
jon_wakefield,Mon Aug 26 17:39:04 IST 2013,play now tv footbal fortun win sky sport day pass amaz prize nowtvfootballfortun
jon_wakefield,Mon Aug 26 02:45:40 IST 2013,lauren remind psycho killer i realli hope cri end make face clutch knife cbb carcrashtv
jon_wakefield,Mon Aug 26 00:17:15 IST 2013,rt cours adebydonkey would drill car park
jon_wakefield,Sun Aug 25 23:57:47 IST 2013,ah realli
jon_wakefield,Sun Aug 25 23:34:50 IST 2013,i hope spur fan know soldado score penalti count thfc
jon_wakefield,Sun Aug 25 21:31:47 IST 2013,meal servant
jon_wakefield,Sun Aug 25 16:26:29 IST 2013,could twitter erect beiber fan i fed see shit like justinspasswordattempt doon
jon_wakefield,Sun Aug 25 16:19:00 IST 2013,i think deep knew would go i spur fan i would excit futur put togeth squad
jon_wakefield,Sun Aug 25 14:55:25 IST 2013,push place best boyfriend today pancak bed work bestboyfriendev
jon_wakefield,Sun Aug 25 01:09:59 IST 2013,i thought meant go make nextflix film
