username,time,tweet
MendozaDanya,Sat Sep 01 05:29:56 IST 2012,prop peopl keep convers go seem mani obtain skill shame
MendozaDanya,Sat Sep 01 05:26:41 IST 2012,rt that awkward moment make eye contact someon littl crack bathroom stall
MendozaDanya,Sat Sep 01 00:13:22 IST 2012,i also wanna zoologist point life dreambig
MendozaDanya,Sat Sep 01 00:12:14 IST 2012,i wanna flight attend point life dream
MendozaDanya,Sat Sep 01 00:11:18 IST 2012,you strong weakest point truth
MendozaDanya,Sat Sep 01 00:09:12 IST 2012,guy tattoo gentlemen tattoo
MendozaDanya,Fri Aug 31 23:40:21 IST 2012,it friday i got job i got shit next c
MendozaDanya,Fri Aug 31 23:37:42 IST 2012,if want best they best wordtoyamotha
MendozaDanya,Fri Aug 31 22:59:50 IST 2012,eat taco tonight dd you real taco till come mexico delici
MendozaDanya,Fri Aug 31 22:54:26 IST 2012,i like tell littl kid tell stori imagin crazi druggedwithoutdrug
MendozaDanya,Fri Aug 31 22:53:01 IST 2012,a cricket piss i rash dafuq itseverywher makeitgoaway
MendozaDanya,Fri Aug 31 22:31:31 IST 2012,woohooo start get littl cold here excitedforwint
MendozaDanya,Fri Aug 31 11:09:22 IST 2012,i caus reduc slutti popul guy turn men forthecaus
MendozaDanya,Fri Aug 31 11:08:16 IST 2012,guy like slut man give ladi reason wanna classi ass woman itssimpl respect
MendozaDanya,Fri Aug 31 11:05:59 IST 2012,find talk everi girl meet way talk everytim everyfuckingtim
MendozaDanya,Fri Aug 31 11:04:17 IST 2012,am i person spell shit anymor how i suppos know say abbrevi n shit lazyass
MendozaDanya,Fri Aug 31 01:19:25 IST 2012,i need pandora back life why work mexico sad whattodo
MendozaDanya,Fri Aug 31 01:18:20 IST 2012,take care babi hummingbird socut
MendozaDanya,Thu Aug 30 15:39:59 IST 2012,rt you gotta text goodnight special the bitch get oh bad i fell asleep text mo
MendozaDanya,Thu Aug 30 09:46:45 IST 2012,pillow someth would keep cool night amiamillionaireyet genius
MendozaDanya,Thu Aug 30 09:42:18 IST 2012,my aunt said day i gone hair look like grew hellyeah itri iwantmyhairback
MendozaDanya,Thu Aug 30 09:40:46 IST 2012,watch spongebob spanish fuck annoy
MendozaDanya,Thu Aug 30 09:40:09 IST 2012,i start saturday fuck nofunfriday
MendozaDanya,Thu Aug 30 09:39:09 IST 2012,i got job fuckyeah money
MendozaDanya,Thu Aug 30 09:35:18 IST 2012,having wait marvel dinner till midnight
MendozaDanya,Thu Aug 30 09:34:50 IST 2012,having sushi dinner
MendozaDanya,Thu Aug 30 09:28:40 IST 2012,rt there nobodi aquarius cannot talk relat level
MendozaDanya,Tue Aug 28 22:57:13 IST 2012,back mexico gonna live noproblemo ithadtohappen stillmissyouthough
MendozaDanya,Mon Aug 27 22:08:29 IST 2012,rt biggest pet peev aquarius having follow someon els rule narrow mind peopl open c
MendozaDanya,Sat Aug 25 22:49:43 IST 2012,one day shall tat fuck upppp head feet im wait money best tattoo artist cantwait
MendozaDanya,Sat Aug 25 22:47:01 IST 2012,my back crack sneez thatshithurt
MendozaDanya,Sat Aug 25 22:46:21 IST 2012,i wish color contact never exist that damn question yes eye real theyr marbl eye socket pleasestopask
MendozaDanya,Sat Aug 25 22:41:38 IST 2012,datemeif your matur serious hard find nowaday either dont find hes like year older fmg
MendozaDanya,Sat Aug 25 22:38:39 IST 2012,i speak accent speak like normal icanthelpit peopl probabl think im weird ohwel
MendozaDanya,Sat Aug 25 22:36:45 IST 2012,when guy tri act tough niggapleas quitplayin
MendozaDanya,Sat Aug 25 22:35:08 IST 2012,not cake face im slow get readi like take time thingsineedtoimprov
MendozaDanya,Sat Aug 25 22:34:30 IST 2012,having start get readi must leav
MendozaDanya,Sat Aug 25 22:34:02 IST 2012,peopl onlin skype one contact imbor dafuqyouat
MendozaDanya,Sat Aug 25 22:32:10 IST 2012,product momma daughter day
MendozaDanya,Thu Aug 23 05:06:10 IST 2012,one didnt see date though first time saw lol oop
MendozaDanya,Wed Aug 22 08:05:28 IST 2012,fusho winkwinkwinkkkkk
MendozaDanya,Wed Aug 22 08:02:25 IST 2012,oh shittt guess last year awkward
MendozaDanya,Wed Aug 22 07:58:29 IST 2012,d awww saw littl messag left tv lol cuut
MendozaDanya,Wed Aug 22 02:25:58 IST 2012,pink floyd put better mood everi song listen except wish you were here that shit depress
MendozaDanya,Tue Aug 21 07:00:07 IST 2012,lmao tortur meeeee
MendozaDanya,Mon Aug 20 02:56:45 IST 2012,now leav irv sadday
MendozaDanya,Sun Aug 19 12:22:09 IST 2012,i cannot wait cold blanket snow mmmmm yespleas
MendozaDanya,Sun Aug 19 12:19:14 IST 2012,when everyon room stuck technolog world im like i play nail dont mind imdyinginsid
MendozaDanya,Sun Aug 19 12:16:08 IST 2012,i wish teen mayb but choic never would choos generat disgrac
