username,time,tweet
ChrisMatthewLee,Tue Mar 01 05:29:56 IST 2016,hillari gonna presid idk i gonna prepar doomsday bunker time
ChrisMatthewLee,Tue Mar 01 05:26:31 IST 2016,this man get insan everi day support even know vote
ChrisMatthewLee,Tue Mar 01 05:00:39 IST 2016,just got choic sheet due tomorrow indecis natur realli help
ChrisMatthewLee,Tue Mar 01 04:58:21 IST 2016,thank god
ChrisMatthewLee,Tue Mar 01 03:56:51 IST 2016,first day back school almost week i wanna listen realli angri music
ChrisMatthewLee,Mon Feb 29 18:35:44 IST 2016,rt those slander truli lack understand bibl point
ChrisMatthewLee,Mon Feb 29 18:35:31 IST 2016,rt which worst
ChrisMatthewLee,Mon Feb 29 10:38:52 IST 2016,rt i wonder actor pick hat dumb caus go support global warm first world
ChrisMatthewLee,Mon Feb 29 10:35:56 IST 2016,i name topic say pro con mayb read watch someth
ChrisMatthewLee,Mon Feb 29 10:32:36 IST 2016,rt i know i hype leo i see dumb meme inevit lost
ChrisMatthewLee,Mon Feb 29 10:26:19 IST 2016,rt the meme is over
ChrisMatthewLee,Mon Feb 29 10:22:56 IST 2016,rt sum piec
ChrisMatthewLee,Mon Feb 29 10:21:26 IST 2016,femin cultur marxism pc sjw cultur regress leftism academia homosexu anyth trump
ChrisMatthewLee,Mon Feb 29 09:45:04 IST 2016,rt merica
ChrisMatthewLee,Mon Feb 29 09:15:56 IST 2016,rt star war deserv everi singl one award regardless categori
ChrisMatthewLee,Mon Feb 29 08:50:19 IST 2016,i worst middl part known man
ChrisMatthewLee,Mon Feb 29 07:20:39 IST 2016,way preach i believ fabul manner unmatch
ChrisMatthewLee,Mon Feb 29 07:18:03 IST 2016,rt everi time rt i move one step closer accept homosexu
ChrisMatthewLee,Mon Feb 29 05:31:04 IST 2016,rt who fuck care
ChrisMatthewLee,Mon Feb 29 05:12:38 IST 2016,i think i laugh anyth harder i face swap
ChrisMatthewLee,Mon Feb 29 05:02:50 IST 2016,human right
ChrisMatthewLee,Mon Feb 29 04:57:19 IST 2016,wear cis scum
ChrisMatthewLee,Mon Feb 29 04:56:26 IST 2016,very import full video explain well
ChrisMatthewLee,Sun Feb 28 23:29:28 IST 2016,rt realli sad better we agre racism wrong kkk abhorr
ChrisMatthewLee,Sun Feb 28 21:41:23 IST 2016,rt bless parent i
ChrisMatthewLee,Sun Feb 28 21:31:57 IST 2016,this kill everi time
ChrisMatthewLee,Sun Feb 28 20:31:10 IST 2016,okay i need hurri get better hurri die i never learn patient person
ChrisMatthewLee,Sun Feb 28 12:10:46 IST 2016,rt american idiot
ChrisMatthewLee,Sun Feb 28 12:10:40 IST 2016,rt death bachelor
ChrisMatthewLee,Sun Feb 28 12:09:16 IST 2016,rt vessel
ChrisMatthewLee,Sun Feb 28 12:00:37 IST 2016,hand best disturb face swap
ChrisMatthewLee,Sun Feb 28 11:59:26 IST 2016,rt
ChrisMatthewLee,Sun Feb 28 11:53:44 IST 2016,i ultim biolog weapon i never get vaccin never finish antibiot us combin
ChrisMatthewLee,Sun Feb 28 11:52:21 IST 2016,never finish
ChrisMatthewLee,Sun Feb 28 11:49:04 IST 2016,although i say mayb immun system strong fight major virus time get vaccin
ChrisMatthewLee,Sun Feb 28 11:46:59 IST 2016,i think wrong i question everyth rn
ChrisMatthewLee,Sun Feb 28 11:43:07 IST 2016,wow yet anoth fever sinc tuesday concuss unknown virus quit combo ask
ChrisMatthewLee,Sun Feb 28 05:01:24 IST 2016,rt fiji bucknel
ChrisMatthewLee,Sun Feb 28 05:01:18 IST 2016,rt off frat parti
ChrisMatthewLee,Sun Feb 28 04:36:14 IST 2016,rt we kid go overboard nostalgia thing true music awesom way superior
ChrisMatthewLee,Sun Feb 28 03:08:10 IST 2016,why actual decid call
ChrisMatthewLee,Sat Feb 27 23:27:36 IST 2016,rt i breath
ChrisMatthewLee,Sat Feb 27 22:49:47 IST 2016,i want buy everyth chubbi catalog move socal bahama
ChrisMatthewLee,Sat Feb 27 20:47:15 IST 2016,my favorit band come new album year
ChrisMatthewLee,Sat Feb 27 20:41:08 IST 2016,rt i love twitter lmaoo
ChrisMatthewLee,Sat Feb 27 09:34:29 IST 2016,
ChrisMatthewLee,Sat Feb 27 08:56:58 IST 2016,dern go bed line
ChrisMatthewLee,Sat Feb 27 08:54:51 IST 2016,so mani prayer answer god great never lose faith
ChrisMatthewLee,Sat Feb 27 08:01:09 IST 2016,two meal dinner hell yeah
ChrisMatthewLee,Sat Feb 27 02:47:35 IST 2016,if possibl trump could actual next presid elect would entertain
