username,time,tweet
Bargeguy,Sat Sep 01 05:29:56 IST 2012,back hurric tunica downtown new orlean tonit friend birthday whew lot yard work hous ok
Bargeguy,Fri Aug 31 01:35:12 IST 2012,that time row i got big fav lost will streak ever end puke nois
Bargeguy,Fri Aug 31 01:33:24 IST 2012,ouch got stack flop straight rais flop got put set he caught last river
Bargeguy,Thu Aug 30 21:56:50 IST 2012,i bet dirti darn chip keep littl bottl hand steril handi get well soon
Bargeguy,Thu Aug 30 10:11:53 IST 2012,wow trip
Bargeguy,Thu Aug 30 04:16:27 IST 2012,anoth day hurric tunica poor new orlean way celebr katrina anniversari
Bargeguy,Wed Aug 29 19:29:29 IST 2012,bbq blue beal street memphi no elvi sight yesterday
Bargeguy,Wed Aug 29 11:14:47 IST 2012,take littl hurric tunica it fun sit around dark hurrican goe thru even littl tonit money
Bargeguy,Mon Aug 27 21:27:34 IST 2012,download kindl app it much better one ipad anyway
Bargeguy,Sun Jul 29 01:56:30 IST 2012,olymp overdos make
Bargeguy,Sun Jul 29 01:39:14 IST 2012,guitar solo pachelbel canon via one awesom piec music
Bargeguy,Sat Jul 28 06:12:09 IST 2012,wow impress effort congrat
Bargeguy,Sun Jul 22 00:19:43 IST 2012,oh boy oh boy got kitchen pass play harrah n awl tonit saturday nite insan rule lot loos play crazi pot
Bargeguy,Fri Jul 13 07:55:32 IST 2012,great effort scott it ball sweat afar it matter time nail one
Bargeguy,Fri Jul 06 07:39:49 IST 2012,
Bargeguy,Fri Jul 06 01:35:28 IST 2012,pot game one mani
Bargeguy,Fri Jul 06 01:02:45 IST 2012,the size pot depend much behind
Bargeguy,Fri Jul 06 00:55:31 IST 2012,omg biggest game of drink poker i ve ever seen pleas give me some card
Bargeguy,Thu Jul 05 06:50:03 IST 2012,happi birthday america what awesom countri on miss riverfront n awl firework
Bargeguy,Thu Jul 05 00:37:48 IST 2012,love degre today
Bargeguy,Tue Jul 03 03:56:02 IST 2012,rt first break
Bargeguy,Sun Jul 01 04:56:16 IST 2012,million place million one drop anyon want buy share
Bargeguy,Fri Jun 29 04:48:05 IST 2012,ugli nite tonit full hous loser aa loser ugh
Bargeguy,Wed Jun 27 08:42:10 IST 2012,alright scott keep entertain drive home houston run good
Bargeguy,Tue Jun 26 05:51:47 IST 2012,felt him
Bargeguy,Mon Jun 25 03:13:26 IST 2012,insan nite last nite harrah new orlean usual i end buddi randi cash usual game
Bargeguy,Sun Jun 24 07:43:15 IST 2012,and get call
Bargeguy,Sun Jun 24 07:42:28 IST 2012,i love nut
Bargeguy,Sat Jun 23 23:02:44 IST 2012,look harrah come
Bargeguy,Mon Jun 18 08:34:11 IST 2012,boost hour averag tonight beau rivag hour yahoo
Bargeguy,Mon Jun 18 03:13:52 IST 2012,scott mama tell better give receiv give one donkey bad beat
Bargeguy,Sat Jun 16 10:40:29 IST 2012,usual mad harrah tonit
Bargeguy,Sat Jun 16 08:18:00 IST 2012,oh boy time kick butt harrah
Bargeguy,Sat Jun 16 05:47:51 IST 2012,fun nite tonit dinner ww museum hold em harrah happi father day geaux scott
Bargeguy,Fri Jun 15 06:41:29 IST 2012,watch dalla tnt yawn jr stay retir
Bargeguy,Wed Jun 13 21:49:45 IST 2012,lunch today twin peak baton roug hooter steroid wow
Bargeguy,Mon Jun 11 22:41:35 IST 2012,could read coupl chapter harrington hold em
Bargeguy,Sun Jun 10 07:09:53 IST 2012,how awesom one i proud
Bargeguy,Sat Jun 09 22:12:56 IST 2012,lunch hooterisci today
Bargeguy,Fri Jun 08 07:16:07 IST 2012,coupl suggest don play anyon j play idiot now go get jewelri gl
Bargeguy,Fri Jun 08 07:11:39 IST 2012,at beach kid never dull moment my buddi kept send pictur harrah rub
Bargeguy,Sun Jun 03 03:43:44 IST 2012,oop my bad i resort time enjoy blog run good
Bargeguy,Sun Jun 03 03:36:06 IST 2012,call phone
Bargeguy,Thu May 31 16:32:21 IST 2012,awesom job best part get start congrat scott
Bargeguy,Thu May 31 07:00:12 IST 2012,like chris said blast track hope much fun when next match
Bargeguy,Thu May 31 03:07:22 IST 2012,that fast great job scott
Bargeguy,Wed May 30 09:22:40 IST 2012,take down
Bargeguy,Wed May 30 05:44:09 IST 2012,alright all louisiana pull
Bargeguy,Tue May 29 06:36:36 IST 2012,geaux scott geaux n awl
Bargeguy,Sun May 27 04:31:18 IST 2012,rt be care say year old fart run good scott lol bad
