username,time,tweet
katiemary96,Sun Sep 01 05:29:50 IST 2013,the pleasur tickl actual increas older becom ha get use
katiemary96,Sun Sep 01 04:54:22 IST 2013,rt like friend talk everi day still friend even go week without talk
katiemary96,Sun Sep 01 04:12:13 IST 2013,my mommi made rice crispi treat
katiemary96,Sat Aug 31 20:18:00 IST 2013,i feel like luckiest girl aliv
katiemary96,Sat Aug 31 18:51:32 IST 2013,my ear still ring that show total worth
katiemary96,Sat Aug 31 10:52:27 IST 2013,if i could reliv today day rest life i could die truli happi
katiemary96,Sat Aug 31 06:00:25 IST 2013,miss ya doll i
katiemary96,Sat Aug 31 05:51:03 IST 2013,this surreal fob falloutboy upnext
katiemary96,Sat Aug 31 04:08:34 IST 2013,so close stage
katiemary96,Sat Aug 31 03:51:23 IST 2013,casual wait fall out boy dead omg isthisr icantbelieveiamher fob falloutboy
katiemary96,Fri Aug 30 17:32:18 IST 2013,the fact less hour i see one greatest band
katiemary96,Fri Aug 30 16:39:20 IST 2013,why i torment wake earli
katiemary96,Fri Aug 30 16:36:30 IST 2013,rosi
katiemary96,Fri Aug 30 16:28:05 IST 2013,rt when parent bring ex
katiemary96,Fri Aug 30 08:11:28 IST 2013,ahh yay thank
katiemary96,Fri Aug 30 08:09:41 IST 2013,i never know free can pick i get readi jt get
katiemary96,Fri Aug 30 07:55:41 IST 2013,serious though i desper ride home tomorrow someon help pleas
katiemary96,Fri Aug 30 07:54:16 IST 2013,i got boo
katiemary96,Fri Aug 30 07:48:08 IST 2013,if anyon could give ride home practic tomorrow would realli awesom i pay gas money
katiemary96,Fri Aug 30 07:46:53 IST 2013,forreal i take lot video i share good feel
katiemary96,Fri Aug 30 07:42:21 IST 2013,jt show set list
katiemary96,Fri Aug 30 07:29:22 IST 2013,forev lose remot bed
katiemary96,Fri Aug 30 07:26:59 IST 2013,yes i am so friggen excit like omg
katiemary96,Fri Aug 30 07:19:25 IST 2013,hope go
katiemary96,Fri Aug 30 07:16:23 IST 2013,yeah i saw said someth which one
katiemary96,Fri Aug 30 07:10:41 IST 2013,i know would taken i town holiday
katiemary96,Fri Aug 30 07:07:11 IST 2013,friend jt go see
katiemary96,Fri Aug 30 07:00:27 IST 2013,ugh yes like i would legitim kill see live i cri i saw peep thought i psycho
katiemary96,Fri Aug 30 06:52:43 IST 2013,like ugh i even put word emot
katiemary96,Fri Aug 30 06:46:43 IST 2013,my love rival obsess i think say someth
katiemary96,Fri Aug 30 06:22:19 IST 2013,soon enough
katiemary96,Fri Aug 30 06:20:30 IST 2013,i wonder
katiemary96,Fri Aug 30 06:17:22 IST 2013,hehe i know someon
katiemary96,Fri Aug 30 06:17:04 IST 2013,see girl cri one direct perform agt honest make question valu entir societi
katiemary96,Fri Aug 30 02:07:32 IST 2013,the one night week i plan hair shit sorri choral friend deal frizzi monster head
katiemary96,Fri Aug 30 00:21:44 IST 2013,you must tri make love definit love divin accid life
katiemary96,Thu Aug 29 19:44:18 IST 2013,uh i clue lol
katiemary96,Thu Aug 29 19:42:18 IST 2013,
katiemary96,Thu Aug 29 19:38:50 IST 2013,aww thank i miss wait see later
katiemary96,Thu Aug 29 07:27:20 IST 2013,your forev i need
katiemary96,Thu Aug 29 07:08:13 IST 2013,it long time sinc i felt genuin happi
katiemary96,Thu Aug 29 06:12:56 IST 2013,i excit gonna much fun
katiemary96,Thu Aug 29 06:08:46 IST 2013,rt scorpio fighter never give will accomplish anyth put mind
katiemary96,Thu Aug 29 06:08:01 IST 2013,rt
katiemary96,Thu Aug 29 06:07:42 IST 2013,friday fob
katiemary96,Wed Aug 28 17:33:06 IST 2013,i gonna miss wake face everi morn school start dog dexter babyboy
katiemary96,Wed Aug 28 17:21:42 IST 2013,i think
katiemary96,Wed Aug 28 17:16:51 IST 2013,why damn perfect
katiemary96,Wed Aug 28 16:51:05 IST 2013,giraff calf isn t it precious
katiemary96,Wed Aug 28 16:49:53 IST 2013,rt senior year tho
