username,time,tweet
RatJMich,Tue Mar 01 05:29:53 IST 2016,my goal life go john mayer concert
RatJMich,Sun Feb 28 18:54:27 IST 2016,burn atmospher
RatJMich,Sun Feb 28 09:55:08 IST 2016,chef curri
RatJMich,Sun Feb 28 01:39:14 IST 2016,so done today
RatJMich,Fri Feb 26 00:56:58 IST 2016,i still feel like like year ago
RatJMich,Tue Feb 23 23:51:58 IST 2016,i realiz park like asshol day
RatJMich,Sun Feb 21 10:02:24 IST 2016,i realli see resembl
RatJMich,Tue Feb 16 10:38:59 IST 2016,john mayer soul good
RatJMich,Tue Feb 16 09:10:35 IST 2016,look pretti good old man happi birthday papa
RatJMich,Thu Feb 11 22:32:00 IST 2016,this happen
RatJMich,Thu Feb 11 22:30:02 IST 2016,anxieti
RatJMich,Thu Feb 11 22:29:56 IST 2016,i right
RatJMich,Thu Feb 11 22:28:48 IST 2016,what aw day
RatJMich,Thu Feb 11 22:21:00 IST 2016,what great day turn
RatJMich,Wed Feb 10 21:34:41 IST 2016,noth worth ever go easi
RatJMich,Wed Feb 10 21:22:39 IST 2016,rt
RatJMich,Tue Feb 09 19:46:02 IST 2016,i need confid i confid
RatJMich,Tue Feb 09 09:12:11 IST 2016,i realli think i lose mind
RatJMich,Tue Feb 09 02:21:27 IST 2016,i content life i see go futur
RatJMich,Mon Feb 08 01:35:16 IST 2016,keeppound take panther win super bowl sbvote
RatJMich,Mon Feb 08 01:33:06 IST 2016,rt you know day
RatJMich,Mon Feb 08 01:31:32 IST 2016,i actual gonna mad good game tonight tbh
RatJMich,Sun Feb 07 07:56:21 IST 2016,my boy brett final canton bound
RatJMich,Sun Feb 07 07:14:32 IST 2016,it bad feel
RatJMich,Sun Feb 07 00:41:08 IST 2016,wow today suck
RatJMich,Thu Feb 04 08:32:22 IST 2016,how can you just have one season of someth that has multipl season
RatJMich,Wed Feb 03 20:08:14 IST 2016,but happen
RatJMich,Wed Feb 03 20:05:09 IST 2016,none mom student recogn haircut
RatJMich,Wed Feb 03 08:11:17 IST 2016,
RatJMich,Wed Feb 03 08:06:17 IST 2016,chop chop mf
RatJMich,Wed Feb 03 00:56:22 IST 2016,
RatJMich,Fri Jan 29 01:24:16 IST 2016,rt what man go
RatJMich,Thu Jan 28 06:14:33 IST 2016,just make hate hilari clinton even
RatJMich,Thu Jan 28 06:08:26 IST 2016,if seen hour yet you need
RatJMich,Tue Jan 26 07:33:31 IST 2016,rt i paradis
RatJMich,Mon Jan 25 18:28:38 IST 2016,a girl basketbal team roger got band confer said skill level high
RatJMich,Mon Jan 25 10:48:49 IST 2016,
RatJMich,Mon Jan 25 05:09:20 IST 2016,keeppound
RatJMich,Mon Jan 25 04:58:47 IST 2016,is intent ground penalti anymor
RatJMich,Sun Jan 24 17:46:01 IST 2016,wow day alreadi suck
RatJMich,Sun Jan 24 05:59:18 IST 2016,rt ur neighbor outsid shovel rex costum
RatJMich,Sun Jan 24 03:10:44 IST 2016,i
RatJMich,Sat Jan 23 01:22:51 IST 2016,quick painless i promis
RatJMich,Sat Jan 23 01:19:06 IST 2016,i pierc right
RatJMich,Fri Jan 22 02:49:31 IST 2016,i realli hate fact degre bearabl temperatur
RatJMich,Tue Jan 19 09:19:46 IST 2016,honest though hard stay phone drive
RatJMich,Mon Jan 18 22:05:11 IST 2016,faith take first step even see whole staircas mlk
RatJMich,Mon Jan 18 06:43:17 IST 2016,i even understand peopl get whole day without take nap
RatJMich,Mon Jan 18 06:20:43 IST 2016,the afc bore tbh
RatJMich,Sun Jan 17 20:53:44 IST 2016,it even today alreadi go downhil fast
