username,time,tweet
Matt_glenn33,Tue Mar 01 05:29:43 IST 2016,day i cruis mexico
Matt_glenn33,Tue Mar 01 01:33:07 IST 2016,rt thank februari drop
Matt_glenn33,Tue Feb 16 08:32:02 IST 2016,rt wiz khalifa care free
Matt_glenn33,Mon Feb 01 06:39:52 IST 2016,noth wors work bridal show
Matt_glenn33,Mon Jan 04 10:08:36 IST 2016,rt for time sinc vike win nfc north minnesota take packer
Matt_glenn33,Fri Dec 25 10:58:25 IST 2015,rt christma eve fun hecc santa gotta stone gettin playlist togeth point
Matt_glenn33,Mon Dec 21 01:46:10 IST 2015,happi birthday carle
Matt_glenn33,Sat Dec 12 11:54:41 IST 2015,travi scott
Matt_glenn33,Fri Dec 11 08:32:07 IST 2015,c mon vike
Matt_glenn33,Fri Dec 04 07:36:22 IST 2015,noth better get work earli
Matt_glenn33,Sat Nov 28 11:25:49 IST 2015,rt my cowork make life worth live
Matt_glenn33,Mon Oct 05 05:51:59 IST 2015,mexico
Matt_glenn33,Sun Jul 12 23:32:23 IST 2015,az mn
Matt_glenn33,Fri Jul 03 04:41:25 IST 2015,the best part wisconsin
Matt_glenn33,Thu Jul 02 01:48:27 IST 2015,drive around green bay realiz i dont know anyth
Matt_glenn33,Fri May 29 22:35:52 IST 2015,my car
Matt_glenn33,Mon Apr 06 05:36:42 IST 2015,maci i vote sconniespirit win who pick marchmad
Matt_glenn33,Sun Apr 05 08:28:39 IST 2015,rt i hate kentucki
Matt_glenn33,Sun Apr 05 02:42:22 IST 2015,yes till
Matt_glenn33,Sun Mar 29 07:16:58 IST 2015,noth better get car search polic
Matt_glenn33,Sat Mar 28 05:01:08 IST 2015,maci i vote sconniespirit advanc next round who pick marchmad
Matt_glenn33,Sat Mar 14 13:10:10 IST 2015,they hire leprechaun parti work tonight
Matt_glenn33,Fri Mar 06 03:43:07 IST 2015,happi birthday colin see summer
Matt_glenn33,Fri Mar 06 03:30:51 IST 2015,think take photo
Matt_glenn33,Mon Feb 02 01:08:20 IST 2015,i got win seahawkswin
Matt_glenn33,Sun Feb 01 06:07:56 IST 2015,give jj wattmvp
Matt_glenn33,Thu Jan 29 10:04:36 IST 2015,success day get sportscent the dan patrick show day
Matt_glenn33,Sat Jan 10 21:51:14 IST 2015,alway regret sleep contact
Matt_glenn33,Sat Dec 13 10:57:01 IST 2014,so i met brian urlach work today
Matt_glenn33,Fri Dec 05 02:33:39 IST 2014,just luck day i wear new shoe school poor
Matt_glenn33,Thu Nov 27 02:32:03 IST 2014,welcom get mom send money
Matt_glenn33,Sun Nov 23 04:41:50 IST 2014,when get bore work red bull chug contest
Matt_glenn33,Wed Nov 19 08:02:12 IST 2014,know get sick worst feel
Matt_glenn33,Tue Nov 11 03:06:40 IST 2014,rt i would buy
Matt_glenn33,Tue Nov 04 03:17:49 IST 2014,only full week school novemb
Matt_glenn33,Sun Oct 05 21:41:43 IST 2014,mall america today
Matt_glenn33,Sun Oct 05 02:47:59 IST 2014,sometim get along
Matt_glenn33,Thu Oct 02 01:29:24 IST 2014,last week minneapoli sunni cours i land raini
Matt_glenn33,Tue Sep 30 08:50:18 IST 2014,first time window open sinc may feel amaz
Matt_glenn33,Sun Sep 28 23:57:05 IST 2014,i bench steve smith
Matt_glenn33,Mon Sep 22 05:11:38 IST 2014,guy left earli
Matt_glenn33,Sun Sep 21 23:17:44 IST 2014,bye cassel hello bridgewat
Matt_glenn33,Fri Sep 19 05:00:49 IST 2014,rt nfl terribl right
Matt_glenn33,Sun Sep 14 03:05:42 IST 2014,first time ive ashwaubenon coca cola commerci tv sens super bowl
Matt_glenn33,Fri Sep 12 06:51:23 IST 2014,neverforget memori place i never forget
Matt_glenn33,Thu Sep 11 09:53:43 IST 2014,rt fun rabbit got gun huh
Matt_glenn33,Mon Sep 08 11:09:32 IST 2014,oliv realli like cone shame
Matt_glenn33,Mon Sep 08 01:52:31 IST 2014,if lion loos tomorrow first place first time year
Matt_glenn33,Wed Aug 27 07:40:05 IST 2014,of cours i pick dad airport tonight
