username,time,tweet
mlee389W,Tue Mar 01 05:29:52 IST 2016,utharrissu north korean student ask teacher america danger get scold
mlee389W,Tue Mar 01 05:25:27 IST 2016,utharrissu american flag north korean flag orchestra meh
mlee389W,Tue Mar 01 05:23:13 IST 2016,utharrissu pyongyang modern meh
mlee389W,Tue Mar 01 05:19:20 IST 2016,utharrissu creat sens two dimension medium
mlee389W,Tue Mar 01 05:17:31 IST 2016,utharrissu year countri divid meh
mlee389W,Tue Mar 01 05:15:06 IST 2016,utharrissu korea a nation divid mark edward harri
mlee389W,Tue Mar 01 05:11:25 IST 2016,utharrissu photojournalist kill blame
mlee389W,Tue Mar 01 05:10:18 IST 2016,the boy die one help utharrissu
mlee389W,Tue Mar 01 05:07:49 IST 2016,utharrissu children vietnam still die land mine ut
mlee389W,Tue Mar 01 05:04:29 IST 2016,utharrissu
mlee389W,Tue Mar 01 05:03:31 IST 2016,utharrissu year napalm i took pictur pari hilton jail ut
mlee389W,Tue Mar 01 05:01:07 IST 2016,utharrissu hollywood pictur bett davi oj simpson tyson
mlee389W,Tue Mar 01 04:55:50 IST 2016,utharrissu hell hollywood titl second part
mlee389W,Tue Mar 01 04:47:41 IST 2016,utharrissu i want take pictur i want help ut
mlee389W,Tue Mar 01 04:42:14 IST 2016,utharrissu i film but must
mlee389W,Tue Mar 01 04:38:37 IST 2016,utharrissu work ap year hope retir year
mlee389W,Tue Mar 01 04:32:33 IST 2016,utharrissu public lectur sargent hall
mlee389W,Mon Feb 29 23:35:58 IST 2016,utharrissu nick ut outsid somerset suffolk flag background
mlee389W,Mon Feb 29 22:07:49 IST 2016,utharrissu nick ut pictur church across ridgeway
mlee389W,Mon Feb 29 18:09:52 IST 2016,utharrissu sawyer librari sargent hall
mlee389W,Mon Feb 29 06:56:25 IST 2016,utharri photograph poster design trio
mlee389W,Mon Feb 29 02:25:01 IST 2016,great open hous today with surpris
mlee389W,Mon Feb 29 00:08:57 IST 2016,utharrissu at studio
mlee389W,Sun Feb 28 23:41:16 IST 2016,utharrissu nick ut front greatest boston colleg
mlee389W,Sun Feb 28 22:02:37 IST 2016,utharrissu the men camera mark left nick back ken front
mlee389W,Sun Feb 28 22:00:39 IST 2016,utharrissu nick old north church
mlee389W,Sun Feb 28 19:58:59 IST 2016,utharrissu over old citi hall
mlee389W,Sun Feb 28 19:13:44 IST 2016,utharrissu dinner cjn faculti
mlee389W,Sun Feb 28 18:48:46 IST 2016,utharrissu and final reliev realli boston
mlee389W,Sun Feb 28 18:48:14 IST 2016,utharrissu i hope mark stern look pictur
mlee389W,Sun Feb 28 18:47:31 IST 2016,utharrissu they nick ut depart boston
mlee389W,Sat Feb 27 21:19:46 IST 2016,see soon
mlee389W,Sat Feb 27 19:48:36 IST 2016,i see i thought meant film someth
mlee389W,Sat Feb 27 01:59:09 IST 2016,utharrissu tue p master class social media lab somerset e mail kmartin suffolk edu
mlee389W,Fri Feb 26 23:06:52 IST 2016,this popular articl assign mention
mlee389W,Fri Feb 26 23:05:44 IST 2016,someon post you say hi
mlee389W,Fri Feb 26 23:04:31 IST 2016,any selfi involv face accept these pictur sexi you look like idiot
mlee389W,Fri Feb 26 22:59:50 IST 2016,even lit review student
mlee389W,Fri Feb 26 22:59:13 IST 2016,time appear must popular articl far
mlee389W,Fri Feb 26 22:58:52 IST 2016,you say hi erin she post
mlee389W,Fri Feb 26 22:57:48 IST 2016,this insight interview
mlee389W,Fri Feb 26 22:55:16 IST 2016,interview interviewe guest
mlee389W,Fri Feb 26 22:51:34 IST 2016,how experi relat question
mlee389W,Fri Feb 26 22:49:09 IST 2016,any idea hollywood
mlee389W,Fri Feb 26 22:47:59 IST 2016,slight unclear relat activ
mlee389W,Fri Feb 26 22:46:54 IST 2016,yes like blacklivesmatt
mlee389W,Fri Feb 26 22:45:35 IST 2016,i think rais good question whether citizen photojournalist
mlee389W,Fri Feb 26 22:44:18 IST 2016,how interest
mlee389W,Fri Feb 26 22:43:20 IST 2016,a student post one like post ha ha
mlee389W,Fri Feb 26 22:42:52 IST 2016,remind boston marathon bomb peopl take pictur help other
