username,time,tweet
Skyecolor,Thu Sep 01 05:29:34 IST 2011,possibly the most awesome site ever its name has absolutely nothing to do with it  wwwcalebmusiccom
Skyecolor,Thu Sep 01 00:42:26 IST 2011,rt  kevin  lolita vacca-missionaries since 93 philippines she speaks 5 languages 5 yr philippine goal- 1 million souls  
Skyecolor,Wed Aug 31 23:47:49 IST 2011,rt  if your creed and scripture do not agree cut your creed to pieces but make it agree with this book -  spurgeon
Skyecolor,Wed Aug 31 23:41:11 IST 2011,rt  leonard  ping-lan richardson been in taiwan since 1990 these people have a great burden for the chinese people http 
Skyecolor,Wed Aug 31 20:16:14 IST 2011,washed my glasses today with simple soap and water it was like i got new glasses it was so clear
Skyecolor,Wed Aug 31 18:19:08 IST 2011,rt  leave this morning for toronto eagle summit conference looking for a jesus show up not a man show out jesus is lord
Skyecolor,Wed Aug 31 08:18:45 IST 2011,rt  the headquarters upc church on the island of st croix built this building with their own money i think around 3 mil ht 
Skyecolor,Wed Aug 31 08:09:26 IST 2011,rt  randall  theresa richardson have been missionaries for 34 years started in madagascar 
Skyecolor,Wed Aug 31 07:53:19 IST 2011,rt  i feel that the 38 years ive spent on the mission field have been a gift to me  valerie demos 
Skyecolor,Wed Aug 31 07:30:52 IST 2011,rt  alan  valerie demos have been missionaries for 38 years 1974-89 greece 1989-present germany a lifetime of missions h 
Skyecolor,Wed Aug 31 06:27:43 IST 2011,rt  missionaries are the pride of the upci giving up comfort and complacency to make a difference for the kingdom god  
Skyecolor,Wed Aug 31 03:31:53 IST 2011,a priority not an asset investing innot pulling out sacrificing for them not sacrificing themsecond only to jesus in our lives family
Skyecolor,Wed Aug 31 03:08:05 IST 2011,rt  missionaries steve  kari shirley dominican republic/leeward islands 1992 - 36 ministers 2011 - 126 ministers http// 
Skyecolor,Wed Aug 31 02:42:07 IST 2011,rt  missionaries roger  becky buckland sharing their burden for czech republic budapest hungary 2 million has no church h 
Skyecolor,Wed Aug 31 02:05:41 IST 2011,rt  missionaries to cameroons africa  terry riddick famthe spirit fell as she prayed in the pidgen spelling language h 
Skyecolor,Wed Aug 31 02:05:21 IST 2011,rt  robert mcfarland missionary to israel speaks both aramic  hebrew pray for these great people they live in jerusalem  
Skyecolor,Wed Aug 31 02:05:18 IST 2011,rt  missionaries to taiwan praying in manderin gave their lives to bring the gospel to the chinese people wow  
Skyecolor,Tue Aug 30 04:18:20 IST 2011,rt  we often treat jesus like saul treated david we ask him 2 slay giants  remove evil spirits but dont want 2 let him b 
Skyecolor,Tue Aug 30 04:11:04 IST 2011,prepping for a two hour bus trip tomorrow i love google maps
Skyecolor,Mon Aug 29 07:56:30 IST 2011,rt aregiants life is short  dream big
Skyecolor,Mon Aug 29 02:31:23 IST 2011, followed closely by i will mold this clay like clay
Skyecolor,Sun Aug 28 22:42:35 IST 2011,had an awesome time with bro larry carter at the pom looking forward to youth this evening blessed
Skyecolor,Sun Aug 28 03:03:11 IST 2011,chef boyardee its whats for dinner i havent had mini ravioli in years lol homealone hunger
Skyecolor,Sun Aug 28 02:15:08 IST 2011,rt  if you find yourself in a conversation with a stutterer its best to shout reeeeeemix and scratch at invisible turn 
Skyecolor,Sat Aug 27 09:59:01 IST 2011,had a great time video chatting with a group of like-minded youth we have to do this again i think i strained a smile muscle japan
Skyecolor,Sat Aug 27 07:48:16 IST 2011,rt  its time for the church to abandon social classes - we dont draw our identity from creation but the creator all are 
Skyecolor,Sat Aug 27 06:42:28 IST 2011, im more jealous than i look lol
Skyecolor,Sat Aug 27 06:19:09 IST 2011, yeah it filled in alot of the backstory about the establishment of the empire and the clone army it explains alot lol
Skyecolor,Sat Aug 27 06:16:20 IST 2011, have you read the republic commando series
Skyecolor,Sat Aug 27 06:14:06 IST 2011, oh wow thats awesome ive probably read all of those lol
Skyecolor,Sat Aug 27 06:08:57 IST 2011,rt  there are students from 140 different countries at post-secondary institutions in halifax foreign missions has come t 
Skyecolor,Sat Aug 27 02:55:40 IST 2011, im impressed congrats
Skyecolor,Fri Aug 26 06:16:18 IST 2011,i had a sitdown dinner with my mom for the first time in about 3 weeks life gets busy fast lol goodfood family content
Skyecolor,Fri Aug 26 04:32:08 IST 2011,rt  it is raining cats and dogsi almost stepped in a poodle
Skyecolor,Fri Aug 26 00:43:03 IST 2011,rt  we love  
Skyecolor,Thu Aug 25 23:29:59 IST 2011, thats great i hear solitare comes preloaded on that so cool -
Skyecolor,Thu Aug 25 23:28:52 IST 2011,rt  today is the day i make a bold move i am upgrading to windows98
Skyecolor,Thu Aug 25 22:39:56 IST 2011,rt  a thorough knowledge of the bible is worth more than a college education -theodore roosevelt 26th president of the u 
Skyecolor,Thu Aug 25 12:01:08 IST 2011,rt levesque youknowitstimetogotobedwhen you look at your ipod and it says 230am and your still wide awake
Skyecolor,Thu Aug 25 08:05:36 IST 2011,rt  it never seems so bad until you run into a day like tomorrow
Skyecolor,Thu Aug 25 07:57:50 IST 2011,crazy lightning storm happening now in the gta who needs fireworks its lighting up the entire street lol amazed thunderousapplause
Skyecolor,Thu Aug 25 07:42:53 IST 2011,rt  steve jobs has resigned wowperhaps soon apple users will gain personal control over their devices
Skyecolor,Thu Aug 25 01:05:17 IST 2011,tortillas grill ham and cheese im going to be a wrap star rhythmandrhyme
Skyecolor,Thu Aug 25 00:08:09 IST 2011,rt  parents help your childs youth pastor out by assuming your role and disciple your child train up a childits bib 
Skyecolor,Wed Aug 24 09:17:14 IST 2011, you should follow  theyre awesome and i love who and what they are
Skyecolor,Wed Aug 24 09:12:00 IST 2011,rt  never be afraid to be yourself remember original is always worth more than a copy
Skyecolor,Wed Aug 24 08:57:34 IST 2011,finally had a hot drink my first for the year besides soup lol i normally ration my hot drinks to november and december slipping
Skyecolor,Wed Aug 24 08:38:56 IST 2011,don barista to you or perhaps godfather respect the barista needcaffeine
Skyecolor,Wed Aug 24 08:36:18 IST 2011,esspresso machine is back and up and running the coffee will flow tonight i wanna be a barista when i grow up
Skyecolor,Wed Aug 24 04:22:51 IST 2011, you can read open letter to the virginia district   // powerful here it comes north america excited
