username,time,tweet
SamanthaBurgio,Sun Sep 01 05:29:53 IST 2013,so mani big sweater mall tis season big sweater leg ugg boot
SamanthaBurgio,Sun Sep 01 03:47:48 IST 2013,piss pink mix blond fuckdyinghair
SamanthaBurgio,Sat Aug 31 04:39:23 IST 2013,ask mom sister i go away colleg they respond would went jail
SamanthaBurgio,Sat Aug 31 00:20:11 IST 2013,would believ i said i love
SamanthaBurgio,Fri Aug 30 07:39:50 IST 2013,i love second job bartend much fun plus extra money
SamanthaBurgio,Wed Aug 28 02:46:54 IST 2013,i still like miley
SamanthaBurgio,Wed Aug 28 02:45:34 IST 2013,yes pleasee ill let know i next caus i think i wok job tomorrow thursday
SamanthaBurgio,Sun Aug 25 13:30:29 IST 2013,i need go home like
SamanthaBurgio,Sun Aug 25 09:22:06 IST 2013,day two midnight let goooo er drunk dui code asshol
SamanthaBurgio,Sun Aug 25 05:54:11 IST 2013,
SamanthaBurgio,Sun Aug 25 05:54:07 IST 2013,work
SamanthaBurgio,Sun Aug 25 05:44:17 IST 2013,could hit zoo someth ha
SamanthaBurgio,Sun Aug 25 05:42:43 IST 2013,hey i see come state lololol
SamanthaBurgio,Sun Aug 25 05:18:48 IST 2013,hmmm i herd main cool
SamanthaBurgio,Sun Aug 25 05:03:38 IST 2013,one hit cross countri trip
SamanthaBurgio,Sun Aug 25 04:33:17 IST 2013,mountain climb well
SamanthaBurgio,Sun Aug 25 03:26:20 IST 2013,ny i drive lol but get togeth need happen asap
SamanthaBurgio,Sun Aug 25 03:17:11 IST 2013,shall mini trip
SamanthaBurgio,Sun Aug 25 00:55:08 IST 2013,i want road trip start
SamanthaBurgio,Sat Aug 24 23:02:47 IST 2013,
SamanthaBurgio,Sat Aug 24 12:34:31 IST 2013,stay awak late much easyer drunk
SamanthaBurgio,Sat Aug 24 11:12:53 IST 2013,reunit feel soooo goooood killmenow come er right meow
SamanthaBurgio,Sat Aug 24 11:08:30 IST 2013,there doubt mind i gong fall asleep er help graveshift fuckthi dui drunk detox code erlif
SamanthaBurgio,Sat Aug 24 05:49:16 IST 2013,i actual piss i got call fake wear makeup today perfect
SamanthaBurgio,Fri Aug 23 21:24:17 IST 2013,i like pretend maci ryan get back togeth one day
SamanthaBurgio,Thu Aug 22 12:00:02 IST 2013,i feel comfort insid outsid durn storm biggest fear
SamanthaBurgio,Thu Aug 22 11:41:59 IST 2013,so i wish i heavi sleeper i fuck hate thunder storm
SamanthaBurgio,Thu Aug 22 06:23:30 IST 2013,whenev i feel i read quot pinterest
SamanthaBurgio,Wed Aug 21 21:13:19 IST 2013,pizza wing beer camp fire tonight
SamanthaBurgio,Wed Aug 21 02:58:17 IST 2013,i need new friend like laid back hippi one
SamanthaBurgio,Tue Aug 20 04:06:41 IST 2013,super trooper never get old
SamanthaBurgio,Sun Aug 18 19:33:09 IST 2013,rt it goe show ever know watch card play play slow gratefuldead
SamanthaBurgio,Sun Aug 18 05:44:43 IST 2013,just taught mom dad jell o shot
SamanthaBurgio,Sun Aug 18 03:44:15 IST 2013,could come clam bake build fire but know long well it us though
SamanthaBurgio,Sun Aug 18 03:35:43 IST 2013,i mind peopl smoke i think disgust peopl feel need wear pot leaf cloth
SamanthaBurgio,Sun Aug 18 00:48:34 IST 2013,clam bake
SamanthaBurgio,Sat Aug 17 23:22:33 IST 2013,wish i cute hippi dress
SamanthaBurgio,Fri Aug 16 23:44:14 IST 2013,feel hookah tonight
SamanthaBurgio,Fri Aug 16 21:28:42 IST 2013,slut slut
SamanthaBurgio,Fri Aug 16 14:37:22 IST 2013,fuck cold weather
SamanthaBurgio,Fri Aug 16 14:16:00 IST 2013,i even go question i woke without pant
SamanthaBurgio,Fri Aug 16 02:34:07 IST 2013,why life like eat pray love
SamanthaBurgio,Wed Aug 14 19:07:15 IST 2013,have less do be
SamanthaBurgio,Wed Aug 14 18:30:52 IST 2013,work point i post i leav kitti home i went hous
SamanthaBurgio,Wed Aug 14 17:14:40 IST 2013,if talk shit someon still act like friend your trash i want ever friend getfuck
SamanthaBurgio,Wed Aug 14 06:38:14 IST 2013,i love hate relationship exboyfriend moment i hate tomorrow ill prob love whatev
SamanthaBurgio,Wed Aug 14 06:33:23 IST 2013,i actual fuck hate think fakest person iv ever met stupidbitch
SamanthaBurgio,Wed Aug 14 01:35:59 IST 2013,rt overs sweater leg
