username,time,tweet
eggsotics,Tue Mar 01 05:29:35 IST 2016,self esteem improv singl bit sinc like
eggsotics,Tue Mar 01 05:28:54 IST 2016,thing chang say thank bc got tire fight
eggsotics,Tue Mar 01 05:28:13 IST 2016,rt re watch american beauti one time favourit film
eggsotics,Tue Mar 01 05:28:08 IST 2016,big problem bc whenev peopl compliment feel like lie
eggsotics,Tue Mar 01 05:08:41 IST 2016,love watch josh play drum satisfi
eggsotics,Tue Mar 01 05:08:09 IST 2016,rt like drum
eggsotics,Tue Mar 01 04:58:33 IST 2016,rt having issu eye everi time i see say fight i alway read mute anyon els
eggsotics,Tue Mar 01 04:54:16 IST 2016,rt you poem i never knew write life stori i alway want tell
eggsotics,Tue Mar 01 04:22:43 IST 2016,rt excit expect turn resent
eggsotics,Tue Mar 01 03:50:45 IST 2016,rt contextu fuckboy n fuckboy relat mistak fuckboy universali n etern inher
eggsotics,Mon Feb 29 17:16:21 IST 2016,
eggsotics,Mon Feb 29 17:16:07 IST 2016,rt
eggsotics,Mon Feb 29 17:15:52 IST 2016,rt i havent fuck seen this
eggsotics,Mon Feb 29 17:15:00 IST 2016,rt dave grohl sing blackbird amaz
eggsotics,Mon Feb 29 17:14:59 IST 2016,rt
eggsotics,Mon Feb 29 11:24:55 IST 2016,rt yes huge congrat well deserv
eggsotics,Mon Feb 29 11:24:47 IST 2016,rt fun fact tho leonardo dicaprio scorpio point u guy
eggsotics,Mon Feb 29 11:24:42 IST 2016,rt i tri make big one secur stop darn oscar
eggsotics,Mon Feb 29 11:07:05 IST 2016,ok ok i gotta sleep i full joy rn i
eggsotics,Mon Feb 29 11:06:49 IST 2016,rt i sob
eggsotics,Mon Feb 29 11:06:08 IST 2016,look him om g a happi oscar win leo
eggsotics,Mon Feb 29 11:03:16 IST 2016,rt leo s full speech rt to save a life
eggsotics,Mon Feb 29 11:02:57 IST 2016,rt leo dicaprio hold oscar rare appear everi year rt sec good luck
eggsotics,Mon Feb 29 11:02:49 IST 2016,rt leonardo dicaprio final win oscar
eggsotics,Mon Feb 29 11:02:37 IST 2016,rt thank academi incred cast crew thereven oscar
eggsotics,Mon Feb 29 11:02:20 IST 2016,rt ladi gaga
eggsotics,Mon Feb 29 11:02:08 IST 2016,child born today never experi world oscar less leo
eggsotics,Mon Feb 29 10:52:16 IST 2016,rt can wait see updat leo meme tomorrow well deserv award oscar leonardodicaprio
eggsotics,Mon Feb 29 10:50:41 IST 2016,lmao wake tomorrow joke take oscar leo hous give eddi lmao bye
eggsotics,Mon Feb 29 10:50:00 IST 2016,punk real bad rn
eggsotics,Mon Feb 29 10:45:37 IST 2016,happi new year merri christma cure cancer discov leo oscar love day
eggsotics,Mon Feb 29 10:44:51 IST 2016,go snapchat see exclus footag actual genuin real tear over leo s win
eggsotics,Mon Feb 29 10:36:23 IST 2016,i need lmao bye
eggsotics,Mon Feb 29 10:36:08 IST 2016,leo oscar good angel
eggsotics,Mon Feb 29 10:35:27 IST 2016,rt leo use oscar speech talk abt underprivileg abt global warm good pure
eggsotics,Mon Feb 29 10:33:26 IST 2016,leo first oscar
eggsotics,Mon Feb 29 10:32:54 IST 2016,rt sign win oscar
eggsotics,Mon Feb 29 10:32:48 IST 2016,rt kate winslet watch leo dicaprio oscar accept speech cri
eggsotics,Mon Feb 29 10:32:24 IST 2016,happi
eggsotics,Mon Feb 29 10:30:32 IST 2016,
eggsotics,Mon Feb 29 10:29:40 IST 2016,i happi babi ok gnight
eggsotics,Mon Feb 29 10:29:25 IST 2016,know better cut like wtf wait forev least
eggsotics,Mon Feb 29 10:29:01 IST 2016,notic how they didnt cut him off with the music lmao
eggsotics,Mon Feb 29 10:28:43 IST 2016,rt leo speech
eggsotics,Mon Feb 29 10:28:36 IST 2016,rt final teamleo oscar
eggsotics,Mon Feb 29 10:25:47 IST 2016,my heart
eggsotics,Mon Feb 29 10:25:41 IST 2016,holi fuke
eggsotics,Mon Feb 29 10:25:11 IST 2016,
eggsotics,Mon Feb 29 10:24:04 IST 2016,
eggsotics,Mon Feb 29 10:23:59 IST 2016,bro imma upset i stay shit leo win
