username,time,tweet
haileywampach,Tue Mar 01 05:29:58 IST 2016,marlei mad rn i share long hair hamster
haileywampach,Tue Mar 01 04:28:12 IST 2016,when third wheel boyfriend bestfriend
haileywampach,Mon Feb 29 20:43:38 IST 2016,rt fr lucki met
haileywampach,Mon Feb 29 11:19:03 IST 2016,
haileywampach,Mon Feb 29 11:11:57 IST 2016,shake vishal
haileywampach,Mon Feb 29 11:09:34 IST 2016,i go start sell organ pay tuition
haileywampach,Mon Feb 29 02:46:56 IST 2016,happi birthday girl
haileywampach,Mon Feb 29 01:14:26 IST 2016,heather bout sister law
haileywampach,Sun Feb 28 16:27:41 IST 2016,rt so high school ridicul
haileywampach,Sun Feb 28 02:36:33 IST 2016,fuck
haileywampach,Sun Feb 28 02:26:58 IST 2016,rt stubborn af good heart
haileywampach,Sun Feb 28 02:17:25 IST 2016,rt when u step away func take pic
haileywampach,Sat Feb 27 14:41:48 IST 2016,fuckkk
haileywampach,Sat Feb 27 14:36:28 IST 2016,i probabl get expel tweet
haileywampach,Sat Feb 27 06:42:00 IST 2016,rt if cheat liter go straight hell do pass go do collect dollar
haileywampach,Thu Feb 25 12:07:14 IST 2016,fuckkkkkk
haileywampach,Wed Feb 24 04:19:49 IST 2016,happi birthday littl love lot
haileywampach,Tue Feb 23 10:53:56 IST 2016,rt life get better june
haileywampach,Sun Feb 21 09:51:39 IST 2016,rt i stubborn hell
haileywampach,Fri Feb 19 10:54:29 IST 2016,hahah bra strap show i got referr freshman
haileywampach,Fri Feb 19 10:53:08 IST 2016,rt i wait go colleg
haileywampach,Fri Feb 19 10:52:24 IST 2016,distract
haileywampach,Fri Feb 19 10:46:00 IST 2016,short finger length
haileywampach,Fri Feb 19 10:45:13 IST 2016,ugh thank beauti
haileywampach,Fri Feb 19 10:43:41 IST 2016,make heart happi
haileywampach,Fri Feb 19 10:17:48 IST 2016,rt never tweet accur
haileywampach,Fri Feb 19 07:53:39 IST 2016,rt isn funni day day noth chang look back everyth differ
haileywampach,Thu Feb 18 11:56:31 IST 2016,rt friend lmao
haileywampach,Thu Feb 18 03:24:41 IST 2016,but
haileywampach,Mon Feb 15 05:53:14 IST 2016,rt dont hit me up when its good for you
haileywampach,Mon Feb 15 01:11:47 IST 2016,goal
haileywampach,Mon Feb 15 00:05:21 IST 2016,rt mood
haileywampach,Sun Feb 14 07:04:43 IST 2016,i realli need tattoo
haileywampach,Sun Feb 14 01:46:08 IST 2016,rt never earli selfi
haileywampach,Sat Feb 13 07:12:26 IST 2016,rt when text back
haileywampach,Fri Feb 12 23:39:57 IST 2016,happi birthday phoeb hope great
haileywampach,Fri Feb 12 05:55:37 IST 2016,rt my dad cancer
haileywampach,Wed Feb 10 11:17:20 IST 2016,rt i want cloth lot cloth
haileywampach,Tue Feb 09 01:33:47 IST 2016,rt welcom gcu fiona samodurov lopesris
haileywampach,Sun Feb 07 11:08:18 IST 2016,rt i wait colleg
haileywampach,Sat Feb 06 08:17:31 IST 2016,rt get readi valentin day like
haileywampach,Sat Feb 06 08:10:47 IST 2016,rt when hear bitch talk
