username,time,tweet
savedbycookies,Tue Mar 01 05:29:49 IST 2016,but i reaaaaalli bad evalu damag i sure whether jump lot time
savedbycookies,Tue Mar 01 05:29:13 IST 2016,akali much fun
savedbycookies,Tue Mar 01 03:33:20 IST 2016,rt everyon deserv look way leonardo dicaprio look cooki
savedbycookies,Mon Feb 29 21:55:15 IST 2016,hrm
savedbycookies,Mon Feb 29 18:49:47 IST 2016,pretti littl liar addict though
savedbycookies,Mon Feb 29 18:49:09 IST 2016,rt leo s face when they engrav his name to his oscar i m laugh what s go on
savedbycookies,Mon Feb 29 18:28:53 IST 2016,she fake it didn t she pll
savedbycookies,Mon Feb 29 18:26:06 IST 2016,allison still aliv
savedbycookies,Mon Feb 29 18:23:47 IST 2016,hannah yas my queeeen pll
savedbycookies,Mon Feb 29 18:23:19 IST 2016,wait mom leav wtf pll
savedbycookies,Mon Feb 29 18:22:16 IST 2016,mike give fuck anymor pll
savedbycookies,Mon Feb 29 18:20:39 IST 2016,alex x spencer real heart melt pll
savedbycookies,Mon Feb 29 18:19:58 IST 2016,sean pleas stop being so annoy pll
savedbycookies,Mon Feb 29 18:15:31 IST 2016,spencer drama queen pll
savedbycookies,Mon Feb 29 18:14:00 IST 2016,oooh trashtalk ali dare pll
savedbycookies,Mon Feb 29 18:13:03 IST 2016,hannah queen pll
savedbycookies,Mon Feb 29 18:11:20 IST 2016,alex omg spencer hilft mir mit den melonenbällchen ich muss sie heiraten pll
savedbycookies,Mon Feb 29 18:07:32 IST 2016,
savedbycookies,Mon Feb 29 18:04:50 IST 2016,yeah throw away evid tobi murder sound like a good idea pll
savedbycookies,Mon Feb 29 17:56:19 IST 2016,sean kind weird pll
savedbycookies,Mon Feb 29 17:40:06 IST 2016,she live pll
savedbycookies,Mon Feb 29 17:39:20 IST 2016,run fast with those high heel pll
savedbycookies,Mon Feb 29 17:37:32 IST 2016,shit go pll
savedbycookies,Mon Feb 29 17:36:27 IST 2016,that symbol
savedbycookies,Mon Feb 29 17:35:04 IST 2016,yaaaa em run pll
savedbycookies,Mon Feb 29 17:34:38 IST 2016,jenna you hoe pll
savedbycookies,Mon Feb 29 17:34:27 IST 2016,this fuck show is way too intens pll
savedbycookies,Mon Feb 29 17:33:27 IST 2016,hannah don t break sean heart pll
savedbycookies,Mon Feb 29 17:32:56 IST 2016,pleas don t die emili pll
savedbycookies,Mon Feb 29 17:32:03 IST 2016,tobi pleas don t be a rapist murder pll
savedbycookies,Mon Feb 29 17:31:34 IST 2016,ok like
savedbycookies,Mon Feb 29 17:31:17 IST 2016,melissa can you just die you bitter old cunt pll
savedbycookies,Mon Feb 29 17:29:49 IST 2016,oooh em dead pll
savedbycookies,Mon Feb 29 17:23:33 IST 2016,time pizza
savedbycookies,Mon Feb 29 17:22:30 IST 2016,emili bi queen pll
savedbycookies,Mon Feb 29 17:08:17 IST 2016,poor alex pll
savedbycookies,Mon Feb 29 17:06:32 IST 2016,yaaaa aria forget borderlin pedophil teacher pll
savedbycookies,Mon Feb 29 17:05:38 IST 2016,melissa i hope you die a slow and pain death pll
savedbycookies,Mon Feb 29 17:05:11 IST 2016,wenn es quakt und läuft wie ne ent ist es ne scheiß ent hannah queen metaphor
savedbycookies,Mon Feb 29 17:00:24 IST 2016,melissa you bitch leav alex alon pll
savedbycookies,Mon Feb 29 16:58:48 IST 2016,i take everyth back mona piec shit pll
savedbycookies,Mon Feb 29 16:53:44 IST 2016,jenna evil bitch pll
savedbycookies,Mon Feb 29 16:53:04 IST 2016,hannah noooo you broke maya heart pll
savedbycookies,Mon Feb 29 16:52:31 IST 2016,wait alex like well jesus go find boyfriend that are not illeg girl pll
savedbycookies,Mon Feb 29 16:51:47 IST 2016,alex way cute pll
savedbycookies,Mon Feb 29 16:50:48 IST 2016,emili doesn t give a fuck pll
savedbycookies,Mon Feb 29 16:50:32 IST 2016,why tobi look like fuck werewolf pll
savedbycookies,Mon Feb 29 16:49:38 IST 2016,oh god tobi pll
savedbycookies,Mon Feb 29 16:47:06 IST 2016,ezra stop being a dick pll
savedbycookies,Mon Feb 29 16:46:32 IST 2016,ich bin muskulö wie ein seegurk ok pll
