username,time,tweet
ThatPlexusLife,Tue Mar 01 05:29:39 IST 2016,make draft plexus powerpoint present plexus meet greet everyth get confirm
ThatPlexusLife,Tue Mar 01 05:09:22 IST 2016,i guess i thinker you tri noth happen i know
ThatPlexusLife,Tue Mar 01 05:06:27 IST 2016,time get mind thing i go work plexus busi
ThatPlexusLife,Tue Mar 01 05:05:05 IST 2016,i know girl intent let happen shame
ThatPlexusLife,Tue Mar 01 05:04:18 IST 2016,i jealous type girl someon tri step my territori best believ i stayinyourlan
ThatPlexusLife,Tue Mar 01 02:19:11 IST 2016,look earn extra look join plexus team today plexusambassador plexus drinkpink thatpinklif
ThatPlexusLife,Tue Mar 01 00:45:19 IST 2016,it would pretti awesom could just thought
ThatPlexusLife,Mon Feb 29 23:32:53 IST 2016,i recruit peopl join plexus team wouldn like earn extra messag
ThatPlexusLife,Mon Feb 29 23:29:39 IST 2016,start plexus right direct just get peopl interest think plexusambassador plexus drinkpink
ThatPlexusLife,Mon Feb 29 23:26:27 IST 2016,look differ laptop my current one keep freez
ThatPlexusLife,Mon Feb 29 07:35:47 IST 2016,want earn extra what i told home join plexus plexusambassador
ThatPlexusLife,Mon Feb 29 05:40:14 IST 2016,how i allerg break horribl rash sam choic bbq sauc
ThatPlexusLife,Mon Feb 29 02:11:25 IST 2016,time get journal well plexus journal to keep note strategi plus contact
ThatPlexusLife,Mon Feb 29 02:09:46 IST 2016,off work monday tuesday wednesday then thursday huge order final hour
ThatPlexusLife,Mon Feb 29 02:08:06 IST 2016,i look peopl join team must motiv readi fun messag info
ThatPlexusLife,Mon Feb 29 00:53:04 IST 2016,check two
ThatPlexusLife,Sun Feb 28 00:29:02 IST 2016,take plexus busi mobil laptop
ThatPlexusLife,Sat Feb 27 23:18:42 IST 2016,thank starter kit it definit help glad apart busi plexusambassador
ThatPlexusLife,Sat Feb 27 23:06:26 IST 2016,rt uncl jess is still fire
ThatPlexusLife,Sat Feb 27 23:05:20 IST 2016,total make hour next week about time hour go
ThatPlexusLife,Sat Feb 27 10:48:35 IST 2016,plexus readi go morn plexus drinkpink livingthatpinklif
ThatPlexusLife,Sat Feb 27 01:10:13 IST 2016,do know ppl know someon could benefit plexus product i look referr
ThatPlexusLife,Thu Feb 25 07:53:00 IST 2016,make sure flexibl time enter win new flex tumbler
ThatPlexusLife,Wed Feb 24 22:18:40 IST 2016,run low plexus product have fear shop ambassador id
ThatPlexusLife,Wed Feb 24 22:16:09 IST 2016,join team today with plexus get amaz benefit get bodi healthi contact info
ThatPlexusLife,Wed Feb 24 08:09:10 IST 2016,he alway know brighten day
ThatPlexusLife,Wed Feb 24 04:36:48 IST 2016,peopl never happi someon they alway gotta tri knock someon
ThatPlexusLife,Wed Feb 24 04:08:28 IST 2016,if bother peopl i post plexus guest unfriend
ThatPlexusLife,Wed Feb 24 04:07:08 IST 2016,i love ambassador peopl tri knock go stop
ThatPlexusLife,Wed Feb 24 03:33:36 IST 2016,want member great compani dm today find joinplexus plexusambassador
ThatPlexusLife,Wed Feb 24 02:40:30 IST 2016,what dothan film catfish how i know
ThatPlexusLife,Wed Feb 24 02:15:51 IST 2016,i look motiv peopl join team today contact info plexusambassador plexus
ThatPlexusLife,Wed Feb 24 00:12:56 IST 2016,win amaz exclus pinchm box today
ThatPlexusLife,Tue Feb 23 23:11:29 IST 2016,have pink drink today what wait
ThatPlexusLife,Tue Feb 23 23:10:46 IST 2016,ask plexus today
ThatPlexusLife,Tue Feb 23 23:09:26 IST 2016,let talk ask plexus awesom benefit today plexusambassador askmehow
ThatPlexusLife,Tue Feb 23 23:08:17 IST 2016,ambassador want earn incom ask today
ThatPlexusLife,Tue Feb 23 04:22:32 IST 2016,want get healthi easi way tri plexus today contact info
ThatPlexusLife,Mon Feb 22 06:17:41 IST 2016,know anyon health issu list pic plexus could help though not cure plexus
ThatPlexusLife,Mon Feb 22 06:14:48 IST 2016,i love dress wwefastlan
ThatPlexusLife,Mon Feb 22 06:13:41 IST 2016,why join team the benefit plexalici begin new journey today well wait
ThatPlexusLife,Mon Feb 22 06:10:42 IST 2016,what great grandpa amaz
ThatPlexusLife,Sat Feb 20 04:00:44 IST 2016,i alreadi readi halloween have perfect idea
ThatPlexusLife,Sat Feb 20 03:00:30 IST 2016,got plexus if get plexus today
ThatPlexusLife,Sat Feb 20 02:58:18 IST 2016,how relationship still mess boyfriend bippiti boppiti back heck stay lane
ThatPlexusLife,Fri Feb 19 11:33:35 IST 2016,i girl live world drinkpink plexusstrong getyourplexuson
ThatPlexusLife,Thu Feb 18 09:46:54 IST 2016,possibl two custom score with plexus anyth possibl plexusstrong plexusorbust getyourplexuson
ThatPlexusLife,Thu Feb 18 08:11:22 IST 2016,so true
ThatPlexusLife,Thu Feb 18 08:10:48 IST 2016,might first custom eeek
ThatPlexusLife,Thu Feb 18 04:51:47 IST 2016,plan host plexus seminar just find place use that definit comfort zone
