username,time,tweet
wadahjekot,Tue Mar 01 05:29:45 IST 2016,why i read oh right i sadist
wadahjekot,Tue Mar 01 01:33:56 IST 2016,come give ameera khan break alreadi took video lesson learnt
wadahjekot,Tue Mar 01 00:40:01 IST 2016,rt tri comfort someon cri
wadahjekot,Mon Feb 29 22:25:38 IST 2016,rt rememb stupid thing done
wadahjekot,Mon Feb 29 22:23:39 IST 2016,haha seigt aku dulu belajar scienc bumi kita berputar hari sbb tu bila empat thn dia jdi gtu ler haha
wadahjekot,Mon Feb 29 21:37:47 IST 2016,yaaaaa mana boleh miss joongki ngan hyekyo hhahaahaha
wadahjekot,Mon Feb 29 20:40:12 IST 2016,ooo ptutlaaa sedap nya nak tri cri kt sini
wadahjekot,Mon Feb 29 20:38:22 IST 2016,kau tgh kat negara arab ke cmne ley dpt ni lol
wadahjekot,Mon Feb 29 18:27:05 IST 2016,rt jumpa kat youtub hahahahahahahaha weh siapa buat ni
wadahjekot,Mon Feb 29 18:25:47 IST 2016,rt leonardo dicaprio first oscar
wadahjekot,Mon Feb 29 18:24:53 IST 2016,rt apa itik kampung cakap bila jumpa itik bandar duck duck bandar shial
wadahjekot,Mon Feb 29 18:08:44 IST 2016,monday lectur
wadahjekot,Mon Feb 29 18:03:42 IST 2016,rt when employ want least ten year work experi age
wadahjekot,Mon Feb 29 17:12:48 IST 2016,bila nak dpt elaun
wadahjekot,Mon Feb 29 16:26:18 IST 2016,rt cust buat taik kan nah ambik besok post taik edit resit kan hahaha
wadahjekot,Mon Feb 29 16:23:01 IST 2016,haha sabo jele adat berhousem hehe
wadahjekot,Mon Feb 29 16:11:56 IST 2016,nape ni yunk
wadahjekot,Mon Feb 29 16:11:38 IST 2016,ugh song joongki dont just dont
wadahjekot,Sun Feb 28 21:49:34 IST 2016,rt don underestim power littl boy
wadahjekot,Sun Feb 28 21:45:54 IST 2016,sab kenal kan ibrahim mhi dia buat servi rent bju sejuk adik dia ada baju
wadahjekot,Sun Feb 28 21:20:11 IST 2016,rt only australia hahahahahha
wadahjekot,Sun Feb 28 21:19:26 IST 2016,rt awak yang perempuan jangan sesekali cakap macam ni dunia dunia
wadahjekot,Sun Feb 28 20:54:52 IST 2016,rt allow bless timelin second beauti
wadahjekot,Sun Feb 28 20:53:57 IST 2016,boleh skip kot tu
wadahjekot,Sun Feb 28 20:53:39 IST 2016,hahaha
wadahjekot,Sun Feb 28 19:49:23 IST 2016,haha tapi byk scene nake la tgk
wadahjekot,Sun Feb 28 19:15:02 IST 2016,hahaha cter danish girl tu lagi dahsyat dia kata dia jmpe org yg ley fix mistak yg tuhan buat ltk dia dlm bdn laki
wadahjekot,Sun Feb 28 19:01:12 IST 2016,tak movi eng psl first transgend kt dunia ni
wadahjekot,Sun Feb 28 18:48:50 IST 2016,lol ni dah macam cter danish girl ni
wadahjekot,Sun Feb 28 18:48:22 IST 2016,half day wast ugh
wadahjekot,Sun Feb 28 18:31:56 IST 2016,rt first time make contact coupl malu malu much aww though last long two
wadahjekot,Sun Feb 28 18:26:51 IST 2016,korea snow
wadahjekot,Sun Feb 28 06:21:52 IST 2016,susah gila nak bangun subuh bila dia dah start awal
wadahjekot,Sun Feb 28 00:28:12 IST 2016,nak kurus cm krystal boleh tak
wadahjekot,Sun Feb 28 00:25:13 IST 2016,rt tolong sebar hari kita tolong orang esok lusa orang tolong kita
wadahjekot,Sat Feb 27 23:39:10 IST 2016,nak pergi aldi tapi tuhan je thu mala dia
wadahjekot,Sat Feb 27 23:18:13 IST 2016,rt pergi mampo dgn orang yang tak suka aku aku hidup bukan nak puaskan hati semua orang
wadahjekot,Sat Feb 27 01:54:44 IST 2016,rt slide adulthood
wadahjekot,Sat Feb 27 01:54:37 IST 2016,rt being weird age some peopl still school marri singl ever
wadahjekot,Sat Feb 27 01:53:33 IST 2016,rt when obsess someon
wadahjekot,Sat Feb 27 01:51:47 IST 2016,awh ustaz dah nak kawen yipeee
wadahjekot,Sat Feb 27 01:29:49 IST 2016,rt palestinian journalist moham al qeeq end hunger strike read a look back
wadahjekot,Fri Feb 26 22:21:25 IST 2016,ke sbb aku letak sume self rais flour bad
wadahjekot,Fri Feb 26 22:21:00 IST 2016,bila la ambong ni nak siap
wadahjekot,Fri Feb 26 22:13:35 IST 2016,rt sky dream
wadahjekot,Fri Feb 26 22:13:24 IST 2016,rt tolonglah berhenti merokok guy
wadahjekot,Fri Feb 26 22:00:47 IST 2016,rt chia chia chia tu bukan gelak budak hipster tu sepahtu reunion lah kuno
wadahjekot,Fri Feb 26 21:56:02 IST 2016,rt kau punya mala nk basuh baju sampai brtimbun baju kau kumpul kau tk tahu apa sebenarnya baju ni buat time kau takda
wadahjekot,Fri Feb 26 19:58:30 IST 2016,mini wrap je pn berzaman
