username,time,tweet
AnnaaEscoto,Sun Sep 01 05:29:58 IST 2013,youre the harmony to every song i sing
AnnaaEscoto,Sun Sep 01 05:22:18 IST 2013,i thought i had you figured out
AnnaaEscoto,Sun Sep 01 05:15:54 IST 2013,ojalá tuviera un novio para que me abrace y me quite el miedo de los rayos 
AnnaaEscoto,Sat Aug 31 23:15:50 IST 2013,“ volver con tu ex esa y mil maneras de morir”
AnnaaEscoto,Sat Aug 31 21:57:18 IST 2013,todos crudos hablando de lo sensacional que fue steve aoki o su peda y yoyo vi una película bien padre
AnnaaEscoto,Sat Aug 31 21:56:37 IST 2013,rt  don’t push away the people who truly care about you because one day you will push them away and they won’t come bac…
AnnaaEscoto,Sat Aug 31 20:38:50 IST 2013,i still remember 
AnnaaEscoto,Sat Aug 31 20:37:20 IST 2013,buenos días no despierten muy crudos o que les sea leve 
AnnaaEscoto,Sat Aug 31 20:02:03 IST 2013,rt  buenos días patriotnation
AnnaaEscoto,Sat Aug 31 11:04:44 IST 2013,rt  
AnnaaEscoto,Sat Aug 31 10:59:21 IST 2013,“  jajajajajaja 
AnnaaEscoto,Sat Aug 31 10:52:38 IST 2013,rt  dios es amor 
AnnaaEscoto,Sat Aug 31 10:48:36 IST 2013,rt  yo siempre regalo una sonrisa aun en los momentos difíciles 
AnnaaEscoto,Sat Aug 31 10:15:42 IST 2013,best friend  fridaynight mybestfriend loveher missyou nochedepeliculas guapas 
AnnaaEscoto,Fri Aug 30 19:15:58 IST 2013,oo lo que tu quieres es burlarte de mi  jajajaja  — jajaja no obvio no me quiero burlaral contrario  ser 
AnnaaEscoto,Fri Aug 30 18:54:43 IST 2013,sabes a veces creo que yo soy un minion por tiern — jajajajaja awwww que divino jaja jaja no creo que est 
AnnaaEscoto,Fri Aug 30 16:25:23 IST 2013,hahaha tu gorra de minion esta padre eres fanática d — jajajaja gracias me encantan los minions esque son 
AnnaaEscoto,Fri Aug 30 09:39:56 IST 2013,no te tengo en fb no me sigues en twitter — mmmmmmchalas ta padre eh vuélveme a seguir y te doy followback s 
AnnaaEscoto,Fri Aug 30 09:36:46 IST 2013,rt  ironía es que alguien que te miente para no perderte termine perdiéndote por haberte mentido
AnnaaEscoto,Fri Aug 30 09:35:21 IST 2013,hola la verdad esque me encantas — hola la verdad como no se quien eres no puedo decir lo mismo lo sient 
AnnaaEscoto,Fri Aug 30 09:34:59 IST 2013,no tengo tu número — inbox dm hay varias formas 
AnnaaEscoto,Fri Aug 30 09:25:06 IST 2013,eres el amor de mi vida — awwwwwwwwwww en serio jajaja no creo que tu seas el amor de la mía yo no amo 
AnnaaEscoto,Fri Aug 30 09:17:52 IST 2013,rt  no te enamoresno te enamno te enano te eno tenono mamno mames ¿ya viste sus ojos ¿ya viste su …
AnnaaEscoto,Fri Aug 30 09:17:27 IST 2013,“ felicidad es comer y no engordar”
AnnaaEscoto,Fri Aug 30 08:08:21 IST 2013,rt  geirangerfjord noruega 
AnnaaEscoto,Fri Aug 30 07:36:26 IST 2013,—tan bonita y sin —sí sin novio —iba a decir sin chichis y sin nalgas pero ya entiendo el por qué no tienes novio —ay aaay
AnnaaEscoto,Fri Aug 30 06:25:01 IST 2013,quien es vane y sofía — eres nuevo/a 
AnnaaEscoto,Fri Aug 30 05:58:24 IST 2013,quienes son tus amigas del moderno — mm vanne la extraño demasiado y a sofía aunque ya no estén zuri lind 
AnnaaEscoto,Fri Aug 30 05:15:07 IST 2013,hola /  un deseo que no hallas cumplido pásate por mi ask dejan — creo que estoy cumpliéndolos todos yeeeeih 
AnnaaEscoto,Fri Aug 30 05:14:37 IST 2013,quien te entiende pues no que ya no ibas a regresar — caray a tu que te importa te afecta en algo creo q 
AnnaaEscoto,Thu Aug 29 15:59:43 IST 2013,pues no que no te daba pena   ya dime porfa ósea q — jajaja no pues nada supongoumm guapos veamosjim 
AnnaaEscoto,Thu Aug 29 10:04:59 IST 2013,rt  voy a dormir como dios me trajo al mundo sin tu whatsapp de buenas noches 
AnnaaEscoto,Thu Aug 29 09:56:06 IST 2013,rt  si era hermosa dramática inteligente y la dejaste ir ¡felicidades triunfaste como el más pendejo de todos
AnnaaEscoto,Thu Aug 29 09:48:27 IST 2013,de tu generación del salón 5010 y 5020 ósea los dos s — entonces supongo que eres de mi generación para que  
AnnaaEscoto,Thu Aug 29 09:46:03 IST 2013,con quien haz fajado — mm pues yo me fajo a veces la blusa pero sólo a veces 
AnnaaEscoto,Thu Aug 29 09:41:11 IST 2013,quien se te hace guapo o atractivo del moderno di la verdadsi te da pena  — dime de que año no me da pena 
AnnaaEscoto,Thu Aug 29 08:53:34 IST 2013,rt  ¿quieres ser mi chava—frases célebres de la rosa de guadalupe rt si tengo la pinche razón
AnnaaEscoto,Thu Aug 29 08:41:45 IST 2013,porque me lo dijiste — pero quien eres duuh 
AnnaaEscoto,Thu Aug 29 07:30:53 IST 2013,¿como te gustaría que se vistiera un hombre para sali — mm depende de quien sea creo qe cada quien tiene su  
AnnaaEscoto,Wed Aug 28 16:26:21 IST 2013,take a chance on me 
AnnaaEscoto,Wed Aug 28 09:21:55 IST 2013,toda una mentada de madre 
AnnaaEscoto,Wed Aug 28 09:11:38 IST 2013,no dejare de poner cosas de chey hasta que en realida — jajajajajajaja esto es lo último que te contesto q 
AnnaaEscoto,Wed Aug 28 09:06:48 IST 2013,tu y chey porfavor dale una oportunidad no te lastimara — okey ya me harte de que me pongan cosas de chey ya  
AnnaaEscoto,Wed Aug 28 09:03:41 IST 2013,en donde dejaste a aldo — quieeeeen quien es aldo 
AnnaaEscoto,Wed Aug 28 09:03:17 IST 2013,que fue lo último que le dijiste a chey yo vi la conv — jajaja jaja que todavía quiero con el ahí doy a nota 
AnnaaEscoto,Wed Aug 28 08:46:51 IST 2013,con quien traes onda — mmmmm con absolutamente nadie 
