username,time,tweet
beeeethholmes,Thu Sep 01 05:29:56 IST 2011,gonna tire school tomorrow i beyond point care
beeeethholmes,Thu Sep 01 03:16:13 IST 2011,i nervous sleep i forgot much go new school suck
beeeethholmes,Wed Aug 31 21:40:27 IST 2011,rt twinkl twinkl littl slut open leg unclench butt
beeeethholmes,Wed Aug 31 06:25:37 IST 2011,have ipod inbetween boob yep thought need know
beeeethholmes,Wed Aug 31 05:15:56 IST 2011,ahah awh sorri scare
beeeethholmes,Wed Aug 31 05:15:33 IST 2011,aha char dearest wednesday
beeeethholmes,Wed Aug 31 05:15:09 IST 2011,erm
beeeethholmes,Wed Aug 31 05:06:46 IST 2011,wednesday tomorrow thursday
beeeethholmes,Wed Aug 31 05:03:40 IST 2011,fuckidi fuck fuck school tomorrow
beeeethholmes,Wed Aug 31 04:46:28 IST 2011,yeah gurll i skype work ipod atm i talk faceach xxx
beeeethholmes,Wed Aug 31 04:42:10 IST 2011,aha hola yeaah true i twitter facebook anyth age sorri love xxx
beeeethholmes,Wed Aug 31 04:40:14 IST 2011,hello hannah l u think i dead xxx
beeeethholmes,Wed Aug 31 04:33:02 IST 2011,say rofl roll floor laugh actual fire
beeeethholmes,Wed Aug 31 04:14:28 IST 2011,say lmao whilst ars quit clear fallen
beeeethholmes,Wed Aug 31 04:07:33 IST 2011,rt waystopissmeoff ask i want play got nose
beeeethholmes,Sun Aug 28 06:23:16 IST 2011,u want rli
beeeethholmes,Sun Aug 28 06:23:03 IST 2011,i lik ur toe u wnt
beeeethholmes,Sun Aug 28 06:19:13 IST 2011,hahaha yup love xx
beeeethholmes,Sun Aug 28 06:16:47 IST 2011,i lick jame toe
beeeethholmes,Sun Aug 28 06:07:08 IST 2011,janic u bitc i wil shit da ring u luv
beeeethholmes,Sun Aug 28 06:06:43 IST 2011,it fat bitch jane
beeeethholmes,Sun Aug 28 06:06:32 IST 2011,i lick nippl daili
beeeethholmes,Sun Aug 28 03:27:28 IST 2011,hairi armpit nippl
beeeethholmes,Sun Aug 28 03:26:54 IST 2011,mmmmmm tast like milk sweat
beeeethholmes,Sun Aug 28 03:22:36 IST 2011,i lick armpit boob lol
beeeethholmes,Thu Aug 25 05:38:37 IST 2011,when someon bbm bc ping me if ya awak wake i repli cunt littl bc i awak fuck
beeeethholmes,Thu Aug 25 03:34:30 IST 2011,the fresh princ bel air fuck yeeea
beeeethholmes,Wed Aug 24 15:13:29 IST 2011,oh shit i rememb scienc gcse class get result tomorrow i gonna fail but good luck everyon hope great
beeeethholmes,Wed Aug 24 05:46:27 IST 2011,rupert grint sexiest ginger aliv happi birthday rupert
beeeethholmes,Wed Aug 24 05:37:55 IST 2011,rt aw rupert grint birthday sexi happybirthdayrupert
beeeethholmes,Mon Aug 22 16:28:29 IST 2011,omg harri look beauti new vid
beeeethholmes,Mon Aug 22 03:52:10 IST 2011,paramor monster perfect hayley voic
beeeethholmes,Fri Aug 19 03:18:20 IST 2011,jedward big brother good
beeeethholmes,Fri Aug 19 00:59:56 IST 2011,forza make xbox vibrat much
beeeethholmes,Thu Aug 18 23:43:26 IST 2011,the new haribo advert bloodi cheesi unreal
beeeethholmes,Thu Aug 18 15:15:12 IST 2011,good luck everyon get result today i hope done well
beeeethholmes,Wed Aug 17 04:03:03 IST 2011,gurl i bbm
beeeethholmes,Wed Aug 17 03:27:07 IST 2011,that moment friend stop talk talk girlfriend phone
beeeethholmes,Wed Aug 17 01:18:31 IST 2011,maul aha xx
beeeethholmes,Mon Aug 15 06:07:57 IST 2011,why year put bbm pm l hurt i never know
beeeethholmes,Mon Aug 15 05:01:32 IST 2011,bore fuck one talk tonight fun wooo
beeeethholmes,Sat Aug 13 00:36:18 IST 2011,ahahaha fuck brilliant
beeeethholmes,Fri Aug 12 02:26:17 IST 2011,i funni never fuck know
beeeethholmes,Fri Aug 12 02:10:03 IST 2011,so hous kill zombi fine us shout tv i i seem weird
beeeethholmes,Fri Aug 12 01:10:47 IST 2011,haven laptop day wrong
beeeethholmes,Thu Aug 11 05:46:11 IST 2011,my time low poster fell land face i need use blue tack put poster
beeeethholmes,Wed Aug 10 03:59:04 IST 2011,i know i saw why its best thing ffs shall i talk msn xxxxxx
beeeethholmes,Wed Aug 10 03:54:54 IST 2011,idea bbi g xxxxxxx
beeeethholmes,Wed Aug 10 03:51:26 IST 2011,kind scari see fuck societi day i shall read xxxxxx
beeeethholmes,Wed Aug 10 03:46:31 IST 2011,i unhappi unless start shit near game break window nick stuff i like free game xxxxxx
