username,time,tweet
kaitlynmatzuka,Tue Mar 01 05:29:28 IST 2016,bæ hand bowl made ceram say made lowkeyobsess
kaitlynmatzuka,Tue Mar 01 05:25:00 IST 2016,rt my heart would melt i found someon talk like
kaitlynmatzuka,Mon Feb 29 09:56:21 IST 2016,rt boy opposit sour patch kid first sweet sour
kaitlynmatzuka,Mon Feb 29 09:54:39 IST 2016,hello gorgeous
kaitlynmatzuka,Mon Feb 29 09:54:24 IST 2016,rt if leo win oscar tonight
kaitlynmatzuka,Mon Feb 29 01:47:13 IST 2016,yea
kaitlynmatzuka,Sun Feb 28 10:04:05 IST 2016,listen parent sing wed song togeth kinda realli cute
kaitlynmatzuka,Sun Feb 28 08:48:48 IST 2016,rt netflix avoid peopl
kaitlynmatzuka,Sat Feb 27 10:03:38 IST 2016,rt everi morn
kaitlynmatzuka,Sat Feb 27 10:01:06 IST 2016,whoever made need award
kaitlynmatzuka,Sat Feb 27 09:59:44 IST 2016,rt mood
kaitlynmatzuka,Sat Feb 27 09:55:33 IST 2016,rt son cheat girl ima smack shit outta send chick sephora giftcard
kaitlynmatzuka,Sat Feb 27 09:54:06 IST 2016,rt i high key obsess boyfriend
kaitlynmatzuka,Sat Feb 27 09:48:23 IST 2016,rt i actual get stress i see pretti peopl look make i look like potato even
kaitlynmatzuka,Sat Feb 27 09:47:26 IST 2016,saaaam
kaitlynmatzuka,Wed Feb 24 08:25:35 IST 2016,rt date boy proud say girlfriend show everyon boy
kaitlynmatzuka,Wed Feb 24 08:25:29 IST 2016,rt the hardest thing ever control laughter serious time
kaitlynmatzuka,Wed Feb 24 08:22:47 IST 2016,rt me
kaitlynmatzuka,Wed Feb 24 08:21:41 IST 2016,rt if date phone password read text answer phone get twitter read dm i
kaitlynmatzuka,Wed Feb 24 08:19:14 IST 2016,rt can wait fish bonfir warm weather sittin lake drive window i readi summer
kaitlynmatzuka,Tue Feb 23 06:13:49 IST 2016,i obsess coffe mug candl i need help
kaitlynmatzuka,Tue Feb 23 04:34:32 IST 2016,hate monday monday give perfect opportun start week right start hate
kaitlynmatzuka,Mon Feb 22 07:40:07 IST 2016,rt
kaitlynmatzuka,Mon Feb 22 07:37:21 IST 2016,rt a carniv date would perfect
kaitlynmatzuka,Mon Feb 22 07:36:30 IST 2016,rt eye bag game fleek caus tire af
kaitlynmatzuka,Mon Feb 22 07:34:28 IST 2016,rt when girl say lol fun fun abort mission i repeat abort mission
kaitlynmatzuka,Mon Feb 22 07:26:57 IST 2016,rt style
kaitlynmatzuka,Sun Feb 21 21:55:05 IST 2016,rt blow mind girl expect vs michael kor would happiest girl world u pick flower
kaitlynmatzuka,Sun Feb 21 11:17:47 IST 2016,rt yess
kaitlynmatzuka,Sun Feb 21 11:13:10 IST 2016,rt i love guy call girl like girl i freak good i freak way good call
kaitlynmatzuka,Sun Feb 21 02:24:03 IST 2016,rt pretti much sum friend
kaitlynmatzuka,Sun Feb 21 02:22:36 IST 2016,rt i respect tell truth matter hard
kaitlynmatzuka,Sat Feb 20 12:16:53 IST 2016,rt it littl thing make crazili attract
kaitlynmatzuka,Sat Feb 20 12:15:56 IST 2016,rt there noth better take hot ass shower brush teeth cleans skin lay
kaitlynmatzuka,Sat Feb 20 12:14:37 IST 2016,
kaitlynmatzuka,Sat Feb 20 06:25:13 IST 2016,rt what media show
kaitlynmatzuka,Sat Feb 20 04:45:03 IST 2016,rt lose trust never get shit
kaitlynmatzuka,Sat Feb 20 04:35:33 IST 2016,extent
kaitlynmatzuka,Fri Feb 19 21:04:10 IST 2016,rt home passport
kaitlynmatzuka,Fri Feb 19 20:58:41 IST 2016,rt peopl bitch much
kaitlynmatzuka,Fri Feb 19 20:58:37 IST 2016,rt any girl becom friend liter hmu dms like girl u believ mf what he do babe what
kaitlynmatzuka,Fri Feb 19 20:16:51 IST 2016,i good mood good mood rare let hope one piss today
kaitlynmatzuka,Fri Feb 19 07:09:12 IST 2016,rt botfcifsd finalist rt vote blue crew
kaitlynmatzuka,Thu Feb 18 10:25:03 IST 2016,rt obsess back scratch
kaitlynmatzuka,Thu Feb 18 09:44:33 IST 2016,rt cant wait wear underwear around hous person love
kaitlynmatzuka,Thu Feb 18 09:40:20 IST 2016,rt a weekend like would nice
kaitlynmatzuka,Thu Feb 18 05:26:19 IST 2016,rt i honest obsess maison des fleur arrang
kaitlynmatzuka,Wed Feb 17 09:26:04 IST 2016,sad peopl take note
kaitlynmatzuka,Wed Feb 17 05:14:38 IST 2016,text
kaitlynmatzuka,Tue Feb 16 21:52:11 IST 2016,rt i call true love
