username,time,tweet
cloneprotocol66,Tue Mar 01 05:29:44 IST 2016,im excited for the nbcuinnovation hackathon this weekend looking forward to finally getting a chance to see the htc vive in action
cloneprotocol66,Mon Feb 22 10:31:14 IST 2016,i just beat the gobot on codefights 
cloneprotocol66,Fri Feb 12 03:48:03 IST 2016, the  developers meetup got me thinking about industrialinternet  any plans to host another iot dev bootcamp soon
cloneprotocol66,Mon Feb 08 06:22:05 IST 2016, but paypal lets merchants accept bitcoin with braintree theyre including bitcoin when they talk about new money right
cloneprotocol66,Thu Feb 04 13:03:57 IST 2016, getting hyped so i made this css animation dedicated to pokemon20 - 
cloneprotocol66,Wed Feb 03 08:45:20 IST 2016, enter me for an  ticket 💻📱👍
cloneprotocol66,Fri Jan 29 08:37:43 IST 2016,funfetti macaroons netflixgirlgeekdinner  
cloneprotocol66,Fri Jan 29 03:06:18 IST 2016,just donated to help faye attend lesbians who tech 2016  …   lwtsummit 
cloneprotocol66,Fri Jan 29 00:55:05 IST 2016,just submitted a pen ngo  is the site still active 
cloneprotocol66,Mon Sep 29 04:35:32 IST 2014,excited for the premier tonight swanqueenisamodernfairytale mentionyourotp
cloneprotocol66,Sun Sep 21 12:14:45 IST 2014,my first 1st place and on my least favorite map  destiny ps4share 
cloneprotocol66,Fri Jun 13 23:33:12 IST 2014, dont know if you go on reddit but weve been talking about you guys  
cloneprotocol66,Thu Jun 12 23:31:14 IST 2014,rt  our dragon age trailer stand together presented from the perspective of a female protagonist because it matters https/…
cloneprotocol66,Sun Mar 23 09:34:53 IST 2014,rt  2 da pastor who wrote me-being gay isnt a beliefmy soul isnt struggling i dont want arms of heavenly father around mea …
cloneprotocol66,Wed Mar 19 00:51:01 IST 2014,best place for some craft beer and a sandwich  via 
cloneprotocol66,Wed Mar 05 11:28:58 IST 2014,i only let it age 2 years but it was still good 
cloneprotocol66,Tue Mar 04 11:21:10 IST 2014,im really digging smoked porters right now 
cloneprotocol66,Mon Mar 03 08:56:31 IST 2014,rt  if only bradleys arm was longer best photo ever oscars 
cloneprotocol66,Thu Dec 19 00:16:49 IST 2013,rt  get your daily dogecoins retweet this and post in  so i can give away dogecoin via dogetipbot -…
cloneprotocol66,Sat Dec 07 11:12:52 IST 2013, you guys really need to get a shark who has a background in technology this is ridiculous
cloneprotocol66,Sat Dec 07 11:10:40 IST 2013, you do realize the the new tech in 8 years will be their upgraded version 
cloneprotocol66,Sat Dec 07 11:06:30 IST 2013,yep the wii fit didnt make tons of money cause gamers wont work out /s  
cloneprotocol66,Sat Dec 07 11:03:55 IST 2013,if youre going to stereotype gamers then include the fact that they spend tons on crazy set ups  
cloneprotocol66,Sat Dec 07 11:01:56 IST 2013,wow the  sharks are embarrassingly out-of-the-know in technology and gaming
cloneprotocol66,Mon Oct 14 10:28:24 IST 2013,  thank you so much for that mulan part sad for her but it makes me so happy that you guys are able to go there  thank u
cloneprotocol66,Sat Oct 05 11:43:06 IST 2013,sfworlds is for   not bots go t1 
cloneprotocol66,Sat Oct 05 10:33:08 IST 2013,anyone want to play after this ignrobeau sfworlds esports  
cloneprotocol66,Sat Oct 05 10:30:56 IST 2013,i really dont see royal winning it after that rally and these picks sfworlds   
cloneprotocol66,Sat Oct 05 09:24:45 IST 2013,kinda hot in these rhinos warm sfworlds  
cloneprotocol66,Sat Oct 05 08:04:54 IST 2013,sfworlds favorite thing about these events theres alcohol and no wait for the ladys room     esports
cloneprotocol66,Sat Oct 05 06:51:15 IST 2013,variety of beverages at sfworlds event in folsom st foundry thanks   esports for sponsoring 
cloneprotocol66,Sat Oct 05 06:42:08 IST 2013,an hour to go and this place is already pretty lively astrogaming sfworlds
cloneprotocol66,Sat Oct 05 06:38:57 IST 2013,aram spot at sfworlds its filling up esports   
cloneprotocol66,Sat Sep 28 03:37:24 IST 2013, s3wc i sorted it and you are 100 out of 2252 overall
cloneprotocol66,Sat Sep 28 03:34:22 IST 2013,s3wc  633 in overall points not too bad
cloneprotocol66,Wed Sep 11 01:25:38 IST 2013,rt joyce ohmygold im so happy  well done evilregals lana did it finally reached 150k  bet shell be so humbled asklana n…
cloneprotocol66,Sun Aug 04 09:25:46 IST 2013,just left  a bit disappointing that the indie dev panelist didnt show but    and  were awesome
cloneprotocol66,Tue Jul 02 00:17:17 IST 2013,rt  just want 2 sincerely thank all of you for your overwhelming support of theheat this weekend funny ladies can open movies …
cloneprotocol66,Tue Jun 18 07:05:48 IST 2013,just shared a photo throughglass 
cloneprotocol66,Sat Jun 08 02:10:56 IST 2013,  even google cant escape you
cloneprotocol66,Mon Apr 01 22:14:06 IST 2013,reddit is back up
cloneprotocol66,Mon Apr 01 21:54:16 IST 2013,guys reddit isnt actually down switch to incognito mode its an april fools prank
cloneprotocol66,Mon Mar 11 04:17:54 IST 2013,rt itevil swanqueen because i said so
cloneprotocol66,Mon Mar 11 04:17:13 IST 2013,hoping to see some swanqueen on tonights episode
cloneprotocol66,Tue Mar 05 12:38:26 IST 2013,the  devs just arrived at the gamestop in sunnyvale
cloneprotocol66,Mon Jan 28 08:40:08 IST 2013,i got a 77/10 in color a color matching game 
cloneprotocol66,Sat Nov 17 10:15:55 IST 2012, foound this when hacking a portal 
cloneprotocol66,Wed Oct 24 00:38:11 IST 2012, and another one romobomb surprises some ladies at the pool 
cloneprotocol66,Tue Oct 23 23:43:29 IST 2012, does it gangnam style romobomb 
cloneprotocol66,Tue Oct 23 01:26:54 IST 2012,view reddit while its down 
