username,time,tweet
SidMich_,Tue Mar 01 05:29:46 IST 2016,just left meet yes julz team excit shoot featur miami trip
SidMich_,Tue Mar 01 03:02:21 IST 2016,rt his daughter testifi drag mother flight stair neck but get fire
SidMich_,Tue Mar 01 03:01:37 IST 2016,rt nj communiti mourn loss year old sneaker store owner follow fatal shoot
SidMich_,Tue Mar 01 02:58:43 IST 2016,rt work sittin pretti second week row big up god fan
SidMich_,Tue Mar 01 02:22:36 IST 2016,rt one time wang balenciaga
SidMich_,Tue Mar 01 02:16:59 IST 2016,rt retweet hu
SidMich_,Tue Mar 01 02:15:18 IST 2016,rt watch morgan freeman lmfaoooo
SidMich_,Tue Mar 01 01:44:53 IST 2016,rt girl brother treat gf better treat lol at least know valu women
SidMich_,Tue Mar 01 01:35:26 IST 2016,when littl brother relationship take crap
SidMich_,Tue Mar 01 01:33:10 IST 2016,it babi bros gfs anniversari got feel post
SidMich_,Mon Feb 29 22:58:21 IST 2016,thank ladi
SidMich_,Mon Feb 29 22:55:21 IST 2016,anyon know good site realli cool sunglass
SidMich_,Mon Feb 29 21:10:07 IST 2016,s o shooter get video need
SidMich_,Mon Feb 29 21:07:37 IST 2016,appli e news today chanc report freelanc pray girl
SidMich_,Mon Feb 29 19:10:50 IST 2016,my bri bring bundl joy world today i emot proud babyharp
SidMich_,Mon Feb 29 11:20:02 IST 2016,rt i love fight power song close telecast oscar
SidMich_,Mon Feb 29 11:17:38 IST 2016,rt ladi gaga bring oscar audienc tear empower anthem
SidMich_,Mon Feb 29 11:16:15 IST 2016,rt and chris rock final word oscar
SidMich_,Mon Feb 29 11:15:14 IST 2016,rt oscar red carpet see best dress tuxedo academi award
SidMich_,Mon Feb 29 04:11:09 IST 2016,rt dear the kkk nasti danger vicious hate group even year old son know stop
SidMich_,Sat Feb 27 22:35:27 IST 2016,gain weight right place tone mean need stay hous west indian food cook great
SidMich_,Sat Feb 27 22:32:30 IST 2016,tri stay low carb regimen daili train realli seem dumb best friend forc roti curri chicken
SidMich_,Sat Feb 27 20:24:14 IST 2016,rt yes
SidMich_,Sat Feb 27 03:24:04 IST 2016,rt some proclaim februari best blackhistorymonth ever here
SidMich_,Sat Feb 27 03:09:49 IST 2016,when plug one old cowork plug back scratch back i scratch
SidMich_,Sat Feb 27 03:06:50 IST 2016,just gave away rest chic fila lunch i crave homeless guy outsid job man i want chicken
SidMich_,Sat Feb 27 03:05:42 IST 2016,a great segment awesom job
SidMich_,Sat Feb 27 00:55:26 IST 2016,i need gym buddi afternoon even some one could push limit even better
SidMich_,Sat Feb 27 00:51:36 IST 2016,rt i coolest girl friend ever if u guy consid urself lucki homi
SidMich_,Sat Feb 27 00:31:28 IST 2016,rt the memor oscar accept speech black actress actor
SidMich_,Sat Feb 27 00:02:29 IST 2016,rt we right christi along
SidMich_,Fri Feb 26 23:55:26 IST 2016,fact
SidMich_,Fri Feb 26 23:54:32 IST 2016,rt phaedrapark on realiti tv oscarssowhit and the realiti of racial inequ in entertain via https
SidMich_,Fri Feb 26 23:53:30 IST 2016,when flyest best friend pumatrain rihanna
SidMich_,Fri Feb 26 23:33:39 IST 2016,rt sheer joy
SidMich_,Fri Feb 26 23:30:08 IST 2016,mark zuckerberg call out malici facebook employe for cross out black live matter slogan via
SidMich_,Fri Feb 26 22:03:14 IST 2016,celebr gossip guru b scott on the busi of pop cultur blog via
SidMich_,Fri Feb 26 22:01:53 IST 2016,an awesom read the academi award long histori of racial inequ visual infograph via
SidMich_,Fri Feb 26 21:59:30 IST 2016,kany west less influenti than taylor swift say nielsen studi via
SidMich_,Fri Feb 26 21:21:13 IST 2016,rt still disappoint none candid work damn daniel refer last night
SidMich_,Fri Feb 26 21:15:03 IST 2016,first creeper new trainer rihanna take money better
SidMich_,Fri Feb 26 21:10:45 IST 2016,rt that reign let thetrain fenti
SidMich_,Fri Feb 26 21:10:29 IST 2016,rt black live mean live mark zuckerberg said
SidMich_,Fri Feb 26 19:16:39 IST 2016,rt it final friday
SidMich_,Fri Feb 26 03:16:35 IST 2016,rt no excus no boundari the trainer drop am local time fentyxpuma
SidMich_,Fri Feb 26 02:18:19 IST 2016,oh life journalist
SidMich_,Thu Feb 25 23:55:54 IST 2016,rt doing piec yes julz forb i miami nevernotwork
SidMich_,Thu Feb 25 23:23:10 IST 2016,anyon like last night get readi recap post drop today forb blackish
SidMich_,Thu Feb 25 22:19:37 IST 2016,check new post forb tumblr oscar insid multimillion dollar home oscar nomine
