username,time,tweet
RyanWBoland,Thu Sep 01 05:29:45 IST 2011,the world discriminates against those of us without smartphones
RyanWBoland,Thu Sep 01 05:27:10 IST 2011,hurricane irene hit my followers pretty hard stagnant
RyanWBoland,Thu Sep 01 05:24:19 IST 2011, the pretty boys dont want to brawl believe me redsoxnation
RyanWBoland,Thu Sep 01 05:19:44 IST 2011, even if he doesnt hit the ball well he sees alot of pitches  if cc doesnt throw 130 its a different ballgame
RyanWBoland,Thu Sep 01 05:18:32 IST 2011,the new 2011 cliche you are what you tweet
RyanWBoland,Thu Sep 01 05:16:53 IST 2011, you cant be having much fun if youre tweeting through dinner bro
RyanWBoland,Thu Sep 01 05:16:32 IST 2011,at some point im going to have to renew my xbox live subscription and buy a more recent sports game then like 08
RyanWBoland,Thu Sep 01 05:14:56 IST 2011, pccsd postcapecodstressdisorder
RyanWBoland,Thu Sep 01 05:13:22 IST 2011, while you are in the business of answering questions who is the starter
RyanWBoland,Thu Sep 01 05:12:32 IST 2011, how ironic im sick of home 1moreday
RyanWBoland,Thu Sep 01 05:07:46 IST 2011, um what
RyanWBoland,Thu Sep 01 05:06:00 IST 2011, can you put that in terms of a channel number or are you saying it wont be aired
RyanWBoland,Thu Sep 01 05:04:27 IST 2011, feels sorry for the asswhooping hes going to hand him in a few innings
RyanWBoland,Thu Sep 01 05:02:14 IST 2011,rt  more fireworks ahead after punching out teixeira beckett turned and w/his glove gestured angrily at gardner stealing  
RyanWBoland,Thu Sep 01 04:56:11 IST 2011,the yellow schoolbus flag is up at my housewtfdad
RyanWBoland,Thu Sep 01 03:13:18 IST 2011,dasilva painetraininsane
RyanWBoland,Wed Aug 31 20:07:57 IST 2011,dasilva you need to give me a ride duder
RyanWBoland,Wed Aug 31 11:14:28 IST 2011,does liking somebody elses happy birthday post on facebook count as wishing that person a happy birthday
RyanWBoland,Wed Aug 31 11:13:30 IST 2011, at home bases loaded with less then two outs and no runs is a crime whatthehellhappenedtoadriangonzalez mcdonaldswingsball4
RyanWBoland,Wed Aug 31 11:11:44 IST 2011,purposely fucking my sleep schedule for college
RyanWBoland,Wed Aug 31 11:01:19 IST 2011,takethemoneyandrun if you get caught in the first 8 hours of the game then you suck
RyanWBoland,Wed Aug 31 11:00:21 IST 2011, you didnt here fairfield pushed the move in day back to the 13th of september
RyanWBoland,Wed Aug 31 10:59:52 IST 2011,no bells or whistles just straight up with the tweets these days
RyanWBoland,Wed Aug 31 10:59:17 IST 2011, follow me
RyanWBoland,Wed Aug 31 10:51:04 IST 2011,i think im in trouble with the mob or a major insurance company
RyanWBoland,Wed Aug 31 10:25:01 IST 2011,tearing up to pam and jims weddingtheofficereruns
RyanWBoland,Wed Aug 31 10:22:01 IST 2011,got hugged and kissed by a little old woman that knows me and told me to say hi to my parentsum mom some woman that wants me says hi
RyanWBoland,Wed Aug 31 10:19:36 IST 2011,both sides of his pillow are cold
RyanWBoland,Wed Aug 31 10:10:51 IST 2011,cervelli pussy
RyanWBoland,Wed Aug 31 10:07:57 IST 2011,francisco cervelli has an awkwardly large head
RyanWBoland,Wed Aug 31 10:03:15 IST 2011,loled at the pic of   playing tennis uconn thabeet swag
RyanWBoland,Wed Aug 31 09:52:21 IST 2011,cant be leaving the bases loaded disappointed
RyanWBoland,Wed Aug 31 09:37:22 IST 2011, what are you doing this fall/year
RyanWBoland,Wed Aug 31 09:34:11 IST 2011, you are sassy
RyanWBoland,Wed Aug 31 09:29:17 IST 2011, a website
RyanWBoland,Wed Aug 31 09:27:06 IST 2011,girl you want a snack come get some poppycock
RyanWBoland,Wed Aug 31 09:26:48 IST 2011,overpacked is an understatement collegepacking
RyanWBoland,Wed Aug 31 09:26:33 IST 2011, just go on omegle
RyanWBoland,Wed Aug 31 00:21:07 IST 2011,might be late to work because my foot is asleep
RyanWBoland,Wed Aug 31 00:18:02 IST 2011,2 more days and ill be up up and away
RyanWBoland,Wed Aug 31 00:10:36 IST 2011,gotta go make that money so i can just blow it in about a month
RyanWBoland,Sun Aug 28 23:22:50 IST 2011, ac blastingphone charging keurig brewing lights shining pump pumping microwave popcorn popping here on 43 burr street
RyanWBoland,Sun Aug 28 23:14:55 IST 2011,bob lee swagger
RyanWBoland,Sun Aug 28 22:56:14 IST 2011,i love it when they interview illiterate people on the news
RyanWBoland,Sun Aug 28 22:55:38 IST 2011,tired of watching this shit on the news
RyanWBoland,Sun Aug 28 22:51:53 IST 2011, ive been saving lives left and right
RyanWBoland,Sun Aug 28 20:44:59 IST 2011, valiant effort id like to see a little more effort doe
RyanWBoland,Sun Aug 28 20:37:25 IST 2011,they fucked with the university of miami and now we have a real life hurricane karma miami ncaa irene
RyanWBoland,Sun Aug 28 20:33:51 IST 2011,so what is chuck norris role in hurricane irene
