username,time,tweet
MommaRissa_,Tue Mar 01 05:29:45 IST 2016,i knew soon paisley turn year old nobodi go want friend bc cute littl babi anymor hahaha
MommaRissa_,Tue Mar 01 04:53:17 IST 2016,rt i love lay bed i watch stupid show laugh even care
MommaRissa_,Tue Mar 01 00:51:25 IST 2016,rt aye i wait summer get i go float
MommaRissa_,Mon Feb 29 20:17:53 IST 2016,rt heart warm much peopl say remind the feel know peopl think sometim
MommaRissa_,Mon Feb 29 20:17:34 IST 2016,i stop watch
MommaRissa_,Mon Feb 29 19:56:35 IST 2016,paisley sleep room sound like someon alway walk around
MommaRissa_,Mon Feb 29 19:51:32 IST 2016,i got one paisley creepi
MommaRissa_,Mon Feb 29 09:57:34 IST 2016,rt hate get work thing complet destroy mood
MommaRissa_,Mon Feb 29 09:57:06 IST 2016,fake fake fake
MommaRissa_,Mon Feb 29 09:56:28 IST 2016,rt date someon let u trade snow cone u like better
MommaRissa_,Mon Feb 29 09:52:08 IST 2016,rt y rememb
MommaRissa_,Mon Feb 29 09:46:45 IST 2016,sometim i wish life would end instead wait suck
MommaRissa_,Mon Feb 29 09:42:23 IST 2016,rt cute
MommaRissa_,Mon Feb 29 09:30:33 IST 2016,rt oh
MommaRissa_,Mon Feb 29 09:26:18 IST 2016,fav thing
MommaRissa_,Mon Feb 29 06:28:22 IST 2016,babi babi go babi
MommaRissa_,Mon Feb 29 06:25:08 IST 2016,rt i made mini
MommaRissa_,Mon Feb 29 06:22:40 IST 2016,rt you know she mad when she mhmm everyth bae i sorri mhmm u know i love you mhmmm how was your day mhmmm
MommaRissa_,Mon Feb 29 06:21:15 IST 2016,rt mom stay post cute thing facebook page
MommaRissa_,Mon Feb 29 06:20:28 IST 2016,rt where loyal guy
MommaRissa_,Mon Feb 29 03:29:33 IST 2016,proud ria perfect
MommaRissa_,Sun Feb 28 20:44:42 IST 2016,someon let get waffl hous
MommaRissa_,Sun Feb 28 20:38:54 IST 2016,paisley awak sinc
MommaRissa_,Sun Feb 28 20:38:34 IST 2016,rt fact
MommaRissa_,Sun Feb 28 20:37:48 IST 2016,rt honest dissappear coupl peopl would notic
MommaRissa_,Sun Feb 28 20:36:09 IST 2016,rt song og parti starter
MommaRissa_,Sun Feb 28 20:35:57 IST 2016,rt probabl icon song childhood love kesha
MommaRissa_,Sun Feb 28 20:35:25 IST 2016,rt holi shit heard song year big part life omg
MommaRissa_,Sun Feb 28 20:35:16 IST 2016,rt yes yes
MommaRissa_,Sun Feb 28 20:35:13 IST 2016,shit
MommaRissa_,Sun Feb 28 20:34:54 IST 2016,rt so mani flashback from just listen to a snippet of this song
MommaRissa_,Sun Feb 28 20:34:44 IST 2016,rt offici grow
MommaRissa_,Sun Feb 28 17:18:30 IST 2016,rt why i awak
MommaRissa_,Sun Feb 28 08:16:05 IST 2016,
MommaRissa_,Sun Feb 28 08:14:42 IST 2016,rt i want lose like pound spring break help
MommaRissa_,Sun Feb 28 08:11:41 IST 2016,rt aye beat go
MommaRissa_,Sun Feb 28 08:11:33 IST 2016,rt behind scene
MommaRissa_,Sun Feb 28 08:08:44 IST 2016,paisley sleep room tonight first time scare nervous happi time
MommaRissa_,Sun Feb 28 08:08:43 IST 2016,rt they alway bomb busi look hoe realiz
MommaRissa_,Sun Feb 28 08:08:03 IST 2016,rt lurk lurk lurk lurk all bitch lurk lurk lurk lurk lurk trynna find dirt dirt dirt dirt get ya feel hurt
MommaRissa_,Sun Feb 28 08:06:38 IST 2016,rt yeast infect lit
MommaRissa_,Sun Feb 28 08:04:18 IST 2016,rt he back
MommaRissa_,Sun Feb 28 08:03:46 IST 2016,rt
MommaRissa_,Sun Feb 28 08:02:28 IST 2016,rt this smooth af lol
MommaRissa_,Sun Feb 28 08:01:39 IST 2016,rt i wish best friend busi
MommaRissa_,Sun Feb 28 08:01:27 IST 2016,rt liter exhaust i wanna cri
MommaRissa_,Sun Feb 28 08:00:44 IST 2016,rt i think gave much medicin
MommaRissa_,Sun Feb 28 08:00:04 IST 2016,rt drake real mvp man
