username,time,tweet
TQueenx3,Tue Mar 01 05:29:32 IST 2016,if got snap chat random eat chip mean i love
TQueenx3,Mon Feb 29 23:19:19 IST 2016,i know cheat lie real question nigga die though
TQueenx3,Mon Feb 29 21:20:49 IST 2016,rt bother complic life one
TQueenx3,Mon Feb 29 21:08:23 IST 2016,i see
TQueenx3,Mon Feb 29 19:22:14 IST 2016,rt
TQueenx3,Mon Feb 29 19:22:03 IST 2016,caus nice
TQueenx3,Mon Feb 29 19:21:29 IST 2016,curs
TQueenx3,Mon Feb 29 19:10:08 IST 2016,i stay home sleep eat cri
TQueenx3,Mon Feb 29 18:52:30 IST 2016,rt gotta stop absent
TQueenx3,Mon Feb 29 13:08:54 IST 2016,i said time time time i complet done i rather alon hurt
TQueenx3,Mon Feb 29 06:48:07 IST 2016,idgaf loos friend tbh i even fuck half famili
TQueenx3,Mon Feb 29 06:24:42 IST 2016,rt where snow bunni
TQueenx3,Mon Feb 29 04:36:37 IST 2016,stupid prom stupid dress stupid shop fuck stupid
TQueenx3,Mon Feb 29 01:15:25 IST 2016,rt say idk lot trust know
TQueenx3,Mon Feb 29 00:11:03 IST 2016,ungrat
TQueenx3,Sun Feb 28 23:37:00 IST 2016,rt from babyyi real quick
TQueenx3,Sun Feb 28 22:13:17 IST 2016,caus im piec shit hard fuck tell
TQueenx3,Sun Feb 28 20:36:49 IST 2016,dm number sweet
TQueenx3,Sun Feb 28 20:35:22 IST 2016,lol i miss enjoy birthday
TQueenx3,Sun Feb 28 20:33:46 IST 2016,happi birthday munchkin
TQueenx3,Sat Feb 27 20:33:52 IST 2016,now i get anoth phone fuckeri
TQueenx3,Sat Feb 27 11:25:04 IST 2016,rt woke one day meant noth
TQueenx3,Fri Feb 26 07:23:42 IST 2016,rt love clingi shit
TQueenx3,Fri Feb 26 07:10:31 IST 2016,i got problem i gonna take nap ignor
TQueenx3,Fri Feb 26 06:43:55 IST 2016,rt all i keep shit don nobodi know i realli feel
TQueenx3,Fri Feb 26 05:19:37 IST 2016,rt aquarius rememb almost everyth although often wish forget
TQueenx3,Fri Feb 26 03:28:42 IST 2016,rt ever feel insecur
TQueenx3,Thu Feb 25 17:25:22 IST 2016,rt everi girl one person never lose feel
TQueenx3,Thu Feb 25 08:43:03 IST 2016,rt girl
TQueenx3,Thu Feb 25 08:35:54 IST 2016,rt if kiss neck i respons happen next
TQueenx3,Thu Feb 25 08:21:28 IST 2016,rt can forc chemistri either
TQueenx3,Thu Feb 25 08:20:42 IST 2016,rt i love
TQueenx3,Thu Feb 25 08:17:19 IST 2016,rt keep lurk bitch i great
TQueenx3,Thu Feb 25 08:17:02 IST 2016,rt go shit grow shit
TQueenx3,Thu Feb 25 06:35:23 IST 2016,rt today good day till i saw
TQueenx3,Thu Feb 25 06:18:52 IST 2016,rt me tri get life togeth
TQueenx3,Thu Feb 25 05:40:32 IST 2016,rt i need bag joint life
TQueenx3,Thu Feb 25 05:21:23 IST 2016,rt my reaction almost everyth
TQueenx3,Thu Feb 25 04:49:57 IST 2016,rt tire like wtf
TQueenx3,Thu Feb 25 02:33:06 IST 2016,rt school soup i fork
TQueenx3,Thu Feb 25 00:29:23 IST 2016,i appreci
TQueenx3,Thu Feb 25 00:29:08 IST 2016,rt alway taken grant
TQueenx3,Wed Feb 24 16:47:04 IST 2016,awe i love
TQueenx3,Wed Feb 24 09:39:20 IST 2016,rt never apolog say feel
TQueenx3,Wed Feb 24 09:27:38 IST 2016,rt i notic everyth i keep mouth shut
TQueenx3,Wed Feb 24 07:03:05 IST 2016,rt they friend till ur better
TQueenx3,Wed Feb 24 06:43:08 IST 2016,
TQueenx3,Wed Feb 24 06:04:25 IST 2016,tri peopl gonna listen i piec shit duh
TQueenx3,Wed Feb 24 06:03:24 IST 2016,rt tell nicol to come back
