username,time,tweet
AndaJustus,Sat Mar 26 14:09:30 IST 2016,take moment look back far come quot
AndaJustus,Sat Mar 26 14:05:16 IST 2016,alway go mountain sometim mountain come
AndaJustus,Sat Mar 26 14:01:42 IST 2016,rt don chase peopl work hard under two principl right peopl find way
AndaJustus,Fri Mar 25 18:18:39 IST 2016,rt one day retrospect year struggl strike beauti sigmund freud quot
AndaJustus,Fri Mar 25 13:25:03 IST 2016,rt you may hurt love much live miseri love littl napoleon hill quot
AndaJustus,Thu Mar 24 18:00:22 IST 2016,suffer live rest life like champion quot m ali
AndaJustus,Thu Mar 24 17:22:01 IST 2016,happi easter holiday
AndaJustus,Thu Mar 24 17:19:15 IST 2016,let go someth love may pain might well set free
AndaJustus,Thu Mar 24 17:17:00 IST 2016,today futur worri live
AndaJustus,Thu Mar 24 17:09:44 IST 2016,rt you truli time jay samit disrupt you quot
AndaJustus,Thu Mar 24 17:07:59 IST 2016,choos path want follow life otherwis life choos andajustus
AndaJustus,Thu Mar 24 17:03:58 IST 2016,great spirit alway encount violent opposit
AndaJustus,Sat Mar 19 00:27:43 IST 2016,i choos lazi person hard job billgat
AndaJustus,Mon Mar 14 01:48:16 IST 2016,new footag reveal attempt attack trump was much wors than origin via
AndaJustus,Tue Mar 08 02:31:06 IST 2016,your mind multimillion dollar properti screen tenant very care quot via
AndaJustus,Tue Mar 08 02:29:24 IST 2016,step back look differ way breath then give quot
AndaJustus,Tue Mar 08 01:05:56 IST 2016,to make differ someon life brilliant rich beauti perfect unknown
AndaJustus,Tue Mar 08 01:05:47 IST 2016,progress imposs without chang georg bernard shaw
AndaJustus,Sun Mar 06 20:07:41 IST 2016,feed mind come action
AndaJustus,Sun Mar 06 19:58:44 IST 2016,rt great thing done seri small thing brought togeth vincent van gogh quot via
AndaJustus,Sat Mar 05 20:25:08 IST 2016,unusu habit except product peopl
AndaJustus,Sat Mar 05 20:02:09 IST 2016,rt find someon chang life status
AndaJustus,Fri Mar 04 20:21:31 IST 2016,rt focus shore if strategi work find altern mean get want
AndaJustus,Fri Mar 04 19:05:39 IST 2016,rt just seed contain need sprout alreadi equip thrive quot via
AndaJustus,Fri Mar 04 19:04:06 IST 2016,action beyond queri test begin
AndaJustus,Fri Mar 04 14:12:23 IST 2016,how slim line genius insan determin stubborn richard branson quot
AndaJustus,Fri Mar 04 14:10:58 IST 2016,self esteem begin end the know less move opinion other b dilley
AndaJustus,Fri Mar 04 14:07:43 IST 2016,have wisdom choos matter long time great andajustus
AndaJustus,Fri Mar 04 14:04:15 IST 2016,knock door one eventu open andajustus
AndaJustus,Fri Mar 04 14:01:01 IST 2016,hard work idol keep
AndaJustus,Mon Feb 22 22:05:44 IST 2016,in matter heart take mind andajustus
AndaJustus,Mon Feb 22 09:11:57 IST 2016,you put earth achiev greatest self live purpos courag steve mar
AndaJustus,Mon Feb 22 09:09:38 IST 2016,stop tri fit born stand unk
AndaJustus,Sun Feb 21 23:38:17 IST 2016,if ahead scare behind hurt look god fail
AndaJustus,Sun Feb 21 23:35:46 IST 2016,an intellig person open mind a beauti person open eye and love kind person open heart quot
AndaJustus,Sun Feb 21 19:20:50 IST 2016,rt the best reveng move get continu succeed never give someon satisfact watch
AndaJustus,Sat Feb 20 22:47:33 IST 2016,even world break mlk
AndaJustus,Sat Feb 20 22:44:00 IST 2016,uniqu extinct rare one kind
AndaJustus,Sat Feb 20 22:38:02 IST 2016,rt you blood bought christ paid god ordain right enjoy everi singl moment life
AndaJustus,Sat Feb 20 22:26:08 IST 2016,even truth hurt ignor embrac
AndaJustus,Sat Feb 20 20:34:08 IST 2016,alway analys kind result decis may bring
AndaJustus,Sat Feb 20 20:28:58 IST 2016,rt pain make stronger tear make braver a broken heart make wiser alcohol make rememb
AndaJustus,Mon Feb 08 20:10:48 IST 2016,rt you either master money level money master toni robbin quot
AndaJustus,Sun Feb 07 21:19:47 IST 2016,rt you learn rule game and play better anyon els sourc albert einstein via
AndaJustus,Sat Feb 06 02:03:43 IST 2016,rt sometim explain see person it way take place one els
AndaJustus,Sat Feb 06 01:46:47 IST 2016,fall dust show way
AndaJustus,Sat Feb 06 01:43:27 IST 2016,suffer today live rest life champion moham ali
AndaJustus,Sat Feb 06 01:40:56 IST 2016,chang automat progress occur gradual direct certain place andajustus
AndaJustus,Sat Feb 06 01:35:05 IST 2016,a peopl choos quit succeed
AndaJustus,Tue Feb 02 09:29:10 IST 2016,life full opportun prepar one arriv andajustus
