username,time,tweet
BiasBe,Sun Mar 20 05:29:59 IST 2016,of wrong thing tweet plural lego lego wrongest
BiasBe,Sat Mar 19 16:58:10 IST 2016,the fallibl common sens scientif method invent
BiasBe,Sat Mar 19 10:02:50 IST 2016,true theori well support test explan set fact observ law
BiasBe,Sat Mar 19 09:52:17 IST 2016,what call evolut direct observ
BiasBe,Sat Mar 19 09:50:28 IST 2016,doubl nope
BiasBe,Sat Mar 19 09:48:40 IST 2016,a hors larg land mammal now put word sea front see chang definit amaz nogodperfect
BiasBe,Sat Mar 19 05:56:25 IST 2016,yes thousand million year diverg popul
BiasBe,Sat Mar 19 05:55:17 IST 2016,so bug bodi plan do mean insect
BiasBe,Fri Mar 18 06:08:36 IST 2016,bullshit you gone paranoia rabbit hole you sound like silli child
BiasBe,Fri Mar 18 06:00:01 IST 2016,evolut fact natur select theori explain
BiasBe,Fri Mar 18 05:59:11 IST 2016,evolut explain biodivers it make claim origin life that abiogenesi
BiasBe,Fri Mar 18 05:57:53 IST 2016,yes same theori graviti germ theori
BiasBe,Fri Mar 18 05:57:04 IST 2016,um adult give birth babi what think evolut
BiasBe,Fri Mar 18 05:52:21 IST 2016,bonobo share genet code is enough
BiasBe,Fri Mar 18 05:51:15 IST 2016,no evolut observ testabl fact natur select theori
BiasBe,Fri Mar 18 05:48:47 IST 2016,intellig analyst serious
BiasBe,Thu Mar 17 16:54:01 IST 2016,you know work model spin ball stand
BiasBe,Wed Mar 16 10:02:36 IST 2016,what like wrong everyth
BiasBe,Wed Mar 16 10:00:18 IST 2016,rt i proberni would vote hillari i one issu voter issu open seventh seal
BiasBe,Wed Mar 16 06:16:38 IST 2016,nope it easili direct observ
BiasBe,Wed Mar 16 04:15:48 IST 2016,not sure read i provid link observ speciat it hybrid
BiasBe,Tue Mar 15 23:35:38 IST 2016,fals it happen time direct observ
BiasBe,Tue Mar 15 23:33:58 IST 2016,bonobo human share dna that enough
BiasBe,Tue Mar 15 07:30:23 IST 2016,again
BiasBe,Tue Mar 15 05:50:52 IST 2016,except direct observ
BiasBe,Tue Mar 15 02:01:21 IST 2016,rt the flatearth movement interest dishearten infuri learn
BiasBe,Mon Mar 14 22:00:05 IST 2016,bonobo share dna us half enough
BiasBe,Mon Mar 14 21:58:52 IST 2016,trump candid crazi stupid gullibl
BiasBe,Mon Mar 14 15:24:03 IST 2016,i read bibl it one reason i stop christian
BiasBe,Mon Mar 14 15:21:25 IST 2016,most sequel work fiction fulfil propheci made prequel nice tri
BiasBe,Mon Mar 14 08:19:57 IST 2016,don forget conspiraci or conspiraci subset make shit
BiasBe,Mon Mar 14 08:02:21 IST 2016,earth chicken is logic next escal step
BiasBe,Mon Mar 14 08:00:03 IST 2016,exact enjoy fantasi world
BiasBe,Mon Mar 14 07:59:17 IST 2016,circumfer
BiasBe,Mon Mar 14 07:58:49 IST 2016,my view base avail evid includ direct observ curvatur water horizon
BiasBe,Mon Mar 14 07:57:01 IST 2016,no alchemi ancient greek measur accur circumst earth
BiasBe,Mon Mar 14 07:55:44 IST 2016,all evid object show wrong how come conclus
BiasBe,Mon Mar 14 07:50:14 IST 2016,scientif method invent common sens extrem fallibl
BiasBe,Mon Mar 14 07:48:50 IST 2016,so water somehow immun graviti or one graviti myth flat earther
BiasBe,Mon Mar 14 04:59:23 IST 2016,actual probabl right jesus thing i guess even broken clock right twice day
BiasBe,Mon Mar 14 04:53:41 IST 2016,why would prestigi school teach paranoid conspiraci nonsens histori
BiasBe,Mon Mar 14 04:43:45 IST 2016,you reject someth even know basic definit lol complet joke
BiasBe,Mon Mar 14 04:40:37 IST 2016,oh i see you know evolut the explain moron statement
BiasBe,Mon Mar 14 04:36:45 IST 2016,flu shot drug resist bacteria just name
BiasBe,Mon Mar 14 04:35:17 IST 2016,rt need evolut medicin im sorri hope vain
BiasBe,Mon Mar 14 04:31:36 IST 2016,why would need believ despit overwhelm conclus evid
BiasBe,Sun Mar 13 10:37:52 IST 2016,rt oh god okcupid way filter asshol
