username,time,tweet
selenella_,Tue Mar 01 05:29:31 IST 2016,happi birthday love have wonder day feel i love
selenella_,Tue Mar 01 02:49:00 IST 2016,rt
selenella_,Tue Mar 01 00:29:45 IST 2016,rt babi give no fuck
selenella_,Mon Feb 29 23:12:58 IST 2016,rt still love video
selenella_,Mon Feb 29 21:12:11 IST 2016,go tomorrow i readi i long heart take
selenella_,Mon Feb 29 21:11:29 IST 2016,rt justinbieb spend week yourself make hit biggest song career
selenella_,Mon Feb 29 21:11:28 IST 2016,rt day till purposetour i think i pant excit
selenella_,Mon Feb 29 21:11:25 IST 2016,rt q is anyth perfect brit perform a nope
selenella_,Mon Feb 29 21:11:23 IST 2016,rt loveyourself hitstorm straight week
selenella_,Mon Feb 29 21:11:16 IST 2016,rt for bday would nice
selenella_,Mon Feb 29 19:51:46 IST 2016,thank i love chanel
selenella_,Mon Feb 29 19:50:19 IST 2016,rt fav chanel
selenella_,Mon Feb 29 19:50:17 IST 2016,rt bitch oscar
selenella_,Mon Feb 29 19:48:25 IST 2016,rt g morn kiddo first day back job n i feelin like million buck thank patient w n see u
selenella_,Mon Feb 29 19:48:24 IST 2016,rt to laugh speech leonardo gave climat chang
selenella_,Mon Feb 29 19:48:21 IST 2016,rt the new shotsupd someth funni
selenella_,Mon Feb 29 17:39:23 IST 2016,rt girl born may mean chic pictur
selenella_,Mon Feb 29 17:38:29 IST 2016,rt ariana grand kiss
selenella_,Mon Feb 29 17:37:52 IST 2016,rt titan
selenella_,Mon Feb 29 17:37:36 IST 2016,rt girl born may coffe kind coffe
selenella_,Mon Feb 29 17:37:06 IST 2016,rt captain jack sparrow
selenella_,Mon Feb 29 17:35:31 IST 2016,rt fuckin ayeeee congratul damn time ik i late lol well deserv
selenella_,Mon Feb 29 17:35:28 IST 2016,rt night taipei taiwan slfl xx
selenella_,Mon Feb 29 17:35:22 IST 2016,rt so said luka graham look like thoma i test theori
selenella_,Mon Feb 29 17:34:25 IST 2016,rt tonight i upload stori happen
selenella_,Mon Feb 29 13:03:00 IST 2016,rt luke eat amaz pizza new orlean via
selenella_,Mon Feb 29 12:31:49 IST 2016,rt forev
selenella_,Mon Feb 29 12:31:06 IST 2016,rt harri potter real
selenella_,Mon Feb 29 12:30:53 IST 2016,rt look at leo being so proud and humbl i can t take this
selenella_,Mon Feb 29 12:30:08 IST 2016,rt via
selenella_,Mon Feb 29 12:28:23 IST 2016,rt about last night happi bday
selenella_,Mon Feb 29 12:26:11 IST 2016,congratul leo oscar i happi cours i teamleo
selenella_,Mon Feb 29 12:25:24 IST 2016,rt thank academi incred cast crew thereven oscar
selenella_,Mon Feb 29 12:24:56 IST 2016,rt leo final oscar so happi
selenella_,Mon Feb 29 11:41:28 IST 2016,rt kate leo ever let go give us end titan never got
selenella_,Mon Feb 29 11:41:26 IST 2016,rt checkout snap stori lmfao
selenella_,Mon Feb 29 11:41:25 IST 2016,rt what bloodi legend love
selenella_,Mon Feb 29 05:31:51 IST 2016,rt previous leo role deserv oscar
selenella_,Mon Feb 29 05:30:27 IST 2016,rt i gotta stop wast time
selenella_,Mon Feb 29 05:30:16 IST 2016,rt you need sit grab cup water tame thirst
selenella_,Mon Feb 29 05:21:02 IST 2016,rt haha great
selenella_,Mon Feb 29 01:27:48 IST 2016,rt so love piec teilart find perfect spot hang
selenella_,Mon Feb 29 00:54:45 IST 2016,rt
selenella_,Mon Feb 29 00:50:46 IST 2016,rt isn nice quiet place could go fuck
selenella_,Mon Feb 29 00:06:01 IST 2016,rt
selenella_,Mon Feb 29 00:06:00 IST 2016,rt the fact i get see today
selenella_,Mon Feb 29 00:06:00 IST 2016,rt should i hush do guy want one one talk
selenella_,Sun Feb 28 21:00:29 IST 2016,rt my idea clean throw cloth hang barstool top bedroom door
selenella_,Sun Feb 28 18:52:01 IST 2016,rt in word this app dope
selenella_,Sun Feb 28 18:51:55 IST 2016,rt plot twist via camcord app
