username,time,tweet
medicbritt619,Tue Mar 01 05:29:50 IST 2016,he love year day die next morn it sound like beauti heartbreak stori it great uncl
medicbritt619,Mon Feb 29 04:58:01 IST 2016,also like favorit cluster author genr
medicbritt619,Mon Feb 29 04:56:36 IST 2016,writerpost photo
medicbritt619,Sun Feb 28 19:32:03 IST 2016,last shift great partner sunday coffe shenanigan em inappropriatecom lovemyjob
medicbritt619,Sat Feb 27 09:02:10 IST 2016,extrovert splash person everywher person introvert write introvertproblem amwrit lookinsid
medicbritt619,Sat Feb 27 09:00:24 IST 2016,my head full thing i rememb stori come life sometim feel like explod amwrit
medicbritt619,Wed Feb 24 05:56:23 IST 2016,overheard snatch convers this bracelet lie concern actual bracelet amwrit writerslif storieseverywher
medicbritt619,Tue Feb 23 18:55:55 IST 2016,make your charact reaction twice interest help writer becom author
medicbritt619,Tue Feb 23 17:44:54 IST 2016,watch moon partner take call itsthelittleth morn medicfueliscoffe
medicbritt619,Mon Feb 22 03:29:47 IST 2016,our inadequaci god our failur his failur he see mess he see final product let your fear go
medicbritt619,Sun Feb 21 20:34:22 IST 2016,firefighterstrong motiv
medicbritt619,Sun Feb 21 03:14:29 IST 2016,this station weather specif wind runfast eagleup firefighterstrong
medicbritt619,Sat Feb 20 08:37:14 IST 2016,run short februari in ohio emsstrong runfast firefighterstrong eagleup
medicbritt619,Sat Feb 20 00:17:48 IST 2016,like how secur
medicbritt619,Sat Feb 20 00:17:22 IST 2016,this happen phone mobil write fit life platform writerslif firefight medic
medicbritt619,Fri Feb 19 21:36:12 IST 2016,no one will ever understand you like your em partner does uniform stori
medicbritt619,Fri Feb 19 20:36:51 IST 2016,watt pad have use
medicbritt619,Fri Feb 19 20:36:23 IST 2016,goal day squatchalleng firefighterstrong medic eagleup
medicbritt619,Fri Feb 19 11:14:30 IST 2016,today chang flat tire deal smell em conquer chao puke mini coma nap laugh cowork forget lunch bag day
medicbritt619,Thu Feb 18 09:17:51 IST 2016,tonight i found write thing nobodi told i start em the list endless emsstruggl writer
medicbritt619,Wed Feb 17 20:23:29 IST 2016,did blog post writer prompt made snicker writerslif justwrit
medicbritt619,Wed Feb 17 20:21:14 IST 2016,snow cover driveway tree a true winter wonderland straight side hill countrylif
medicbritt619,Tue Feb 16 07:05:25 IST 2016,my sister show dad chick flick dvd my dad tone absolut horror i never seen anyth like chickflick dad
medicbritt619,Mon Feb 15 22:59:12 IST 2016,writersresourc photo
medicbritt619,Mon Feb 15 22:49:42 IST 2016,know need order accomplish goal great until stare cold hard fact
medicbritt619,Mon Feb 15 05:59:53 IST 2016,rt writer ever wonder book blog origin enough i know i here advic cslewi https
medicbritt619,Sun Feb 14 18:45:05 IST 2016,writerslif i love dialogu prompt
medicbritt619,Sun Feb 14 09:26:29 IST 2016,goal accomplish convers today epic bout random hilar lunaci coffe medicfuel
medicbritt619,Sun Feb 14 03:59:39 IST 2016,just share call me mayb armi version base miami dolphin version watch parter pee laugh epic
medicbritt619,Sun Feb 14 03:54:17 IST 2016,writer file photo lol
medicbritt619,Sat Feb 13 22:57:15 IST 2016,monitorthebeat photo show it might look pretti slow better stop neverquit
medicbritt619,Sat Feb 13 22:50:48 IST 2016,insomniacmedicblog photo my mission em makethemlaugh
medicbritt619,Sat Feb 13 20:23:29 IST 2016,rt introduc urself w dementia pt assess leav second complet forgot i like
medicbritt619,Sat Feb 13 08:05:53 IST 2016,love great breakthrough stori idea moment but hate while drive in snowstorm on ici road writer
medicbritt619,Fri Feb 12 23:49:06 IST 2016,rt skeptic begin faith writerslif amwrit faith mondaymotiv quoteoftheday
medicbritt619,Fri Feb 12 23:48:43 IST 2016,rt i writer amwrit writerslif writersproblem
