username,time,tweet
No1CookieLady,Sun Feb 28 05:11:08 IST 2016,she liar liar pantsuit s on fire
No1CookieLady,Sun Feb 28 05:10:26 IST 2016,rt berniestrong votetogeth notmeus weareberni stopcensoringus feelthebern iamnotyourfirewal freedomofspeech https
No1CookieLady,Sun Feb 28 05:10:09 IST 2016,rt alwaystrump b c twitter censor this happen citi rn tell marchforberni https
No1CookieLady,Sun Feb 28 05:09:51 IST 2016,rt boycott msm watch elect coverag
No1CookieLady,Sun Feb 28 04:44:45 IST 2016,rt feelthebern votetogeth berniecar berniestrong berniesand notforsal americatogeth enoughisenough
No1CookieLady,Sun Feb 28 04:43:42 IST 2016,rt if hillari want us take paid oper serious go better feelthebern
No1CookieLady,Sun Feb 28 04:43:12 IST 2016,rt the meme nice vote feelthebern berniestrong
No1CookieLady,Sun Feb 28 04:42:59 IST 2016,rt feelthebern
No1CookieLady,Sun Feb 28 04:42:40 IST 2016,rt killer mike want go vote berni right now poll open p get vote scforberni
No1CookieLady,Sun Feb 28 04:42:19 IST 2016,rt can afford donat can get canvass you phone bank home feelthebern supertuesday
No1CookieLady,Sun Feb 28 04:41:52 IST 2016,rt let scrap deleg togeth whoever win popular vote win nomin feelthebern berniestrong
No1CookieLady,Sun Feb 28 04:41:23 IST 2016,rt america need whichhillari whichhillarycensor bernieorbust nohillari berni berniestrong
No1CookieLady,Sun Feb 28 04:41:06 IST 2016,rt berni true fighter climat chang race read
No1CookieLady,Sun Feb 28 04:40:46 IST 2016,rt berniesandersforsc supertuesday hewinswewin weareberni scprimari blacklivesmatt https
No1CookieLady,Sun Feb 28 04:40:27 IST 2016,rt rt in support today nerdland in support berniestrong
No1CookieLady,Sun Feb 28 04:40:12 IST 2016,rt rt rt vote sinc vote today daughter
No1CookieLady,Sun Feb 28 04:39:42 IST 2016,rt rt hasn vote sinc vote today daughter hasn
No1CookieLady,Sun Feb 28 04:38:59 IST 2016,rt data captain jason sherri bern colorado
No1CookieLady,Sun Feb 28 04:38:32 IST 2016,thank folk
No1CookieLady,Sun Feb 28 04:38:22 IST 2016,rt killer mike nina turner stop columbia s c offic afternoon canvass launch scforberni https
No1CookieLady,Sun Feb 28 04:38:07 IST 2016,my predict if hrc dem nomine trump win white hous
No1CookieLady,Sun Feb 28 04:37:24 IST 2016,rt my predict trump get major deleg gop deni nomin support go bonker
No1CookieLady,Sat Feb 27 19:28:32 IST 2016,rt scprimari
No1CookieLady,Sat Feb 27 19:28:09 IST 2016,this realli import
No1CookieLady,Sat Feb 27 19:27:29 IST 2016,rt ahillarywinisatrumpwin hillaryclinton need to releasethetranscript nevertrump https
No1CookieLady,Sat Feb 27 19:27:07 IST 2016,scprimari she stand noth
No1CookieLady,Sat Feb 27 19:25:39 IST 2016,rt scprimari
No1CookieLady,Sat Feb 27 19:25:26 IST 2016,rt scprimari
No1CookieLady,Sat Feb 27 19:25:03 IST 2016,rt video why berni sander being ignor media uniteblu
No1CookieLady,Sat Feb 27 19:24:48 IST 2016,rt hillari is worst than trump we can t have corrupt peopl run for presid bernieorbust feelthebern
No1CookieLady,Sat Feb 27 19:24:32 IST 2016,rt scprimari
No1CookieLady,Sat Feb 27 19:23:52 IST 2016,rt scprimari
No1CookieLady,Sat Feb 27 19:23:10 IST 2016,crook core hrccrookedtothecor
No1CookieLady,Sat Feb 27 19:22:13 IST 2016,rt berniesandersforsc there reason nurs trust berni singlepay healthcar right privleg
No1CookieLady,Sat Feb 27 19:22:04 IST 2016,rt berni sander fight racial equal fifti year scprimari notmeus feelthebern
No1CookieLady,Sat Feb 27 19:21:55 IST 2016,rt kansa road bridg work underfund ksleg https
No1CookieLady,Sat Feb 27 19:21:38 IST 2016,rt south carolina get vote tomorrow the polit revolut start berniesandersforsc
No1CookieLady,Sat Feb 27 19:21:29 IST 2016,rt scprimari viralvotechalleng challeng friend toshar selfiesvot challeng friend
No1CookieLady,Sat Feb 27 19:21:11 IST 2016,rt scprimari
No1CookieLady,Sat Feb 27 19:20:50 IST 2016,we get chanc hrc ensur trump presid
No1CookieLady,Sat Feb 27 19:20:13 IST 2016,rt feder judg refus block new voterregistr process kansa ksleg https
No1CookieLady,Sat Feb 27 19:19:29 IST 2016,realli independ vote real best interest scprimari
No1CookieLady,Sat Feb 27 19:18:13 IST 2016,rt let super deleg steal process
No1CookieLady,Sat Feb 27 19:17:52 IST 2016,rt i think either one beat trump poll today show poor hrc turnout could hurt congression race
No1CookieLady,Sat Feb 27 19:17:24 IST 2016,i think the young voter turn bother vote mark word feelthebern
No1CookieLady,Sat Feb 27 19:15:43 IST 2016,she it bode well american peopl
No1CookieLady,Sat Feb 27 19:13:38 IST 2016,some i hard press my concern get anoth chanc like
No1CookieLady,Sat Feb 27 19:08:19 IST 2016,understand dnc mani support turn hrc she cost us white hous wake up feelthebern
No1CookieLady,Sat Feb 27 19:06:17 IST 2016,i feel sorri uninform voter scprimari vote peopl
No1CookieLady,Sat Feb 27 19:03:56 IST 2016,one chanc real chang scprimari blow make sad
