username,time,tweet
megan_ts,Sat Sep 01 05:29:46 IST 2012,gonna tri press snooz morn
megan_ts,Sat Sep 01 04:56:47 IST 2012,awwww killer use love thee d
megan_ts,Sat Sep 01 04:28:28 IST 2012,aww yeah hahaha
megan_ts,Sat Sep 01 04:26:27 IST 2012,still smile see balint beauti tele l
megan_ts,Sat Sep 01 03:52:44 IST 2012,now watch boy lotto d
megan_ts,Sat Sep 01 02:33:29 IST 2012,get lolz watch twenti one jump street
megan_ts,Fri Aug 31 23:00:33 IST 2012,two thing three go d progress yay
megan_ts,Fri Aug 31 22:25:37 IST 2012,tri clean room result everyth end floor get distract twitter d
megan_ts,Fri Aug 31 21:07:00 IST 2012,tri set desk disast l
megan_ts,Fri Aug 31 20:25:01 IST 2012,blare all hous clean room d
megan_ts,Fri Aug 31 19:29:46 IST 2012,milki bar white button made day d
megan_ts,Fri Aug 31 19:15:18 IST 2012,hmmmm stay go ill decid last minut like per usual
megan_ts,Fri Aug 31 02:14:11 IST 2012,tri sociabl reckon year head studi one except like peopl
megan_ts,Fri Aug 31 01:59:43 IST 2012,came home knit needl stuck strap bag look got l
megan_ts,Fri Aug 31 00:09:38 IST 2012,first week school im alreadi lose sleep stress notgood
megan_ts,Thu Aug 30 22:34:04 IST 2012,can sleep week pleaseeeee
megan_ts,Thu Aug 30 21:05:25 IST 2012,sorri saw go school
megan_ts,Thu Aug 30 12:17:58 IST 2012,ronan keat daybreak scream hous
megan_ts,Thu Aug 30 03:06:48 IST 2012,sign im go bed l tomorrow
megan_ts,Thu Aug 30 00:34:45 IST 2012,big momma hous bed
megan_ts,Thu Aug 30 00:09:43 IST 2012,sit shout fuck english homework
megan_ts,Wed Aug 29 23:13:48 IST 2012,awww fuck im go bed ly homework done morn
megan_ts,Wed Aug 29 22:55:27 IST 2012,in much pain owwwwwww
megan_ts,Wed Aug 29 22:22:58 IST 2012,so determin best year matter d
megan_ts,Wed Aug 29 02:46:47 IST 2012,tweet actual make day alway make smile
megan_ts,Wed Aug 29 02:07:11 IST 2012,chang plan friday think
megan_ts,Wed Aug 29 00:10:23 IST 2012,read danni quot alway help calm ham l
megan_ts,Wed Aug 29 00:09:23 IST 2012,grand thank
megan_ts,Tue Aug 28 23:50:37 IST 2012,start dislik certain peopl that life
megan_ts,Tue Aug 28 23:11:07 IST 2012,amazebal feel lone peopl get follow and tweet her pronto
megan_ts,Tue Aug 28 22:46:29 IST 2012,gonna prove everyon wrong work ass year
megan_ts,Tue Aug 28 22:22:16 IST 2012,what day blehhhh aight
megan_ts,Tue Aug 28 03:22:07 IST 2012,tell gonna littl sleep tonight
megan_ts,Tue Aug 28 02:20:59 IST 2012,sit listen whilst live sept d
megan_ts,Tue Aug 28 02:05:15 IST 2012,life im wide awak bad need find phone
megan_ts,Tue Aug 28 00:22:51 IST 2012,rt to get someon never someth never done
megan_ts,Mon Aug 27 22:40:05 IST 2012,off go walk rain tad weird love
megan_ts,Mon Aug 27 21:31:37 IST 2012,waystoirritatem slag even wors say love pure u fanci danni know breakeven like feck
megan_ts,Mon Aug 27 21:30:38 IST 2012,waystoirritatem hide shit
megan_ts,Mon Aug 27 20:08:48 IST 2012,im actual glad school glad
megan_ts,Mon Aug 27 19:49:19 IST 2012,youll probabl home ec art
megan_ts,Mon Aug 27 19:47:46 IST 2012,shes mine x
megan_ts,Mon Aug 27 19:46:37 IST 2012,jessica nicol d
megan_ts,Mon Aug 27 19:45:09 IST 2012,need stop paranoid l
megan_ts,Mon Aug 27 18:06:58 IST 2012,laugh way home school gangster bus l surround oneself posit d
megan_ts,Mon Aug 27 18:04:56 IST 2012,mehhh throat sore think swolen
megan_ts,Mon Aug 27 18:01:06 IST 2012,near kill eat pasta damn cinnamon
megan_ts,Mon Aug 27 17:59:55 IST 2012,that realli good like version
megan_ts,Mon Aug 27 02:40:10 IST 2012,got follow happi
megan_ts,Mon Aug 27 02:16:26 IST 2012,im bring pen that
