username,time,tweet
VSPC,Tue Mar 01 05:19:08 IST 2016,not bad way spend year gift extra even thank leapday bongo stpetebeach
VSPC,Tue Mar 01 02:33:01 IST 2016,guy make philli phanat hat look amaz philli
VSPC,Tue Mar 01 02:18:36 IST 2016,see live concert march tix info
VSPC,Tue Mar 01 01:19:18 IST 2016,hey kevin we select announc winner very soon know die get outta chi sunshin
VSPC,Mon Feb 29 21:00:35 IST 2016,on day citi stpete fl incorpor it also leapday old sunshin citi
VSPC,Mon Feb 29 20:05:43 IST 2016,stpeteclearwat we stare anoth week jam pack w awesom event
VSPC,Mon Feb 29 07:58:03 IST 2016,amaz shot alway
VSPC,Mon Feb 29 01:36:57 IST 2016,bongo on stpetebeach
VSPC,Sun Feb 28 23:58:59 IST 2016,wish alexandra
VSPC,Sun Feb 28 23:22:45 IST 2016,day like make life worth live gulfport bike liveamplifi
VSPC,Sun Feb 28 22:27:51 IST 2016,absolut brew perfect liveamplifi
VSPC,Sun Feb 28 22:26:20 IST 2016,kid meal we think all meal come pail florida lovefl
VSPC,Sun Feb 28 20:49:01 IST 2016,look forward return sunshinec liveamplifi
VSPC,Sun Feb 28 20:39:16 IST 2016,look love ladi and thank memo sure blue coat today
VSPC,Sun Feb 28 20:28:04 IST 2016,sound like good plan liveamplifi
VSPC,Sun Feb 28 19:45:15 IST 2016,great stuff enjoy explor today liveamplifi
VSPC,Sun Feb 28 19:41:02 IST 2016,that win combo have fun
VSPC,Sun Feb 28 19:39:29 IST 2016,rt spectacular sunris vinoy park it go top day enjoy thank paul eastman
VSPC,Sun Feb 28 19:38:25 IST 2016,beat view level grand plaza stpetebeach liveamplifi
VSPC,Sun Feb 28 19:36:46 IST 2016,u made right choic land stpete super entertain stori thank none lol
VSPC,Sun Feb 28 19:30:40 IST 2016,wow look delici liveamplifi
VSPC,Sun Feb 28 19:26:02 IST 2016,sound pretti darn delici innov supportloc liveamplifi
VSPC,Sun Feb 28 19:20:21 IST 2016,great time watch clearwat today go great day basebal liveamplifi
VSPC,Sun Feb 28 19:17:16 IST 2016,yippe can wait get what agenda eat beach sleep repeat liveamplifi
VSPC,Sun Feb 28 19:15:40 IST 2016,tbray better rock star so impress commit communiti raysup
VSPC,Sun Feb 28 19:10:51 IST 2016,look refresh readi take sundayfunday liveamplifi
VSPC,Sun Feb 28 04:09:07 IST 2016,yasss visit stpeteclearwat ftw
VSPC,Sun Feb 28 03:40:46 IST 2016,today mark first day baseballforev campaign keep stpete raysup
VSPC,Sun Feb 28 02:14:33 IST 2016,haha look serious knew sort fish thing greatjob
VSPC,Sun Feb 28 01:57:36 IST 2016,anoth awesom raysfanfest book stoke season begin raysup liveamplifi stpete
VSPC,Sun Feb 28 00:20:34 IST 2016,which book would choos got read raysfanfest liveamplifi
VSPC,Sat Feb 27 23:51:27 IST 2016,fantast turn raysfanfest today liveamplifi
VSPC,Sat Feb 27 22:25:31 IST 2016,we make way raysfanfest today are free raysup
VSPC,Sat Feb 27 22:09:05 IST 2016,beat enjoy liveamplifi
VSPC,Sat Feb 27 21:48:50 IST 2016,gorgeous morn you head clearwaterbeach
VSPC,Sat Feb 27 21:31:28 IST 2016,it beauti weekend explor streetart stpete use list guid
VSPC,Sat Feb 27 20:29:18 IST 2016,awesom shot northshoreandchil liveamplifi
VSPC,Sat Feb 27 19:54:37 IST 2016,heck yeah so much fun flyinghigh liveamplifi
VSPC,Sat Feb 27 19:53:26 IST 2016,super shell session great find liveamplifi
VSPC,Sat Feb 27 19:49:48 IST 2016,good morn have great saturday liveamplifi
VSPC,Sat Feb 27 17:59:28 IST 2016,the sunris tampabay north shore park fli morn stpete liveamplifi
VSPC,Sat Feb 27 08:51:14 IST 2016,rockin rt good time watch tonight liveamplifi
VSPC,Sat Feb 27 05:36:55 IST 2016,memo ftw liveamplifi
VSPC,Sat Feb 27 02:26:01 IST 2016,great recommend don forget liveamplifi
VSPC,Sat Feb 27 01:35:17 IST 2016,argu liveamplifi
VSPC,Sat Feb 27 01:34:30 IST 2016,thank host us we enjoy explor museum thank thefhm liveamplifi
VSPC,Sat Feb 27 01:32:15 IST 2016,caladesi island short boat ride away honeymoon island near dunedin fl
VSPC,Sat Feb 27 01:30:58 IST 2016,get clearwaterbeach faster cheap mar apr clearwat ride free park
VSPC,Sat Feb 27 00:41:56 IST 2016,let
VSPC,Sat Feb 27 00:34:25 IST 2016,look like take selfi selfi photobomb complex hard coordin impress
