username,time,tweet
EmperorOfShade,Tue Mar 01 05:29:43 IST 2016,if i plan one go small i sure would want small one famili
EmperorOfShade,Tue Mar 01 05:20:52 IST 2016,they start plan one yet pretti sure start smell like rot flesh
EmperorOfShade,Tue Mar 01 05:08:19 IST 2016,for i one fuck
EmperorOfShade,Tue Mar 01 04:15:33 IST 2016,richard iii georg plantagenet isabel nevill bona savoy elizabeth woodvill ann nevill itslit
EmperorOfShade,Tue Mar 01 03:59:52 IST 2016,georg clap slept mother ladi you know edward hit first nasti ass
EmperorOfShade,Tue Mar 01 03:53:16 IST 2016,y thot
EmperorOfShade,Tue Mar 01 03:49:52 IST 2016,my name liter mean cur hair one oijbew i one cur hair peopl
EmperorOfShade,Tue Mar 01 03:47:15 IST 2016,nativ never blond the weird color hair brown the rest straight dark hair
EmperorOfShade,Tue Mar 01 03:43:53 IST 2016,i cri i scream i would
EmperorOfShade,Tue Mar 01 03:38:46 IST 2016,i suppos bring back wine warwick i wound bed ladi talk distract
EmperorOfShade,Tue Mar 01 03:37:55 IST 2016,hear my cri at this
EmperorOfShade,Tue Mar 01 03:34:26 IST 2016,i lost virgin best way
EmperorOfShade,Tue Mar 01 03:22:30 IST 2016,i gave eddi talk henc reason still singl
EmperorOfShade,Tue Mar 01 03:19:17 IST 2016,isabel learn first time
EmperorOfShade,Tue Mar 01 03:15:37 IST 2016,i told daughter lose virgin sin three grandchildren later
EmperorOfShade,Tue Mar 01 03:13:18 IST 2016,my parent tweet
EmperorOfShade,Tue Mar 01 02:47:53 IST 2016,you chees head fuck
EmperorOfShade,Tue Mar 01 02:43:39 IST 2016,me crash jump get booka booka crash complet opposit i said spin tnt
EmperorOfShade,Tue Mar 01 02:40:29 IST 2016,crash bandicoot bane exist i love game goddamn stress
EmperorOfShade,Tue Mar 01 02:38:53 IST 2016,they make mega man movi naww they might cast aaron taylor johnson mega man i realli want hate mega man
EmperorOfShade,Tue Mar 01 02:36:23 IST 2016,i lie sonic r guilti pleasur like worst sonic game ever made
EmperorOfShade,Tue Mar 01 02:31:29 IST 2016,i might ever get anoth good sega consol sonic game thank god i get sonic movi fuck you
EmperorOfShade,Tue Mar 01 02:30:17 IST 2016,who woke said want sonic hedgehog live action movi you fuck made good game sinc
EmperorOfShade,Tue Mar 01 02:27:21 IST 2016,they make live action sonic hedgehog movi goodby childhood nice
EmperorOfShade,Tue Mar 01 02:17:53 IST 2016,im sold
EmperorOfShade,Tue Mar 01 02:16:13 IST 2016,that cast basic like watch anim accur hair movement everyth
EmperorOfShade,Tue Mar 01 02:13:50 IST 2016,nine time ten japanes actor wind look like charact american one
EmperorOfShade,Tue Mar 01 02:12:29 IST 2016,don dare tell anim charact play japanes actor
EmperorOfShade,Tue Mar 01 02:07:19 IST 2016,fuckboy coutur still would bang
EmperorOfShade,Tue Mar 01 02:03:14 IST 2016,why is he me
EmperorOfShade,Tue Mar 01 02:01:40 IST 2016,only l could eat cake still look depress fuck is l us was model us model l
EmperorOfShade,Tue Mar 01 01:59:13 IST 2016,if put l front hot chick cake say take cake
EmperorOfShade,Tue Mar 01 01:55:15 IST 2016,can imagin gong li ancient one i realli care benedict dr strang anymor least look part
EmperorOfShade,Tue Mar 01 01:53:22 IST 2016,
EmperorOfShade,Tue Mar 01 01:50:36 IST 2016,my brother introduc manga first anim memori
EmperorOfShade,Tue Mar 01 01:49:17 IST 2016,watch go ape shit
EmperorOfShade,Tue Mar 01 01:47:44 IST 2016,the best fancast meme i ever made
EmperorOfShade,Tue Mar 01 01:45:46 IST 2016,i see death note wind put foot wall
EmperorOfShade,Tue Mar 01 01:45:00 IST 2016,death note shit back day i use watch faith adult swim use show
EmperorOfShade,Tue Mar 01 01:41:58 IST 2016,this actress play motoko play i m kinda mark out
EmperorOfShade,Tue Mar 01 01:40:41 IST 2016,i guess i hurt
EmperorOfShade,Tue Mar 01 01:37:24 IST 2016,ghost shell product fuck ive been wait my whol scarlett johansson motoko kusanagi
EmperorOfShade,Tue Mar 01 01:34:33 IST 2016,ew
EmperorOfShade,Tue Mar 01 01:32:56 IST 2016,they make death note movi one japanes person cast day
EmperorOfShade,Tue Mar 01 01:31:42 IST 2016,ann anyth tho y losin mind
EmperorOfShade,Tue Mar 01 01:23:25 IST 2016,we sibl rivalri dead parent break process nun my timelin fire
EmperorOfShade,Tue Mar 01 01:10:07 IST 2016,yeah
EmperorOfShade,Tue Mar 01 01:10:01 IST 2016,do i time shit
EmperorOfShade,Tue Mar 01 01:06:00 IST 2016,i set barbara failur though i know son got like
EmperorOfShade,Tue Mar 01 01:05:16 IST 2016,i told you to stay away from men but naww im the alpha and omega that your fault
