username,time,tweet
ryanonthego,Thu Sep 01 05:29:42 IST 2011,as impress the kinet king i seem vega headlin agt
ryanonthego,Thu Sep 01 05:25:59 IST 2011,tonight agt i beleiv follow advanc smage bros
ryanonthego,Thu Aug 25 10:32:28 IST 2011,congratul make top agt
ryanonthego,Thu Aug 25 10:31:42 IST 2011,you correct lot good thing ahead best wish agt
ryanonthego,Thu Aug 25 10:23:45 IST 2011,tough call worthi top agt
ryanonthego,Thu Aug 25 10:22:11 IST 2011,not surpris finish behind well futur agt
ryanonthego,Thu Aug 25 10:01:35 IST 2011,sorri make top agt howev great career impressionist ahead
ryanonthego,Thu Aug 25 10:00:40 IST 2011,congrat keep good work agt
ryanonthego,Thu Aug 25 09:56:58 IST 2011,all right congrat advanc deserv top agt
ryanonthego,Thu Aug 25 09:41:12 IST 2011,best wish futur guy great act agt
ryanonthego,Thu Aug 25 09:40:17 IST 2011,far rest act first group congrat make top agt
ryanonthego,Thu Aug 25 09:38:35 IST 2011,while sandou trio russian bar point move russian bar way would advanc agt
ryanonthego,Thu Aug 25 05:35:48 IST 2011,any two three agt act advanc hard say
ryanonthego,Thu Aug 25 05:33:43 IST 2011,i believ agt act sure advanc tonight
ryanonthego,Thu Aug 25 05:20:44 IST 2011,is anoth cd pike
ryanonthego,Fri Aug 19 05:57:46 IST 2011,made today satisfi blue moon crave i week pick el diablo azul
ryanonthego,Fri Aug 19 05:56:03 IST 2011,final got around get sandwich week i mean last year
ryanonthego,Fri Aug 19 00:33:06 IST 2011,iwishtheywouldbringback the twin tower
ryanonthego,Fri Aug 19 00:29:12 IST 2011,congrat open
ryanonthego,Fri Aug 19 00:26:08 IST 2011,rt rt break refus let constitu offic they shut door face
ryanonthego,Thu Aug 18 10:33:36 IST 2011,thank work hard savekcmetro
ryanonthego,Thu Aug 18 10:32:12 IST 2011,made right decis advanc agt semi
ryanonthego,Thu Aug 18 10:03:48 IST 2011,right landon show magic agt
ryanonthego,Thu Aug 18 10:02:36 IST 2011,landon seth could gone either way great agt
ryanonthego,Thu Aug 18 10:00:34 IST 2011,not surpris kinet king chosen rest group agt
ryanonthego,Thu Aug 18 09:43:52 IST 2011,i would like see yellow design stunt team advanc howev west springfield danc team deserv agt
ryanonthego,Thu Aug 18 09:42:19 IST 2011,out first act chop block tonight agt i thought west springfield danc team vulner
ryanonthego,Thu Aug 18 08:27:03 IST 2011,build second one like ireport for even consid visitng ny tourism purpos need
ryanonthego,Wed Aug 17 03:57:54 IST 2011,sorri loss
ryanonthego,Wed Aug 17 03:57:18 IST 2011,take bank buzz those funni littl peopl within first second act agt
ryanonthego,Mon Aug 15 00:20:38 IST 2011,with tim pawlenti drop race think get nomin btw i share predict tpaw
ryanonthego,Fri Aug 12 11:38:35 IST 2011,rt politico dub mitt conspicu absenc debt negoti protect program http
ryanonthego,Fri Aug 12 11:37:33 IST 2011,rt fact under presid obama seen straight month privat sector job growth
ryanonthego,Fri Aug 12 11:36:05 IST 2011,rt fact call assert obama apolog america fals
ryanonthego,Fri Aug 12 11:35:59 IST 2011,rt fact while romney governor ma econom perform one worst countri
ryanonthego,Fri Aug 12 11:35:39 IST 2011,rt fact check the republican debat via
ryanonthego,Fri Aug 12 11:35:06 IST 2011,rt rt tonight learn republican candid repres singl extrem gop presidenti
ryanonthego,Fri Aug 12 06:20:38 IST 2011,coupl day ago i loos cash i came got best chocol shake citi
ryanonthego,Fri Aug 12 06:18:43 IST 2011,ran i came get mine
ryanonthego,Fri Aug 12 06:13:53 IST 2011,rt today presid obama call congress put countri ahead parti rt agre countrybeforeparti
ryanonthego,Fri Aug 12 06:12:13 IST 2011,romeni day like today unless goe back mit protect program
ryanonthego,Thu Aug 11 10:43:47 IST 2011,
ryanonthego,Thu Aug 11 10:36:03 IST 2011,rt gop approv plummet lowest histori
ryanonthego,Thu Aug 11 10:32:21 IST 2011,out act agt wild card preview show west springfield deserv advanc
ryanonthego,Thu Aug 11 10:31:10 IST 2011,glad see west springfield get anoth chanc good call bring back give anoth shot agt
ryanonthego,Thu Aug 11 10:28:37 IST 2011,that tough call either one two could advanc deserv agt
ryanonthego,Thu Aug 11 10:20:58 IST 2011,compar west springfield danc team beth ann robinson surpris see gabe rock elimin agt
ryanonthego,Thu Aug 11 10:08:07 IST 2011,so far i kevin coli best group deserv advanc agt
ryanonthego,Thu Aug 11 09:57:45 IST 2011,out group matt wilhelm best furthermor perform deserv advanc semi agt
ryanonthego,Thu Aug 11 09:38:01 IST 2011,great see gymkana advanc agt
