username,time,tweet
DJRoberts84,Thu Feb 25 06:20:39 IST 2016,Pretty stoked my name has gone viral on the web. #sarcasm
DJRoberts84,Thu Feb 25 04:07:13 IST 2016,Was able to acquire one of the best albums ever today. Just get it! #shellac #stevealbini #vinyl https://t.co/KHBvQjDnPs
DJRoberts84,Thu Feb 25 02:30:13 IST 2016,"You might think this is a post to apologize for clogging your feed the last hour, but no this is just another post to clog your feed."
DJRoberts84,Thu Feb 25 02:14:23 IST 2016,What a neat day. I never ever get to use the word blustery but alas here we are. It is blustery outside.
DJRoberts84,Thu Feb 25 01:58:48 IST 2016,"Darth: Cool hand, Luke.
Luke: haha good one, dad. https://t.co/iXVCkoI0Gm"
DJRoberts84,Thu Feb 25 01:54:20 IST 2016,I am loving the new Facebook update. The word like has always been way to vague if you ask me which no one did.
DJRoberts84,Thu Feb 25 01:44:37 IST 2016,Ezra > Jake
DJRoberts84,Thu Feb 25 01:43:02 IST 2016,Shout out to 15 second YouTube ads for making me realize I didn’t really want to watch that video anyway
DJRoberts84,Thu Feb 25 01:42:45 IST 2016,RT @michaeljackson: “Thriller” hit #1 on the @Billboard 200 Chart this week in 1983. #MJHistory https://t.co/jGqHUSzbHt
DJRoberts84,Thu Feb 25 01:41:05 IST 2016,RT @samir: Love him or hate him he does have a point here https://t.co/5Lc9Rkxmey
DJRoberts84,Thu Feb 25 01:40:46 IST 2016,RT @kanyewest: Hi Grammys this is the most important living artist talking.
DJRoberts84,Thu Feb 25 01:40:14 IST 2016,RT @kanyewest: The world needs a guy like me. The world needs somebody to not be scared and tell his truth.
DJRoberts84,Thu Feb 25 01:39:03 IST 2016,In exactly 4 months I’ll be on the way to see #Phish in Chicago.
DJRoberts84,Thu Feb 25 01:37:36 IST 2016,RT @thephunion: Does anyone have a goat I can borrow for the Wrigley Field shows?
DJRoberts84,Thu Feb 25 01:36:10 IST 2016,Tom Waits - Kommienezuspadt https://t.co/AmQiTBBx7S
DJRoberts84,Thu Feb 25 00:02:54 IST 2016,"Watch Violent Femmes, Scatting Colbert Perform 'Blister in the Sun' https://t.co/fiJa4fPOc3 via @rollingstone"
DJRoberts84,Wed Feb 24 08:56:26 IST 2016,Don’t use the food pyramid. Pyramids were built by slaves.
DJRoberts84,Wed Feb 24 07:37:33 IST 2016,I think it’s super rad that I can carry a gun into most stores but if I don’t have shoes on I’m screwed.
DJRoberts84,Wed Feb 24 01:17:24 IST 2016,A nice thing about being an adult is that I can practice the pulling the table cloth from the table trick as often as I like.
DJRoberts84,Tue Feb 23 09:18:50 IST 2016,"When I ask someone how they are and they answer, “Can’t complain,” all I can think  is well, that’s one thing I have over you"
DJRoberts84,Tue Feb 23 07:46:16 IST 2016,I was terrible at basketball because whenever I got the ball I’d put it under my shirt and pretend to be pregnant
DJRoberts84,Tue Feb 23 00:34:56 IST 2016,A lot of vacation is looking at photos you just took.
DJRoberts84,Mon Feb 22 11:11:56 IST 2016,You think dogs would never use a phone because there is a pound key on it??? I dunno I’m sleepy
DJRoberts84,Mon Feb 22 08:34:32 IST 2016,"Upon further reflection, I think he WAS sayin’ she a gold digger."
DJRoberts84,Mon Feb 22 07:50:13 IST 2016,"The cemetery is a maze and I was a little lost finding my mother's grave, but I couldn't think… https://t.co/MQZPUgUgQc"
DJRoberts84,Mon Feb 22 06:02:49 IST 2016,"Once a teacher said nobody was buying my cool guy act, but he dropped his clipboard and there was a drawing of me in sunglasses on it."
DJRoberts84,Sun Feb 21 23:08:42 IST 2016,♪♪ Teach me some melodious sonnet; sung by flaming tongues above♪♪ has got to be the coolest line from a church hymn ever.
DJRoberts84,Sun Feb 21 11:46:08 IST 2016,@prodigal_tyler if I had a time machine I’d go big and get a T-Rex then kill baby Hitler
DJRoberts84,Sun Feb 21 11:26:57 IST 2016,"If I was in a room with Trump, Cruz, and Rubio and had a gun with 2 bullets, then that would be the weirdest situation of my life no doubt"
DJRoberts84,Sun Feb 21 11:22:52 IST 2016,"RT @DepressedDarth: ""I bet Voldemort couldn't force choke someone from across the room like my grandfather could"" https://t.co/tYgneBu9i1"
DJRoberts84,Sun Feb 21 10:54:33 IST 2016,Is nyquil  a sedative or apples fortress I say hello
DJRoberts84,Sun Feb 21 07:59:21 IST 2016,Just left the server at Jefferson’s a very large and brightly colored tip.
DJRoberts84,Sun Feb 21 04:39:27 IST 2016,The feels https://t.co/k1g1KmVAgF
DJRoberts84,Sun Feb 21 04:32:51 IST 2016,Saturday Jams.. Panda Bear - Person Pitch (2007) #vinyl https://t.co/AAOex1FLgb
DJRoberts84,Sun Feb 21 02:17:49 IST 2016,"In the 2024 Presidential Election, I'm thinking ""Creepy since 1987"" as my slogan."
DJRoberts84,Sun Feb 21 02:09:00 IST 2016,"Love this outtake from ""Gifted Hands: The Ben Carson Story"" https://t.co/huCEZC39Mw"
DJRoberts84,Sun Feb 21 02:05:54 IST 2016,RT @BuzzFeedAndrew: Cool presidential race FOR ME TO POPE ON https://t.co/sJXo81sYAj
DJRoberts84,Sun Feb 21 02:05:27 IST 2016,RT @markleggett: Hornets are always angry because their fathers were never around.
DJRoberts84,Sun Feb 21 02:03:05 IST 2016,@annajeanelle my condolences...I don't know how to be serious
DJRoberts84,Sun Feb 21 02:01:34 IST 2016,@annajeanelle Is this tweet literal?
DJRoberts84,Sun Feb 21 02:00:59 IST 2016,"RT @LIFECOACHERS: Good day. It is Feb. 20, 2016. Or 1916. We're not sure. Long night. Anyway, if you die today, DIE WELL AND LEAVE PAIN IN …"
DJRoberts84,Sun Feb 21 02:00:13 IST 2016,really looking forward to getting married one day so I can get a joint Facebook account
DJRoberts84,Sun Feb 21 01:08:37 IST 2016,"“Well if my calculations are correct….”

*typed frantically into calculator*

“Yes that does spell Hells Bells upside down”"
DJRoberts84,Sun Feb 21 01:08:14 IST 2016,Sorry for the Valentine being late bb https://t.co/ucDb2TS4u6
DJRoberts84,Sat Feb 20 22:39:46 IST 2016,Just walked in my house and saw this going on. I mean what the h man? https://t.co/jhONguvnLy
DJRoberts84,Sat Feb 20 22:18:15 IST 2016,"RIP Harper Lee. I’m sure she’s playing tambourine in Lemmy, Bowie, and Glenn Frey’s band."
DJRoberts84,Sat Feb 20 11:27:10 IST 2016,"you can lead a horse to water, but you can’t make it break dance without some kind of system of weights and pulleys"
DJRoberts84,Sat Feb 20 07:09:06 IST 2016,The new Animal Collective record samples an episode of The Golden Girls so I’m absolutely sold.
DJRoberts84,Sat Feb 20 07:01:05 IST 2016,Happy 51st birthday to my second favorite drummer behind @bradrobertsau and the coolest man to… https://t.co/bRY2oA0IwZ
DJRoberts84,Sat Feb 20 06:55:28 IST 2016,"Dance like nobody's watching
Sing like nobody's listening
Text like she's not going to take screenshots & make fun of you to all her friends"
