username,time,tweet
SuzanHLindberg,Wed Feb 24 18:55:18 IST 2016,gotradingo you also rock follow unfollow thing nice
SuzanHLindberg,Wed Feb 24 18:49:45 IST 2016,rt why a b test outdat
SuzanHLindberg,Wed Feb 24 12:14:49 IST 2016,the secret mean behind brand logo via
SuzanHLindberg,Tue Feb 23 23:24:57 IST 2016,rt e barometern årsrapport infografik ebarometern ehandel
SuzanHLindberg,Tue Feb 23 23:24:28 IST 2016,
SuzanHLindberg,Tue Feb 23 21:57:35 IST 2016,rt my best rts week came thanksal who
SuzanHLindberg,Tue Feb 23 21:02:32 IST 2016,back work brandmanag lovethisplac
SuzanHLindberg,Tue Feb 23 21:00:08 IST 2016,rt ebarometern påvisar vikten av bra digit närvaro oavsett om du primärt säljer produkt onlin eller afk
SuzanHLindberg,Tue Feb 23 15:42:41 IST 2016,rt welcom initi sap thrill welcometal
SuzanHLindberg,Tue Feb 23 14:01:28 IST 2016,rt den känslan det var int bättre förr
SuzanHLindberg,Tue Feb 23 00:36:23 IST 2016,ball shape samsung gear make easi record vr video priceworthi
SuzanHLindberg,Tue Feb 23 00:30:37 IST 2016,hidden trick make snapchat infinit better via
SuzanHLindberg,Tue Feb 23 00:28:02 IST 2016,snapchat let creat custom geofilt parti wed via
SuzanHLindberg,Tue Feb 23 00:27:02 IST 2016,the galaxi edg help samsung much gear might via
SuzanHLindberg,Tue Feb 23 00:26:05 IST 2016,facebook massiv boost virut realiti video resolut via
SuzanHLindberg,Tue Feb 23 00:25:11 IST 2016,appl fbi drop case let figur digit secur togeth via
SuzanHLindberg,Tue Feb 23 00:24:53 IST 2016,we tri flexibl lcd bracelet geekiest thing ever via
SuzanHLindberg,Tue Feb 23 00:23:04 IST 2016,
SuzanHLindberg,Mon Feb 22 18:17:48 IST 2016,rt hej hej nu finn vi också på sociala medier put first layer
SuzanHLindberg,Mon Feb 22 18:17:34 IST 2016,rt idag skriver om influenc market och vikten av det en läsvärd bloggpost
SuzanHLindberg,Mon Feb 22 18:07:43 IST 2016,ja så bra welcometal
SuzanHLindberg,Mon Feb 22 18:07:13 IST 2016,rt snyggt det här bord såklart fler göra ska definitivt ta upp det internt
SuzanHLindberg,Mon Feb 22 17:19:55 IST 2016,fantast initiativ spotifi welcometal
SuzanHLindberg,Mon Feb 22 14:44:13 IST 2016,rt rt the first suzystip contentmarket imag market communic
SuzanHLindberg,Mon Feb 22 14:17:07 IST 2016,the first suzystip contentmarket imag market communic
SuzanHLindberg,Mon Feb 22 12:55:12 IST 2016,rt hur säljer jag inbound market till min vd inboundmarket
SuzanHLindberg,Mon Feb 22 12:55:00 IST 2016,rt åtta av tio styrelsemedlemmar svenska storföretag saknar digit kompeten bra granskn av
SuzanHLindberg,Sun Feb 21 02:36:23 IST 2016,instagram chang way show amount like like get number name liker tri see
SuzanHLindberg,Sun Feb 21 02:28:52 IST 2016,instagram may rethink show like via
SuzanHLindberg,Sun Feb 21 02:27:58 IST 2016,
SuzanHLindberg,Sun Feb 21 02:26:45 IST 2016,rt some swedish brand determin make posit chang becom movement leader are brandpurpos
SuzanHLindberg,Sun Feb 21 02:26:12 IST 2016,rt why brand must prove purpos beyond profit brandpurpos likeagirl
SuzanHLindberg,Sun Feb 21 02:26:04 IST 2016,rt brandpurpos becom increas import consum take bigger role boardroom
SuzanHLindberg,Sun Feb 21 02:25:51 IST 2016,good hear feel better
SuzanHLindberg,Sun Feb 21 02:25:01 IST 2016,rt the world most innov compani accord fastcompani disrupt
SuzanHLindberg,Sun Feb 21 02:24:25 IST 2016,rt at help start up creat fantast new brand i love
SuzanHLindberg,Sun Feb 21 02:24:15 IST 2016,rt intress mjuka värden blir allt mer efterfrågad som egenskap där generellt kvinnor har styrkor karriär
SuzanHLindberg,Sun Feb 21 02:23:03 IST 2016,how
SuzanHLindberg,Sun Feb 21 02:21:21 IST 2016,rt volvo har aldrig sålt så många bilar vdn vi har ett unikt varumärkeslöft growth
SuzanHLindberg,Sat Feb 20 16:03:12 IST 2016,jag tror dessvärr int det
SuzanHLindberg,Sat Feb 20 04:22:37 IST 2016,here iphon mean via
SuzanHLindberg,Sat Feb 20 04:21:32 IST 2016,volvo new wagon futur hipster car choic via
SuzanHLindberg,Sat Feb 20 04:20:47 IST 2016,u s justic depart file motion compel appl cooper fbi via
SuzanHLindberg,Sat Feb 20 04:20:19 IST 2016,facebook launch new websit help nonprofit master platform via
SuzanHLindberg,Sat Feb 20 02:50:01 IST 2016,meet geekgirl
SuzanHLindberg,Sat Feb 20 02:49:06 IST 2016,rt vad för intress seminarium har jag missat nu
SuzanHLindberg,Sat Feb 20 02:48:56 IST 2016,ett seminarium med och jätteintress mkt snack om content och nativ market
SuzanHLindberg,Fri Feb 19 23:54:44 IST 2016,rt fredagsmi delux trevlig helg
SuzanHLindberg,Fri Feb 19 19:27:31 IST 2016,rt dear sthlmtech friend neighbor i look passion account manag love game dm appli
SuzanHLindberg,Fri Feb 19 18:54:15 IST 2016,startup orb vr music format gfe sthlmtech
