username,time,tweet
DoctorAllen13,Mon Dec 07 09:54:06 IST 2015,two one week good girl real good fuckedup
DoctorAllen13,Wed Nov 11 03:43:20 IST 2015,if boy could suck would awesom
DoctorAllen13,Thu Nov 05 13:18:49 IST 2015,i want girl make knee go weak give better man
DoctorAllen13,Mon Oct 26 07:39:45 IST 2015,catch feel real bad even i sure
DoctorAllen13,Sat Oct 17 13:53:08 IST 2015,yeahhhh probabl tell girl thing kind stuff annoy
DoctorAllen13,Thu Oct 08 10:50:58 IST 2015,when would straight marri boy mormon
DoctorAllen13,Mon Oct 05 11:08:01 IST 2015,we need boy love disney much get excit coupl halloween costum
DoctorAllen13,Fri Sep 25 22:39:04 IST 2015,awhhhh i want someon walk class mani cute coupl campus
DoctorAllen13,Thu Sep 17 04:56:35 IST 2015,having dream regardless time day everyday suppos happen confus
DoctorAllen13,Mon Sep 14 06:33:15 IST 2015,some day day miss everyth ex
DoctorAllen13,Fri Sep 04 13:03:01 IST 2015,i definit type sure good bad one question
DoctorAllen13,Wed Sep 02 08:25:55 IST 2015,this
DoctorAllen13,Thu Aug 27 05:53:48 IST 2015,when feel like actual want talk
DoctorAllen13,Sat Jul 18 02:50:47 IST 2015,when miss one person could let emot tell everyth anymor
DoctorAllen13,Mon Jul 13 05:53:00 IST 2015,never realiz much song relat real life
DoctorAllen13,Tue Jul 07 22:16:44 IST 2015,this actual cutest thing ever
DoctorAllen13,Mon Jun 29 21:24:43 IST 2015,the bad thing tell absolut everyth
DoctorAllen13,Sat Jun 20 11:14:22 IST 2015,current mood
DoctorAllen13,Sat May 23 13:05:16 IST 2015,gdrnibgshjkbyfqpxz you make mad sometim
DoctorAllen13,Sun Apr 19 13:48:52 IST 2015,real talk societi sex becom pass time casualti instead passion relationship
DoctorAllen13,Sun Apr 12 12:19:48 IST 2015,where sweet boy would call extrem drunk tell love talk iwantthatguyback
DoctorAllen13,Sat Apr 04 11:32:33 IST 2015,where julian baker oth menthesedaysarenotthesam
DoctorAllen13,Sun Mar 29 12:13:56 IST 2015,i realli hope appear would extrem sad i would feel sorri
DoctorAllen13,Sun Feb 01 15:06:47 IST 2015,i glad i independ enough brush snow ice car would sure nice boyfriend mancard
DoctorAllen13,Fri Dec 26 13:45:11 IST 2014,never forget real friend cherish stick around
DoctorAllen13,Wed Nov 19 14:01:47 IST 2014,the littl green jealousi monster definit jump back see kind stuff dontforgetm
DoctorAllen13,Thu Nov 13 06:20:28 IST 2014,everi girl want guy put everyth els pedest like princess take bullet thought
DoctorAllen13,Wed Nov 12 04:09:11 IST 2014,if rather speak countri nativ languag english gtfo america wespeakenglish letmeseeyourcitizenship
DoctorAllen13,Thu Oct 30 07:11:48 IST 2014,you truli better half also worst
DoctorAllen13,Mon Oct 13 12:43:35 IST 2014,welp fairi tale short
DoctorAllen13,Mon Oct 13 12:30:57 IST 2014,i give everyth show noth rager
DoctorAllen13,Mon Oct 13 12:29:58 IST 2014,its amaz someon show almost emot someth last long
DoctorAllen13,Mon Oct 13 12:29:10 IST 2014,i hope hit right face realiz lost
DoctorAllen13,Mon Oct 13 12:28:37 IST 2014,pardon rant next coupl day justawarn
DoctorAllen13,Mon Oct 13 08:22:33 IST 2014,byyyyee
DoctorAllen13,Mon Oct 13 06:50:45 IST 2014,hope best prepar absolut worst
DoctorAllen13,Sun Oct 12 09:59:48 IST 2014,you tacki hate
DoctorAllen13,Thu Oct 02 04:36:05 IST 2014,there liter need boyfriend instruct manuel guy like stat
DoctorAllen13,Sun Sep 21 13:55:52 IST 2014,i wish good thing call life a littl green monster call jealousi crawl back see easi come other
DoctorAllen13,Thu Sep 18 08:11:46 IST 2014,if man realli love woman fall weak knee matter love relationshipgo
DoctorAllen13,Thu Sep 04 23:39:43 IST 2014,its freakin weekend
DoctorAllen13,Wed Aug 20 21:36:38 IST 2014,i honest yet find somewher love ijustwanttolovemycolleg
DoctorAllen13,Sun Aug 10 13:37:39 IST 2014,fuuuuck
DoctorAllen13,Sun Aug 10 13:15:29 IST 2014,i serious think cantkeepdoingthistomyself
DoctorAllen13,Sat Jul 19 05:08:15 IST 2014,you love absolut everyth someon love
DoctorAllen13,Sun Jun 29 12:45:45 IST 2014,what go friend gone what go i decid gone
DoctorAllen13,Sun Jun 29 00:50:17 IST 2014,where go what next step happi itsgettingold
DoctorAllen13,Thu Jun 12 13:36:06 IST 2014,yepp
DoctorAllen13,Mon Jun 09 05:27:10 IST 2014,boy live year regardless dorm teach live parent getmeoutofher
DoctorAllen13,Sun Jun 08 10:05:08 IST 2014,this girl may save littl babi africa that great might punch face
