username,time,tweet
leclaireman,Sun Apr 26 05:17:22 IST 2015,i love fact peopl i want talk ignor it make feel warm fuzzi insid sadpanda
leclaireman,Sat Apr 25 09:50:46 IST 2015,the one thing i want life someon want around even talk lone
leclaireman,Sat Apr 25 02:54:00 IST 2015,rt rt chanc win wooden crate print bad robot workshop
leclaireman,Fri Apr 24 11:06:09 IST 2015,
leclaireman,Thu Apr 23 20:07:59 IST 2015,who ever wrote stick stone may break bone word never hurt complet idiot word weapon word
leclaireman,Thu Apr 23 08:03:06 IST 2015,rt if i date goal marri build grow date pass time see
leclaireman,Mon Apr 20 08:36:26 IST 2015,heartach fun said mass i hate lone meh lifesuck
leclaireman,Mon Apr 20 07:25:19 IST 2015,that sound yummi now i want
leclaireman,Sun Apr 19 06:57:58 IST 2015,yummi goodfood chinesefood tacobel bajablast freez
leclaireman,Sun Apr 19 06:51:35 IST 2015,my life miss thing make life special i hope i find soon sadpanda depress fightforfutur love
leclaireman,Sat Apr 18 00:24:29 IST 2015,rt for jedi padawn alik check starwarsbattlefront reveal trailer swca
leclaireman,Fri Apr 17 00:21:13 IST 2015,rt just debut suspens new teaser theforceawaken swca
leclaireman,Tue Apr 14 23:54:28 IST 2015,rt rt follow chanc win box sign one random winner chosen
leclaireman,Tue Apr 14 05:31:52 IST 2015,dear we need hour news a half hour need i guess much better epicfail
leclaireman,Tue Apr 14 04:25:04 IST 2015,if want current polit vote want someth better vote republican
leclaireman,Mon Apr 13 20:59:45 IST 2015,dear your movi unfriendedmovi look unbeliev bad the whole concept film stupid epicfail
leclaireman,Mon Apr 13 08:39:09 IST 2015,my biggest wish life want someon right i think ever happen lifesuck
leclaireman,Fri Apr 10 06:38:05 IST 2015,i thought might interest
leclaireman,Sat Apr 04 04:22:06 IST 2015,dear custom what make think put dirti plant checkstand belt smart retailproblem
leclaireman,Sat Apr 04 03:15:22 IST 2015,dear custom organ food better expens retail corporategre
leclaireman,Sat Apr 04 00:19:53 IST 2015,never get excit disappoint i sometim wish life would bring joy i rememb life hate
leclaireman,Wed Mar 25 04:47:10 IST 2015,i hope go show love put dlc xbox first big fuck fan
leclaireman,Mon Mar 23 20:52:17 IST 2015,thank make ultimatemarvelmarathon avail fan west coast specif oregon fail
leclaireman,Thu Mar 19 23:39:26 IST 2015,why mosaic piec glitch hinterland fix yet
leclaireman,Wed Mar 18 23:29:42 IST 2015,dear custom why go complet side store cash bottl return closer place retailproblem
leclaireman,Tue Mar 17 23:14:31 IST 2015,rt do pdt legal stuff here each prize usd winner local
leclaireman,Tue Mar 17 23:11:43 IST 2015,rt st day tweepstak rt fill survey follow us chanc currenc code
leclaireman,Sun Mar 15 23:10:25 IST 2015,dear custom just cloth bag mean better everyon your douch retailproblem douch
leclaireman,Sat Mar 14 19:42:41 IST 2015,happi π day everyon piday onceinalifetim
leclaireman,Fri Mar 13 02:45:09 IST 2015,dear custom one thing i love expect hand money think give courtesi retailproblem
leclaireman,Fri Mar 13 02:35:54 IST 2015,dearest custom i magic abil call count retailproblem facepalm
leclaireman,Wed Mar 11 09:48:23 IST 2015,i sooooooo impress applewatch way expens and commerci way long
leclaireman,Sat Mar 07 08:21:21 IST 2015,attent custom cashier bore lone sleepi but fact realli annoy assumpt retailproblem
leclaireman,Fri Mar 06 11:35:52 IST 2015,i wonder kany thought lol
leclaireman,Fri Mar 06 11:31:33 IST 2015,she probabl public lol
leclaireman,Fri Mar 06 11:23:28 IST 2015,lol yeah hair colour look horribl i think look good
leclaireman,Fri Mar 06 10:40:06 IST 2015,rt let addict
leclaireman,Fri Mar 06 10:40:01 IST 2015,rt i wast lot time wrong peopl
leclaireman,Fri Mar 06 09:52:52 IST 2015,my depart given greatest news gotten long a new manag praiseth lord retail badmanag
leclaireman,Tue Mar 03 05:51:41 IST 2015,don ask cashier alseep stand around it like heard retailproblem
leclaireman,Mon Mar 02 10:57:03 IST 2015,rt everi singl person planet stori don judg peopl truli know
leclaireman,Sun Mar 01 10:49:56 IST 2015,for peopl shop retail pleas expect peopl help emotionless robot retailproblem
leclaireman,Sat Feb 28 12:48:26 IST 2015,rt a life like garden perfect moment preserv except memori llap
leclaireman,Sat Feb 28 08:01:57 IST 2015,r i p you brought joy mani peopl around world now celebr life morn death thank
leclaireman,Sat Feb 21 09:08:47 IST 2015,rt rt chanc win robot patch made bad robot workshop
leclaireman,Mon Feb 02 00:17:07 IST 2015,go seahawk superbowlxlix seahawk wtd
leclaireman,Tue Jan 27 11:11:04 IST 2015,well i guess good excus xd so nike
leclaireman,Tue Jan 27 10:56:11 IST 2015,saturday lol
leclaireman,Tue Jan 27 10:53:25 IST 2015,so i notic made mom shop self yesterday xd
leclaireman,Sat Jan 17 06:11:06 IST 2015,rt rt chanc win shirt made bad robot workshop plus calendar winner pick
