username,time,tweet
Ariffrsix,Sat Nov 14 08:13:23 IST 2015,press and hold all your phone buttons to deploy nuke  
Ariffrsix,Sat Nov 14 08:03:46 IST 2015,rt monitor franceparis terror attack summary- 6 locations attacked- 158 dead- 4 police officers dead - 5 terrorists killed-…
Ariffrsix,Sat Nov 14 08:00:25 IST 2015,terrorists always terroristregardless their race n religiondont simply accusing islameven white ppl hve their own historyprayforparis
Ariffrsix,Fri Nov 13 23:34:34 IST 2015,kalau facebook pun bole switch2 account mesti gempak
Ariffrsix,Fri Nov 13 21:39:52 IST 2015,i bet this time hes gonna win an oscar 😂 
Ariffrsix,Fri Nov 13 21:34:25 IST 2015,dan yang reti acah2 jai kl gangster syerramm nihh  kahh 
Ariffrsix,Fri Nov 13 21:31:03 IST 2015, tiqah ngn zfirah kos sme yg lain2 kos lain haha
Ariffrsix,Fri Nov 13 21:25:42 IST 2015,true 
Ariffrsix,Fri Nov 13 21:22:03 IST 2015, atiqah dgn zafirah hahaa budak2 klas lain pun ade jgop
Ariffrsix,Fri Nov 13 21:19:48 IST 2015,bilalah internet kt malaysia ni nk cpai 100mbps　　　∧∧　　 　･ω･　　 ＿|　⊃／＿＿／　└-＿＿＿／￣￣￣￣￣￣￣tidur jelah　＜⌒／ヽ-､＿／＜/＿＿＿＿／￣￣￣￣￣￣
Ariffrsix,Fri Nov 13 21:17:20 IST 2015, makan shawarma la bruh keh3
Ariffrsix,Fri Nov 13 21:11:49 IST 2015,  cewahh
Ariffrsix,Fri Nov 13 21:08:17 IST 2015, hahaxdepe nk djeles pun biasa je sni unikl pun citycampus takde feel campus mcm ipta lenbtwjauh pjlann luas pndgn haha
Ariffrsix,Fri Nov 13 21:03:13 IST 2015,farahana hahaa tula psal
Ariffrsix,Fri Nov 13 21:01:37 IST 2015,dalam banyak-2 sudut sastera melayu klasik aku suka baca hikayat je sebab gaya bahasa dan storyline die best macam filem hero tamil
Ariffrsix,Fri Nov 13 20:58:41 IST 2015,  bukan contest ape  tapi apa dia punya hadiah hahaha
Ariffrsix,Fri Nov 13 20:56:38 IST 2015,farahana hahaha kan nmpak sgt bru smlam makan budu  kopok keh3well ak pun xpandi kecek gakhuhu
Ariffrsix,Fri Nov 13 20:54:44 IST 2015,bro  sis sekalian tlong jgn layan mamat alvin chipmunk ni so that dia tkde reason utk dpt suaka politik lagitq 
Ariffrsix,Fri Nov 13 20:51:32 IST 2015, haha yep2 nasib la dpt sni mlas nk blaja jauh2haha ouh yeke uyue study mne skrg
Ariffrsix,Fri Nov 13 20:48:25 IST 2015, eyhh takde la i unikl lar unikl where knowledge applied takde pun mmg slama ni pun ak duk ulang alik rumah-kampus
Ariffrsix,Fri Nov 13 20:46:10 IST 2015, skrg yela kot nnti da kawen bole mintak somi yg pegang kan hahaok tgn comel
Ariffrsix,Fri Nov 13 20:44:31 IST 2015, safe travel 👌
Ariffrsix,Fri Nov 13 20:41:43 IST 2015, prmpuan xpe fon beso2 bole simpan dlm handbag klu laki stakat 48-55 inch dah la hahaha
Ariffrsix,Fri Nov 13 20:37:43 IST 2015,huzairy kah3 dey whos dat anjali
Ariffrsix,Fri Nov 13 20:35:11 IST 2015, hahaaxpe mana2 je cume nk ckp iphone lgi best klu skrin beso dats y ak pki samsung skrin beso super amoled lgi kikiki
Ariffrsix,Fri Nov 13 20:32:43 IST 2015,farahana hahaa tula nora danish pun gigih betul kecek ganu
Ariffrsix,Fri Nov 13 20:10:45 IST 2015,  bulus dia lawaa haha
Ariffrsix,Fri Nov 13 20:08:38 IST 2015,rt  hangpa tanya jamil khir and cakap dia salah guna so dia katalah dia pi official trip tapi cuba tanya awat mahal sangat t…
Ariffrsix,Fri Nov 13 20:06:11 IST 2015,rt  harapnya star wars dengan warcraft tak mengecewakan especially warcraft
Ariffrsix,Fri Nov 13 20:05:01 IST 2015, amik 6 terus reason skrin beso hahaa
Ariffrsix,Fri Nov 13 20:00:12 IST 2015,farahana terbaik haha
Ariffrsix,Fri Nov 13 19:57:06 IST 2015,rt  if youre smart you know a lot if youre wise you know all you know is a little - 
Ariffrsix,Fri Nov 13 19:56:55 IST 2015,done download god of war 3iso ps3 skrang tggal ps3 emulator je sape tau mana2 emulator yg working share link pleaseee tq
Ariffrsix,Fri Nov 13 15:35:24 IST 2015,rt  naper yang pegang buku tu plak nampak jahat  
Ariffrsix,Fri Nov 13 07:11:35 IST 2015,there there
Ariffrsix,Fri Nov 13 07:11:00 IST 2015,too much bacon consumed fked as hell 
Ariffrsix,Fri Nov 13 07:05:07 IST 2015,bila hari kelas biasa  syahdu je kelastapi bile time ada test  yg muka tak pernah nmpak pun ada dlm kelas haha
Ariffrsix,Fri Nov 13 06:59:04 IST 2015, kemah bohh
Ariffrsix,Fri Nov 13 06:58:29 IST 2015,grrr geram nyaaa
Ariffrsix,Fri Nov 13 06:57:48 IST 2015,sentiasa mengingatinya walau di mana jua anda berada 
Ariffrsix,Fri Nov 13 06:55:15 IST 2015,statistic class now apak bosan
Ariffrsix,Fri Nov 13 06:49:32 IST 2015,rt  what i want right now 😍 
Ariffrsix,Fri Nov 13 06:33:48 IST 2015,rt 9gagtweets you guys should practice at home - topgif by 9gaggifs 
Ariffrsix,Thu Nov 12 22:01:56 IST 2015,kool and gang // hollywood swinging epic game sound track np 
Ariffrsix,Thu Nov 12 20:50:37 IST 2015,
Ariffrsix,Thu Nov 12 20:01:40 IST 2015,rt  fake people have an image to maintain real people just dont care anon 
Ariffrsix,Thu Nov 12 16:29:03 IST 2015,rt  
Ariffrsix,Thu Nov 12 16:27:23 IST 2015,  dia jdi mcm ni psal korg gigih lyan dia klau korg buat dek je gerenti dia pishang dahla dia mental barai lol
Ariffrsix,Thu Nov 12 16:24:57 IST 2015,rt 9gaggifs dont be such a pussy 
