username,time,tweet
wyndall93,Thu Feb 25 01:56:44 IST 2016,whaa but follow polici letter gray area nextchat
wyndall93,Thu Feb 25 01:55:59 IST 2016,nextchat hardest part need keep remind supervisor some better other
wyndall93,Thu Feb 25 01:54:46 IST 2016,hello nextchat
wyndall93,Thu Feb 25 01:53:46 IST 2016,congrat phd
wyndall93,Thu Feb 25 01:52:39 IST 2016,current ee tri new allergi med could take care situat we public cannot tell other peanut
wyndall93,Thu Feb 25 01:50:19 IST 2016,nextchat phone call goe long way
wyndall93,Thu Feb 25 01:49:05 IST 2016,nextchat yes have remind sup make call
wyndall93,Thu Feb 25 01:47:16 IST 2016,allergi peanut allergi accommod came across desk nextchat
wyndall93,Thu Feb 25 01:45:55 IST 2016,rt rememb nextchat
wyndall93,Thu Feb 25 01:44:01 IST 2016,nextchat need help supervisor convers other think fair
wyndall93,Thu Feb 25 01:41:33 IST 2016,put togeth train reason accommod supervisor reason nextchat
wyndall93,Thu Feb 25 01:40:12 IST 2016,nextchat first choic probabl lot reason think
wyndall93,Thu Feb 25 01:39:19 IST 2016,nextchat talk employe assum worst think need fair staff
wyndall93,Thu Feb 25 01:37:22 IST 2016,hi glad made nextchat importanttop
wyndall93,Thu Feb 25 01:36:43 IST 2016,nextchat assum know go ask amaz happen talk
wyndall93,Thu Feb 25 01:35:15 IST 2016,rt and particular case hidden disabl much challeng
wyndall93,Thu Feb 25 01:34:31 IST 2016,nextchat talk employe need help
wyndall93,Thu Feb 25 01:16:22 IST 2016,check train session this one work right offic
wyndall93,Thu Feb 25 01:06:15 IST 2016,anoth chat i need check lovetwitterchat
wyndall93,Thu Feb 25 01:05:02 IST 2016,i never understood say probabl babi rare slept
wyndall93,Thu Feb 25 00:14:07 IST 2016,thank perkinsrestaurantandbakeri discount lunch
wyndall93,Wed Feb 24 22:16:57 IST 2016,those complain usual work least sotru letmemakealist
wyndall93,Wed Feb 24 22:09:55 IST 2016,the dailey journey bear fruit lentpray
wyndall93,Wed Feb 24 20:32:07 IST 2016,my fitbit step mile travel
wyndall93,Wed Feb 24 20:12:45 IST 2016,rt meet peopl not want coach
wyndall93,Wed Feb 24 20:12:32 IST 2016,rt the reason behind good wednesday day do work hr connect shrm
wyndall93,Wed Feb 24 20:11:47 IST 2016,rt if effect communic listen divert attent communic method text
wyndall93,Wed Feb 24 20:10:41 IST 2016,rt nextchat accommod disabl workplac today et ada
wyndall93,Wed Feb 24 18:22:01 IST 2016,hashtag question want use interview train whatnottodo
wyndall93,Wed Feb 24 03:00:19 IST 2016,rt kid these day
wyndall93,Tue Feb 23 23:42:03 IST 2016,i way exercis total run
wyndall93,Tue Feb 23 18:13:58 IST 2016,hope i find time get tomorrow train sell cooki
wyndall93,Tue Feb 23 16:34:51 IST 2016,my fitbit step mile travel
wyndall93,Tue Feb 23 00:39:15 IST 2016,i invit join run group whathaveidon
wyndall93,Tue Feb 23 00:23:09 IST 2016,i way exercis total run
wyndall93,Mon Feb 22 17:43:32 IST 2016,via
wyndall93,Mon Feb 22 14:36:53 IST 2016,my fitbit step mile travel
wyndall93,Mon Feb 22 08:08:38 IST 2016,rt the i read bibl i tri follow jesus i find becom deepli radic
wyndall93,Mon Feb 22 08:07:29 IST 2016,thank go well we want check servic need get littl earlier
wyndall93,Sun Feb 21 18:38:56 IST 2016,lot lot step yesterday wonder girl tire
wyndall93,Sun Feb 21 13:34:53 IST 2016,my fitbit step mile travel
wyndall93,Sun Feb 21 08:08:30 IST 2016,themuppetmov they look like presbyterian
wyndall93,Sun Feb 21 06:19:00 IST 2016,girlscout cooki wine pair sauvignon blanc lemonad yum
wyndall93,Sun Feb 21 04:06:13 IST 2016,how say face buysomecooki girlscout
wyndall93,Sun Feb 21 03:58:28 IST 2016,come see us walmart pick girlscout cooki today
wyndall93,Sat Feb 20 14:33:20 IST 2016,my fitbit step mile travel
wyndall93,Sat Feb 20 05:59:22 IST 2016,more cooki girlscout cookieboss flandreau indian school
wyndall93,Fri Feb 19 22:43:05 IST 2016,thank steve love find new peep follow
wyndall93,Fri Feb 19 19:40:38 IST 2016,gotta love assist bring breakfast friday morn tgif
wyndall93,Fri Feb 19 17:33:22 IST 2016,my fitbit step mile travel
