username,time,tweet
EveryDayDavid,Fri May 08 06:16:33 IST 2015,high qualiti vine ripen tomato
EveryDayDavid,Fri May 08 05:20:51 IST 2015,
EveryDayDavid,Fri May 08 04:45:38 IST 2015,found beagl lay bed
EveryDayDavid,Fri May 08 01:44:39 IST 2015,youtub channel come soon
EveryDayDavid,Mon May 04 22:45:56 IST 2015,get readi shoot documentari wed
EveryDayDavid,Mon May 04 07:58:08 IST 2015,look super nice need pictur wall i send one put
EveryDayDavid,Mon Apr 27 19:20:35 IST 2015,let work togetherrrrrrrrrrrrrrrrrrrrrrrrrrrrr
EveryDayDavid,Mon Apr 27 12:24:50 IST 2015,tow got stick floor tile came rip skin it nice size chuck
EveryDayDavid,Mon Apr 27 12:19:46 IST 2015,on way bed i trip skin tow hurt bad
EveryDayDavid,Sat Apr 25 07:41:55 IST 2015,new websit i hate wait month googl index site time manner
EveryDayDavid,Sat Apr 25 01:36:58 IST 2015,googl index page websit way go googl
EveryDayDavid,Fri Apr 24 22:07:19 IST 2015,rt
EveryDayDavid,Fri Apr 24 20:44:18 IST 2015,googl map android pee appl
EveryDayDavid,Thu Apr 23 23:40:33 IST 2015,i think i seen origin work i wait see
EveryDayDavid,Thu Apr 23 09:53:26 IST 2015,nice
EveryDayDavid,Thu Apr 23 04:35:26 IST 2015,so i guess thing what worst could happen
EveryDayDavid,Thu Apr 23 01:25:19 IST 2015,what homeless gave money that guy want find video go viral
EveryDayDavid,Wed Apr 22 23:00:52 IST 2015,we miss
EveryDayDavid,Wed Apr 22 20:25:41 IST 2015,rt person studi no link mmr autism now antivax nutter apologis pain suffer caus http
EveryDayDavid,Wed Apr 22 11:09:32 IST 2015,and tonight i leav
EveryDayDavid,Wed Apr 22 04:25:19 IST 2015,a trooper found bloodi band aid bake biscuit cookevill
EveryDayDavid,Tue Apr 21 19:15:42 IST 2015,tame impala new fave band listen work
EveryDayDavid,Tue Apr 21 09:56:07 IST 2015,when realiz pm yet eat dinner got hour ago work
EveryDayDavid,Sat Apr 18 21:45:41 IST 2015,space unicorn
EveryDayDavid,Sat Apr 18 00:15:30 IST 2015,i wish i good artist guy
EveryDayDavid,Fri Apr 17 21:05:55 IST 2015,i lot fave cartoon right mlp stephen univers as older cartoon lot
EveryDayDavid,Fri Apr 17 00:35:49 IST 2015,so much write work get done today i best write i realli need find someon help
EveryDayDavid,Tue Apr 14 12:25:52 IST 2015,someon rang door bell am scare end guy live across let know car open how nice
EveryDayDavid,Tue Apr 14 09:32:43 IST 2015,thing i gotten done today tax spent lot money pay tax spent money file tax
EveryDayDavid,Tue Apr 14 03:35:27 IST 2015,i want travel japan week mayb i abl soon
EveryDayDavid,Mon Apr 13 02:03:10 IST 2015,that littl i done today
EveryDayDavid,Mon Apr 13 00:41:39 IST 2015,how everyon sunday
EveryDayDavid,Thu Apr 09 23:28:34 IST 2015,it hot i got portibl ac unit place vent i vent hous air intak
EveryDayDavid,Thu Apr 09 19:30:32 IST 2015,feel littl better sick today get stuff done
EveryDayDavid,Tue Apr 07 02:01:52 IST 2015,sorri hear i sick day stomach bug
EveryDayDavid,Tue Apr 07 00:24:58 IST 2015,i sick day unabl get much done
EveryDayDavid,Sun Apr 05 06:29:38 IST 2015,go check happi easter broni
EveryDayDavid,Sun Apr 05 06:24:36 IST 2015,i love littl darker episod still fun
EveryDayDavid,Sat Apr 04 04:19:53 IST 2015,my phone notifi tornado area travel speed mph
EveryDayDavid,Fri Apr 03 06:16:50 IST 2015,i hate come name stuff
EveryDayDavid,Mon Mar 30 05:15:01 IST 2015,well
EveryDayDavid,Sun Mar 29 01:19:26 IST 2015,love art
EveryDayDavid,Sat Mar 28 00:09:21 IST 2015,rt we proud announc dr patrick edward broni studi latest special guest
EveryDayDavid,Sat Mar 28 00:09:17 IST 2015,rt shutout newest member staff help art con check work
EveryDayDavid,Sat Mar 28 00:08:31 IST 2015,having slight bad day what
EveryDayDavid,Wed Mar 25 18:56:39 IST 2015,look like tri make comeback that one site i year
EveryDayDavid,Tue Mar 24 22:35:47 IST 2015,if need websit made great web host check busi
EveryDayDavid,Mon Mar 23 18:11:06 IST 2015,i give much get booth tri realli hard deserv
EveryDayDavid,Mon Mar 23 06:02:04 IST 2015,woot
EveryDayDavid,Sun Mar 22 08:02:36 IST 2015,work account fun
