username,time,tweet
FinancialPR,Mon Feb 29 21:24:57 IST 2016,wait mean i need content market strategi
FinancialPR,Fri Feb 19 23:35:25 IST 2016,and right no reason i could never celebr pr
FinancialPR,Fri Feb 19 18:28:37 IST 2016,there way judg viabil instantan they take time effort fintech
FinancialPR,Fri Feb 19 03:32:27 IST 2016,interest stori i love cheap jersey gas much i love get stay warm car someon els pump
FinancialPR,Fri Feb 19 02:07:58 IST 2016,rt pitch tip mimic target public write style headlin subject line realworldpr
FinancialPR,Thu Feb 18 22:20:36 IST 2016,nice piec we celebr fairfield counti grow tech scene
FinancialPR,Wed Feb 17 21:22:17 IST 2016,peopl skill
FinancialPR,Wed Feb 17 21:03:11 IST 2016,yes video import part pr plan here
FinancialPR,Wed Feb 17 18:47:15 IST 2016,should declin circul make think differ emphasi media relat i think pr
FinancialPR,Wed Feb 17 18:45:01 IST 2016,great articl i complet agre media relat smaller part pr communic
FinancialPR,Wed Feb 17 18:37:04 IST 2016,rt how make email introduct ruin both live jobhunt email
FinancialPR,Wed Feb 17 02:29:06 IST 2016,haha my insur compani made pull away vine ivi etc hous chimney now i realiz right
FinancialPR,Wed Feb 17 01:11:48 IST 2016,like kany plea zuckerberg twtr instead fb anoth reason know audienc fail
FinancialPR,Tue Feb 16 23:46:26 IST 2016,rt how give perform review
FinancialPR,Tue Feb 16 23:08:29 IST 2016,it consum brand use social engag influenc look continu innov
FinancialPR,Tue Feb 16 19:42:29 IST 2016,i amus rush contentmarket i start late long trendi buzzword
FinancialPR,Tue Feb 16 19:25:58 IST 2016,financi servic compani natur contentmarket don let wall pr advertis hold back
FinancialPR,Tue Feb 16 19:20:35 IST 2016,contentmarket new advertis brand invest storytel wield creativ asset
FinancialPR,Tue Feb 16 19:17:21 IST 2016,great articl
FinancialPR,Tue Feb 16 18:56:44 IST 2016,love posit outlook you inspir
FinancialPR,Mon Feb 15 22:56:13 IST 2016,this sad commentari life us journal
FinancialPR,Mon Feb 15 22:43:09 IST 2016,storytel import pr advertis be authent includ emot compon reson w target audienc
FinancialPR,Mon Feb 15 22:42:19 IST 2016,have agenc abus term storytel interview via
FinancialPR,Wed Feb 10 20:54:21 IST 2016,rt kid westchest came hear transcript mendelssohn octet morn i https
FinancialPR,Wed Feb 10 20:53:47 IST 2016,wonder meet yesterday thank part music educ program musicmatt
FinancialPR,Wed Feb 10 20:51:34 IST 2016,rt a heartfelt thank marvel rendit mendelssohn octet transcript https
FinancialPR,Wed Feb 10 20:51:04 IST 2016,rt some pic sunday concert w
FinancialPR,Sat Feb 06 20:28:48 IST 2016,i alreadi see promot tweet i want pleas chang riptwitt
FinancialPR,Fri Feb 05 20:12:13 IST 2016,are best employe burn
FinancialPR,Fri Feb 05 19:56:43 IST 2016,let peopl outsid compani read press releas public ensur messag clear effect pr groupthink
FinancialPR,Fri Feb 05 19:30:37 IST 2016,it funni yet tragic media urg us gov agenc write better press releas pr
FinancialPR,Thu Feb 04 23:49:42 IST 2016,yup that good contentmarket
FinancialPR,Thu Feb 04 23:46:47 IST 2016,is yahoo wrong ignor rumor million holiday parti no but corpor excess often bring bad pr
FinancialPR,Wed Feb 03 02:21:24 IST 2016,hope finger point good pr strategi before make major chang talk like outcom
FinancialPR,Mon Dec 21 23:02:30 IST 2015,wonder perform yesterday possibl best holiday concert i seen
FinancialPR,Mon Oct 12 20:09:07 IST 2015,rt learn har potenti talent pipelin recruit retir
FinancialPR,Mon Oct 12 19:27:44 IST 2015,rt we wish canadian friend happi thanksgiv day thanksgivingcanada
FinancialPR,Mon Oct 12 19:25:29 IST 2015,congrat new posit fortun aboard client grate well
FinancialPR,Thu Oct 08 01:11:11 IST 2015,consum behavior hard predict seem like big miss
FinancialPR,Fri Oct 02 20:24:09 IST 2015,congrat great event
FinancialPR,Wed Sep 30 22:57:31 IST 2015,the pr fallout wider vw articl show it impact everi busi govern
FinancialPR,Wed Sep 30 22:50:13 IST 2015,congrat newest partner hope meet soon
FinancialPR,Mon Sep 21 01:08:33 IST 2015,i blown away talent
FinancialPR,Mon Sep 21 01:08:10 IST 2015,rt aaaaaaaamaz talent display stamfordhackathon today right
FinancialPR,Mon Sep 21 01:07:26 IST 2015,rt how respond misinfo twitter silenc worst thing allow convers
FinancialPR,Sat Sep 19 04:58:15 IST 2015,fascin talk steven adler opendata stamfordhackathon
FinancialPR,Fri Sep 18 19:13:45 IST 2015,look forward stamfordhackathon weekend go iot virtualr opendata
FinancialPR,Tue Sep 15 00:46:22 IST 2015,rt great opportun ub ubsinnov
FinancialPR,Tue Sep 15 00:36:19 IST 2015,rt the skill content market need order becom true media profession
FinancialPR,Tue Sep 15 00:02:37 IST 2015,pleasur talk today look forward meet soon
