username,time,tweet
Paow_22,Fri Feb 26 08:27:48 IST 2016,i know right live global warn
Paow_22,Fri Feb 26 08:26:54 IST 2016,
Paow_22,Fri Feb 26 08:23:08 IST 2016,rt yeah huh suree trump honest gopdeb iagreebutstil
Paow_22,Fri Feb 26 08:18:10 IST 2016,kasich carson speak less make point interest gopdeb
Paow_22,Fri Feb 26 08:15:48 IST 2016,logo etho patho health care plan kasich plan super thorough pleas repulican nomin gopdeb
Paow_22,Fri Feb 26 08:12:51 IST 2016,trump appeal ignor gopdeb
Paow_22,Fri Feb 26 08:08:18 IST 2016,i spi i spec violat lovethi
Paow_22,Fri Feb 26 08:05:41 IST 2016,bencarson weakanalog gopdeb
Paow_22,Fri Feb 26 08:04:49 IST 2016,the moder cxclarif question gopdeb
Paow_22,Fri Feb 26 08:02:05 IST 2016,rt where ben carson
Paow_22,Fri Feb 26 08:01:56 IST 2016,rubio it obama job replac scolia follow constitut origin intent gopdeb
Paow_22,Fri Feb 26 07:59:09 IST 2016,when commerci ineedabreak gopdeb
Paow_22,Fri Feb 26 07:56:57 IST 2016,cruz suprem justic suppos pocket suppos uphold constitut gopdeb
Paow_22,Fri Feb 26 07:55:38 IST 2016,rt cruz ever consid mayb view constitut
Paow_22,Fri Feb 26 07:50:53 IST 2016,carson pivot question turn question favor gopdeb
Paow_22,Fri Feb 26 07:48:40 IST 2016,rt ted cruz want equal fair chanc success us hispan statement lil broad
Paow_22,Fri Feb 26 07:45:23 IST 2016,rubio fact run presid effect valu idea gopdeb
Paow_22,Fri Feb 26 07:41:55 IST 2016,i agre also part reason obama need mani execut order
Paow_22,Fri Feb 26 07:38:00 IST 2016,if american govn make trade stop mexican govn gopdeb trump
Paow_22,Fri Feb 26 07:36:00 IST 2016,where proof trump the mexican presid necessarili say tv gopdeb
Paow_22,Fri Feb 26 07:32:40 IST 2016,kasich respons realist view immigr solut i hope we built immigr gopdeb
Paow_22,Fri Feb 26 07:29:11 IST 2016,i seen video i consid lol
Paow_22,Fri Feb 26 07:28:07 IST 2016,fidget bad rubio like talk class
Paow_22,Fri Feb 26 07:26:29 IST 2016,when presidenti candid argu wors sibl imscar gopdeb
Paow_22,Fri Feb 26 07:24:02 IST 2016,yasss
Paow_22,Fri Feb 26 07:18:12 IST 2016,we win anymor countri donald j trump as countri us succeed rest world gopdeb
Paow_22,Fri Feb 26 07:15:37 IST 2016,kasich even address anyth polit niceintro gopdeb
Paow_22,Fri Feb 26 07:07:17 IST 2016,i live tweet gopdeb sorri crowd feed school
Paow_22,Mon Dec 21 08:42:25 IST 2015,nyc forev heart new york citi
Paow_22,Fri Jul 24 23:23:57 IST 2015,allstar vs staff game coachingsquad truefriend
Paow_22,Wed Jul 08 18:42:49 IST 2015,just post photo
Paow_22,Sun Mar 29 18:47:53 IST 2015,taken cnn snapchat channel
Paow_22,Tue Mar 24 06:58:56 IST 2015,pleas sign site look scholarship use link help earn money thank
Paow_22,Sat Mar 21 23:06:36 IST 2015,rt pretti much sum entir generat idea date love
Paow_22,Sat Mar 21 23:03:34 IST 2015,rt cuando termina los examen
Paow_22,Thu Mar 05 02:05:13 IST 2015,this kahlúa cuti island
Paow_22,Fri Feb 13 18:46:20 IST 2015,rt i best pre valentin day breakfast chickfila chickfilasauc heart vday
Paow_22,Thu Feb 12 22:34:04 IST 2015,memori past
Paow_22,Thu Feb 12 01:44:20 IST 2015,just post photo a clear world
Paow_22,Thu Feb 05 20:43:29 IST 2015,nomin beauti
Paow_22,Thu Jan 01 03:18:04 IST 2015,here to friend old new i love to famili i love even
Paow_22,Sat Dec 27 08:16:27 IST 2014,just post photo w littl black dress
Paow_22,Thu Dec 25 10:30:21 IST 2014,happi birthday mami and merri christma christma lane
Paow_22,Fri Nov 28 10:30:07 IST 2014,happi birthday best sister i love much we go
Paow_22,Fri Nov 14 10:09:45 IST 2014,there final like scandal winter final scandalabc tgit
Paow_22,Sun Nov 02 03:43:25 IST 2014,pirat eye
Paow_22,Sun Oct 19 00:57:14 IST 2014,yay final fordfocus mine fitzgerald
Paow_22,Thu Oct 09 01:02:51 IST 2014,i artist art sociolog build
Paow_22,Sat Oct 04 06:34:08 IST 2014,my fierc attack dog lol casa fuster
