username,time,tweet
Gods_Warrior82,Fri Jun 26 19:29:46 IST 2015,i love pajama pant leg get caught drawer knob i hurt knee ouch
Gods_Warrior82,Thu Jun 25 22:40:20 IST 2015,i listen widow phone tweet
Gods_Warrior82,Thu Jun 25 20:06:58 IST 2015,mornin
Gods_Warrior82,Thu Jun 25 08:39:15 IST 2015,i sleepi pleas wish goodnight say goodnight kati to
Gods_Warrior82,Wed Jun 24 09:22:44 IST 2015,neither i prefer countri lol
Gods_Warrior82,Wed Jun 24 08:27:19 IST 2015,who favorit artist musician letsstopher
Gods_Warrior82,Wed Jun 24 08:26:23 IST 2015,i i got back vbs church
Gods_Warrior82,Wed Jun 24 06:28:29 IST 2015,i love vbs church bless
Gods_Warrior82,Wed Jun 24 03:19:39 IST 2015,first five emoji think pleas repli justcuri
Gods_Warrior82,Wed Jun 24 03:15:29 IST 2015,bulli letsstopher
Gods_Warrior82,Wed Jun 24 03:11:02 IST 2015,
Gods_Warrior82,Wed Jun 24 02:59:03 IST 2015,know would nice see make appear fashion week he awesom dude nofw
Gods_Warrior82,Tue Jun 23 09:48:04 IST 2015,practic theme night church camp next month gonna involv sing imasurvivor love reba
Gods_Warrior82,Tue Jun 23 09:23:23 IST 2015,awwww love
Gods_Warrior82,Tue Jun 23 08:26:39 IST 2015,rt my friend i made father day video last year hold
Gods_Warrior82,Mon Jun 22 20:53:35 IST 2015,awesom
Gods_Warrior82,Sun Jun 21 04:06:40 IST 2015,tropicalstormbil
Gods_Warrior82,Sun Jun 21 04:05:44 IST 2015,gotta love tropic storm ruin day father day oh well still shop dinner
Gods_Warrior82,Sun Jun 21 03:06:15 IST 2015,happi west virginia day happywestvirginiaday
Gods_Warrior82,Sat Jun 20 23:00:01 IST 2015,west virginia heffrondrivenewvideo
Gods_Warrior82,Sat Jun 20 21:07:31 IST 2015,i take cooki cream look yummi lol
Gods_Warrior82,Sat Jun 20 08:17:46 IST 2015,thank they way overdu new pair though i hope get new pair sometim soon haha
Gods_Warrior82,Sat Jun 20 08:07:34 IST 2015,welcom
Gods_Warrior82,Sat Jun 20 08:07:19 IST 2015,oh good hope get better soon
Gods_Warrior82,Sat Jun 20 07:45:38 IST 2015,i like glass tonight so cute
Gods_Warrior82,Sat Jun 20 02:23:21 IST 2015,rt that crazi cool moment u ur write partner script dialogu hollywood legend policecop
Gods_Warrior82,Sat Jun 20 02:22:47 IST 2015,awesom can wait
Gods_Warrior82,Sat Jun 20 02:14:32 IST 2015,awesom glad blast
Gods_Warrior82,Sat Jun 20 02:03:26 IST 2015,awesom
Gods_Warrior82,Sat Jun 20 02:00:20 IST 2015,western like barboursvill huntington area
Gods_Warrior82,Sat Jun 20 00:00:27 IST 2015,part west virginia
Gods_Warrior82,Fri Jun 19 23:56:15 IST 2015,i know right
Gods_Warrior82,Fri Jun 19 23:51:26 IST 2015,awesom so glad i find anoth wv rusher
Gods_Warrior82,Fri Jun 19 23:49:08 IST 2015,west virginia
Gods_Warrior82,Fri Jun 19 08:54:31 IST 2015,awesom can wait
Gods_Warrior82,Fri Jun 19 08:26:36 IST 2015,sometim trust friend hardest thing even closest friend becom enemi sad true
Gods_Warrior82,Fri Jun 19 08:25:54 IST 2015,omgosh yes i still listen btr beatl version i figur line lol
Gods_Warrior82,Fri Jun 19 08:01:29 IST 2015,think go bed earli itsbeenanexhaustingfewday
Gods_Warrior82,Fri Jun 19 07:16:48 IST 2015,caitlyn
Gods_Warrior82,Fri Jun 19 07:10:03 IST 2015,daggon i need bring game lol kid
Gods_Warrior82,Fri Jun 19 06:57:29 IST 2015,repli not sometim i think profil mute someth like
Gods_Warrior82,Fri Jun 19 06:56:45 IST 2015,yea sometim i feel like skip dms year half i never got
Gods_Warrior82,Fri Jun 19 06:51:57 IST 2015,why
Gods_Warrior82,Fri Jun 19 06:50:51 IST 2015,hi
Gods_Warrior82,Fri Jun 19 06:50:20 IST 2015,repli back i dm one i sent
Gods_Warrior82,Fri Jun 19 06:49:36 IST 2015,i tri make luck work i doing year half i get
Gods_Warrior82,Fri Jun 19 06:43:39 IST 2015,i that lucki
Gods_Warrior82,Fri Jun 19 06:34:12 IST 2015,girl i worst luck
Gods_Warrior82,Fri Jun 19 06:22:14 IST 2015,rt sweatpant sneaker hair tie makeup that prettiest
Gods_Warrior82,Fri Jun 19 02:57:01 IST 2015,camo whatev float boat lol
