username,time,tweet
andpacker,Wed Jun 10 21:19:02 IST 2015,i feel like news site consid good headlin unless provok countless comment
andpacker,Wed Jun 10 19:22:12 IST 2015,year ago would thought social media would thing weed shitti cop onebyon
andpacker,Wed Jun 10 13:16:01 IST 2015,wow good i bet got spring step
andpacker,Wed Jun 10 08:15:04 IST 2015,i shower today wear shirt least eyebrowsonfleek
andpacker,Wed Jun 10 01:12:41 IST 2015,do that mani peopl rollerblad around athen greec eat chip
andpacker,Tue Jun 09 23:47:41 IST 2015,rt laid back compani allow employe to work from home after p m
andpacker,Tue Jun 09 23:42:42 IST 2015,ericcasebolt kindergarten level somersault perfect foreshadow abil polic offic texaspoolparti
andpacker,Tue Jun 09 23:18:57 IST 2015,i think store need coupl manikin retail highfashion
andpacker,Tue Jun 09 15:07:01 IST 2015,rt any pool parti without cop show realli parti
andpacker,Tue Jun 09 04:21:00 IST 2015,it good thing vatican made cover knee shoulder want offend anyon front nude paint
andpacker,Mon Jun 08 22:03:20 IST 2015,wow give guy break like said sorri
andpacker,Mon Jun 08 21:57:56 IST 2015,due lack peopl give shit
andpacker,Mon Jun 08 21:16:43 IST 2015,red vibrant red bold red afford
andpacker,Sun Jun 07 18:23:22 IST 2015,there might realli good restaur europ offer free wifi i know thestruggl
andpacker,Sun Jun 07 18:13:57 IST 2015,if ever feel cocki rememb pomeranian dog achiev age ever
andpacker,Sun Jun 07 14:27:48 IST 2015,i dont dislik use selfi stick i want get caught thunderstorm
andpacker,Sat Jun 06 03:45:41 IST 2015,sometim i think i success twitter i post pictur cat
andpacker,Sat Jun 06 03:31:00 IST 2015,europ even fire hydrant skinni
andpacker,Fri Jun 05 15:15:43 IST 2015,the catch come pack
andpacker,Fri Jun 05 15:02:49 IST 2015,million peopl africa get electr year ago rapper felt lone mrlone butterflyeffect
andpacker,Fri Jun 05 14:54:55 IST 2015,whether ellen trailblaz whatev name news section fb ami schumer kill today
andpacker,Fri Jun 05 14:43:36 IST 2015,ask wear sandal vatican shit hit fan ventil monkey cage norespect
andpacker,Thu Jun 04 23:48:36 IST 2015,bahahahahahha i doubl check make sure articl smh fifacorrupt
andpacker,Thu Jun 04 23:43:53 IST 2015,rt dog vow to keep their shit togeth during of juli firework
andpacker,Thu Jun 04 19:37:40 IST 2015,who knew gangster rapper snoop dogg love progress voic transgend communiti stun callmecaitlyn
andpacker,Wed Jun 03 21:25:11 IST 2015,mmmm campaign season time major news network spread specul bullshit tabloid
andpacker,Wed Jun 03 21:00:06 IST 2015,where rapper get rich die tri comedian get rich tri die neurot comedi wednesday
andpacker,Tue Jun 02 16:11:55 IST 2015,this like releas new movi call coke smile wonder chuckl bill cosbi given us
andpacker,Tue Jun 02 00:32:17 IST 2015,the weirdest part finger smelt florenc
andpacker,Mon Jun 01 14:29:57 IST 2015,rt jerri seinfeld right comedian relationship
andpacker,Mon Jun 01 02:29:24 IST 2015,everyth news feed alreadi while i away section redund
andpacker,Mon Jun 01 02:26:17 IST 2015,when highfashion use strap smh
andpacker,Sun May 31 00:05:39 IST 2015,any site let peopl post video choic lot dog video cat video dude jack rulesoftheunivers
andpacker,Sat May 30 00:28:08 IST 2015,work squat game today eurotrip squateveryday
andpacker,Fri May 29 01:19:02 IST 2015,omg i wait
andpacker,Wed May 27 15:51:04 IST 2015,the us justic depart say drop charg fifa agre call soccer fifaarrest
andpacker,Wed May 27 02:45:26 IST 2015,rt my neighbor call color it old fashion i cut head sword put pike i
andpacker,Tue May 26 13:45:53 IST 2015,sometim i fri garlic pan peopl come think i cook lifehack comedi lazi
andpacker,Tue May 26 04:14:30 IST 2015,mayb pedestrian shield someth like car
andpacker,Mon May 25 11:35:26 IST 2015,england still reap benefit histor destruct domin cultur histori english movi
andpacker,Mon May 25 11:10:00 IST 2015,frustrat make sale french hat saleswoman told i know noth hat ouff cut deep real
andpacker,Mon May 25 10:58:57 IST 2015,just everyon know anyth rhyme day fact keep doctor away
andpacker,Mon May 25 10:53:59 IST 2015,dear everi girl becom fashion blogger instagram yet
andpacker,Mon May 25 01:57:12 IST 2015,
andpacker,Mon May 25 01:47:21 IST 2015,steven harper hair look like attach way attach hair legoman
andpacker,Mon May 25 01:38:36 IST 2015,call home colonoscopi noinsur
andpacker,Mon May 25 01:30:48 IST 2015,peopl gather monacogp today watch car go fast nevergrowup grandprixmonaco
andpacker,Sun May 24 01:21:43 IST 2015,rt ireland vote yes gay marriag yet anoth victori sinist gay agenda affect tradit marriag
andpacker,Sun May 24 01:19:02 IST 2015,the way johnni depp shape person writer vision charact incred if pokémon would dido
andpacker,Sat May 23 23:32:35 IST 2015,if bakeri around world could get franc level great
