username,time,tweet
MaxBenson5,Thu Feb 25 10:00:18 IST 2016,wow convers go so much complex product new emoji thank fb
MaxBenson5,Thu Feb 25 09:51:38 IST 2016,liter cutest snapchat i ever gotten thank lil sis
MaxBenson5,Thu Feb 25 05:06:51 IST 2016,let talk jennif lawrenc ethic icloud socmeddiscuss
MaxBenson5,Thu Feb 25 02:23:00 IST 2016,rt who think misquot marilyn monro teen god gop
MaxBenson5,Wed Feb 24 22:01:26 IST 2016,rt okay aggi i need vote one time take minut help girl
MaxBenson5,Wed Feb 24 14:18:56 IST 2016,s o person social media hour
MaxBenson5,Tue Feb 23 12:38:25 IST 2016,rt video when trump fan met muslim refuge
MaxBenson5,Tue Feb 23 11:46:49 IST 2016,
MaxBenson5,Tue Feb 23 11:38:16 IST 2016,ram someon i thought friend discov random year old woman glad see i leav legaci usu
MaxBenson5,Tue Feb 23 11:37:05 IST 2016,legit idea damn daniel mean sos milleni
MaxBenson5,Mon Feb 22 23:49:19 IST 2016,vote student alumni vp she shown mean dedic passion usu
MaxBenson5,Mon Feb 22 00:43:21 IST 2016,religion sourc discov truth also open continu seek truth
MaxBenson5,Sun Feb 21 22:56:02 IST 2016,the cinnamon pancak put light sweet section menu herm lol
MaxBenson5,Fri Feb 19 14:32:20 IST 2016,what life feel like right sos
MaxBenson5,Thu Feb 18 22:32:04 IST 2016,rt when peopl like i know i lucki i like
MaxBenson5,Thu Feb 18 11:58:56 IST 2016,very pleas see one result type name googl imag
MaxBenson5,Thu Feb 18 04:59:37 IST 2016,new blog post do prefer skype facetim skype socmeddiscuss
MaxBenson5,Tue Feb 16 11:16:45 IST 2016,but new music version incred listen now
MaxBenson5,Tue Feb 16 11:16:16 IST 2016,dude book even darker not happi stori
MaxBenson5,Tue Feb 16 06:55:52 IST 2016,and peggi
MaxBenson5,Tue Feb 16 00:12:24 IST 2016,rt peopl critic prequel grasp genius the world readi jar jar bink it
MaxBenson5,Mon Feb 15 11:02:31 IST 2016,i fulli intend invit wed sent
MaxBenson5,Mon Feb 15 04:14:47 IST 2016,saint
MaxBenson5,Mon Feb 15 04:14:18 IST 2016,rt love life look like valentin day
MaxBenson5,Sat Feb 13 23:15:42 IST 2016,rt
MaxBenson5,Sat Feb 13 06:06:58 IST 2016,would date
MaxBenson5,Fri Feb 12 05:55:04 IST 2016,serious question how legal blond fight system genr right next mandela documentari
MaxBenson5,Fri Feb 12 05:41:05 IST 2016,rt when tri feel pain see savior loveoneanoth
MaxBenson5,Thu Feb 11 12:29:00 IST 2016,anyon els felt creep nearbi friend foursquar socmeddiscuss
MaxBenson5,Thu Feb 11 07:02:30 IST 2016,import
MaxBenson5,Thu Feb 11 05:56:27 IST 2016,rt lean whisper i download chic fil app yesterday lol
MaxBenson5,Thu Feb 11 04:57:42 IST 2016,hey cuti
MaxBenson5,Thu Feb 11 00:31:56 IST 2016,weather relat like life in ut degre mean warm i eat donut basic feel i relationship
MaxBenson5,Tue Feb 09 12:23:41 IST 2016,
MaxBenson5,Mon Feb 08 11:44:52 IST 2016,i livid
MaxBenson5,Mon Feb 08 11:44:30 IST 2016,wrong
MaxBenson5,Mon Feb 08 10:46:50 IST 2016,saaaaammmee
MaxBenson5,Mon Feb 08 07:42:15 IST 2016,the librari super bowl feel like hogwart holiday no one is here
MaxBenson5,Mon Feb 08 06:52:41 IST 2016,announc coldplay perform wtf
MaxBenson5,Mon Feb 08 06:38:31 IST 2016,rt who win tonight feministsuperbowl
MaxBenson5,Mon Feb 08 01:40:04 IST 2016,what a time to be aliv amiright
MaxBenson5,Mon Feb 08 01:16:06 IST 2016,rt cheer beyonc that
MaxBenson5,Mon Feb 08 00:25:25 IST 2016,count olaf also show fine
MaxBenson5,Mon Feb 08 00:24:51 IST 2016,i dream i went beyoncé concert beyoncé wave i just want awar
MaxBenson5,Sun Feb 07 09:56:25 IST 2016,when tri get couch realiz mistak watch girl pink girlinpink
MaxBenson5,Sun Feb 07 06:25:10 IST 2016,hey five favorit thing
MaxBenson5,Sun Feb 07 03:55:33 IST 2016,rt five minut beyoncé video said new orlean hour american horror stori i hope ryan murphi
MaxBenson5,Sun Feb 07 00:21:19 IST 2016,brave courag photograph i know
MaxBenson5,Sun Feb 07 00:20:05 IST 2016,i still tri understand strategi twitter suppos place get away fb
MaxBenson5,Fri Feb 05 09:23:20 IST 2016,rt this vote like tri regist class time banner crash nice
