username,time,tweet
Bert8287,Thu Jun 18 04:32:45 IST 2015,holi fuck yall put the filter function back in it only took month to do it too
Bert8287,Thu Jun 18 02:46:38 IST 2015,rt stop eat nutella save forest french ecolog minist say
Bert8287,Thu Jun 18 02:46:20 IST 2015,rt eminem and next collab is alreadi finish
Bert8287,Thu Jun 18 02:46:05 IST 2015,rt walmart accus dodg us tax store billion asset abroad
Bert8287,Wed Jun 17 22:53:30 IST 2015,rt at t got hit million fine slow unlimit data
Bert8287,Wed Jun 17 22:52:07 IST 2015,rt thebigpictur here what decad trade look like video
Bert8287,Wed Jun 17 22:50:47 IST 2015,rt anonym back new encrypt social network rival facebook
Bert8287,Wed Jun 17 22:49:46 IST 2015,rt urban texa frack site spill gallon fluid hope reopen
Bert8287,Wed Jun 17 22:49:35 IST 2015,rt redactedtonight the ridicul simpl way end child poverti video
Bert8287,Wed Jun 17 22:48:57 IST 2015,rt pleas wish luck i kick cancer behind thank love support
Bert8287,Wed Jun 17 22:48:47 IST 2015,rt the good news i use marijuana treat cancer
Bert8287,Wed Jun 17 22:48:40 IST 2015,rt i good news bad news first bad news cancer came back real pain butt
Bert8287,Wed Jun 17 22:48:20 IST 2015,rt did get chanc see no man sky soni press confer
Bert8287,Wed Jun 17 19:12:16 IST 2015,rt i support opposit identifi black ladi realiti human be origin africa
Bert8287,Wed Jun 17 19:12:00 IST 2015,rt all human be start femal men nippl bottom line give fuck identifi
Bert8287,Wed Jun 17 19:11:49 IST 2015,rt the world war intens debat subject man want woman white chick want
Bert8287,Wed Jun 17 19:11:17 IST 2015,rt i identifi immort infinit univers express multi cell biolog entiti use
Bert8287,Wed Jun 17 04:00:37 IST 2015,rt if this tweet get rts fave will get drunk and get her nose pierc and throw a parti at her hous
Bert8287,Wed Jun 17 03:44:14 IST 2015,rt fuuuuck yooouuuuu its humid mississippi
Bert8287,Wed Jun 17 03:31:06 IST 2015,it might actual get weekend lol
Bert8287,Tue Jun 16 03:54:33 IST 2015,rt futur locat tower sauron hall doom the black lodg harrenh
Bert8287,Tue Jun 16 03:53:53 IST 2015,rt frack blame alabama earthquak occur near shale gas develop
Bert8287,Tue Jun 16 03:47:18 IST 2015,rt colorado court rule medic marijuana unlaw uphold fire quadripleg worker
Bert8287,Tue Jun 16 03:45:21 IST 2015,rt the human race progress inspir
Bert8287,Tue Jun 16 03:44:34 IST 2015,rt that complex list piss aha
Bert8287,Mon Jun 15 22:52:19 IST 2015,i show engin d comput made bridg germani proceed tell wont work lol
Bert8287,Mon Jun 15 22:50:16 IST 2015,rt redactedtonight the ugli truth about gmos video
Bert8287,Mon Jun 15 22:32:20 IST 2015,rt off arctic shell drill rig attempt leav seattl protest blockad path
Bert8287,Mon Jun 15 22:31:07 IST 2015,rt player ai control adversari massiv scale environ size previous halo map welcom warzon
Bert8287,Mon Jun 15 22:30:33 IST 2015,im addict eso i dream shit
Bert8287,Mon Jun 15 19:52:25 IST 2015,rt robot build print amsterdam bridg mid air construct support along way
Bert8287,Fri Jun 12 18:34:01 IST 2015,that shitti hahaha rt if shoot moon miss closer even nearest star
Bert8287,Thu Jun 11 23:24:12 IST 2015,rt summer jam xviii fuck tomorrow
Bert8287,Thu Jun 11 23:23:56 IST 2015,rt tomorrow summerjam
Bert8287,Thu Jun 11 23:22:34 IST 2015,rt last week tonight proud sponsor yawn yawn now want yawn
Bert8287,Thu Jun 11 23:21:22 IST 2015,rt a nation judg moral number billionair treat vulner peopl http
Bert8287,Thu Jun 11 23:20:58 IST 2015,rt trend fed want year prison sentenc man delet internet brows histori http
Bert8287,Thu Jun 11 23:20:22 IST 2015,rt obama opportunist hillari clinton differ milit noam chomski
Bert8287,Thu Jun 11 23:20:07 IST 2015,rt texa offic pin year old girl emot get best lawyer video
Bert8287,Thu Jun 11 07:10:53 IST 2015,rt it we updat everyon twitter back onlin
Bert8287,Thu Jun 11 06:44:11 IST 2015,rt it funni search elder scroll onlin laugh read everyon childish rage tweet meanwhil
Bert8287,Wed Jun 10 01:52:18 IST 2015,rt just in protest mckinney gain strength peopl color march polic brutal
Bert8287,Wed Jun 10 01:51:56 IST 2015,rt luckyyyyyyi
Bert8287,Tue Jun 09 23:54:27 IST 2015,play eso hour lunch pretti badass far minus server flood first day
Bert8287,Tue Jun 09 22:39:52 IST 2015,rt i may shape least i still run better govern
Bert8287,Tue Jun 09 22:37:56 IST 2015,rt lunch time best time
Bert8287,Tue Jun 09 19:19:26 IST 2015,rt elder scroll
Bert8287,Tue Jun 09 11:07:02 IST 2015,rt elder scroll onlin server right smh
Bert8287,Tue Jun 09 10:46:22 IST 2015,rt who els besid tech hype see summerjamxviii
Bert8287,Tue Jun 09 10:19:35 IST 2015,rt the esotu server open respect time zone midnight local time see
