username,time,tweet
Connie_Franck,Sat Apr 04 20:25:42 IST 2015,just saw i love obamacar bumperstick prius i wish know
Connie_Franck,Sat Apr 04 05:13:14 IST 2015,rt ty
Connie_Franck,Sat Apr 04 03:15:15 IST 2015,ff tlot
Connie_Franck,Sat Apr 04 00:10:11 IST 2015,ff peopl work liberti va tlot
Connie_Franck,Sat Apr 04 00:05:10 IST 2015,ff peopl work liberti va tlot
Connie_Franck,Sat Apr 04 00:00:10 IST 2015,ff peopl work liberti va tlot
Connie_Franck,Fri Apr 03 23:39:23 IST 2015,follow thank everyon
Connie_Franck,Fri Apr 03 23:15:20 IST 2015,rt this libertarianfollowtrain if libertarian retweet follow libertarian retweet
Connie_Franck,Fri Apr 03 22:59:39 IST 2015,ty
Connie_Franck,Fri Apr 03 22:59:31 IST 2015,rt ff lp peopl
Connie_Franck,Fri Apr 03 22:15:08 IST 2015,ex ir ethic offic lawyer disbar ethic violat via
Connie_Franck,Fri Apr 03 20:18:48 IST 2015,chrischristi pardon singl mother arrest after gun mixup via
Connie_Franck,Fri Apr 03 20:17:41 IST 2015,ty
Connie_Franck,Fri Apr 03 20:17:30 IST 2015,rt ff libertarian va work liberti
Connie_Franck,Fri Apr 03 19:50:23 IST 2015,gm
Connie_Franck,Fri Apr 03 19:49:09 IST 2015,ty
Connie_Franck,Fri Apr 03 19:49:01 IST 2015,rt ff
Connie_Franck,Fri Apr 03 00:42:26 IST 2015,problem
Connie_Franck,Thu Apr 02 20:31:50 IST 2015,great quot
Connie_Franck,Thu Apr 02 01:15:06 IST 2015,next meetup loudouncounti va libertarian detail
Connie_Franck,Thu Apr 02 00:01:13 IST 2015,lostrhino winsaprilfoolsday
Connie_Franck,Wed Apr 01 20:03:16 IST 2015,yes unfortun i understand justifi
Connie_Franck,Wed Apr 01 07:51:40 IST 2015,so nrawhor thing insult peopl strengthen argument gunright
Connie_Franck,Wed Apr 01 03:51:54 IST 2015,yes exact
Connie_Franck,Wed Apr 01 01:45:07 IST 2015,liber prof if you understand econom you like bad person via
Connie_Franck,Tue Mar 31 20:15:09 IST 2015,gunright group sue pa township ordin via
Connie_Franck,Tue Mar 31 19:47:08 IST 2015,rt once ban hemp focus research virginia state univers virginia tech
Connie_Franck,Tue Mar 31 05:04:24 IST 2015,rt so peopl choos busi state agre valu when everyon becom
Connie_Franck,Tue Mar 31 00:33:51 IST 2015,refund ir give back money
Connie_Franck,Mon Mar 30 21:45:16 IST 2015,the top libertarian sciencefict novel via
Connie_Franck,Mon Mar 30 20:15:13 IST 2015,california conceal gun rule reconsid gunright via
Connie_Franck,Mon Mar 30 20:11:40 IST 2015,i start the fountainhead weekend i wait finish compar atlas shrug
Connie_Franck,Mon Mar 30 06:20:06 IST 2015,make mysteri flavor one i scare
Connie_Franck,Mon Mar 30 06:17:28 IST 2015,the close campus mind via
Connie_Franck,Mon Mar 30 06:17:08 IST 2015,i wonder long make pumpkin spice flavor peep
Connie_Franck,Sat Mar 28 21:19:56 IST 2015,great job support communiti
Connie_Franck,Sat Mar 28 20:33:45 IST 2015,rt i excit announc live big thank
Connie_Franck,Fri Mar 27 23:16:00 IST 2015,rt this libertarianfollowtrain if libertarian retweet follow libertarian retweet
Connie_Franck,Fri Mar 27 22:33:17 IST 2015,work site finish slider speak
Connie_Franck,Fri Mar 27 22:28:09 IST 2015,wonder
Connie_Franck,Fri Mar 27 22:21:06 IST 2015,ty
Connie_Franck,Fri Mar 27 22:20:54 IST 2015,rt ff lp peopl
Connie_Franck,Fri Mar 27 22:20:09 IST 2015,ff peopl work liberti va tlot
Connie_Franck,Fri Mar 27 22:15:08 IST 2015,ff peopl work liberti va tlot
Connie_Franck,Fri Mar 27 22:10:07 IST 2015,ff peopl work liberti va tlot
Connie_Franck,Fri Mar 27 21:21:29 IST 2015,ty
Connie_Franck,Fri Mar 27 21:21:19 IST 2015,rt ff libertarian va work liberti
Connie_Franck,Fri Mar 27 20:15:14 IST 2015,ff tlot
Connie_Franck,Fri Mar 27 19:26:12 IST 2015,ty
Connie_Franck,Fri Mar 27 19:26:01 IST 2015,rt more freedom friday ff
