username,time,tweet
YLabonte26,Wed May 13 06:38:23 IST 2015,est ce que marchesseault est un ancien des rempart felixseguin
YLabonte26,Wed May 13 06:35:00 IST 2015,il faut accept la critiqu et amelior
YLabonte26,Wed May 13 06:27:11 IST 2015,il va te barrer il n aim pas la critiqu
YLabonte26,Wed May 13 06:21:28 IST 2015,et il parl encor des equip junior ou le joueur jouer onsencriss
YLabonte26,Wed May 13 05:50:24 IST 2015,comm price inquietai ya qq anne calm toé an
YLabonte26,Tue May 12 19:46:06 IST 2015,hey max tu aussi parler de crossfit
YLabonte26,Tue May 12 18:39:51 IST 2015,yesssssss
YLabonte26,Tue May 12 18:29:06 IST 2015,et pu de
YLabonte26,Tue May 12 05:59:02 IST 2015,merci maika
YLabonte26,Tue May 12 05:58:36 IST 2015,rt je croi sincèrement en l efficacité des produit pur noiseti mes enfant en ont toujour porté
YLabonte26,Sun May 10 18:24:06 IST 2015,donc comm l impact quand il mène apr min de jeu dan un match
YLabonte26,Sun May 10 18:03:55 IST 2015,rt merci de donner crédit à text repri presqu intégral ah
YLabonte26,Sat May 09 18:08:19 IST 2015,la question ce matin est ce que aura un veston bleu ce soir
YLabonte26,Fri May 08 06:15:54 IST 2015,un gordi howe
YLabonte26,Fri May 08 04:08:54 IST 2015,renlavoietva tu un autr veston que ton veston bleu tjlememehabit blackberri informateurquisinformesurtwitt
YLabonte26,Tue May 05 19:45:34 IST 2015,soir ou matin
YLabonte26,Tue May 05 02:52:13 IST 2015,salut oyongo est quel genr de joueur pour qq qui suit le soccer depui an un genr de merci
YLabonte26,Mon May 04 22:44:54 IST 2015,franchement quell question inutil dsl
YLabonte26,Mon May 04 21:42:09 IST 2015,pour qq qui ne connai pas trop les joueur qui pourrai le compar dan l equip un genr de
YLabonte26,Mon May 04 05:24:48 IST 2015,euhhhh go impact go
YLabonte26,Mon May 04 00:56:03 IST 2015,le mond est vraiment cave desharnai fou rien et personn le dit go chucki go
YLabonte26,Sun May 03 22:24:01 IST 2015,jme su dit la meme chose jeudi
YLabonte26,Sun May 03 21:20:45 IST 2015,si renaud le dit
YLabonte26,Sun May 03 01:48:09 IST 2015,gross nouvell mon renaud lach pas t linformateur
YLabonte26,Sat May 02 04:38:23 IST 2015,mon coté de jpensai que cetai regi lévesqu lol
YLabonte26,Thu Apr 30 15:19:45 IST 2015,meme si yen rest sont vendu pareil qqs les achet
YLabonte26,Thu Apr 30 08:51:17 IST 2015,
YLabonte26,Wed Apr 29 22:23:15 IST 2015,ptit diner l avantag sur la terrass steph
YLabonte26,Wed Apr 29 03:37:00 IST 2015,wow
YLabonte26,Wed Apr 29 03:33:22 IST 2015,et la deuxiem
YLabonte26,Sat Apr 25 19:22:33 IST 2015,c est vraiment incroy jmennui de
YLabonte26,Sat Apr 25 00:44:53 IST 2015,j aimai la box tanner de tous ces niaiseri arreton aller
YLabonte26,Fri Apr 24 09:04:02 IST 2015,non plus une joke que jp ferland deja dit les gen l appelai comm ca des foi
YLabonte26,Fri Apr 24 09:03:17 IST 2015,lolll
YLabonte26,Fri Apr 24 09:01:55 IST 2015,ferland gignac
YLabonte26,Thu Apr 23 16:17:04 IST 2015,rt hey listen wanna major leagu wake caus right absolut joke around
YLabonte26,Thu Apr 23 08:44:05 IST 2015,arret encourag les alouett
YLabonte26,Thu Apr 23 00:02:16 IST 2015,rt félicit pour l accè à la prochain rond et une remonté extraordinair lhjmq
YLabonte26,Thu Apr 23 00:01:41 IST 2015,rt combien de rt pour ceux qui croient en ce rêve goimpact marquonslhistoir final championsleagu
YLabonte26,Wed Apr 22 17:24:29 IST 2015,pas de chroniqu ce matin v mathia
YLabonte26,Wed Apr 22 08:17:41 IST 2015,de la eska
YLabonte26,Wed Apr 22 08:16:13 IST 2015,jvien de voir un video et cest clairement baie comeau les san class
YLabonte26,Wed Apr 22 07:42:51 IST 2015,score chi
YLabonte26,Tue Apr 21 21:50:30 IST 2015,je reposerai max il navait pas lair de feeler et je met parenteau cest qes ten pens martin
YLabonte26,Mon Apr 20 07:24:01 IST 2015,eller ryan
YLabonte26,Mon Apr 20 02:25:02 IST 2015,jcroi que plus que part loui jean tva sport fait pitié jmennui de pierr et marc
YLabonte26,Sat Apr 18 06:31:17 IST 2015,gros gros nacho avec et vous anik
YLabonte26,Fri Apr 17 19:14:23 IST 2015,sekac stai pas le gretzki des fefan ca
YLabonte26,Fri Apr 17 07:29:38 IST 2015,ya just le gardien qui fait peur
YLabonte26,Thu Apr 16 09:35:23 IST 2015,jesper que dan ton blogu tu en jasera haha vive eller
