username,time,tweet
PhilCheeseQuake,Mon Feb 29 06:35:26 IST 2016,this steveaveri written datelin
PhilCheeseQuake,Mon Feb 29 06:31:03 IST 2016,rt new skipper amaz power
PhilCheeseQuake,Mon Feb 29 06:30:05 IST 2016,classic use ol xboxliv alibi getawaywithmurd datelin
PhilCheeseQuake,Mon Feb 29 02:22:41 IST 2016,broken windshield goe cub chariti auction sent at bat
PhilCheeseQuake,Sat Feb 27 10:05:02 IST 2016,the crazi nastyass honey badger origin narrat randal view
PhilCheeseQuake,Fri Feb 26 20:20:17 IST 2016,today i learn georg washington troop use keep warm militari boat
PhilCheeseQuake,Fri Feb 26 11:17:55 IST 2016,cobyreturn
PhilCheeseQuake,Fri Feb 26 08:15:05 IST 2016,will pleas stand i repeat will pleas stand we gonna problem gopdeb
PhilCheeseQuake,Fri Feb 26 08:09:40 IST 2016,rt trump continu bash obamacar impli want free market he want singl payer gopdeb tcot
PhilCheeseQuake,Fri Feb 26 08:06:52 IST 2016,start good size hole
PhilCheeseQuake,Fri Feb 26 08:04:04 IST 2016,who win debat gopdeb
PhilCheeseQuake,Fri Feb 26 08:00:12 IST 2016,rt ted cruz suit tonight gopdeb
PhilCheeseQuake,Fri Feb 26 07:53:09 IST 2016,rt googl tell truth gopdeb
PhilCheeseQuake,Fri Feb 26 07:34:50 IST 2016,rt lava cake
PhilCheeseQuake,Fri Feb 26 07:33:56 IST 2016,fun fact there mile railroad unit state showfact
PhilCheeseQuake,Thu Feb 25 20:24:28 IST 2016,today i learn better altern hous homeless help turn life around
PhilCheeseQuake,Thu Feb 25 10:15:45 IST 2016,why stripper prostitut oh wait that right
PhilCheeseQuake,Tue Feb 23 08:30:18 IST 2016,rt ben love two women bro live denver hop skip utah problem solv mittromney thebachelor
PhilCheeseQuake,Tue Feb 23 08:28:07 IST 2016,rt calia dad look familiar thebachelor
PhilCheeseQuake,Tue Feb 23 08:26:35 IST 2016,rt so amanda kid wors jojo brother chad thebachelor
PhilCheeseQuake,Tue Feb 23 08:25:32 IST 2016,you first home date amanda thebachelor
PhilCheeseQuake,Tue Feb 23 08:21:54 IST 2016,rt ben hang jojo dad brother thebachelor tension
PhilCheeseQuake,Tue Feb 23 08:14:30 IST 2016,rt mom drink right outta bottl thebachelor
PhilCheeseQuake,Tue Feb 23 08:14:01 IST 2016,jo jo mom drunk wine botox just creppin thebachelor
PhilCheeseQuake,Tue Feb 23 08:12:23 IST 2016,rt what jojo brother know neither seem wed ring thebachelor
PhilCheeseQuake,Tue Feb 23 08:12:10 IST 2016,put chyo poka face bro thebachelor
PhilCheeseQuake,Tue Feb 23 08:10:40 IST 2016,the mom know get serious take swig wine bottl thebachelor
PhilCheeseQuake,Tue Feb 23 08:08:59 IST 2016,interest everyon outsid alway look even know half thebachelor
PhilCheeseQuake,Tue Feb 23 08:07:35 IST 2016,rt jojo brother look like armenian version winklevoss twin thebachelor
PhilCheeseQuake,Tue Feb 23 08:04:56 IST 2016,rt tell them your unlov ben thatll work
PhilCheeseQuake,Tue Feb 23 08:03:36 IST 2016,mob bros chat wit ben thebachelor
PhilCheeseQuake,Tue Feb 23 08:00:14 IST 2016,ben jo jo bro immedi make ben seem like heart breaker judgybrolo thebachelor
PhilCheeseQuake,Tue Feb 23 07:53:09 IST 2016,jo jo told ex fart wind itsov thebachelor
PhilCheeseQuake,Tue Feb 23 07:46:01 IST 2016,she kept ex number backupplan thebachelor
PhilCheeseQuake,Tue Feb 23 07:39:51 IST 2016,rt for time career david back put puck net
PhilCheeseQuake,Tue Feb 23 07:36:29 IST 2016,rt all i heard caila mom describ dinner you need bottl recov
PhilCheeseQuake,Tue Feb 23 07:34:25 IST 2016,rt i need cube caila mom fight urg get sauc tonight thebachelor
PhilCheeseQuake,Tue Feb 23 07:31:38 IST 2016,after four interview readi drink thebachelor
PhilCheeseQuake,Tue Feb 23 07:30:04 IST 2016,caila dad take reign boat thebachelor
PhilCheeseQuake,Tue Feb 23 07:22:21 IST 2016,did caila take ben china sweatshop thebachelor
PhilCheeseQuake,Tue Feb 23 07:13:30 IST 2016,my predict amanda caila go home thebachelor
PhilCheeseQuake,Tue Feb 23 06:49:30 IST 2016,amanda dad slowli talk ben fenc dad thebachelor
PhilCheeseQuake,Tue Feb 23 06:47:13 IST 2016,can ben instant dad amanda mom hope thebachelor
PhilCheeseQuake,Tue Feb 23 06:37:31 IST 2016,amanda kid show go back home togeth thebachelor preciousmo
PhilCheeseQuake,Sun Feb 21 11:17:21 IST 2016,criminalmind next bing
PhilCheeseQuake,Tue Feb 16 19:37:48 IST 2016,great app track spend keep wallet get run receipt
PhilCheeseQuake,Tue Feb 16 08:27:36 IST 2016,rt chris soul like hey becca rememb i singl readi mingl thebachelor
PhilCheeseQuake,Tue Feb 16 08:26:08 IST 2016,finalros finalfour caila bye bye becca thebachelor
PhilCheeseQuake,Tue Feb 16 08:16:20 IST 2016,rt i feel pontoon boat go make detour dock dumpsvill thebachelor
PhilCheeseQuake,Tue Feb 16 08:15:49 IST 2016,that awkward boat ride find but hope the cheerlead preliminari april thebachelor
