username,time,tweet
FenstarDeLuxe,Mon Feb 29 10:22:59 IST 2016,good see compani like go beyond custom very displeas servic i receiv
FenstarDeLuxe,Mon Feb 29 03:58:11 IST 2016,hey folk one get one offic footi tip ladder thing
FenstarDeLuxe,Mon Feb 29 02:10:22 IST 2016,tiz fen howev just awesom one
FenstarDeLuxe,Mon Feb 29 01:26:50 IST 2016,i want stay home guy
FenstarDeLuxe,Mon Feb 29 00:54:20 IST 2016,i realli realli want go work today monday
FenstarDeLuxe,Mon Feb 29 00:51:24 IST 2016,i weirdest dream alarm woke spoil sport
FenstarDeLuxe,Sun Feb 28 16:46:05 IST 2016,
FenstarDeLuxe,Sun Feb 28 16:45:21 IST 2016,job
FenstarDeLuxe,Sun Feb 28 16:33:51 IST 2016,i readi weekend
FenstarDeLuxe,Sun Feb 28 16:08:52 IST 2016,yeah i find anyth onlin point very strang inde
FenstarDeLuxe,Sun Feb 28 16:08:35 IST 2016,queen pouff
FenstarDeLuxe,Sun Feb 28 15:57:38 IST 2016,a loud explos type nois light almost went uh oh what malvern town tonight
FenstarDeLuxe,Sun Feb 28 15:36:01 IST 2016,errr you keep one
FenstarDeLuxe,Sun Feb 28 15:32:46 IST 2016,promis promis
FenstarDeLuxe,Sun Feb 28 15:30:31 IST 2016,savour delici
FenstarDeLuxe,Sun Feb 28 15:30:07 IST 2016,make show young man
FenstarDeLuxe,Sun Feb 28 15:24:01 IST 2016,purchas hedgehog slice i leav dinner tonight just rememb i bag oh the joy
FenstarDeLuxe,Sun Feb 28 15:09:45 IST 2016,sunday sunset crackerjack waterfront cafe
FenstarDeLuxe,Sun Feb 28 11:29:34 IST 2016,throw wall watch piec fall
FenstarDeLuxe,Sun Feb 28 11:28:10 IST 2016,
FenstarDeLuxe,Sun Feb 28 11:27:19 IST 2016,oh bad
FenstarDeLuxe,Sun Feb 28 06:28:07 IST 2016,neighbour brother develop stack hat i pink one hahahahahaha
FenstarDeLuxe,Sun Feb 28 06:22:16 IST 2016,oh jealous
FenstarDeLuxe,Sun Feb 28 06:21:56 IST 2016,outrag take day go beach
FenstarDeLuxe,Sun Feb 28 06:02:36 IST 2016,fetish disord unless caus person distress harm sexposit
FenstarDeLuxe,Sun Feb 28 04:33:31 IST 2016,gosh i headach which shit coz i hundr thing today
FenstarDeLuxe,Sat Feb 27 19:11:28 IST 2016,tattoo collabor come togeth i fuck wait
FenstarDeLuxe,Sat Feb 27 18:20:06 IST 2016,i use think wonder mayb stroke
FenstarDeLuxe,Sat Feb 27 18:19:48 IST 2016,i use wake one leg around knee area alway sweati and
FenstarDeLuxe,Sat Feb 27 18:19:07 IST 2016,one sweati it clear connect rage drug abus
FenstarDeLuxe,Sat Feb 27 18:11:26 IST 2016,oh i miss best hope whole denial thing work
FenstarDeLuxe,Sat Feb 27 17:10:41 IST 2016,well perfect night stonningtonsymphoni
FenstarDeLuxe,Sat Feb 27 15:22:46 IST 2016,appar i perth go home phone drunk
FenstarDeLuxe,Sat Feb 27 15:12:30 IST 2016,perfect even stonningtonsymphoni
FenstarDeLuxe,Fri Feb 26 22:03:19 IST 2016,phone call middl night make heart happi i miss much
FenstarDeLuxe,Fri Feb 26 18:46:47 IST 2016,how actual hell left arm cover mozzi bite i readi scratch skin
FenstarDeLuxe,Fri Feb 26 18:15:37 IST 2016,pardon
FenstarDeLuxe,Fri Feb 26 18:12:20 IST 2016,want preserv too late whing damag done
FenstarDeLuxe,Fri Feb 26 11:21:16 IST 2016,alex eye macro macro bengal fenstar imag
FenstarDeLuxe,Fri Feb 26 10:45:10 IST 2016,nope
FenstarDeLuxe,Fri Feb 26 04:58:24 IST 2016,purchas awesom new book i heard program can wait arriv
FenstarDeLuxe,Fri Feb 26 02:39:39 IST 2016,the aircon kick current status human ice block
FenstarDeLuxe,Fri Feb 26 02:03:57 IST 2016,pfft ignor messag
FenstarDeLuxe,Fri Feb 26 00:50:15 IST 2016,hahahahaha
FenstarDeLuxe,Thu Feb 25 15:35:30 IST 2016,this
FenstarDeLuxe,Thu Feb 25 15:32:19 IST 2016,yeah requir thought
FenstarDeLuxe,Thu Feb 25 15:30:15 IST 2016,fuck yes i wish i could rt
FenstarDeLuxe,Thu Feb 25 02:10:53 IST 2016,free flower wooli morn brighten day
FenstarDeLuxe,Wed Feb 24 17:04:47 IST 2016,why i awak
FenstarDeLuxe,Wed Feb 24 17:01:33 IST 2016,yup excruci
