username,time,tweet
fakemodesty69,Wed Apr 15 12:24:56 IST 2015,bbcbreakfast depth piec potato how
fakemodesty69,Wed Apr 15 02:55:19 IST 2015,i think tori wear dunc hat easi identif especi ms fernando
fakemodesty69,Wed Apr 15 02:52:42 IST 2015,rt what just even tori repuls
fakemodesty69,Wed Apr 15 02:52:16 IST 2015,chamalifernando complet bitch idiot
fakemodesty69,Wed Apr 15 01:57:57 IST 2015,madeinchelsea make shudder peopl aw act fake realli crappi
fakemodesty69,Wed Apr 15 01:45:20 IST 2015,tri watch internet decid go pearshap
fakemodesty69,Wed Apr 15 00:53:59 IST 2015,great dog
fakemodesty69,Wed Apr 15 00:52:19 IST 2015,chimp swat drone sky netherland zoo video damn clever chimp
fakemodesty69,Wed Apr 15 00:51:06 IST 2015,i think tori wear
fakemodesty69,Wed Apr 15 00:23:21 IST 2015,to fair admir tori chutzpah face housingcrisi solut someth expert say help start
fakemodesty69,Wed Apr 15 00:20:23 IST 2015,well said hater need hobbi hate
fakemodesty69,Wed Apr 15 00:20:07 IST 2015,rt you huge amount go life stop gay peopl get marri big concern i
fakemodesty69,Wed Apr 15 00:18:45 IST 2015,rolfharri sunday night glastonburi
fakemodesty69,Wed Apr 15 00:04:37 IST 2015,rt tori candid actual think mental ill peopl wear wristband
fakemodesty69,Tue Apr 14 23:27:27 IST 2015,swam meter swim i hungri
fakemodesty69,Tue Apr 14 23:21:30 IST 2015,tori deni right buy hous elect pledg unafford hous chao follow tori
fakemodesty69,Tue Apr 14 23:19:20 IST 2015,nigeria
fakemodesty69,Tue Apr 14 23:18:17 IST 2015,smellypeopl train yuck tomorrow hotter
fakemodesty69,Tue Apr 14 19:30:41 IST 2015,ugli boyfriend make clever malemodel
fakemodesty69,Tue Apr 14 19:29:40 IST 2015,wish i lie soho harass
fakemodesty69,Tue Apr 14 19:23:07 IST 2015,rt this ultim tv renew cancel scorecard
fakemodesty69,Tue Apr 14 19:21:15 IST 2015,pretti good pho
fakemodesty69,Tue Apr 14 18:56:21 IST 2015,steve bell tori labour elect pledg cartoon
fakemodesty69,Tue Apr 14 18:39:13 IST 2015,anyon got gag liztruss
fakemodesty69,Tue Apr 14 18:38:34 IST 2015,rt liz truss parti minion destroy leader chanc anoth term go girl cameronmustgo wato
fakemodesty69,Tue Apr 14 18:36:56 IST 2015,pleas pier morgan
fakemodesty69,Tue Apr 14 16:31:10 IST 2015,laughingga harmless small dose helium ban next
fakemodesty69,Tue Apr 14 15:42:29 IST 2015,rt reason extend right to buy anoth disast wait happen
fakemodesty69,Tue Apr 14 15:24:17 IST 2015,to show harm coalit done poor south east london perhap simonhugh
fakemodesty69,Tue Apr 14 15:17:29 IST 2015,righttobuy increas social mobil help landlord estat agent etc conservativemanifesto piss poor
fakemodesty69,Tue Apr 14 02:59:52 IST 2015,good graffiti toilet gay bar soho
fakemodesty69,Tue Apr 14 02:53:07 IST 2015,rt read full respons today rail disrupt due work london bridg station
fakemodesty69,Tue Apr 14 02:46:18 IST 2015,londonbridg quicker cross river take dlr attempt entri london appal
fakemodesty69,Mon Apr 13 20:09:37 IST 2015,i got
fakemodesty69,Mon Apr 13 16:20:13 IST 2015,rt peopl get angri train delay london bridg
fakemodesty69,Mon Apr 13 16:17:54 IST 2015,normal servic month year unless crap new normal
fakemodesty69,Mon Apr 13 16:05:11 IST 2015,jean mari le pen retreat front nation famili feud good
fakemodesty69,Mon Apr 13 15:48:10 IST 2015,crabwalk must read
fakemodesty69,Mon Apr 13 15:09:05 IST 2015,mayb earthquak pr sanandrea hollywood good pr
fakemodesty69,Mon Apr 13 14:59:37 IST 2015,rt get bbqs much uk hotter spain week
fakemodesty69,Mon Apr 13 14:54:02 IST 2015,londonbridg anoth day delay taken hour get lewisham london bridg nationalrail
fakemodesty69,Mon Apr 13 12:27:33 IST 2015,did allah invent plate tecton earthquak
fakemodesty69,Mon Apr 13 12:25:43 IST 2015,earthquak could fat peopl fall bed get losangel
fakemodesty69,Mon Apr 13 01:33:52 IST 2015,love vera accent oh god
fakemodesty69,Mon Apr 13 00:39:09 IST 2015,rt no one work harder longer chanc lead free world
fakemodesty69,Mon Apr 13 00:33:19 IST 2015,like
fakemodesty69,Sun Apr 12 23:43:10 IST 2015,pope boost armenia effort ottoman kill recognis genocid
fakemodesty69,Sun Apr 12 15:00:05 IST 2015,listen clegg talk good talk still conserv fluffi liber cloth
fakemodesty69,Sun Apr 12 14:51:53 IST 2015,rt georg osborn said increas nhs spend year he absolut a blatant lie marr http
fakemodesty69,Sun Apr 12 14:48:08 IST 2015,rt the troubl preposit littl word struggl master languag
