username,time,tweet
Yorelyzss,Mon May 18 20:00:58 IST 2015,bendigo al tipo que se antojo de pasar el trimer cuando quiero estudiar mean ameeeeeen
Yorelyzss,Sat May 16 21:42:45 IST 2015,feed billion vía
Yorelyzss,Thu May 14 17:27:22 IST 2015,rt asamblea multisectori en directo desd el teatro
Yorelyzss,Thu May 14 02:23:07 IST 2015,rt estudiant ayudan recog la basura en la call fortaleza
Yorelyzss,Thu May 14 02:22:58 IST 2015,rt envivo escuch lo que ocurr en esto momento en la fortaleza
Yorelyzss,Mon Apr 27 07:30:33 IST 2015,notcryingonsuday
Yorelyzss,Thu Oct 23 03:22:04 IST 2014,sunset view share time love one
Yorelyzss,Tue Aug 05 07:04:28 IST 2014,nena despué explica
Yorelyzss,Sun Aug 03 02:22:51 IST 2014,pero yo recivido ninguna llamada tuya
Yorelyzss,Fri Aug 01 07:23:09 IST 2014,queee o
Yorelyzss,Thu Jul 10 05:07:23 IST 2014,mucha gracia muy eficient
Yorelyzss,Thu Jul 10 04:17:38 IST 2014,rt podrían confrontar intermitencia los sector aledaño en casco del pueblo de río piedra santa rita
Yorelyzss,Thu Jul 10 04:17:33 IST 2014,rt se trabaja reparación de línea de en la call manila en urb sana rita en río piedra
Yorelyzss,Thu Jul 10 04:08:09 IST 2014,la comunidad de santa rita está sin agua desd hace hora informen cuando se resolverá el problema
Yorelyzss,Tue Jul 08 08:20:32 IST 2014,rt when parent tell i go
Yorelyzss,Tue Jul 08 08:20:02 IST 2014,rt hot chocol hot like made perfect temperatur i wait day
Yorelyzss,Tue Jul 08 08:19:09 IST 2014,de que vecino hablamo o
Yorelyzss,Wed Jul 02 07:01:53 IST 2014,rt there stori behind everi person there reason way think judg
Yorelyzss,Wed Jul 02 07:01:36 IST 2014,hahahhaha
Yorelyzss,Wed Jul 02 06:57:22 IST 2014,awww miss u nigga
Yorelyzss,Sun Jun 22 22:14:17 IST 2014,esta super bueno ambo equipo intenso
Yorelyzss,Mon Jun 09 21:35:01 IST 2014,rt world cup fever start nowplay vida puertorico http
Yorelyzss,Mon Apr 14 20:34:25 IST 2014,check mix pentatonix
Yorelyzss,Fri Apr 11 02:31:40 IST 2014,rt when repeat mistak mistak anymor decis
Yorelyzss,Tue Apr 08 23:41:20 IST 2014,asamblea upr
Yorelyzss,Tue Apr 01 06:38:28 IST 2014,feel positiev
Yorelyzss,Thu Mar 20 01:36:05 IST 2014,comiendo cheesecak de pistacho con la socia cheesecak pistacho yum
Yorelyzss,Tue Mar 11 22:36:21 IST 2014,si es para hacer de chalé no quiero hahahah
Yorelyzss,Tue Mar 11 22:34:26 IST 2014,ha txt
Yorelyzss,Tue Mar 11 22:33:52 IST 2014,si tu lo dice hahahaja
Yorelyzss,Tue Mar 11 22:32:56 IST 2014,esta aburrida
Yorelyzss,Tue Mar 11 22:31:06 IST 2014,esta son cosa que se escriben en twitter nigga hahahha
Yorelyzss,Tue Mar 11 22:27:39 IST 2014,la reseción de pr llegado todo lado haha
Yorelyzss,Tue Feb 11 07:28:49 IST 2014,en la pobreza la alegria se considera insensibilidad la melancolia mal humor himmelfarb
Yorelyzss,Tue Feb 11 07:20:12 IST 2014,la desigualdad social comienza con la propiedad privada j rousseau
Yorelyzss,Fri Feb 07 07:30:08 IST 2014,i extrem recomend movi it splendid i wonder time girl lovu guy
Yorelyzss,Thu Feb 06 23:18:43 IST 2014,hahaahaja
Yorelyzss,Thu Feb 06 19:28:11 IST 2014,hahahaa te sient cm angel yamil en la clase de rodriguez hahaaha
Yorelyzss,Thu Feb 06 18:55:16 IST 2014,l os hombr opresor pueden ser utópico no pueden ser profético por tanto pueden tener esperanza freir
Yorelyzss,Thu Feb 06 18:40:17 IST 2014,kuajajajajja
Yorelyzss,Wed Feb 05 22:22:49 IST 2014,yeap that right
Yorelyzss,Wed Feb 05 19:11:51 IST 2014,lelolelo
Yorelyzss,Wed Feb 05 19:08:03 IST 2014,hahaahaha ahhh de ahi es que interesant es la vida
Yorelyzss,Wed Feb 05 19:04:32 IST 2014,eso quisiera saber yo ella habla de walgreen cm si fuera un restaurant
Yorelyzss,Wed Feb 05 18:58:41 IST 2014,ay ya
Yorelyzss,Wed Feb 05 18:55:06 IST 2014,acompanala al ami es que alguien dejo quier acompanar santa rosa
Yorelyzss,Wed Feb 05 18:42:55 IST 2014,pue vas
Yorelyzss,Wed Feb 05 18:33:12 IST 2014,dijist que queria ir yo voy para las scarf
Yorelyzss,Wed Feb 05 18:32:30 IST 2014,siii si quier cuando salgan del esperan en el ap cm quieran yo salgo la clase encuentro cn ustd
Yorelyzss,Wed Feb 05 18:28:02 IST 2014,esa ere tu hahahaha
