username,time,tweet
odiegogomes,Mon Feb 29 08:13:47 IST 2016,momento humor negro literalment oscar black histori
odiegogomes,Mon Feb 29 07:48:22 IST 2016,por que compra direito oscar e transmit só que convém quem quer ver bbb se não quer transmitir libera concorrência
odiegogomes,Mon Feb 29 06:22:26 IST 2016,sansa virou sonsa rooney mara virou neimara será que faltou preparação oscar tapetevermelhonognt
odiegogomes,Mon Feb 29 05:52:35 IST 2016,astrid sua louca assim não tem como te defend muito perdida locona tapetevermelhonognt tiremeladoar
odiegogomes,Mon Feb 29 05:35:40 IST 2016,lilian pacc atendendo telefon ao vivo durant transmissão traz gloria kalil por favor tapetevermelhonognt
odiegogomes,Sat Feb 27 21:32:13 IST 2016,adoramo apena ao que conhecemo não pode existir adoração se não conhecermo deus que dizemo amar e cultuar
odiegogomes,Fri Feb 26 22:33:47 IST 2016,cristianismo é nossa resposta ao amor doador de deus que nos alcançou o amamo porqu ele nos amou primeiro
odiegogomes,Fri Feb 26 02:32:16 IST 2016,a verdadeira adoração é uma atitud de nós para deus mas produz benefício para nós ela garant que deus é dono dos nosso coraçõ
odiegogomes,Thu Feb 25 01:31:09 IST 2016,a gratidão é como um óculo ou como filtro certo instagram não muda que vemo muda forma como vemo que vemo faladiego
odiegogomes,Thu Feb 25 01:00:52 IST 2016,não precisamo de mai coisa para sermo mai feliz precisamo de uma mudança interior aprend ser grato em qualquer circunstância
odiegogomes,Thu Feb 25 00:31:01 IST 2016,dependência absoluta de deus é nosso testemunho de confiança quando dependemo dele anunciamo ao mundo que ele é bom e cuida de nós
odiegogomes,Wed Feb 24 05:05:08 IST 2016,no meio de tudo que estamo vivendo vem e coloca um horário político obrigatório ant jornal vontad de vomitar
odiegogomes,Wed Feb 24 02:35:17 IST 2016,a tolerância é patrimônio de quem tem convicçõ em um diálogo sábio é que argumenta c conteúdo e não pelo volum de sua voz faladiego
odiegogomes,Wed Feb 24 02:31:38 IST 2016,é possível divergir sem agredir pensar diferent não é motivo para ofensa precisamo aprend expressar opiniõ c respeito faladiego
odiegogomes,Wed Feb 24 01:30:54 IST 2016,jesus ensinou que exist muita sabedoria na vida cotidiana precisamo de olho aberto p aprendermo com parábola nosso dia dia
odiegogomes,Tue Feb 23 07:55:59 IST 2016,peguem xuxa meneghel jeito que está hoje e joguem na sexta noit ficadicarecord obrigado de nada xuxanarecord
odiegogomes,Tue Feb 23 07:52:09 IST 2016,prefiro gravado a edição está ótima programa ficou leve ao vivo deveria ser apena pra data especiai
odiegogomes,Tue Feb 23 07:47:17 IST 2016,parec que finalment xuxanarecord acertou quadro bon edição acertada tia colocou produção pra trabalhar
odiegogomes,Thu Feb 18 05:56:08 IST 2016,nest mundo tem seu tempo cada coisa tem sua ocasião eclesiast
odiegogomes,Thu Feb 18 02:28:34 IST 2016,rt em nova prévia da reunião de friend elenco fala da amizad entr ele
odiegogomes,Thu Feb 18 00:53:42 IST 2016,janelinha forev
odiegogomes,Thu Feb 11 19:50:48 IST 2016,mate gelado se batido com limão então
odiegogomes,Wed Feb 10 05:38:19 IST 2016,quando eu crescer quero escrev que nem que revelação da palavra e sabedoria
odiegogomes,Wed Feb 10 05:37:39 IST 2016,rt o bastant e suficient
odiegogomes,Wed Feb 10 05:19:38 IST 2016,último post da série bem aventurado ar foi um prazer compartilhar essa semana com você blogdodiego
odiegogomes,Thu Feb 04 19:32:33 IST 2016,o quarto post da série bem aventurado está ar hoje falando sobr fome e sede de justiça blogdodiego
odiegogomes,Wed Feb 03 21:05:56 IST 2016,tem texto novo da série bem aventurado ar hoje tema é mansidão já sabe né cliqu leia compartilh
odiegogomes,Tue Feb 02 23:31:05 IST 2016,o segundo post da série bem aventurado está ar blogdodiego
odiegogomes,Tue Feb 02 20:48:08 IST 2016,frase louvor adoração todoserquerespira
odiegogomes,Tue Feb 02 00:12:58 IST 2016,a resolveu meu problema e internet está de volta ufa vivo pegabem atendebem
odiegogomes,Mon Feb 01 20:15:37 IST 2016,está ar primeiro post da série bem aventurado blogdodiego pobr em espírito
odiegogomes,Mon Feb 01 20:02:01 IST 2016,enviei todo os dado por dm aguardo retorno atenciosament
odiegogomes,Mon Feb 01 07:00:39 IST 2016,final de semana detox digit graça net e vivo descobri uma pessoa aqui em casa que dizem ser meus familiar semwifi
odiegogomes,Thu Jan 28 22:38:26 IST 2016,a graça ensina que embora eu seja amado e aceito como sou sempr poderei melhorar e parec mai com cristo faladiego
odiegogomes,Thu Jan 28 00:44:19 IST 2016,semana que vem tem série nova blogdodiego fiqu ligado
odiegogomes,Wed Jan 27 05:25:51 IST 2016,rt por todo brasil oramo para que palavra se torn um instrumento simpl e acessível para um encontro com
odiegogomes,Mon Jan 25 22:14:13 IST 2016,rt christian think god love us good god make us good he love us
odiegogomes,Mon Jan 25 20:27:27 IST 2016,que foo meee
odiegogomes,Sun Jan 24 21:34:41 IST 2016,como é incrível agora diga obrigada gal costa melhor técnica melhor humor thevoicekid thevoicekidsbr
odiegogomes,Sat Jan 23 02:23:07 IST 2016,rt in everi generat world chang peopl stand someth fear unpopular dare
odiegogomes,Thu Jan 21 23:12:54 IST 2016,eu amo quando cozinha de casa está sendo usada hoje vai ter trança de frio e browni de chocol p receb amigo querido féria
odiegogomes,Thu Jan 21 22:23:15 IST 2016,a oração é fôlego de vida cristão não é que faz viver mas evidência de que ele está vivo oswald chamber frase
odiegogomes,Thu Jan 21 06:53:19 IST 2016,rt never preach lead worship prove point the whole goal power holi spirit reveal
odiegogomes,Thu Jan 21 00:29:01 IST 2016,tem texto novo blogdodiego hoje falando sobr sede já sabe esquema né leia coment compartilh
odiegogomes,Wed Jan 20 23:45:50 IST 2016,aquel momento em que você está concentrado na leitura e um pássaro invad seu quarto quas te matando coração
odiegogomes,Wed Jan 20 21:50:08 IST 2016,gosta de ler e de estudar bíblia conheça blogdodiego c texto novo toda semana leitura vidacristã bíblia
odiegogomes,Wed Jan 20 21:46:14 IST 2016,a verdadeira batalha espiritu é aquela que acontec dentro de nós é vencer treva que existem em mim primeiro faladiego
odiegogomes,Tue Jan 19 23:14:22 IST 2016,a quem tenho nos céus senão ti e na terra nada mai desejo além de estar junto ti sl
odiegogomes,Tue Jan 19 22:03:23 IST 2016,a meditação na palavra é como carvão para fogo é combustível para avivamento que buscamo faladiego
odiegogomes,Tue Jan 19 20:52:39 IST 2016,minha rede sociai instagram odiegogom snapchat odiegogom twitter odiegogom facebook diegogomesofici
