username,time,tweet
Crayzooz,Wed May 13 18:07:23 IST 2015,when custom come complain take i tell suggest manag back away
Crayzooz,Wed May 13 18:02:53 IST 2015,some peopl live life i sit see happen end i see love hate i see cri laugh
Crayzooz,Wed May 13 18:00:24 IST 2015,i easi listen mind quiet peac also dead dark
Crayzooz,Wed May 13 03:52:56 IST 2015,hello olloclip fishey lens meow
Crayzooz,Tue May 12 01:46:46 IST 2015,olloclip new begin p photographi macro fishey lens
Crayzooz,Sun May 10 03:39:54 IST 2015,rt we go hand galaxi gear vr headset
Crayzooz,Fri May 08 05:42:45 IST 2015,rt payday crimewav edit reveal releas date xbox one
Crayzooz,Fri May 08 05:41:50 IST 2015,rt the appl watch impress design interfac first gen issu
Crayzooz,Fri May 08 02:29:04 IST 2015,rt grand theft train hijack railroad
Crayzooz,Fri May 08 02:27:13 IST 2015,mrekeb terbuh
Crayzooz,Fri May 08 02:26:25 IST 2015,as grow addict bass loud music i come find i get realli relax good thing damag ear drum p
Crayzooz,Thu May 07 19:34:19 IST 2015,morn heartbeat beat faster p
Crayzooz,Thu May 07 19:33:14 IST 2015,anyon need gut i got donat xd
Crayzooz,Wed May 06 02:34:51 IST 2015,projectcar great realist race game aint type fuck lemm get back onlin
Crayzooz,Tue May 05 23:31:37 IST 2015,what part world i live know news around i bet dead know thing i
Crayzooz,Tue May 05 21:18:51 IST 2015,twitter count ot tweet retweet anoth twitter suggest updat
Crayzooz,Tue May 05 21:13:19 IST 2015,rt revolutionari construct conserv execut ford f review
Crayzooz,Tue May 05 21:12:08 IST 2015,rt the end rivalri mitsubishi lancer evolut mr subaru wrx sti
Crayzooz,Tue May 05 21:11:58 IST 2015,rt it still old dirt mercedesbenz g class get new engin
Crayzooz,Tue May 05 21:11:49 IST 2015,rt the gt r get respect anymor here defiant commentari
Crayzooz,Tue May 05 21:10:00 IST 2015,what bad idea lamborghini build suv the way benz build pickup truck
Crayzooz,Tue May 05 21:08:51 IST 2015,rt the italian govern want give lamborghini lot build suv home
Crayzooz,Tue May 05 17:08:01 IST 2015,i critic i wont time i turn kill coz time late wake
Crayzooz,Tue May 05 17:05:29 IST 2015,i say aint worth blood boil i troll day away you still get fukk with doubl k
Crayzooz,Tue May 05 17:03:57 IST 2015,when energi ember nowher critic mad work the energi asshol you fukk with doubl k
Crayzooz,Mon May 04 20:41:45 IST 2015,i jus rebuit clashofclan base defend attack in a row still nobodi activ defens shield
Crayzooz,Sun May 03 04:52:43 IST 2015,there well beeh mani manni peep bet manni win p mani manni mani manni hahahahaha maaannnn better go sleep
Crayzooz,Sun May 03 04:47:25 IST 2015,smartest convers ive heard far
Crayzooz,Sun May 03 04:46:47 IST 2015,rt manni throw shade floyd
Crayzooz,Sun May 03 04:45:38 IST 2015,im ocd come haircut avoid peopl punch face
Crayzooz,Sun May 03 04:40:47 IST 2015,selfi gtaonlin crew cuz
Crayzooz,Sun May 03 04:36:54 IST 2015,let hope vacat run graduat ceremoni
Crayzooz,Sat May 02 13:40:49 IST 2015,rt we talk like see possibl watch dog
Crayzooz,Sat May 02 13:39:19 IST 2015,rt mayweatherpacquiao biggest crowd ever box weigh maypac
Crayzooz,Sat May 02 13:38:19 IST 2015,rt why marilyn manson use old playstat disc releas ninth studio album
Crayzooz,Sat May 02 13:36:01 IST 2015,weekday oh man wish weekend weekend i gotta go somewher stink bed two day
Crayzooz,Fri May 01 00:25:21 IST 2015,when new haircut make look like idiot
Crayzooz,Thu Apr 30 21:51:20 IST 2015,so i dreamt i gun i kill everyon
Crayzooz,Wed Apr 29 17:51:46 IST 2015,and diarrhea award goe tooooo
Crayzooz,Tue Apr 28 17:49:24 IST 2015,why i agre food tast good system doesnt make blast toilet
Crayzooz,Tue Apr 28 14:58:03 IST 2015,where cressida option situat notic milag car rise less week
Crayzooz,Tue Apr 28 14:52:27 IST 2015,when wish go back time fuck somebodi day walk away make normal day oh pleas
Crayzooz,Tue Apr 28 14:49:13 IST 2015,i break bumper shit pant jus avoid scratch fuck car tho wouldnt care hit run parkitright noob
Crayzooz,Tue Apr 28 14:47:02 IST 2015,not also real life xd dump car final
Crayzooz,Tue Apr 28 04:48:00 IST 2015,when tast blood tast iron iron coz main made iron lol ok one last tweet ahhh lame senseless
Crayzooz,Tue Apr 28 04:44:49 IST 2015,fuck answer everi solut everi style like you gotta find one fit perfect
Crayzooz,Tue Apr 28 04:40:57 IST 2015,am i outdat whatsapp real sinc call made shit p
Crayzooz,Tue Apr 28 03:01:12 IST 2015,i get go sleep other get readi work p would better batman shift haha
Crayzooz,Tue Apr 28 01:21:45 IST 2015,land cruiser
