username,time,tweet
I_Pink_Elephant,Fri Apr 03 01:47:10 IST 2015,human live bah silli thing matter game polit leadersdeb
I_Pink_Elephant,Fri Apr 03 01:45:19 IST 2015,i want three side coin leadersdeb
I_Pink_Elephant,Fri Apr 03 01:43:54 IST 2015,rt our three popular politician tonight guess leadersdeb
I_Pink_Elephant,Fri Apr 03 01:43:16 IST 2015,we differ definit word normal seem
I_Pink_Elephant,Fri Apr 03 01:41:28 IST 2015,well said immigr use excus failur govern leadersdeb
I_Pink_Elephant,Fri Apr 03 01:39:44 IST 2015,rt great hear take anti immigr myth we progress
I_Pink_Elephant,Fri Apr 03 01:39:10 IST 2015,rt is nigel realli tri play commi card the end quit ago leadersdeb
I_Pink_Elephant,Fri Apr 03 01:38:57 IST 2015,you would make fab mp
I_Pink_Elephant,Fri Apr 03 01:38:34 IST 2015,rt leadersdeb joan i keep think talk make nervous
I_Pink_Elephant,Fri Apr 03 01:37:18 IST 2015,well said nicola sturgeon women panel rock tonight men seem like soulless robot leadersdeb
I_Pink_Elephant,Fri Apr 03 01:33:17 IST 2015,rt speak hiv immigr find women rape tortur conflict zone farag would let die
I_Pink_Elephant,Fri Apr 03 01:32:27 IST 2015,ditto
I_Pink_Elephant,Fri Apr 03 01:31:59 IST 2015,rt posit twitter feel toward women negat toward men follow http
I_Pink_Elephant,Fri Apr 03 01:31:19 IST 2015,immigr poor farag its like gone heath tourist foreign aid patient leadersdeb
I_Pink_Elephant,Fri Apr 03 01:29:25 IST 2015,rt return issu immigr nigel talk anyth els night leadersdeb
I_Pink_Elephant,Fri Apr 03 01:29:12 IST 2015,do i i half way episod leadersdeb
I_Pink_Elephant,Fri Apr 03 01:26:02 IST 2015,rt horrifi hear farag exploit victim hiv polit gain believ compassion
I_Pink_Elephant,Fri Apr 03 01:25:43 IST 2015,peopl like farag make embarrass uk citizen horrid man frighten parti leadersdeb
I_Pink_Elephant,Fri Apr 03 01:22:24 IST 2015,rt nigel farag push myth health tourism hiv stigma this man loathsom belong polit stage
I_Pink_Elephant,Fri Apr 03 01:22:04 IST 2015,rt yep farag goe turn hiv foreign leadersdeb
I_Pink_Elephant,Fri Apr 03 01:19:15 IST 2015,rt we end nhs privatis scrap market unwind pfi deal increas fund strengthen social care gps mental health
I_Pink_Elephant,Fri Apr 03 01:18:51 IST 2015,rt yes horribl play galleri a danger clown
I_Pink_Elephant,Fri Apr 03 01:18:27 IST 2015,farag probabl think would got sooner stop sell dvd tor oversea compani leadersdeb
I_Pink_Elephant,Fri Apr 03 01:17:06 IST 2015,rt when someon go ask import question like when the underwat menac actual come
I_Pink_Elephant,Fri Apr 03 01:16:59 IST 2015,well said cleggi need help mental health care treatment make less taboo talk leadersdeb
I_Pink_Elephant,Fri Apr 03 01:15:20 IST 2015,rt agre natali get involv leadersdeb
I_Pink_Elephant,Fri Apr 03 01:14:54 IST 2015,my mum work nhs almost mani year she said foreign pay servic leadersdeb
I_Pink_Elephant,Fri Apr 03 01:12:41 IST 2015,oh look go foreign leadersdeb
I_Pink_Elephant,Fri Apr 03 01:12:01 IST 2015,rt they dump johnni it terri terri terri terri terri the nation salut terri it terri nation
I_Pink_Elephant,Fri Apr 03 01:11:31 IST 2015,poor johni longer center uk polit power
I_Pink_Elephant,Fri Apr 03 01:10:04 IST 2015,rt fact all nhs propos ukip deal effect smoke drink leader
I_Pink_Elephant,Fri Apr 03 01:09:53 IST 2015,rt increas foreign aid we need stabl world tackl hunger diseas protect human right yes natali
I_Pink_Elephant,Fri Apr 03 01:08:04 IST 2015,rt place profit motiv health care free prescript eye care dental
I_Pink_Elephant,Fri Apr 03 01:06:02 IST 2015,rt farag bang cut foreign aid look increas silli unfair selfish well done speak
I_Pink_Elephant,Fri Apr 03 01:05:34 IST 2015,johnni leadersdeb
I_Pink_Elephant,Fri Apr 03 01:02:53 IST 2015,farag want leader uk how go soct go help leadersdeb
I_Pink_Elephant,Fri Apr 03 01:02:21 IST 2015,i think even get bit board
I_Pink_Elephant,Fri Apr 03 01:01:52 IST 2015,ask johnni debat seem impress reason
I_Pink_Elephant,Fri Apr 03 01:01:07 IST 2015,bet farag get public alway vote joke act leadersdeb
I_Pink_Elephant,Fri Apr 03 01:00:12 IST 2015,rt do get vote one leader anoth leadersdeb
I_Pink_Elephant,Fri Apr 03 00:59:03 IST 2015,rt so glad i watch leadersdeb subtitl
I_Pink_Elephant,Fri Apr 03 00:58:06 IST 2015,rt well done clegg rebuk farag oversea aid i want make poorest world poorer still leadersdeb
I_Pink_Elephant,Fri Apr 03 00:56:50 IST 2015,rt draft letter cameron go leav behind may leadersdeb
I_Pink_Elephant,Fri Apr 03 00:56:35 IST 2015,johnni is one audienc somth leadersdeb
I_Pink_Elephant,Fri Apr 03 00:53:46 IST 2015,that uncal poor cod compar
I_Pink_Elephant,Fri Apr 03 00:51:53 IST 2015,farag remind boogeyman dark fairytal leadersdeb
I_Pink_Elephant,Fri Apr 03 00:51:07 IST 2015,cameron clegg argu joke ball would stood last year leadersdeb
I_Pink_Elephant,Fri Apr 03 00:47:55 IST 2015,rt you said go nando johnni leadersdeb
I_Pink_Elephant,Fri Apr 03 00:46:46 IST 2015,go quit tedious leadersdeb
