username,time,tweet
sgowsmith1988,Wed Feb 24 12:42:02 IST 2016,white wealthi privileg aliv well unitaryplan
sgowsmith1988,Wed Feb 24 12:41:10 IST 2016,yeah peopl got everyth free shit rest us bugger unitaryplan
sgowsmith1988,Wed Feb 24 12:39:16 IST 2016,a sad day auckland urban sprawl continu peopl support leav younger generat mess unitaryplan
sgowsmith1988,Wed Feb 24 12:25:29 IST 2016,so good right wouldn mind go hall oat concert yachtrockfan
sgowsmith1988,Wed Feb 24 10:27:26 IST 2016,rt rock roll rap
sgowsmith1988,Wed Feb 24 10:27:22 IST 2016,rt bro said macklemor import music offens macklemor nice human
sgowsmith1988,Wed Feb 24 08:58:46 IST 2016,rt l l
sgowsmith1988,Wed Feb 24 08:27:57 IST 2016,rt nowherebro soundcloud check us dope music review podcast everi month
sgowsmith1988,Wed Feb 24 08:17:49 IST 2016,snackabl way
sgowsmith1988,Wed Feb 24 08:09:13 IST 2016,yes rip mr bowi
sgowsmith1988,Wed Feb 24 08:00:30 IST 2016,sound like lot love jen ex news peopl much compani boss nzmedia
sgowsmith1988,Wed Feb 24 07:56:54 IST 2016,had enough soft news jen mediawork nzmedia
sgowsmith1988,Wed Feb 24 07:56:00 IST 2016,of cours
sgowsmith1988,Wed Feb 24 07:55:15 IST 2016,mark jen leav mediawork
sgowsmith1988,Wed Feb 24 07:45:23 IST 2016,rt just disgrac behaviour
sgowsmith1988,Wed Feb 24 06:14:58 IST 2016,rt if entrepreneur may debt lawsuit fact
sgowsmith1988,Wed Feb 24 02:31:39 IST 2016,as capitalist societi divid beach base much peopl paid if contribut get beach
sgowsmith1988,Wed Feb 24 01:48:28 IST 2016,rt i think could buy beach wasn quit big deal made issu
sgowsmith1988,Wed Feb 24 01:40:30 IST 2016,i struggl understand buy piec natur also local iwi consult
sgowsmith1988,Tue Feb 23 15:45:37 IST 2016,this noth icc should ban test match least the guy earn fortun play australia
sgowsmith1988,Tue Feb 23 11:58:00 IST 2016,penni huls poor peopl sea view know unitaryplan nzmedia nzpol
sgowsmith1988,Tue Feb 23 11:54:32 IST 2016,great discuss unitari plan hous auckland waatea estat this current affair nzmedia
sgowsmith1988,Tue Feb 23 11:40:01 IST 2016,now live stream on everi week night
sgowsmith1988,Tue Feb 23 11:33:18 IST 2016,waatea estat get good guest tonight penni huls head salvat armi
sgowsmith1988,Tue Feb 23 11:16:56 IST 2016,this week album anniversari gang starr step in arena celebr year nowherebro gangstarr
sgowsmith1988,Tue Feb 23 11:06:16 IST 2016,rt can kiwi explain anyon christchurch would vote nation parti
sgowsmith1988,Tue Feb 23 11:00:16 IST 2016,cool
sgowsmith1988,Tue Feb 23 10:26:43 IST 2016,
sgowsmith1988,Tue Feb 23 09:19:13 IST 2016,bracewel quit unlucki bowler has bowl well without much success
sgowsmith1988,Tue Feb 23 09:18:46 IST 2016,also pitch flat day break like use and anomali come along nagpur bad pitch nzvaus
sgowsmith1988,Tue Feb 23 09:15:08 IST 2016,interest bracewel henri wagner bowl ok sinc bond left two much
sgowsmith1988,Tue Feb 23 09:12:55 IST 2016,workload mayb problem injuri have hard miss test shouldn play fit rtpt nzvaus
sgowsmith1988,Tue Feb 23 09:11:36 IST 2016,boult southe penetr recent time usual boult wicket last test southe last test nzvaus
sgowsmith1988,Tue Feb 23 08:22:25 IST 2016,i rememb stuart broad bat got bad drop ten same thing happen southe
sgowsmith1988,Tue Feb 23 08:20:56 IST 2016,senior explan certain form credibl
sgowsmith1988,Tue Feb 23 06:20:58 IST 2016,rt well play kane williamson face barrag qualiti revers swing bowl batsmen could even
sgowsmith1988,Tue Feb 23 05:30:10 IST 2016,rt a caltex techron josh hazlewood nzvaus
sgowsmith1988,Tue Feb 23 05:14:18 IST 2016,everyth make sens
sgowsmith1988,Tue Feb 23 05:11:55 IST 2016,remind hospit
sgowsmith1988,Tue Feb 23 05:10:22 IST 2016,hsb need bulldoz
sgowsmith1988,Tue Feb 23 05:08:40 IST 2016,rt the custodian game
sgowsmith1988,Tue Feb 23 05:06:41 IST 2016,know let
sgowsmith1988,Tue Feb 23 05:05:41 IST 2016,sort player nzvaus
sgowsmith1988,Tue Feb 23 05:04:20 IST 2016,rt josh hazlewood get life wrong who fuck third umpir mate doesn matter take away
sgowsmith1988,Tue Feb 23 04:32:13 IST 2016,rt nobodi gave shit someon liter shot bullet hone harawira offic but chuck dildo glitter
sgowsmith1988,Mon Feb 22 15:07:03 IST 2016,rt toast revolut night first show
sgowsmith1988,Mon Feb 22 12:21:12 IST 2016,unfortun i think could opportun quit distinct internet snackabl stuff
sgowsmith1988,Mon Feb 22 12:17:00 IST 2016,tell jeez
sgowsmith1988,Mon Feb 22 12:02:29 IST 2016,it quit amaz chang current affair they show stuff find internet no distinct qualiti
sgowsmith1988,Mon Feb 22 11:51:24 IST 2016,this actual realli interest shock horror debat issu clock whowouldhavethought nzmedia
