username,time,tweet
bormod,Sat Apr 11 03:47:21 IST 2015,i sit wait till favorit extens compat
bormod,Sat Apr 11 03:37:09 IST 2015,rt i quit what realli goe appl via
bormod,Wed Apr 08 16:55:54 IST 2015,thank that i love twitter
bormod,Wed Apr 08 16:52:34 IST 2015,where i download teamciti plugin slack thank
bormod,Wed Apr 08 13:04:12 IST 2015,remot job
bormod,Wed Apr 08 03:37:02 IST 2015,in ukrain averag dev buy bigmac earn less third salari dev us
bormod,Wed Apr 08 03:32:46 IST 2015,israel fourth place number dev per peopl accord stackoverflow survey
bormod,Tue Apr 07 13:55:01 IST 2015,wow thank
bormod,Tue Apr 07 12:16:56 IST 2015,psget like app get chocolatey powershel modul
bormod,Mon Apr 06 22:44:40 IST 2015,rt engin least fun peopl know one implement bullshit everyon
bormod,Mon Apr 06 18:07:02 IST 2015,yammer slack
bormod,Mon Apr 06 02:56:46 IST 2015,
bormod,Mon Apr 06 02:51:52 IST 2015,rt engin micromanag justifi even day work time noth ever go
bormod,Fri Apr 03 02:01:33 IST 2015,rt join secret effect unit test full day tutori may brussel btdconf
bormod,Wed Apr 01 19:56:23 IST 2015,rt learn test only develop tod in tod write test a quantum supercomput generat random code
bormod,Wed Apr 01 19:54:08 IST 2015,ad link cat clippi work nobodi notic yet
bormod,Wed Apr 01 17:24:40 IST 2015,mani new featur googl
bormod,Wed Apr 01 15:40:02 IST 2015,can i block head hunter linkedin base regex
bormod,Tue Mar 31 19:39:03 IST 2015,rt tech need recogn shorter work hour human emot environ better perk free lunch
bormod,Tue Mar 31 17:31:18 IST 2015,if use order test rubi admit suck
bormod,Tue Mar 31 01:28:49 IST 2015,rt fear hold back mondaymotiv
bormod,Mon Mar 30 20:46:13 IST 2015,rt frontend look nice mean lot work backend guy
bormod,Mon Mar 30 02:51:35 IST 2015,rt a wise person said hardwar eventu fail softwar eventu work
bormod,Sun Mar 29 21:53:08 IST 2015,rt it import to tell children that anyth dream so one day they blame themselves
bormod,Thu Mar 26 14:43:42 IST 2015,rt i use tip i learn time have chrome tool open click hold mous reload button
bormod,Thu Mar 26 14:14:37 IST 2015,just regist microsoft thinknext
bormod,Wed Mar 25 17:57:06 IST 2015,rt optimist program a test alway pass and folk make sure test fail make
bormod,Wed Mar 25 17:55:32 IST 2015,rt עושה לביתי סדנאות הבית מיזם הכתיבה של אשכול נבו ואורית גידלי מחפש מנהל ת אדמיניסטרטיבי לחצי משרה קו ח ל orit gidali בג
bormod,Wed Mar 25 14:42:56 IST 2015,happi day
bormod,Wed Mar 25 02:24:55 IST 2015,yep rhetor question
bormod,Wed Mar 25 01:51:15 IST 2015,rt everi stackoverflow question
bormod,Wed Mar 25 01:50:20 IST 2015,are applic realli univers
bormod,Wed Mar 25 01:45:42 IST 2015,excel way avoid typo disclaim i work
bormod,Wed Mar 25 01:32:37 IST 2015,rt one hard thing no one teach about program gamedev indiedev code
bormod,Tue Mar 24 22:38:59 IST 2015,speed light goal perform optim
bormod,Tue Mar 24 22:16:35 IST 2015,thank great session web perform
bormod,Tue Mar 24 19:37:15 IST 2015,rt seen match motto whenev i get sad i stop sad awesom instead
bormod,Tue Mar 24 19:13:56 IST 2015,what differ ninja develop rock star develop
bormod,Mon Mar 23 19:34:44 IST 2015,rt at least someon take build serious agil ci
bormod,Mon Mar 23 18:43:57 IST 2015,rt just fun get hire code ninja don show first day when say we see offic today
bormod,Mon Mar 23 16:47:26 IST 2015,rt i troubl believ namingthingsisntthatfuckinghard
bormod,Sun Mar 22 03:55:21 IST 2015,rt pay peopl work open sourc import step make open sourc divers
bormod,Sun Mar 22 03:53:56 IST 2015,great articl thank share
bormod,Fri Mar 20 21:49:18 IST 2015,rt i rt if think test first hard tri debug
bormod,Fri Mar 20 21:45:31 IST 2015,thank work it realli chang way peopl develop dotnet
bormod,Fri Mar 20 14:46:41 IST 2015,correct one
bormod,Fri Mar 20 14:44:59 IST 2015,good idea i use bizark purpos also maintain project
bormod,Fri Mar 20 04:36:24 IST 2015,rt name one hardest problem comput scienc here one time got right
bormod,Fri Mar 20 02:51:56 IST 2015,love ir cc
bormod,Fri Mar 20 02:47:24 IST 2015,congrat take ownership prism
