username,time,tweet
Romaticize,Tue Jun 02 14:00:33 IST 2015,your everi tweet contribut negat world infinitesim amount screw much fun
Romaticize,Tue Jun 02 13:20:27 IST 2015,jewish sect belz ban women drive did also think go back invent wheel sincew rego backward
Romaticize,Tue Jun 02 13:08:29 IST 2015,rt free nation roam bsnl june union minist ravishankar prasad prasad announc today
Romaticize,Tue Jun 02 13:07:48 IST 2015,got get televis
Romaticize,Tue Jun 02 12:56:01 IST 2015,i hate win it much keep compet
Romaticize,Tue Jun 02 12:53:08 IST 2015,there differ lose win except war then die
Romaticize,Tue Jun 02 12:33:05 IST 2015,rt hot singl area busi argu peopl internet
Romaticize,Tue Jun 02 12:22:01 IST 2015,quit possibl but fight brain brawn
Romaticize,Tue Jun 02 12:20:47 IST 2015,you lost fb relationship status go complic it realli u lack iq
Romaticize,Tue Jun 02 12:16:36 IST 2015,there time use crush boy band dunno wth day bringbackmagcon realli tighten secur
Romaticize,Tue Jun 02 12:06:33 IST 2015,never feel bad rememb generat come app use friend play ohwait
Romaticize,Tue Jun 02 11:53:49 IST 2015,askmahirakhan are oracl otherwis pointless
Romaticize,Tue Jun 02 11:49:15 IST 2015,happi birthday sonakshi sinha rememb time world reject appear show paycheck
Romaticize,Tue Jun 02 11:41:30 IST 2015,tall enough go
Romaticize,Tue Jun 02 11:39:46 IST 2015,have read page bhagavad gita far surpris turn quack fanat haha read
Romaticize,Tue Jun 02 11:17:19 IST 2015,there million starv hostelit silent pray uniti lift ban maggi nestl
Romaticize,Tue Jun 02 11:12:39 IST 2015,rt the freer harsh judgement freer lighter feel the judg get weigh
Romaticize,Tue Jun 02 11:07:46 IST 2015,hamarapass read bihari accent
Romaticize,Tue Jun 02 11:05:38 IST 2015,nevertweetwhatyoucan tspeak
Romaticize,Tue Jun 02 03:12:03 IST 2015,rt when come home colleg parent tri say go
Romaticize,Tue Jun 02 02:30:12 IST 2015,rt after battl hogwart everyon final understood pull school carriag begin
Romaticize,Tue Jun 02 02:20:12 IST 2015,rt if get love harri potter i sorri nevill friend
Romaticize,Tue Jun 02 02:19:00 IST 2015,rt if kim kardashian kany west new babi name south west point
Romaticize,Tue Jun 02 02:12:45 IST 2015,what john snow barfkagola
Romaticize,Tue Jun 02 02:01:56 IST 2015,what woman hit man magazin call feminafatal thislaston sorri
Romaticize,Tue Jun 02 01:57:37 IST 2015,if husband affair call homm affair franc peopl fair
Romaticize,Tue Jun 02 01:44:20 IST 2015,i like jon snow getoverit and i actual like snow
Romaticize,Tue Jun 02 01:41:11 IST 2015,or pr onlin shop giant p
Romaticize,Tue Jun 02 01:20:59 IST 2015,pull caitlynjenn not kimkardashian courag
Romaticize,Tue Jun 02 01:19:14 IST 2015,gameofthron graphic got fan like need fanfic p
Romaticize,Tue Jun 02 01:14:14 IST 2015,brett lee love india is aussi indian pun forfun cantsleep
Romaticize,Tue Jun 02 01:10:21 IST 2015,what john watson say hous my dear holm i pun
Romaticize,Tue Jun 02 00:55:41 IST 2015,rain poetri noreal iphilosoph
Romaticize,Tue Jun 02 00:53:31 IST 2015,
Romaticize,Tue Jun 02 00:50:12 IST 2015,mere paa emi pe gaadi hai home loan pe bangla hai tumhar paa kya hai mere paa maa ke gehn hai manappuram gold loan d
Romaticize,Tue Jun 02 00:22:56 IST 2015,aamadmiparti like fake alphonso aam crop month year never real thing
Romaticize,Tue Jun 02 00:20:15 IST 2015,if tell girl run like girl run like girl
Romaticize,Tue Jun 02 00:08:25 IST 2015,how youtub millionair a becom teen british boy stupid hormon craze fangirl follow b be bad mouth indian
Romaticize,Mon Jun 01 23:57:02 IST 2015,if pun get wors i becom punauti
Romaticize,Mon Jun 01 23:55:51 IST 2015,how mani writer take fix light bulb nil gaiman d
Romaticize,Mon Jun 01 23:52:27 IST 2015,do understand unfortun generat sunni leon marilynmonro p
Romaticize,Mon Jun 01 23:50:32 IST 2015,parent say generat spare lot physic work but spare lot brain work tryfindingtheright googlekeyword
Romaticize,Wed May 27 01:07:39 IST 2015,funni colorblind stori
Romaticize,Thu May 21 22:11:43 IST 2015,if you were to die today roma thakur via
Romaticize,Thu May 21 20:59:45 IST 2015,india roma thakur via
Romaticize,Thu May 21 20:34:06 IST 2015,are you for real virtual roma thakur via
Romaticize,Thu May 21 15:18:49 IST 2015,if you were to die today roma thakur via
Romaticize,Thu May 21 14:15:26 IST 2015,heartbreak cool thing i learnt live alon roma thakur via
Romaticize,Wed May 20 13:47:06 IST 2015,the first world idiot roma thakur via
Romaticize,Wed May 20 12:22:27 IST 2015,metropoli roma thakur via
