username,time,tweet
CMandeville11,Sun Feb 28 11:27:41 IST 2016,magic johnson timelin alway laugh loud funni one favorit twitter follow
CMandeville11,Sun Feb 28 09:56:30 IST 2016,steph anoth planet
CMandeville11,Fri Feb 26 20:12:36 IST 2016,
CMandeville11,Sat Feb 20 05:29:37 IST 2016,how play tonight cmonman
CMandeville11,Sat Feb 20 01:28:48 IST 2016,
CMandeville11,Mon Feb 15 08:36:30 IST 2016,fantast midseason premier thewalkingdead
CMandeville11,Sun Feb 14 09:06:10 IST 2016,man aaron gordon got screw can hand easili nbadunkcontest
CMandeville11,Sun Feb 14 08:56:50 IST 2016,omg nbadunkcontest
CMandeville11,Mon Feb 08 09:23:27 IST 2016,still get monday superbowlsunday nation holiday yet
CMandeville11,Mon Feb 08 06:30:01 IST 2016,super bowl commerci get wors wors everi year
CMandeville11,Mon Feb 08 06:23:00 IST 2016,
CMandeville11,Thu Feb 04 09:06:31 IST 2016,i wish commerci thechallengebloodlin
CMandeville11,Sun Jan 31 06:56:11 IST 2016,rt icon everi sens see book preview center appt
CMandeville11,Sat Jan 30 08:28:24 IST 2016,compliment doubt
CMandeville11,Fri Jan 29 08:58:05 IST 2016,rt icymi cowboy owner impress mbstadium read riseup
CMandeville11,Fri Jan 29 08:51:49 IST 2016,i love see friend success much i enjoy know lot great ppl doin big thing successandnothingless
CMandeville11,Thu Jan 28 09:24:26 IST 2016,rt worst part week everi week minut teen mom i catch the challeng
CMandeville11,Thu Jan 28 08:05:36 IST 2016,way much ask denver fan though
CMandeville11,Mon Jan 25 06:50:20 IST 2016,carson palmer
CMandeville11,Mon Jan 25 04:59:10 IST 2016,don think i ever seen o line get domin bad pat throughout game
CMandeville11,Sat Jan 23 09:44:09 IST 2016,a littl late cav fire david blatt outrag that absolut joke
CMandeville11,Tue Jan 19 09:13:13 IST 2016,mlb contract absurd upton
CMandeville11,Sun Jan 17 10:10:27 IST 2016,that might greatest minut stretch sport i ever wit gbvsaz
CMandeville11,Sun Jan 17 09:58:05 IST 2016,what just happen gbvsaz
CMandeville11,Sun Jan 17 09:11:13 IST 2016,carson palmer cmonman
CMandeville11,Sun Jan 17 08:53:44 IST 2016,he led shoulder could cleaner hit hine ward made live kind play
CMandeville11,Sun Jan 17 08:48:08 IST 2016,that blindsid block call fitz b nfl becom soft
CMandeville11,Sun Jan 17 05:03:50 IST 2016,bradi gronk unreal combo good
CMandeville11,Fri Jan 15 11:21:15 IST 2016,that go lefti bron bron fundament
CMandeville11,Fri Jan 15 07:11:39 IST 2016,happi see pocatello nativ get hc shot highest level highlandram
CMandeville11,Thu Jan 14 09:26:43 IST 2016,this outrag
CMandeville11,Tue Jan 12 06:19:05 IST 2016,thought oscar never mayb
CMandeville11,Mon Jan 11 06:52:35 IST 2016,glad see phone still work
CMandeville11,Sun Jan 10 06:02:38 IST 2016,just saw mcpick commerci mcdonald time hate alreadi bananaland
CMandeville11,Sun Jan 10 05:38:13 IST 2016,what aw game watch
CMandeville11,Sun Jan 10 05:23:40 IST 2016,dreamteam
CMandeville11,Sun Jan 10 04:29:27 IST 2016,crazi chief point show turnov
CMandeville11,Sun Jan 10 04:28:23 IST 2016,rt the chief got special team td turnov brandon weeden sport movi entranc
CMandeville11,Fri Jan 08 09:06:27 IST 2016,rt
CMandeville11,Thu Jan 07 09:49:32 IST 2016,rt tom landri first season head coach cowboy patienc
CMandeville11,Thu Jan 07 09:09:37 IST 2016,not enough patienc pro sport head coach day
CMandeville11,Wed Jan 06 00:17:58 IST 2016,outrag
CMandeville11,Tue Jan 05 09:46:09 IST 2016,not much better overtim sport except eastern time zone kuvsou
CMandeville11,Mon Jan 04 09:36:13 IST 2016,is score real pathet
CMandeville11,Sun Jan 03 06:21:46 IST 2016,can rememb colleg footbal bowl season ever bad somanyblowout
CMandeville11,Fri Jan 01 07:00:34 IST 2016,whoever came stuf crust pizza absolut genius top invent time mind
CMandeville11,Thu Dec 31 10:16:06 IST 2015,not big realiti tv guy i addict the challeng best realiti tv show imo mtv
CMandeville11,Thu Dec 31 04:25:01 IST 2015,mcdonald get rid dollar menu outrag i even rememb last time i ate news still devast
CMandeville11,Tue Dec 29 11:07:55 IST 2015,just brutal season far no room kind lose streak west tough watch
CMandeville11,Tue Dec 29 10:03:58 IST 2015,glad allow us catch end great monday night footbal matchup comcastproblem
