username,time,tweet
rachael_cooney,Mon Apr 06 23:00:23 IST 2015,luv come class last week watch movi
rachael_cooney,Wed Apr 01 17:53:23 IST 2015,last semest thankusteut
rachael_cooney,Wed Apr 01 09:09:18 IST 2015,chris keller whyyyyyy oth
rachael_cooney,Wed Apr 01 05:27:25 IST 2015,pari confus citi tri play pacman googlemap
rachael_cooney,Tue Mar 31 05:23:50 IST 2015,od tic tac ask friend
rachael_cooney,Fri Mar 27 19:15:31 IST 2015,if gopro i would run around sackvill take video jump puddl
rachael_cooney,Wed Mar 25 19:31:38 IST 2015,i wait meet pari someday missthatplac
rachael_cooney,Wed Mar 25 05:06:50 IST 2015,cooki chat goodtim
rachael_cooney,Tue Mar 24 18:48:31 IST 2015,look like sackvill summer horizon folk employ
rachael_cooney,Sat Mar 21 07:43:55 IST 2015,if i go stay sackvill summer i demand froyo establish built
rachael_cooney,Fri Mar 20 19:00:49 IST 2015,done class day am
rachael_cooney,Thu Mar 19 22:47:22 IST 2015,i ping pong ball backandforth
rachael_cooney,Thu Mar 19 19:47:16 IST 2015,next time someon ask i live i go say avard dixon alwaysher
rachael_cooney,Wed Mar 18 22:19:04 IST 2015,day end semest plz go fast prais
rachael_cooney,Tue Mar 17 23:48:50 IST 2015,hi mom
rachael_cooney,Tue Mar 17 22:07:00 IST 2015,got candi class i like today luckoftheirish
rachael_cooney,Tue Mar 17 20:49:48 IST 2015,i pretti much alway think one two thing coffe grey reallif
rachael_cooney,Thu Mar 12 00:47:48 IST 2015,kind day exhaust
rachael_cooney,Mon Mar 09 17:52:34 IST 2015,why friend wear sandal stillcoldout
rachael_cooney,Sun Mar 08 08:33:14 IST 2015,rt gasp
rachael_cooney,Fri Mar 06 20:07:15 IST 2015,rt path path made walk antonio machado
rachael_cooney,Wed Mar 04 11:36:44 IST 2015,thank jet lag night
rachael_cooney,Mon Mar 02 05:47:15 IST 2015,cri montreal snow
rachael_cooney,Sun Mar 01 06:55:10 IST 2015,i never felt home place i never live maui lo
rachael_cooney,Wed Feb 25 05:02:18 IST 2015,all sunscreen place go rain
rachael_cooney,Tue Feb 24 23:19:12 IST 2015,just woke wear dress i wear yesterday tire
rachael_cooney,Sun Feb 22 23:47:57 IST 2015,eat breakfast deck neighbour play harmonica yep i could get use maui
rachael_cooney,Sun Feb 22 00:51:00 IST 2015,aloha maui
rachael_cooney,Thu Feb 19 22:28:12 IST 2015,i wanna make pasta wannabeitalian
rachael_cooney,Thu Feb 19 03:55:13 IST 2015,this place prettiest sunset pink vsco sackvill town of vill de
rachael_cooney,Thu Feb 19 03:00:24 IST 2015,pea sooooo good
rachael_cooney,Thu Feb 19 02:55:24 IST 2015,yeeeeeup countmein
rachael_cooney,Thu Feb 19 02:54:26 IST 2015,
rachael_cooney,Wed Feb 18 20:15:19 IST 2015,that show netflix hello read break watchalltheseri
rachael_cooney,Wed Feb 18 08:44:01 IST 2015,mayb best part soci buzzword jargon make sound smart i idea i talk hegemoni
rachael_cooney,Wed Feb 18 02:11:04 IST 2015,loooov get boot open find two differ size waytogo
rachael_cooney,Tue Feb 17 00:13:26 IST 2015,i cover head toe flour rachaelvsthekitchen
rachael_cooney,Mon Feb 16 05:46:00 IST 2015,two class alreadi cancel tomorrow
rachael_cooney,Mon Feb 16 01:57:14 IST 2015,my hous make scari nois stormtown
rachael_cooney,Sun Feb 15 06:16:25 IST 2015,i want live place i drink ice coffe year round without freez goal
rachael_cooney,Fri Feb 13 08:23:36 IST 2015,final go christmas pictur liter lole i love crazi famili
rachael_cooney,Thu Feb 12 00:56:29 IST 2015,my prof bash one direct i stand
rachael_cooney,Tue Feb 10 05:30:26 IST 2015,got combin two favourit thing today parent sackvill also coffe love
rachael_cooney,Thu Feb 05 20:05:40 IST 2015,rt i love hate relationship morn
rachael_cooney,Thu Feb 05 07:42:58 IST 2015,you know long day everi light hous
rachael_cooney,Wed Feb 04 20:18:04 IST 2015,wow
rachael_cooney,Mon Feb 02 05:30:06 IST 2015,rt idina menzel like
rachael_cooney,Fri Jan 30 03:10:41 IST 2015,this littl place total heart sackvill vsco sackvill waterfowl park
rachael_cooney,Thu Jan 29 04:53:17 IST 2015,o malley stillnotoverit
rachael_cooney,Wed Jan 28 05:51:39 IST 2015,rt i decid i longer want adult if anyon need i blanket fort watch littl
