username,time,tweet
ryanvasey94,Tue Jun 02 02:51:19 IST 2015,nice weather consid first day summer
ryanvasey94,Mon Jun 01 02:18:31 IST 2015,great night dxxx
ryanvasey94,Mon Jun 01 02:18:16 IST 2015,san andrea amaz film
ryanvasey94,Sat May 30 19:23:26 IST 2015,stuck colleg work day like typic
ryanvasey94,Sat May 30 19:16:54 IST 2015,buy gym gear get motiv
ryanvasey94,Fri May 29 21:42:29 IST 2015,don love go pay someth card forget pin number haha howembarress
ryanvasey94,Fri May 29 16:52:43 IST 2015,hope rain tomorrow sunday it got day
ryanvasey94,Fri May 29 16:40:07 IST 2015,can wait see tonight
ryanvasey94,Fri May 29 10:43:40 IST 2015,can believ tire i thank god friday though
ryanvasey94,Fri May 29 10:42:21 IST 2015,unbeliev film mate
ryanvasey94,Fri May 29 01:43:53 IST 2015,no matter mani time watch i never get bore fast furious
ryanvasey94,Fri May 29 01:23:33 IST 2015,realli want tattoo know get
ryanvasey94,Fri May 29 01:09:05 IST 2015,hate rememb password i swear i need start write alway forget
ryanvasey94,Thu May 28 18:47:10 IST 2015,do tourist know path look like constant walk middl road
ryanvasey94,Thu May 28 18:45:53 IST 2015,hate energi especi work getmehom
ryanvasey94,Thu May 28 01:36:26 IST 2015,realli get game throne near finish season catchup
ryanvasey94,Thu May 28 01:35:50 IST 2015,i love
ryanvasey94,Thu May 28 01:34:55 IST 2015,so hard eat clean diet much tempt food
ryanvasey94,Thu May 28 01:34:23 IST 2015,hope feel better soon
ryanvasey94,Wed May 27 01:33:09 IST 2015,treat iphon wait get
ryanvasey94,Tue May 26 18:41:17 IST 2015,white black iphon i clue
ryanvasey94,Mon May 18 22:15:29 IST 2015,spend monday first aid cours best way start week bore
ryanvasey94,Sat May 16 23:18:55 IST 2015,know i get medium ew wade jacket
ryanvasey94,Thu May 07 01:54:26 IST 2015,lionel messi human class
ryanvasey94,Tue May 05 02:03:48 IST 2015,miss love mllion
ryanvasey94,Tue May 05 01:53:49 IST 2015,feel like sunday
ryanvasey94,Wed Apr 29 10:20:58 IST 2015,should illeg get least clock morn
ryanvasey94,Wed Apr 29 02:54:25 IST 2015,hate set alarm morn
ryanvasey94,Wed Apr 29 01:54:30 IST 2015,in bed clock feel like right old man
ryanvasey94,Sun Apr 26 17:47:37 IST 2015,sunday hungov much better
ryanvasey94,Sun Apr 12 16:53:50 IST 2015,stabl dinner
ryanvasey94,Tue Apr 07 14:22:09 IST 2015,would defiant pay see fast
ryanvasey94,Sat Apr 04 19:04:03 IST 2015,hahaha wheyyy
ryanvasey94,Sat Apr 04 17:27:20 IST 2015,listen steve aoki get mood go
ryanvasey94,Sat Apr 04 17:11:49 IST 2015,hate find name song realli like
ryanvasey94,Fri Apr 03 14:13:14 IST 2015,everyon enjoy long weekend i work allworknoplay
ryanvasey94,Fri Apr 03 14:12:41 IST 2015,can wait fast tonight class book ticket straightin
ryanvasey94,Fri Apr 03 14:05:32 IST 2015,wait d
ryanvasey94,Wed Apr 01 23:24:01 IST 2015,mini egg nice
ryanvasey94,Wed Apr 01 14:02:15 IST 2015,act like
ryanvasey94,Mon Mar 30 22:24:45 IST 2015,love gym practic empti
ryanvasey94,Mon Mar 30 01:59:32 IST 2015,i love
ryanvasey94,Sun Mar 29 23:10:58 IST 2015,haven happi long time
ryanvasey94,Sun Mar 29 23:10:31 IST 2015,can believ weekend near alreadi
ryanvasey94,Sun Mar 22 23:57:18 IST 2015,can wait go see fast furious
ryanvasey94,Sun Mar 22 20:17:40 IST 2015,get class mata
ryanvasey94,Sun Mar 22 18:57:01 IST 2015,huge game
ryanvasey94,Sat Mar 21 23:37:14 IST 2015,love last minut date kfc
ryanvasey94,Fri Mar 20 17:36:52 IST 2015,i love x
ryanvasey94,Fri Mar 20 17:32:51 IST 2015,go girl
