username,time,tweet
iamAzharSK,Sun Jun 21 16:34:06 IST 2015,drop rahan take jadeja is pure mr cool desis
iamAzharSK,Sun Jun 21 16:26:28 IST 2015,jadeja trend widout help ms dhoni
iamAzharSK,Sun Jun 21 12:32:01 IST 2015,rt आज हम
iamAzharSK,Sun Jun 21 11:58:20 IST 2015,favourit ing tweet sex doggi style internationalyogaday
iamAzharSK,Sun Jun 21 10:50:25 IST 2015,scariest thing see someon phone book contact name dad new dad happyfathersday
iamAzharSK,Sun Jun 21 09:47:35 IST 2015,go error
iamAzharSK,Sun Jun 21 00:50:23 IST 2015,tum humko khel main harao hum tumhara guna lagaan maaf karega epic
iamAzharSK,Sat Jun 20 20:28:07 IST 2015,rt is deepika padukon ignor ranveer singh
iamAzharSK,Sat Jun 20 19:41:04 IST 2015,rt how rain batter film and tv shoot yesterday in mumbai
iamAzharSK,Sat Jun 20 19:35:08 IST 2015,internationaldayofyoga woof woof doggi ishtyl
iamAzharSK,Sat Jun 20 18:28:34 IST 2015,mumbairain high tide feelin bad coupl bandstand
iamAzharSK,Sat Jun 20 17:47:43 IST 2015,becom father easi enough one rough goodknightsuperdad love you paa
iamAzharSK,Sat Jun 20 17:12:12 IST 2015,we support dhoni bcz we cant support alia humanitarian
iamAzharSK,Sat Jun 20 16:56:43 IST 2015,we support dhoni decis loos bangladesh atleast poor dey get aadhar card
iamAzharSK,Sat Jun 20 16:30:12 IST 2015,this gave goosebump amazingbbtrail amaz
iamAzharSK,Sat Jun 20 16:03:53 IST 2015,mithunda kya boat kya boat kya boat mumbairain
iamAzharSK,Sat Jun 20 15:53:43 IST 2015,thebestamancanget beat that
iamAzharSK,Sat Jun 20 15:21:45 IST 2015,why father like park space the good one alreadi taken and recit mydadmyhero
iamAzharSK,Sat Jun 20 14:53:17 IST 2015,boy i pen phone think possibilti girl i sandal face think casual thebestamancanget
iamAzharSK,Sat Jun 20 14:48:57 IST 2015,if women fallen an idiot walk a gentlemen help get but a real men lie thebestamancanget
iamAzharSK,Sat Jun 20 14:42:36 IST 2015,and ur wife made india
iamAzharSK,Sat Jun 20 14:34:36 IST 2015,bhai sonakshi say bas kar rulayega kya
iamAzharSK,Sat Jun 20 14:24:06 IST 2015,son iit sorri iin
iamAzharSK,Sat Jun 20 14:10:24 IST 2015,ddlj mine
iamAzharSK,Sat Jun 20 14:04:03 IST 2015,itni der tak china ka product nahi chalta jitni der made in china trend chal raha hai fact
iamAzharSK,Sat Jun 20 13:18:43 IST 2015,anil kapoor a ji o ji lodgi remak ram lakhan
iamAzharSK,Sat Jun 20 12:04:55 IST 2015,abcd collect crs day bcz salman bhai tweet a ppl sleepin footpath dark chale gay theatr
iamAzharSK,Sat Jun 20 11:02:51 IST 2015,एक ह
iamAzharSK,Fri Jun 19 23:51:31 IST 2015,maunmodi no way i sure wo paan khaa raha hai
iamAzharSK,Fri Jun 19 23:07:10 IST 2015,did pm gulp centr fresh chew gum zabaan pe rakh lagaam p maunmodi
iamAzharSK,Fri Jun 19 23:02:55 IST 2015,madam tussad plan statu narendra modi maunmodi
iamAzharSK,Fri Jun 19 22:58:07 IST 2015,modi teen patti dealer bcz it accept tip cum boss maunmodi
iamAzharSK,Fri Jun 19 21:50:34 IST 2015,rt my tweet
iamAzharSK,Fri Jun 19 17:15:17 IST 2015,well said sana
iamAzharSK,Fri Jun 19 15:41:46 IST 2015,boy are come mall girl no yar heavi rain boy there flat sale girl mumbairain
iamAzharSK,Fri Jun 19 15:16:45 IST 2015,rt rt dad superman myfirsthero
iamAzharSK,Fri Jun 19 14:34:43 IST 2015,i didnt go offic bcz car doesnt know swim p mumbairain
iamAzharSK,Fri Jun 19 14:26:48 IST 2015,abcd releas today wid mumbairain its name any bodi can drown bwhahahahah
iamAzharSK,Fri Jun 19 14:21:00 IST 2015,vishwapappudiwa
iamAzharSK,Fri Jun 19 14:16:54 IST 2015,rg birthay declar vishwapappudiwa now krk birthday shud call vishwakasabsebasechutiyaadiwa hahahahahahha
iamAzharSK,Fri Jun 19 00:46:32 IST 2015,milan subway media guy sittin boat coverag cameraman ashok ke saath raj dixit aaj tak mumbai
iamAzharSK,Fri Jun 19 00:01:17 IST 2015,take moment pray victim famili communiti affect charlestonshoot rip
iamAzharSK,Thu Jun 18 23:19:49 IST 2015,hurray we lost run aur bhejo modi ko tour karn bangladesh banvind
iamAzharSK,Thu Jun 18 22:45:07 IST 2015,lol p
iamAzharSK,Thu Jun 18 20:39:13 IST 2015,whr find moon weatheri nite ppl wishin chand mubarak whatsapp ramzan
iamAzharSK,Thu Jun 18 20:36:41 IST 2015,jst heard special boat arrang kurla station bandra local mubaikar inconveni regret mumbairain
iamAzharSK,Thu Jun 18 19:50:37 IST 2015,ramadan kareem mubarak may almighti guid us path imaan
iamAzharSK,Thu Jun 18 19:48:49 IST 2015,bank loan yahansekharido
iamAzharSK,Thu Jun 18 19:39:24 IST 2015,milan subway se boat pe cameramen akash ke saath deepak chourasiya abp news heavi rain mumbairain malad far cant predict
iamAzharSK,Thu Jun 18 19:30:18 IST 2015,i dnt know abt hamari adhuri kahaani fever bt ya got nausea loos motion aftr watchin
