username,time,tweet
kategtz,Fri Feb 19 10:01:17 IST 2016,know u happen wen nationaldrinkwineday turn let finish wine
kategtz,Fri Feb 19 09:58:19 IST 2016,know joke
kategtz,Fri Feb 19 09:56:36 IST 2016,cheke like bank account wen u wait tax refund
kategtz,Fri Feb 19 09:54:57 IST 2016,u didnt girl
kategtz,Fri Feb 19 09:54:43 IST 2016,wen u tweet ur sister answer
kategtz,Fri Feb 19 09:53:05 IST 2016,hello dont u answer yes
kategtz,Fri Feb 19 09:52:16 IST 2016,wen ur sister dont answer see post stuff
kategtz,Fri Feb 19 08:14:48 IST 2016,rt ladi gaga take runway alongsid kendal jenner marc jacob nyfw
kategtz,Thu Feb 18 23:49:25 IST 2016,rt get civilwar face tbt
kategtz,Thu Feb 18 23:48:54 IST 2016,rt get better today i still hear head
kategtz,Thu Feb 18 23:48:03 IST 2016,rt more detail emerg offic involv shoot
kategtz,Thu Feb 18 23:46:57 IST 2016,rt soy el papá más orgulloso elciclosinfin mi hija yo cantamo dueto ya quiero que lo escuchen https
kategtz,Thu Feb 18 22:10:01 IST 2016,rt mob wive big ang die age battl cancer
kategtz,Thu Feb 18 22:04:13 IST 2016,rt desmiento esta información pronto les platicaré de mi participación en la nueva barra de concurso https
kategtz,Thu Feb 18 22:02:48 IST 2016,rt i alway love pic rip
kategtz,Thu Feb 18 22:00:18 IST 2016,rt les confirmo habrá gira de alejandro fernández lui miguel así lo informaron
kategtz,Thu Feb 18 22:00:05 IST 2016,rt mob wive big ang pass away send us ripbigang tweet read livefrom
kategtz,Thu Feb 18 21:59:27 IST 2016,rt big ang mob wive cast mate brokenheart death ripbigang
kategtz,Thu Feb 18 21:58:45 IST 2016,rt rest peac big ang
kategtz,Thu Feb 18 09:51:52 IST 2016,rt gracia enriquuue
kategtz,Thu Feb 18 09:50:26 IST 2016,rt thank mexico mexican may lord bless virgin guadalup accompani alway
kategtz,Thu Feb 18 08:07:25 IST 2016,rt el papa francisco se despid de los mexicano
kategtz,Thu Feb 18 08:07:15 IST 2016,rt el papa francisco se va de méxico esperemo que su mensaj se qued para siempr
kategtz,Thu Feb 18 08:06:54 IST 2016,rt the merci jesus embrac everyon everi part world open heart
kategtz,Thu Feb 18 08:06:48 IST 2016,rt celebr jubile merci mean learn remain prison past it mean believ thing
kategtz,Thu Feb 18 08:06:46 IST 2016,rt thisisthetoughpart mysterymanonsvu
kategtz,Wed Feb 17 21:55:44 IST 2016,rt impos hace año pensar en un papa en juarez hoy eso es una realidad aqui https
kategtz,Wed Feb 17 12:16:23 IST 2016,rt pope urg mexican dare dream
kategtz,Wed Feb 17 12:13:51 IST 2016,rt jesus would never ask us assassin call us discipl he would never send us die he invit us life
kategtz,Wed Feb 17 12:13:40 IST 2016,rt you ask word hope i offer name jesus christ
kategtz,Tue Feb 16 22:31:39 IST 2016,rt ronda rousey admit suicid thought lose holli holm
kategtz,Tue Feb 16 22:31:27 IST 2016,rt law order svu rollin goe undercov get busi
kategtz,Tue Feb 16 22:28:04 IST 2016,rt it traffictiptuesday pedestrian look look around assum seen walksmartca
kategtz,Tue Feb 16 10:53:27 IST 2016,rt uptown funk win record year grammi
kategtz,Tue Feb 16 10:51:48 IST 2016,rt congrat badblood big win madlov videooftheyear bandaidsdontfixbullethol grammi
kategtz,Tue Feb 16 10:51:38 IST 2016,rt i prefer famili tire face sacrific made rather pretti one unfamiliar tender
kategtz,Tue Feb 16 03:00:54 IST 2016,rt si alguna vez te ha hecho esto haz rt
kategtz,Tue Feb 16 03:00:23 IST 2016,rt el cargamento de metanfetamina valuado en millon de dólare iba empacado en ropa interior de mujer foto https
kategtz,Tue Feb 16 02:58:08 IST 2016,rt among poor treat worst planet we cannot pretend fine face great environment crisi
kategtz,Tue Feb 16 02:58:00 IST 2016,rt in heart everi person desir live freedom place chang possibl fellowship solidar
kategtz,Mon Feb 15 12:57:48 IST 2016,rt defensaanim encontramo est cachorro en ecatepec pero tenemo dónde llevarlo cómo podemo ayudarlo https
kategtz,Mon Feb 15 12:57:33 IST 2016,rt lisa vanderpump latest throwback photo prove she is truli ageless
kategtz,Mon Feb 15 12:56:40 IST 2016,rt respect
kategtz,Mon Feb 15 12:56:25 IST 2016,rt icymi kobebry all star introduct video
kategtz,Mon Feb 15 12:56:21 IST 2016,rt respect
kategtz,Mon Feb 15 12:56:05 IST 2016,rt thank all star memori
kategtz,Mon Feb 15 12:55:09 IST 2016,rt happen now investig offic involv shoot prescott plaza pkwi suspect transport hospit w
kategtz,Mon Feb 15 12:54:54 IST 2016,rt jesus wait us want heal heart tear us he god name merci
kategtz,Mon Feb 15 03:38:22 IST 2016,rt may lord help us overcom temptat wealth vaniti pride seek destroy truth gospel
kategtz,Mon Feb 15 00:58:31 IST 2016,rt con aplauso porra reciben al papa en ecatepec ha sido muy emocionant https
