username,time,tweet
shubhan3009,Thu Apr 23 21:54:37 IST 2015,sugar intak must low
shubhan3009,Tue Apr 21 22:29:43 IST 2015,rt insid microsoft secret design lab microsoft
shubhan3009,Tue Apr 21 20:02:17 IST 2015,rt microsoft pattern practic releas azur architectur guidanc
shubhan3009,Mon Apr 20 21:41:01 IST 2015,what wonder meet are come
shubhan3009,Sat Apr 18 10:37:45 IST 2015,rt band studio visual studio visualstudio
shubhan3009,Fri Apr 17 19:52:37 IST 2015,loaner devic test app return other dev use
shubhan3009,Fri Apr 17 19:45:22 IST 2015,devic cheaper in india devic cost reward help us get ad band surfac reward would good
shubhan3009,Thu Apr 16 16:11:50 IST 2015,rt state bank india launch much await state bank anywher window phone
shubhan3009,Mon Apr 13 19:22:06 IST 2015,hd screen mean hd qualiti work time work mean better work achievemor
shubhan3009,Mon Apr 13 19:20:52 IST 2015,larg screen equal better present equal product offic achievemor
shubhan3009,Mon Apr 13 19:19:05 IST 2015,more space number crunch document larg screen achievemor
shubhan3009,Mon Apr 13 18:49:42 IST 2015,add list well
shubhan3009,Mon Apr 13 18:48:51 IST 2015,even onedr websit gmail googl map site work ie spartan
shubhan3009,Mon Apr 13 18:39:17 IST 2015,fli concern away flight swift send present air use onedr achievemor
shubhan3009,Mon Apr 13 18:34:18 IST 2015,save note onedr creat present easi no storag concern free achievemor
shubhan3009,Mon Apr 13 18:27:01 IST 2015,quick edit present save onedr send use onedr link via achievemor
shubhan3009,Mon Apr 13 17:54:34 IST 2015,rt lest forget fulli recommend read jule bianchi battl
shubhan3009,Mon Apr 13 17:38:44 IST 2015,i video call friend colleagu outsid india increas work collabor achievemor skype
shubhan3009,Mon Apr 13 14:20:56 IST 2015,onenot offic give access note file anywher anytim great portabl achievemor
shubhan3009,Mon Apr 13 14:19:48 IST 2015,use power offic one note save instant idea thought come mind achievemor
shubhan3009,Sun Apr 12 23:11:48 IST 2015,tri soft reset test sim well is hard reset option
shubhan3009,Sun Apr 12 23:01:15 IST 2015,photo app crash sim detect quit hour shortcut gone quick action ps twttr work
shubhan3009,Sun Apr 12 22:15:54 IST 2015,declar result achievemor contest hope win
shubhan3009,Sun Apr 12 20:45:46 IST 2015,one grow india abund
shubhan3009,Fri Apr 10 23:14:08 IST 2015,build use free space sd card just free phone
shubhan3009,Fri Apr 10 22:17:46 IST 2015,googl might interest well
shubhan3009,Fri Apr 10 17:17:46 IST 2015,rt when i order appl watch said ship i realiz meant april
shubhan3009,Thu Apr 09 16:51:09 IST 2015,rt so peopl first time ever bring build
shubhan3009,Wed Apr 08 23:56:51 IST 2015,rt can anyon help rt wpdev how india report earn app tax profil need advic
shubhan3009,Tue Apr 07 22:45:21 IST 2015,rt regist global azur bootcamp
shubhan3009,Tue Apr 07 20:03:34 IST 2015,when town keep share via onedr offic take offic fun achievemor
shubhan3009,Tue Apr 07 19:07:27 IST 2015,travelogu share onedr storytel app make use unlimit storag via offic achievemor
shubhan3009,Tue Apr 07 18:15:46 IST 2015,offic allow store file project idea onedr avail go edit option achievemor
shubhan3009,Tue Apr 07 17:08:16 IST 2015,with larg screen i see skype achievemor
shubhan3009,Tue Apr 07 17:06:44 IST 2015,with skype bigger screen i video chat friend effici manner n fun achievemor
shubhan3009,Tue Apr 07 10:46:44 IST 2015,i think sleep in morn india tweet even tweet get sleep
shubhan3009,Tue Apr 07 06:58:03 IST 2015,thank just sent coupl dm detail
shubhan3009,Mon Apr 06 23:42:32 IST 2015,rt look start work api week cours start april sign
shubhan3009,Mon Apr 06 23:13:58 IST 2015,three app call a number map wordpress phone all app
shubhan3009,Mon Apr 06 21:20:19 IST 2015,yes pleas rt
shubhan3009,Mon Apr 06 19:36:19 IST 2015,thank just sent email
shubhan3009,Mon Apr 06 12:04:27 IST 2015,do accept profil india if yes i would like appli
shubhan3009,Mon Apr 06 10:05:29 IST 2015,wpdev how india report earn app tax profil need advic
shubhan3009,Sat Apr 04 23:21:55 IST 2015,rt hey wpdev windev do download let us know want featur blog post
shubhan3009,Sat Apr 04 23:21:28 IST 2015,yes would includ i
shubhan3009,Sat Apr 04 09:42:10 IST 2015,they deni talk launch window
shubhan3009,Sat Apr 04 00:54:02 IST 2015,surfac ratio futur you feel benefit window scale
shubhan3009,Fri Apr 03 23:20:06 IST 2015,interest thank now i need search
shubhan3009,Fri Apr 03 22:38:01 IST 2015,dint think would possibl
shubhan3009,Fri Apr 03 22:31:17 IST 2015,eve better it ship india appar i read review is small touch
