username,time,tweet
born_a_pom,Mon Feb 29 16:53:55 IST 2016,qanda cathol priest audienc clap good yardstick societi
born_a_pom,Mon Feb 29 16:52:03 IST 2016,qanda get church state educ parliament
born_a_pom,Mon Feb 29 16:40:24 IST 2016,qanda procreat reason marriag nobodi marri menopaus infertil peopl marri
born_a_pom,Mon Feb 29 16:35:20 IST 2016,qanda govern disgrac backwardbigot
born_a_pom,Mon Feb 29 16:34:34 IST 2016,we need gonski ineedsafeschool futur qanda
born_a_pom,Sun Feb 28 07:37:31 IST 2016,rt abus survivor touch rome pell brace royal commiss grill
born_a_pom,Sat Feb 27 14:15:06 IST 2016,stupid comment driver brave went rage flood idiot bus driver send wrong messag ifitsfloodedforgetit
born_a_pom,Wed Feb 24 16:04:55 IST 2016,corybernardi complain name call call someon fraud that make hypocrit homophob
born_a_pom,Sat Feb 20 16:21:47 IST 2016,jami like walk solidar support recent protest so glad ynwa steve lees
born_a_pom,Sat Feb 20 16:21:17 IST 2016,
born_a_pom,Sat Feb 20 16:18:56 IST 2016,jami like walk solidar support recent protest so glad ynwa steve lees
born_a_pom,Sat Feb 20 16:17:40 IST 2016,jami like walk solidar support recent protest so glad ynwa steve lees
born_a_pom,Sat Feb 20 15:36:39 IST 2016,co jami like walk solidar support recent protest so glad ynwa steve lees
born_a_pom,Mon Feb 01 16:07:39 IST 2016,still wait start tweet earlier
born_a_pom,Sun Jan 31 14:49:05 IST 2016,rt all want go school close darwin school young mum sign petit
born_a_pom,Mon Jan 25 05:49:00 IST 2016,rt gold coast oporto vigilant give australian interview time
born_a_pom,Sun Jan 24 16:27:28 IST 2016,tell emerald branch meet parti member recent move area thank
born_a_pom,Fri Jan 22 14:37:46 IST 2016,thank
born_a_pom,Fri Jan 22 14:20:40 IST 2016,tri rejoin link site broken can someon pleas send form email
born_a_pom,Sun Jan 17 14:36:47 IST 2016,huge congrat
born_a_pom,Thu Jan 14 13:22:41 IST 2016,would believ telecommun even make member wright top
born_a_pom,Thu Jan 14 13:22:14 IST 2016,rt better mobil phone coverag need somerset region particular toogoolawah esk coominya
born_a_pom,Tue Jan 05 13:16:51 IST 2016,rt peopl uproar chris gayl comment happi peter dutton what kind place
born_a_pom,Sat Jan 02 09:30:31 IST 2016,rt if mr turnbul liber want fight elect industri relat bring we workchoic
born_a_pom,Sat Jan 02 09:30:12 IST 2016,interest accur quot the gillard project aeu some day union like high school branch green
born_a_pom,Wed Dec 30 08:37:30 IST 2015,rt brough brigg appoint turnbul decis myefo cut turnbul decis what say
born_a_pom,Tue Dec 29 05:23:40 IST 2015,birmo disgrac news gonski fund it shame lnp put joint ticket back togeth buy vote
born_a_pom,Tue Dec 29 05:21:08 IST 2015,gonski said they like public educ like public health they like public
born_a_pom,Sat Dec 05 13:32:56 IST 2015,rt worldsoilday come close noth ag minist interest sustain product
born_a_pom,Thu Dec 03 17:47:48 IST 2015,what great night so mani ppl pay tribut great advoc campaign friend shaft blatant faction power grab
born_a_pom,Fri Nov 20 07:02:04 IST 2015,rt recognis anyon pic gopro selfi stick found valley hunt owner https
born_a_pom,Sat Nov 14 10:33:38 IST 2015,rt tonight light riverbank bridg bluewhit solidar franc
born_a_pom,Sat Nov 14 10:33:07 IST 2015,rt we light brisban storybridg red white blue tonight parisattack
born_a_pom,Sat Nov 14 05:52:41 IST 2015,rt with fellow feder labor rep back kyli localwholisten ipswich
born_a_pom,Mon Nov 09 15:09:56 IST 2015,live qld yet
born_a_pom,Mon Nov 02 16:04:27 IST 2015,qanda need live air rural qld lnp fraud band mean watch onlin due slow connect
born_a_pom,Mon Nov 02 15:51:32 IST 2015,factcheck qanda live tv qld daylight save time
born_a_pom,Mon Nov 02 15:50:26 IST 2015,qanda keep tweet charact serious
born_a_pom,Sat Oct 31 07:54:49 IST 2015,birmo roll full gonski nationwid
born_a_pom,Mon Oct 26 15:03:09 IST 2015,readi get qanda
born_a_pom,Mon Oct 12 15:48:13 IST 2015,qanda live abc tv channel qld
born_a_pom,Mon Oct 12 14:53:25 IST 2015,rt so much advic surviv hsc mani messag luck sure kid deserv assess system
born_a_pom,Thu Oct 08 16:41:11 IST 2015,rt did like govern just rememb polici chang still
born_a_pom,Thu Oct 08 05:44:11 IST 2015,qtupresid need come oz david cameron say turn everi school academi
born_a_pom,Mon Oct 05 17:19:34 IST 2015,qanda took year seek help wish i sooner stupidmaleprid
born_a_pom,Mon Oct 05 17:12:46 IST 2015,get extra seat qanda panel xavier
born_a_pom,Mon Oct 05 17:09:01 IST 2015,we need mental health care cover medicar like healthcar qanda
born_a_pom,Fri Oct 02 12:48:38 IST 2015,rt good see big busi lobbi argument gentl mock great australian trade union movement auspoi
born_a_pom,Fri Oct 02 12:40:13 IST 2015,rt good hear tell love gonski need parti commit fund full six year
born_a_pom,Tue Sep 29 07:28:26 IST 2015,sampidgeon wright campaign fundrais auction sign albo and terri butler item to bid on
