username,time,tweet
maximenamateus,Wed Jun 03 08:24:12 IST 2015,a round applaus use repertoir
maximenamateus,Tue Jun 02 03:50:00 IST 2015,rt hay sonrisa en el mundo mí gustó la tuya
maximenamateus,Tue Jun 02 03:38:45 IST 2015,vamo por eso
maximenamateus,Tue Jun 02 03:36:54 IST 2015,rt y la dieta
maximenamateus,Mon Jun 01 03:20:53 IST 2015,possibl miss somebodi less hour come
maximenamateus,Sun May 31 01:33:27 IST 2015,red nail back
maximenamateus,Fri May 29 23:52:05 IST 2015,my name molli
maximenamateus,Fri May 29 06:45:06 IST 2015,don wast time overthink googl know everyth
maximenamateus,Fri May 29 06:42:40 IST 2015,él sabe como hacerm
maximenamateus,Thu May 28 22:53:07 IST 2015,hate sick
maximenamateus,Thu May 28 02:31:17 IST 2015,un amigo haciendom compañia en la oficina buzzlightyear
maximenamateus,Wed May 27 02:31:16 IST 2015,nap time pleas
maximenamateus,Wed May 27 02:30:01 IST 2015,sabe q esta en el camino correcto cuando pierd el inter por mirar atra
maximenamateus,Sat May 23 05:48:48 IST 2015,no es justo desvelarm las mañana terner q despertarm las
maximenamateus,Thu May 21 09:27:45 IST 2015,el origen se niega todo el día hablando con santandereano que ya al final el mano se escucha hasta bonito
maximenamateus,Tue May 19 10:15:02 IST 2015,rt de día mantien la ment ocupada de noch quita el sueño
maximenamateus,Sat May 16 09:18:19 IST 2015,the worst sensat ever full hear instead eat
maximenamateus,Thu May 14 18:13:25 IST 2015,oh that lol miss guy ps plane train haha
maximenamateus,Thu May 14 08:53:39 IST 2015,i thought soon i saw amtrak crash news
maximenamateus,Thu May 14 08:05:15 IST 2015,escucha xo por johnmay np en soundcloud
maximenamateus,Thu May 14 07:53:31 IST 2015,why mix too much ask
maximenamateus,Wed May 13 01:47:31 IST 2015,si se porta bien
maximenamateus,Tue May 12 09:45:09 IST 2015,la tonta mania en dond el que busca encuentra la que esculca tambien
maximenamateus,Tue May 12 04:34:32 IST 2015,con gana de coger un avion que vaya bien lejo
maximenamateus,Sun May 10 23:42:55 IST 2015,dejenm salir
maximenamateus,Sun May 10 23:15:15 IST 2015,que mejor que un tinto del campo mientra sale toda la gent que se parqueo en frent de mi carro atrapada
maximenamateus,Fri May 08 05:32:44 IST 2015,impos querer verla
maximenamateus,Thu May 07 09:12:39 IST 2015,los complemento perfecto existen para la muestra un boton
maximenamateus,Wed May 06 03:14:05 IST 2015,dia de montaña rusa
maximenamateus,Wed May 06 03:11:41 IST 2015,rt el poder de un abrazo
maximenamateus,Sat May 02 11:53:42 IST 2015,el corazon esta en modo acordeon arrugado
maximenamateus,Fri May 01 08:30:05 IST 2015,gab mas reencuentro
maximenamateus,Sun Apr 26 23:01:08 IST 2015,sabado de pereza domingo de vuelta como q cuadra
maximenamateus,Fri Apr 24 08:10:35 IST 2015,rt
maximenamateus,Thu Apr 23 05:46:43 IST 2015,dia sin carro pico placa mañana tan querido ud señor alcald mi cansancio le
maximenamateus,Thu Apr 23 00:58:41 IST 2015,asi asi
maximenamateus,Wed Apr 22 09:04:55 IST 2015,con gana tía
maximenamateus,Wed Apr 22 08:49:04 IST 2015,quien quier peru
maximenamateus,Wed Apr 22 03:45:33 IST 2015,hay una palabra que esta perturbando en est momento sueñoooooooo zzzzzzz
maximenamateus,Tue Apr 21 06:48:37 IST 2015,look forward
maximenamateus,Thu Apr 16 16:19:07 IST 2015,mucho amor de llevar mi hno al aeropuerto esta hora
maximenamateus,Wed Apr 15 09:41:14 IST 2015,like much pillow face
maximenamateus,Tue Apr 14 08:53:24 IST 2015,acabo de publicar una foto
maximenamateus,Tue Apr 14 07:47:06 IST 2015,have heard and julia stone big jet quinwhisper soundcloud np
maximenamateus,Tue Apr 14 07:34:33 IST 2015,como dos cancion al dia pueden sacar sonrisa
maximenamateus,Mon Apr 13 06:33:16 IST 2015,eato pasa cuando visita tus amig con hijo
maximenamateus,Sun Apr 12 22:28:31 IST 2015,raro yo en el piso pero esta vez si dolio auch pie
maximenamateus,Sat Apr 11 06:31:40 IST 2015,omg girl take ever salon
maximenamateus,Thu Apr 09 09:12:42 IST 2015,let trust magic
maximenamateus,Thu Apr 09 08:18:47 IST 2015,so good red wine health
