username,time,tweet
kindrasims12,Sat Jun 13 02:33:54 IST 2015,you kid yet quit job goal
kindrasims12,Fri Jun 12 16:55:29 IST 2015,don expect anyon els understand talk abo more gemini
kindrasims12,Thu Jun 11 16:55:20 IST 2015,your nerv edg find healthi outlet more gemini
kindrasims12,Wed Jun 10 16:54:56 IST 2015,a sudden imbal power could rear ugli head today yo more gemini
kindrasims12,Tue Jun 09 16:55:27 IST 2015,peopl might attempt talk go along cur more gemini
kindrasims12,Mon Jun 08 16:55:43 IST 2015,although could fact gather neat plac more gemini
kindrasims12,Sun Jun 07 16:55:19 IST 2015,although other count finish regular cho more gemini
kindrasims12,Sat Jun 06 16:55:12 IST 2015,you reluct share feel quiet more gemini
kindrasims12,Fri Jun 05 16:55:42 IST 2015,your social life receiv energet boost charm ven more gemini
kindrasims12,Thu Jun 04 16:55:46 IST 2015,you tempt dismiss practic propos today bef more gemini
kindrasims12,Wed Jun 03 16:55:46 IST 2015,you wish could take day play might more gemini
kindrasims12,Tue Jun 02 16:56:11 IST 2015,it might seem peopl emot demand tod more gemini
kindrasims12,Mon Jun 01 16:56:04 IST 2015,your self confid high today inspir make new more gemini
kindrasims12,Sun May 31 16:56:02 IST 2015,you may believ avoid make commit today more gemini
kindrasims12,Sat May 30 16:55:45 IST 2015,you fork road may feel pressur someon more gemini
kindrasims12,Fri May 29 16:57:08 IST 2015,your overact imagin act bless cur more gemini
kindrasims12,Fri May 29 01:21:10 IST 2015,any volunt help pack
kindrasims12,Thu May 28 19:45:33 IST 2015,rt tgit happi friday eve
kindrasims12,Thu May 28 19:44:59 IST 2015,i tire pick slack
kindrasims12,Thu May 28 19:30:08 IST 2015,
kindrasims12,Thu May 28 16:53:23 IST 2015,you probabl feel slight lackadais make si more gemini
kindrasims12,Wed May 27 16:55:52 IST 2015,you fair share exact oth more gemini
kindrasims12,Tue May 26 16:55:59 IST 2015,you may resist restrict place more gemini
kindrasims12,Mon May 25 16:55:38 IST 2015,peopl wonder get away express more gemini
kindrasims12,Sun May 24 16:55:42 IST 2015,a larger life gestur part big positiv more gemini
kindrasims12,Sat May 23 16:55:37 IST 2015,you might stubborn cling negat feel more gemini
kindrasims12,Fri May 22 16:56:13 IST 2015,slow job method come natur more gemini
kindrasims12,Thu May 21 16:56:29 IST 2015,the frantic pace life pick today energ more gemini
kindrasims12,Wed May 20 16:59:06 IST 2015,you ride pretti intens cross current like more gemini
kindrasims12,Tue May 19 16:55:54 IST 2015,you may experi moment dread start beli more gemini
kindrasims12,Tue May 19 06:24:02 IST 2015,you pregnant smoke good job
kindrasims12,Tue May 19 06:23:32 IST 2015,rt don go cri momma caus real world
kindrasims12,Mon May 18 16:56:00 IST 2015,it time uncov thought secret away yo more gemini
kindrasims12,Sun May 17 16:55:45 IST 2015,you might think someon hide truth more gemini
kindrasims12,Sat May 16 16:54:55 IST 2015,someon admir may becom close friend first more gemini
kindrasims12,Fri May 15 16:56:33 IST 2015,you sore tempt take shortcut today hope more gemini
kindrasims12,Thu May 14 16:56:01 IST 2015,you overflow enthusiasm today sudden se more gemini
kindrasims12,Wed May 13 16:56:56 IST 2015,convers may jumbl today make matter wors more gemini
kindrasims12,Tue May 12 16:57:03 IST 2015,the solut job relat predica may come more gemini
kindrasims12,Mon May 11 16:56:54 IST 2015,you tempt tip toe around delic topic discussi more gemini
kindrasims12,Sun May 10 16:55:45 IST 2015,meet peopl expect may seem like uphil battl more gemini
kindrasims12,Sat May 09 16:55:36 IST 2015,you feel like pendulum swing one way more gemini
kindrasims12,Fri May 08 16:59:05 IST 2015,you might feel littl insecur today sinc charm ve more gemini
kindrasims12,Thu May 07 16:57:01 IST 2015,you may appear quit busi today other figur w more gemini
kindrasims12,Wed May 06 16:57:22 IST 2015,peopl natur assum good time more gemini
kindrasims12,Tue May 05 22:01:52 IST 2015,any volunt pack stuff
kindrasims12,Tue May 05 16:56:29 IST 2015,your action close align heart creat more gemini
kindrasims12,Tue May 05 01:53:47 IST 2015,someon told long ago calm storm
kindrasims12,Tue May 05 01:32:47 IST 2015,buy hous stress
kindrasims12,Tue May 05 01:30:12 IST 2015,i best boss ever
