username,time,tweet
Sadiesniece,Thu Feb 25 20:26:11 IST 2016,in entir prop room find mask wear
Sadiesniece,Thu Feb 25 20:22:11 IST 2016,rt kill rescu swept water wave redondo beach
Sadiesniece,Thu Feb 25 20:21:22 IST 2016,rt name isi threaten zuckerberg dorsey
Sadiesniece,Thu Feb 25 20:20:57 IST 2016,rt my column suprem court parti no way
Sadiesniece,Thu Feb 25 20:20:28 IST 2016,rt your letter help challeng shuttl engin shed year of guilt
Sadiesniece,Thu Feb 25 20:16:03 IST 2016,rt sigalert in malibu mulholland hwi btwn littl sycamor cyn rd and pacif coast hwi is close until further notic due
Sadiesniece,Thu Feb 25 20:15:26 IST 2016,brush fire scorch malibu hillsid evacu possibl nbc southern california via
Sadiesniece,Thu Feb 25 20:11:19 IST 2016,rt seek advic fundrais i creat program help fund local headstart program get bus
Sadiesniece,Thu Feb 25 19:59:48 IST 2016,rt paint time fold colour red heather oil priv coll
Sadiesniece,Thu Feb 25 19:59:28 IST 2016,rt polic say water rescu turn dead harbor redondo beach
Sadiesniece,Thu Feb 25 19:58:59 IST 2016,rt endless peopl still expos kill asbesto
Sadiesniece,Thu Feb 25 19:58:43 IST 2016,rt how get artwork cover vinyl album glad ask
Sadiesniece,Thu Feb 25 19:54:27 IST 2016,brush fire burn malibu scorch acr nearbi kid camp being evacu
Sadiesniece,Thu Feb 25 11:11:41 IST 2016,five non hero hang mall bore
Sadiesniece,Thu Feb 25 11:08:08 IST 2016,rt still awesom photo come dontbreakourphon ralli citi yesterday
Sadiesniece,Thu Feb 25 09:13:43 IST 2016,metropoli ii a special present via
Sadiesniece,Thu Feb 25 09:09:34 IST 2016,rt and hors rode
Sadiesniece,Thu Feb 25 08:18:31 IST 2016,jdl threaten blow caus i work german compani despis ever sinc
Sadiesniece,Thu Feb 25 07:34:16 IST 2016,rt american overwhelm want water system get fix
Sadiesniece,Thu Feb 25 04:18:05 IST 2016,rt
Sadiesniece,Thu Feb 25 04:08:25 IST 2016,rt
Sadiesniece,Thu Feb 25 04:07:48 IST 2016,rt climat chang melt ice disappear food sourc lead polar bear cannib
Sadiesniece,Thu Feb 25 03:48:48 IST 2016,rt feb pio pico marri maria ignacia alvarado plaza church https
Sadiesniece,Thu Feb 25 03:48:32 IST 2016,i everi time i head desert
Sadiesniece,Thu Feb 25 03:19:58 IST 2016,near percent support disapprov lincoln free slave via
Sadiesniece,Thu Feb 25 00:35:56 IST 2016,rt meet founder terrorist harlan carter shot year old boy led oper wetback gunsens
Sadiesniece,Thu Feb 25 00:32:50 IST 2016,some owner sport team realli work american public it time bite bullet say
Sadiesniece,Thu Feb 25 00:29:15 IST 2016,rt inaccur sentenc condemn prison serv longer law
Sadiesniece,Thu Feb 25 00:27:57 IST 2016,wisconsin is about to make it easier for debt collector to go after consum rickett famili friend strike
Sadiesniece,Thu Feb 25 00:26:30 IST 2016,rt wisconsin make easier debt collector go consum
Sadiesniece,Thu Feb 25 00:22:31 IST 2016,a tribut to georg clayton johnson american cinemathequ
Sadiesniece,Thu Feb 25 00:22:17 IST 2016,a tribut to georg clayton johnson american cinemathequ
Sadiesniece,Thu Feb 25 00:21:00 IST 2016,rt brutal death italian student egypt confound expert h
Sadiesniece,Thu Feb 25 00:11:54 IST 2016,i afraid would happen the island breathtak beauti fragil
Sadiesniece,Thu Feb 25 00:04:21 IST 2016,rt polit motiv trap law affect low incom women women color trap doc share stori
Sadiesniece,Thu Feb 25 00:02:55 IST 2016,a tribut to georg clayton johnson american cinemathequ
Sadiesniece,Thu Feb 25 00:02:08 IST 2016,rt samantha bee ask refuge think isi they answer h
Sadiesniece,Thu Feb 25 00:01:16 IST 2016,rt oscar nomine urg skip israel swag bag trip via reuter skipthetrip make headlin
Sadiesniece,Wed Feb 24 23:59:52 IST 2016,a tribut to georg clayton johnson american cinemathequ
Sadiesniece,Wed Feb 24 23:56:55 IST 2016,rt massiv starfish die off link warm ocean natur h
Sadiesniece,Wed Feb 24 23:56:35 IST 2016,leonard cohen first record live perform the gift april
Sadiesniece,Wed Feb 24 23:55:10 IST 2016,wait wait wait
Sadiesniece,Wed Feb 24 23:52:28 IST 2016,rt doubl fatal crash fwi san dima watch
Sadiesniece,Wed Feb 24 23:51:33 IST 2016,this friday a tribut to georg clayton johnson american cinemathequ
Sadiesniece,Wed Feb 24 23:51:16 IST 2016,this friday a tribut to georg clayton johnson american cinemathequ
Sadiesniece,Wed Feb 24 23:47:50 IST 2016,rt break all wb lane close freeway glendora fatal multi vehicl crash chp say
Sadiesniece,Wed Feb 24 23:38:38 IST 2016,rt wound iraq war ugandan fight u s compens via
Sadiesniece,Wed Feb 24 23:38:28 IST 2016,rt attent women red blous do go picnic man he manner luck
Sadiesniece,Wed Feb 24 23:30:11 IST 2016,chomski trump rise due breakdown societi
Sadiesniece,Wed Feb 24 23:08:44 IST 2016,thank i found itun
