username,time,tweet
PochooMut,Tue Apr 07 09:20:50 IST 2015,offici great
PochooMut,Tue Apr 07 09:18:30 IST 2015,mean anyth i vouch proof
PochooMut,Tue Apr 07 08:09:52 IST 2015,pleas anyon buy tax cover msp pleas
PochooMut,Tue Apr 07 07:33:47 IST 2015,i go first
PochooMut,Tue Apr 07 06:27:50 IST 2015,i realli wanna deal i one right
PochooMut,Tue Apr 07 06:00:29 IST 2015,i wanna sell though tri hold onto rest
PochooMut,Tue Apr 07 05:55:42 IST 2015,i right i sell i cover tax cours
PochooMut,Tue Apr 07 05:49:47 IST 2015,much only look right
PochooMut,Tue Apr 07 04:42:32 IST 2015,sell coin msp only fair rate need it by tonight
PochooMut,Tue Apr 07 04:41:11 IST 2015,msp
PochooMut,Sat Apr 04 04:08:09 IST 2015,still sell look msp fair deal
PochooMut,Sat Apr 04 04:06:12 IST 2015,battlefield
PochooMut,Fri Apr 03 17:55:23 IST 2015,dm
PochooMut,Fri Apr 03 05:33:44 IST 2015,sell coin msp only fair rate
PochooMut,Fri Apr 03 03:37:17 IST 2015,in need msp coin i need everyth must go only msp
PochooMut,Sun Feb 08 11:57:01 IST 2015,what friend got scam like friend get guy hot water
PochooMut,Sun Feb 08 03:42:36 IST 2015,rt hour mike vick giveaway rt chanc win one lucki winner tomorrow
PochooMut,Thu Feb 05 08:22:49 IST 2015,i gonna kms
PochooMut,Thu Feb 05 08:20:41 IST 2015,rise star come are still come
PochooMut,Fri Jan 09 07:42:23 IST 2015,sorri
PochooMut,Thu Jan 01 00:39:39 IST 2015,how much look
PochooMut,Wed Dec 31 22:14:36 IST 2014,still msp
PochooMut,Tue Dec 30 08:52:26 IST 2014,rt first giveaway time the elit badg rt and follow to enter end time tbd
PochooMut,Tue Dec 30 01:16:05 IST 2014,pull like i get
PochooMut,Tue Dec 30 01:15:42 IST 2014,i rememb night like yesterday
PochooMut,Tue Dec 30 01:09:18 IST 2014,rt the playoff final set man we great matchup afc nfc now i need kfc man i hungri
PochooMut,Mon Dec 29 22:33:55 IST 2014,rt this is the excit i use to have for mut goodoldday
PochooMut,Sat Dec 27 23:21:58 IST 2014,fletcher coverag abil thingsbetterthanultimatepack
PochooMut,Sat Dec 27 23:18:30 IST 2014,green eagl main color green ribbon tie like x dawkin known weapon x
PochooMut,Sat Dec 27 21:32:32 IST 2014,
PochooMut,Sat Dec 27 21:30:43 IST 2014,i will take msp i couch peopl trust pictur proof i deal
PochooMut,Sat Dec 27 21:29:19 IST 2014,dm
PochooMut,Sat Dec 27 20:57:14 IST 2014,when i actual want play ea server
PochooMut,Sat Dec 27 10:06:40 IST 2014,say kid
PochooMut,Sat Dec 27 01:31:50 IST 2014,rt we done rt chanc win
PochooMut,Sat Dec 27 01:31:45 IST 2014,rt rt chanc win
PochooMut,Fri Dec 26 12:07:36 IST 2014,live i play hors
PochooMut,Fri Dec 26 12:06:02 IST 2014,peopl live live peopl give reaction
PochooMut,Fri Dec 26 12:04:20 IST 2014,say bottom sign ea server
PochooMut,Thu Dec 25 06:35:12 IST 2014,pic gtfo
PochooMut,Thu Dec 25 06:29:44 IST 2014,dm
PochooMut,Wed Dec 24 11:40:06 IST 2014,face game weak ass game come clutch
PochooMut,Wed Dec 24 11:39:34 IST 2014,said bitch lot
PochooMut,Sun Dec 21 20:37:36 IST 2014,i dream sanchez fletcher play like legend
PochooMut,Sun Dec 21 09:08:51 IST 2014,good ole day
PochooMut,Sun Dec 21 06:24:37 IST 2014,i blame parkey man struggl groin issu we got punk sanchez william fletcher
PochooMut,Sun Dec 21 06:22:59 IST 2014,his stat look good player work he aw can close game
PochooMut,Sun Dec 21 06:22:07 IST 2014,this season end soon fole went thanx sanchez fletcher william can wait till ugli fucker philli
