username,time,tweet
naptinia,Fri Mar 27 18:35:13 IST 2015,less total weight sugar that suppos impress anyon congrat
naptinia,Thu Mar 26 06:28:10 IST 2015,rt amaz earthhouruk support wwf ambassador time speak demand better futur
naptinia,Wed Mar 25 17:03:51 IST 2015,rt move toward plant base diet could save billion at least scientif advisori committe say
naptinia,Wed Mar 25 17:01:50 IST 2015,rt uh oh i truffl chocol pistachio truffl energi bite
naptinia,Wed Mar 25 17:01:16 IST 2015,rt how govegan stay vegan
naptinia,Tue Mar 24 20:38:20 IST 2015,delici vegan
naptinia,Tue Mar 24 18:32:50 IST 2015,can wait cinnamon roll yummi vegan
naptinia,Tue Mar 24 12:50:53 IST 2015,goodmorn noth better fresli made juic start day
naptinia,Tue Mar 24 03:57:29 IST 2015,rt for one planet use yourpow go beyond hour earthhour
naptinia,Tue Mar 24 03:56:42 IST 2015,rt cheesi jalapeno burger vegan burger recip w more protein than beef
naptinia,Tue Mar 24 01:47:05 IST 2015,rt have friend love meat great sign meatfreeweek challeng march
naptinia,Mon Mar 23 18:52:46 IST 2015,rt happi monday my black bean crust pizza recip wait link bio
naptinia,Mon Mar 23 18:17:48 IST 2015,vegan cake oven soooo curious
naptinia,Mon Mar 23 16:32:46 IST 2015,rt ltrs water put kg beef supermarket that one reason go vegetarian
naptinia,Sun Mar 22 20:35:28 IST 2015,rt build better smoothi learn use blender ultim breakfast sip
naptinia,Sun Mar 22 20:33:18 IST 2015,rt as soon i realiz i need meat surviv good health i began see forlorn
naptinia,Sun Mar 22 13:44:48 IST 2015,rt saturday glorytogreen lunch spinach kale roast sweetpotato black bean german
naptinia,Sat Mar 21 14:51:41 IST 2015,vegetarian so sick contagi look i eat anim you killer explain
naptinia,Sat Mar 21 14:21:10 IST 2015,great initi it time spread word encourag peopl reduc amount meat eat vegetarian vegan
naptinia,Sat Mar 21 14:19:21 IST 2015,rt if ever curious tri vegetarian diet good join meatfreeweek meatfreeweekorg https
naptinia,Sat Mar 21 14:18:26 IST 2015,rt happi first day spring this recip avolici raw soup recip plus mani color
naptinia,Sat Mar 21 14:10:52 IST 2015,rt human only speci drink milk anoth speci her milk him you
naptinia,Sat Mar 21 04:20:13 IST 2015,rt smile infecti spread love internationaldayofhappi happyday
naptinia,Fri Mar 20 21:27:59 IST 2015,chia choco pud vegan chiase chocol yummi
naptinia,Thu Mar 19 20:25:19 IST 2015,rt we are all anim
naptinia,Thu Mar 19 03:19:50 IST 2015,longday exhaust goodnight
naptinia,Thu Mar 19 03:15:56 IST 2015,rt kale univers everyon never tri
naptinia,Thu Mar 19 03:15:46 IST 2015,soooo true
naptinia,Thu Mar 19 03:14:56 IST 2015,rt chocol no bake almond joy energi ball
naptinia,Thu Mar 19 03:14:23 IST 2015,hahaha hilari vegan i vegetarian i love anim i vegetarian i hate plant
naptinia,Thu Mar 19 03:11:45 IST 2015,rt blood orang poppi seed cake vegan
naptinia,Tue Mar 17 17:51:12 IST 2015,yummi vegan chia chocol chia seed superfood pud gluten free vegan via
naptinia,Tue Mar 17 17:41:43 IST 2015,interestin sweetpotatosoul what i eat everyday video pickl avocado toast
naptinia,Tue Mar 17 17:31:54 IST 2015,rt should you leav tv radio for your pet
naptinia,Tue Mar 17 17:31:04 IST 2015,rt readi minut vegan lunch made easi
naptinia,Mon Mar 16 21:54:38 IST 2015,rt want littl hand hold transit vegan diet here perfect book
naptinia,Mon Mar 16 21:09:24 IST 2015,pancak recepi sweetpotatosoul look yummi appl spice pancak video
naptinia,Mon Mar 16 20:59:09 IST 2015,readi new start
naptinia,Mon Mar 16 20:58:52 IST 2015,rt inspir mantra kick monday
naptinia,Mon Mar 16 20:18:49 IST 2015,rt happi throwbackthursday tbt
naptinia,Wed Nov 06 19:06:27 IST 2013,ashton kutcher speech teen choic award realli inspir
naptinia,Wed Nov 06 18:22:05 IST 2013,rt should lovelustfaithdreamstour clip like rt yes
naptinia,Wed Nov 06 17:55:54 IST 2013,rt experi simpli name give mistak wild
naptinia,Tue Nov 05 19:52:57 IST 2013,annual cat week via
naptinia,Thu Oct 31 00:47:19 IST 2013,make fall love everytim watch
naptinia,Wed Oct 30 18:43:50 IST 2013,smoothi breakfast sooo yummi
naptinia,Fri Oct 25 15:49:26 IST 2013,save mr bank offici trailer via
naptinia,Fri Oct 25 15:33:19 IST 2013,such bore lesson and start univers bore
naptinia,Fri Oct 25 02:53:39 IST 2013,lorenzo stile è ugual manca solo la voce
naptinia,Fri Oct 25 02:34:57 IST 2013,aba brava molto brava non mi da nient non mi arriva
