username,time,tweet
joshauck,Mon Feb 29 06:19:57 IST 2016,watch michael strahan forc tina fey selfi never present classili oscar
joshauck,Mon Feb 29 06:17:08 IST 2016,in room peopl watch oscar i never seen mani famous peopl i forgotten exist
joshauck,Sun Feb 28 23:55:19 IST 2016,most agre concern ceil run talent team happen execut
joshauck,Sun Feb 28 23:45:04 IST 2016,they talent enough win without superior execut sort like poor man wichita st
joshauck,Sat Feb 27 07:21:39 IST 2016,him cousin harden big whine also clip collect unit
joshauck,Sat Feb 27 00:04:03 IST 2016,not lot evid hang onto entri pass post tape i seen
joshauck,Fri Feb 26 23:13:05 IST 2016,now need learn catch pass block run behind line mile better oppon
joshauck,Fri Feb 26 08:09:56 IST 2016,he probabl say current presid appoint would doubt find fault mani potenti candid
joshauck,Thu Feb 25 22:38:17 IST 2016,how deep would dynasti roster need add t rich man fantasi dynastyfootbal
joshauck,Thu Feb 25 08:58:27 IST 2016,to eye dunleavi come back fix lot bull issu he allow defens readjust bc move ball quick
joshauck,Thu Feb 25 08:37:05 IST 2016,benjamin gordon martin ingram laci concern ingram injuri think laci look beyond bad
joshauck,Thu Feb 25 08:15:53 IST 2016,this best offens game i seen bull play might system work rose butler weigh
joshauck,Wed Feb 24 07:02:11 IST 2016,it look like obstacl particular unorigin laser tag cours
joshauck,Tue Feb 23 09:37:19 IST 2016,i think wwe fan age want want roman reign beat wrestlemania perform
joshauck,Tue Feb 23 09:30:54 IST 2016,anyth involv bigshow long ago descend unintent comedi raw wwe
joshauck,Mon Feb 22 07:34:13 IST 2016,is realli want wm this feud realli wwefastlan wrestlemania
joshauck,Mon Feb 22 06:37:14 IST 2016,look like poor construct cgi render actual person wwefastlan wwe
joshauck,Sat Feb 20 23:57:54 IST 2016,i sure well intent feel embarrass get blown basketbal
joshauck,Thu Feb 18 23:48:29 IST 2016,why trade frye it seem like cav interest wors love certain help guard dub
joshauck,Sat Feb 13 04:02:54 IST 2016,that sort i settl thank advic btw thorough enjoy new podcast
joshauck,Sat Feb 13 03:41:46 IST 2016,should mention also ppr make signific enough differ
joshauck,Sat Feb 13 03:27:22 IST 2016,was offer gurley l bell straight what play
joshauck,Sat Feb 13 00:42:16 IST 2016,in particular order cade mcnown ced benson johnni knox kellen davi j marcus webb immort chris cont
joshauck,Tue Feb 09 21:47:05 IST 2016,to fair cam also shown extrem poor sport win admir consist camnewton
joshauck,Tue Feb 09 10:01:03 IST 2016,thankyoudanielbryan make care deepli someth silli
joshauck,Tue Feb 09 04:50:39 IST 2016,and seem like kerr pick lot pop certain run triangl
joshauck,Tue Feb 09 04:46:57 IST 2016,thank year away one brought back wrestl thankyoudanielbryan
joshauck,Mon Feb 08 08:42:38 IST 2016,giveuppunt
joshauck,Mon Feb 08 07:47:32 IST 2016,that drop right propbet
joshauck,Mon Feb 08 07:32:46 IST 2016,they would throw jericho cotcheri
joshauck,Mon Feb 08 07:21:10 IST 2016,noth wrong halftim show fun hate
joshauck,Mon Feb 08 07:08:36 IST 2016,did anyon tell coldplay happen pepsihalftim
joshauck,Mon Feb 08 06:08:28 IST 2016,a yard differ seem like silli use final challeng keeppound
joshauck,Mon Feb 08 05:47:36 IST 2016,cotcheri bad game far peewe level drop mayb switch number tedd ginn
joshauck,Mon Feb 08 05:39:32 IST 2016,but clear incomplet nose ball hit ground shift roll
joshauck,Mon Feb 08 03:03:05 IST 2016,it injustic timber second td taken away votetimb puppybowl
joshauck,Mon Feb 08 01:08:35 IST 2016,the puppi bowl took shot brian william puppybowl nbcnightlynew
joshauck,Mon Feb 08 01:03:59 IST 2016,serious question puppi bowl announc better cbs team puppybowl superbowl
joshauck,Sun Feb 07 23:49:33 IST 2016,still though skull fractur good thing either easi fix nfl
joshauck,Sat Feb 06 09:14:46 IST 2016,knee ligament injuri definit sprain would seem indic acl easili diagnos live
joshauck,Sat Feb 06 09:11:14 IST 2016,bull train staff real issu it happen anyon screw lu jo rose butler coincid bull
joshauck,Sat Feb 06 00:40:22 IST 2016,at point need think penal coach well program you know pitino run greener pastur uofl
joshauck,Tue Feb 02 07:20:17 IST 2016,the socialoutcast like michael scott tag team place hard watch raw
joshauck,Mon Feb 01 06:41:22 IST 2016,rice call throw intercept forc fumbl recov play probowl
joshauck,Mon Feb 01 04:59:29 IST 2016,john scott highest percentag career goal score star game nhlallstar
joshauck,Mon Feb 01 03:31:45 IST 2016,these team close eye open see much better pau deandr jordan clipper bull chiatlac
joshauck,Tue Jan 26 21:48:53 IST 2016,did whine foul call afterward blakegriffin clipper
joshauck,Mon Jan 25 05:45:16 IST 2016,the rb play qb thing becom disservic cam real qb least leagu averag pocket azvscar keeppound
joshauck,Mon Jan 25 04:47:28 IST 2016,gronk whine doyourjob
joshauck,Mon Jan 25 04:44:38 IST 2016,terribl challeng might catch definit fumbl nevsden broncoscountryplayoff
