username,time,tweet
Castrejo67,Sun Feb 28 00:11:08 IST 2016,well end drug problem
Castrejo67,Sun Feb 28 00:06:46 IST 2016,honorari aussi chat one day
Castrejo67,Sun Feb 28 00:05:31 IST 2016,delici
Castrejo67,Sun Feb 28 00:04:28 IST 2016,i would label show regress progress
Castrejo67,Sun Feb 28 00:02:20 IST 2016,ok like tweet
Castrejo67,Sun Feb 28 00:01:56 IST 2016,i like video the f word world dumbest video contest
Castrejo67,Sat Feb 27 23:59:11 IST 2016,hold ya hors mate still watch latest video
Castrejo67,Sat Feb 27 23:48:13 IST 2016,even set garden
Castrejo67,Sat Feb 27 23:36:35 IST 2016,edit an idiot gtr block road mong
Castrejo67,Sat Feb 27 23:34:37 IST 2016,idiot caus traffic jam caus brought chain
Castrejo67,Sat Feb 27 23:21:47 IST 2016,i like video this better better
Castrejo67,Sat Feb 27 23:20:25 IST 2016,rt great read regressiveleft intersect nonsens
Castrejo67,Sat Feb 27 23:16:08 IST 2016,i like video qualiti test you bastard
Castrejo67,Sat Feb 27 23:13:26 IST 2016,i like video buzzcanc the white stuff
Castrejo67,Sat Feb 27 23:12:43 IST 2016,yep
Castrejo67,Sat Feb 27 21:48:48 IST 2016,i like video destruct gift
Castrejo67,Sat Feb 27 21:36:21 IST 2016,i like video tim blake diari
Castrejo67,Sat Feb 27 20:35:28 IST 2016,comparison brilliant i salut
Castrejo67,Sat Feb 27 20:31:28 IST 2016,my neighborhood i woke today
Castrejo67,Sat Feb 27 19:07:56 IST 2016,cool gonna watch
Castrejo67,Sat Feb 27 18:57:10 IST 2016,i bet still major black black crime huge margin
Castrejo67,Sat Feb 27 18:55:37 IST 2016,yes dickhead cheer mate
Castrejo67,Sat Feb 27 18:54:40 IST 2016,michael fault accord one dickhead i read morn
Castrejo67,Sat Feb 27 18:41:41 IST 2016,i like video femin women only
Castrejo67,Sat Feb 27 18:26:52 IST 2016,i like video univers professor funniest reason censorship
Castrejo67,Sat Feb 27 17:51:06 IST 2016,nope ignor fine
Castrejo67,Sat Feb 27 17:39:55 IST 2016,i like video bear hagbard make angri aussi even angrier
Castrejo67,Sat Feb 27 17:39:33 IST 2016,palestinian intent commit suicid soldier stop attack arm soldier knife wont shoot
Castrejo67,Sat Feb 27 17:09:32 IST 2016,least h claim lol
Castrejo67,Sat Feb 27 16:39:36 IST 2016,funni fuck till bout minut jaclyn ruin d
Castrejo67,Sat Feb 27 16:36:58 IST 2016,man quot lol
Castrejo67,Sat Feb 27 16:25:20 IST 2016,i like video jaclyn glenn do girl masturb
Castrejo67,Sat Feb 27 05:24:15 IST 2016,good night mate wonder know snarki remark tonight sorri
Castrejo67,Sat Feb 27 05:12:46 IST 2016,rt atheist atheism religion god church islam jesus bacon bibl freethink secular quran war
Castrejo67,Sat Feb 27 04:55:18 IST 2016,fist gross
Castrejo67,Sat Feb 27 04:38:27 IST 2016,tomorrow good
Castrejo67,Sat Feb 27 04:24:49 IST 2016,i think expect conflict sam harri like usual get even sofbal didnt let
Castrejo67,Sat Feb 27 04:21:05 IST 2016,context berni sander
Castrejo67,Sat Feb 27 04:07:25 IST 2016,rt ladi gentlemen i give result maryam namazi open border
Castrejo67,Sat Feb 27 03:53:04 IST 2016,rt as name suggest littl open ozplant shrub certain impress epacri impressa ericacea
Castrejo67,Sat Feb 27 03:49:23 IST 2016,lol
Castrejo67,Sat Feb 27 03:46:25 IST 2016,much appreci d
Castrejo67,Sat Feb 27 03:44:40 IST 2016,kristi alway look us
Castrejo67,Sat Feb 27 03:41:12 IST 2016,cool enjoy
Castrejo67,Sat Feb 27 03:39:35 IST 2016,skep hangout right
Castrejo67,Sat Feb 27 03:29:48 IST 2016,rt samharrisorg
Castrejo67,Sat Feb 27 03:29:13 IST 2016,best summat interview far
Castrejo67,Sat Feb 27 03:02:10 IST 2016,terribl wont one think cat
Castrejo67,Sat Feb 27 02:56:22 IST 2016,moron
Castrejo67,Sat Feb 27 02:36:08 IST 2016,wtf everyon feel lone
