username,time,tweet
LegacyBishop,Sat May 16 13:38:43 IST 2015,last weekend augi excit
LegacyBishop,Sat May 16 06:59:32 IST 2015,rt go crazi vega this sunday ticket sundrai draislv rt
LegacyBishop,Fri May 15 02:08:09 IST 2015,rt the music come chicago right
LegacyBishop,Fri May 15 02:04:57 IST 2015,rt happen wizard hawk game last night
LegacyBishop,Fri May 15 01:47:16 IST 2015,rt i born make mistak not fake perfect
LegacyBishop,Fri May 15 01:46:46 IST 2015,seen like ten peopl i know babi age holdupholdup
LegacyBishop,Fri May 15 01:03:07 IST 2015,imma hold everi memori i go
LegacyBishop,Fri May 15 00:16:00 IST 2015,rt tweet question start haveueva i answer limit time
LegacyBishop,Thu May 14 21:34:08 IST 2015,all i got put mind
LegacyBishop,Thu May 14 13:52:19 IST 2015,you learn lot person observ
LegacyBishop,Thu May 14 13:34:09 IST 2015,i swear goofi
LegacyBishop,Thu May 14 13:33:19 IST 2015,slip disappoint ant trip neither i can wast energi
LegacyBishop,Thu May 14 13:32:06 IST 2015,i wanna bring
LegacyBishop,Thu May 14 13:30:50 IST 2015,some peopl meant life other pure amus
LegacyBishop,Thu May 14 11:31:24 IST 2015,rt checkout websit vamplif teamnosleep
LegacyBishop,Thu May 14 11:28:01 IST 2015,me get ppl shimmi lol parti
LegacyBishop,Thu May 14 08:12:38 IST 2015,
LegacyBishop,Wed May 13 20:32:48 IST 2015,i wish i start
LegacyBishop,Wed May 13 01:59:16 IST 2015,connect right peopl
LegacyBishop,Wed May 13 01:06:20 IST 2015,rt my friend take chicago saturday get tix now
LegacyBishop,Wed May 13 00:55:55 IST 2015,check behind scene footag via boy
LegacyBishop,Tue May 12 22:51:19 IST 2015,thing get deep get hard climb
LegacyBishop,Tue May 12 09:34:58 IST 2015,rt kany west receiv honorari doctor chicago
LegacyBishop,Tue May 12 09:34:39 IST 2015,rt i believ possibl
LegacyBishop,Tue May 12 09:31:43 IST 2015,rt chancetherapp close pitchforkfest don miss
LegacyBishop,Tue May 12 09:26:25 IST 2015,rt open mike ft vic mensa kayn west amaz kid chicago brought sox staff
LegacyBishop,Tue May 12 09:24:52 IST 2015,rt excus
LegacyBishop,Tue May 12 09:22:55 IST 2015,rt part
LegacyBishop,Tue May 12 09:14:00 IST 2015,rt i like everybodi busi my shit oso
LegacyBishop,Tue May 12 09:13:17 IST 2015,i think need lineup
LegacyBishop,Tue May 12 09:11:27 IST 2015,rt alex wiley vibrat live on skee tv
LegacyBishop,Tue May 12 09:04:03 IST 2015,rt watch perform latest openmik event
LegacyBishop,Tue May 12 09:01:09 IST 2015,rt that shimmi tho
LegacyBishop,Tue May 12 03:54:35 IST 2015,rt why gotta hold hand csl you go carveri gonna get lost
LegacyBishop,Tue May 12 02:53:00 IST 2015,not much tri good time
LegacyBishop,Tue May 12 02:21:18 IST 2015,the wolf real
LegacyBishop,Tue May 12 02:10:02 IST 2015,fall love work
LegacyBishop,Tue May 12 00:26:42 IST 2015,one perfect past let consum
LegacyBishop,Mon May 11 21:45:36 IST 2015,rt ticket second annual raurfest sale
LegacyBishop,Mon May 11 21:27:50 IST 2015,treat queen like queen
LegacyBishop,Mon May 11 21:25:23 IST 2015,take lose like man
LegacyBishop,Mon May 11 08:44:22 IST 2015,your bless
LegacyBishop,Mon May 11 08:41:16 IST 2015,rt new look vike readi new look season theaugieway
LegacyBishop,Mon May 11 08:36:44 IST 2015,rt ion realli like new rule ima drop album without tell nobodi shit start feel like fad my album drop
LegacyBishop,Mon May 11 08:35:03 IST 2015,rt adida
LegacyBishop,Mon May 11 08:32:15 IST 2015,rt artist watch via can wait show music year
LegacyBishop,Mon May 11 08:14:21 IST 2015,rt love
LegacyBishop,Mon May 11 08:03:01 IST 2015,
LegacyBishop,Mon May 11 07:59:26 IST 2015,rt can wait till son come home
