username,time,tweet
JMcMil129,Mon Mar 28 03:05:19 IST 2016,are play anywher near austin
JMcMil129,Mon Mar 28 03:02:51 IST 2016,i like hole whack grandstand pgagoofygolf
JMcMil129,Sun Mar 27 18:32:41 IST 2016,rt rejoic stlcard fan today last sun basebal
JMcMil129,Fri Mar 25 19:45:00 IST 2016,rt it march mad zion expect full shuttl weekend wait time minut
JMcMil129,Mon Mar 21 23:53:36 IST 2016,break news think i heard espn cub could challeng nl central knew stlcard
JMcMil129,Mon Mar 21 15:56:07 IST 2016,just dream wherewouldiratherb stlcard
JMcMil129,Mon Mar 21 15:53:36 IST 2016,sit orl head chattanooga thru atl think springbreak springtrain stlcard i figur keep smile
JMcMil129,Sun Mar 20 17:54:53 IST 2016,spring basebal stlcard enjoy
JMcMil129,Sun Mar 20 03:20:44 IST 2016,hey everybodi think big pictur alway best thanksforlisten
JMcMil129,Wed Mar 16 22:12:04 IST 2016,long may run enjoy
JMcMil129,Wed Mar 16 21:02:36 IST 2016,rt today first six straight day cardin basebal retweet excit stlcard
JMcMil129,Wed Mar 16 20:49:41 IST 2016,enjoy outdoor patio f termin delta atl skyroom await intern flight tri citi tn
JMcMil129,Wed Mar 16 18:26:15 IST 2016,rt i love one fav place ever watch favorit girl swing coach
JMcMil129,Wed Mar 16 18:25:45 IST 2016,rt it nation everyth you do is right day goplay you go wrong cours
JMcMil129,Wed Mar 16 17:02:31 IST 2016,move fast dontblink
JMcMil129,Sun Mar 13 00:52:20 IST 2016,
JMcMil129,Sat Mar 12 23:55:24 IST 2016,move fla would go spring game grab beer enjoy talk old guy stand i guy stlcard enjoy
JMcMil129,Mon Mar 07 06:22:10 IST 2016,rt this dude get espi
JMcMil129,Mon Mar 07 03:57:56 IST 2016,oh
JMcMil129,Mon Mar 07 03:12:35 IST 2016,rt don blink
JMcMil129,Mon Mar 07 03:11:32 IST 2016,rt daylight save time next weekend translat time golf
JMcMil129,Mon Mar 07 03:10:55 IST 2016,rt a beauti day huge crowd trophi incred comeback what season open
JMcMil129,Mon Mar 07 03:02:06 IST 2016,rt stoppag time comeback come behind tie rsl
JMcMil129,Mon Mar 07 01:06:41 IST 2016,get red helicopt ocsc
JMcMil129,Sun Mar 06 20:36:25 IST 2016,rt get everybodi it game day neverhuntalon fillthebowlagain
JMcMil129,Sat Mar 05 21:58:43 IST 2016,public servic pay pretti well polit tri
JMcMil129,Thu Mar 03 11:08:02 IST 2016,rt watch year old ace first hole play golf tiger wood incred
JMcMil129,Wed Mar 02 01:42:39 IST 2016,rt we celebr year fat tire collabor favorit breweri more https
JMcMil129,Sat Feb 27 15:17:50 IST 2016,rt the best reveng move get continu succeed never give someon satisfact watch
JMcMil129,Thu Feb 25 22:03:33 IST 2016,work way april come fast enough stlcard
JMcMil129,Tue Feb 23 05:36:37 IST 2016,rt rough week wed thu fri sat sun tbd doesn get better
JMcMil129,Sat Feb 20 07:20:01 IST 2016,rt coral canyon take top spot cag choic best golf experi travel
JMcMil129,Sat Feb 20 07:12:33 IST 2016,rt i love play game basebal i love put uniform stan musial
JMcMil129,Sat Feb 20 07:11:43 IST 2016,rt these cloud get pretti cirrus serious cirrus uncinus cloud yosemit fall
JMcMil129,Sat Feb 20 07:09:07 IST 2016,readi ballgam stlcard
JMcMil129,Thu Feb 18 19:32:40 IST 2016,rt respect peopl find time schedul see love peopl never look schedul need
JMcMil129,Wed Feb 17 23:26:07 IST 2016,well i run road tri loosen load
JMcMil129,Tue Feb 16 20:50:59 IST 2016,rt to celebr fillthebowlagain give one lucki fan cake rt win pick
JMcMil129,Sat Feb 13 20:54:43 IST 2016,no doubt question card gibson start
JMcMil129,Fri Feb 12 07:27:28 IST 2016,rt when compos email leav recipi field blank readi send messag
JMcMil129,Fri Feb 12 05:06:27 IST 2016,take all night right if i get smile i leav
JMcMil129,Fri Feb 12 04:46:37 IST 2016,know littl tire skyroom head men room hold door nice ladi follow oop
JMcMil129,Wed Feb 10 23:55:48 IST 2016,need ballgam stlcard
JMcMil129,Sat Feb 06 21:33:30 IST 2016,rt championship saturday here stand two round duel desert
JMcMil129,Wed Feb 03 03:16:41 IST 2016,what great day
JMcMil129,Wed Feb 03 03:13:57 IST 2016,rt today red schoendienst birthday he came dugout proclaim year stlcard https
JMcMil129,Wed Feb 03 00:35:23 IST 2016,rt happi birthday legendari hall famer red schoendienst we
JMcMil129,Wed Feb 03 00:00:21 IST 2016,off vega golf game super parti work nocomplaint
JMcMil129,Thu Jan 28 07:15:24 IST 2016,rt rt think yadier molina great catcher stlcard bellletstalk
JMcMil129,Thu Jan 28 07:15:19 IST 2016,enough said
