username,time,tweet
Dmoney1568,Mon Apr 06 19:14:24 IST 2015,mayb hors grant permiss
Dmoney1568,Mon Apr 06 18:26:57 IST 2015,great easter day famili now day kentucki derbi day preak day belmont day saratoga open day
Dmoney1568,Mon Apr 06 07:24:31 IST 2015,light race get better race moth help get
Dmoney1568,Mon Apr 06 07:17:48 IST 2015,american pharaoh dortmund carp diem materi stanford
Dmoney1568,Mon Apr 06 07:06:11 IST 2015,i use firster the horribl sheet need big win d mato firster
Dmoney1568,Mon Apr 06 07:02:41 IST 2015,the life we get week back salt mine tomorrow start prepar next weekend
Dmoney1568,Mon Apr 06 06:59:53 IST 2015,life chang money money make wager week
Dmoney1568,Mon Apr 06 06:59:05 IST 2015,i know i push ticket time went my frustrat lose head
Dmoney1568,Mon Apr 06 06:50:19 IST 2015,you better man i i still piss lol
Dmoney1568,Mon Apr 06 06:49:12 IST 2015,on sheet slow seen last he everyth right though
Dmoney1568,Mon Apr 06 06:33:00 IST 2015,i think intern star bet well
Dmoney1568,Mon Apr 06 06:32:20 IST 2015,i think top three much better rest matter dortmund carp diem american pha
Dmoney1568,Mon Apr 06 06:29:10 IST 2015,kevin i pretti sure need even worri jockey el kabeir alreadi toss
Dmoney1568,Mon Apr 06 06:24:45 IST 2015,i could see other list i think good enough
Dmoney1568,Mon Apr 06 06:19:41 IST 2015,is twitter back hors kd win frost el kabeir tencendur ocho ocho ocho danz moon
Dmoney1568,Mon Apr 06 05:59:04 IST 2015,if steeler take olb kentucki dupre i immedi sell everyth i root jet idiotcoach
Dmoney1568,Mon Apr 06 04:42:04 IST 2015,berajano nine wide entir race make big move flatten no shit wide entir race
Dmoney1568,Mon Apr 06 04:34:54 IST 2015,happi easter
Dmoney1568,Mon Apr 06 04:00:14 IST 2015,i happen yes alway i get often either
Dmoney1568,Mon Apr 06 01:58:30 IST 2015,happi easter famili
Dmoney1568,Sun Apr 05 21:30:02 IST 2015,pen horribl i huge fan i call like i see horribl
Dmoney1568,Sun Apr 05 21:21:19 IST 2015,happi easter famili dan
Dmoney1568,Sun Apr 05 21:18:48 IST 2015,happi easter famili
Dmoney1568,Sun Apr 05 18:31:37 IST 2015,happi easter everyon god bless famili
Dmoney1568,Sun Apr 05 09:42:04 IST 2015,i blame ref hit woodbin super high five total bs
Dmoney1568,Sun Apr 05 09:36:24 IST 2015,on monday fast forward saturday back derbi lol
Dmoney1568,Sun Apr 05 09:26:59 IST 2015,both mine gone far over hurt prospect park got desormeaux ed best luck
Dmoney1568,Sun Apr 05 09:21:36 IST 2015,great idea do know expect runner arkansa derbi usual puls
Dmoney1568,Sun Apr 05 08:49:34 IST 2015,number
Dmoney1568,Sun Apr 05 08:48:39 IST 2015,super high five number
Dmoney1568,Sun Apr 05 08:43:54 IST 2015,congrat scott
Dmoney1568,Sun Apr 05 08:34:22 IST 2015,total fuck joke game went great game bs
Dmoney1568,Sun Apr 05 08:33:55 IST 2015,flop flop flop
Dmoney1568,Sun Apr 05 08:32:06 IST 2015,payback right
Dmoney1568,Sun Apr 05 08:29:36 IST 2015,when joshua my boy light tote board we bring super high five
Dmoney1568,Sun Apr 05 08:04:53 IST 2015,insid insid go insid they stop
Dmoney1568,Sun Apr 05 07:51:46 IST 2015,everi bounc everi call go wisconsin can lose happen
Dmoney1568,Sun Apr 05 07:26:10 IST 2015,well minut settl noth nail biter enjoy watch know i lose lol
Dmoney1568,Sun Apr 05 06:28:11 IST 2015,congrat win today best luck
Dmoney1568,Sun Apr 05 05:08:20 IST 2015,i agre it great day time race track perfect
Dmoney1568,Sun Apr 05 04:20:20 IST 2015,how freak bad desormeaux hors field get hors check twice dive rail moron
Dmoney1568,Sun Apr 05 03:16:28 IST 2015,best
Dmoney1568,Sun Apr 05 02:43:50 IST 2015,the guy first derbi war push right button
Dmoney1568,Sun Apr 05 02:42:22 IST 2015,wow tough
Dmoney1568,Sun Apr 05 02:40:58 IST 2015,i finish march ran big lord nelson wow hors monster
Dmoney1568,Sun Apr 05 02:39:46 IST 2015,thank
Dmoney1568,Sun Apr 05 02:38:58 IST 2015,bs
Dmoney1568,Sun Apr 05 02:38:45 IST 2015,sorri i shitti day hope pick
Dmoney1568,Sun Apr 05 02:36:35 IST 2015,race ride i win derbi war the huddi pool win place pick
Dmoney1568,Sun Apr 05 02:35:20 IST 2015,thank i watch ever sinc mention month ago
