username,time,tweet
toni_bradbury23,Mon May 18 09:37:14 IST 2015,well sleep schedul screw just anoth great fact life
toni_bradbury23,Mon May 18 09:09:34 IST 2015,rt wait longer get hand tell us think pass song
toni_bradbury23,Mon May 18 04:22:18 IST 2015,rt rememb
toni_bradbury23,Mon May 18 03:40:44 IST 2015,so excit
toni_bradbury23,Mon May 18 03:39:38 IST 2015,i woke im alreadi readi go bed night why exhaust
toni_bradbury23,Mon May 18 01:46:47 IST 2015,rt relationship
toni_bradbury23,Sun May 17 05:20:02 IST 2015,ugh post cri headach taken right
toni_bradbury23,Sun May 17 04:31:15 IST 2015,now watch netflix
toni_bradbury23,Sun May 17 04:30:54 IST 2015,serious cri end being human you guy awesom will miss
toni_bradbury23,Sun May 17 01:31:37 IST 2015,im get close finish i ok
toni_bradbury23,Thu May 14 01:58:04 IST 2015,it would cool achiev could unlock app show true loneli dedic
toni_bradbury23,Sun May 10 12:38:24 IST 2015,rt hi i toni i cri cute anim
toni_bradbury23,Sun May 10 12:38:20 IST 2015,hi im daniell im turd bucket
toni_bradbury23,Sat May 09 08:38:58 IST 2015,rt green pepper world comedi vine
toni_bradbury23,Fri May 08 13:16:30 IST 2015,i realli need go sleep think im gonna start day around i see coffe futur
toni_bradbury23,Thu May 07 17:33:54 IST 2015,rt hakuna tata
toni_bradbury23,Wed May 06 05:37:00 IST 2015,just funer home bring back emot
toni_bradbury23,Fri May 01 01:24:37 IST 2015,rt death alway mean goodby thank watch supernatur
toni_bradbury23,Sat Apr 25 07:02:35 IST 2015,go follow do
toni_bradbury23,Sat Apr 25 06:54:18 IST 2015,
toni_bradbury23,Wed Apr 22 23:29:03 IST 2015,the day leg day whathurtsthemost
toni_bradbury23,Wed Apr 22 03:05:49 IST 2015,dear futur husband pleas readi play hair constant no compromis
toni_bradbury23,Tue Apr 21 21:44:15 IST 2015,the amount work must today realli stress
toni_bradbury23,Thu Apr 16 05:27:59 IST 2015,kinda wanna throw phone river see problem go away
toni_bradbury23,Mon Apr 13 10:07:44 IST 2015,enjoy spend qualiti time weekend
toni_bradbury23,Thu Apr 09 03:01:20 IST 2015,i feel weak rn
toni_bradbury23,Wed Apr 08 18:32:31 IST 2015,rt u ever bring ur pet mirror ur like
toni_bradbury23,Thu Apr 02 01:37:44 IST 2015,feel pretti right
toni_bradbury23,Mon Mar 30 04:11:25 IST 2015,hi
toni_bradbury23,Wed Mar 25 02:58:08 IST 2015,ah here random one if could anim would
toni_bradbury23,Thu Mar 19 05:29:18 IST 2015,the movi taken still scare shit
toni_bradbury23,Thu Mar 19 01:10:52 IST 2015,final get oil chang its month sinc light came
toni_bradbury23,Tue Mar 17 18:00:30 IST 2015,oh quick thank random number wakeup call
toni_bradbury23,Tue Mar 17 05:33:50 IST 2015,this weather make happiest person right i feel good life
toni_bradbury23,Sat Mar 14 19:01:33 IST 2015,dear self you you flip
toni_bradbury23,Sun Mar 08 19:08:45 IST 2015,open slit face start day you much time make slit look right twenti one pilot
toni_bradbury23,Sun Mar 08 19:00:11 IST 2015,well least i minuet earli work
toni_bradbury23,Sun Mar 08 17:38:01 IST 2015,why still even use day light save time why
toni_bradbury23,Sun Mar 08 17:12:22 IST 2015,today feel ughhhhhhhhhhhhhhhh
toni_bradbury23,Sun Mar 08 01:42:07 IST 2015,my anxieti level rise come closer work time
toni_bradbury23,Fri Mar 06 00:36:21 IST 2015,the movi punctur top favorit mine hand
toni_bradbury23,Fri Feb 27 00:05:42 IST 2015,what funniest weirdest thing ever happen
toni_bradbury23,Thu Feb 26 11:03:25 IST 2015,are ever tire scream profan ur pillow because
toni_bradbury23,Wed Feb 25 19:49:42 IST 2015,it would take day bing watch includ commerci and let say day would quit worth supernaturai
toni_bradbury23,Wed Feb 25 07:56:14 IST 2015,my brain constant worri futur it never goe away
toni_bradbury23,Tue Feb 24 11:18:28 IST 2015,honest i lot happi time last year and i even happi
toni_bradbury23,Sat Feb 21 10:19:23 IST 2015,where find perfect
toni_bradbury23,Fri Feb 20 08:13:09 IST 2015,well i got job
toni_bradbury23,Wed Feb 18 02:46:20 IST 2015,rt my grade bad someon urg drop school everi minut
toni_bradbury23,Mon Feb 16 11:59:28 IST 2015,well all feel past month sunken now deal question
