username,time,tweet
kellykimono,Tue Jan 05 11:05:55 IST 2016,how dare want someon cousin ugh insan truelif
kellykimono,Tue Jan 05 11:04:40 IST 2016,if close eye listen chick sound like jennell teen mom truelif
kellykimono,Tue Jan 05 11:02:40 IST 2016,rt um oh yeah mtv lol truelif
kellykimono,Tue Jan 05 11:02:11 IST 2016,rt she googl see anyth bibl incest sure leviticus came truelif
kellykimono,Tue Jan 05 11:01:54 IST 2016,rt recap truelif i had my cousin babi besttruelifeepisodeev
kellykimono,Tue Jan 05 11:01:03 IST 2016,this truelif make want take shower
kellykimono,Tue Jan 05 10:13:02 IST 2016,oh nake peopl but mommi done porno teenmomog
kellykimono,Tue Jan 05 10:12:21 IST 2016,leah sound so rehears don worri karma b
kellykimono,Tue Jan 05 10:11:13 IST 2016,yeah leah sound rehears
kellykimono,Tue Jan 05 10:10:49 IST 2016,rt i feel like gari influenc everyth leah said teenmomog
kellykimono,Tue Jan 05 10:10:40 IST 2016,rt i rather jump pool lemon juic paper cut ever room farrah
kellykimono,Tue Jan 05 10:10:33 IST 2016,rt rememb farrah even get ford focus hand lost tooth teenmomog
kellykimono,Tue Jan 05 08:29:55 IST 2016,i need trainwreck back teenmomog
kellykimono,Tue Jan 05 07:19:29 IST 2016,amber manfriend weird teenmomog
kellykimono,Tue Jan 05 06:55:47 IST 2016,ugh i want chicken thebachelor
kellykimono,Tue Jan 05 06:54:03 IST 2016,these twin dumbest pair tit i ever seen thebachelor
kellykimono,Tue Jan 05 06:29:48 IST 2016,rt t minus minut thebachelor start
kellykimono,Tue Jan 05 06:29:24 IST 2016,i free think woman decid watch thebachelor first time tonight pray i lose mani brain cell
kellykimono,Tue Jan 05 06:28:09 IST 2016,rt for right reason thebachelor cakepop
kellykimono,Tue Jan 05 06:27:39 IST 2016,i think i actual go watch discuss popcast haha let give shot
kellykimono,Sun Jan 03 05:22:50 IST 2016,being singl go month bad
kellykimono,Sun Jan 03 05:22:02 IST 2016,hope everyon excel christma new year bestwish latepost
kellykimono,Sun Dec 13 23:58:23 IST 2015,the famili stone i get opinion rachel mcadam head lol
kellykimono,Sun Dec 13 05:04:31 IST 2015,in go take nap yeah sound right
kellykimono,Mon Dec 07 09:35:53 IST 2015,mark let her talk you psycho window nazi
kellykimono,Mon Dec 07 09:32:12 IST 2015,nope mark tri answer
kellykimono,Mon Dec 07 08:51:13 IST 2015,what american dream there bare dollar menu anymor
kellykimono,Mon Dec 07 08:46:23 IST 2015,rt do let your child bride touch your window ya think
kellykimono,Mon Dec 07 08:42:22 IST 2015,fernando still look like sack potato
kellykimono,Mon Dec 07 08:40:23 IST 2015,nikki look absolut miser
kellykimono,Mon Dec 07 08:39:41 IST 2015,this damn widow let go mark
kellykimono,Mon Dec 07 08:38:14 IST 2015,melani rememb physic attract devar so like objectifi
kellykimono,Mon Dec 07 08:37:01 IST 2015,hahaha welcom
kellykimono,Mon Dec 07 08:31:22 IST 2015,nikki promis alway go never touch window car
kellykimono,Mon Dec 07 08:27:13 IST 2015,rt fernando look like mr potato head
kellykimono,Mon Dec 07 08:25:58 IST 2015,i hope like biggest trick mark dump at the wed ugh
kellykimono,Mon Dec 07 08:25:17 IST 2015,this pretti somber music
kellykimono,Mon Dec 07 08:24:40 IST 2015,nikki dont marri him your entir life is in front of you
kellykimono,Mon Dec 07 08:12:57 IST 2015,loren virgin act excit
kellykimono,Mon Dec 07 08:10:10 IST 2015,the nerv set loren or bipolar med
kellykimono,Mon Dec 07 08:09:18 IST 2015,no one want deal ursula
kellykimono,Mon Dec 07 08:07:57 IST 2015,i love hunter optimist work
kellykimono,Mon Dec 07 08:07:25 IST 2015,rt i feel like start gofundm campaign save nikki mark
kellykimono,Mon Dec 07 08:06:09 IST 2015,i hate take turn read vow
kellykimono,Mon Dec 07 07:56:28 IST 2015,why would want babi grandpa
kellykimono,Mon Dec 07 07:55:01 IST 2015,mark cheap entir season sign prenup coincid think
kellykimono,Mon Dec 07 07:40:19 IST 2015,i chug beer i marri loren
kellykimono,Mon Dec 07 07:39:23 IST 2015,loren everyon cri demand
kellykimono,Mon Dec 07 07:39:02 IST 2015,and cri break get back togeth
kellykimono,Mon Dec 07 07:36:53 IST 2015,serious i give alexei loren good one year
