username,time,tweet
Zen_Shot,Wed Feb 24 17:51:58 IST 2016,microsoft develop milo bundl killer app get peter molynuex demo
Zen_Shot,Wed Feb 24 16:18:47 IST 2016,its offici clarkson racist drop bigot like hot rock immedi
Zen_Shot,Wed Feb 24 16:12:36 IST 2016,lol
Zen_Shot,Wed Feb 24 04:03:53 IST 2016,so like soni puls headset i way back ok
Zen_Shot,Mon Feb 22 23:14:55 IST 2016,rt happi birthday one special
Zen_Shot,Mon Feb 22 23:09:15 IST 2016,griefer what player possibl within concept game
Zen_Shot,Mon Feb 22 00:04:38 IST 2016,its ok everyon i rich
Zen_Shot,Fri Feb 19 18:07:57 IST 2016,thank head just got mine only left
Zen_Shot,Thu Feb 18 21:45:08 IST 2016,return i never left still find new stuff see day play time
Zen_Shot,Mon Feb 15 19:52:03 IST 2016,when yar reveng becom avail
Zen_Shot,Mon Feb 15 04:41:18 IST 2016,have fix ent yet
Zen_Shot,Sat Feb 13 03:23:10 IST 2016,lag
Zen_Shot,Fri Feb 12 16:30:22 IST 2016,i seem except rule i year old game veteran i gave em hell doom alpha
Zen_Shot,Wed Feb 10 22:41:15 IST 2016,rt you listen
Zen_Shot,Mon Feb 08 04:59:09 IST 2016,oh god
Zen_Shot,Sun Feb 07 22:23:41 IST 2016,in snapmap possibl link map exit anoth map order creat map pack episod
Zen_Shot,Sat Feb 06 06:11:14 IST 2016,nice know collector edit alreadi bag courtesi alway help friend staff
Zen_Shot,Fri Feb 05 02:08:45 IST 2016,serious pull leg
Zen_Shot,Fri Feb 05 01:57:27 IST 2016,dooooommaarghhhn cough cough
Zen_Shot,Wed Feb 03 22:56:48 IST 2016,arrroooooogah
Zen_Shot,Wed Feb 03 22:52:40 IST 2016,realli loud butt
Zen_Shot,Mon Feb 01 22:59:41 IST 2016,doom
Zen_Shot,Sat Jan 30 18:00:31 IST 2016,rt b b b bonus buy any digit code chanc win bonus game reward point
Zen_Shot,Fri Jan 29 13:47:54 IST 2016,thanyou past effort how progress bad compani go
Zen_Shot,Thu Jan 28 22:03:19 IST 2016,link fail tri
Zen_Shot,Thu Jan 28 22:02:01 IST 2016,quit histori urban dictionari idspispopd
Zen_Shot,Thu Jan 28 20:56:27 IST 2016,i must give nod idspispopd lol
Zen_Shot,Thu Jan 28 20:52:36 IST 2016,iddqd
Zen_Shot,Thu Jan 28 20:52:02 IST 2016,doooooooooooooooommarrrgh cough cough
Zen_Shot,Wed Jan 27 22:45:34 IST 2016,woah burton taylor
Zen_Shot,Wed Jan 27 22:43:22 IST 2016,bleeeuurgh vomit
Zen_Shot,Mon Jan 25 23:13:18 IST 2016,thank use offer i land gearsofwar judgement xboxon compatabl i come
Zen_Shot,Mon Jan 25 04:20:46 IST 2016,yar reveng there yar reveng
Zen_Shot,Sat Jan 23 22:34:17 IST 2016,pizzahut email late deliveri sorri got wrong hour later pizzahut email how
Zen_Shot,Thu Jan 21 22:41:28 IST 2016,free uk nope
Zen_Shot,Wed Jan 20 23:01:07 IST 2016,half life confirm
Zen_Shot,Tue Jan 19 23:05:42 IST 2016,rt sell data artifici cap amount data allow charg peopl get around cap creat
Zen_Shot,Mon Jan 18 22:57:23 IST 2016,rt take short survey us could win game choic uk
Zen_Shot,Mon Jan 18 22:52:28 IST 2016,geif code plx
Zen_Shot,Mon Jan 18 22:50:39 IST 2016,why debat its record preach hatr ban automat
Zen_Shot,Mon Jan 18 00:58:40 IST 2016,rt jan sale save get exclus cover free gift subscrib pc gamer magazin print
Zen_Shot,Sat Jan 16 07:11:24 IST 2016,rt omikron the nomad soul free next week memori david bowi
Zen_Shot,Sat Jan 16 07:10:54 IST 2016,rt the tie fighter best sound ship time rt agre
Zen_Shot,Sat Jan 16 07:06:56 IST 2016,rt it year sinc i made doom level here version use wad
Zen_Shot,Sat Jan 16 00:01:45 IST 2016,rt just announc pokkén tournament come wiiu march battl it out
Zen_Shot,Fri Jan 15 17:54:03 IST 2016,thank head new pre own whatsthatallabout
Zen_Shot,Thu Jan 14 22:45:47 IST 2016,distinct lack chines inuit nativ american irish liverpudlian oompa loompa elvish actor nomin
Zen_Shot,Thu Jan 14 21:00:20 IST 2016,i never buy game profit ad rrp
Zen_Shot,Wed Jan 13 01:02:42 IST 2016,xboxon close call
