username,time,tweet
the5thColumnist,Tue Feb 23 00:27:54 IST 2016,and i thought goal make money i guess i erong
the5thColumnist,Mon Feb 22 22:25:19 IST 2016,you tell new democrat orang nose
the5thColumnist,Mon Feb 22 07:31:02 IST 2016,so forest south equat call jungl
the5thColumnist,Mon Feb 22 00:37:51 IST 2016,one week go till final find skinnybas cabletv actual work hope
the5thColumnist,Mon Feb 22 00:25:22 IST 2016,if govt serv us well answer get rid turn power wealthi peopl corp but chang elect govt
the5thColumnist,Mon Feb 22 00:18:21 IST 2016,bitcoin pretend money creat comput game
the5thColumnist,Sun Feb 21 05:20:39 IST 2016,if want planet upon burn fossil fuel must leav tarsand ground thischangeseveryth
the5thColumnist,Sun Feb 21 05:19:10 IST 2016,the valuabl resourc earth feed us topsoil overburden oil gas industri thischangeseveryth
the5thColumnist,Sun Feb 21 04:25:22 IST 2016,fuck stupid websit overlay block i want read go hell frustrat
the5thColumnist,Sun Feb 21 01:54:23 IST 2016,rt i move canada common refrain us elect actual follow
the5thColumnist,Sat Feb 20 22:28:18 IST 2016,appl one thing right donal trump think reason boycott
the5thColumnist,Sat Feb 20 09:14:35 IST 2016,why cbc news network charg stream alreadi pay tax
the5thColumnist,Sat Feb 20 08:55:53 IST 2016,if ever choos environ economi keep mind cannot surviv without environ
the5thColumnist,Sat Feb 20 05:34:48 IST 2016,hero return fight death alway bear cane vike ragnar jack
the5thColumnist,Sat Feb 20 04:32:18 IST 2016,donald trump patriot promot korean firm american one
the5thColumnist,Fri Feb 19 21:06:58 IST 2016,when parent taught us share expect us make money call sharingeconomi oldenday
the5thColumnist,Fri Feb 19 20:59:01 IST 2016,how long till dictionari chang mean share provid servic exchang payment call sharingeconomi
the5thColumnist,Fri Feb 19 19:08:49 IST 2016,the key auto diagnost speak car nois languag mechan
the5thColumnist,Fri Feb 19 08:30:54 IST 2016,bizarr
the5thColumnist,Fri Feb 19 02:35:12 IST 2016,well make social invest somebodi least make profit
the5thColumnist,Fri Feb 19 01:00:08 IST 2016,like fool i check roger websit daili know detail till march hope
the5thColumnist,Thu Feb 18 08:47:48 IST 2016,the ultim victim blame sue victim
the5thColumnist,Thu Feb 18 07:24:17 IST 2016,i thought develop charg infrastructur ongo annual cost
the5thColumnist,Thu Feb 18 02:57:28 IST 2016,rt isi islam we must expos utter lack religi basi atroc cdnpoli
the5thColumnist,Wed Feb 17 22:32:46 IST 2016,so fact francophon learn english make bilingu discrimin unilingu anglophon
the5thColumnist,Wed Feb 17 22:26:32 IST 2016,look like go wait till last minut tell us squeez extra month us
the5thColumnist,Wed Feb 17 22:22:12 IST 2016,learn earn money replac learn knowledg enlighten signal downfal civil educ
the5thColumnist,Wed Feb 17 21:16:12 IST 2016,motherhood statement everi budget includ
the5thColumnist,Wed Feb 17 10:07:08 IST 2016,why move car automat prioriti move peopl prtioriti
the5thColumnist,Wed Feb 17 06:53:53 IST 2016,the world screw measur countri success well wealthiest measur poorest
the5thColumnist,Tue Feb 16 23:58:23 IST 2016,today snowblow day twice far plough
the5thColumnist,Tue Feb 16 02:21:42 IST 2016,rt louisrielday time rememb fearless métis leader continu fight discrimin inequ
the5thColumnist,Mon Feb 15 21:15:54 IST 2016,one worst crash pathway gatineaus go downhil hit someth oili path bad case road rash
the5thColumnist,Mon Feb 15 21:13:34 IST 2016,alway wear helmet never know might even someth dumb without think mtber feel weird without
the5thColumnist,Mon Feb 15 08:00:32 IST 2016,final book bike barg tour netherland summer amsterdam stop copenhagen way home take helmet
the5thColumnist,Mon Feb 15 05:57:24 IST 2016,rt love we heal human natur spend time mother natur
the5thColumnist,Mon Feb 15 02:54:03 IST 2016,two week till skinni basic cabl still detail avail
the5thColumnist,Sun Feb 14 20:07:52 IST 2016,the scienc pirat bay
the5thColumnist,Sun Feb 14 04:22:21 IST 2016,more winterlud cancel due winter ironi
the5thColumnist,Sun Feb 14 03:07:58 IST 2016,winterlud cancel due winter ironi
the5thColumnist,Sat Feb 13 21:28:18 IST 2016,all need know oil price when go bad when go bad oilpric
