username,time,tweet
Stephie__Green,Tue Jun 23 04:14:55 IST 2015, bizarre non  autoderision jaime de moins en moins les soldes nobuy
Stephie__Green,Tue Jun 23 04:13:21 IST 2015, ça cest cool ☺ avec le temps je me rend compte que je préfère que mon argent reste sur mon compte que celui de multinationales
Stephie__Green,Tue Jun 23 01:28:43 IST 2015, ha les soldes comment donner lillusion de faire des économies tout en dépensantjadore lidéelol
Stephie__Green,Fri Jun 19 22:18:29 IST 2015,rt  green aime le maquillage minéral naturel    shop   
Stephie__Green,Wed Jun 17 17:40:26 IST 2015,rt  découvrez la revue complète sur les produits  de green ici  beautebio maquillag…
Stephie__Green,Fri Jun 12 21:16:11 IST 2015,fr il faut absolument organiser un évènement à montpellier ça me ferait plaisir de rencontrer léquipe
Stephie__Green,Fri Jun 12 01:26:31 IST 2015,rt  en ce moment à montpellier jusquà dimanche le fav34  festival des architectures vives 
Stephie__Green,Thu Jun 11 18:07:39 IST 2015,nouvel article  et  je vous dis tout sur la marque  mineral maquillage blog stephiegreen
Stephie__Green,Wed Jun 10 04:31:55 IST 2015, participation fait et jespère être tirée au sort ☺ vernis jeu
Stephie__Green,Wed Jun 10 04:30:22 IST 2015,merci  jai été tiré au sort et jai gagné un gel douche hâte de le recevoir merci stephiegreen blog concours
Stephie__Green,Mon Jun 08 22:05:50 IST 2015, je vais rester connectée 😻 surtout que jadore lunivers weleda blogstephiegreen
Stephie__Green,Mon Jun 08 15:18:04 IST 2015, je viens de voir que le weledabiotytour vient à montpellier cet automne jai hâte que les inscriptions commencent😍belle journée
Stephie__Green,Mon Jun 08 14:49:40 IST 2015, cest pas mal 2200 mots lautre jour cest ce que je me suis dit quand mon article a atteint 2500 mots assommoir
Stephie__Green,Thu Jun 04 17:06:16 IST 2015,a lire mon article sur les huiles végétales  
Stephie__Green,Sun May 31 18:16:21 IST 2015, et oui on dirait pas hein cest grâce aux produits bio que jutilise😇
Stephie__Green,Sat May 30 05:03:55 IST 2015, punaise ça me rappelle des souvenirs ça😊
Stephie__Green,Wed May 27 17:17:14 IST 2015,article à lire absolument  fr
Stephie__Green,Wed May 27 03:25:18 IST 2015,rt fr connaissez-vous le secret de jenniferaniston pour avoir un si joli teint     http…
Stephie__Green,Tue May 26 15:08:08 IST 2015,mes chouchous fr  cest ici  
Stephie__Green,Tue May 26 15:05:07 IST 2015,nouvel article mes produits terminés sur  ren pai grownalchemist
Stephie__Green,Mon May 25 19:04:56 IST 2015,en ce moment  vous fait gagner ses 10 produits favoris  
Stephie__Green,Wed May 20 04:49:26 IST 2015,rt  halte au massacre des abeilles  signez la pétition de la  
Stephie__Green,Wed May 20 04:49:10 IST 2015,mon article fr est en ligne vous voulez en savoir plus  drhauschka blog beauty
Stephie__Green,Tue May 19 02:45:06 IST 2015,rt  le pays européen le plus adapté au vélo urbain en europe  le danemark  via  htt…
Stephie__Green,Tue May 19 02:43:00 IST 2015,rt fr usa  42 des abeilles domestiques sont mortes en un an     
Stephie__Green,Tue May 19 02:42:36 IST 2015,rt  vous êtes déjà de 35000 à dire halte au massacre des abeilles allons jusquà 100 000  
Stephie__Green,Tue May 19 02:42:28 IST 2015,rt  dans certaines régions 3 colonies d’abeilles sur 4 disparaissent chaque année  a vos votes  htt…
Stephie__Green,Tue May 19 02:41:39 IST 2015,rt  montre nous quelque chose de bleu de ton quotidien  je démarre ce challenge pendant 5 jours merci green … ht…
Stephie__Green,Sun May 17 03:36:43 IST 2015,rt paris vous aussi relevez le défi avec nous    
Stephie__Green,Fri May 15 22:45:06 IST 2015,rt  en ce moment huellas  à montpellier 
Stephie__Green,Fri May 15 02:23:31 IST 2015,rt  j-200 avant la cop21  rt si vous souhaitez voir nos décideurs mondiaux inverser le dérèglement climatique 
Stephie__Green,Thu May 14 19:32:39 IST 2015,nouvel article sur le blog layering beaute blog fr 
Stephie__Green,Mon May 11 04:32:00 IST 2015,rt  le contour des yeux  sur doux good  soyeux à lextrème 
Stephie__Green,Sat May 09 00:20:45 IST 2015,mes chouchous du mois cest par ici  pensez à vous inscrire à la newsletter blog drhauschka 
Stephie__Green,Thu May 07 19:29:50 IST 2015,rt  top shot shelter from the storm  
Stephie__Green,Thu May 07 19:29:29 IST 2015,rt fr découvrez les vertus de la pomme rosedeberne   sérumtonifiantnuit soindenuit nightcare http/…
Stephie__Green,Wed May 06 02:16:55 IST 2015,rt  natgeo traveler photo contest check the galleries eye candy enter im judging  photo htt…
Stephie__Green,Sun May 03 04:23:00 IST 2015,rt  🍞🍰🍪 
Stephie__Green,Sun May 03 00:56:40 IST 2015,le blog  est en ligne le blog de la beauté au naturel organics green bigday blog
Stephie__Green,Sat May 02 05:40:29 IST 2015,rt  récap trop cute de monagrom sur le baume premier et autres richesses acp merci morgane 3 
Stephie__Green,Sat May 02 05:40:13 IST 2015,rt  maquillage bio avec dr hauschka ilia lily lolo  
Stephie__Green,Fri May 01 18:10:59 IST 2015,rt  votre zone de confort vous empêche-t-elle datteindre vos rêves  cette vidéo vous y   via …
Stephie__Green,Fri May 01 18:08:44 IST 2015,rt  nouveau  un kit dessai pour découvrir oolution 100 remboursé dès votre première commande   http//…
Stephie__Green,Wed Apr 29 21:53:05 IST 2015,un nettoyant du matin pas du tout chagrintataharper  skincare peau rituel beauty doux soft clean 
Stephie__Green,Sun Apr 26 02:49:17 IST 2015,soin des yeux pour une regard frais et hydraté fr soindesyeux eyecare 
Stephie__Green,Fri Apr 24 01:21:44 IST 2015,trop contente davoir reçu la greenchic hâte de tester     fr greenbeauty green 
Stephie__Green,Thu Apr 23 17:17:59 IST 2015,rt  [mots doux]et si on ne gardait que lessentiel que ce qui est positifquen pensez-vous  
Stephie__Green,Thu Apr 23 17:17:50 IST 2015,rt  lancement du rapport  raviver léconomie des océans rt pour faire passer le mot  océan 
Stephie__Green,Thu Apr 23 04:09:59 IST 2015,rt  palette flower power offerte dès 45€ dachat en maquillage  sur  maquillage bio promotions 
Stephie__Green,Thu Apr 23 04:09:08 IST 2015,rt  jaws 
