username,time,tweet
kennyn316,Fri May 15 08:25:55 IST 2015,tweet needygreedi help back crime station podcast peopl selfless a key world tryit
kennyn316,Fri May 15 07:53:45 IST 2015,readcar volunt basi i promot thing peopl twat it freeli free wrong prome my dm thank
kennyn316,Fri May 15 07:02:24 IST 2015,frikkin canadian channel dontseedudley
kennyn316,Fri May 15 01:58:50 IST 2015,rt clown left joker right
kennyn316,Thu May 14 07:38:05 IST 2015,serious proveit canadasid need read believ myhooesneverhappen kitkat
kennyn316,Thu May 14 07:24:26 IST 2015,amaz match payback smackdown statement made
kennyn316,Thu May 14 07:17:00 IST 2015,rememb sinc u fan beingocd a ok coach becauseitsthecup atweetback repli misspunkinr cannot wait octagon
kennyn316,Thu May 14 06:56:43 IST 2015,if boy next ladychampion bigbump lookingawesom ur twin lol teamyoualway
kennyn316,Thu May 14 06:45:01 IST 2015,congrat firemetweet
kennyn316,Thu May 14 06:37:06 IST 2015,segment shoulda said on cambi
kennyn316,Wed May 13 07:23:03 IST 2015,think coach call habsvslightn becauseitsthecup bestintheworld
kennyn316,Wed May 13 07:02:23 IST 2015,turn channel ur tweet holyshit amaz game batman you batman sound good lol
kennyn316,Wed May 13 06:50:48 IST 2015,rt just wake manila open workout later today meanwhil look bring heat love http
kennyn316,Tue May 12 08:20:00 IST 2015,care officiallyfam best witch follow you
kennyn316,Tue May 12 08:14:15 IST 2015,rt thankyoudaniel raw
kennyn316,Mon May 11 21:09:11 IST 2015,rt book club deepest circl hell watch familyguy netflix
kennyn316,Sun May 10 23:08:26 IST 2015,rt everyon gangster gangster walk room chael sonnen
kennyn316,Sun May 10 23:08:06 IST 2015,everyon you good piec shit hulk hogan lover bloodredturnsdollargreen
kennyn316,Sun May 10 17:07:55 IST 2015,backup ur femal version truthtalk
kennyn316,Sun May 10 09:33:16 IST 2015,
kennyn316,Sun May 10 09:18:16 IST 2015,cheapo appleitunesdrama serious watch ur tweet dude
kennyn316,Sun May 10 08:49:59 IST 2015,believ sinc day like forget monstergirl
kennyn316,Sun May 10 08:14:57 IST 2015,hooker alway win dollarsign
kennyn316,Sun May 10 08:13:54 IST 2015,becom channel makesaloteasi miss fight wtf
kennyn316,Sun May 10 07:53:54 IST 2015,hatersgonnah letthemtweet whoooooooo whooooooooooo ufcadelaid
kennyn316,Sat May 09 23:36:35 IST 2015,rt
kennyn316,Sat May 09 22:59:26 IST 2015,hellsno per normal twitter shiiiiat hatersgonnah
kennyn316,Sat May 09 22:27:12 IST 2015,tweet back punk
kennyn316,Sat May 09 08:01:56 IST 2015,fudg ur shirt say couldntread beckstar right truth
kennyn316,Sat May 09 07:47:49 IST 2015,rt widow owen hart releas statement rumor upcom wwe dvd
kennyn316,Sat May 09 07:43:42 IST 2015,u right sir sure bro happi nyrvswsh capsfan tweet condol becauseitsthecup
kennyn316,Sat May 09 07:38:04 IST 2015,vancouv rowdi need pic ladi got bruceleehoodi bday
kennyn316,Sat May 09 07:34:35 IST 2015,rt joerogan ufc reebok deal i echo sentiment
kennyn316,Sat May 09 05:56:20 IST 2015,rt watch tina fey show bye dave underwear lateshow
kennyn316,Fri May 08 22:37:52 IST 2015,beenawhil blackfish bulletproofcoffe cultureshock innercircl ufcadelaid specialcorrespond wherethesungo nothingtoreport
kennyn316,Fri May 08 22:36:42 IST 2015,rt hey pls rt follow hear jayden martin podcast week
kennyn316,Fri May 08 22:22:53 IST 2015,rt a custom point bullet hole wall right behind i stand read more
kennyn316,Fri May 08 22:07:25 IST 2015,rt florida man tri cash check billion full stori
kennyn316,Fri May 08 09:28:45 IST 2015,love see unecessari youcantsaythat bleepsnblur
kennyn316,Fri May 08 09:12:52 IST 2015,seen thought without watch stop duck scrapsarah ya dodger canada scaredhomey
kennyn316,Fri May 08 09:10:25 IST 2015,good was tire reebook talk anyway noaintcomingback schedul fail
kennyn316,Fri May 08 08:40:01 IST 2015,hey coach broom emoji teamcm beprepar new breed awesom right teampunk
kennyn316,Fri May 08 07:14:11 IST 2015,rt god bless the owen hart forev i miss him
kennyn316,Fri May 08 07:09:47 IST 2015,rt bullshit
kennyn316,Thu May 07 20:36:52 IST 2015,rt mayweath gonna mad someon final read
kennyn316,Thu May 07 09:14:26 IST 2015,dopplegang
kennyn316,Thu May 07 00:44:45 IST 2015,rt happi mchappi day scott creation the mcscotti egg bacon sausag chees and yes it
kennyn316,Thu May 07 00:44:08 IST 2015,rt you want tea nah i good
kennyn316,Wed May 06 07:22:41 IST 2015,rt the best ever wear gear compani claim brethart rootsoffight
kennyn316,Tue May 05 07:06:42 IST 2015,kick ass maythefourthbewithyou
