username,time,tweet
tiredoflaundry,Mon Jun 15 23:38:26 IST 2015,who play racheldolez lifetim movi transraci transraciallivesmatt
tiredoflaundry,Mon Jun 15 23:20:43 IST 2015,it monday
tiredoflaundry,Mon Jun 15 21:23:16 IST 2015,rt need black no need shun naacp wakeupamerica
tiredoflaundry,Mon Jun 15 00:38:43 IST 2015,rt it realli skin color it left right
tiredoflaundry,Sun Jun 14 23:23:11 IST 2015,long may wave flagday
tiredoflaundry,Sun Jun 14 04:57:02 IST 2015,someon give wedgi
tiredoflaundry,Sun Jun 14 03:24:43 IST 2015,that tweet win internet ohmysid
tiredoflaundry,Sun Jun 14 03:23:44 IST 2015,rt we are tampa tblightn becauseitsthecup
tiredoflaundry,Sun Jun 14 03:23:07 IST 2015,so hillari want identifi roosevelt i see husband cheat wive lesbian hillari tcot
tiredoflaundry,Sun Jun 14 02:55:00 IST 2015,sinc i grew eni bklyn age i claim i transraci
tiredoflaundry,Sun Jun 14 02:51:58 IST 2015,rt the biggest sport event tampa bay sinc in event weight tonight via
tiredoflaundry,Sun Jun 14 02:50:52 IST 2015,hillari fear you keep marco
tiredoflaundry,Sun Jun 14 02:49:22 IST 2015,rt chang has come chang ethnic chang gender chang math chang neighborhood chang
tiredoflaundry,Sun Jun 14 00:44:09 IST 2015,i democrat respons thank hagd
tiredoflaundry,Sun Jun 14 00:42:51 IST 2015,holi snot
tiredoflaundry,Sun Jun 14 00:39:33 IST 2015,there rule vote they must follow if one follow rule one vote you suggest anarchi
tiredoflaundry,Sun Jun 14 00:33:36 IST 2015,
tiredoflaundry,Sun Jun 14 00:32:14 IST 2015,iow red herring use hillari
tiredoflaundry,Sun Jun 14 00:23:43 IST 2015,yet nys legislatur democrat
tiredoflaundry,Sun Jun 14 00:19:54 IST 2015,rt shot fire at polic philadelphia oh odd shooter black hope shot policelivesmatt
tiredoflaundry,Sun Jun 14 00:16:07 IST 2015,but could done someth right
tiredoflaundry,Sun Jun 14 00:11:51 IST 2015,bitch rep deni peopl right vote yet nystat day weren senat
tiredoflaundry,Sat Jun 13 22:25:53 IST 2015,is elizabethwarren aka fauxcahonta also victim transrac makethemupastheygoalong tcot
tiredoflaundry,Sat Jun 13 22:23:28 IST 2015,thought thing aw white crowd
tiredoflaundry,Sat Jun 13 20:38:23 IST 2015,rt where progress led us
tiredoflaundry,Sat Jun 13 20:16:30 IST 2015,scari folk disappoint po kill dallaspdshoot
tiredoflaundry,Sat Jun 13 20:01:05 IST 2015,rt clukin
tiredoflaundry,Sat Jun 13 08:24:04 IST 2015,rt ffryday clucker
tiredoflaundry,Sat Jun 13 05:12:59 IST 2015,rt polic offic deserv respect gratitud outstand protect everi day pjnet tcot
tiredoflaundry,Sat Jun 13 04:46:13 IST 2015,good thing chang mind she w h b dead
tiredoflaundry,Sat Jun 13 02:51:16 IST 2015,upteenth time lightningstrik
tiredoflaundry,Sat Jun 13 01:33:41 IST 2015,i champagn tast beer pocketbook what tran
tiredoflaundry,Fri Jun 12 23:50:23 IST 2015,did pelosi realli vote no done procedur move trade tcot
tiredoflaundry,Fri Jun 12 22:22:42 IST 2015,
tiredoflaundry,Fri Jun 12 22:19:22 IST 2015,rt why emerg synthet drug flakka potenti dead first use
tiredoflaundry,Fri Jun 12 22:02:04 IST 2015,so heavi duti makeup tan bed racheldolez
tiredoflaundry,Fri Jun 12 21:45:50 IST 2015,i guess t creat brand new label peopl transraci icantkeepup democrat
tiredoflaundry,Fri Jun 12 07:28:10 IST 2015,rt pasco counti fl sheriff search nake arm carjack resid wa wfla news channel
tiredoflaundry,Fri Jun 12 00:04:30 IST 2015,rt have notic msm total uninterest concept first hispan presid cruz rubio
tiredoflaundry,Thu Jun 11 23:49:03 IST 2015,rip theamericandream dustyrhod wrestler
tiredoflaundry,Thu Jun 11 23:44:52 IST 2015,happi birthday
tiredoflaundry,Thu Jun 11 23:44:28 IST 2015,rt want take moment wish friend colleagu happybirthday
tiredoflaundry,Thu Jun 11 22:55:10 IST 2015,rip sir christopherle your hammer studio film forev rememb appreci
tiredoflaundry,Thu Jun 11 04:03:30 IST 2015,rain dampen spirit gobolt
tiredoflaundry,Thu Jun 11 03:15:34 IST 2015,rt left marco rubio hous right hillari clinton hous clear hillari identifi common man
tiredoflaundry,Thu Jun 11 02:25:28 IST 2015,true dat
tiredoflaundry,Thu Jun 11 02:20:38 IST 2015,bar better get extra stool readi
tiredoflaundry,Thu Jun 11 02:19:42 IST 2015,better orlando tampa flood
tiredoflaundry,Thu Jun 11 02:16:26 IST 2015,white hous obama hold cigarett yes
tiredoflaundry,Wed Jun 10 19:22:07 IST 2015,boom kevin jackson annihil profession protest video via derayspeak ohmysid
