username,time,tweet
VLThorpe,Thu May 28 18:24:21 IST 2015,everyon alreadi type everi move thought fb twitter use periscop
VLThorpe,Wed May 27 18:02:34 IST 2015,rais kid good moral educ know right wrong donthov
VLThorpe,Mon May 25 03:12:31 IST 2015,this memori day i rememb awesom week babi
VLThorpe,Sat May 23 07:56:22 IST 2015,pole danc split belt turn snake lollipop lick contest best show vega
VLThorpe,Wed May 20 03:43:13 IST 2015,rt yes soup nazi tonight the best episod ever
VLThorpe,Wed May 20 00:32:40 IST 2015,my thought madmenfinal i realli watch crappiest final ever i believ
VLThorpe,Mon May 18 03:30:19 IST 2015,rt eric do ever tell truth ari ari i tell part matter
VLThorpe,Tue May 12 07:28:49 IST 2015,rt video shit pat fan say the well report
VLThorpe,Tue May 12 07:24:31 IST 2015,rt tom bradi join bad boy club
VLThorpe,Sat May 09 06:25:43 IST 2015,grade due monday professor post sunday make sweat
VLThorpe,Thu Apr 30 17:51:58 IST 2015,ya need pancak maker just get crafti batter squeez bottl youtub case dismiss
VLThorpe,Thu Apr 30 08:33:50 IST 2015,app itun ya talk morn face someth
VLThorpe,Thu Apr 02 21:09:31 IST 2015,final tribe name i rememb pronounc spell merica
VLThorpe,Sun Mar 29 08:39:34 IST 2015,noth better watch intens uk game network play infam shot ky heart twist dagger
VLThorpe,Thu Mar 26 08:49:58 IST 2015,twin yokoono perrieedward
VLThorpe,Thu Mar 26 08:10:23 IST 2015,rt is zayn malik fiancé perri edward next yoko ono these direction throw major shade
VLThorpe,Thu Mar 26 00:24:54 IST 2015,now know real reason latest album call four famegottozayn
VLThorpe,Thu Mar 19 08:07:20 IST 2015,hey babi mother natur waitin love bloomin like cherri tree let buzz around mayb pollinatin dive like honey bee
VLThorpe,Tue Mar 17 09:05:42 IST 2015,i think christian laettner sport today all talk action istilllovelaettn ihateuk
VLThorpe,Fri Mar 13 01:20:59 IST 2015,are get cinderella tomorrow
VLThorpe,Thu Mar 12 19:11:14 IST 2015,do wear makeup join
VLThorpe,Wed Mar 11 17:55:58 IST 2015,has realli year alreadi thank we best memori day
VLThorpe,Wed Mar 11 01:34:47 IST 2015,i love see nofilt hashtag obvious see use app i sorri look flawless person
VLThorpe,Sun Mar 08 07:08:34 IST 2015,rt rt mango gonna locker room talk team like
VLThorpe,Sun Mar 08 07:01:51 IST 2015,boof nyah card uofl
VLThorpe,Sat Mar 07 19:27:55 IST 2015,pleas send momma see these snow day taken saniti adam give back
VLThorpe,Sat Mar 07 19:01:19 IST 2015,i woke stella sneez respons man allerg someth
VLThorpe,Fri Mar 06 00:03:42 IST 2015,
VLThorpe,Thu Mar 05 06:48:32 IST 2015,rt due inclement weather not school russel counti thursday march pleas travel necessari
VLThorpe,Wed Mar 04 18:58:22 IST 2015,sinc make trip ky predict us
VLThorpe,Tue Mar 03 02:28:02 IST 2015,i handl anoth big snow i need sunshin warmth
VLThorpe,Mon Mar 02 20:13:01 IST 2015,our live fulli live will die love believ mlkjr selma
VLThorpe,Sun Mar 01 19:18:38 IST 2015,that fine look high hors take back stabl
VLThorpe,Sat Feb 28 10:00:10 IST 2015,i know like houseofcard smart peopl sleep tight matthew
VLThorpe,Fri Feb 27 17:36:00 IST 2015,look
VLThorpe,Sun Feb 22 08:55:24 IST 2015,no greater feel lay head soft fresh clean sheet
VLThorpe,Fri Feb 20 19:23:58 IST 2015,year ago the us postal servic found
VLThorpe,Wed Feb 18 04:43:02 IST 2015,theater open tonight
VLThorpe,Tue Feb 17 08:35:43 IST 2015,either drunk retard go bed embarrass even
VLThorpe,Sat Feb 14 03:35:04 IST 2015,don expect anyth someon reduc risk get hurt
VLThorpe,Fri Feb 13 21:43:53 IST 2015,the tooth fairi paid littl visit stella last night liter i also think everi
VLThorpe,Thu Feb 12 17:57:07 IST 2015,year ago unit state presid abraham lincoln born
VLThorpe,Thu Feb 12 08:48:37 IST 2015,hour sayyyi whaaaat
VLThorpe,Thu Feb 12 04:12:49 IST 2015,rose red violet blue sunflow yellow noth romant garden fact
VLThorpe,Thu Feb 12 02:42:21 IST 2015,prayer strength hope justic kyle littlefield famili snipertri
VLThorpe,Tue Feb 10 23:24:24 IST 2015,i think i i think i i think i
VLThorpe,Tue Feb 10 21:16:00 IST 2015,darn fat pant big
VLThorpe,Tue Feb 10 19:52:55 IST 2015,i may may spent last min look pic laugh put asshol place get em girl
VLThorpe,Tue Feb 10 07:56:17 IST 2015,i proud say i never seen episod bachelor bachelorett i guess say i typic white girl
VLThorpe,Tue Feb 10 01:47:33 IST 2015,
