username,time,tweet
naveedamazari,Fri Mar 25 16:20:20 IST 2016,the best field team pakvsaus eunich ausvpak
naveedamazari,Fri Mar 25 16:19:41 IST 2016,malik co countri
naveedamazari,Fri Mar 25 05:21:43 IST 2016,rt dead mosqu nigeria suicid bomber this go mainstream media tweet show
naveedamazari,Fri Mar 25 04:28:03 IST 2016,rt charact treat noth greatremind
naveedamazari,Fri Mar 25 03:53:33 IST 2016,rt ripjohancruyff
naveedamazari,Fri Mar 25 03:30:23 IST 2016,rt agre turn last nail cofin cricket still beauti brought tullaybaz tukaybaz https
naveedamazari,Fri Mar 25 03:29:06 IST 2016,devolp skill requir modern day game still play
naveedamazari,Fri Mar 25 03:27:07 IST 2016,mani aerial shot player attempt repeat attempt play last over match ws thrown away
naveedamazari,Fri Mar 25 03:23:10 IST 2016,hope time make brave decis
naveedamazari,Fri Mar 25 03:17:41 IST 2016,noth happen cricket die accept
naveedamazari,Fri Mar 25 02:56:04 IST 2016,lol ye tou joke day ho gaya
naveedamazari,Fri Mar 25 02:55:06 IST 2016,rt for malik i say old habit die hard
naveedamazari,Fri Mar 25 02:53:07 IST 2016,remind dialogu hous card the road power pave hypocrisi causal
naveedamazari,Fri Mar 25 02:50:31 IST 2016,afridi like friend make worst enemi
naveedamazari,Fri Mar 25 02:47:18 IST 2016,mani time heard seen coach chairman give middl tournament
naveedamazari,Fri Mar 25 02:42:36 IST 2016,nt anyon say match thrown away malik among culprit
naveedamazari,Fri Mar 25 02:37:58 IST 2016,talk power game sir match given question ask
naveedamazari,Fri Mar 25 02:36:40 IST 2016,team fyi even tri go aerial rout mess alway
naveedamazari,Fri Mar 25 02:34:32 IST 2016,rt the phone least use app phone
naveedamazari,Fri Mar 25 02:31:06 IST 2016,dear salman can u tell mani aerial shot malik play r even tri last over whn pak need
naveedamazari,Fri Mar 25 01:43:10 IST 2016,rt
naveedamazari,Fri Mar 25 01:37:47 IST 2016,rt basit ali like aunti alway drama everi weed seek attent
naveedamazari,Fri Mar 25 01:33:39 IST 2016,rt on day mar pak world cup aus thank manofthematch perform https
naveedamazari,Fri Mar 25 01:16:42 IST 2016,advertis best
naveedamazari,Fri Mar 25 01:12:49 IST 2016,sir bt time right proverb man leav tmrw
naveedamazari,Fri Mar 25 00:55:32 IST 2016,plz prog malik co dress room atmospher get shabbi part
naveedamazari,Fri Mar 25 00:49:33 IST 2016,question tell go miss
