username,time,tweet
timonther6,Sun Feb 28 02:30:09 IST 2016,and seem love crowd ismanchesteririshgreen
timonther6,Sun Feb 28 02:29:03 IST 2016,hey sure fight territori it seem crowd prefer frampton teamjack
timonther6,Sun Feb 28 00:54:18 IST 2016,i bet nerv fine she think bedroom box carl tomorrow
timonther6,Sun Feb 28 00:35:46 IST 2016,sky channel free access carl frampton fight unlock foreign channel american commentari framptonquigg
timonther6,Sun Feb 28 00:15:01 IST 2016,never thought i say time schmidt grace move bring someon new
timonther6,Sat Feb 27 22:46:58 IST 2016,expect see hour teamjack framptonquigg ourweecountri
timonther6,Sat Feb 27 13:51:04 IST 2016,interest watch church leader call greater tax rich whilst church remain exempt tax ironi
timonther6,Sat Feb 27 13:17:30 IST 2016,it fight day the day see destroy the day get recognit deserv
timonther6,Sat Feb 27 03:26:57 IST 2016,worst game rugbi i seen terribl long time walvfra goingtowatchpaintdrynow
timonther6,Sat Feb 27 02:57:57 IST 2016,look danger could kill imaginari friend framptonfact framptonquigg jackalarmi
timonther6,Sat Feb 27 01:24:31 IST 2016,don want wish life away hurri fuck tomorrow even can wait see destroy frampton
timonther6,Fri Feb 26 16:55:01 IST 2016,quigg beat for understand bet place quigg win lose teamjack
timonther6,Fri Feb 26 01:08:35 IST 2016,could current non spur player link striker would
timonther6,Thu Feb 25 06:04:43 IST 2016,church offer they warm empti time lovethyneighbour
timonther6,Thu Feb 25 06:02:36 IST 2016,start tweet retweet biblic shit uk religion you lose follow young lad
timonther6,Thu Feb 25 05:59:40 IST 2016,serious you mean woman forc dress like street whore
timonther6,Thu Feb 25 03:13:57 IST 2016,brand new transhero rosi budd
timonther6,Thu Feb 25 02:54:04 IST 2016,lyric fdssghygdsdfhjjgfddgh work work work fgghjknhhgffddddfghjjhhgg
timonther6,Thu Feb 25 02:30:50 IST 2016,how shitfac adel alreadi love i i rich could sing
timonther6,Thu Feb 25 01:44:29 IST 2016,welcom donat don forget becki i famous
timonther6,Thu Feb 25 01:39:37 IST 2016,frickin day undisput best super bantam weight world till back
timonther6,Thu Feb 25 01:30:50 IST 2016,good luck pledg
timonther6,Thu Feb 25 00:42:16 IST 2016,
timonther6,Thu Feb 25 00:33:02 IST 2016,chicken vegan
timonther6,Wed Feb 24 15:08:00 IST 2016,it clear
timonther6,Wed Feb 24 04:30:34 IST 2016,least barri got tast yido coy
timonther6,Wed Feb 24 04:29:32 IST 2016,yes yes yes barri mcguigan yido coy
timonther6,Wed Feb 24 04:27:39 IST 2016,strike like playground bulli you negoti discuss way tri hurt vulner
timonther6,Wed Feb 24 03:54:11 IST 2016,come liverpool foyswilddetour
timonther6,Tue Feb 23 02:46:12 IST 2016,i think littl bit envious jealousi diseas get well soon shauna
timonther6,Mon Feb 22 23:46:16 IST 2016,day bring destruct and cours i forget quigg fan
timonther6,Mon Feb 22 04:54:08 IST 2016,sundaysmil
timonther6,Sun Feb 21 23:33:19 IST 2016,with borisjohnson make stanc clear brexit make clear not next leader conserv careersuicid
timonther6,Sun Feb 21 18:00:09 IST 2016,well ban religion certain remov lot death penalti
timonther6,Sun Feb 21 03:26:37 IST 2016,frick week undisput undoubt unmatch champion ourweecountri teamframpton
timonther6,Sat Feb 20 23:45:34 IST 2016,peopl move mistak made apolog deliv time chang
timonther6,Sat Feb 20 21:36:58 IST 2016,
timonther6,Sat Feb 20 21:26:56 IST 2016,day get knock f teamframpton framptonquigg
timonther6,Sat Feb 20 14:57:49 IST 2016,love thi neighbour do i say i
timonther6,Wed Feb 17 06:01:39 IST 2016,i i thought spur consist beat top team chavski bottom half spend hundr million
timonther6,Wed Feb 17 05:28:19 IST 2016,nope
timonther6,Wed Feb 17 05:16:45 IST 2016,could manag wave bye bye european hope
timonther6,Wed Feb 17 04:33:46 IST 2016,hey carl any kid stuff i love get shirt littl boy girl smash
timonther6,Wed Feb 17 03:26:14 IST 2016,hiya miss game what result thebestbluesalwayswin
timonther6,Wed Feb 17 00:05:43 IST 2016,rt win ticket biggest fight simpli follow us twitter retweet post good luck
timonther6,Wed Feb 17 00:01:24 IST 2016,parisstgermainareblu
timonther6,Tue Feb 16 23:16:38 IST 2016,must big style alreadi tonight think chelsea peak alreadi coy
timonther6,Tue Feb 16 15:45:09 IST 2016,ive visit contin set irish bar outboastkany
timonther6,Tue Feb 16 13:58:31 IST 2016,scientist discov gravit wave i wave graviti first outboastkany
timonther6,Tue Feb 16 03:19:10 IST 2016,tough show give insight militari train royalnavyschool show snippet if tri judg
