username,time,tweet
Maryliirg,Thu Apr 16 00:46:29 IST 2015,love fast day gone love even i work doubl today
Maryliirg,Mon Apr 13 03:20:40 IST 2015,when ask half size salad get full size instead
Maryliirg,Sat Apr 11 20:26:12 IST 2015,about jump bumpi road
Maryliirg,Sat Apr 11 10:19:31 IST 2015,second year get ask particip event mean might well
Maryliirg,Fri Apr 10 20:21:06 IST 2015,wasn feel burn last night workout till haha i dead
Maryliirg,Fri Apr 10 12:14:37 IST 2015,ah yea im done
Maryliirg,Fri Apr 10 06:35:04 IST 2015,my right screw
Maryliirg,Thu Apr 09 20:57:09 IST 2015,at moment know want settl fun care anymor
Maryliirg,Thu Apr 09 03:44:02 IST 2015,its either way windi car get move around im trip
Maryliirg,Thu Apr 09 03:36:54 IST 2015,gotta get new jean
Maryliirg,Tue Apr 07 20:46:02 IST 2015,when someon talk sh spanish without realiz understand smh
Maryliirg,Tue Apr 07 18:20:24 IST 2015,so earli mani thought mind
Maryliirg,Tue Apr 07 07:46:26 IST 2015,how wish could save broken heart pleas learn smh
Maryliirg,Tue Apr 07 06:02:29 IST 2015,just realiz last tweet sound incorrect lazi correct tho haha
Maryliirg,Tue Apr 07 05:50:48 IST 2015,haha love weird stranger
Maryliirg,Tue Apr 07 05:50:31 IST 2015,marriag big step move togeth big step kid big step date definit not big step
Maryliirg,Sat Apr 04 19:23:24 IST 2015,min call yea
Maryliirg,Sat Apr 04 10:20:44 IST 2015,haha oh someon saw ill tell bit
Maryliirg,Sat Apr 04 10:18:38 IST 2015,what made day look
Maryliirg,Mon Mar 30 22:40:33 IST 2015,feel sick yet eat bomb taco guacamol haha
Maryliirg,Mon Mar 30 22:21:56 IST 2015,still feel like crap like wth
Maryliirg,Sat Mar 28 23:20:56 IST 2015,let get start
Maryliirg,Sat Mar 28 01:14:46 IST 2015,thank lord
Maryliirg,Sat Mar 28 01:03:48 IST 2015,upgrad
Maryliirg,Fri Mar 27 20:23:55 IST 2015,not feel best friday
Maryliirg,Thu Mar 26 08:27:54 IST 2015,pue son dr scholl hahaha oh mom
Maryliirg,Thu Mar 26 08:16:19 IST 2015,so sick see sit floor middl store wait
Maryliirg,Thu Mar 26 03:49:18 IST 2015,random get ask i shakira sister
Maryliirg,Thu Mar 26 03:22:13 IST 2015,sit shop car mom push haha realli sick
Maryliirg,Wed Mar 25 23:39:28 IST 2015,rt i complet alway i care peopl think i i look like that i
Maryliirg,Wed Mar 25 23:16:52 IST 2015,ha mom follow social media plus
Maryliirg,Wed Mar 25 22:45:42 IST 2015,haven sick feel terribl gotta go
Maryliirg,Wed Mar 25 22:18:11 IST 2015,rt god alway someth key everi problem light everi shadow relief everi sorrow
Maryliirg,Wed Mar 25 05:55:34 IST 2015,i went eyelash curler addict
Maryliirg,Tue Mar 24 05:31:32 IST 2015,workout well need
Maryliirg,Mon Mar 23 20:22:44 IST 2015,so tire function today
Maryliirg,Mon Mar 23 18:21:46 IST 2015,not readi today
Maryliirg,Sun Mar 22 10:10:07 IST 2015,insurg insurg
Maryliirg,Sun Mar 22 04:08:55 IST 2015,just i like work i come i run
Maryliirg,Sun Mar 22 03:43:06 IST 2015,will realli happen today
Maryliirg,Sat Mar 21 11:35:46 IST 2015,but oh work coupl hour
Maryliirg,Sat Mar 21 11:35:20 IST 2015,great night guy
Maryliirg,Fri Mar 20 22:37:51 IST 2015,order wrong thing menu realiz get food
Maryliirg,Fri Mar 20 10:45:11 IST 2015,haha omg you funni
Maryliirg,Fri Mar 20 10:38:10 IST 2015,get use android happen
Maryliirg,Fri Mar 20 03:50:34 IST 2015,when tri pay peopl front
Maryliirg,Fri Mar 20 03:23:13 IST 2015,rt happi birthday adam levin ur i
Maryliirg,Fri Mar 20 02:36:43 IST 2015,yay got amaz makeup today so happi get better better everi
Maryliirg,Thu Mar 19 19:21:52 IST 2015,good morn
