username,time,tweet
siera_janae,Wed Apr 01 07:05:21 IST 2015,this year keep get better
siera_janae,Tue Mar 31 22:43:14 IST 2015,rt can believ alreadi year ago
siera_janae,Sun Mar 29 08:04:54 IST 2015,notr dame
siera_janae,Fri Mar 27 06:16:54 IST 2015,just thought life get harder
siera_janae,Fri Mar 27 00:57:32 IST 2015,rt just year ago thing differ
siera_janae,Wed Mar 25 22:49:37 IST 2015,this biolog class might kill toomuch
siera_janae,Sat Mar 21 00:57:04 IST 2015,current tie bracket an predict win
siera_janae,Fri Mar 20 05:19:27 IST 2015,rt real men shoot anim rt u agre
siera_janae,Tue Mar 17 10:27:03 IST 2015,got sister tattoo saturday first pic kinda wrong color blood bruis love
siera_janae,Fri Mar 13 02:43:10 IST 2015,i wish talk
siera_janae,Wed Mar 11 22:54:43 IST 2015,hahahahah miss day
siera_janae,Tue Mar 10 09:17:42 IST 2015,danc thing keep sane alwaysd
siera_janae,Sun Mar 08 04:13:18 IST 2015,i take much i enough
siera_janae,Fri Mar 06 23:32:35 IST 2015,i rock swing danc today hpr
siera_janae,Thu Mar 05 11:35:13 IST 2015,i wish i care anymor obvious care feelingreject
siera_janae,Mon Mar 02 11:42:08 IST 2015,rt so glad roommat becam one best friend
siera_janae,Wed Feb 25 23:45:12 IST 2015,test speech next week it even midterm week
siera_janae,Tue Feb 17 11:56:26 IST 2015,accord fair open sleeptalk
siera_janae,Sun Feb 15 12:03:35 IST 2015,congrat girl compet section you well today go fun state
siera_janae,Sat Feb 14 11:24:55 IST 2015,thank good i home
siera_janae,Fri Feb 13 10:11:23 IST 2015,not word
siera_janae,Thu Feb 12 22:45:32 IST 2015,class cancel done day
siera_janae,Thu Feb 12 11:10:11 IST 2015,peopl say optimist i i end disappoint end day pessimist
siera_janae,Thu Feb 12 03:02:23 IST 2015,agre
siera_janae,Wed Feb 11 23:47:56 IST 2015,rt i pretti fuckin far okay
siera_janae,Wed Feb 11 11:33:56 IST 2015,this realli tough day hope tomorrow better
siera_janae,Wed Feb 11 05:30:57 IST 2015,i good screw life awesom
siera_janae,Mon Feb 09 11:42:28 IST 2015,rt littl roomi love
siera_janae,Sat Jan 31 00:07:35 IST 2015,rt psycholog say love fight relationship love fight end love still
siera_janae,Tue Jan 20 14:55:24 IST 2015,can sleep
siera_janae,Wed Dec 17 22:29:17 IST 2014,final done final thankgod
siera_janae,Mon Dec 15 22:43:58 IST 2014,look like condom only room
siera_janae,Sun Dec 14 03:06:46 IST 2014,it one long week readytogo
siera_janae,Fri Dec 12 12:23:16 IST 2014,you start wonder fault one seem stick around latenightthought
siera_janae,Tue Nov 11 21:22:33 IST 2014,rt class cancel email goodmorn text
siera_janae,Tue Nov 11 01:29:50 IST 2014,haha realli it probabl got sick
siera_janae,Sat Nov 01 13:36:18 IST 2014,so glad i get girl side up down bestfriend halloween
siera_janae,Mon Oct 27 04:31:42 IST 2014,rt i perfect i annoy make fun say stupid thing never find someon love much
siera_janae,Thu Oct 23 07:57:09 IST 2014,i hope fun watch fail
siera_janae,Sat Oct 11 06:42:26 IST 2014,one compliment make someon whole day
siera_janae,Wed Oct 08 08:51:26 IST 2014,pretti sure i go fail colleg glad high school help much hatetest
siera_janae,Sun Oct 05 01:50:14 IST 2014,rt stop bash peopl privat account like pussi man
siera_janae,Sat Oct 04 01:12:06 IST 2014,rt my roommat i still taken pictur togeth probabl look homeless like everi day whoop dgaf
siera_janae,Thu Oct 02 01:40:02 IST 2014,oop
siera_janae,Mon Sep 29 08:54:13 IST 2014,year wonder boyfriend ever thank
siera_janae,Mon Sep 29 08:50:20 IST 2014,rt only five day i get see best friend
siera_janae,Sun Sep 28 21:16:24 IST 2014,hahahahah yes
siera_janae,Thu Sep 18 20:51:32 IST 2014,haha leav roomat awkward situat
siera_janae,Tue Sep 02 22:36:07 IST 2014,the best roomat ever dish i class
