username,time,tweet
92Gaulinv,Sun Feb 28 23:38:17 IST 2016,get contour look like kim kardashian amaz beingsilli
92Gaulinv,Sun Feb 28 23:28:47 IST 2016,rt life happen tri find time nap
92Gaulinv,Sun Feb 28 23:28:04 IST 2016,rt i guess i dress book charact today say daughter mention school dress day
92Gaulinv,Sun Feb 28 23:26:11 IST 2016,awe keep tri or consid get class driver licens
92Gaulinv,Sun Feb 28 23:20:44 IST 2016,over cautious worth
92Gaulinv,Sun Feb 28 23:18:15 IST 2016,yum tri get pfantast pannekoek haus yyc all peopl nice famili ahead
92Gaulinv,Sun Feb 28 21:11:30 IST 2016,also mimosa
92Gaulinv,Sun Feb 28 21:11:05 IST 2016,i hate grumpykid hangri yum
92Gaulinv,Sun Feb 28 21:07:14 IST 2016,thank god manutd
92Gaulinv,Sun Feb 28 21:06:51 IST 2016,rt not look good gunner
92Gaulinv,Sun Feb 28 20:39:39 IST 2016,rt usha learn share our littl red panda cub quit confid new home
92Gaulinv,Sun Feb 28 20:32:57 IST 2016,rt half time man utd arsenal bpl debut marcus rashford steal show goal minut munar
92Gaulinv,Sun Feb 28 20:29:09 IST 2016,rt molson curl tonight canadian sext
92Gaulinv,Sun Feb 28 20:27:19 IST 2016,i look purchas sweater i live yyc ship solut
92Gaulinv,Sun Feb 28 20:04:26 IST 2016,rt the don draper world use marri secretari now marri fellow execut
92Gaulinv,Sun Feb 28 10:15:24 IST 2016,sumo hockey what play
92Gaulinv,Sun Feb 28 10:02:52 IST 2016,brew hous stand venu well done
92Gaulinv,Sun Feb 28 08:52:42 IST 2016,i drink p
92Gaulinv,Sun Feb 28 08:07:59 IST 2016,row come kokane
92Gaulinv,Sun Feb 28 08:04:08 IST 2016,game dear readi set disappoint senat
92Gaulinv,Sun Feb 28 05:32:43 IST 2016,rt i foreign affair minist coupl month bernier recal yes whatev happen
92Gaulinv,Sun Feb 28 05:16:08 IST 2016,rt how koch brother use extrem wealth shift america far right https
92Gaulinv,Sun Feb 28 05:13:48 IST 2016,oh appar miss tweet unabl convers without interog thank btw
92Gaulinv,Sun Feb 28 05:10:18 IST 2016,i got joke p
92Gaulinv,Sun Feb 28 05:05:33 IST 2016,got flame t shirt readi budweis hockey beauti citi yyc
92Gaulinv,Sun Feb 28 01:57:03 IST 2016,rt did miss today bundesliga action watch video highlight game
92Gaulinv,Sun Feb 28 01:52:39 IST 2016,rt why millenni obsess becom
92Gaulinv,Sun Feb 28 01:47:53 IST 2016,rt it retro night dome mean rock tonight vs sen ottvscgi
92Gaulinv,Sun Feb 28 01:19:10 IST 2016,rt saskatchewan premier brad wall sign nation carbon tax
92Gaulinv,Sat Feb 27 23:22:35 IST 2016,i like organ fix elect date parti you know like new year nerd poli sci peopl
92Gaulinv,Sat Feb 27 22:54:00 IST 2016,flame play sen tonight giggl i realiz sen draft pick would call senat wait cdnpoli nerdygirl
92Gaulinv,Sat Feb 27 22:47:20 IST 2016,rt pink slip fli alberta westjet staff last thing i would cut say ceo https
92Gaulinv,Sat Feb 27 22:39:20 IST 2016,rt invest pipe infrastructur help reach custom expand long term econ capac
92Gaulinv,Sat Feb 27 09:50:18 IST 2016,rt icymi watch replay today question period next cpac cpac tv go cdnpoli
92Gaulinv,Sat Feb 27 09:12:42 IST 2016,say i unbalanc even skin combin
92Gaulinv,Fri Feb 26 21:17:04 IST 2016,more coffe less talki
92Gaulinv,Fri Feb 26 21:15:49 IST 2016,music bar morn need coffe somewher
92Gaulinv,Fri Feb 26 21:10:26 IST 2016,oh snap you right i mad i took school ontario paid student loan alreadi honest
92Gaulinv,Fri Feb 26 20:54:37 IST 2016,rt tequila friend ever spirit
92Gaulinv,Fri Feb 26 20:23:26 IST 2016,send luck way
92Gaulinv,Fri Feb 26 20:18:29 IST 2016,doubt u c remain prestigi place attend but money matter somewher admiss process hurt
92Gaulinv,Fri Feb 26 20:06:04 IST 2016,section master applic process u c in fair good prompt realiti check need
92Gaulinv,Fri Feb 26 20:00:53 IST 2016,on tuition grant complet cover instruct ab student need write essay explain pay upon admiss
92Gaulinv,Fri Feb 26 06:37:15 IST 2016,rt you moment day sometim week doubt just know part spiritu process
92Gaulinv,Fri Feb 26 06:33:03 IST 2016,rt sex finish without i need get beer
92Gaulinv,Fri Feb 26 06:31:39 IST 2016,rt the stage set canada game truli canadian place lakelouis
92Gaulinv,Fri Feb 26 06:30:06 IST 2016,rt for twice divorc new yorker trump poll remark well bibl belt state
92Gaulinv,Fri Feb 26 06:11:11 IST 2016,cheap drink yyc where
92Gaulinv,Fri Feb 26 02:53:05 IST 2016,rt the agricultur budget decreas financ treasuri board budget respons govern cost cut
92Gaulinv,Fri Feb 26 00:17:48 IST 2016,
