username,time,tweet
Arisbeth687,Thu Dec 10 21:55:56 IST 2015,the shape eye compliment wing eyelin i i obvious incaseyoucanttel
Arisbeth687,Tue Dec 08 21:34:23 IST 2015,rt we get start often want how cool
Arisbeth687,Mon Dec 07 20:55:46 IST 2015,rt so drake got grammi nomin best rap perform back back meek took biggest l rap histori lol
Arisbeth687,Sun Dec 06 22:12:25 IST 2015,rt attitud littl thing make big differ winstonchurchil getyourheadinthegam startuplif
Arisbeth687,Thu Dec 03 13:36:50 IST 2015,take cute pictur like next time
Arisbeth687,Thu Dec 03 13:36:10 IST 2015,my person utter depict major
Arisbeth687,Thu Dec 03 11:49:20 IST 2015,angel fallen
Arisbeth687,Thu Dec 03 11:46:37 IST 2015,happi birthday wish i could celebr w loveyou runsinthefam imissyou
Arisbeth687,Thu Dec 03 11:28:27 IST 2015,
Arisbeth687,Thu Dec 03 11:27:04 IST 2015,rt sinc attend colleg i know true mean go tuesday saginaw valley state univers
Arisbeth687,Thu Dec 03 10:37:35 IST 2015,know bring tabl afraid eat alon
Arisbeth687,Wed Dec 02 07:10:25 IST 2015,rt why mad win nation board review best movi matter
Arisbeth687,Tue Dec 01 22:04:14 IST 2015,rt everi day stare mirror look person tri improv a team establish natur
Arisbeth687,Mon Nov 30 23:01:49 IST 2015,rt love much i happi okay
Arisbeth687,Mon Nov 30 21:42:15 IST 2015,if love know never alon
Arisbeth687,Mon Nov 30 21:34:37 IST 2015,so thank amaz peopl life especi hard time
Arisbeth687,Mon Nov 30 21:30:01 IST 2015,rt today mondaymotiv augustin wong assist creativ design manag
Arisbeth687,Mon Nov 30 21:27:32 IST 2015,rt stand matter mondaymotiv
Arisbeth687,Sat Nov 28 03:18:00 IST 2015,when miss someon much could actual cri
Arisbeth687,Thu Nov 26 05:29:01 IST 2015,auto correct
Arisbeth687,Thu Nov 26 05:22:25 IST 2015,there huge amount freedom take noth person
Arisbeth687,Mon Nov 23 21:41:22 IST 2015,rt rise grind the futur belong peopl see possibl becom obvious
Arisbeth687,Sun Nov 22 10:46:57 IST 2015,i better ever watchm good bye twitter
Arisbeth687,Sun Nov 22 10:44:40 IST 2015,rt hate say famili realli disappoint
Arisbeth687,Sun Nov 22 10:37:54 IST 2015,delet tweet sign weak
Arisbeth687,Sun Nov 22 10:31:33 IST 2015,no way i game how i expect
Arisbeth687,Fri Nov 20 23:52:57 IST 2015,the state increas minimum wage decreas head count busi is realli peopl want
Arisbeth687,Fri Nov 20 23:50:22 IST 2015,rt now fda decis made approv ge salmon next step must ensur american know
Arisbeth687,Fri Nov 20 23:50:19 IST 2015,rt genet engin salmon approv fda fact label crimin transpar bedrock
Arisbeth687,Fri Nov 20 23:14:23 IST 2015,rt los angel california
Arisbeth687,Thu Nov 19 23:27:37 IST 2015,don blame lack time time longest thing known exist make ultim count guilti
Arisbeth687,Wed Nov 18 23:38:35 IST 2015,love life love worldkindnessday
Arisbeth687,Wed Nov 18 13:40:19 IST 2015,you never know might see someon last time
Arisbeth687,Mon Nov 16 01:20:05 IST 2015,rt look back
Arisbeth687,Sun Nov 15 01:00:48 IST 2015,awwww total us
Arisbeth687,Sat Nov 14 11:03:39 IST 2015,the problem ignor pre conceiv idea
Arisbeth687,Fri Nov 13 12:00:41 IST 2015,hahahah
Arisbeth687,Fri Nov 13 11:58:27 IST 2015,that simpli awesom
Arisbeth687,Fri Nov 13 11:54:10 IST 2015,lo hecho ya pero al final da igual
Arisbeth687,Fri Nov 13 11:00:10 IST 2015,alway sweet empow
Arisbeth687,Fri Nov 13 10:42:49 IST 2015,not realli i hope someday
Arisbeth687,Fri Nov 13 10:19:59 IST 2015,should eject
Arisbeth687,Fri Nov 13 10:18:39 IST 2015,
Arisbeth687,Fri Nov 13 10:09:30 IST 2015,griffin
Arisbeth687,Fri Nov 13 09:56:03 IST 2015,rt steph curri better year last year that bad rest nba
Arisbeth687,Tue Nov 10 22:34:02 IST 2015,everyon pleas come join awesom event host ceo club campus tonight bryan be
Arisbeth687,Tue Nov 10 04:49:35 IST 2015,i live type friendship genuin tell someon love know day
Arisbeth687,Tue Nov 10 04:36:00 IST 2015,heart america kc kansa citi missouri
Arisbeth687,Tue Nov 10 04:30:21 IST 2015,this weather help nostalgia dramaqueen
Arisbeth687,Tue Nov 10 01:49:51 IST 2015,second person question whether i adhd hmm i never question
