username,time,tweet
5R_Milspec,Sat Feb 27 02:17:13 IST 2016,haha thanx slv pretti sure sarah doesnt heartbroken there someth serious wrong
5R_Milspec,Fri Feb 26 09:50:40 IST 2016,rt this looney block oppos lefti apologist anti israel anti west
5R_Milspec,Fri Feb 26 09:50:20 IST 2016,rt oh mark we still love reneck
5R_Milspec,Fri Feb 26 04:02:21 IST 2016,ladi bun fine
5R_Milspec,Fri Feb 26 03:55:28 IST 2016,yes someth like bull rope
5R_Milspec,Fri Feb 26 03:54:47 IST 2016,would def help layman no pun intend
5R_Milspec,Fri Feb 26 03:48:42 IST 2016,guess anim right idiot prefer kill human stop
5R_Milspec,Fri Feb 26 03:45:19 IST 2016,lmao now get
5R_Milspec,Fri Feb 26 02:23:35 IST 2016,
5R_Milspec,Fri Feb 26 02:23:06 IST 2016,
5R_Milspec,Fri Feb 26 02:22:49 IST 2016,
5R_Milspec,Thu Feb 25 17:53:47 IST 2016,
5R_Milspec,Thu Feb 25 17:53:42 IST 2016,rt i pleas hear huge troubl serv right
5R_Milspec,Thu Feb 25 17:53:26 IST 2016,realli havent heard doesnt surpris feral cat catastroph nativ
5R_Milspec,Thu Feb 25 14:19:24 IST 2016,rt keep sign share bantheburka
5R_Milspec,Thu Feb 25 11:00:02 IST 2016,she even look like this costum ontheoth hand spit imag nopunintend
5R_Milspec,Thu Feb 25 10:49:33 IST 2016,concern want dress kany he total dickhead
5R_Milspec,Thu Feb 25 10:48:53 IST 2016,if black person paint face white would funni cute work way sure
5R_Milspec,Thu Feb 25 09:43:49 IST 2016,nice shot
5R_Milspec,Thu Feb 25 09:29:46 IST 2016,rt mariam divid seiz upon trivial obscur realiti muslim rape gang auspol
5R_Milspec,Thu Feb 25 07:39:53 IST 2016,rememb
5R_Milspec,Thu Feb 25 06:46:14 IST 2016,lmao realiti much funnier prank far send gaol
5R_Milspec,Thu Feb 25 06:34:23 IST 2016,rt what think go happen
5R_Milspec,Thu Feb 25 06:18:17 IST 2016,rogu state similiar convit felon no shouldnt nuke gun
5R_Milspec,Thu Feb 25 06:16:11 IST 2016,whos suggest everyon arm convict felon cant shouldnt
5R_Milspec,Thu Feb 25 06:08:22 IST 2016,lmao some mother havem
5R_Milspec,Thu Feb 25 06:01:25 IST 2016,rt in u s yes credibl fact tell us
5R_Milspec,Thu Feb 25 05:49:15 IST 2016,rt you make excel point one i follow
5R_Milspec,Thu Feb 25 04:22:55 IST 2016,rt well done ssaa lie former pm sport shooter associ australia ssaa
5R_Milspec,Thu Feb 25 03:29:15 IST 2016,increas sentenc punish gun crime control lafo
5R_Milspec,Thu Feb 25 03:22:33 IST 2016,near gun crime perpetr unreg gun unlicens crim
5R_Milspec,Thu Feb 25 03:14:13 IST 2016,rt thank follow i hope enjoy today show
5R_Milspec,Thu Feb 25 02:18:06 IST 2016,
5R_Milspec,Thu Feb 25 02:17:52 IST 2016,
5R_Milspec,Thu Feb 25 02:09:59 IST 2016,rt bs travel thro mani safe countri choic not refuge
5R_Milspec,Thu Feb 25 02:09:19 IST 2016,rt tough gun law affect peopl gun legal they effect crimin
5R_Milspec,Thu Feb 25 02:08:33 IST 2016,rt only tough part law abid respons citizen keep use pay licn f arm
5R_Milspec,Wed Feb 24 18:56:13 IST 2016,rt so much tough gun law aust us take note
5R_Milspec,Wed Feb 24 18:54:57 IST 2016,rt i hope aust list
5R_Milspec,Wed Feb 24 18:54:34 IST 2016,rt bill shorten call cori bernardi homophob at least never suspect rape
5R_Milspec,Wed Feb 24 18:54:01 IST 2016,far much hair even redneck
5R_Milspec,Wed Feb 24 18:35:19 IST 2016,rt hey tom saw fb time ago thought might like
5R_Milspec,Wed Feb 24 17:55:29 IST 2016,sick tire funpolic
5R_Milspec,Wed Feb 24 17:35:18 IST 2016,
5R_Milspec,Wed Feb 24 13:59:27 IST 2016,rt and enough bs hypocrisi
5R_Milspec,Wed Feb 24 12:03:51 IST 2016,rt muslim enslav children blow plane train sell ice kid bash polic
5R_Milspec,Wed Feb 24 11:30:55 IST 2016,rt everi time feminist refus call islam misogyni cultur this enabl
5R_Milspec,Wed Feb 24 11:28:27 IST 2016,besid look like filthier pigsti trash
5R_Milspec,Wed Feb 24 11:24:13 IST 2016,what els expect australian dont like religion advoc fgm paedophilia rape terror via
