username,time,tweet
Gautam_Singh89,Mon Nov 30 22:18:01 IST 2015,awesom channel special realli entertain
Gautam_Singh89,Mon Nov 30 09:47:40 IST 2015,rt isi manag sell oil turkey black market less global iraqi mp
Gautam_Singh89,Mon Nov 30 09:42:26 IST 2015,u cover serious issu
Gautam_Singh89,Sun Nov 29 13:54:07 IST 2015,seem best intellectu respond u blunt
Gautam_Singh89,Sun Nov 29 13:23:43 IST 2015,r video riot but hindus buddhist christian preach violenc
Gautam_Singh89,Sun Nov 29 13:21:40 IST 2015,india
Gautam_Singh89,Sun Nov 29 13:07:49 IST 2015,see effect religi educ
Gautam_Singh89,Sun Nov 29 12:58:51 IST 2015,agre observ sufism have seen preacher radic islam effect
Gautam_Singh89,Sun Nov 29 12:17:59 IST 2015,disagre
Gautam_Singh89,Sun Nov 29 12:07:40 IST 2015,stand
Gautam_Singh89,Sun Nov 29 08:19:51 IST 2015,feminist speak coz sickular
Gautam_Singh89,Sat Nov 28 23:57:19 IST 2015,limit defin religion irrat exampl is spread islam
Gautam_Singh89,Sat Nov 28 23:40:08 IST 2015,read indian politi m lakshmik requir call intellectu
Gautam_Singh89,Sat Nov 28 23:30:22 IST 2015,context sangeetakalia
Gautam_Singh89,Sat Nov 28 20:30:00 IST 2015,now intoler countri radic islamist
Gautam_Singh89,Fri Nov 27 19:45:01 IST 2015,rt
Gautam_Singh89,Fri Nov 27 19:28:55 IST 2015,rt over next day carri seri behead no isi our alli saudi arabia
Gautam_Singh89,Thu Nov 26 14:17:33 IST 2015,intoler speech intoler also intoler my point debat issu lower priorit countri
Gautam_Singh89,Thu Nov 26 13:43:51 IST 2015,effect everi women they intoler toward freedom why unbias approach whole world
Gautam_Singh89,Thu Nov 26 12:44:18 IST 2015,appreci ur prejudic consid sanghi
Gautam_Singh89,Thu Nov 26 10:04:02 IST 2015,complet agre not proud present constitut
Gautam_Singh89,Thu Nov 26 07:40:55 IST 2015,see real intoler societi
Gautam_Singh89,Thu Nov 26 07:34:34 IST 2015,surpris includ toler countri sharia law paidmedia
Gautam_Singh89,Thu Nov 26 00:09:56 IST 2015,possibl happen coz becom busi drive world superpow
Gautam_Singh89,Wed Nov 25 00:35:26 IST 2015,rt that take long how long western bullshit media question us illeg iraq invas death
Gautam_Singh89,Tue Nov 24 21:10:33 IST 2015,even suppress women make wear burka noth religion secular
Gautam_Singh89,Tue Nov 24 18:56:32 IST 2015,canada exclud singl male refuge if femal femin would start instead terror
Gautam_Singh89,Tue Nov 24 18:41:31 IST 2015,putin down russian jet syria stab back terrorist accomplic nato respons isi
Gautam_Singh89,Tue Nov 24 16:55:25 IST 2015,point toler anyway
Gautam_Singh89,Tue Nov 24 15:49:17 IST 2015,russia handl turkey
Gautam_Singh89,Tue Nov 24 15:39:32 IST 2015,relax consequ lead russia know handl
Gautam_Singh89,Mon Nov 23 16:20:18 IST 2015,sorri say maximum indian women bias feminist never took stand issu muslim women sharia
Gautam_Singh89,Mon Nov 23 00:46:36 IST 2015,differ world differ educ differ religion differ believ godmustbecrazi
Gautam_Singh89,Mon Nov 23 00:41:29 IST 2015,call intern ear
Gautam_Singh89,Sun Nov 22 16:26:16 IST 2015,rt the sad state syria syrian peopl isi women enforc syria recount collabor anguish escap
Gautam_Singh89,Sun Nov 22 11:06:54 IST 2015,rt as long continu lie direct connect jihadi terror never b abl deal wid problem
Gautam_Singh89,Sun Nov 22 10:47:21 IST 2015,rt why farmer alon bear cost keep food price low
Gautam_Singh89,Sun Nov 22 10:31:32 IST 2015,news year late mani north tea garden that part countri economicinequ
Gautam_Singh89,Sun Nov 22 01:25:02 IST 2015,r way differ democrat republican
Gautam_Singh89,Sat Nov 21 21:28:38 IST 2015,everi singl danc enjoy loud bhajan music templ addict enjoy cost nois pollut
Gautam_Singh89,Sat Nov 21 21:21:03 IST 2015,accept issu radic islam follow
Gautam_Singh89,Sat Nov 21 21:18:28 IST 2015,rt it everyth concept arm jihad espous islam book you apologist
Gautam_Singh89,Sat Nov 21 15:04:08 IST 2015,our secular press complet igonor fact islam sharia
Gautam_Singh89,Sat Nov 21 07:57:53 IST 2015,rt any differ mindset mob burnt ahmedi pak kamal faruqui warn live tv
Gautam_Singh89,Sat Nov 21 07:44:33 IST 2015,seem face fact
Gautam_Singh89,Fri Nov 20 10:27:28 IST 2015,rt set farmersincomecommiss line pay commiss farmer need lead life digniti
Gautam_Singh89,Fri Nov 20 09:54:06 IST 2015,rt big bonus govt employe cruel joke die farmer stop till promis supportpric
Gautam_Singh89,Fri Nov 20 09:53:21 IST 2015,rt the make farmer whose averag incom less rs per month look like beggar and
Gautam_Singh89,Thu Nov 19 07:59:17 IST 2015,when issu isi oil compani need attent media divert prioriti
Gautam_Singh89,Tue Nov 17 10:48:43 IST 2015,bloodandoil islamicst
