username,time,tweet
eonica28,Sun Feb 28 07:21:13 IST 2016,you smoke pot today yay
eonica28,Sat Feb 27 08:57:47 IST 2016,i love bread much
eonica28,Fri Feb 26 19:20:58 IST 2016,rude ass peopl bug meeee
eonica28,Fri Feb 26 10:09:05 IST 2016,drunk middl age women kinda funni watch
eonica28,Fri Feb 26 02:25:11 IST 2016,fight guy wast time
eonica28,Fri Feb 26 01:33:29 IST 2016,the man dumb i get peopl would support
eonica28,Fri Feb 26 01:29:23 IST 2016,i like trump either give anybodi right go say support crazi
eonica28,Thu Feb 25 03:33:03 IST 2016,uhm call
eonica28,Thu Feb 25 00:25:55 IST 2016,snow day chill
eonica28,Wed Feb 24 17:01:39 IST 2016,earli dismiss chill
eonica28,Wed Feb 24 04:09:13 IST 2016,lol tri bbi i tri
eonica28,Wed Feb 24 03:36:31 IST 2016,trump ass
eonica28,Mon Feb 22 05:56:30 IST 2016,just shitti polic mean hate
eonica28,Sun Feb 21 07:45:20 IST 2016,my father love alway strong my mother glamour live yet still insid i felt alon for reason unknown
eonica28,Sun Feb 21 06:45:03 IST 2016,i want tattoo alreadi
eonica28,Sun Feb 21 05:39:30 IST 2016,only half month graduat hell time go
eonica28,Sat Feb 20 05:15:33 IST 2016,i understand peopl like wake earli
eonica28,Sat Feb 20 04:36:24 IST 2016,peopl say judg turn around call someon slut wear
eonica28,Fri Feb 19 23:51:09 IST 2016,don leav ladi product floor bathroom sit toilet seat pleas thank
eonica28,Mon Feb 15 05:51:58 IST 2016,if trump end presid i move canada
eonica28,Sun Feb 14 04:47:10 IST 2016,i hate valentin day i singl i hate dumb
eonica28,Sat Feb 13 00:46:54 IST 2016,all i wanna get high beach get high beach get high
eonica28,Fri Feb 12 20:31:23 IST 2016,i readi school
eonica28,Fri Feb 12 04:57:04 IST 2016,but wear tank top booti short it winter peopl
eonica28,Thu Feb 11 23:53:48 IST 2016,middl schooler talk polit like know
eonica28,Mon Feb 08 05:26:12 IST 2016,i commerci food superbowl
eonica28,Sun Feb 07 22:01:49 IST 2016,not one project cost us four year work that make much sens
eonica28,Sun Feb 07 06:49:12 IST 2016,i like candid year
eonica28,Wed Feb 03 18:22:03 IST 2016,i like delay good enough
eonica28,Wed Feb 03 08:26:08 IST 2016,i almost die like time way home tonight two option cancel cancel
eonica28,Mon Feb 01 21:30:16 IST 2016,someon told iggi better beyonc what
eonica28,Sun Jan 31 02:05:31 IST 2016,i know i annoy yall without get slap upsid head ha
eonica28,Sun Jan 31 01:47:24 IST 2016,well
eonica28,Sat Jan 30 03:52:38 IST 2016,it must nation dumb driver day
eonica28,Fri Jan 29 08:46:53 IST 2016,what point senior year like honest
eonica28,Fri Jan 29 04:51:20 IST 2016,better die happi lol
eonica28,Mon Jan 25 10:16:30 IST 2016,i sinc morn i go sleep
eonica28,Tue Jan 19 04:30:35 IST 2016,back road still terribl you know mean
eonica28,Mon Jan 18 06:19:37 IST 2016,don complain work hour shift reason noth
eonica28,Mon Jan 18 05:10:33 IST 2016,thank mother natur
eonica28,Mon Jan 18 04:29:22 IST 2016,it look pretti bad better close school
eonica28,Sat Jan 16 09:07:08 IST 2016,rt my life would much easier thing peopl
eonica28,Tue Jan 12 08:55:34 IST 2016,senior year great even get snow day i could still stay home miss thing
eonica28,Tue Jan 12 00:28:44 IST 2016,i would make look someon bump regardless goldenglobereview
eonica28,Mon Jan 11 23:58:48 IST 2016,i could go anoth day tomorrow sayin
eonica28,Mon Jan 11 05:46:07 IST 2016,now i watch night
eonica28,Mon Jan 11 05:38:56 IST 2016,even though i senior i blow class still great hear snow day
eonica28,Fri Jan 08 07:50:32 IST 2016,i think i bit obsess dog
eonica28,Fri Jan 01 13:27:27 IST 2016,yeah sleep
eonica28,Fri Jan 01 08:56:19 IST 2016,this year flew
