username,time,tweet
partymarty25,Sat May 09 07:24:46 IST 2015,ref super good keep game control clevschi
partymarty25,Sat May 09 07:05:38 IST 2015,i miss shaq fall stuff halftim
partymarty25,Sat May 09 07:03:56 IST 2015,you know great idea noah piss lebron commonsens
partymarty25,Sat May 09 06:11:20 IST 2015,joakim noah screen legal manbun gocav
partymarty25,Sat May 09 05:54:47 IST 2015,rt watch year old throw first pitch indian
partymarty25,Sat May 09 05:29:50 IST 2015,rock jersey i fall tonight peopl think i impress shaqtinafool allincl
partymarty25,Thu May 07 06:09:30 IST 2015,he back fightforlov
partymarty25,Thu May 07 06:06:01 IST 2015,rt you know championship footbal team allincl gobuck
partymarty25,Thu May 07 05:53:12 IST 2015,shock sinc noah never sore loser
partymarty25,Thu May 07 04:48:20 IST 2015,
partymarty25,Thu May 07 04:47:39 IST 2015,i think good luck take next week
partymarty25,Thu May 07 04:47:02 IST 2015,if thing continu game like i wear f ing sweatband power suit tomorrow gocav
partymarty25,Thu May 07 04:44:45 IST 2015,pretti much obsess shump emoji ballershotcal
partymarty25,Thu May 07 04:40:55 IST 2015,christma diwali roll one
partymarty25,Tue May 05 04:56:27 IST 2015,are realli talk bad luck chicago those mj year reeeeal rough bullsvscav
partymarty25,Mon May 04 17:57:47 IST 2015,lace readi gocav nextmanup theland
partymarty25,Fri May 01 07:37:40 IST 2015,realli might noth time lot time hand you littl chick crimson lip
partymarty25,Fri May 01 07:36:46 IST 2015,rt once the brown clock brownsdraft
partymarty25,Fri May 01 07:36:39 IST 2015,destroy draft night concentr everyon want know opinion
partymarty25,Fri May 01 07:36:00 IST 2015,wonder googl hit readi go
partymarty25,Fri May 01 07:34:54 IST 2015,come caus look fine i realli wanna make mine basementdanc klemspiss
partymarty25,Fri May 01 07:31:54 IST 2015,hey let slide alright caus gonna get tonight
partymarty25,Fri May 01 07:29:50 IST 2015,feel feel boom boom boomboomboom boom boom boomboomboom
partymarty25,Fri May 01 07:28:25 IST 2015,take
partymarty25,Fri May 01 07:28:06 IST 2015,get babi get
partymarty25,Fri May 01 07:27:28 IST 2015,get right get tight
partymarty25,Fri May 01 07:26:15 IST 2015,yes tvs fla ocean i make call ps come keep leav town b tch
partymarty25,Fri May 01 07:24:34 IST 2015,i come hous monday throw tv window it best
partymarty25,Fri May 01 07:20:50 IST 2015,get job
partymarty25,Fri May 01 07:01:45 IST 2015,rt retweet welcom dawgpound
partymarty25,Fri May 01 06:54:31 IST 2015,the brown face mask get program it major news gobrown
partymarty25,Fri May 01 06:51:52 IST 2015,rt final the brown clock brownsdraft
partymarty25,Fri May 01 05:35:49 IST 2015,let joe thoma calib nfldraft shall
partymarty25,Thu Apr 30 06:27:48 IST 2015,rt i think tribe tonight
partymarty25,Wed Apr 29 02:01:34 IST 2015,rt news studi four aortic root procedur find safe durabl
partymarty25,Mon Apr 27 04:17:17 IST 2015,rt kevin love right that bush leagu
partymarty25,Mon Apr 27 01:10:05 IST 2015,rt
partymarty25,Mon Apr 27 01:10:02 IST 2015,rt cavsplayoff cavsnat cavsmania
partymarty25,Mon Apr 27 01:08:24 IST 2015,rule anytim cav breath playoff surpris took long
partymarty25,Mon Apr 27 01:06:36 IST 2015,thank espn championship comparison can go seri without point
partymarty25,Mon Apr 27 01:00:45 IST 2015,agre but think look get jone confid next seri
partymarty25,Mon Apr 27 00:40:43 IST 2015,ps jimmi watch pitch perfect even tho i offer fast forward sing part get guod case
partymarty25,Mon Apr 27 00:40:00 IST 2015,perfect storm stuff like
partymarty25,Mon Apr 27 00:05:14 IST 2015,yep well worth imo i love say imo thank set
partymarty25,Mon Apr 27 00:02:01 IST 2015,permish watch nba playoff
partymarty25,Sun Apr 26 23:57:10 IST 2015,rt the cav motto seri
partymarty25,Sun Apr 26 23:56:33 IST 2015,rt perkin point rebound entri forev heart cav fan everywher
partymarty25,Sun Apr 26 23:55:48 IST 2015,pretti sure one pass ball put commit manslaught
partymarty25,Sun Apr 26 23:55:12 IST 2015,perkin pretti much come cav game destroy peopl put celtic azz it hilari beauti
partymarty25,Sun Apr 26 23:37:20 IST 2015,if i play perkin came i fall play dead gocav messagereceiv
