username,time,tweet
a_legs,Thu Apr 23 19:25:18 IST 2015,my bro idea quit smoke bum still end smoke cig night logic lol
a_legs,Wed Apr 22 18:06:41 IST 2015,rt cri new
a_legs,Wed Apr 22 09:43:08 IST 2015,perfect new fave banana egg pancak getinmabelli tomorrowsbreakfast
a_legs,Wed Apr 22 07:04:46 IST 2015,ugh i know but fit i like loos top also mani tank top i like sleev
a_legs,Wed Apr 22 06:40:33 IST 2015,mayb birthday i request box questbar whoever get present lol
a_legs,Wed Apr 22 06:37:51 IST 2015,i desper need new workout top never find style i like someth flatter suggest
a_legs,Sun Apr 19 03:46:57 IST 2015,rt my life constant cycl eat food plan i go eat next
a_legs,Sun Apr 19 03:44:25 IST 2015,in kinda mood i wanna eat everyth sight wahh help
a_legs,Sun Apr 19 03:32:00 IST 2015,rt ariana dad told big sean what up on his insta post lmaoooo
a_legs,Sun Apr 19 03:10:16 IST 2015,rt beauti beauti day
a_legs,Sat Apr 18 05:46:19 IST 2015,i alway watch show mtv that weird
a_legs,Sat Apr 18 05:45:04 IST 2015,hiii thank follow i love hair avi rad
a_legs,Sat Apr 18 05:12:44 IST 2015,rt one day combat boot laci crop top next day air forc snoop dogg tee wear u want
a_legs,Fri Apr 17 20:11:58 IST 2015,rt conceit look better confid i look good love beauti conceit vs confid
a_legs,Fri Apr 17 10:44:02 IST 2015,rt beauti far depth see it inner conscienc word justic
a_legs,Fri Apr 17 10:43:49 IST 2015,if look lose go play slot lmfao woodbin
a_legs,Fri Apr 17 10:43:15 IST 2015,i get point necessari mean white
a_legs,Fri Apr 17 10:42:36 IST 2015,i use word usual mix w mani race uniqu look i would love b call exot
a_legs,Thu Apr 16 21:44:54 IST 2015,rt beer chang sold new locat new tax rais million price cap till onpoli
a_legs,Thu Apr 16 10:19:56 IST 2015,rt restaur messag dumpster diver goe viral
a_legs,Thu Apr 16 01:10:16 IST 2015,rt thank student amaz semest good luck exam safe happi
a_legs,Wed Apr 15 06:48:31 IST 2015,brb gunna go take shower wash bullshit ugh fedup
a_legs,Wed Apr 15 04:32:35 IST 2015,rt fall love
a_legs,Tue Apr 14 09:49:45 IST 2015,rt comfort number one taurus
a_legs,Mon Apr 13 03:51:15 IST 2015,netflix pleas cooper its long day i wanna relax
a_legs,Sun Apr 12 03:43:48 IST 2015,pictur black screen
a_legs,Sat Apr 11 19:37:56 IST 2015,rt toronto polic look miss autist boy last seen weston eglinton white stocki wear black jacket
a_legs,Sat Apr 11 19:33:43 IST 2015,rt if eye saw soul instead bodi differ would perceiv beauti
a_legs,Sat Apr 11 19:32:45 IST 2015,rt toronto polic say look year old boy autism gone miss weston road eglinton
a_legs,Sat Apr 11 09:11:35 IST 2015,he peel pass half repeat tangerin yum
a_legs,Sat Apr 11 09:10:12 IST 2015,chain eat tangerin
a_legs,Sat Apr 11 09:07:16 IST 2015,you appreci warmth feel cold
a_legs,Sat Apr 11 02:06:40 IST 2015,i understand peopl still get catfish
a_legs,Fri Apr 10 10:19:52 IST 2015,rt you butterfli
a_legs,Fri Apr 10 09:51:12 IST 2015,how stay motiv gym
a_legs,Fri Apr 10 09:26:36 IST 2015,rt this import greatest thing i seen
a_legs,Thu Apr 09 19:23:57 IST 2015,rt i stop look
a_legs,Tue Apr 07 20:00:53 IST 2015,the elwin so down low yourwelcom hearditontheedg
a_legs,Sat Apr 04 21:39:45 IST 2015,rt once start wear leg pant realli go back
a_legs,Sat Apr 04 02:21:14 IST 2015,rt straight womb teach girl hate bodi teach boy super
a_legs,Fri Apr 03 19:58:09 IST 2015,rt love women empow women uplift
a_legs,Fri Apr 03 10:43:24 IST 2015,sugar maroon jam
a_legs,Fri Apr 03 00:23:12 IST 2015,rt look neighbor bowl see if look see
a_legs,Fri Apr 03 00:23:03 IST 2015,rt stop tri outdo neighbor
a_legs,Thu Apr 02 21:40:51 IST 2015,coffe tea
a_legs,Thu Apr 02 21:07:41 IST 2015,i would wear blue today realist i sit home pj day write essay
a_legs,Thu Apr 02 21:07:00 IST 2015,it autism awar day show support wear blue autismawar aba behaviouralsci student
a_legs,Thu Apr 02 21:04:15 IST 2015,rt i wear light blue autismawar special ta selfi
a_legs,Thu Apr 02 21:03:36 IST 2015,rt today world autism awar day we love someon autism pleas wear blue today
