username,time,tweet
iwlocal97,Mon Feb 29 00:55:19 IST 2016,what a great idea say excess extraordinarili badidea
iwlocal97,Mon Feb 29 00:36:08 IST 2016,being ironwork flex muscl doingitright
iwlocal97,Mon Feb 29 00:02:32 IST 2016,rt metal theft throughout metro vancouv
iwlocal97,Sat Feb 27 07:28:12 IST 2016,does mean ok breach incom tax act bclab ridicul
iwlocal97,Sat Feb 27 07:23:58 IST 2016,serious meant play teas tri live stereotyp if got lol consid success
iwlocal97,Fri Feb 26 05:48:21 IST 2016,rt littl walk crane posit galleri bridg tie
iwlocal97,Fri Feb 26 05:47:53 IST 2016,thnx pic brother keep come
iwlocal97,Fri Feb 26 05:35:07 IST 2016,ironwork defin workinghard day long
iwlocal97,Fri Feb 26 04:45:26 IST 2016,ironwork keep look hashtag describ workinghard seem mean thought
iwlocal97,Fri Feb 26 04:10:26 IST 2016,gotta love quot we union union someth connect well said brother ironwork
iwlocal97,Tue Feb 23 04:07:14 IST 2016,someth ironwork might say
iwlocal97,Wed Feb 17 06:37:50 IST 2016,rt old vs new
iwlocal97,Wed Feb 17 06:35:39 IST 2016,thank
iwlocal97,Tue Feb 16 00:11:39 IST 2016,our dispatch paul beacom gather team travel haiti prove ironwork heart
iwlocal97,Sat Feb 13 09:03:29 IST 2016,member interest reinforc class begin middl march call hall
iwlocal97,Fri Feb 12 02:24:57 IST 2016,univers wisconsin ironwork film explor cultur ironwork
iwlocal97,Wed Feb 10 04:42:59 IST 2016,rodbust joe via ironwork
iwlocal97,Wed Feb 10 04:37:29 IST 2016,rt america sold myth year degre ticket solid futur
iwlocal97,Wed Feb 10 04:20:42 IST 2016,rt stationcdrkelli space walk remind ironwork day astronaut like ironwork space
iwlocal97,Wed Feb 10 04:10:37 IST 2016,so print progress along here steel bike frame print ironwork
iwlocal97,Thu Feb 04 04:46:29 IST 2016,like to ny stat show correl death happen non union site canlab ironwork
iwlocal97,Thu Feb 04 03:15:09 IST 2016,rt food thought worktogeth unionstrong iammyunion
iwlocal97,Sat Jan 30 05:36:45 IST 2016,so agre but think take american sign no worker anywher live poverti
iwlocal97,Sat Jan 30 05:04:27 IST 2016,or take time tough ironwork start slow safe get apprenticeship join union
iwlocal97,Wed Jan 27 05:47:59 IST 2016,win lose welcom canlab organ drive it like posit benefit
iwlocal97,Wed Jan 27 05:33:46 IST 2016,women ironwork yep near femal member celebr women trade vdlc event
iwlocal97,Wed Jan 27 05:13:41 IST 2016,ironwork member interest take advantag educ opportun call
iwlocal97,Tue Jan 26 04:43:34 IST 2016,richard trumka afl cio canlab ironwork
iwlocal97,Tue Jan 26 04:17:28 IST 2016,rt union worker stand togeth collect level play field
iwlocal97,Sat Jan 23 05:51:13 IST 2016,rt thu jan labour tell elit davo focus job creation how women construct worker use net
iwlocal97,Sat Jan 23 04:46:07 IST 2016,welcom offic come the view great
iwlocal97,Sat Jan 23 04:39:42 IST 2016,prevent death bc construct worker last yr larg due asbesto
iwlocal97,Fri Jan 22 05:48:23 IST 2016,rt the sky limit learn ironwork apprentic
iwlocal97,Fri Jan 22 05:04:46 IST 2016,rt ny public advoc jame build safer union way
iwlocal97,Fri Jan 22 04:33:56 IST 2016,it challeng ironwork job consid choos trade apprenticeship
iwlocal97,Thu Jan 21 06:19:02 IST 2016,ontario worksit inspect blitz found employ violat employ standard
iwlocal97,Thu Jan 21 05:42:21 IST 2016,rt break down old percept interview union ironwork tradeswomen advoc
iwlocal97,Thu Jan 21 05:32:35 IST 2016,bad boss happen less someon worker easili talk legal advic
iwlocal97,Tue Jan 19 06:02:46 IST 2016,middl class union go hand hand build stronger canadian economi ironwork
iwlocal97,Sat Jan 16 03:07:09 IST 2016,before everyon ironwork footag safeti come long way sinc
iwlocal97,Fri Jan 15 08:00:31 IST 2016,rt be conscious consum
iwlocal97,Fri Jan 15 05:44:23 IST 2016,data indic impress growth last two year five valu ad sector
iwlocal97,Fri Jan 15 05:39:12 IST 2016,decad common hazard main caus fatal ironwork
iwlocal97,Wed Jan 13 05:35:23 IST 2016,solidar brethren ironwork work cs wind fight fair
iwlocal97,Tue Jan 12 05:56:34 IST 2016,reason join union collect bargain
iwlocal97,Tue Jan 12 04:58:53 IST 2016,reason join union job secur union workplac tend far lower worker turnov
iwlocal97,Tue Jan 12 04:29:10 IST 2016,reason join union imf say declin union direct corel growth incom inequ
iwlocal97,Tue Jan 12 04:16:55 IST 2016,rt cross canada rout sever ontario bridg appear split apart
iwlocal97,Sat Jan 09 04:39:39 IST 2016,rt a look basic curv steel process anyth basic steelshot
iwlocal97,Sat Jan 09 03:51:31 IST 2016,what favourit ironwork video
