username,time,tweet
VonnyB76,Fri Feb 26 23:09:47 IST 2016,mayb i made wrong choic school ridgewat i come
VonnyB76,Fri Feb 26 22:47:43 IST 2016,thank nfl network not like i want watch combin anyth
VonnyB76,Thu Feb 25 09:47:08 IST 2016,rt this better damn daniel
VonnyB76,Thu Feb 18 11:28:13 IST 2016,rt being mr nice seem alway bite ass
VonnyB76,Fri Feb 12 18:41:46 IST 2016,rt
VonnyB76,Mon Feb 08 08:05:59 IST 2016,rt the nfl take credit unprotect sex real product sex sing creepiest thing i
VonnyB76,Fri Feb 05 05:16:02 IST 2016,rt lol i hate
VonnyB76,Tue Jan 26 11:01:11 IST 2016,haha welcom amanda
VonnyB76,Tue Jan 26 10:58:24 IST 2016,rt aaawww love never thought i ever hear word come mouth
VonnyB76,Tue Jan 26 10:55:25 IST 2016,yes dead serious proud colleg teach someth
VonnyB76,Tue Jan 26 10:51:21 IST 2016,btw impress tweet late all grammat correct go amanda
VonnyB76,Tue Jan 26 10:47:09 IST 2016,one true love alway food
VonnyB76,Fri Jan 22 06:39:50 IST 2016,rt so true
VonnyB76,Sat Jan 16 01:07:04 IST 2016,rt
VonnyB76,Fri Jan 15 21:49:54 IST 2016,rt not hero wear cape
VonnyB76,Fri Jan 15 02:12:41 IST 2016,
VonnyB76,Sat Jan 09 23:39:03 IST 2016,possibl buddi sun rise set time
VonnyB76,Mon Jan 04 10:17:35 IST 2016,rt never happier life i rn skol
VonnyB76,Mon Jan 04 10:15:45 IST 2016,rt nfc north champion vike
VonnyB76,Mon Jan 04 07:25:45 IST 2016,rt yds fake punt return fmr minn state wr
VonnyB76,Mon Jan 04 02:19:29 IST 2016,dictionari word douch pictur cutler
VonnyB76,Sun Dec 13 20:00:26 IST 2015,minorbuddiesforlif
VonnyB76,Fri Dec 11 00:57:06 IST 2015,wow woulda thought
VonnyB76,Mon Dec 07 11:37:03 IST 2015,hey good look
VonnyB76,Mon Dec 07 11:35:43 IST 2015,sinc offici monday mcm goe caus pull ladi
VonnyB76,Mon Dec 07 00:51:54 IST 2015,rt i apolog nice thing i said exum less one hour ago
VonnyB76,Mon Nov 30 07:02:29 IST 2015,rt peopl constant complain everi littl thing
VonnyB76,Wed Nov 25 01:04:56 IST 2015,rt
VonnyB76,Fri Nov 20 02:54:18 IST 2015,rt skol ninosock mnwild
VonnyB76,Thu Nov 05 13:19:21 IST 2015,love fall asleep piss
VonnyB76,Mon Nov 02 10:25:49 IST 2015,rt would someon pleas tell harold reynold differ delay steal read pitch
VonnyB76,Mon Nov 02 08:21:23 IST 2015,rt don stand way
VonnyB76,Sun Nov 01 21:33:06 IST 2015,rt share care
VonnyB76,Thu Oct 29 00:45:33 IST 2015,rt
VonnyB76,Wed Oct 28 10:52:06 IST 2015,rt hosmer walk bottom
VonnyB76,Tue Oct 27 09:13:31 IST 2015,rt mnf guy highlight best safeti nfl erron omit harrison smith they must watch uninform
VonnyB76,Mon Oct 26 01:36:03 IST 2015,anybodi els see mike zimmer put dip game
VonnyB76,Sun Oct 25 11:11:23 IST 2015,rt i guess say f kato new thing not cool guy sick congrat suck anyway
VonnyB76,Sun Oct 25 06:27:26 IST 2015,i guess answer lol
VonnyB76,Sat Oct 24 09:25:48 IST 2015,lorenzo cain ridicul
VonnyB76,Thu Oct 22 19:55:46 IST 2015,thursday buddi
VonnyB76,Thu Oct 22 09:11:11 IST 2015,rt quick peek tulo swing nolan arenado piec
VonnyB76,Tue Oct 20 09:40:23 IST 2015,
VonnyB76,Tue Oct 20 01:56:28 IST 2015,you know colleg take nap class pass lectur
VonnyB76,Fri Oct 16 05:31:30 IST 2015,rt lepel hit solo shot opposit field second home run seri white lead
VonnyB76,Fri Oct 16 00:18:36 IST 2015,truer word never spoken
VonnyB76,Fri Oct 16 00:17:54 IST 2015,rt if i could punch everi worker summit face i would
VonnyB76,Wed Oct 14 22:56:57 IST 2015,good luck i pray
VonnyB76,Sun Oct 11 04:02:22 IST 2015,rt it oclock i broke hand ceil lamp
VonnyB76,Fri Oct 09 10:15:33 IST 2015,when bird fli apart
