username,time,tweet
iStefPayne,Fri May 15 22:57:05 IST 2015,just joke i love everybodi if come sit
iStefPayne,Fri May 15 22:53:16 IST 2015,rt william shatner leonard nimoy
iStefPayne,Fri May 15 18:36:36 IST 2015,washington bike work day may
iStefPayne,Fri May 15 14:44:58 IST 2015,i found one
iStefPayne,Fri May 15 03:41:49 IST 2015,streetsid charg station do exist
iStefPayne,Fri May 15 03:01:46 IST 2015,fragrant flower swipe lilac freesia
iStefPayne,Thu May 14 23:12:26 IST 2015,good find
iStefPayne,Thu May 14 21:07:47 IST 2015,serious serious i feel way least day facepalm
iStefPayne,Thu May 14 19:44:41 IST 2015,thank brighten million other feed starstuff
iStefPayne,Thu May 14 19:25:50 IST 2015,don want sit in tini nook mediterranean sea me to
iStefPayne,Thu May 14 17:44:10 IST 2015,ha yes great idea
iStefPayne,Thu May 14 02:57:44 IST 2015,foodporn everyth kitchen sink
iStefPayne,Thu May 14 02:29:20 IST 2015,memori imag fix word eras polo said perhap i afraid
iStefPayne,Wed May 13 20:40:52 IST 2015,wish i could credit artist great draw sentiment way heart pursuehappi
iStefPayne,Wed May 13 20:26:24 IST 2015,anoth awesom display area need repair replac art citylif via
iStefPayne,Wed May 13 20:18:57 IST 2015,bisoux petit fit
iStefPayne,Wed May 13 20:02:28 IST 2015,washington annual
iStefPayne,Wed May 13 19:41:01 IST 2015,sunset amazon river travelfar
iStefPayne,Wed May 13 18:34:08 IST 2015,sun show front dcmetro humpday humpdayhappi
iStefPayne,Wed May 13 18:29:21 IST 2015,thank amtrak train
iStefPayne,Tue May 12 19:46:09 IST 2015,eye eye
iStefPayne,Tue May 12 19:45:44 IST 2015,
iStefPayne,Tue May 12 19:12:08 IST 2015,good tuesday folk may cup fill brain bright idea today nasajpl coffeemuggin
iStefPayne,Tue May 12 16:58:48 IST 2015,i keep say i go stop swear i read thing like languagelov
iStefPayne,Mon May 11 19:39:21 IST 2015,a pictur poem without word horac
iStefPayne,Mon May 11 02:08:17 IST 2015,unexpect reaction when i quit job travel via followyourbliss
iStefPayne,Mon May 11 00:23:19 IST 2015,happymothersday mama penguin south georgia island
iStefPayne,Sun May 10 20:09:09 IST 2015,mothersdayquot saling mothersday momknowsbest
iStefPayne,Sun May 10 04:19:30 IST 2015,streetart dc travel home weekend
iStefPayne,Sat May 09 19:22:15 IST 2015,to abl leav ground fli marvel bomber fli overhead yesterday washington dc wwiiflyov
iStefPayne,Sat May 09 19:19:07 IST 2015,sea gala
iStefPayne,Sat May 09 18:39:21 IST 2015,each us societi us need understand
iStefPayne,Sat May 09 18:28:30 IST 2015,good saturday time get busi poolsid
iStefPayne,Sat May 09 18:15:31 IST 2015,fattenamovi lord the fri
iStefPayne,Sat May 09 17:53:50 IST 2015,nasa prototyp hunt for heartbeat amid nepal devast scienc technolog
iStefPayne,Sat May 09 17:17:45 IST 2015,i tend becom impress friend share name storm tropicalstormana
iStefPayne,Fri May 08 19:32:06 IST 2015,traveladdict followingbliss falkland
iStefPayne,Fri May 08 18:57:18 IST 2015,i come accept feel know i go and i train
iStefPayne,Fri May 08 16:52:00 IST 2015,rt tie dye
iStefPayne,Fri May 08 08:53:07 IST 2015,weekendsonthursday plan ahead tgit
iStefPayne,Fri May 08 05:15:36 IST 2015,cocktailhour hot summer south beg slushi w photo twitter instagram
iStefPayne,Fri May 08 04:46:46 IST 2015,insid hbo quest for emot truth
iStefPayne,Fri May 08 04:37:13 IST 2015,perfect show dc tuesday music
iStefPayne,Fri May 08 04:34:59 IST 2015,intim portrait bee
iStefPayne,Fri May 08 04:17:42 IST 2015,some day call glimps perspect i super excit get edit batch
iStefPayne,Fri May 08 02:43:43 IST 2015,overheard work inspir next generat explor ilovemyjob
iStefPayne,Thu May 07 21:56:20 IST 2015,i think still aliv interview photograph
iStefPayne,Thu May 07 21:51:34 IST 2015,so cool watch anyth launch launchamerica
iStefPayne,Thu May 07 21:48:39 IST 2015,south georgia island the land that time forgot
iStefPayne,Thu May 07 20:56:19 IST 2015,her face amaz beauti
