username,time,tweet
BittyGreeny,Mon Feb 29 13:32:25 IST 2016,thank support help realli make feel great
BittyGreeny,Mon Feb 29 11:41:21 IST 2016,rt scoreyperri hat trick puck letsgoduck
BittyGreeny,Mon Feb 29 10:30:31 IST 2016,quack
BittyGreeny,Mon Feb 29 02:07:30 IST 2016,happi birthday
BittyGreeny,Sun Feb 28 08:56:17 IST 2016,today best day food i poke lunch thai dinner dreamlif
BittyGreeny,Sun Feb 28 02:49:21 IST 2016,dog give confid tbh
BittyGreeny,Sat Feb 27 23:15:37 IST 2016,
BittyGreeny,Sat Feb 27 23:05:28 IST 2016,when jk rowl sassi tweet
BittyGreeny,Sat Feb 27 22:44:25 IST 2016,realpancakeart
BittyGreeny,Sat Feb 27 10:57:08 IST 2016,rt how feel go someon instagram week back
BittyGreeny,Sat Feb 27 08:01:49 IST 2016,rt me
BittyGreeny,Fri Feb 26 01:58:03 IST 2016,rt draco malfoy origin fangirl
BittyGreeny,Fri Feb 26 01:55:52 IST 2016,rt use b calcul slope hill life go
BittyGreeny,Thu Feb 25 21:45:16 IST 2016,rt happi birthday jame oliv phelp play fred georg weasley film mischief manag
BittyGreeny,Thu Feb 25 03:30:12 IST 2016,standard pictur
BittyGreeny,Thu Feb 25 00:24:11 IST 2016,rt this
BittyGreeny,Tue Feb 23 13:31:13 IST 2016,rt point gryffindor
BittyGreeny,Tue Feb 23 13:31:09 IST 2016,rt fafsa think parent annual salari gonna go straight colleg tuition like bill pay
BittyGreeny,Tue Feb 23 13:31:00 IST 2016,i stop buy sweater amazon
BittyGreeny,Tue Feb 23 03:04:13 IST 2016,most professor use first name i think sick
BittyGreeny,Mon Feb 22 06:23:45 IST 2016,rt tru
BittyGreeny,Sun Feb 21 23:21:49 IST 2016,rt this need to get more attent freekesha
BittyGreeny,Sun Feb 21 08:13:36 IST 2016,rt and sudden could play sirius remus
BittyGreeny,Sun Feb 21 07:58:44 IST 2016,rt the greatest blooper tv histori
BittyGreeny,Thu Feb 18 03:24:57 IST 2016,honest like ron weasley harri potter i start question valu friend
BittyGreeny,Thu Feb 18 00:07:55 IST 2016,rt
BittyGreeny,Tue Feb 16 01:43:25 IST 2016,rt me
BittyGreeny,Tue Feb 16 01:23:23 IST 2016,rt this
BittyGreeny,Sun Feb 14 08:24:52 IST 2016,rt happi anniversari ryan kelli lol
BittyGreeny,Fri Feb 12 17:33:19 IST 2016,it i go sleep
BittyGreeny,Fri Feb 12 09:56:39 IST 2016,rt neopet cyber dystopia
BittyGreeny,Thu Feb 11 23:50:44 IST 2016,when class gonna go get
BittyGreeny,Thu Feb 11 22:42:58 IST 2016,to girl wear pjs school i feel
BittyGreeny,Thu Feb 11 03:31:58 IST 2016,rt ron hermion throughout seri
BittyGreeny,Mon Feb 08 06:45:17 IST 2016,rt i care superbowl last time i honest care big sport event voldemort return
BittyGreeny,Sun Feb 07 08:49:18 IST 2016,rt yolouyhh you only live once unless you have horcrux
BittyGreeny,Fri Feb 05 01:51:08 IST 2016,class got cancel i listen teacher lectur us histori english today
BittyGreeny,Wed Feb 03 03:21:35 IST 2016,overheard convers is super bowl today saturday bruhhhhh
BittyGreeny,Wed Feb 03 00:35:18 IST 2016,my african danc teacher alway min late class
BittyGreeny,Tue Feb 02 08:22:17 IST 2016,rt me school vs weekend
BittyGreeny,Tue Feb 02 00:27:17 IST 2016,sorri i late class professor wind push back bed morn
BittyGreeny,Mon Feb 01 21:36:40 IST 2016,rt wingardium leviorca
BittyGreeny,Mon Feb 01 12:13:47 IST 2016,it offici i go new york
BittyGreeny,Mon Feb 01 06:41:10 IST 2016,rt a appreci harri potter quot
BittyGreeny,Sun Jan 31 07:55:05 IST 2016,rt count lucki inde get behind scene glimps
BittyGreeny,Fri Jan 29 07:44:52 IST 2016,rt a theori fight air battl seven potter
BittyGreeny,Fri Jan 29 06:27:12 IST 2016,rt pictur
BittyGreeny,Fri Jan 29 06:26:36 IST 2016,rt bearlikeson you are dog now
BittyGreeny,Thu Jan 28 22:44:24 IST 2016,rt when read receipt know alway phone
BittyGreeny,Thu Jan 28 22:44:13 IST 2016,rt if bad day dog graduat puppi train
