username,time,tweet
nikknikk_e,Tue May 26 07:19:32 IST 2015,i imagin know pilot hire cream crop gladtobegon
nikknikk_e,Tue May 26 06:35:09 IST 2015,just know still seat lunch tabl i miss beej maybesomejello maybesomechocolatemilk
nikknikk_e,Mon May 25 06:59:10 IST 2015,i think handbag weigh much small child airbagoff toomuchstuffinther
nikknikk_e,Sat May 23 05:31:05 IST 2015,tmasengil tuesday movi night somethingsneverchang haha
nikknikk_e,Tue May 19 08:20:06 IST 2015,just friend remind summervac
nikknikk_e,Tue May 19 07:52:01 IST 2015,lord know i tri
nikknikk_e,Sat May 16 04:09:46 IST 2015,i got lil buddi weekend
nikknikk_e,Tue May 12 05:59:06 IST 2015,so good angri vegetarian sushi harpoonharri pigeonforg
nikknikk_e,Mon May 04 08:54:08 IST 2015,idk i live but i guess i find soon almostmovingday
nikknikk_e,Tue Apr 28 08:25:04 IST 2015,if i cut chanc hand scissor truth
nikknikk_e,Sat Apr 25 05:17:16 IST 2015,look cook supper aunt brandi parker
nikknikk_e,Sat Apr 25 03:32:55 IST 2015,i think i person go garthinknoxvill concert east tennesse justnotafaniguess
nikknikk_e,Fri Apr 24 17:44:47 IST 2015,a person chase two rabbit catch neither thoughtforthday truth
nikknikk_e,Thu Apr 23 16:41:16 IST 2015,dude i shave week ago hahaha
nikknikk_e,Mon Apr 20 09:24:35 IST 2015,mmmmm hmmmm girl
nikknikk_e,Mon Apr 20 07:35:54 IST 2015,disappoint will def go back bigger group men right ladi lol
nikknikk_e,Sun Apr 19 09:54:07 IST 2015,rt the best friendship tend peopl open weird sarcast without person take
nikknikk_e,Tue Apr 14 00:44:13 IST 2015,i like mail like mademyday bestemployerev birthdaymoney
nikknikk_e,Wed Apr 08 08:08:52 IST 2015,oh i bought pair i one wear bahahaha i let decid
nikknikk_e,Wed Apr 08 07:24:23 IST 2015,i nerd i bought next weekend waverlyhil nighttour
nikknikk_e,Tue Apr 07 21:00:13 IST 2015,rt you cannot find peac avoid life
nikknikk_e,Tue Apr 07 19:40:53 IST 2015,just convo dermatologist nurs probabl suit episod dr phil confus lovelifeadvis
nikknikk_e,Sat Apr 04 07:01:02 IST 2015,parker color happi dinosaur birthday even wrap lovethatlittleboy
nikknikk_e,Wed Apr 01 09:42:03 IST 2015,i slept bed day oh i miss
nikknikk_e,Wed Mar 25 07:41:10 IST 2015,i alreadi prepar septemb cruis verabradley beachtowel beachtot petalpaisley
nikknikk_e,Wed Mar 25 04:57:36 IST 2015,i miss old neighborhood meth hous walk pill window bulli kid trailer park they realli need move
nikknikk_e,Mon Mar 23 07:50:14 IST 2015,my mom best homemad chocol gravi biscuit dontjudgem lovebeingfromthesouth
nikknikk_e,Sun Mar 22 23:19:18 IST 2015,miss visit soon promis
nikknikk_e,Sun Mar 22 08:20:57 IST 2015,rt there love without forgiv forgiv without love
nikknikk_e,Wed Mar 11 06:04:30 IST 2015,parker love peep
nikknikk_e,Tue Mar 10 21:51:50 IST 2015,love miss beej
nikknikk_e,Sat Mar 07 09:25:08 IST 2015,via
nikknikk_e,Thu Mar 05 04:10:11 IST 2015,rt i realiz friend askhol
nikknikk_e,Thu Mar 05 04:08:52 IST 2015,i guess everybodi song bahahahaha betterlatethannev
nikknikk_e,Wed Mar 04 23:37:46 IST 2015,the thing i see stuff happen daili basi even made strang bizarr
nikknikk_e,Wed Mar 04 08:12:56 IST 2015,it good feel know someon miss
nikknikk_e,Tue Mar 03 16:50:31 IST 2015,knowledg know say wisdom know whether say wiseword truth
nikknikk_e,Mon Mar 02 18:10:41 IST 2015,rt being posit negat situat naiv it leadership
nikknikk_e,Mon Mar 02 18:09:10 IST 2015,rt everyon need support system motivationn morninginspir
nikknikk_e,Sun Mar 01 18:46:12 IST 2015,being reject someth good mean point toward someth better truth lifeisgood
nikknikk_e,Fri Feb 27 07:15:48 IST 2015,these two insepar papawsboy
nikknikk_e,Fri Feb 27 01:12:07 IST 2015,i offici caribbean carnivalcruis
nikknikk_e,Fri Feb 27 01:09:03 IST 2015,rt ice t review fifti shade grey it could nickelodeon
nikknikk_e,Thu Feb 26 18:49:19 IST 2015,i fan adult snow day i got bill pay snowday closedfortheday
nikknikk_e,Tue Feb 24 17:48:13 IST 2015,i love get woke morn day cowork mad snow takeasnowday gobuildasnowman
nikknikk_e,Tue Feb 24 02:59:45 IST 2015,truth
nikknikk_e,Sat Feb 21 07:12:24 IST 2015,worst deliveri servic driver if busi ship lose busi done
nikknikk_e,Fri Feb 20 09:55:23 IST 2015,i miss moe moe
