username,time,tweet
st8zee,Mon Jan 11 06:36:03 IST 2016,oh rickygervai if egg crusti dusti i would smarmi progeni goldenglob
st8zee,Mon Jan 11 06:14:19 IST 2016,jaimiealexand redcarpet goldenglob micdrop boom
st8zee,Mon Jan 11 06:06:35 IST 2016,swoon
st8zee,Mon Jan 11 06:05:47 IST 2016,fa love pa
st8zee,Mon Jan 11 06:04:24 IST 2016,if i could freakyfriday anyon would jlaw what i chick i chang mind goldenglob
st8zee,Mon Jan 11 06:02:53 IST 2016,is weird watch themartian i crave pootato goldenglob
st8zee,Mon Jan 11 06:01:14 IST 2016,rt gaga arriv goldenglob
st8zee,Mon Jan 11 06:00:51 IST 2016,ladygaga waist must inch dress styletast goldenglob
st8zee,Mon Jan 11 05:59:05 IST 2016,great film hope mass get messag thebigshort
st8zee,Mon Jan 11 05:58:14 IST 2016,seem legit
st8zee,Mon Jan 11 05:57:43 IST 2016,trailer freakin epic goldenglob
st8zee,Mon Jan 11 05:54:46 IST 2016,jamiefoxx swoon goldenglob
st8zee,Mon Jan 11 05:51:01 IST 2016,this made pee littl goldenglob
st8zee,Mon Jan 11 05:49:14 IST 2016,rt watch taraji p henson hit everi singl damn pose best thing i see night slayon goldenglob
st8zee,Mon Jan 11 05:48:58 IST 2016,rt rickygervai bring enthusiasm goldenglob
st8zee,Mon Jan 11 05:48:15 IST 2016,if i could freakyfriday anyon would amyschum goldenglob
st8zee,Sun Jan 10 01:11:55 IST 2016,mayb commit issu i find i realli dig varietalwin
st8zee,Thu Dec 31 22:17:53 IST 2015,rt retweet share this photo beerwithfriend newyearsev newyearsday newyearsdayparad newyear worldrecord
st8zee,Wed Dec 30 23:49:55 IST 2015,boo hiss cbsstudio paramount i posit reboot larg part thank buzz creat axanar
st8zee,Wed Dec 23 03:48:28 IST 2015,sooo i may prematur i call elnino noshowpunkassbitch mybad
st8zee,Tue Dec 22 23:48:53 IST 2015,i nerdgasm hard i broke tooth
st8zee,Tue Dec 22 23:47:47 IST 2015,randomthingsthatmakemehappi that moment get shower clean nekk envelop steami good
st8zee,Mon Dec 21 00:16:46 IST 2015,celebr return gilmoregirl new ep coffeecoffeecoffe brownsugarcinnamonpoptart netflix complet
st8zee,Sun Dec 20 08:58:42 IST 2015,make chocol dip peanut butter m m ball holiday cooki exchang tomorrow i hope friend enjoy type diabet eyerol
st8zee,Thu Dec 17 18:10:33 IST 2015,rt los angel seinfeldapart almost open melros ave
st8zee,Mon Dec 14 07:04:49 IST 2015,help make happen our dirti laundri
st8zee,Sat Dec 12 07:01:16 IST 2015,excel make one design driver hold back hair need drunkwithpow
st8zee,Fri Dec 11 06:02:45 IST 2015,made techgasm hard
st8zee,Thu Dec 10 02:34:56 IST 2015,time get showtim
st8zee,Thu Dec 10 02:30:32 IST 2015,time get showtim
st8zee,Wed Dec 09 09:13:11 IST 2015,haveyaev shower good someon stab yeah i ok
st8zee,Tue Dec 08 11:43:22 IST 2015,i support beerwithfriend
st8zee,Mon Dec 07 08:53:46 IST 2015,did guy shoot willowstudio
st8zee,Mon Dec 07 00:38:49 IST 2015,that moment realiz hair colorin reader car should interest feelinmyway girlproblem
st8zee,Sun Dec 06 22:17:54 IST 2015,best thing lalif bagel einsteinbrosbagel
st8zee,Sun Dec 06 01:53:25 IST 2015,is weird i teamgerhardt dontwannaberight
st8zee,Sat Dec 05 01:21:41 IST 2015,preach
st8zee,Sat Dec 05 01:21:02 IST 2015,rt velvet revolv pay touch tribut old friend bandmat scott weiland
st8zee,Sat Dec 05 01:20:46 IST 2015,noth nicer wake littl love go feed thank get ball roll tgif tweep
st8zee,Thu Dec 03 02:00:46 IST 2015,peopl for christ sake useyourword prayersforsanberdu
st8zee,Wed Dec 02 12:01:03 IST 2015,drinkin red red wine coffe mug stayinclassi movingproblem
st8zee,Tue Nov 24 13:19:47 IST 2015,freakin brilliant dontchaknow youbetcha
st8zee,Mon Nov 16 11:54:16 IST 2015,only ep that buttsteakidioci right
st8zee,Thu Nov 12 06:25:26 IST 2015,you work girl that pie sky livingthedream
st8zee,Thu Nov 12 06:23:46 IST 2015,final caught i firm believ take accomplish
st8zee,Tue Nov 10 15:09:30 IST 2015,holi crap is ronald reagan
st8zee,Tue Nov 10 11:38:49 IST 2015,lovin in
st8zee,Sun Nov 08 13:57:10 IST 2015,welcom twittispher
st8zee,Fri Nov 06 11:48:51 IST 2015,great see tonight
