username,time,tweet
fabscarrillo,Thu Feb 25 07:57:05 IST 2016,everyon right stupid abus privileg
fabscarrillo,Thu Feb 25 07:56:08 IST 2016,socialmediamarket elimin middleman give brand opportun direct relationship audienc
fabscarrillo,Thu Feb 25 04:15:12 IST 2016,the troubl life background music
fabscarrillo,Thu Feb 25 04:07:12 IST 2016,a posit attitud may solv problem annoy enough peopl make worth effort
fabscarrillo,Thu Feb 25 02:36:51 IST 2016,lydia martin definit charm way safeti who would surviv
fabscarrillo,Thu Feb 25 01:48:22 IST 2016,yes millenni work hard real problem old peopl make much
fabscarrillo,Thu Feb 25 01:42:51 IST 2016,everyth read socialmedia necessarili realiti wednesdaywisdom
fabscarrillo,Thu Feb 25 01:41:59 IST 2016,truth
fabscarrillo,Thu Feb 25 01:41:39 IST 2016,i discours self fulfil socialmedia
fabscarrillo,Thu Feb 25 01:40:32 IST 2016,rt most peopl present curat version social media forget you never know peopl
fabscarrillo,Thu Feb 25 01:40:06 IST 2016,rt event target allow easili connect brand live audienc power result
fabscarrillo,Wed Feb 24 11:31:12 IST 2016,so lydia connect the beast a descend someon involv i need answer argent teenwolf whoisthebeast
fabscarrillo,Wed Feb 24 03:23:04 IST 2016,today music popcultur christinaaguilera grammi best new artist first grammi
fabscarrillo,Wed Feb 24 01:49:23 IST 2016,play socialmedia predict year old millenni rip year old yelp employe got fire
fabscarrillo,Wed Feb 24 01:13:23 IST 2016,wordsofwisdom
fabscarrillo,Wed Feb 24 01:12:19 IST 2016,again socialmedia fad stay learn use busi person need
fabscarrillo,Wed Feb 24 01:11:17 IST 2016,socialmedia use wise generat enough awar help creat much need chang societi
fabscarrillo,Tue Feb 23 10:46:36 IST 2016,great list popcultur junki cours millenni
fabscarrillo,Tue Feb 23 10:44:39 IST 2016,time well spent millenni
fabscarrillo,Tue Feb 23 10:43:20 IST 2016,themoreyouknow
fabscarrillo,Tue Feb 23 04:46:11 IST 2016,the struggl real mondaymotiv
fabscarrillo,Tue Feb 23 04:44:53 IST 2016,socialmedia tool enhanc mutual benefit market strategi
fabscarrillo,Tue Feb 23 04:01:06 IST 2016,if content king convers queen socialmediamarket socialmedia
fabscarrillo,Tue Feb 23 03:47:42 IST 2016,what depict fiction e socialmedia realiti keep expect realist key
fabscarrillo,Tue Feb 23 03:46:25 IST 2016,rt the entrepreneur field guid to use social media channel
fabscarrillo,Mon Feb 22 04:43:18 IST 2016,rt tonight nbc i host ultim reunion cast will grace taxi frasier friend mustseetv
fabscarrillo,Mon Feb 22 04:42:56 IST 2016,everi model see socialmedia e g instagram actual model fakesocialmediafact
fabscarrillo,Mon Feb 22 04:34:32 IST 2016,increas social listen congress look boost email privaci increas socialmedia surveil
fabscarrillo,Mon Feb 22 04:33:53 IST 2016,rt the best moment life make social media
fabscarrillo,Sun Feb 21 05:58:15 IST 2016,earn attent creat someth interest valuabl publish onlin free socialmediamarket
fabscarrillo,Sun Feb 21 04:19:42 IST 2016,shareyourear disneyland fan encourag take part chariti campaign
fabscarrillo,Sat Feb 20 12:49:56 IST 2016,rt the dark side being millenni student debt
fabscarrillo,Sat Feb 20 12:49:06 IST 2016,truth
fabscarrillo,Sat Feb 20 04:02:21 IST 2016,the best relationship post socialmedia you look like need convinc happi
fabscarrillo,Sat Feb 20 03:42:12 IST 2016,the weird reason talk to yourself in public help keep you sane healthyhabit psycholog positivevib
fabscarrillo,Sat Feb 20 00:52:27 IST 2016,flashbackfriday
fabscarrillo,Sat Feb 20 00:51:46 IST 2016,what see socialmedia often realiti that someth keep mind
