username,time,tweet
Ariella_Matthea,Wed May 20 21:18:35 IST 2015,ain kind person stoop level
Ariella_Matthea,Wed May 20 14:17:47 IST 2015,ahh
Ariella_Matthea,Wed May 20 14:17:16 IST 2015,kaila ka
Ariella_Matthea,Wed May 20 08:32:25 IST 2015,annika myona padilla dablio ari
Ariella_Matthea,Tue May 19 14:26:46 IST 2015,kaila ka
Ariella_Matthea,Tue May 19 08:31:52 IST 2015,annika myona padilla dablio ari
Ariella_Matthea,Mon May 18 14:20:33 IST 2015,
Ariella_Matthea,Mon May 18 13:02:41 IST 2015,siya dli pwede mag sacrific pero ako pwede aish
Ariella_Matthea,Mon May 18 12:51:48 IST 2015,
Ariella_Matthea,Mon May 18 12:45:33 IST 2015,rt
Ariella_Matthea,Mon May 18 08:32:23 IST 2015,annika myona padilla dablio ari
Ariella_Matthea,Sun May 17 17:38:08 IST 2015,rt
Ariella_Matthea,Sun May 17 17:30:39 IST 2015,rt heartbreak gonna break hater gonna hate faker gonna fake potato gonna potat
Ariella_Matthea,Sun May 17 08:32:28 IST 2015,annika myona padilla dablio ari
Ariella_Matthea,Sat May 16 13:34:33 IST 2015,demand
Ariella_Matthea,Sat May 16 13:00:47 IST 2015,rt love
Ariella_Matthea,Sat May 16 12:55:31 IST 2015,rt got pasalub cousin wiiiieeee thank
Ariella_Matthea,Sat May 16 12:51:58 IST 2015,
Ariella_Matthea,Sat May 16 08:32:26 IST 2015,annika myona padilla dablio ari
Ariella_Matthea,Fri May 15 20:33:33 IST 2015,miss
Ariella_Matthea,Fri May 15 19:14:31 IST 2015,chocol toffe crunch mwah mwah
Ariella_Matthea,Fri May 15 16:21:58 IST 2015,rt current mood
Ariella_Matthea,Fri May 15 16:21:48 IST 2015,rt this everytim
Ariella_Matthea,Fri May 15 08:31:17 IST 2015,annika myona padilla dablio ari
Ariella_Matthea,Thu May 14 19:11:17 IST 2015,why slow
Ariella_Matthea,Thu May 14 18:45:35 IST 2015,psh user friend idc
Ariella_Matthea,Thu May 14 18:44:03 IST 2015,sino po yung rooki ng ls season
Ariella_Matthea,Thu May 14 18:13:33 IST 2015,rt their best middl outsid opposit awarde anak nang nag iisang coach ramil de jesus
Ariella_Matthea,Thu May 14 18:13:28 IST 2015,rt petron shopina philip lead la sall superstar
Ariella_Matthea,Thu May 14 18:12:41 IST 2015,it still pain
Ariella_Matthea,Thu May 14 16:35:53 IST 2015,hb
Ariella_Matthea,Thu May 14 16:33:17 IST 2015,rt best outsid spiker cha cruz pslafc
Ariella_Matthea,Thu May 14 16:31:57 IST 2015,deserv pa naman po siya masyado sayang
Ariella_Matthea,Thu May 14 16:22:01 IST 2015,bakit hindi siya yung nanalo ng best middl blocker award kahit place lang
Ariella_Matthea,Thu May 14 16:21:11 IST 2015,what kkd best middl blocker award o c mon
Ariella_Matthea,Thu May 14 16:14:30 IST 2015,sino po yung best blocker
Ariella_Matthea,Thu May 14 16:12:37 IST 2015,best blocker pls pls pls
Ariella_Matthea,Thu May 14 16:10:21 IST 2015,definit good year favorit volleybal team let wait hope
Ariella_Matthea,Thu May 14 16:08:52 IST 2015,well deserv
Ariella_Matthea,Thu May 14 16:05:40 IST 2015,set palang na hurot na ang akong tubig ug hinilaka sayang
Ariella_Matthea,Thu May 14 16:04:32 IST 2015,still best blocker block parti uaap
Ariella_Matthea,Thu May 14 16:01:58 IST 2015,i would want watch award ceremoni see tear might turn piec
Ariella_Matthea,Thu May 14 16:00:14 IST 2015,rt how chat know download beetalk go discov enter forum jessey de leon pleas
Ariella_Matthea,Thu May 14 15:59:45 IST 2015,abi marano today pslafc pslonsolarsport lol made day
Ariella_Matthea,Thu May 14 15:57:41 IST 2015,rapmonst style oh
Ariella_Matthea,Thu May 14 15:56:36 IST 2015,grabe tao man pud gud ni sila dli robot gakapuyun gyapun imagin big game in a day kaya consider pud mo uy
Ariella_Matthea,Thu May 14 15:52:53 IST 2015,still best blocker kkd
Ariella_Matthea,Thu May 14 15:51:27 IST 2015,this year may nit be realli for my fav team
Ariella_Matthea,Thu May 14 15:50:33 IST 2015,feel ate
Ariella_Matthea,Thu May 14 15:49:48 IST 2015,for me will alway be my champ
