username,time,tweet
benjiface1,Mon Feb 29 03:01:17 IST 2016,if one thing brown know qb evalu
benjiface1,Mon Feb 29 02:38:14 IST 2016,trust brown evalu sound like great idea
benjiface1,Mon Feb 29 02:14:49 IST 2016,i think content essenti right side i agre think olson would make list
benjiface1,Mon Feb 29 01:59:55 IST 2016,funni i think ask thing much man so mani young adult men complet tool
benjiface1,Mon Feb 29 01:38:55 IST 2016,rt game lead big sky two left
benjiface1,Mon Feb 29 01:38:25 IST 2016,rt wildcat win weber state beat montana that weber state win divis i program weareweb
benjiface1,Mon Feb 29 01:34:43 IST 2016,as parent daughter i agre olson great job
benjiface1,Mon Feb 29 00:57:43 IST 2016,rt trump rt nazi quot mussolini attack judg spanish refus condemn kkk that
benjiface1,Sun Feb 28 06:55:22 IST 2016,bummer
benjiface1,Sat Feb 27 02:58:46 IST 2016,the buck stop
benjiface1,Sat Feb 27 02:55:48 IST 2016,rt i imagin dunk contest joel bolomboy richaud gitten would look like
benjiface1,Fri Feb 26 21:01:58 IST 2016,rt steph curri career game pts make pointer the rest nba ever
benjiface1,Fri Feb 26 05:14:32 IST 2016,rt i promis i rig differenti sinc report start https
benjiface1,Thu Feb 25 20:17:58 IST 2016,
benjiface1,Thu Feb 25 19:21:08 IST 2016,rt the fact sasha vujac play jimmer madden a day contract prove sit bench ugh
benjiface1,Thu Feb 25 01:10:46 IST 2016,rt cham pain
benjiface1,Wed Feb 24 03:28:18 IST 2016,rt btw ronald reagan call senat confirm scotus justic elect year
benjiface1,Wed Feb 24 03:28:03 IST 2016,my origin comment even jimmer vs lin melo pout linsan melo selfish underachiev
benjiface1,Wed Feb 24 03:10:59 IST 2016,jimmer dribbl fine yes lin better defend
benjiface1,Wed Feb 24 03:08:18 IST 2016,will orrin hatch ever go away
benjiface1,Wed Feb 24 03:01:43 IST 2016,is modern day player overr melo i sure no playoff success massiv contract sink franchis
benjiface1,Wed Feb 24 02:34:23 IST 2016,not sure read comprehens good not sure melo hof er either i refer j lin situat
benjiface1,Wed Feb 24 01:58:44 IST 2016,yeah could use player like basketballsens
benjiface1,Wed Feb 24 01:38:55 IST 2016,just post thing greatmind burk might head third season
benjiface1,Wed Feb 24 01:37:48 IST 2016,trey burk alreadi perhap head third
benjiface1,Wed Feb 24 01:35:27 IST 2016,or petul über ball hog carmelo anthoni histori pout other get spotlight
benjiface1,Wed Feb 24 01:33:43 IST 2016,rt pro sport function meritocraci jimmer work hard fix hole appear confront unusu
benjiface1,Wed Feb 24 01:32:55 IST 2016,this
benjiface1,Wed Feb 24 01:27:21 IST 2016,kudo ask question
benjiface1,Wed Feb 24 01:26:04 IST 2016,look jimmer compar trey burk exampl jimmer come even ahead area despit far less min
benjiface1,Wed Feb 24 01:25:06 IST 2016,i think fair wonder whether jimmer would chanc nba differ racial background religion
benjiface1,Wed Feb 24 01:11:00 IST 2016,why knick fan expect jimmermania
benjiface1,Wed Feb 24 01:06:06 IST 2016,rt jimmer jimmer hashtag jimmer jimmer jimmertim jimmerrang melocallshimjimmi
benjiface1,Tue Feb 23 05:14:18 IST 2016,amaz still smrt peopl think jazz need burk score bench have watch jazz game three year
benjiface1,Tue Feb 23 04:56:43 IST 2016,afternoon duo continu call mack sheldon no fella shelvin
benjiface1,Tue Feb 23 01:45:38 IST 2016,whew mechan seem ligament injuri i nervous howev
benjiface1,Tue Feb 23 00:39:13 IST 2016,rt weber state joel bolomboy bone bruis left knee he undergo rehab timet
benjiface1,Tue Feb 23 00:38:12 IST 2016,me port por better option porti much like
benjiface1,Mon Feb 22 23:53:18 IST 2016,funni i envis
benjiface1,Mon Feb 22 23:40:05 IST 2016,in annal inter web stori stand alon
benjiface1,Mon Feb 22 23:36:08 IST 2016,sound book slam close
benjiface1,Mon Feb 22 23:21:05 IST 2016,love tell tweet love
benjiface1,Mon Feb 22 22:40:59 IST 2016,is anderson verejao even upgrad jason thompson not sure not sure matter either gsw
benjiface1,Mon Feb 22 22:37:02 IST 2016,carmelo unenthus jimmi fredett
benjiface1,Mon Feb 22 22:36:01 IST 2016,sos favor jazz vs portland even money vs houston
benjiface1,Mon Feb 22 22:34:15 IST 2016,outsid bold move everi afc team actual like idea bengal acquir jeffrey bengal
benjiface1,Mon Feb 22 22:31:58 IST 2016,ban
benjiface1,Mon Feb 22 22:31:24 IST 2016,those headlin awesom
benjiface1,Mon Feb 22 22:30:51 IST 2016,or yes read comprehens fail
benjiface1,Mon Feb 22 22:30:23 IST 2016,read dummi vol page
