username,time,tweet
RowdyFuller51,Sun Mar 20 04:28:47 IST 2016,forgot kyle need wreck car win race duh
RowdyFuller51,Sun Mar 20 04:28:05 IST 2016,rt kinda baffl austin other say kyle tri block last i check race car turn well
RowdyFuller51,Sun Mar 20 04:25:25 IST 2016,where cup driver won xfiniti hate
RowdyFuller51,Sun Mar 20 04:17:37 IST 2016,
RowdyFuller51,Sun Mar 20 04:17:28 IST 2016,rt kylebusch like
RowdyFuller51,Sun Mar 20 04:16:24 IST 2016,rt are happi kyle win oh wait anoth cup driver can agre excit finish
RowdyFuller51,Sun Mar 20 04:15:50 IST 2016,rt kyle busch almost win tire one craziest thing i ever seen
RowdyFuller51,Sun Mar 20 04:14:29 IST 2016,rt i say i want win flat tire sooooo bad
RowdyFuller51,Sun Mar 20 04:13:29 IST 2016,i know disappoint dude laugh not mad you lost less second flat tire
RowdyFuller51,Sun Mar 20 02:53:33 IST 2016,gamestopgiveaway awesom giveaway
RowdyFuller51,Sun Mar 20 02:49:58 IST 2016,rt we back fontana lap busch jone suàrez
RowdyFuller51,Sat Mar 19 22:57:05 IST 2016,come has someth better warm bed like pizza someth
RowdyFuller51,Sat Mar 19 14:25:19 IST 2016,rt dear ladi hold berni sander sign trump event fox news you know clinton vs sander
RowdyFuller51,Sat Mar 19 14:24:19 IST 2016,oh i say
RowdyFuller51,Sat Mar 19 08:10:15 IST 2016,updat twitter handl
RowdyFuller51,Fri Mar 18 08:57:29 IST 2016,rt lap offici retir race justin remain halifax night
RowdyFuller51,Fri Mar 18 07:36:20 IST 2016,rt lap caution nis fix lead
RowdyFuller51,Thu Mar 17 16:55:00 IST 2016,celebr year
RowdyFuller51,Thu Mar 17 02:29:14 IST 2016,i live i alway took back road avoid
RowdyFuller51,Wed Mar 16 07:32:31 IST 2016,
RowdyFuller51,Wed Mar 16 07:32:26 IST 2016,rt tell hornet nest trey respond good i hope i flip
RowdyFuller51,Wed Mar 16 06:02:53 IST 2016,good luck teammat tonight npasphoenix
RowdyFuller51,Wed Mar 16 02:48:03 IST 2016,zero those toy car
RowdyFuller51,Wed Mar 16 02:43:17 IST 2016,rt it s ncis day it s ncis day it s ncis day it s day hooray
RowdyFuller51,Tue Mar 15 21:50:11 IST 2016,rt good luck driver tonight watch live et link npasphoenix
RowdyFuller51,Tue Mar 15 03:52:36 IST 2016,final omfg must check clear steve
RowdyFuller51,Tue Mar 15 03:52:11 IST 2016,my random fantasi race pick fontana
RowdyFuller51,Mon Mar 14 23:37:18 IST 2016,rt last night carri team flag finish
RowdyFuller51,Mon Mar 14 09:34:01 IST 2016,rt we realli good camri today ran front bunch close get c get one next
RowdyFuller51,Mon Mar 14 01:57:18 IST 2016,rt kyle busch fan rememb kyle busch behind wheel tire
RowdyFuller51,Mon Mar 14 01:57:10 IST 2016,rt kylebusch fan tire pit stop
RowdyFuller51,Mon Mar 14 01:41:45 IST 2016,rt caution dale jr spin go turn one back hard outsid wall
RowdyFuller51,Sun Mar 13 21:37:34 IST 2016,rt i also want thank give great car along team kapusta help
RowdyFuller51,Sun Mar 13 21:36:05 IST 2016,i readi sweep weekend how everyon els
RowdyFuller51,Sun Mar 13 16:32:50 IST 2016,
RowdyFuller51,Sun Mar 13 02:08:14 IST 2016,ok tough guy
RowdyFuller51,Sun Mar 13 02:03:58 IST 2016,basic like hear top what race fan
RowdyFuller51,Sat Mar 12 22:41:09 IST 2016,rt car owner tom kapusta driver make sure set qualifi morn
RowdyFuller51,Sat Mar 12 20:58:09 IST 2016,rt good morn everyon it race day we great drive car i wait fun race https
RowdyFuller51,Sat Mar 12 15:34:57 IST 2016,well go therapi someth get old real quick
RowdyFuller51,Sat Mar 12 09:17:15 IST 2016,serious ever race clean why bad
RowdyFuller51,Sat Mar 12 07:27:44 IST 2016,rt rowdi close last week look like back faster ever phoenix
RowdyFuller51,Sat Mar 12 06:28:34 IST 2016,rt we learn everyth could first practic elect sit final practic can wait
RowdyFuller51,Sat Mar 12 02:13:21 IST 2016,rt prep rwr driven car
RowdyFuller51,Sat Mar 12 00:10:25 IST 2016,rt back action
RowdyFuller51,Sat Mar 12 00:09:58 IST 2016,rt it long busi night pack australia we way
RowdyFuller51,Fri Mar 11 21:00:49 IST 2016,good equip it alway doubl standard
RowdyFuller51,Fri Mar 11 21:00:29 IST 2016,person say ok landon run full time cup xfiniti
RowdyFuller51,Fri Mar 11 19:08:31 IST 2016,i hate peopl compar race stick ball sport worst argument ever
RowdyFuller51,Thu Mar 10 20:33:29 IST 2016,money give right hit her properti say anyth illeg
