username,time,tweet
MatthewKent18,Fri Nov 20 15:58:40 IST 2015,i need soulmat
MatthewKent18,Fri Nov 20 15:58:10 IST 2015,respect elder you hear quit often hous quot chines
MatthewKent18,Fri Nov 20 15:56:28 IST 2015,i think get nvidiashieldtablet perfect i
MatthewKent18,Fri Nov 20 15:53:57 IST 2015,what adult believ alway right keep think perfect never advanc im sure
MatthewKent18,Fri Nov 20 15:51:49 IST 2015,if someon i care believ bullshit i correct if noth i say word
MatthewKent18,Fri Nov 20 15:50:19 IST 2015,nvidiashieldtablet
MatthewKent18,Thu Nov 19 19:56:56 IST 2015,rt okay live life other understand
MatthewKent18,Thu Nov 19 19:53:48 IST 2015,rt if waitress suggest certain dish order it probabl food tri get rid
MatthewKent18,Thu Nov 19 19:52:27 IST 2015,rt i hate i miss someon anyth
MatthewKent18,Thu Nov 19 19:52:18 IST 2015,rt fake friend believ rumor real friend believ
MatthewKent18,Thu Nov 19 19:50:40 IST 2015,strang obsess nickiminaj anaconda
MatthewKent18,Thu Nov 19 19:49:21 IST 2015,so true noth hide someon view without permiss violat privaci
MatthewKent18,Thu Nov 19 18:19:59 IST 2015,when upset show then peopl know trifl
MatthewKent18,Thu Nov 19 18:15:45 IST 2015,me better bigger person me amaz peopl i love make asshol pay never forgiv never forget
MatthewKent18,Thu Nov 19 17:56:54 IST 2015,someon need stop chippi don attack peopl never offend way
MatthewKent18,Thu Nov 19 17:31:53 IST 2015,haha honor mine
MatthewKent18,Thu Nov 19 17:27:31 IST 2015,know yet have plan first keep post
MatthewKent18,Thu Nov 19 17:25:10 IST 2015,yes hell yes
MatthewKent18,Thu Nov 19 16:41:34 IST 2015,
MatthewKent18,Thu Nov 19 16:40:44 IST 2015,noth like good quot start workday
MatthewKent18,Thu Nov 19 16:03:42 IST 2015,okay okay
MatthewKent18,Thu Nov 19 15:57:06 IST 2015,dont know gone explor like music
MatthewKent18,Thu Nov 19 15:56:21 IST 2015,yup haha never seen come
MatthewKent18,Thu Nov 19 15:55:26 IST 2015,i zerg player for swarm
MatthewKent18,Thu Nov 19 15:51:14 IST 2015,made best omelet morn feelingaccomplish fantast
MatthewKent18,Thu Nov 19 15:49:33 IST 2015,i idol inspir much all videogam charact
MatthewKent18,Thu Nov 19 15:47:18 IST 2015,can wait christma countdown start
MatthewKent18,Thu Nov 19 15:46:10 IST 2015,still shock one friend got cancer i glad high chanc surviv can bear fact lose
MatthewKent18,Thu Nov 19 15:43:53 IST 2015,i think i vampir i weird sleep schedul
MatthewKent18,Thu Nov 19 15:43:05 IST 2015,fact i ninja silent time i cat person i never cheat exam i work better night
MatthewKent18,Thu Nov 19 15:31:16 IST 2015,i think i go help someon this surpris
MatthewKent18,Thu Nov 19 15:30:31 IST 2015,i call good cook a bit tast creativ everi meal work art
MatthewKent18,Thu Nov 19 15:29:10 IST 2015,need tri new cook recip eat thing entir week doesn matter tast good get bore
MatthewKent18,Thu Nov 19 15:23:02 IST 2015,after exam i go find job learn german write book
MatthewKent18,Thu Nov 19 15:21:11 IST 2015,when parent around never conduc learn environ parent studi exam home
MatthewKent18,Thu Nov 19 15:16:27 IST 2015,i blame got hook lol
MatthewKent18,Thu Nov 19 05:52:58 IST 2015,rt reason live alon friggin best
MatthewKent18,Wed Nov 18 11:10:56 IST 2015,rt dreamteam
MatthewKent18,Wed Nov 18 11:05:38 IST 2015,lotv conclus satisfi left mysteri pleas tell kerrigan raynor live happili ever starcraft
MatthewKent18,Tue Nov 17 15:49:50 IST 2015,expens coffe tast lot better
MatthewKent18,Tue Nov 17 15:49:08 IST 2015,i grate peopl even though i practic stranger kind shown power
MatthewKent18,Tue Nov 17 15:46:45 IST 2015,weird im artist draw art
MatthewKent18,Tue Nov 17 15:45:51 IST 2015,i loyal peopl i care i go great length ensur wellb
MatthewKent18,Tue Nov 17 15:43:22 IST 2015,i like i an artist
MatthewKent18,Tue Nov 17 15:42:01 IST 2015,go church first time ever christma church christma
MatthewKent18,Tue Nov 17 15:39:48 IST 2015,rt strong peopl stand stronger peopl stand other
MatthewKent18,Tue Nov 17 15:38:48 IST 2015,rt second pleas freshtruffl beauti pink hue center yes iknowimspoil
MatthewKent18,Tue Nov 17 15:20:39 IST 2015,walk home rain wet rain
MatthewKent18,Tue Nov 17 10:40:37 IST 2015,rt
