username,time,tweet
1untamedbrain,Sat Feb 27 01:59:28 IST 2016,yeah sorri appar i stuck it mnt go previous tweet
1untamedbrain,Sat Feb 27 01:56:00 IST 2016,heard learn come have integr
1untamedbrain,Sat Feb 27 01:54:42 IST 2016,and secular humanist fight religion stop screw live like u hv etern
1untamedbrain,Sat Feb 27 01:53:22 IST 2016,prove someth don u help other bc god command otherwis wld u
1untamedbrain,Sat Feb 27 01:51:28 IST 2016,light sun star plnts sun u nt breed stripe goat hving bang frnt reed badbibl
1untamedbrain,Sat Feb 27 01:49:42 IST 2016,that one saddest argument anyth i ever heard attend school any school pls
1untamedbrain,Sat Feb 27 01:47:12 IST 2016,it seem told u lot wrong thing evo mk sound stupid lrn othr side
1untamedbrain,Sat Feb 27 01:42:32 IST 2016,why u think appropri argu someth u nvr care learn
1untamedbrain,Fri Feb 26 13:59:35 IST 2016,rt success test drive space base gravitationalwav detector lisapathfind
1untamedbrain,Fri Feb 26 13:43:23 IST 2016,i believ said profil accord polit affili so turn away islamist
1untamedbrain,Fri Feb 26 13:41:47 IST 2016,rt in airlock low pressur investig airway inflamm coolscienc https
1untamedbrain,Fri Feb 26 13:37:52 IST 2016,no worri i piss think write indoctrin bueno
1untamedbrain,Fri Feb 26 13:26:35 IST 2016,it clear mind ppl touch antisoci disord
1untamedbrain,Fri Feb 26 13:18:07 IST 2016,if omnisci start noah instead adam or dn let eat appl
1untamedbrain,Fri Feb 26 13:15:44 IST 2016,god great genet almost like sprang mind bronz age desert dweller
1untamedbrain,Fri Feb 26 13:08:50 IST 2016,here why god bother arc why remak anim afterward
1untamedbrain,Fri Feb 26 13:07:50 IST 2016,high larious
1untamedbrain,Fri Feb 26 13:06:17 IST 2016,so scale punish etern sinc god etern duh perfect logic
1untamedbrain,Fri Feb 26 13:02:53 IST 2016,to play devil advoc unintend pun say bc punish frm godlik way wors
1untamedbrain,Fri Feb 26 13:00:50 IST 2016,read rest thread proper context
1untamedbrain,Fri Feb 26 12:52:12 IST 2016,bless cometh name lord
1untamedbrain,Fri Feb 26 12:41:28 IST 2016,dsn believ evil tri seduc u away frm god away frm god mns hell
1untamedbrain,Fri Feb 26 12:40:07 IST 2016,well get u kid easier believ then teach
1untamedbrain,Fri Feb 26 12:37:41 IST 2016,all part show reason
1untamedbrain,Fri Feb 26 12:29:27 IST 2016,oop impress and angri here peac offer
1untamedbrain,Fri Feb 26 12:24:45 IST 2016,no worri i great impress obvious it realli fuck shit indoctrin kid
1untamedbrain,Fri Feb 26 12:18:31 IST 2016,heh exact
1untamedbrain,Fri Feb 26 12:17:25 IST 2016,christian honest fuck disgust
1untamedbrain,Fri Feb 26 12:15:27 IST 2016,once u accept jesus u hv accept ur flaw creation innat sin only he save u yr deprav
1untamedbrain,Fri Feb 26 12:08:16 IST 2016,been lot guilt involv belief overr understat
1untamedbrain,Fri Feb 26 11:05:24 IST 2016,mayb jesus read scari stori tell dark
1untamedbrain,Fri Feb 26 11:02:32 IST 2016,everi time i read someth like i think dorothi power insid along
1untamedbrain,Fri Feb 26 10:54:17 IST 2016,ever tri learn actual theori evolut
1untamedbrain,Fri Feb 26 10:53:52 IST 2016,this say stop fill kid w misinfo yet thr spell grammar error near everi word
1untamedbrain,Fri Feb 26 10:50:13 IST 2016,it illog religion they base decis object evid instd holi book
1untamedbrain,Fri Feb 26 10:48:51 IST 2016,simpl fact atheist do donat time money chariti without think get us etern reward
1untamedbrain,Fri Feb 26 10:46:34 IST 2016,the goal make this life good u knw hghli like evnt thr noth afterward
1untamedbrain,Fri Feb 26 10:45:12 IST 2016,we help other bc instinctu keep tribe ur apart strong togeth thrive
1untamedbrain,Fri Feb 26 10:44:14 IST 2016,altruism dsn exist everyth ultim selfish desir even u want hvn
1untamedbrain,Fri Feb 26 10:41:40 IST 2016,the koran say someth like how cld object tell right
1untamedbrain,Fri Feb 26 10:40:50 IST 2016,not true evn those specif ppl bow any religion
1untamedbrain,Fri Feb 26 10:38:13 IST 2016,that feel ingrain thr evid bestow upon us god
1untamedbrain,Fri Feb 26 10:36:31 IST 2016,primit ape learn help othr surviv benefit it instinctu hardwir us
1untamedbrain,Fri Feb 26 03:24:38 IST 2016,gotta make donut respond later tonight rest
1untamedbrain,Fri Feb 26 03:23:46 IST 2016,hv u done research verifi evo work bc ur base fals premis
1untamedbrain,Fri Feb 26 03:05:46 IST 2016,no prob
1untamedbrain,Fri Feb 26 02:35:24 IST 2016,care explain ridicul analog
1untamedbrain,Fri Feb 26 02:34:56 IST 2016,why u think religion bear either atheist
1untamedbrain,Fri Feb 26 02:34:09 IST 2016,heh exact religi conserv right feel america
1untamedbrain,Fri Feb 26 02:32:30 IST 2016,i gave u two massiv rich atheist donat way share
