username,time,tweet
taylorlamotte19,Sat Mar 28 09:18:06 IST 2015,dad googl ben franklin utica me never caus dead found sassonpointtonight
taylorlamotte19,Sat Mar 28 09:09:51 IST 2015,rt ari happi thing spur moment
taylorlamotte19,Sat Mar 28 09:03:46 IST 2015,take zoo i need to go to the zoo
taylorlamotte19,Sat Mar 28 09:02:36 IST 2015,omg he s so cute look at his tini hand up like that oh my good
taylorlamotte19,Sat Mar 28 09:02:06 IST 2015,i made happi mistak stumbl page dontsavem
taylorlamotte19,Sat Mar 28 09:00:35 IST 2015,rt babi koala
taylorlamotte19,Sat Mar 28 09:00:28 IST 2015,rt look tini duckl
taylorlamotte19,Sat Mar 28 08:59:52 IST 2015,rt these two found cuddl togeth find shelter forest fire aww
taylorlamotte19,Sat Mar 28 08:58:07 IST 2015,rt i want it
taylorlamotte19,Sat Mar 28 08:57:11 IST 2015,take all my money futur hous
taylorlamotte19,Sat Mar 28 08:53:37 IST 2015,best friend goal most
taylorlamotte19,Sat Mar 28 08:52:22 IST 2015,chill friend ladi friend oh my god
taylorlamotte19,Sat Mar 28 08:51:22 IST 2015,tire look wallet find year teller pain real
taylorlamotte19,Sat Mar 28 08:46:37 IST 2015,u ever realiz almost adult i adult
taylorlamotte19,Sat Mar 28 08:44:43 IST 2015,diet could describ unchaperon child birthday parti day
taylorlamotte19,Sat Mar 28 08:34:35 IST 2015,i slack relationship wine day makingupforlosttim
taylorlamotte19,Fri Mar 27 22:26:46 IST 2015,friday jam music xambassador adventuresong someonedropmeinthemountain
taylorlamotte19,Fri Mar 27 19:25:50 IST 2015,rt best pun i ever seen
taylorlamotte19,Fri Mar 27 19:21:13 IST 2015,bison
taylorlamotte19,Fri Mar 27 19:19:32 IST 2015,hungri you ate
taylorlamotte19,Fri Mar 27 19:19:19 IST 2015,u ever look ur friend think wow gonna weird adult updat weird adult
taylorlamotte19,Fri Mar 27 19:08:57 IST 2015,zwfmiami video welcom morn cute noneedtothankm
taylorlamotte19,Fri Mar 27 19:07:57 IST 2015,collectiblesay photo yessss
taylorlamotte19,Fri Mar 27 07:32:45 IST 2015,cupcak wine documentari you never guess i turn day
taylorlamotte19,Fri Mar 27 00:24:39 IST 2015,i get enough chop suey
taylorlamotte19,Thu Mar 26 20:02:18 IST 2015,workman work decid use loud drill middl storyofmylif in word stephani tanner howrud
taylorlamotte19,Thu Mar 26 06:31:16 IST 2015,i love mexican far right
taylorlamotte19,Thu Mar 26 06:27:50 IST 2015,updat store sell alreadi made banana pud dissapoint
taylorlamotte19,Thu Mar 26 06:20:48 IST 2015,does groceri store sell banana pud alreadi made
taylorlamotte19,Thu Mar 26 05:57:12 IST 2015,eat strawberri blueberri protect brain age but i hate blueberri demonfruit
taylorlamotte19,Thu Mar 26 05:55:19 IST 2015,rt whale worri hater fab
taylorlamotte19,Thu Mar 26 05:55:01 IST 2015,when bam drop kick ryan
taylorlamotte19,Thu Mar 26 05:52:35 IST 2015,rt chill lawn chair
taylorlamotte19,Thu Mar 26 03:50:41 IST 2015,rt wet skin jontak photographi canon
taylorlamotte19,Thu Mar 26 02:28:13 IST 2015,mascara updat locat sock drawer idontrememberdoingthat
taylorlamotte19,Thu Mar 26 02:23:19 IST 2015,how i manag lose mascara for god sake neon green tube storyofmylif
taylorlamotte19,Thu Mar 26 02:03:26 IST 2015,black sand beach iceland i want birthday
taylorlamotte19,Thu Mar 26 01:56:25 IST 2015,rt kinda emot kinda emotionless
taylorlamotte19,Thu Mar 26 01:50:37 IST 2015,peopl want attent good bad it sad
taylorlamotte19,Thu Mar 26 01:49:57 IST 2015,rt
taylorlamotte19,Thu Mar 26 01:25:27 IST 2015,like surpris note mybestfriendisbetterthanyour
taylorlamotte19,Wed Mar 25 23:38:44 IST 2015,rt lighthous go run island look boat save stand shine a lamott
taylorlamotte19,Wed Mar 25 23:12:42 IST 2015,sorri
taylorlamotte19,Wed Mar 25 22:23:13 IST 2015,i miss rain
taylorlamotte19,Wed Mar 25 06:45:47 IST 2015,rt guy i found charl charlesisa
taylorlamotte19,Wed Mar 25 06:40:36 IST 2015,rt lawd i need check radley mess charlesisa
taylorlamotte19,Tue Mar 24 09:12:44 IST 2015,seem like everi time turn around adob flash player date madden attentionwhor
taylorlamotte19,Tue Mar 24 00:16:45 IST 2015,rt
taylorlamotte19,Tue Mar 24 00:14:08 IST 2015,quit ador account
taylorlamotte19,Tue Mar 24 00:12:53 IST 2015,basic ya
