username,time,tweet
neaaalll,Fri Mar 25 15:46:43 IST 2016,sorri i retract tweet turn actual even earlier i apologis i mislead
neaaalll,Fri Mar 25 15:39:36 IST 2016,any chanc could word stick own t cs tckts sold before disappoint
neaaalll,Fri Mar 25 15:36:58 IST 2016,lot angri custom morn there clear differ thanksfornoth
neaaalll,Thu Mar 24 23:03:35 IST 2016,quick stop eastercw selfi way elli gould
neaaalll,Tue Mar 22 03:59:26 IST 2016,nando card does singl combin meal red reward mean regular side singl chicken burger
neaaalll,Sun Mar 20 03:31:02 IST 2016,rt we ve done it ft franc england carrythemhom
neaaalll,Mon Mar 07 01:37:25 IST 2016,any plan bring mobil servic anytim soon
neaaalll,Sat Jan 30 01:01:30 IST 2016,rt win valentin day gift bundl worth follow retweet
neaaalll,Sat Jan 30 01:01:00 IST 2016,rt win beauti bundl worth just rt flw enter valentinesday freebiefriday
neaaalll,Tue Jan 19 22:51:38 IST 2016,like enjoymorewat win robinson glass
neaaalll,Sun Jan 17 21:18:07 IST 2016,rt aww look cuti masi moo work camera like pro neal
neaaalll,Sun Jan 17 20:39:51 IST 2016,this big bag keep littl maisi moo go mypetlovesfetch
neaaalll,Sat Dec 12 03:35:49 IST 2015,feel festiv owl christma snowglob glitter glitteri christmasdecor cantwait
neaaalll,Fri Nov 06 02:33:55 IST 2015,look like custom servic quick next day deliveri sixdaysandcount
neaaalll,Thu Sep 10 01:51:04 IST 2015,weartheros
neaaalll,Thu Sep 10 01:51:02 IST 2015,at weartheros support makeusproud wooooooo
neaaalll,Thu Sep 10 01:49:56 IST 2015,at weartheros support makeusproud wooooooo
neaaalll,Thu Sep 10 01:48:39 IST 2015,weartheros
neaaalll,Wed Aug 26 01:57:04 IST 2015,poor stock control basildon tonight no sour cream mash potato pull pork hot dog bun birthday girl feelingsad
neaaalll,Sat Jun 20 00:04:40 IST 2015,
neaaalll,Wed Jun 17 12:30:50 IST 2015,whole marathon thing appar go explain lol
neaaalll,Wed Jun 17 00:53:39 IST 2015,lie in word good watch
neaaalll,Sat May 30 04:35:09 IST 2015,happi birthday
neaaalll,Tue May 19 15:33:37 IST 2015,rt team famous five work challeng havensquest pleas pleas retweet need rt
neaaalll,Thu May 07 22:16:05 IST 2015,ivot
neaaalll,Wed May 06 00:31:12 IST 2015,rt thank west ham legend billi bond toni gale help rais cash havenshospic
neaaalll,Wed May 06 00:30:10 IST 2015,rt saturday may the meadow chelmsford new mascot help us give name
neaaalll,Wed May 06 00:30:07 IST 2015,rt sunday may childrenshospiceweek duck race rais money come see us
neaaalll,Wed May 06 00:30:02 IST 2015,rt thursday may childrenshospiceweek come along help name new
neaaalll,Sat May 02 16:19:28 IST 2015,rt a woman babi girl
neaaalll,Sat May 02 16:16:12 IST 2015,rt royalbabi updat princ william gas air
neaaalll,Sat May 02 16:16:06 IST 2015,rt text princ william heir done spare done goodlad royalbabi
neaaalll,Sat May 02 16:15:46 IST 2015,rt text david cameron just think shall postpon elect celebr just year forget
neaaalll,Wed Apr 29 02:04:55 IST 2015,say hi caramel
neaaalll,Thu Apr 23 00:26:31 IST 2015,time cliffspavilion good job quick comput these ticket sold quick
neaaalll,Sun Apr 12 21:39:15 IST 2015,rt recap video email annoy real life
neaaalll,Sun Apr 12 02:03:33 IST 2015,rt recap news articl of the week
neaaalll,Sat Apr 04 21:20:48 IST 2015,blusteri day blackwat thamesbarg
neaaalll,Sun Mar 29 03:24:09 IST 2015,rt who rememb victoria plaza shop centr southend look like
neaaalll,Sun Mar 29 03:22:09 IST 2015,rt what lose hour sleep bodi fix
neaaalll,Wed Feb 25 00:57:53 IST 2015,found sculptur dentist wait room luckili i nervous patient
neaaalll,Sun Feb 22 15:06:14 IST 2015,rt recap exampl three voic write
neaaalll,Sat Feb 07 15:19:21 IST 2015,rt im fray knot
