username,time,tweet
hotts58,Sun Apr 12 05:01:54 IST 2015,we care hit need defens great offens pitch twin
hotts58,Sun Apr 12 05:00:46 IST 2015,pelfrey solid hr k ratio solid era he get outpitch spring train milon twin
hotts58,Sat Apr 11 06:27:16 IST 2015,doubl given year brewer game
hotts58,Sat Apr 11 04:43:01 IST 2015,great way end game twinswin
hotts58,Sat Apr 11 04:32:52 IST 2015,is ass whole ass better wors half ass i rememb
hotts58,Sat Apr 11 04:29:59 IST 2015,twin part obvious
hotts58,Sat Apr 11 04:19:14 IST 2015,not bad sam fuld trade return now pelfrey keep go tomorrow i sure momentum twin sarcasm
hotts58,Fri Apr 10 23:11:33 IST 2015,they probabl score run first inning today
hotts58,Fri Apr 10 05:58:06 IST 2015,green score less point matt harvey point leagu need sit jake odorizzi
hotts58,Fri Apr 10 05:54:13 IST 2015,green face twin everi day still like see time yet twin run season
hotts58,Fri Apr 10 05:45:58 IST 2015,even fantasi owner usual give least one chanc
hotts58,Thu Apr 09 22:35:32 IST 2015,i bet get treat respect coach male counterpart across field
hotts58,Thu Apr 09 21:49:10 IST 2015,one month one day mine may birthday know special
hotts58,Thu Apr 09 21:18:51 IST 2015,liss right i hate hear need blow the rest world say rest break sport blow
hotts58,Thu Apr 09 21:14:50 IST 2015,ausmus like talk run plan score today
hotts58,Thu Apr 09 02:13:30 IST 2015,tecmo bowl origin nintendo nba jam john madden footbal mike tyson punchout daytona usa
hotts58,Wed Apr 08 02:05:49 IST 2015,yes i tri still noth
hotts58,Wed Apr 08 00:09:12 IST 2015,say expir
hotts58,Tue Apr 07 22:59:36 IST 2015,i access internet radio listen via app phone shouldn i abl neither
hotts58,Tue Apr 07 06:50:19 IST 2015,dekker clutch airbal nationalchampionship
hotts58,Sat Apr 04 00:50:10 IST 2015,is wandi waiver free agent
hotts58,Fri Apr 03 17:03:04 IST 2015,same guy use play cub are concuss longer issu
hotts58,Fri Apr 03 04:43:43 IST 2015,ricki nolasco ceil mediocr veteran paid
hotts58,Fri Apr 03 04:40:58 IST 2015,the content count matter be concis accur count matter sinc grade school
hotts58,Fri Apr 03 04:02:06 IST 2015,craig anthoni desclafani worth roster team leagu he pretti good spring say thank
hotts58,Thu Apr 02 20:03:59 IST 2015,new york yanke get gregorio petit houston astro cash via
hotts58,Thu Apr 02 19:08:25 IST 2015,doubl negat two cancel he guy want team twin
hotts58,Thu Apr 02 17:55:55 IST 2015,jess much
hotts58,Thu Apr 02 05:45:01 IST 2015,happi birthday oracl bestdayev
hotts58,Thu Apr 02 02:39:27 IST 2015,plus folk guess do even know problem not like injur spring train right
hotts58,Wed Apr 01 07:11:31 IST 2015,what eduardo escobar everyday player seem like consist produc year
hotts58,Wed Apr 01 06:13:05 IST 2015,would karma bodi could play got hurt prior date cub plan call baseballdecisionb
hotts58,Fri Mar 27 18:48:41 IST 2015,theo slow roll what bryant come struggl get hurt cub still expect win
hotts58,Fri Mar 27 07:00:40 IST 2015,i sure great seat rest flight restroomsmel
hotts58,Tue Mar 24 18:15:30 IST 2015,rt mntwin sign brian dozier four year extens worth million
hotts58,Tue Mar 24 07:05:22 IST 2015,wow that pretti much sum did lose bet adrianpetersoncamel
hotts58,Tue Mar 24 06:59:44 IST 2015,lamest thing ever
hotts58,Tue Mar 24 06:58:47 IST 2015,have ever ridden ox gore that birthday written birthdayox
hotts58,Tue Mar 24 06:52:57 IST 2015,look part start play game i want radar
hotts58,Tue Mar 24 06:22:38 IST 2015,come ray join dark side bryant floor mike trout product
hotts58,Tue Mar 24 06:12:14 IST 2015,did i miss cervelli rocki trade not hr bat
hotts58,Tue Mar 24 05:48:11 IST 2015,why i prefer guy domin worth someth rather blind reward inning guy
hotts58,Tue Mar 24 05:46:37 IST 2015,pay save pay stiff
hotts58,Tue Mar 24 05:44:46 IST 2015,save hold much better categori save save get stud
hotts58,Tue Mar 24 04:47:12 IST 2015,ap crime time vike come smell like rose rather cut save cap space
hotts58,Mon Mar 23 03:00:58 IST 2015,rt shock go expert come cub kris bryant he say go all in rt if
hotts58,Sun Mar 22 09:46:14 IST 2015,bryant just could live abl year take
hotts58,Sat Mar 21 20:27:01 IST 2015,stupid keep hamel instead bryant i could keep whole career point alreadi max greink goldi
hotts58,Fri Mar 20 22:27:43 IST 2015,when would possibl happen opinion
hotts58,Fri Mar 20 08:14:42 IST 2015,minut tri watch march mad sick alreadi game all commerci break marchmad
