username,time,tweet
JoeWalkerWebb26,Fri Nov 20 22:14:40 IST 2015,i got hour sleep lastnight i go buy lotteri ticket misssleep i guess hour better noth
JoeWalkerWebb26,Fri Nov 20 08:59:22 IST 2015,i sure chucknorri even mess asher htgawm holi shit they want number
JoeWalkerWebb26,Fri Nov 20 08:58:30 IST 2015,i pretti sure chucknorri even mess asher htgawm holi shit they want number speed dial
JoeWalkerWebb26,Fri Nov 20 08:43:51 IST 2015,you becom one favorit follow well done well done
JoeWalkerWebb26,Fri Nov 20 08:42:37 IST 2015,i accident took meliton minut help winterfinal htgawm i miss
JoeWalkerWebb26,Fri Nov 20 08:40:08 IST 2015,feel sad what wine i drink mani bottl mobwiv
JoeWalkerWebb26,Fri Nov 20 08:25:55 IST 2015,i drink moonshin scandal give love may happen ftiz liv
JoeWalkerWebb26,Fri Nov 20 07:12:33 IST 2015,heartbroken sad
JoeWalkerWebb26,Fri Nov 20 06:34:20 IST 2015,historyofmyheart
JoeWalkerWebb26,Thu Nov 19 18:22:11 IST 2015,rt tomorrow better day
JoeWalkerWebb26,Thu Nov 19 09:48:01 IST 2015,there hole heart that never fill
JoeWalkerWebb26,Thu Nov 19 09:20:53 IST 2015,
JoeWalkerWebb26,Thu Nov 19 08:08:44 IST 2015,happen
JoeWalkerWebb26,Thu Nov 19 08:02:32 IST 2015,ever taken selfi imdbaskmarkpaul
JoeWalkerWebb26,Thu Nov 19 05:50:31 IST 2015,i drink
JoeWalkerWebb26,Thu Nov 19 05:49:59 IST 2015,the wall go back
JoeWalkerWebb26,Thu Nov 19 05:41:52 IST 2015,yeah yeah davidbeckham got sexiestmanal see that girl fire enew
JoeWalkerWebb26,Wed Nov 18 18:45:00 IST 2015,i way kansa so jealous selfi
JoeWalkerWebb26,Wed Nov 18 08:59:44 IST 2015,rt my motto everi year
JoeWalkerWebb26,Wed Nov 18 08:35:25 IST 2015,taken selfi today you chrisleyknowsbest selfi
JoeWalkerWebb26,Wed Nov 18 07:56:08 IST 2015,i know feel it suck
JoeWalkerWebb26,Wed Nov 18 07:55:31 IST 2015,rt
JoeWalkerWebb26,Wed Nov 18 06:35:36 IST 2015,love
JoeWalkerWebb26,Wed Nov 18 06:02:07 IST 2015,it one day i hate peopl make feel small i highest colleg degre i stupid over
JoeWalkerWebb26,Wed Nov 18 05:19:35 IST 2015,rt i take great pride know peopl like realli know peopl know love
JoeWalkerWebb26,Wed Nov 18 05:02:01 IST 2015,listentothi settl for slowdown nowplay
JoeWalkerWebb26,Tue Nov 17 23:22:59 IST 2015,there day feel good enough
JoeWalkerWebb26,Tue Nov 17 21:37:43 IST 2015,rt no matter strong tri stay day wanna strong anymor
JoeWalkerWebb26,Tue Nov 17 16:41:52 IST 2015,i miss sleep
JoeWalkerWebb26,Tue Nov 17 12:27:29 IST 2015,rt
JoeWalkerWebb26,Tue Nov 17 09:12:45 IST 2015,take two
JoeWalkerWebb26,Mon Nov 16 20:30:00 IST 2015,
JoeWalkerWebb26,Mon Nov 16 10:58:21 IST 2015,rt know cri know laugh know silent mark crow
JoeWalkerWebb26,Mon Nov 16 10:49:31 IST 2015,i wonder take time tweet back kind handsom friend huge guy kansa kuwtk
JoeWalkerWebb26,Mon Nov 16 10:32:55 IST 2015,rt sweet dream
JoeWalkerWebb26,Mon Nov 16 09:54:58 IST 2015,via youtub
JoeWalkerWebb26,Mon Nov 16 09:27:53 IST 2015,rt gn
JoeWalkerWebb26,Mon Nov 16 09:16:03 IST 2015,i alway wonder happen barney purpl dinosaur find tonight he worn king cryus
JoeWalkerWebb26,Mon Nov 16 08:30:22 IST 2015,the get girl beauti
JoeWalkerWebb26,Mon Nov 16 07:52:01 IST 2015,i would feel like i i got autograph copi stronglooksbetternak kuwtk great season
JoeWalkerWebb26,Mon Nov 16 07:39:00 IST 2015,instead i think need call keep up with that girl fire she fire kuwtk
JoeWalkerWebb26,Mon Nov 16 07:33:29 IST 2015,kuwtk final my heart happi awhil
JoeWalkerWebb26,Mon Nov 16 05:55:37 IST 2015,rt i wanna know
JoeWalkerWebb26,Mon Nov 16 05:20:50 IST 2015,i make homemad chicken noodl soup lol get feel better
JoeWalkerWebb26,Mon Nov 16 05:16:08 IST 2015,taken selfi today askdorothi richkid
JoeWalkerWebb26,Sun Nov 15 22:11:24 IST 2015,rt it okay cri just keep go
JoeWalkerWebb26,Sun Nov 15 21:55:26 IST 2015,true
JoeWalkerWebb26,Sun Nov 15 21:20:33 IST 2015,rt peopl come life only real one stay
JoeWalkerWebb26,Sun Nov 15 04:00:00 IST 2015,drink girl will power make the duck blind tonight
