username,time,tweet
Amy_Tizzle,Tue Feb 23 12:30:46 IST 2016,had approx min sleep today go fun fulloftwist
Amy_Tizzle,Tue Feb 23 04:19:10 IST 2016,bean sprout blackcat whitewhisk kitten
Amy_Tizzle,Tue Feb 23 03:56:08 IST 2016,cloudi moon
Amy_Tizzle,Mon Feb 22 00:53:35 IST 2016,babe ha
Amy_Tizzle,Sun Feb 21 17:53:43 IST 2016,love guy
Amy_Tizzle,Sun Feb 21 15:56:30 IST 2016,awesom night man pop truli blast thank
Amy_Tizzle,Sun Feb 21 05:32:42 IST 2016,csnt wait meet mam new addit this sprout settl nice catsoftwitt
Amy_Tizzle,Sat Feb 20 18:58:09 IST 2016,love love love track
Amy_Tizzle,Sat Feb 20 18:55:35 IST 2016,camera shi caturday catsofinstagram cuddl
Amy_Tizzle,Thu Feb 18 01:08:31 IST 2016,rt free sat night our pop up bar aycliff villag w gourmet wagu burger live music ticket avail
Amy_Tizzle,Wed Feb 17 02:22:12 IST 2016,i swear someon slip rufus catnip even look troubl catsoftwitt
Amy_Tizzle,Fri Feb 12 13:25:34 IST 2016,its kind morn
Amy_Tizzle,Fri Feb 12 05:07:27 IST 2016,think need sleep anyth els happen could wors
Amy_Tizzle,Fri Feb 12 03:12:24 IST 2016,too true
Amy_Tizzle,Tue Feb 09 02:42:53 IST 2016,tea cake kylabean babe hipstersfortheday
Amy_Tizzle,Tue Feb 09 00:07:06 IST 2016,draw like one french girl jack catsofinstagram sexypos
Amy_Tizzle,Sat Feb 06 21:31:59 IST 2016,bahahaa
Amy_Tizzle,Tue Feb 02 03:57:13 IST 2016,love sound rain wind not much
Amy_Tizzle,Tue Feb 02 03:41:11 IST 2016,just seen scari stuff gocanni
Amy_Tizzle,Tue Feb 02 03:33:44 IST 2016,doofus best catsofinstagram tomcat cuddl crazycatladi
Amy_Tizzle,Mon Feb 01 03:30:58 IST 2016,smonday
Amy_Tizzle,Sun Jan 31 02:15:24 IST 2016,appar mundan tast music word eclect
Amy_Tizzle,Sat Jan 30 02:37:28 IST 2016,rt yellow weather warn snow wind ice issu counti durham
Amy_Tizzle,Thu Jan 28 03:27:45 IST 2016,this made laugh far much trex gymnast
Amy_Tizzle,Mon Jan 25 02:48:14 IST 2016,my sunday even thenat boxer green vinyl
Amy_Tizzle,Sun Jan 24 17:04:51 IST 2016,weekend two niec nephew
Amy_Tizzle,Fri Jan 22 04:14:02 IST 2016,lol
Amy_Tizzle,Thu Jan 21 13:55:15 IST 2016,its nationalhuggingday baymax huggabl sure i run year
Amy_Tizzle,Thu Jan 21 03:53:58 IST 2016,noth better rufus love catsoftwitt
Amy_Tizzle,Tue Jan 19 20:30:44 IST 2016,rt from sunday beer brew north east tap takeov
Amy_Tizzle,Tue Jan 19 03:01:09 IST 2016,watch pulp fiction million th time zedsdeadbabi
Amy_Tizzle,Sat Jan 16 03:33:56 IST 2016,youth
Amy_Tizzle,Fri Jan 15 14:24:05 IST 2016,i realli get duvet
Amy_Tizzle,Fri Jan 15 03:02:04 IST 2016,when lovliest make day montag miss evenrockyhadamontag
Amy_Tizzle,Fri Jan 15 00:15:58 IST 2016,rip alan rickman raiseyourwand
Amy_Tizzle,Wed Jan 13 22:56:29 IST 2016,im far excit robotwar
Amy_Tizzle,Tue Jan 12 13:22:12 IST 2016,rt david bowi fan pay tribut mass sing along brixton video
Amy_Tizzle,Tue Jan 12 03:13:25 IST 2016,bahahaa show kitti
Amy_Tizzle,Mon Jan 11 13:29:03 IST 2016,sad sad news a true legend hero mine you alway remind babe
Amy_Tizzle,Mon Jan 11 01:38:49 IST 2016,final got beauti set downstair
Amy_Tizzle,Sun Jan 10 17:14:29 IST 2016,yesterday walk
Amy_Tizzle,Sat Jan 09 03:58:26 IST 2016,
Amy_Tizzle,Sat Jan 09 02:46:48 IST 2016,found whilst look inspir
Amy_Tizzle,Sat Jan 09 01:46:18 IST 2016,machin robot get dress like the jetson
Amy_Tizzle,Fri Jan 08 18:03:30 IST 2016,i need
Amy_Tizzle,Wed Jan 06 04:14:34 IST 2016,bahahaa yoga yoda without doubt
Amy_Tizzle,Mon Jan 04 13:16:44 IST 2016,its fleetfox kind morn
Amy_Tizzle,Mon Jan 04 04:14:21 IST 2016,an anagram name am royalti haha mortal yay
Amy_Tizzle,Sun Jan 03 05:22:27 IST 2016,tri sleep someon want attent cat cuddlesrequir humansmustobey
Amy_Tizzle,Sat Jan 02 03:41:01 IST 2016,dave grohl pay tribut lemmi ace spade tattoo
