username,time,tweet
illola95,Wed Jun 03 12:02:40 IST 2015,come what may i dont give a damn feelingconfident  morning everyone -
illola95,Tue Jun 02 00:50:21 IST 2015,upas benvenuta irene     curiosa adesso di vedere come si comporterà nonnoferri  p
illola95,Tue Jun 02 00:40:24 IST 2015,rt  eh serenella quanto la fai lungamanco dovessi partorire 😁 aspettandoirene upas rai
illola95,Sun May 31 19:33:45 IST 2015,rt   be merciful not everyone has your perfect mane and drizzle is a nightmare for not-magic hair
illola95,Sat May 30 01:58:52 IST 2015,rt  ci sono storie che non possono finire mai signore e signori al bano e romina power alle 2115 su  
illola95,Fri May 29 14:53:29 IST 2015,rt  buongiorno chissà se stamattina continuerò a lamentarmi del troppo studio oppure aprirò il libro finalmente gnapozzfa …
illola95,Thu May 28 23:30:21 IST 2015,looking forward to watching   cant wait for season3 to start still hoping to see aarontveit there ♡♡ miss all of you guys
illola95,Thu May 28 01:47:38 IST 2015,rt  lo zioooooo  voglio che mi inciti in quel modo prima di dare ogni esame orale alluniversità hahahahah tvoi
illola95,Wed May 27 00:46:12 IST 2015,rt 2308 peccato che leonardo faccia questo personaggioun bel ragazzo sprecato😒upas
illola95,Wed May 27 00:45:16 IST 2015,upas ansia totale non potete lasciarci in questo modo che ne sarà di angela  lunica soluzione è super franco  
illola95,Mon May 25 02:45:14 IST 2015,stupido è chi lo stupido lo fa  forrestgump rete4 stupid is as stupid does 
illola95,Mon May 25 02:32:06 IST 2015,rt  stunnedmy heart goes out to john  alicia  familyan amazing partnership beautiful minds beautiful hearts https/…
illola95,Thu May 21 19:17:37 IST 2015,rt  almost forgot yesterday was the four year anniversary of  thank you all for following atn on this ridicu…
illola95,Sun May 17 05:27:26 IST 2015,amis université placepoisson unisa  dernier jour maintenant commencent les problèmes merde  
illola95,Thu May 14 21:30:45 IST 2015, aww ensemble pour toujours ♡♡ 
illola95,Thu May 14 21:18:55 IST 2015,rt   mi manchi tanto sabato ci vediamo vero ♥
illola95,Thu May 14 21:18:47 IST 2015, ahimè   saremo soci in questo perennemente xd
illola95,Thu May 14 21:17:40 IST 2015,rt  come direbbe la mia socia in affari   il problema è concretizzare cc  latristerealtà
illola95,Thu May 14 21:17:31 IST 2015, mais oui bien sûr ma chérie ♡♡
illola95,Tue May 12 17:40:08 IST 2015, sta attento potrebbe diventare una dipendenza come ricordava   ahahahahcomunque tutto bene  tu invece
illola95,Tue May 12 17:23:57 IST 2015, non ci credo anche tu ti sei twitterizzato xd benvenuto -d
illola95,Tue May 12 17:21:11 IST 2015,rt     mariluuuuuuuuu ♥ 
illola95,Sat May 09 01:48:22 IST 2015,rt  rissyris june 25 is right around the corner
illola95,Sat May 09 01:48:13 IST 2015,rt  gracelandtv exclusive does the new poster for season 3 reveal mikes fate  
illola95,Thu May 07 17:57:47 IST 2015, an oldenjonine video made by a friend of mine comewhatmay ♡♡♡samanthabarks aarontveit enjolras éponine ☆☆☆
illola95,Thu May 07 17:24:33 IST 2015,rt  done voted i have exercised my democratic right to choose which oppressor i prefer to oppress me for the next 5 years…
illola95,Sun May 03 04:14:22 IST 2015,rt  if you have time to sing about your love life on this barricade then youre not revolutioning hard enough
illola95,Sun May 03 04:12:57 IST 2015,rt  whos coming with me to see the fifty shades of red and black movie
illola95,Sun May 03 04:03:30 IST 2015,rt  found this enjonine miss saigon edit and it is beyond beautiful 
illola95,Sun May 03 03:45:20 IST 2015,rt  theres a world i know a place we can go where the pain will go away nexttonormal
illola95,Sun May 03 03:15:46 IST 2015,ahhhh cant wait for   season3 miss you all guys ♡♡♡ 
illola95,Tue Apr 28 23:20:54 IST 2015, mon chouchou ♡ 
illola95,Tue Apr 21 21:57:34 IST 2015,just another day sunnyafternoon university endlessstress me  and simona averageday ☆☆ 
illola95,Tue Apr 21 11:55:29 IST 2015,rt  jakes and johnny weonaboat  gracelandtv season3 miami  
illola95,Sun Apr 19 22:05:43 IST 2015, what happened sweetie ♡
illola95,Sat Apr 18 01:31:23 IST 2015,rt  elizabeth judd as eponine with a sensible hoody jacket and jean shorts cornrows  
illola95,Fri Apr 17 11:47:33 IST 2015,    ahahahahahahahah 
illola95,Sun Apr 12 20:02:36 IST 2015,rt  domenicalive riconosc riconobbe barbaradurso
illola95,Sun Apr 12 04:36:35 IST 2015,  la solita mala suerte / poi ci raconterai le rocambolescheavventuredirossellina 
illola95,Sun Apr 12 03:25:05 IST 2015,    ich liebe euch ♡♡♡♡ 
illola95,Sun Apr 12 03:02:19 IST 2015, ich habe keine hoffnung - friendsarefamily 
illola95,Sun Apr 12 00:01:50 IST 2015,rt  want to say thanks to my guys     
illola95,Sat Apr 11 23:52:43 IST 2015,rt  what is that smell are you wearing cologne its urine angela and hodgins i cant breathe p rewatchingbones
illola95,Sat Apr 11 23:52:06 IST 2015, dai che lo faremo tra poco ♡♡ era da una vita che non entravo qui su twitter ahahahahah
illola95,Sun Mar 29 05:25:31 IST 2015,rt  first day on set of  whos excited 
illola95,Thu Mar 26 00:10:10 IST 2015,even in my english textbook ♥♥♥ lesmis susanboyle 
illola95,Tue Mar 24 05:07:20 IST 2015,rt  aarontveit mikewarren  paulbriggs bts gracelandtv 
illola95,Tue Mar 24 04:55:43 IST 2015,spettacolare com  lavocedelsilenzio portaaporta degna erede della grande mina 
illola95,Tue Mar 24 04:23:16 IST 2015, un modugno semplicemente perfetto è sempre un piacere rivedere volare -d
illola95,Tue Mar 24 04:09:07 IST 2015,rt com questa sera speciale  per il 75esimo compleanno di mina   
