username,time,tweet
AuthorStefanieG,Sat Nov 21 20:25:42 IST 2015,i soul personalitytyp
AuthorStefanieG,Thu Nov 19 20:22:39 IST 2015,read only kiss romanc booklov fictionfan
AuthorStefanieG,Thu Nov 19 05:21:51 IST 2015,i decid i succumb eat piec applepi willpow broke i weak fit nutrit
AuthorStefanieG,Wed Nov 18 20:54:53 IST 2015,some peopl use glue stick instead chapstick jokequot silenc
AuthorStefanieG,Tue Nov 17 20:16:38 IST 2015,one hardest thing life tri look happi money fall birthday card jokequot adulthood
AuthorStefanieG,Tue Nov 17 18:08:20 IST 2015,just found sweetspot bed alarmclock went damn morn
AuthorStefanieG,Tue Nov 17 03:25:22 IST 2015,buy cloth buy cloth buy happi shopper fashion
AuthorStefanieG,Mon Nov 16 04:24:58 IST 2015,read bound determin romanc fictionfan booklov
AuthorStefanieG,Sun Nov 15 04:24:45 IST 2015,a sea whiskey intox much drop jsparker quot
AuthorStefanieG,Fri Nov 13 19:22:31 IST 2015,read good girl don romanc fictionfan booklov
AuthorStefanieG,Thu Nov 12 06:42:40 IST 2015,thenotebook i still love matter mani time i see classic movi
AuthorStefanieG,Thu Nov 12 04:23:09 IST 2015,veteran salut veteransday
AuthorStefanieG,Tue Nov 10 19:26:56 IST 2015,read to claim a wild kimberlykayeterri booklov romanc fictionfan
AuthorStefanieG,Tue Nov 10 03:34:06 IST 2015,can man tangl tempest without get swept away tropic storm contemporaryrom
AuthorStefanieG,Mon Nov 09 20:31:02 IST 2015,isn age grace nice way say slowli look wors jokequot beauti
AuthorStefanieG,Sun Nov 08 19:36:55 IST 2015,read fall love again romanc booklov fictionfan
AuthorStefanieG,Sat Nov 07 20:17:01 IST 2015,just kiss we talk later love
AuthorStefanieG,Thu Nov 05 19:37:29 IST 2015,if i flower everi time i thought i could walk garden forev alfredlordtennyson quot
AuthorStefanieG,Wed Nov 04 20:50:01 IST 2015,a recent studi found women carri littl extra weight live longer men mention fit
AuthorStefanieG,Wed Nov 04 00:26:07 IST 2015,the bird chirp posit balmi outsid it like spring novemb eastcoast weather
AuthorStefanieG,Tue Nov 03 02:52:07 IST 2015,read beauti redempt booklov fictionlov romanc
AuthorStefanieG,Mon Nov 02 08:02:40 IST 2015,i feel like late actual still earli i confus daylightsavingtim
AuthorStefanieG,Sun Nov 01 06:34:13 IST 2015,all ghost outsid halloween still find boo relationshipproblem
AuthorStefanieG,Sun Nov 01 00:09:14 IST 2015,i boo happyhalloween
AuthorStefanieG,Fri Oct 30 20:20:02 IST 2015,sometim unfollow peopl real life follow
AuthorStefanieG,Fri Oct 30 01:53:35 IST 2015,everyday i struggl i want look good nake treat yo self fit nutrit
AuthorStefanieG,Tue Oct 27 21:55:30 IST 2015,i call flaw i call broken piec perfect
AuthorStefanieG,Mon Oct 26 20:45:54 IST 2015,read heartless fiction histor romanc booklov
AuthorStefanieG,Sat Oct 24 21:29:35 IST 2015,on alway take openconcept live space homeown entertain but friend
AuthorStefanieG,Fri Oct 23 20:52:49 IST 2015,the mean life find gift the purpos life give away williamshakespear quotesforlif
AuthorStefanieG,Fri Oct 23 05:22:34 IST 2015,in octob degre i live i ecstat eastcoast weather
AuthorStefanieG,Thu Oct 22 02:09:34 IST 2015,went gym forgot headphon music those minut ellipt machin longest life cardio
AuthorStefanieG,Wed Oct 21 01:44:56 IST 2015,those believ magic never find roalddahl quot
AuthorStefanieG,Tue Oct 20 21:09:17 IST 2015,i spend lot time hold refriger door open look answer ilovefood diet
AuthorStefanieG,Sun Oct 18 19:31:04 IST 2015,text court romanc love date
AuthorStefanieG,Sat Oct 17 22:31:00 IST 2015,he i whatev soul made mine emilybront love
AuthorStefanieG,Sat Oct 17 00:27:58 IST 2015,can wait read yvonn harriott upcom new releas romanceread
AuthorStefanieG,Fri Oct 16 21:13:52 IST 2015,read theirs cherish booklov iread romanceread fiction
AuthorStefanieG,Fri Oct 16 04:48:31 IST 2015,there citi i live is wrong everi citi i visit i see dream furnitur store anywher near
AuthorStefanieG,Wed Oct 14 19:49:23 IST 2015,read walk disast romanc booklov iread fiction
AuthorStefanieG,Tue Oct 13 17:57:09 IST 2015,the day holiday weekend alway hardest morn
AuthorStefanieG,Mon Oct 12 18:07:15 IST 2015,monday the day wear exact outfit yesterday without anyon know style fashion
AuthorStefanieG,Sat Oct 10 21:04:58 IST 2015,if want origin readi copi cocochanel quot
AuthorStefanieG,Fri Oct 09 20:28:47 IST 2015,it fun game jean fit eatrespons exercis fit
AuthorStefanieG,Wed Oct 07 20:54:48 IST 2015,read his take she new author i hope good thing booklov
AuthorStefanieG,Wed Oct 07 02:05:36 IST 2015,if i actual walk shoe realli matter long shoe look fabul thingsthatmakeyousayhmmm
AuthorStefanieG,Tue Oct 06 21:43:50 IST 2015,if meant midnight light fridg foodlov foodi jokequot
AuthorStefanieG,Tue Oct 06 07:25:36 IST 2015,legendsofthefal bradpitt handsom glori be still heart
AuthorStefanieG,Tue Oct 06 04:51:54 IST 2015,i rememb use dvdplayer i feel asham oldtech
AuthorStefanieG,Mon Oct 05 20:42:47 IST 2015,be picki men selfi date lifem
