username,time,tweet
jeffcarp,Thu Feb 25 23:35:38 IST 2016,oh linkedin endors posit impact career
jeffcarp,Thu Feb 25 18:04:03 IST 2016,sinc journalist cite opt survey news did read pdf nyt link no q a race hmm
jeffcarp,Wed Feb 24 19:34:59 IST 2016,when cite opt survey becom newsworthi when result fit journalist narrat
jeffcarp,Wed Feb 24 19:08:53 IST 2016,no us doom matter candid elect what doom individu opinion utopia notthesameth
jeffcarp,Wed Feb 24 18:58:46 IST 2016,yet employ wrote articl trump support view slaveri cite person opt survey
jeffcarp,Wed Feb 24 18:48:56 IST 2016,why pdf yougov link slaveri q a wrote
jeffcarp,Wed Feb 24 18:45:04 IST 2016,realli it opt survey sourc nyt link address claim made articl sloppi
jeffcarp,Wed Feb 24 06:35:11 IST 2016,is differ copilot gps navig gray icon copilot premium red icon android play store
jeffcarp,Wed Feb 24 02:57:46 IST 2016,what crazi world live verizon talk year centurylink instal mpbs dsl new home today
jeffcarp,Tue Feb 23 19:35:05 IST 2016,their well program diff friend program corp well disclos individu result team result
jeffcarp,Mon Feb 22 22:01:02 IST 2016,rt remix os desktop orient version android come older pcs
jeffcarp,Mon Feb 22 08:42:29 IST 2016,do exist custom wait exist easypay leas paid join galaxyforev
jeffcarp,Sun Feb 21 21:06:54 IST 2016,the batteri genius now need put second small fix batteri insid could hot swap batteri
jeffcarp,Sun Feb 21 21:04:22 IST 2016,did remov abil edit order set appear drop other altogeth
jeffcarp,Thu Feb 18 19:03:18 IST 2016,that bit leap situat today access one phone court order
jeffcarp,Thu Feb 18 08:21:32 IST 2016,kind tire half done project latest wear massiv drain watch batteri watch final notifi call call
jeffcarp,Thu Feb 18 08:15:39 IST 2016,that conclus bit leap logic
jeffcarp,Thu Feb 18 05:39:18 IST 2016,it hard imagin appl googl car game experi ridicul lack tech knowledg car salesman
jeffcarp,Mon Feb 15 02:01:55 IST 2016,back leadership rather pontif or congress scare enough job potus bulli pulpit work
jeffcarp,Mon Feb 15 01:52:20 IST 2016,i see elect cycl but see enough voter fed search answer that step
jeffcarp,Mon Feb 15 01:23:35 IST 2016,need legitim moder leadership tell base parti go hell repres us base
jeffcarp,Mon Feb 15 01:22:21 IST 2016,prob imo base side politician pander base idioci need legitim center leader
jeffcarp,Mon Feb 15 01:20:41 IST 2016,still leadership issu strong exec legi relationship negoti filibust come play
jeffcarp,Mon Feb 15 00:40:29 IST 2016,sorri understand comment flip flop
jeffcarp,Mon Feb 15 00:35:38 IST 2016,poor leadership skill confus system failur form govt
jeffcarp,Sun Feb 14 08:36:00 IST 2016,onlin impli simpl can onlin today
jeffcarp,Fri Feb 12 08:11:20 IST 2016,my bill would data bucket no way verizon much better anymor fat happi imo
jeffcarp,Fri Feb 12 07:14:42 IST 2016,you need give user way deni delet mymap share w user spam
jeffcarp,Fri Feb 12 01:35:53 IST 2016,thank i check low the i hope competit forc chang a shame take
jeffcarp,Thu Feb 11 09:30:11 IST 2016,someth errat tonight w normal solid tower clive ia nw st univers ave
jeffcarp,Thu Feb 11 09:08:56 IST 2016,i bet magic stop think serv new subdivis w dsl accept viasat launch
jeffcarp,Wed Feb 10 20:55:57 IST 2016,defect technolog becom tort liabil case brought insur compani rather individu driver insur
jeffcarp,Wed Feb 10 20:55:00 IST 2016,googl prove insur compani technolog worthi receiv kind preferenti risk pool treatment
jeffcarp,Wed Feb 10 20:53:25 IST 2016,autonom driver could differ risk pool car owner insur compani alway pay damag
jeffcarp,Wed Feb 10 19:20:12 IST 2016,could usher new kind fault auto insur paradigm
jeffcarp,Thu Feb 04 06:57:34 IST 2016,chanc receiv paid wait list order march hour spring break flight
jeffcarp,Thu Feb 04 06:30:10 IST 2016,answer toyota survey last night thought android auto futur car this morn i drove work hyundai
jeffcarp,Wed Feb 03 23:51:23 IST 2016,pardon scof great broadband provid liter buy acr w broadband
jeffcarp,Wed Jan 27 18:35:01 IST 2016,here exampl actual report not sure support claim declin w fact
jeffcarp,Wed Jan 27 18:23:45 IST 2016,that irrelev question whether improv declin
jeffcarp,Wed Jan 27 07:34:36 IST 2016,the best quarter sprint year character sprint head wrong direct huh
jeffcarp,Wed Jan 27 00:39:13 IST 2016,instead today sprint articl subt drop fact previous assert last week articl
jeffcarp,Wed Jan 27 00:38:06 IST 2016,today sprint flat refut previous articl recod public defend retract
jeffcarp,Wed Jan 27 00:29:22 IST 2016,sprint say inform correct need defend retract silenc credibl
jeffcarp,Tue Jan 26 19:46:34 IST 2016,you suggest know big futur network specif know sprint plan
jeffcarp,Tue Jan 26 19:43:48 IST 2016,love casual move away previous disrupt fear monger stori w acknowledg wrong
jeffcarp,Tue Jan 26 19:34:02 IST 2016,what carrier histori telegraph futur network plan
jeffcarp,Sun Jan 24 07:55:15 IST 2016,buffer warn slow isp connect my roku call bs excus
jeffcarp,Sun Jan 24 01:54:29 IST 2016,do signific number student get mere stand line hour door open camp requir
jeffcarp,Sun Jan 24 01:28:47 IST 2016,student camp still get seat you equat want need accur
