username,time,tweet
Dualistic_Mix,Mon Jun 22 06:40:58 IST 2015,thank repli
Dualistic_Mix,Mon Jun 22 03:10:15 IST 2015,how would know made differ
Dualistic_Mix,Sun Jun 21 08:34:59 IST 2015,what explain
Dualistic_Mix,Sat Jun 20 13:49:27 IST 2015,those moment clear see saw messag repli
Dualistic_Mix,Sat Jun 20 06:19:33 IST 2015,you stop play peopl
Dualistic_Mix,Fri Jun 19 20:49:50 IST 2015,thank invit friend
Dualistic_Mix,Fri Jun 19 19:45:51 IST 2015,will money mean friend
Dualistic_Mix,Fri Jun 19 19:37:02 IST 2015,there thing make think
Dualistic_Mix,Fri Jun 19 19:36:19 IST 2015,it man job make girl happi
Dualistic_Mix,Fri Jun 19 03:49:29 IST 2015,tri live day without look mirror
Dualistic_Mix,Thu Jun 18 21:02:28 IST 2015,don let go dream
Dualistic_Mix,Thu Jun 18 18:37:36 IST 2015,just tell could wors
Dualistic_Mix,Thu Jun 18 03:38:23 IST 2015,you get chanc one day
Dualistic_Mix,Wed Jun 17 05:45:42 IST 2015,with without
Dualistic_Mix,Tue Jun 16 22:17:17 IST 2015,what would world like without music
Dualistic_Mix,Tue Jun 16 13:48:50 IST 2015,be thank
Dualistic_Mix,Tue Jun 16 09:07:15 IST 2015,truli build connect someon
Dualistic_Mix,Mon Jun 15 22:47:45 IST 2015,you need great full
Dualistic_Mix,Mon Jun 15 09:40:07 IST 2015,live singapor probabl like asian version uk
Dualistic_Mix,Mon Jun 15 09:33:34 IST 2015,it easi break someth valu hide
Dualistic_Mix,Mon Jun 15 07:16:45 IST 2015,do like
Dualistic_Mix,Sun Jun 14 15:09:16 IST 2015,it take time
Dualistic_Mix,Sun Jun 14 14:52:01 IST 2015,time fli sometim
Dualistic_Mix,Sun Jun 14 14:08:01 IST 2015,you worst nightmar
Dualistic_Mix,Sat Jun 13 08:43:30 IST 2015,noth mistak mistak
Dualistic_Mix,Sat Jun 13 08:28:46 IST 2015,stop make everyth go damn way
Dualistic_Mix,Sat Jun 13 08:25:42 IST 2015,rt die talk refus text
Dualistic_Mix,Fri Jun 12 10:15:10 IST 2015,you beauti way
Dualistic_Mix,Thu Jun 11 21:55:29 IST 2015,peopl alway opinion sometim hurt
Dualistic_Mix,Thu Jun 11 21:25:32 IST 2015,all reason i love
Dualistic_Mix,Thu Jun 11 12:02:08 IST 2015,it look back realis becam way today
Dualistic_Mix,Wed Jun 10 09:43:13 IST 2015,rt alway start somewher
Dualistic_Mix,Wed Jun 10 09:42:16 IST 2015,rt go work
Dualistic_Mix,Tue Jun 09 17:41:04 IST 2015,everyth happen reason
Dualistic_Mix,Tue Jun 09 05:19:57 IST 2015,rt love much someon treat wrong recogn
Dualistic_Mix,Tue Jun 09 05:05:49 IST 2015,be thank
Dualistic_Mix,Mon Jun 08 20:04:20 IST 2015,you everyon see
Dualistic_Mix,Mon Jun 08 19:34:30 IST 2015,at least good peopl stop look bad side thing
Dualistic_Mix,Mon Jun 08 07:08:01 IST 2015,you trap mind
Dualistic_Mix,Mon Jun 08 07:03:33 IST 2015,let laugh cri die
Dualistic_Mix,Sun Jun 07 22:33:56 IST 2015,when somebodi love rt retweet retweeett retweeet
Dualistic_Mix,Sun Jun 07 22:32:48 IST 2015,when stand amongst rest vital
Dualistic_Mix,Sat Jun 06 07:37:19 IST 2015,you made believ someth exist first place
Dualistic_Mix,Sat Jun 06 07:36:56 IST 2015,i believ i got fool way
Dualistic_Mix,Fri Jun 05 19:47:54 IST 2015,you probabl biggest joke
Dualistic_Mix,Fri Jun 05 12:36:08 IST 2015,when lost word odd
Dualistic_Mix,Fri Jun 05 07:22:07 IST 2015,what world perfect lifethought
Dualistic_Mix,Fri Jun 05 00:44:53 IST 2015,those moment guy notic hard tri look good girlproblem
Dualistic_Mix,Fri Jun 05 00:44:05 IST 2015,those moment best friend girl feel control relationshipproblem life canthandl
Dualistic_Mix,Thu Jun 04 16:15:31 IST 2015,if i ask load question i want fail
