username,time,tweet
skmalhotra7,Thu Feb 25 18:36:55 IST 2016,if see smile public mean i laugh joke i tell head
skmalhotra7,Tue Feb 23 11:58:05 IST 2016,need shortcut reed book
skmalhotra7,Sun Feb 21 01:37:54 IST 2016,count
skmalhotra7,Sat Feb 20 23:28:43 IST 2016,rt mr i wanna visit injur father amount agit make elig go hisar pleas guid or
skmalhotra7,Sat Feb 20 23:14:17 IST 2016,how peopl access internet i saw news say internet servic block
skmalhotra7,Sat Feb 20 22:52:25 IST 2016,flight chang high due jatreserv jatquotastir
skmalhotra7,Sat Feb 20 22:42:17 IST 2016,brother help send true news news channel
skmalhotra7,Sat Feb 20 22:40:06 IST 2016,accord present report rohtak one progress district haryana send year back jatquotastir jatreserv
skmalhotra7,Wed Jan 06 10:51:24 IST 2016,rt bewar peopl talk nice time good pretend
skmalhotra7,Mon Jan 04 13:51:19 IST 2016,rt whatev make happi continu els miser
skmalhotra7,Mon Jan 04 13:45:12 IST 2016,markzuckerberg jarvi ironman artificialintellig
skmalhotra7,Mon Jan 04 13:38:14 IST 2016,rt india world largest produc automobil annual averag product mn vehicl
skmalhotra7,Mon Jan 04 13:37:55 IST 2016,rt don know pollut level took minut via car pool reach noida south delhi normal take
skmalhotra7,Sun Jan 03 12:19:30 IST 2016,everyon want one chanc guy year so one chanc chang transform bounc back newyearsresolut newyear
skmalhotra7,Thu Dec 31 10:52:29 IST 2015,rt i often silent i scream insid
skmalhotra7,Tue Dec 29 17:17:58 IST 2015,rt there come time believ everyth finish that begin
skmalhotra7,Mon Dec 28 02:56:33 IST 2015,rt rememb guy
skmalhotra7,Sat Dec 26 20:45:58 IST 2015,rt don chase peopl work hard under two principl right peopl find way
skmalhotra7,Sat Dec 26 20:45:17 IST 2015,rt if friendship base compat polit ideolog polit
skmalhotra7,Wed Nov 18 02:20:47 IST 2015,rt a desper attempt win argument usual unmask idioci
skmalhotra7,Mon Nov 16 10:43:24 IST 2015,rt if want someth done ask busi person
skmalhotra7,Fri Nov 13 15:41:40 IST 2015,never get rid person understand anyon els friend entrepreneur busi
skmalhotra7,Fri Nov 13 15:38:59 IST 2015,rt thing learn busi school how give visit card use two hand how abbrevi everyth
skmalhotra7,Thu Nov 12 10:29:02 IST 2015,rt imagin import knowledg
skmalhotra7,Thu Nov 12 10:28:52 IST 2015,i like hangout peopl make forget look phone tech iphon nexus
skmalhotra7,Thu Nov 12 10:25:26 IST 2015,rt most scare peopl stop love
skmalhotra7,Wed Nov 11 09:52:44 IST 2015,rt everi entrepreneur blog websit tell stori detail each one teach one
skmalhotra7,Tue Nov 10 14:34:10 IST 2015,don let action defin prioriti quot entrepreneur busi
skmalhotra7,Tue Nov 10 13:00:49 IST 2015,women want men text first want man text first ironi loveyourself
skmalhotra7,Tue Nov 10 10:56:17 IST 2015,you dear tear i guess quot entrepreneur
skmalhotra7,Tue Nov 10 10:52:52 IST 2015,it better die feet live knee quot linkedin
skmalhotra7,Tue Nov 10 10:30:29 IST 2015,rt not rectangl squar squar rectangl same dinosaur so toronto raptor bird
skmalhotra7,Tue Nov 10 10:28:00 IST 2015,current emot i need money endoftheday
skmalhotra7,Tue Nov 10 10:25:31 IST 2015,if i time i built time machin
skmalhotra7,Mon Nov 09 23:25:41 IST 2015,rt diwali go back place wifi know
skmalhotra7,Mon Nov 09 11:20:15 IST 2015,rt the thing make unhappi thought chang
skmalhotra7,Sat Oct 24 09:56:40 IST 2015,the best reveng massiv success motiv
skmalhotra7,Sat Oct 24 09:53:43 IST 2015,rt take risk life absolut necessari
skmalhotra7,Mon Jul 13 07:02:54 IST 2015,nobodi hate someth bore
skmalhotra7,Sat Jul 11 11:21:05 IST 2015,pleas understand i tri
skmalhotra7,Fri Jul 10 09:28:29 IST 2015,rt the univers reward take risk behalf shakti gawain quot
skmalhotra7,Wed Jul 08 09:40:35 IST 2015,twitter one place go say random thought head see everybodi els weird
skmalhotra7,Mon Jul 06 23:35:31 IST 2015,i need someon life gonna motiv someon go stress motiv
skmalhotra7,Mon Jul 06 23:32:09 IST 2015,don fight someon attent if realli care quot
skmalhotra7,Tue Jun 30 10:38:07 IST 2015,rt you younger today ever make use
skmalhotra7,Tue Jun 30 01:41:07 IST 2015,rt pleas laugh just guffaw
skmalhotra7,Tue Jun 30 01:40:16 IST 2015,rt everi accomplish start decis tri
skmalhotra7,Tue Jun 30 01:37:00 IST 2015,rt i read joke twitter i read fb i read whatsapp relat read i
skmalhotra7,Sun Jun 28 14:30:23 IST 2015,go dream peopl success entrepreneur
skmalhotra7,Sun Jun 28 14:25:30 IST 2015,the man move mountain one began carri away small stone startup motiv
