username,time,tweet
wowinthedetails,Wed Feb 24 21:35:15 IST 2016,noth like power go middl spreadsheet yayworkloss
wowinthedetails,Wed Feb 24 20:56:10 IST 2016,limit mount expans just made panther
wowinthedetails,Wed Feb 24 20:53:37 IST 2016,i run boost cook fish quest beat level draenor
wowinthedetails,Wed Feb 24 20:52:29 IST 2016,did announc strider
wowinthedetails,Wed Feb 24 20:50:37 IST 2016,raft better sinc allow combat
wowinthedetails,Wed Feb 24 20:50:03 IST 2016,i sad holi palli not sure i play next expans i play sinc char i play regular
wowinthedetails,Wed Feb 24 20:48:19 IST 2016,i love mine raft
wowinthedetails,Wed Feb 24 20:47:30 IST 2016,rare see wild
wowinthedetails,Wed Feb 24 17:40:04 IST 2016,lightsab look head immelt
wowinthedetails,Wed Feb 24 17:34:06 IST 2016,halfway done sent comment page
wowinthedetails,Wed Feb 24 09:52:20 IST 2016,i go read
wowinthedetails,Wed Feb 24 09:42:32 IST 2016,dear i know thank lower mailbox garrison handi
wowinthedetails,Wed Feb 24 09:38:41 IST 2016,did see amt hate got tweet so stupid wish peopl would grow
wowinthedetails,Wed Feb 24 09:34:55 IST 2016,love
wowinthedetails,Wed Feb 24 08:37:40 IST 2016,the older better you guy show possibl older dilapid home
wowinthedetails,Wed Feb 24 08:32:59 IST 2016,that hous rock so gorgeous i love big transform miraclework
wowinthedetails,Tue Feb 23 23:14:49 IST 2016,give back door one person fbi mani would get access abus
wowinthedetails,Tue Feb 23 23:13:13 IST 2016,i see gate oke back door wonder phone
wowinthedetails,Tue Feb 23 23:12:11 IST 2016,peopl would complain money particular denomin lol
wowinthedetails,Tue Feb 23 23:10:12 IST 2016,
wowinthedetails,Tue Feb 23 23:09:36 IST 2016,see otherwis
wowinthedetails,Tue Feb 23 17:40:34 IST 2016,oh good i hope
wowinthedetails,Tue Feb 23 07:57:17 IST 2016,monro i look
wowinthedetails,Tue Feb 23 07:27:19 IST 2016,prime ad out africa list if never seen miss someth splendid ihadafarminafrica
wowinthedetails,Mon Feb 22 07:33:01 IST 2016,i think last episod downtonpb feel like last harrypott movi bittersweet hate see end
wowinthedetails,Mon Feb 22 07:30:41 IST 2016,downtonpb start now
wowinthedetails,Mon Feb 22 07:27:21 IST 2016,he turn us
wowinthedetails,Mon Feb 22 07:26:22 IST 2016,i doubt care anyth els honey
wowinthedetails,Mon Feb 22 07:23:28 IST 2016,go miss downtonpb much such great season far
wowinthedetails,Mon Feb 22 06:00:21 IST 2016,make sens wonder well lowcountri
wowinthedetails,Mon Feb 22 05:50:52 IST 2016,i use itun perfect
wowinthedetails,Mon Feb 22 05:06:23 IST 2016,pizza eaten wait downtonpb
wowinthedetails,Mon Feb 22 05:04:02 IST 2016,ebook
wowinthedetails,Mon Feb 22 05:03:44 IST 2016,rt hey rt monday nite chanc win audiobook copi the progress citi primer
wowinthedetails,Mon Feb 22 05:02:25 IST 2016,total incoher he crazi
wowinthedetails,Mon Feb 22 03:28:39 IST 2016,rt hamillhimself these action figur look
wowinthedetails,Mon Feb 22 01:57:30 IST 2016,but counti one two went rubio
wowinthedetails,Mon Feb 22 01:56:43 IST 2016,these staunch repub want see bill back wh capac
wowinthedetails,Mon Feb 22 01:54:59 IST 2016,if short healer yell ingam
wowinthedetails,Mon Feb 22 01:53:23 IST 2016,republican
wowinthedetails,Sun Feb 21 21:26:08 IST 2016,mechan seem place except stand out hanz franz railroad depot
wowinthedetails,Sun Feb 21 21:23:51 IST 2016,is fight use uniqu expans ago i get mix
wowinthedetails,Sun Feb 21 21:21:26 IST 2016,it help relationship built back i better raider i like
wowinthedetails,Sun Feb 21 21:18:35 IST 2016,oh wow great blog name grow azeroth
wowinthedetails,Sun Feb 21 21:17:03 IST 2016,earli east coast hun
wowinthedetails,Sun Feb 21 21:15:05 IST 2016,probabl still sad
wowinthedetails,Sun Feb 21 21:14:27 IST 2016,learn keep mouth shut stuff and realli qualifi
wowinthedetails,Sun Feb 21 21:12:25 IST 2016,never sure ego sexism mayb
wowinthedetails,Sun Feb 21 21:11:42 IST 2016,team talk come rogu tank yesterday hehe
wowinthedetails,Sun Feb 21 21:10:42 IST 2016,lol guy quit play they split though
