username,time,tweet
abigigglez,Sun Feb 28 16:27:16 IST 2016,got drag outta bed wound okc yay random unexpect nighter
abigigglez,Sun Feb 28 11:08:27 IST 2016,rt let go peopl stress
abigigglez,Sun Feb 28 10:52:26 IST 2016,rt ˈhärtˌbrākər noun
abigigglez,Sun Feb 28 08:41:28 IST 2016,rt way fail everyth life complain everyth blame other problem never grate
abigigglez,Sat Feb 27 02:54:00 IST 2016,good luck find one like
abigigglez,Fri Feb 26 01:56:07 IST 2016,hahahaha
abigigglez,Fri Feb 26 01:32:08 IST 2016,rt don lie peopl trust trust peopl lie
abigigglez,Fri Feb 26 01:31:41 IST 2016,rt breakdown creat breakthrough
abigigglez,Thu Feb 25 13:42:21 IST 2016,love guy tell two step break half toenail
abigigglez,Wed Feb 24 23:46:45 IST 2016,rt peopl alway music taylor swift
abigigglez,Wed Feb 24 23:42:30 IST 2016,rt i need life
abigigglez,Wed Feb 24 23:40:24 IST 2016,rt i alway go regist cutest cashier
abigigglez,Wed Feb 24 22:55:44 IST 2016,rt it goe dm
abigigglez,Wed Feb 24 12:43:44 IST 2016,rt best friend poppin
abigigglez,Tue Feb 23 06:12:42 IST 2016,it imposs bad monday sticker come mail riffrafflov
abigigglez,Mon Feb 22 23:34:23 IST 2016,rt guy heaven everyth carrot
abigigglez,Mon Feb 22 23:01:00 IST 2016,unborn child
abigigglez,Mon Feb 22 22:54:02 IST 2016,i set alarm phone rememb feed
abigigglez,Mon Feb 22 22:19:25 IST 2016,rt high school did u studi last night nah fam what make colleg how long u studi last night hour what
abigigglez,Mon Feb 22 11:22:09 IST 2016,my poor webkinz
abigigglez,Mon Feb 22 08:22:52 IST 2016,k l h c
abigigglez,Sun Feb 21 10:53:05 IST 2016,come deej
abigigglez,Sun Feb 21 07:07:44 IST 2016,rt i am north
abigigglez,Sun Feb 21 07:03:09 IST 2016,rt fear
abigigglez,Sun Feb 21 05:43:56 IST 2016,rt listen i know colleg assign seat seat bye
abigigglez,Sat Feb 20 10:59:51 IST 2016,i like
abigigglez,Sat Feb 20 10:48:14 IST 2016,first thing notic girl
abigigglez,Sat Feb 20 10:26:00 IST 2016,can t wait to hear new album
abigigglez,Sat Feb 20 10:24:00 IST 2016,rt hear bar
abigigglez,Sat Feb 20 05:44:48 IST 2016,sunni dayz favorit
abigigglez,Fri Feb 19 01:21:51 IST 2016,rt grace meet us leav us found
abigigglez,Fri Feb 19 01:21:37 IST 2016,rt be awar import word life effect other
abigigglez,Thu Feb 18 23:34:27 IST 2016,back mine
abigigglez,Thu Feb 18 13:15:09 IST 2016,pray i fall asleep caus last two night i
abigigglez,Thu Feb 18 01:42:04 IST 2016,rt sometim say yike move life
abigigglez,Thu Feb 18 01:38:04 IST 2016,rt you don
abigigglez,Thu Feb 18 01:33:24 IST 2016,rt sleep someth i quick becom unfamiliar semest
abigigglez,Wed Feb 17 13:13:21 IST 2016,i keep phone disturb set rest life
abigigglez,Wed Feb 17 05:01:03 IST 2016,pleas tell pictur exist pictur exist
abigigglez,Tue Feb 16 15:27:19 IST 2016,stress eat chocol morn bed
abigigglez,Sat Feb 13 10:28:02 IST 2016,rt when someon ask describ one tree hill
abigigglez,Fri Feb 12 11:33:00 IST 2016,rt gf i sick pretend detect we split me good idea we cover ground way
abigigglez,Fri Feb 12 06:02:39 IST 2016,texa sunset
abigigglez,Fri Feb 12 02:35:07 IST 2016,rt oh valentin valentin day some peopl even groundhog groundhog day check
abigigglez,Thu Feb 11 23:28:08 IST 2016,soml
abigigglez,Thu Feb 11 09:15:30 IST 2016,rt allow god prepar he prepar futur spous
abigigglez,Thu Feb 11 09:14:30 IST 2016,rt semest take toll week
abigigglez,Wed Feb 10 12:04:26 IST 2016,about pass like i slept hour caus i actual slept hour
abigigglez,Wed Feb 10 05:21:58 IST 2016,when gina say want pizza nation pizza day
