username,time,tweet
queenofquirk,Fri Feb 26 20:03:09 IST 2016,doing first model unit nation tonight i realli know i work nervous nah
queenofquirk,Fri Feb 26 20:02:09 IST 2016,go miss go bridg i great week tcd trinitycolleg
queenofquirk,Fri Feb 26 14:12:03 IST 2016,last morn journey tcd cours
queenofquirk,Fri Feb 26 14:09:02 IST 2016,happi birthday
queenofquirk,Fri Feb 26 03:19:51 IST 2016,new vlog my februari mid term like subscrib smallyoutub youtub thegirlgang
queenofquirk,Thu Feb 25 21:25:36 IST 2016,i newspap
queenofquirk,Thu Feb 25 21:22:26 IST 2016,i realli realli realli realllllyyyy hope get vlog tonight
queenofquirk,Thu Feb 25 14:07:42 IST 2016,thursday morn thought
queenofquirk,Thu Feb 25 13:58:18 IST 2016,happi thursday
queenofquirk,Thu Feb 25 04:46:42 IST 2016,danandphilbrit i want see emoji
queenofquirk,Wed Feb 24 14:46:33 IST 2016,so i phone right make look like i busi social life cours begin littl everyon know
queenofquirk,Wed Feb 24 13:49:45 IST 2016,happi wednesday got coolest bag liquid sarcasm
queenofquirk,Tue Feb 23 00:37:51 IST 2016,gif choos appear
queenofquirk,Tue Feb 23 00:37:29 IST 2016,tweet box camera icon poll icon say gif press button list
queenofquirk,Tue Feb 23 00:35:05 IST 2016,marcelin favourit probabl finn jake rainicorn marcelin cool
queenofquirk,Tue Feb 23 00:34:05 IST 2016,oh my god is shop atlanta travel bucket list thegirlgang
queenofquirk,Tue Feb 23 00:33:07 IST 2016,heartbreak insid out probabl one deepest kid movi i ever seen
queenofquirk,Tue Feb 23 00:32:20 IST 2016,nope look like
queenofquirk,Tue Feb 23 00:32:06 IST 2016,worth
queenofquirk,Tue Feb 23 00:31:59 IST 2016,what magic chat hope fab week i leav link thegirlgang
queenofquirk,Tue Feb 23 00:30:54 IST 2016,cute
queenofquirk,Tue Feb 23 00:30:29 IST 2016,bing bong i watch insid out last night
queenofquirk,Tue Feb 23 00:29:26 IST 2016,look like everyday awkward human thegirlgang
queenofquirk,Tue Feb 23 00:28:48 IST 2016,best
queenofquirk,Tue Feb 23 00:28:37 IST 2016,least would hope sad end like rose thegirlgang
queenofquirk,Tue Feb 23 00:28:03 IST 2016,amaz thegirlgang
queenofquirk,Tue Feb 23 00:26:39 IST 2016,also make peopl laugh hear posit thing peopl when i laugh magic thegirlgang
queenofquirk,Tue Feb 23 00:25:37 IST 2016,i realis i magic hobbi blog who knew fun full potenti friendship thegirlgang
queenofquirk,Tue Feb 23 00:23:58 IST 2016,yay i love cute i watch age though i think i seen season fulli thegirlgang
queenofquirk,Tue Feb 23 00:22:58 IST 2016,the tenth doctor would never love us would thegirlgang
queenofquirk,Tue Feb 23 00:22:05 IST 2016,true it one ultim dream
queenofquirk,Tue Feb 23 00:20:45 IST 2016,unicorn obvious or specif rainicorn adventur thegirlgang
queenofquirk,Tue Feb 23 00:19:03 IST 2016,i iron man kinda gal thegirlgang
queenofquirk,Tue Feb 23 00:18:28 IST 2016,yessss
queenofquirk,Tue Feb 23 00:17:51 IST 2016,i season i like matt smith david special thegirlgang
queenofquirk,Tue Feb 23 00:16:35 IST 2016,aww i miss i late doctor who bandwagon start juli watch netflix thegirlgang
queenofquirk,Tue Feb 23 00:14:43 IST 2016,mani beauti men thor movi
queenofquirk,Tue Feb 23 00:14:15 IST 2016,i would leav life behind travel differ planet especi past i love histori thegirlgang
queenofquirk,Tue Feb 23 00:13:01 IST 2016,gif the tenth doctor best doctor
queenofquirk,Tue Feb 23 00:09:23 IST 2016,true how earth could choos thegirlgang
queenofquirk,Tue Feb 23 00:08:57 IST 2016,tom hiddleston
queenofquirk,Tue Feb 23 00:08:13 IST 2016,doctor who fan i live time lord world travel tardi thegirlgang
queenofquirk,Tue Feb 23 00:04:32 IST 2016,love the food one especi thegirlgang
queenofquirk,Tue Feb 23 00:03:19 IST 2016,loki thegirlgang
queenofquirk,Tue Feb 23 00:01:45 IST 2016,i think i decid two thegirlgang
queenofquirk,Tue Feb 23 00:01:12 IST 2016,best answer thegirlgang
queenofquirk,Tue Feb 23 00:00:53 IST 2016,rt when i come across someon like harri potter thegirlgang
queenofquirk,Mon Feb 22 23:59:16 IST 2016,would amaz thegirlgang
queenofquirk,Mon Feb 22 23:58:18 IST 2016,read tweet make want accept hogwart alreadi letter thegirlgang
queenofquirk,Mon Feb 22 23:55:51 IST 2016,could real
