username,time,tweet
sethidema,Wed May 13 07:45:30 IST 2015,awkward situat favorit
sethidema,Tue May 12 22:44:32 IST 2015,didn think would get accid today happytuesday
sethidema,Tue May 12 22:19:09 IST 2015,i want torch lake
sethidema,Tue May 12 21:52:54 IST 2015,rt pray tom bradi he spend game suspens prison
sethidema,Tue May 12 17:38:03 IST 2015,all i care right makin stackin money
sethidema,Tue May 12 07:03:49 IST 2015,littl gumpi lol
sethidema,Tue May 12 06:41:15 IST 2015,thing exact suppos if u like chang want
sethidema,Tue May 12 03:58:16 IST 2015,rt i realli wanna know pierc kobe got status clutch lebron got status choker
sethidema,Tue May 12 00:34:47 IST 2015,rt it palindrom week
sethidema,Tue May 12 00:17:58 IST 2015,rt let go tyusbattl
sethidema,Tue May 12 00:16:18 IST 2015,rt underwat citi shicheng china
sethidema,Mon May 11 23:07:02 IST 2015,nothin like chillen rain drinkin beer gettin paid restofthedayoff
sethidema,Mon May 11 23:00:55 IST 2015,rain day score
sethidema,Mon May 11 21:57:14 IST 2015,rt i shi first i comfort get readi crazi shit
sethidema,Mon May 11 06:50:12 IST 2015,lebrooooooon
sethidema,Mon May 11 06:04:09 IST 2015,rt rose pierc went bank gm winner kingjam went atm swish gm winner bank
sethidema,Mon May 11 00:30:21 IST 2015,rt accident said happi mother day person instead write paragraph social media
sethidema,Mon May 11 00:07:44 IST 2015,movi n lunch happymothersday
sethidema,Sat May 09 19:58:26 IST 2015,good luck doggiee
sethidema,Sat May 09 19:57:48 IST 2015,rt my bros like famili
sethidema,Sat May 09 18:00:51 IST 2015,shouldn stay till last night fml
sethidema,Sat May 09 17:24:39 IST 2015,around noon gay boy
sethidema,Sat May 09 17:22:45 IST 2015,short af say coupl hous let burn
sethidema,Sat May 09 17:20:23 IST 2015,i hour yesterday fml lol
sethidema,Sat May 09 16:49:11 IST 2015,fml
sethidema,Sat May 09 09:47:17 IST 2015,slut
sethidema,Sat May 09 05:09:20 IST 2015,hour go happyfriday overtim getmeadrink andblunt
sethidema,Sat May 09 04:58:13 IST 2015,right
sethidema,Sat May 09 04:57:30 IST 2015,rt break jaguar round pick dant fowler tore acl first practic miss season via http
sethidema,Fri May 08 23:19:01 IST 2015,first look uniform nflminicamp look like piec shit lol
sethidema,Fri May 08 23:17:37 IST 2015,great show
sethidema,Fri May 08 17:55:14 IST 2015,rt beer liquor never sicker toothpast orang juic dead
sethidema,Fri May 08 16:48:49 IST 2015,i kiss neck n tell ya everyth great
sethidema,Thu May 07 16:58:51 IST 2015,rt can stand girl leav seat restroom how disrespect
sethidema,Wed May 06 23:29:55 IST 2015,i drink water it pussi
sethidema,Wed May 06 17:56:17 IST 2015,realest game
sethidema,Wed May 06 17:50:53 IST 2015,doubt
sethidema,Wed May 06 17:35:21 IST 2015,lol cloudi af
sethidema,Wed May 06 17:15:30 IST 2015,rt a list peopl ask opinion
sethidema,Tue May 05 23:36:43 IST 2015,jonah
sethidema,Tue May 05 22:44:13 IST 2015,lol
sethidema,Tue May 05 22:42:26 IST 2015,peopl say better lebron hilari
sethidema,Mon May 04 23:25:40 IST 2015,rt jame harden steph curri mvp award that tough round playoff i got better
sethidema,Mon May 04 08:20:46 IST 2015,rt zoo pet zoo about that life
sethidema,Mon May 04 06:23:29 IST 2015,anyon look burn rollup
sethidema,Sun May 03 20:00:01 IST 2015,dis diiiiick
sethidema,Sun May 03 19:56:59 IST 2015,i alway say alright gucci idk
sethidema,Sun May 03 11:09:15 IST 2015,but realli lol
sethidema,Sun May 03 11:04:16 IST 2015,blunt session tho rollinup join
sethidema,Sun May 03 11:02:14 IST 2015,blunt blunt
