username,time,tweet
nelyaozaeta,Mon Feb 22 13:52:32 IST 2016,ando con todo shit
nelyaozaeta,Sat Feb 20 12:35:58 IST 2016,i hate i lost respect
nelyaozaeta,Fri Feb 19 23:56:26 IST 2016,rt friend remind
nelyaozaeta,Fri Feb 19 23:28:57 IST 2016,mi doctora de renal hace tanta pausa que al fina se le olvida de lo que estaba hablando ya por favor piedad
nelyaozaeta,Thu Feb 18 13:04:27 IST 2016,where f
nelyaozaeta,Sat Feb 13 06:27:51 IST 2016,
nelyaozaeta,Sat Feb 13 03:38:48 IST 2016,rt dr dre get tv show via appl tech giant first
nelyaozaeta,Thu Feb 11 10:40:46 IST 2016,creía que éramo un equipo pero al final yo para ti era nada
nelyaozaeta,Wed Feb 10 02:27:13 IST 2016,where drake
nelyaozaeta,Sun Feb 07 05:25:52 IST 2016,tenemo que valorar mas las persona que pesar de todo se quedan tu lado sin cambiart sin desilusionart
nelyaozaeta,Tue Feb 02 14:04:26 IST 2016,no cabe duda en cualquier momento te entera de cosa sorprendent como a mi mejor amiga le gusta el tocino whaat still
nelyaozaeta,Tue Feb 02 12:17:22 IST 2016,rt best peopl corner alreadi even need
nelyaozaeta,Sun Jan 31 14:05:07 IST 2016,siento mi cama como una nube flotant
nelyaozaeta,Fri Jan 29 12:33:12 IST 2016,zero zero zero
nelyaozaeta,Fri Jan 29 12:31:58 IST 2016,that mani fuck i give
nelyaozaeta,Fri Jan 29 12:31:17 IST 2016,zero
nelyaozaeta,Thu Jan 28 14:14:58 IST 2016,rt el interno saliendo del hospit de postguardia viendo la sala de espera llena
nelyaozaeta,Mon Jan 25 13:01:20 IST 2016,
nelyaozaeta,Sun Jan 24 13:18:23 IST 2016,you made heart gost town
nelyaozaeta,Tue Jan 19 03:07:12 IST 2016,como que si encanta mucho mi carrera
nelyaozaeta,Sun Jan 17 11:39:35 IST 2016,n w a life
nelyaozaeta,Sun Jan 17 11:39:10 IST 2016,rt west coast w
nelyaozaeta,Mon Jan 11 15:12:46 IST 2016,rt todo los médico quisiéramo un juguet asi
nelyaozaeta,Sat Jan 09 16:59:15 IST 2016,la vida es tan corta como la niev que cae
nelyaozaeta,Sat Jan 09 15:40:39 IST 2016,rt swish februari
nelyaozaeta,Sat Jan 09 15:18:39 IST 2016,
nelyaozaeta,Fri Jan 08 17:07:20 IST 2016,one day busi boomin
nelyaozaeta,Sun Jan 03 15:03:27 IST 2016,como hay gent que te quier ver destrozado también están los que se rompen un poco para completart jorg muñoz
nelyaozaeta,Sun Jan 03 15:02:19 IST 2016,no se daña quien se quier
nelyaozaeta,Thu Dec 31 16:40:29 IST 2015,it feel
nelyaozaeta,Sun Dec 27 16:22:01 IST 2015,rt wordporn
nelyaozaeta,Sun Dec 27 06:13:57 IST 2015,rt
nelyaozaeta,Sun Dec 27 06:12:58 IST 2015,chang environ
nelyaozaeta,Tue Dec 22 14:33:55 IST 2015,cree que despué de tanta mierda uno vuelv ser el mismo
nelyaozaeta,Sat Dec 19 11:19:56 IST 2015,rt hay que aprend darl las persona el mismo valor e importancia que ella nos dan
nelyaozaeta,Thu Dec 17 01:19:17 IST 2015,entrénat para dejar libr todo lo que teme perder yoda
nelyaozaeta,Wed Dec 16 12:07:33 IST 2015,rt breathtak photo intern space station
nelyaozaeta,Mon Dec 14 02:59:29 IST 2015,my nigga life
nelyaozaeta,Sun Dec 13 10:39:12 IST 2015,
nelyaozaeta,Sat Dec 12 12:54:12 IST 2015,somo nosotro solo una partícula de polvo dentro de la galaxia
nelyaozaeta,Thu Dec 10 01:22:01 IST 2015,así deberían de ser siempr las amistad sin drama felic todo disfrutando los momento junto lucki
nelyaozaeta,Thu Dec 03 22:52:00 IST 2015,
nelyaozaeta,Thu Dec 03 21:23:06 IST 2015,solo un día más
nelyaozaeta,Wed Dec 02 15:00:34 IST 2015,ya solo exámen más voy ganando
nelyaozaeta,Mon Nov 30 16:09:11 IST 2015,
nelyaozaeta,Sat Nov 28 21:28:49 IST 2015,materia meno
nelyaozaeta,Fri Nov 27 02:05:30 IST 2015,rt abbey road the beatl gif
nelyaozaeta,Fri Nov 27 01:58:31 IST 2015,ni en un día se quier ni en dos se olvida
nelyaozaeta,Thu Nov 26 21:27:39 IST 2015,cuando ya sólo tu cama te pued consolar
nelyaozaeta,Tue Nov 24 23:06:41 IST 2015,el amor es natur
