username,time,tweet
Ant_on_sticks,Sun Feb 28 04:28:30 IST 2016,  crapgamer   pc here i come thats how i have been gaming all my life  
Ant_on_sticks,Sat Feb 27 07:44:09 IST 2016,podcast  when i finally finish 1-3snooze fest games to me you cant make this type of shit up
Ant_on_sticks,Sat Feb 27 05:43:24 IST 2016,  im all im i loved vietnam i need something different cant wait
Ant_on_sticks,Fri Feb 26 23:16:41 IST 2016, brunette bbw angelinacastrolive angelinacastro latina what bracelet
Ant_on_sticks,Thu Feb 25 16:31:13 IST 2016, i cant find cortana must be in the settings
Ant_on_sticks,Thu Feb 25 04:40:35 IST 2016,nice rumorxbox steam page is reportedly in development - eteknix - 
Ant_on_sticks,Wed Feb 24 07:19:52 IST 2016,    i have owned all 3 and i dis agree as i watch tv and get a message at the same time evolution
Ant_on_sticks,Wed Feb 24 05:52:57 IST 2016, crapgamer whatever  happened it has missed me been playing jc3digital all weekend
Ant_on_sticks,Wed Feb 24 03:48:25 IST 2016,  lolwe in here ear to the streetsyoutube/twitter streets
Ant_on_sticks,Wed Feb 24 03:42:15 IST 2016,  prefer my box and wiiu ill get a ps4 when its worth it bought ps3 for mg and hardly even touched it after the wild
Ant_on_sticks,Sun Feb 21 21:37:33 IST 2016, withdrawal lol played some madden today it helped
Ant_on_sticks,Tue Feb 16 04:02:09 IST 2016, crapgamer  it didnt take qb for me to see the vision i saw it im the og xbox luv it 
Ant_on_sticks,Mon Feb 15 22:59:18 IST 2016, i got the halo reach 360 but this time skipped halo box i want a gears box black so its somewhat adult looking
Ant_on_sticks,Mon Feb 15 22:18:16 IST 2016, gearsofwar4 the only special edit n xbox ill buy is a gears one
Ant_on_sticks,Mon Feb 15 22:15:56 IST 2016, why bother😴   
Ant_on_sticks,Mon Feb 15 16:16:03 IST 2016,crapgamer one the first one
Ant_on_sticks,Mon Feb 15 06:08:35 IST 2016,  its a must see even if you have never read the comics awesome flix
Ant_on_sticks,Mon Feb 15 04:15:50 IST 2016, crapgamer seem it earlier stopped reading after crappy gamer shit is funny though
Ant_on_sticks,Sun Feb 14 03:00:10 IST 2016, good that would defeat their purpose so the qb coming to pc is null all hoopla back to my backlog before  drop
Ant_on_sticks,Sun Feb 14 02:48:15 IST 2016,crapgamer     groove music would be nice but it would have to be at a reduced price
Ant_on_sticks,Sat Feb 13 07:33:53 IST 2016,crapgamer standard  packed in with console got it
Ant_on_sticks,Sat Feb 13 07:03:33 IST 2016,crapgamer so you got a pc to run those xb1/windows games ill guess not like most console gamers right i maybe wrong
Ant_on_sticks,Sat Feb 13 06:41:13 IST 2016,crapgamer mofos been paying for live 4 yearsnow its not fairtitanfall they didnt payoutrage lol stop it
Ant_on_sticks,Sat Feb 13 05:02:46 IST 2016,  you are the voice of reason
Ant_on_sticks,Sat Feb 13 05:02:00 IST 2016,crapgamer but its a standard  controller
Ant_on_sticks,Sat Feb 13 04:57:53 IST 2016,  crapgamer damn i miss my disc driveall digitalembrace it 
Ant_on_sticks,Sat Feb 13 04:44:17 IST 2016,crapgamer  standard controller lolkeep it up bro ludditelmao 
Ant_on_sticks,Sat Feb 13 04:32:12 IST 2016,  crapgamer im about the games and ms gow 
Ant_on_sticks,Sat Feb 13 04:31:07 IST 2016, xbox gow microsoft xboxone 
Ant_on_sticks,Sat Feb 13 04:20:56 IST 2016,crapgamer lolgood shit traded mine for a dreamcast its useless if you dont have a tube tv
Ant_on_sticks,Sat Feb 13 04:13:23 IST 2016,crapgamer wanna buy my n64 lmao
Ant_on_sticks,Sat Feb 13 03:57:23 IST 2016, hes a ludditelolman i love this shit
Ant_on_sticks,Sat Feb 13 03:54:04 IST 2016, crapgamer  oh shithalo on surfacestop it 
Ant_on_sticks,Sat Feb 13 03:50:31 IST 2016,  tell crap to google luddite
Ant_on_sticks,Sat Feb 13 03:48:54 IST 2016,  your boy crap is so lost as a gamer
Ant_on_sticks,Fri Feb 12 23:17:56 IST 2016,    gamers yeah that got lost in the youtube crumbside of things we gotta get on that  3/8
Ant_on_sticks,Fri Feb 12 23:09:41 IST 2016,    windows 10 a microsoft product sad state that some gamers are in man
Ant_on_sticks,Fri Feb 12 23:06:29 IST 2016, crapgamer losing it to windows 10 you know people were waiting to get at crap those media sites mad him look bad let it go
Ant_on_sticks,Fri Feb 12 23:02:59 IST 2016, crapgamer  smh sad thought process
Ant_on_sticks,Fri Feb 12 22:54:34 IST 2016,    because it doesnt feed into their perpetuation of this console war who complains about getting more
Ant_on_sticks,Fri Feb 12 18:33:19 IST 2016, crapgamer then you cant go wrong pc gaming is not for me but the option to play win/∗ms∗or xb1 is a plus
Ant_on_sticks,Fri Feb 12 17:32:02 IST 2016,crapgamer isxbox comedian i dont care how my games are deliveredits about the games 2 megive a box/flash w/ a game store
Ant_on_sticks,Fri Feb 12 17:12:39 IST 2016,isxbox crapgamer lifeisgaming it should have always been about gaming
Ant_on_sticks,Fri Feb 12 17:11:25 IST 2016, crapgamer xboxone windows10 windows/xb1 its all the same whats the issue why complain about more
Ant_on_sticks,Fri Feb 12 16:24:28 IST 2016, crapgamer my xbox1 now is an app i dont even use the damn disc tray give me a windows box as long as i can play the games
Ant_on_sticks,Fri Feb 12 16:20:43 IST 2016, crapgamer  how are you stabbed in the back bought all xboxes day one and i dont see it as an issue smh
Ant_on_sticks,Fri Feb 12 06:52:15 IST 2016, cross buy is awesome xbox gamer primarily but the option is great
Ant_on_sticks,Fri Feb 12 05:40:23 IST 2016, the funny thing is his money is still going to microsoft smh some people software makes money
Ant_on_sticks,Fri Feb 12 05:33:28 IST 2016, crapgamer    who cares im not gonna play it now because its on windows thats laughable
Ant_on_sticks,Fri Feb 12 05:26:30 IST 2016,a lot of gamin ceos todayglad that they are filling my twitter feed with nonsense no ammo for the war whats the issuewho the fuck cares
