username,time,tweet
WhereYouBihn,Tue Jun 02 19:42:26 IST 2015,if blanch dorothi love child the golden girl i would charm yet
WhereYouBihn,Mon Jun 01 20:38:33 IST 2015,it june feel like octob like i love fall summer need love
WhereYouBihn,Mon Jun 01 11:38:23 IST 2015,it i eat frozen pizza roll start bottom
WhereYouBihn,Mon Jun 01 11:32:00 IST 2015,rt i need complet i need inspir
WhereYouBihn,Sun May 31 22:00:40 IST 2015,i like coffe like mistress dark
WhereYouBihn,Sun May 31 19:31:05 IST 2015,i got free coffe today barista said i need thank
WhereYouBihn,Sun May 31 19:29:05 IST 2015,rt i room disgust peopl life byeeee bodi shamer
WhereYouBihn,Fri May 29 17:44:36 IST 2015,real life question how i convinc parent go see concert
WhereYouBihn,Thu May 28 03:09:12 IST 2015,he hot i think i know best
WhereYouBihn,Thu May 28 01:54:56 IST 2015,rt what think new mako coaster nothingfast
WhereYouBihn,Tue May 26 02:52:09 IST 2015,rt all photographi grad student peopl still take pictur i drunk
WhereYouBihn,Mon May 25 01:41:18 IST 2015,rt travi
WhereYouBihn,Sun May 24 11:51:11 IST 2015,i read time
WhereYouBihn,Sun May 24 10:16:02 IST 2015,i wear fake glass talk novel
WhereYouBihn,Sun May 24 10:15:18 IST 2015,rt dublin tell my opinion noth marref
WhereYouBihn,Fri May 22 10:39:50 IST 2015,just saw ad organ dirt i done societi
WhereYouBihn,Thu May 21 10:29:49 IST 2015,don let focus shift far back els never see come next
WhereYouBihn,Mon May 18 21:05:48 IST 2015,rt fav kim rt lesli knope
WhereYouBihn,Sun May 17 07:48:31 IST 2015,rt datinganactor
WhereYouBihn,Sat May 16 02:09:50 IST 2015,hang tweet tweet hang osuday
WhereYouBihn,Fri May 15 23:43:43 IST 2015,here closest friend dragster cedarpoint
WhereYouBihn,Fri May 15 18:44:04 IST 2015,oh gosh ohio mani cornfield where ohio
WhereYouBihn,Fri May 15 07:23:52 IST 2015,we might nation championship undisput champ tweetup osuday
WhereYouBihn,Wed May 13 23:54:00 IST 2015,i love present ask rhetor question and i say love i mean hate i want answer question
WhereYouBihn,Wed May 13 23:20:44 IST 2015,a huge shout keep amaz campus run smooth effici sch
WhereYouBihn,Wed May 13 21:37:26 IST 2015,senior year live regret alway order guac
WhereYouBihn,Wed May 13 08:46:52 IST 2015,i life advic once start call phd graduat go get hot dog knowyouraudi
WhereYouBihn,Sun May 10 07:20:31 IST 2015,i love smell bleach go swim put candl call summer
WhereYouBihn,Sun May 10 04:20:28 IST 2015,someon ask i work h m thank
WhereYouBihn,Sun May 10 02:27:31 IST 2015,rt debutgarou time show new ride media
WhereYouBihn,Sun May 10 02:23:14 IST 2015,i rocki kick week follow make shiver antici pation
WhereYouBihn,Fri May 08 11:16:10 IST 2015,forev alway babe
WhereYouBihn,Thu May 07 21:54:34 IST 2015,rt i go shop
WhereYouBihn,Tue May 05 00:23:59 IST 2015,no peopl let smart bring spongebob
WhereYouBihn,Tue May 05 00:22:37 IST 2015,big meati claw
WhereYouBihn,Mon May 04 17:20:17 IST 2015,graduat symbol life end rather match light way new brighter futur
WhereYouBihn,Sat May 02 09:13:11 IST 2015,a public apolog take nap skip werk it i owe babe
WhereYouBihn,Sat May 02 09:11:30 IST 2015,rt happi thank you note friday
WhereYouBihn,Sat May 02 09:08:40 IST 2015,rt this play i express hamilton
WhereYouBihn,Fri May 01 21:28:23 IST 2015,there better feel turn final term paper wink professor bye
WhereYouBihn,Fri May 01 19:45:17 IST 2015,rt and lie karma truest form
WhereYouBihn,Fri May 01 19:44:36 IST 2015,it go may alreadi may so stop
WhereYouBihn,Fri May 01 10:49:26 IST 2015,what cologn calvin klein no call sweat it cheap like
WhereYouBihn,Fri May 01 04:17:48 IST 2015,i even think i know thousand peopl can i sit cool kid tabl yet
WhereYouBihn,Fri May 01 02:21:07 IST 2015,rt explor career legaci fashion origin talent short cours
WhereYouBihn,Fri May 01 01:48:17 IST 2015,rt tomorrow is a new month of cours everi day is a new day but this is a littl more special so be sure to make posit
WhereYouBihn,Thu Apr 30 08:39:44 IST 2015,when i go sit i alway end roll around floor pretend i armadillo
WhereYouBihn,Thu Apr 30 08:04:40 IST 2015,rt pleas rt
WhereYouBihn,Wed Apr 29 12:22:45 IST 2015,yes yes yes
WhereYouBihn,Wed Apr 29 12:22:31 IST 2015,rt my aesthet lame dad understand fashion late
