username,time,tweet
Cool_Bad_Rajjo,Wed Feb 24 09:33:11 IST 2016,boston has so well mannered and beautiful people  i totally belong here p 
Cool_Bad_Rajjo,Sun Feb 21 07:18:21 IST 2016,man bush took all the shit coming out trumps mouth and now he is leaving this race shit  sense 
Cool_Bad_Rajjo,Sun Feb 21 07:15:09 IST 2016,trump winning so thats how god has planned to end human race 
Cool_Bad_Rajjo,Wed Feb 17 04:44:02 IST 2016, is will ferrell of bollywood  everyone loves him
Cool_Bad_Rajjo,Sun Feb 14 13:04:53 IST 2016,rt  when those participating in the gopdebate ignore this 
Cool_Bad_Rajjo,Sun Feb 14 13:04:25 IST 2016,rt  are you not entertained gopdebate  
Cool_Bad_Rajjo,Sun Feb 14 08:09:00 IST 2016,things just got bitter gopdebate
Cool_Bad_Rajjo,Sun Feb 14 08:07:37 IST 2016,did rubio just supported jeb gopdebate
Cool_Bad_Rajjo,Sun Feb 14 07:59:54 IST 2016,jeb and trump or tom and jerry gopdebate
Cool_Bad_Rajjo,Fri Feb 12 14:26:22 IST 2016,leaving library​ at 400 am cleaning staff leaving so soon buddy 
Cool_Bad_Rajjo,Fri Feb 12 09:22:32 IST 2016,hillary wanted bernie to attack obama but bernie is smart good he expressed his love for obama i love obama demdebate
Cool_Bad_Rajjo,Fri Feb 12 09:19:01 IST 2016,bernie has a good comeback period demdebate
Cool_Bad_Rajjo,Fri Feb 12 09:17:25 IST 2016,no hillary that is wrong he never criticised obama so hard  demdebate
Cool_Bad_Rajjo,Fri Feb 12 09:13:23 IST 2016,haha   
Cool_Bad_Rajjo,Fri Feb 12 09:12:45 IST 2016,loved the view of bernie regarding the after effects of removing a dictator he will surely make the peaceful world demdebate
Cool_Bad_Rajjo,Fri Feb 12 09:02:27 IST 2016,well now bernie is speaking more facts this is interesting demdebate
Cool_Bad_Rajjo,Fri Feb 12 08:50:35 IST 2016,this debate hillary has more facts than bernie demdebate
Cool_Bad_Rajjo,Thu Feb 11 11:38:50 IST 2016,rt  my sons poo face vs donalds trump face 
Cool_Bad_Rajjo,Thu Feb 11 10:59:20 IST 2016,rt  how to have a flat stomach・remove all of your organs
Cool_Bad_Rajjo,Thu Feb 11 03:08:39 IST 2016, fodtrumpmovie
Cool_Bad_Rajjo,Thu Feb 11 02:54:28 IST 2016,fodtrumpmovie is funny
Cool_Bad_Rajjo,Wed Feb 10 08:49:23 IST 2016,rt  i am going to be the greatest jobs president that god ever created–donald trump nhprimary 
Cool_Bad_Rajjo,Wed Feb 10 08:22:54 IST 2016,nowwatching bernie sanders speech he makes so much sense than donald trump
Cool_Bad_Rajjo,Wed Feb 10 07:23:43 IST 2016,sanders nearing democratic presidential candidate good work america thatwasreal
Cool_Bad_Rajjo,Wed Feb 10 07:13:02 IST 2016,trump nearing gop presidential candidate good work america thatwassarcastic
Cool_Bad_Rajjo,Sun Feb 07 08:54:38 IST 2016,when it comes to serious issues nobody talks to trump gopdebate why
Cool_Bad_Rajjo,Sun Feb 07 07:37:22 IST 2016,rt  trump reacting to the boos likegopdebate 
Cool_Bad_Rajjo,Sun Feb 07 07:36:48 IST 2016,this is what happens when trump is in debate boos and stuff gopdebate
Cool_Bad_Rajjo,Sun Feb 07 07:22:24 IST 2016,ted cruz wants to build a wall wow republicans are crazy
Cool_Bad_Rajjo,Sat Feb 06 12:26:52 IST 2016,dk c is way cool for developers easier syntax than java
Cool_Bad_Rajjo,Sat Feb 06 12:20:00 IST 2016,dk haha i am on the same boat they are like omg microsoft guy will charge us without any reason p
Cool_Bad_Rajjo,Sat Feb 06 12:01:06 IST 2016,recruiters in the job fairs are like hot girls on tinder they easily swipe you left
Cool_Bad_Rajjo,Fri Feb 05 12:58:14 IST 2016,rt  cant find a full replay of tonights demdebate so i assume  did well
Cool_Bad_Rajjo,Thu Feb 04 05:49:25 IST 2016,if trump wins polls were correct if he losses people are wrong trumptatntrum
Cool_Bad_Rajjo,Tue Feb 02 08:50:16 IST 2016,rt  watching the iowacaucus numbers come in like 
Cool_Bad_Rajjo,Tue Feb 02 08:25:18 IST 2016,rubio shocked everyone
Cool_Bad_Rajjo,Tue Feb 02 08:19:34 IST 2016,iowa caucuses are intensehillary 51 bernie 49 
Cool_Bad_Rajjo,Sun Jan 31 14:51:45 IST 2016,i loved the video of hymnfortheweekend felt like going back to my country back again refreshed my memory   great job
Cool_Bad_Rajjo,Fri Jan 29 10:31:41 IST 2016,rt  i see a lot of people saying this debate is boring good go back to watching the kardashians and stay home in elec…
Cool_Bad_Rajjo,Fri Jan 29 10:30:49 IST 2016,rt  people are saying the debate was boring thats when you know its the most substantive and serious one yet gopdebate
Cool_Bad_Rajjo,Fri Jan 29 10:30:38 IST 2016,rt  if youre complaining that a candidate is boring you should turn on cartoons and let the adults talk about the issues go…
Cool_Bad_Rajjo,Fri Jan 29 10:27:46 IST 2016, good job 
Cool_Bad_Rajjo,Fri Jan 29 10:26:01 IST 2016,rt  debate epilogue they all went on to do incredible things gopdebate
Cool_Bad_Rajjo,Fri Jan 29 10:24:28 IST 2016,rt  shameful gopdebate 
Cool_Bad_Rajjo,Fri Jan 29 09:32:31 IST 2016,finally republican did discuss some issues gopdbate donald trump fully deviates from the topic and marco rubio barack is not bad 
Cool_Bad_Rajjo,Fri Jan 29 07:45:48 IST 2016,rt  everyone on this stage is stupid fat and ugly now that weve gotten the donald trump portion out of the way https…
Cool_Bad_Rajjo,Fri Jan 29 06:57:18 IST 2016,rt  if we are serious about protecting the planet and improving our economy we must focus on efficient renewable energy and n…
Cool_Bad_Rajjo,Fri Jan 29 06:56:31 IST 2016,rt  trump not doing fox debate cause of megan kelly😂some1 get him toe shoesfkng prima donna how can he face isishe cant face a chi…
Cool_Bad_Rajjo,Mon Jan 25 14:05:30 IST 2016,rt   unfair elimination for brock lesner  he was eliminated by already eliminated wyatt family jerks not a good roy…
Cool_Bad_Rajjo,Sat Jan 23 04:20:56 IST 2016,rt  ghar mein computer toh nahi hai par mouse bohat hain
