username,time,tweet
viraatpaul,Fri Jun 05 16:16:36 IST 2015,mns vadapav stall you maharashtrian food you chandigarh girl indian handl poison we yoga
viraatpaul,Fri Jun 05 13:30:19 IST 2015,hahahahah famili guy get school
viraatpaul,Fri Jun 05 13:04:50 IST 2015,beauti espesi cla mb amg
viraatpaul,Fri Jun 05 06:35:45 IST 2015,what have you done come back fuck sake topgear
viraatpaul,Fri Jun 05 06:24:19 IST 2015,peopl chant femin you need actress model get right we
viraatpaul,Thu Jun 04 21:35:53 IST 2015,on stand go check the new commerci design special home design
viraatpaul,Thu Jun 04 14:36:14 IST 2015,gandhi poor man hughhefn alway babe side he mohawk one point punk
viraatpaul,Thu Jun 04 14:33:56 IST 2015,gay sailor
viraatpaul,Thu Jun 04 13:57:47 IST 2015,hey ate ching noodl day new stuff bodi miss felt sad now noodl use know
viraatpaul,Thu Jun 04 12:20:15 IST 2015,just came know launch india that awesom first complet go lead mental
viraatpaul,Thu Jun 04 12:17:05 IST 2015,its mental
viraatpaul,Thu Jun 04 11:09:37 IST 2015,rememb grandmoth
viraatpaul,Wed Jun 03 21:46:01 IST 2015,merica check
viraatpaul,Wed Jun 03 21:28:09 IST 2015,this could racist sorri america hiphop rap rapmus whitepeopl foxnew
viraatpaul,Wed Jun 03 21:26:40 IST 2015,this could racist sorri america hiphop rap rapmus whitepeopl foxnew
viraatpaul,Tue Jun 02 17:03:01 IST 2015,what good day nigga
viraatpaul,Tue Jun 02 13:59:19 IST 2015,i go watch tanuwedsmanureturn seen punjabi movi awesom
viraatpaul,Tue Jun 02 13:31:17 IST 2015,i sandwich today it easi will eat everi lunch i break lunch now time wast updat
viraatpaul,Tue Jun 02 10:26:00 IST 2015,jump bodi armor let go
viraatpaul,Tue Jun 02 10:07:37 IST 2015,brucejenn chang name tran jenner how empow right caitlynjenn callmecaitlyn kardashian vanityfair
viraatpaul,Mon Jun 01 16:49:49 IST 2015,bloodi twat unemploy get anoth amg it complet can see drive around vw
viraatpaul,Mon Jun 01 12:41:18 IST 2015,how i twitter week new follow retweet retweet reach want grow number
viraatpaul,Mon Jun 01 12:07:37 IST 2015,check bar pub
viraatpaul,Mon Jun 01 11:30:06 IST 2015,hahahahahahah nigga lost cracker pig turf blacklivesmatt
viraatpaul,Mon Jun 01 11:02:57 IST 2015,that stereotyp famous australia
viraatpaul,Mon Jun 01 10:39:10 IST 2015,that sikh kid suzuki ad petrol khatam hi nahi hunda real deal knew school said line everyon birthday
viraatpaul,Mon Jun 01 10:36:08 IST 2015,petrol khatam hi nahi hunda
viraatpaul,Mon Jun 01 10:26:52 IST 2015,marin line princess street tick time bomb term vehicular traffic godsaveus
viraatpaul,Fri May 29 22:31:07 IST 2015,weekend start i relax bowl macaroniandchees tv comfert bed good
viraatpaul,Fri May 29 14:21:26 IST 2015,i troll i elf elf
viraatpaul,Fri May 29 14:20:21 IST 2015,forget sex had lot sex
viraatpaul,Thu May 28 17:00:17 IST 2015,peopl scotland everi abl bodi human form rank scottish border charg england melgibson tutori
viraatpaul,Thu May 28 16:55:42 IST 2015,hey i learn ride bike ok then join bike gang u also come we go leh mad max shit peopl
viraatpaul,Thu May 28 16:49:41 IST 2015,this screw yaar sign anandiben
viraatpaul,Thu May 28 16:36:09 IST 2015,yes i got rob yesterday mumbai someon thuglif moment expens let hope made cool video least thuglifevin
viraatpaul,Thu May 28 16:34:00 IST 2015,get offic earli let hope train empti mumbai mumbaiweath good and one steal stuff
viraatpaul,Wed May 27 12:27:03 IST 2015,makeinindia progress
viraatpaul,Wed May 27 10:18:36 IST 2015,i go say handl social media outrag well good luck lad now get canadiangp
viraatpaul,Tue May 26 13:51:29 IST 2015,well want runaway gop usa america presid potus secretservic agent
viraatpaul,Tue May 26 11:24:25 IST 2015,look look
viraatpaul,Tue May 26 11:24:10 IST 2015,rt massiv surg coal product saalekshuruaatanek
viraatpaul,Tue May 26 00:04:35 IST 2015,as phil dunphi say ice cream cake import like get point happi
viraatpaul,Mon May 25 17:00:48 IST 2015,rt iaf countri proud success land fighter jet yamunaexpressway
viraatpaul,Mon May 25 12:44:58 IST 2015,how i twitter week new follow favorit want grow number
viraatpaul,Mon May 25 11:21:48 IST 2015,what race mercedesamg put brilliant perform whatev fault mistak alway one team amg monacogp
viraatpaul,Mon May 25 10:55:26 IST 2015,look forward lad clash without problem canadiangp mb winorlosewestandtogeth
viraatpaul,Sat May 23 08:36:56 IST 2015,weekend go back sleep sleep weekend saturday sunday bed ac blanket tv
viraatpaul,Thu May 21 07:41:34 IST 2015,yes arent manni thought modernfamili boy thinker bubbl fragil human
viraatpaul,Wed May 20 14:07:54 IST 2015,brilliant
viraatpaul,Wed May 20 13:57:31 IST 2015,rt harbhajan back team even dismiss dhoni respect
