username,time,tweet
PaulMarin_NYC,Fri Feb 26 11:24:42 IST 2016,damn time remov trumpunivers m a resum imag courtesi gopdeb
PaulMarin_NYC,Thu Feb 25 08:41:29 IST 2016,oh know one day get visit workperk longtimelisten nyc
PaulMarin_NYC,Sun Feb 21 23:05:03 IST 2016,rt vancityreynold et tu d pool gimm shout roger boot cuss
PaulMarin_NYC,Sun Feb 21 22:49:53 IST 2016,rt wow deadpool awesom well done killedit maximumeffort
PaulMarin_NYC,Sun Feb 21 01:20:35 IST 2016,i wish true know human
PaulMarin_NYC,Sun Feb 14 22:35:31 IST 2016,here spec powerwal
PaulMarin_NYC,Sun Feb 14 11:18:01 IST 2016,tesla unveil batteri power home complet grid
PaulMarin_NYC,Sun Feb 14 09:05:54 IST 2016,my reaction dunk they sick
PaulMarin_NYC,Sun Feb 14 08:06:24 IST 2016,damn point final beat splash brother kill nbaallstarto nba
PaulMarin_NYC,Sun Feb 14 02:58:23 IST 2016,juliealexandria water less jar joint enjoy socal jealous
PaulMarin_NYC,Thu Feb 11 00:14:10 IST 2016,so true thing that slight terrifi everyon who work in an offic via
PaulMarin_NYC,Mon Feb 08 01:05:28 IST 2016,rt lisaaramo thank wish us happi superbowlsunday nfl nflfanstyl
PaulMarin_NYC,Sat Jan 30 23:41:16 IST 2016,thank follow i help career way feel free look
PaulMarin_NYC,Sat Jan 30 02:44:09 IST 2016,happybirthday hardest work superstar i fortun know work
PaulMarin_NYC,Fri Jan 29 00:10:32 IST 2016,someday i learn smile selfi sunglass scarf nyc winter
PaulMarin_NYC,Thu Jan 28 11:03:05 IST 2016,rt deadspin do think equip manag matiastesti scratch blake kia optima temrelatedincid
PaulMarin_NYC,Thu Jan 28 05:20:40 IST 2016,rockstar i even eat sweetpotato
PaulMarin_NYC,Sun Jan 24 05:04:34 IST 2016,as i journey inner peac i am bruce lee light path thank shannon power film
PaulMarin_NYC,Sat Jan 23 10:51:14 IST 2016,well done bring spring train
PaulMarin_NYC,Thu Jan 21 04:02:07 IST 2016,i m figur drunk stone or stupid well liter stupid two here
PaulMarin_NYC,Tue Jan 19 09:10:16 IST 2016,let review sign sign w pleas sign freeagent
PaulMarin_NYC,Tue Jan 19 05:11:59 IST 2016,bien hecho abl laugh mistak i thought go make joke
PaulMarin_NYC,Sun Jan 17 10:20:32 IST 2016,nfl my reaction fitzgerald game winner he did what v instant classic
PaulMarin_NYC,Sun Jan 17 01:29:17 IST 2016,first impress grow small town piss neighbor netflix
PaulMarin_NYC,Thu Jan 14 00:31:54 IST 2016,rt met thought will yr deal w cesped unlik work cant hurt stay contact
PaulMarin_NYC,Thu Jan 14 00:16:11 IST 2016,big fan so talent kind cordial art galleri keep your eye cultur nyc
PaulMarin_NYC,Thu Jan 14 00:08:44 IST 2016,kaitlinmont eye deceiv trust obi wan kenobi stay warm young padawan
PaulMarin_NYC,Tue Jan 12 09:20:14 IST 2016,agre disagre
PaulMarin_NYC,Tue Jan 12 04:37:08 IST 2016,michelledudash i assum oven fri chicken nugget recipeoftheday
PaulMarin_NYC,Tue Jan 12 03:45:20 IST 2016,hi i repres rdn celebr chef develop healthier version tailgat food interest recip
PaulMarin_NYC,Tue Jan 12 01:45:43 IST 2016,damn come soon hope loss kingpin antagonist hurt show
PaulMarin_NYC,Tue Jan 12 00:25:26 IST 2016,damn right good day morn listen comedi hilari
PaulMarin_NYC,Mon Jan 11 22:16:40 IST 2016,how iron funniest moment night mistaken still get id wrong
PaulMarin_NYC,Mon Jan 11 21:21:57 IST 2016,justinfenn embarrass minor actor look alik
PaulMarin_NYC,Mon Jan 11 03:00:24 IST 2016,alrighti finkl einhorn eihorn finkl aceventura
PaulMarin_NYC,Sat Jan 09 22:14:27 IST 2016,there must someth water call aquadient colombiano firewat
PaulMarin_NYC,Sat Jan 09 07:16:33 IST 2016,what top qualiti flaw
PaulMarin_NYC,Sat Jan 09 04:34:08 IST 2016,the entir subway system wi fi end say cuomo seen i call bs
PaulMarin_NYC,Thu Jan 07 22:19:33 IST 2016,rockstar recipeoftheday
PaulMarin_NYC,Tue Jan 05 23:02:42 IST 2016,hi lisa michelledudash would great foodi guest sportsnat she creat healthier version tailgat favorit perfect sb
PaulMarin_NYC,Mon Jan 04 23:53:34 IST 2016,georgeslaraqu thank follow
PaulMarin_NYC,Mon Jan 04 23:53:18 IST 2016,thank follow blackmonday weird day nfl fan
PaulMarin_NYC,Mon Jan 04 22:11:12 IST 2016,rt it final my cleaneat cook school launch today
PaulMarin_NYC,Mon Jan 04 02:49:29 IST 2016,rt tom coughlin say made decis futur will take time talk ownership
PaulMarin_NYC,Mon Jan 04 02:49:22 IST 2016,rt same old jet gang playoff loss rex bill fitzpatrick throw int
PaulMarin_NYC,Tue Dec 29 07:53:33 IST 2015,i big decis make with clariti cajon good luck could good year
PaulMarin_NYC,Tue Dec 29 02:45:34 IST 2015,hi say kiss mistleto time place
PaulMarin_NYC,Mon Dec 28 22:16:18 IST 2015,wonder say california great view haha happi new year melissa go buckey
PaulMarin_NYC,Sat Dec 26 09:48:41 IST 2015,rt way make sure decemb birthday get lost shuffl
PaulMarin_NYC,Sat Dec 26 01:39:45 IST 2015,merrychristma dab santa queen shoutout happyholiday
