username,time,tweet
ruby_kirby,Sat Nov 28 05:24:55 IST 2015,i hate tri hide doubl chin everi time i take selfi it hard life truth selfi
ruby_kirby,Sat Nov 28 05:21:20 IST 2015,the thing i know i like super hot underneath fluffi but make cute approach and i lazi truth
ruby_kirby,Wed Nov 18 18:05:02 IST 2015,rt soho day i work rubi saw i cri i love never know
ruby_kirby,Wed Nov 18 18:03:25 IST 2015,rt easi ignor someth busi but spot cancer sooner save life
ruby_kirby,Sun Nov 15 05:54:01 IST 2015,rt luthersback soon murdahlovesjohn
ruby_kirby,Sun Nov 15 05:51:58 IST 2015,rt feel warm chines takeout lap ur takin home i imagin bring home ur first born
ruby_kirby,Thu Nov 12 19:08:55 IST 2015,i alway feel like burst laughter tube see peopl reaction miser commut
ruby_kirby,Thu Nov 12 16:14:32 IST 2015,why everyon serious miser gym i want go gym everyon smile
ruby_kirby,Thu Nov 12 15:09:37 IST 2015,on way gym serious doubt wether i put deodor too late
ruby_kirby,Sun Nov 08 17:04:55 IST 2015,do make happi okay well thing i love expens hors ride travel happi
ruby_kirby,Fri Nov 06 22:25:23 IST 2015,feel realli rowdi today need chill breath breath then punch someon
ruby_kirby,Thu Nov 05 16:28:30 IST 2015,i wonder oxford circus ever escal ad featur half nake women tfl tube
ruby_kirby,Thu Nov 05 14:01:20 IST 2015,i just realli want a hors all readi
ruby_kirby,Tue Nov 03 17:58:38 IST 2015,today gym someon told i stretch second my year of pe at school were a lie second life
ruby_kirby,Tue Nov 03 17:56:50 IST 2015,that awkward moment casual lick lip accident catch someon eye
ruby_kirby,Mon Nov 02 12:54:31 IST 2015,noth like sweet sweet smell ganja welcom new week
ruby_kirby,Mon Nov 02 02:01:47 IST 2015,when get tube decid sit next opposit smelli fat man makegoodchoic
ruby_kirby,Wed Oct 28 04:21:00 IST 2015,i fart much i surpris shadow still
ruby_kirby,Tue Oct 27 18:18:03 IST 2015,feel skinni today go eat breakfast it felt good last
ruby_kirby,Tue Oct 27 18:16:23 IST 2015,on way work listen dirti r n b like mmm yeah let go dis work thing
ruby_kirby,Sun Oct 25 19:49:54 IST 2015,man must sort follow
ruby_kirby,Sun Oct 25 19:46:52 IST 2015,true in fact difficult focus anyth
ruby_kirby,Sun Oct 25 19:28:52 IST 2015,turn quit difficult run need poo
ruby_kirby,Sun Oct 11 13:12:28 IST 2015,pick nose public without peopl see satisfi
ruby_kirby,Thu Oct 08 21:47:23 IST 2015,i feel sorri peopl annoy caus even realis
ruby_kirby,Mon Oct 05 22:54:57 IST 2015,i fell asleep tube dribbl hand
ruby_kirby,Sat Sep 26 22:11:30 IST 2015,i soooo much today therefor i must sit watch movi whyyyyyy
ruby_kirby,Sat Sep 26 22:10:50 IST 2015,why cant i just be skinni said non skinni bitch everi day storyofmylif skinni
ruby_kirby,Sat Sep 26 14:11:33 IST 2015,this man clear huge ball need person space manspread tube
ruby_kirby,Fri Sep 25 16:22:45 IST 2015,in kitchen wash dish yo scrub hot snoopdogg
ruby_kirby,Fri Sep 25 15:46:07 IST 2015,good ride away
ruby_kirby,Fri Sep 25 15:45:41 IST 2015,today shower i whitney houston howwilliknow
ruby_kirby,Sat Sep 05 16:24:36 IST 2015,man sat outsid chain smoke look sad man walk staff entranc hamley retaillif
ruby_kirby,Tue Sep 01 22:53:11 IST 2015,sinc go festiv carniv involv half nake put cloth
ruby_kirby,Thu Aug 13 16:49:20 IST 2015,ahh britain this much like the grey sky rain suit wood green perfect london rain
ruby_kirby,Sat Aug 01 21:59:22 IST 2015,montric
ruby_kirby,Sat Aug 01 21:59:12 IST 2015,the ladi nail call montric montric say i colour not sure make montric
ruby_kirby,Sat Jul 04 12:23:47 IST 2015,it seem st alban sat ladi fog where blue sky i freez
ruby_kirby,Tue Jun 30 19:39:24 IST 2015,that awkward moment overtak someon leg
ruby_kirby,Wed Jun 24 16:47:07 IST 2015,holi santa clai poop
ruby_kirby,Mon Jun 08 12:10:17 IST 2015,i left fuck make home nightmar work au natur
ruby_kirby,Tue Jun 02 13:32:36 IST 2015,rt big shout introduc articl cheer mate
ruby_kirby,Fri May 29 02:13:15 IST 2015,eat cooki caus i tast good
ruby_kirby,Thu May 28 16:28:39 IST 2015,week bluewat i think i offici speak chav
ruby_kirby,Sat May 23 16:34:02 IST 2015,i think adult slide london itsthelittleth
ruby_kirby,Sat May 23 03:39:05 IST 2015,by mean friend neighbour talk outsid bedroom window
ruby_kirby,Sat May 23 02:34:12 IST 2015,i lazi go bed anoth csi yolo
ruby_kirby,Sat May 23 01:51:08 IST 2015,tea cake dinner don mind i
ruby_kirby,Mon May 18 03:04:26 IST 2015,unscent deodor one smelli even sweati ew
ruby_kirby,Sun May 17 23:56:22 IST 2015,now part lso lsoopenair casual
