username,time,tweet
Allbackdown,Mon May 25 08:15:20 IST 2015, id read the crap out of this watch the movie five times  cardsagainsthumanity 
Allbackdown,Tue May 19 01:05:05 IST 2015,that doom teaser was totally unfair criminally short and all to just drum up hype before e3 however color me psyched anyway
Allbackdown,Fri May 15 19:26:58 IST 2015,yard sale finds all had hookups and controllers retro retrodiscovery nintendo sega sony… 
Allbackdown,Fri May 15 07:02:47 IST 2015,let it go fire fun 
Allbackdown,Tue May 12 18:34:50 IST 2015,working on turning a room into geek paradise/studio hope to get back to making videos soon youtube games
Allbackdown,Fri May 08 14:26:48 IST 2015,shellbell and me 
Allbackdown,Mon May 04 21:34:28 IST 2015,some stuff ive found the last 2 weeks retro retrocollective games oldschool awesome 
Allbackdown,Sun May 03 02:44:27 IST 2015,yay new phone finally  samsunggalaxys6edge
Allbackdown,Sun Apr 19 11:39:54 IST 2015,watch me open blind tf2 figure boxes fun tf2 gaming collectible figures surprise 
Allbackdown,Sat Apr 18 05:22:08 IST 2015,fun times at the fat cave friday fun drinks friends 
Allbackdown,Mon Apr 13 02:51:01 IST 2015,getting my ass kicked all week allergiesarefun
Allbackdown,Sat Apr 04 08:39:05 IST 2015,dungeonsanddragons friday fun 
Allbackdown,Thu Apr 02 18:55:51 IST 2015,check out shell playing slenderthearrival   gaming horror slender letsplay fun youtube
Allbackdown,Wed Apr 01 02:34:54 IST 2015,nintendo makes a good mini entertainment system for work games ems 
Allbackdown,Mon Mar 30 04:00:17 IST 2015,xboxcod codchampsmvp revenge you guys got this get your revenge see you guys in pun hell
Allbackdown,Sun Mar 29 05:40:03 IST 2015,like frosted flakes and hotlinemiami  gaming games funny fun hotlinemiami  
Allbackdown,Sat Mar 28 23:55:37 IST 2015,shell vs slender slenderman horror scream games gaming sorry really 
Allbackdown,Thu Mar 26 23:10:37 IST 2015,rt con adrian is writing a follow-up letter for gencon attendees today we appreciate your passion and support were proud of our c…
Allbackdown,Thu Mar 26 00:09:37 IST 2015, at work and all i want to do is get home and make some delicious videos i feel exactly the same way lol
Allbackdown,Wed Mar 25 23:55:45 IST 2015,fun times at work gaming smashbros 
Allbackdown,Tue Mar 24 14:01:05 IST 2015,work for the next few days be a bit before a new video hits yawn sleepy
Allbackdown,Mon Mar 23 22:13:06 IST 2015,the more splatoon i see the more excited i am to try it games
Allbackdown,Mon Mar 23 04:49:48 IST 2015,rt septiceye seen as mark is sick in hospital lets do something nice to lift his spirits and try to trend getbettermark d http/…
Allbackdown,Sun Mar 22 21:41:04 IST 2015,part two of legends rayman ubisoft games gaming letsplay youtube fun co-op  
Allbackdown,Sun Mar 22 05:58:28 IST 2015,co-op couch with rayman legends games gaming letsplay fun youtube 
Allbackdown,Thu Mar 19 01:18:25 IST 2015,what i spent all day at work doing fun nes mario cool 
Allbackdown,Tue Mar 17 23:34:09 IST 2015,dunno how i feel about nintendo making moblie games im not a big fan of those games
Allbackdown,Tue Mar 17 17:03:06 IST 2015,watch shell and i own halo gamers games gaming xbox letsplay xboxone 
Allbackdown,Mon Mar 16 01:52:36 IST 2015, what was your first m-rated game   mine was definitely mortalkombat
Allbackdown,Mon Mar 16 01:51:59 IST 2015,rt  what was your first m-rated game  
Allbackdown,Mon Mar 16 01:51:46 IST 2015,grats to  for their win at eslonekatowice close game very entertaining
Allbackdown,Sun Mar 15 20:04:46 IST 2015,watching eslonekatowice csgo brings back lots of memories
Allbackdown,Sat Mar 14 22:23:58 IST 2015,watch shell lose her cool while playing alienisolation scream jumpscare fun epic mean  via 
Allbackdown,Sat Mar 14 03:14:48 IST 2015,are all these deaths worth answershotlinemiami2wrongnumber  
Allbackdown,Fri Mar 13 23:10:31 IST 2015,rt  fightstickfriday updated my   killerinstinct stick  with riptor  
Allbackdown,Fri Mar 13 23:09:59 IST 2015,watch the first part of my hotlinemiami2wrongnumber  i die alot  via 
Allbackdown,Fri Mar 13 06:53:37 IST 2015,watch my montage of deaths during my play of hotlinemiami2wrongnumber  via 
Allbackdown,Thu Mar 12 20:10:57 IST 2015,home from work lets get productive and get some videos made hotlinemiami2wrongnumber
Allbackdown,Thu Mar 12 00:53:25 IST 2015,i forgot how weird this game was
Allbackdown,Thu Mar 12 00:52:52 IST 2015,playing mario land 2 last time i played this was on my gameboy nostalgia nintendo
Allbackdown,Wed Mar 11 07:35:34 IST 2015,rt  the reviews are coming in and hotline miami 2 wrong number is either the best or second best hotline miami video game ev…
Allbackdown,Wed Mar 11 06:26:11 IST 2015,rt  tumblr cmonwhat the fuck 
Allbackdown,Wed Mar 11 06:25:56 IST 2015,nothing to do but watch anime and nap any good suggestions to watch
Allbackdown,Wed Mar 11 04:11:22 IST 2015,oh man wish i was at home to load up hotlinemiami2wrongnumber
Allbackdown,Sun Mar 08 07:05:19 IST 2015,rt  so this is getting uploaded right now drumcovers drums drum drummer drummies  
Allbackdown,Sun Mar 08 04:40:17 IST 2015,shooting some video today with fat sam 
Allbackdown,Sat Mar 07 20:01:05 IST 2015,five boring nights at freddies | allback one shot  via 
Allbackdown,Wed Mar 04 15:19:36 IST 2015,booooo 4 am tooearly
Allbackdown,Tue Mar 03 10:08:55 IST 2015,fnaf3 surprise release its pretty creepy do i smell another shell video
Allbackdown,Tue Mar 03 05:55:56 IST 2015,allbackdown plays mega man part 5  via 
