username,time,tweet
Cuso3,Sat Nov 14 03:12:01 IST 2015,thank memori show i chang notarealthanku suchchang hopetochangeback
Cuso3,Fri Nov 13 23:56:00 IST 2015,rt don worri hater they angri truth speak contradict lie live steve maraboli
Cuso3,Fri Nov 13 18:15:46 IST 2015,so dag gone earli i got shit brah
Cuso3,Fri Nov 13 17:24:24 IST 2015,close slept hour minut back work
Cuso3,Fri Nov 13 12:25:04 IST 2015,just saw shoot star ufo either i made wish
Cuso3,Fri Nov 13 12:24:09 IST 2015,rt peopl swear lot tend honest loyal upfront friend
Cuso3,Fri Nov 13 11:20:11 IST 2015,burn calori day getatm wutup chyup
Cuso3,Fri Nov 13 10:42:51 IST 2015,windi af
Cuso3,Fri Nov 13 10:40:25 IST 2015,some peopl noth talk
Cuso3,Fri Nov 13 10:38:49 IST 2015,need restart americansnip shit realli good
Cuso3,Fri Nov 13 08:28:49 IST 2015,get hat cold
Cuso3,Fri Nov 13 08:19:41 IST 2015,i episod houseofcard almost done season lol
Cuso3,Fri Nov 13 07:24:06 IST 2015,why go make font larger tri say
Cuso3,Fri Nov 13 06:33:29 IST 2015,view video awesom phenomen
Cuso3,Fri Nov 13 06:32:30 IST 2015,
Cuso3,Fri Nov 13 06:20:11 IST 2015,ladi ask direct ne idk ish hell i look like columbus gpspeopl checkthestar
Cuso3,Thu Nov 12 11:42:15 IST 2015,rgfisland
Cuso3,Thu Nov 12 11:40:19 IST 2015,flirt temptat cheat cheat
Cuso3,Thu Nov 12 10:59:56 IST 2015,i deal pain much differ
Cuso3,Thu Nov 12 10:27:07 IST 2015,rt gonna live life fullest watch episod tv seri row
Cuso3,Thu Nov 12 09:26:01 IST 2015,my gram duke alway challeng i let ima keep go missyoueveryday
Cuso3,Thu Nov 12 08:39:38 IST 2015,i love ladi one left side mybridetob
Cuso3,Thu Nov 12 08:29:02 IST 2015,peopl possess weak disgust
Cuso3,Thu Nov 12 07:17:55 IST 2015,stylesp getpaid
Cuso3,Thu Nov 12 04:16:09 IST 2015,i go lose someon real soon i even say i feel bad either
Cuso3,Thu Nov 12 02:47:14 IST 2015,between next time i rock piec sheesh
Cuso3,Thu Nov 12 01:19:59 IST 2015,love i abl hear old shit warn b i g
Cuso3,Thu Nov 12 00:46:55 IST 2015,dream trap thought get away hatehavingtosleep
Cuso3,Wed Nov 11 13:51:38 IST 2015,connect failur
Cuso3,Wed Nov 11 13:50:21 IST 2015,wish i could take break thought
Cuso3,Wed Nov 11 13:18:08 IST 2015,wow they go limit control peopl make evil christma movi krumpus
Cuso3,Wed Nov 11 13:07:45 IST 2015,yup got hungri
Cuso3,Wed Nov 11 13:06:03 IST 2015,gotham batmancuso
Cuso3,Wed Nov 11 12:34:45 IST 2015,need find bed sheet sleep couch
Cuso3,Wed Nov 11 11:52:59 IST 2015,backup
Cuso3,Wed Nov 11 11:27:04 IST 2015,why old broad rock snoop lion sippinonginandjuic pleas stop
Cuso3,Wed Nov 11 10:57:17 IST 2015,i host class get app help need help stand self respectiseveryth
Cuso3,Wed Nov 11 10:56:20 IST 2015,i love put peopl place like hell speak like
Cuso3,Wed Nov 11 06:29:13 IST 2015,i check bar graph thing i see point much
Cuso3,Tue Nov 10 15:29:57 IST 2015,shit
Cuso3,Tue Nov 10 11:12:38 IST 2015,wow peopl cant trust alway watch everyon i
Cuso3,Tue Nov 10 05:52:30 IST 2015,i get tire call go happen life gift acurs
Cuso3,Tue Nov 10 05:24:41 IST 2015,i said would way gram never want right though
Cuso3,Mon Nov 09 13:08:16 IST 2015,i tire cold i move couch
Cuso3,Mon Nov 09 13:02:47 IST 2015,so hard go bed work close shift
Cuso3,Mon Nov 09 10:33:42 IST 2015,you kno it
Cuso3,Mon Nov 09 10:16:44 IST 2015,if i high level love i would prefer next
Cuso3,Mon Nov 09 08:29:26 IST 2015,stop like go back favorit option lose like
Cuso3,Mon Nov 09 08:25:51 IST 2015,gotta keep eye fool airport ncis look real suspici
Cuso3,Mon Nov 09 05:36:28 IST 2015,return go fun snow start come eraclif airportlif
