username,time,tweet
docintheboxx,Sat Feb 27 23:26:20 IST 2016,after care experiment determin wife correct laundri wash
docintheboxx,Sat Feb 27 01:18:09 IST 2016,no scene horror movi just dig
docintheboxx,Thu Feb 25 02:25:52 IST 2016,it littl ici view insid roll window
docintheboxx,Tue Feb 23 17:20:20 IST 2016,a psychologist open letter u s voter psycholog today psycholog
docintheboxx,Sun Feb 21 23:15:20 IST 2016,nitor tutori via
docintheboxx,Sun Feb 21 07:44:25 IST 2016,a littl dnd triniti tabletop
docintheboxx,Sat Feb 20 20:33:57 IST 2016,parent psycholog
docintheboxx,Fri Feb 19 03:10:12 IST 2016,studi find food insecur lead mental health disord adolesc psycholog nutrit
docintheboxx,Thu Feb 18 21:51:15 IST 2016,god hypertens ntnu psycholog faith
docintheboxx,Mon Feb 15 19:40:41 IST 2016,am i crazi dr glenn berger phd psychotherapist the blog psycholog
docintheboxx,Mon Feb 15 02:25:14 IST 2016,prayer spiritu psychologyandfaith
docintheboxx,Sun Feb 14 23:00:31 IST 2016,song syrian refuge
docintheboxx,Sun Feb 14 22:38:12 IST 2016,yes i instagram ing church remark
docintheboxx,Sun Feb 14 19:50:24 IST 2016,narcissist necessarili satisfi psycholog
docintheboxx,Sun Feb 14 19:40:14 IST 2016,in syracus easier addict get heroin medic treatment addict healthcar
docintheboxx,Sun Feb 14 08:00:08 IST 2016,studi reveal new link brain fat burn circuit psycholog
docintheboxx,Sat Feb 13 19:40:21 IST 2016,the landmark discoveri gravit wave world scienc festiv
docintheboxx,Sat Feb 13 18:20:15 IST 2016,social anim seek compani other brain wire find reward psycholog
docintheboxx,Sat Feb 13 08:05:04 IST 2016,book review why therapi work via psychcentr psycholog therapi
docintheboxx,Sat Feb 13 07:19:14 IST 2016,rt star trek tv seri sign bryan fuller showrunn via
docintheboxx,Sat Feb 13 07:13:37 IST 2016,rt fridayrorschach what might rememb use hashtag
docintheboxx,Sat Feb 13 07:10:47 IST 2016,n r p reseachervalentin
docintheboxx,Fri Feb 12 00:35:24 IST 2016,studi debunk stereotyp nativ american alcohol via psycholog addict
docintheboxx,Thu Feb 11 22:35:31 IST 2016,intl dayofwomeninsci import step toward gender parityinsci
docintheboxx,Thu Feb 11 19:32:11 IST 2016,featur psychologist franci cecil sumner phd inez bever prosser phd blackhistorymonth psycholog
docintheboxx,Wed Feb 10 08:30:21 IST 2016,what kid need from grown up but aren get psycholog educ
docintheboxx,Wed Feb 10 07:51:22 IST 2016,jakob turn mad scientist villainkiddo
docintheboxx,Tue Feb 09 08:35:18 IST 2016,our dog mocha smile selfi dogselfi
docintheboxx,Mon Feb 08 07:04:38 IST 2016,did chris martin crack ab
docintheboxx,Mon Feb 08 06:07:09 IST 2016,rt and steven transform captain jack sparrow complet
docintheboxx,Mon Feb 08 06:05:27 IST 2016,yell tv
docintheboxx,Mon Feb 08 05:44:20 IST 2016,rt fun left shark neverforget
docintheboxx,Mon Feb 08 04:53:00 IST 2016,that lot chicken american set devour chicken wing over super bowl weekend
docintheboxx,Mon Feb 08 04:49:29 IST 2016,find remot guess gonna miss game superbowl
docintheboxx,Sun Feb 07 05:59:01 IST 2016,rt reduc bulli teach bystand interven psycholog mhsm
docintheboxx,Sun Feb 07 05:58:27 IST 2016,hmmmmm telestr tabletopgam
docintheboxx,Wed Feb 03 02:45:10 IST 2016,rais posit thinker you brain kid parent psycholog
docintheboxx,Wed Feb 03 02:00:38 IST 2016,opposit play work stuart brown md the nation institut play
docintheboxx,Tue Feb 02 19:12:23 IST 2016,stuart brown play fun ted talk psycholog creativ stress
docintheboxx,Mon Feb 01 10:20:24 IST 2016,minecraft thaumcraft minefantasi minecraft minefantasi thaumcraft
docintheboxx,Mon Feb 01 08:31:10 IST 2016,great ad assist dog ptsd mentalhealth psycholog
docintheboxx,Sat Jan 30 07:22:48 IST 2016,rt he tie collar round neck i master slave she calm walk away he go
docintheboxx,Thu Jan 28 18:15:22 IST 2016,just mhsm mentalhealth psycholog
docintheboxx,Thu Jan 28 16:30:51 IST 2016,the benefit psycholog treatment chronic back pain backpain psycholog
docintheboxx,Tue Jan 26 08:03:52 IST 2016,studi holocaust survivor find trauma pass children gene ptsd psycholog
docintheboxx,Mon Jan 25 18:48:18 IST 2016,just post photo
docintheboxx,Mon Jan 25 00:10:18 IST 2016,psycholog humor paranorm distribut via psycholog
docintheboxx,Sun Jan 24 22:00:27 IST 2016,disord may thrive loneli mhsm mentalhealth psycholog
docintheboxx,Sun Jan 24 20:59:47 IST 2016,work deep medit skill morn feel great
docintheboxx,Sun Jan 24 19:55:07 IST 2016,how social internet affect children parent children psycholog
